ID,Type,Title,Authors,Abstract,Categories,Published,DOI,PDF URL,Status
ieee:7341639,conference,Optimized BICM-8QAM formats based on generalized mutual information,"Shaoliang Zhang, Kohei Nakamura, Fatih Yaman, Eduardo Mateo, Takanori Inoue, Yoshihisa Inada","Through the expansion of non-Gray-mapping symbols, the pre-FEC and post-FEC Q-factors of the proposed optimized Circle-8QAM outperform Circle-8QAM and Star-8QAM by ∼0.3 dB and ∼0.6dB at the coding rate of 0.8 in experiments.",,27 Sept.-1,10.1109/ECOC.2015.7341639,https://ieeexplore.ieee.org/document/7341639,new
ieee:7341618,conference,Detection of a 1 Tb/s superchannel with a single coherent receiver,"David S. Millar, Robert Maher, Domanic¸ Lavery, Toshiaki Koike-Akino, Milutin Pajovic, Alex Alvarado, Milen Paskov, Keisuke Kojima, Kieran Parsons, Benn C. Thomsen, Seb J. Savory, Polina Bayvel","We demonstrate detection of a superchannel with net bit rate in excess of 1 Tb/s with a single coherent receiver. Novel, pilot-aided equalization and carrier recovery algorithms enable detection of an 11 × 10 GBd DP-64QAM Nyquist superchannel (1.32 Tb/s gross bit rate).",,27 Sept.-1,10.1109/ECOC.2015.7341618,https://ieeexplore.ieee.org/document/7341618,new
ieee:7341779,conference,Transmission of 8×128.8Gbaud single-carrier PDM-QPSK signal over 2800-km EDFA-only SMF-28 link,"Jianjun Yu, Junwen Zhang, Zhensheng Jia, Xinying Li, Hung Chang Chien, Yi Cai, Fan Li, Yuanquan Wang, Xin Xiao","We successfully transmitted 100-GHz-grid, 8 channels single-carrier 515.2-Gb/s super-Nyquist signal over 2800-km SMF-28 with EDFA-only amplification. Record all-ETDM-based 136-Gbaud PDM-QPSK is also generated and coherently detected.",,27 Sept.-1,10.1109/ECOC.2015.7341779,https://ieeexplore.ieee.org/document/7341779,new
ieee:7356694,conference,Fiber-remoted 20-Gbaud QPSK transmission at 300 GHz,"Atsushi Kanno, Norihiko Sekine, Iwao Hosako, Tetsuya Kawanishi, Yuki Yoshida, Ken-ichi Kitayama",300-GHz multilevel signal transmission over optical fibers and air is demonstrated using advanced optical communication technology including optical frequency comb generation. Local oscillator signal transport over optical fibers to optical-terahertz converters removes the need for setting any terahertz-capable oscillators in the converters. This fiber-remoted configuration with seamless conversio...,,26-29 Oct.,10.1109/MWP.2015.7356694,https://ieeexplore.ieee.org/document/7356694,new
ieee:7425069,conference,Low-density generator matrix code for correcting errors with a small optical transponder,"Hideki Takenaka, Eiji Okamoto, Morio Toyoshima","Space optical communications is studied at National Institute of Information and Communications Technology, where the Small Optical TrAnsponder (SOTA) was developed and embarked on a 50-kg-class satellite. Atmospheric fluctuation is an issue to be solved in ground-to-satellite optical communication links. The SOTA has error-correcting functions using Reed-Solomon code and low-density generator mat...",,26-28 Oct.,10.1109/ICSOS.2015.7425069,https://ieeexplore.ieee.org/document/7425069,new
ieee:7357553,conference,Performance of frequency hopping D-BLAST MIMO Architecture using LDPC and BPSK,"Janek J. Mroczek, Michael. J. Gans, Laurie L. Joiner",In this paper we introduce frequency hopping spread spectrum (FHSS) into Diagonal Bell Laboratories Layered Space-Time (D-BLAST) Multiple Input Multiple Output (MIMO) architecture. We evaluate the performance of the system containing a single interference affecting the system with various probabilities and power. An LDPC code and BPSK modulation is used as a test case to obtain message bit error r...,,26-28 Oct.,10.1109/MILCOM.2015.7357553,https://ieeexplore.ieee.org/document/7357553,new
ieee:7357596,conference,A log-likelihood ratio for improved receiver performance for VLF/LF communication in atmospheric noise,"K. Wiklundh, K. Fors, P. Holm","Receiver-improving techniques are important for submarine communication at the LF/VLF bands, due to very demanding reception conditions. At the surface, the interference environment is dominated by the atmospheric noise, which is highly impulsive in character and may impede the reception of the radio signals. To handle the demanding channel and the impulsive interference environment, error correct...",,26-28 Oct.,10.1109/MILCOM.2015.7357596,https://ieeexplore.ieee.org/document/7357596,new
ieee:7357543,conference,Turbo equalization for waveforms encoded by Reed Solomon codes,"Wenwen Wang, Yong Liang Guan, Ping Yang, Xiaobei Liu","Turbo equalization is an iterative approach to perform joint equalization and decoding of data, which is protected by error correction code and transmitted over intersymbol interference (ISI) channels. Turbo equalization for Reed Solomon (RS) code, which is a popular error-correction code in wireless communication and recording systems, is seldom discussed in the literature. In this paper, we inve...",,26-28 Oct.,10.1109/MILCOM.2015.7357543,https://ieeexplore.ieee.org/document/7357543,new
ieee:7357549,conference,Code selection approach for partitioned cyclic code shift keying to improve multinet capability,"Hongjun Noh, Jepung Yu, Kyuman Lee, Jaesung Lim","In this paper, we propose a new code selection approach for partitioned cyclic code shift keying (PCCSK) to improve the multinet capability of Joint Tactical Information Distribution Systems (JTIDS). The multinet capability of JTIDS enables concurrent operations in battle fields by allowing simultaneous data transmission and reception. PCCSK is a spread spectrum technique that supports various dat...",,26-28 Oct.,10.1109/MILCOM.2015.7357549,https://ieeexplore.ieee.org/document/7357549,new
ieee:7354346,conference,Construction of LDPC codes based on resolvable group divisible designs,"Hengzhou Xu, Dan Feng, Cheng Sun, Baoming Bai","In this paper, we present a method for constructing LDPC codes from resolvable group divisible designs (RGDDs). According to the incidence matrices (or their submatrices) of RGDDs, a class of regular LDPC codes can be constructed. Since the parity-check matrix of the resulting code satisfies the row-column constraint, the girth of the proposed codes is at least six. Furthermore, based on a resolva...",,21-23 Oct.,10.1109/HMWC.2015.7354346,https://ieeexplore.ieee.org/document/7354346,new
ieee:7371391,conference,The Min-Max in LC and Max-Log MAP in LC for MTR Decoding in Two-Track Magnetic Recording Systems,"Nikola Djuric, Vojin Senk","The soft-decision decoding methods for maximum-transition-run (MTR) codes have been considered extensively, in order to enable a wider implementation of MTR codes in magnetic recording systems. The approaches, named as the min-max in LC and the max-log MAP in LC have been proposed, emerging as reasonable solutions for MTR codes. Both methods force the soft-values propagation through the Boolean lo...",,21-23 Oct.,10.1109/CSE.2015.18,https://ieeexplore.ieee.org/document/7371391,new
ieee:7354347,conference,Gallager mapping based constellation shaping for LDPC-coded modulation systems,"Dan Feng, Qi Li, Baoming Bai, Xiao Ma","This paper focuses on the signal constellation shaping in LDPC coded modulation system. A novel constellation is presented by combining geometric shaping with probabilistic shaping based on quadrature amplitude modulation (QAM)constellation. With the shaped signal constellation, the signal mapping is optimized by using the extrinsic information transfer (EXIT) chart analysis. We further consider t...",,21-23 Oct.,10.1109/HMWC.2015.7354347,https://ieeexplore.ieee.org/document/7354347,new
ieee:7354337,conference,Obtaining diversity gain by block Markov superposition transmission,"Jinshun Zhu, Xiao Ma","In time-varying wireless channels, the radio signals suffer from time-varying fading which may cause severe signal attenuation. In this paper, we present a new approach, called block Markov superposition transmission (BMST) over real field, to obtain diversity which increases the transmission reliability under the fading channels. The proposed scheme is similar to BMST over binary field, which has...",,21-23 Oct.,10.1109/HMWC.2015.7354337,https://ieeexplore.ieee.org/document/7354337,new
ieee:7353345,conference,Spatial coupling of RUN codes via block Markov superposition transmission,"Chulong Liang, Xiao Ma, Baoming Bai","In this paper, we propose a simple procedure to construct (decodable) good codes with any given alphabet (of moderate size) for any given (rational) code rate to achieve any given target error performance (of interest) over the additive white Gaussian noise (AWGN) channels. We start with constructing codes over groups for any given code rates. This can be done in an extremely simple way if we igno...",,21-23 Oct.,10.1109/HMWC.2015.7353345,https://ieeexplore.ieee.org/document/7353345,new
ieee:7354338,conference,Rateless spinal code for decode-and-forward relay channel,"Xiaopu Yu, Ying Li, Weiqiang Yang","A practical rateless coding framework for the half-duplex decode-and-forward (DF) relay channel is proposed in this paper. Rateless spinal codes are employed as the basic coding strategy in our coding framework and a cooperative decoder for the destination is proposed. Moreover, by introducing the concepts of equivalent code and equivalent channel, we prove that the proposed coding framework is ca...",,21-23 Oct.,10.1109/HMWC.2015.7354338,https://ieeexplore.ieee.org/document/7354338,new
ieee:7381301,conference,Construction of cyclic one-step majority-logic decodable codes using genetic algorithms,"Anouar Yatribi, Fouad Ayoub, Mostafa Belkasmi","In [6], a construction of cyclic one-step majority-logic decodable codes based on idempotent polynomials is given. However, the search for the feasible Parity-Check Idempotent runs through all possible combinations of cyclotomic cosets modulo n, satisfying some algebraic constraints, consequently, increasing the code length may result in very large dimension space search, and the search for the so...",,20-23 Oct.,10.1109/WINCOM.2015.7381301,https://ieeexplore.ieee.org/document/7381301,new
ieee:7381318,conference,A survey on packet scheduling over DVB-S2 through GSE encapsulation,"Youness Arjoune, Ahmed Tamtaoui, Hassan El Ghazi, Lahoucine Ballihi",A key features of the second generation for video broadcasting (DVB-S2) is the adoption of Adaptive Coding and Modulation (ACM) technology and Generic Stream Encapsulation (GSE) standards. In order to increase the system performance up to the Shannon limit a suitable resource management (RRM) exploiting this key features is a needed. Packet scheduling mechanisms particularly play a fundamental rol...,,20-23 Oct.,10.1109/WINCOM.2015.7381318,https://ieeexplore.ieee.org/document/7381318,new
ieee:7348030,conference,An implementation of a fountain code-based MIMO-OFDM receiver for real-time wireless video streaming,"Yi-Pin Lu, Wei Lan, Yi-Feng Cheng, Tzi-Dar Chiueh","This paper presents a real-time implementation of both a fountain code decoder and a MIMO-OFDM receiver for a wireless video streaming system. The development of the physical layer conforms to the specifications of the Wireless LAN standard, while the limited MAC functionality is based on custom specifications. In order to realize a real-time wireless video streaming system that has a low latency,...",,19-21 Oct.,10.1109/WiMOB.2015.7348030,https://ieeexplore.ieee.org/document/7348030,new
ieee:7399785,conference,MIMO-SC-FDMA system with iterative decision feedback equalization,"Deliang Liu, Lihua Chen, Yimin Wei, Baohua Huang, Heying Teng",The BER performance of MIMO-SC-FDMA system may degrade quickly when the frequency-selective deep fading occurs in the channel. In order to solve this problem the IB-DFEIC (iterative block decision-feedback equalization & interference cancellation) algorithm applied in MIMO-SCFDMA system is proposed in this paper. In this algorithm the inter-layer interference and inter-symbol interference will be ...,,18-20 Oct.,10.1109/ICCT.2015.7399785,https://ieeexplore.ieee.org/document/7399785,new
ieee:7354429,conference,Quantum Expander Codes,"Anthony Leverrier, Jean-Pierre Tillich, Gilles Zémor","We present an efficient decoding algorithm for constant rate quantum hyper graph-product LDPC codes which provably corrects adversarial errors of weight proportional to the code minimum distance, or equivalently to the square-root of the block length. The algorithm runs in time linear in the number of qubits, which makes its performance the strongest to date for linear-time decoding of quantum cod...",,17-20 Oct.,10.1109/FOCS.2015.55,https://ieeexplore.ieee.org/document/7354429,new
ieee:7454239,conference,A shared hard decisions storing in partially parallel FPGA-based QC-LDPC decoder,"Tianjiao Xie, Ruijia Yuan, Jianhua Zhang","A strategy of hard decisions sharing intrinsic and extrinsic memory banks for partially parallel Quasi-Cyclic (QC) LDPC decoder is proposed in this paper. The proposed method not need extra memory banks to store hard decisions, could reduce the total number of memory by 33% compared with the decoder in reference [6] which is significantly fewer memory banks than the other published FPGA implementa...",,16-18 Oct.,10.1109/ICCPS.2015.7454239,https://ieeexplore.ieee.org/document/7454239,new
ieee:7454080,conference,Analysis and comparison of decoding algorithms on repeat accumulate code,"Xueting Zeng, Jing He",This paper presents some decoding methods based on Tanner graph for the analysis of the repeat accumulate code which has been proved to be linear time encoding and linear time decoding. We study the structure of the repeat accumulate code and make a detail derivation of the procedure of these iterative algorithms. The extensive simulation results show that these efficient decoding methods based on...,,16-18 Oct.,10.1109/ICCPS.2015.7454080,https://ieeexplore.ieee.org/document/7454080,new
ieee:7340967,conference,Joint design of QC-LDPC codes for cascade-based multisource coded cooperation,"Shunwai Zhang, Rongfang Song, Fengfan Yang","Quasi-cyclic low-density-parity-check (QC-LDPC) codes are jointly designed for cascade-based multisource coded cooperation system. Firstly, QC-LDPC codes based on the base matrix and exponent matrix are introduced, and then two types of girth-4 cycles in QC-LDPC codes employed by the sources and relay are explicated. Secondly, we propose joint design method of QC-LDPC codes employed by the sources...",,15-17 Oct.,10.1109/WCSP.2015.7340967,https://ieeexplore.ieee.org/document/7340967,new
ieee:7341171,conference,The performance analysis of LDPC coded SFH/BPSK anti-jamming system,"Kongzhe Yang, Bangning Zhang, Hangxian Wang, Daoxing Guo","In order to improve the anti-jamming ability of frequency hopping (FH) system, a low-density parity-check (LDPC) coded SFH/BPSK anti-jamming communication system is established in this paper, and the simulations of the antijamming performance are carried out. Firstly, the system model which is used in simulations is established. Then, the antijamming ability against partial band jamming (PBJ) with...",,15-17 Oct.,10.1109/WCSP.2015.7341171,https://ieeexplore.ieee.org/document/7341171,new
ieee:7341182,conference,A mixed behavior/structural model for analog LDPC decoders including mismatch effects and dynamic behavior,"Zhe Zhao, Fei Gao, Hanyue Li, Yimin Li, Haikun Luo","The analog implementation of error control decoders is a power efficiency and speed competitive methodology comparing with the digital implementation. In this paper, we propose a mixed behavioral/structural model for the analog implementation of low-density parity-check (LDPC) decoders based on the sum-product algorithm, while taking transistor mismatch effects and circuit dynamic behavior into ac...",,15-17 Oct.,10.1109/WCSP.2015.7341182,https://ieeexplore.ieee.org/document/7341182,new
ieee:7340999,conference,Iterative carrier recovery in an LDPC coded QPSK system at low SNRs,"Jianrong Bao, Xiqi Gao, Chao Liu, Bin Jiang","This paper presents an iterative carrier recovery (ICR) via soft decision metrics (SDMs) of low-density parity-check (LDPC) decoding in an LDPC coded quadrature phase shift keying (QPSK) system. It is crucial for wireless communication systems to work effectively, especially at low signal-to-noise ratios (SNRs). By maximizing the sum of the square of the SDMs of LDPC decoding with gradient oriente...",,15-17 Oct.,10.1109/WCSP.2015.7340999,https://ieeexplore.ieee.org/document/7340999,new
ieee:7341331,conference,Analysis and optimization design of P-LDPC coded hybrid FSO/RF systems,"Chengjun Tang, Ming Jiang, Chunming Zhao","In this paper, we study a hybrid free-space optical/radio-frequency (FSO/RF) communication system deploying protograph-based low-density parity-check (P-LDPC) codes. We use the protograph-based extrinsic information transfer (PEXIT) algorithm to accurately evaluate the system performance and employ the hybrid FSO/RF symbol mapping technique and the generalized variable degree matched mapping (G-VD...",,15-17 Oct.,10.1109/WCSP.2015.7341331,https://ieeexplore.ieee.org/document/7341331,new
ieee:7341247,conference,An unequal coding scheme for space image transmission within the framework of CCSDS recommendations,"Jiachen Sun, Kechao Huang, Xiying Liu, Xiao Ma","In this paper, we propose a new coding scheme for space image transmission, which combines the unequal error protection (UEP) by partial superposition transmission (referred to as UEP-by-PST) with coded modulation standards recommended by the Consultative Committee for Space Data Systems (CCSDS). The raw image is first processed by the recommended image compressor, and then encoded by the UEP-by-P...",,15-17 Oct.,10.1109/WCSP.2015.7341247,https://ieeexplore.ieee.org/document/7341247,new
ieee:7341133,conference,Low complexity K-Best algorithm based iterative detectors for MIMO-FBMC systems,"Ying Fang, Jie Zhong, Minjian Zhao, Ming Lei","Filter bank multicarrier (FBMC) modulation has many nice features compared with conventional cyclic prefix-based orthogonal frequency multiplexing (CP-OFDM) and has been considered as a promising waveform candidate for future 5G wireless communication. Combining FBMC with multiple-input multiple-output (MIMO) technology may achieve high data rate. In this paper, we propose the K-Best algorithm bas...",,15-17 Oct.,10.1109/WCSP.2015.7341133,https://ieeexplore.ieee.org/document/7341133,new
ieee:7341327,conference,Design and analysis of irregular sparse code multiple access,"Shutian Zhang, Baicen Xiao, Kexin Xiao, Zhiyong Chen, Bin Xia","Sparse Code Multiple Access (SCMA) is an excellent approach to support massive connections and short time-delay, which are the two key requirements in the future fifth generation (5G) communication system. Due to the drawback that traditional SCMA can&#39;t serve users with different business needs in the same scenario, we propose an irregular Sparse Code Multiple Access (SCMA) in this paper. In contr...",,15-17 Oct.,10.1109/WCSP.2015.7341327,https://ieeexplore.ieee.org/document/7341327,new
ieee:7341061,conference,Low-complexity soft-output detectors for LDPC coded spatial modulation systems,"Cong Li, Yunpeng Cheng, Yuming Zhang, Yuzhen Huang","In this paper, we present an efficient transmission scheme for multiple-input multiple-output (MIMO) systems, i.e., low density parity check (LDPC) coded spatial modulation (SM) systems. To exploit the powerful error correction of LDPC code, the key challenge of LDPC coded SM systems is on designing a reliable but low complexity soft-output detector. To tackle this problem, we propose two soft-out...",,15-17 Oct.,10.1109/WCSP.2015.7341061,https://ieeexplore.ieee.org/document/7341061,new
ieee:7357751,conference,Experimental evaluation of LDPC-coded OAM based FSO communication in the presence of atmospheric turbulence,"Zhen Qu, Ivan B. Djordjevic","A low-density parity check (LDPC)-coded orbital angular momentum (OAM)-based free-space optical (FSO) transmission system is experimentally studied in both the absence and presence of emulator-induced atmospheric turbulence. In the presence of turbulence, the coding gains larger than 6.8 dB are obtained at BER of 10−4 for single OAM mode and dramatic improvement is found in case of LDPC-coded OAM ...",,14-17 Oct.,10.1109/TELSKS.2015.7357751,https://ieeexplore.ieee.org/document/7357751,new
ieee:7357727,conference,Low complexity memory architectures based on LDPC codes: Benefits and disadvantages,"Bane Vasić, Predrag Ivaniš, Srdan Brkic","In this paper we investigate the problem of information storage in inherently unreliable memory cells. In order to increase the memory reliability, information is stored in memory cells as a codeword of a low-density parity-check (LDPC) code, while the memory content is updated periodically by an error correction scheme. We first present an overview on the state-of-the memory architectures based o...",,14-17 Oct.,10.1109/TELSKS.2015.7357727,https://ieeexplore.ieee.org/document/7357727,new
ieee:7357731,conference,Complexity and performance of QC-MDPC code-based McEliece cryptosystems,"Omran Al Rasheed, Predrag Ivaniš","In this paper, we analyze security of McEliece cryptosystem based on Low Density Parity Check (LDPC) and Moderate (MDPC) codes, as well as the complexity of the corresponding cryptosystem. Several approaches are proposed to improve the cryptosystem security for the case when complexity of cryptosystem has to be below the prescribed level. A certain modifications of Gradient Descent Bit Flipping (G...",,14-17 Oct.,10.1109/TELSKS.2015.7357731,https://ieeexplore.ieee.org/document/7357731,new
ieee:7357754,conference,Multidimensional signal constellation design for channel dominated with nonlinear phase noise,"Tao Liu, Ivan B. Djordjevic, Mo Li","Multidimensional signal constellation sets suitable for nonlinear phase noise dominated channel are proposed, where the cumulative log-likelihood-function is used as the optimization criterion. Also, we demonstrate that our proposed signal constellation sets significantly outperform polarization switched QPSK and sphere packing constellations in 8-ary case and 16-ary case.",,14-17 Oct.,10.1109/TELSKS.2015.7357754,https://ieeexplore.ieee.org/document/7357754,new
ieee:7357732,conference,An error correcting technique for performance improvement of OFDM based secondary link,"Nenad J. Vukmirović, Miloš T. Janjić, Predrag N. Ivaniš","In this paper we consider the cognitive radio system based on spectrum sensing, and propose an error correction technique for its performance improvement. We analyze secondary user link based on Orthogonal Frequency-Division Multiplexing (OFDM), realized by using Universal Software Radio Peripheral N210 platforms. Parameters of low density parity check codes and interleaver that provide significan...",,14-17 Oct.,10.1109/TELSKS.2015.7357732,https://ieeexplore.ieee.org/document/7357732,new
ieee:7345034,conference,LDPC decoder architecture for DVB-S2 and DVB-S2X standards,"Cédric Marchand, Emmanuel Boutillon","A particular type of conflict due to multiple-diagonal sub-matrices in the DVB-S2 parity-check matrices is known to complicate the implementation of the layered decoder architecture. The new matrices proposed in DVB-S2X no longer use such sub-matrices. For implementing a decoder compliant both with DVB-S2 and DVB-S2X, we propose an elegant solution which overcomes these conflicts. The solution rel...",,14-16 Oct.,10.1109/SiPS.2015.7345034,https://ieeexplore.ieee.org/document/7345034,new
ieee:7344983,conference,A channel-adaptive nonbinary LDPC decoder,"Wenjie Huang, Lei Wang","We propose a low-complexity decoding message truncation technique for nonbinary LDPC decoders by exploiting the extended min-sum algorithm. The proposed technique dynamically adjusts the decoding message length according to channel conditions, thereby reducing the decoding complexity while conforming to the desired level of decoding performance. Utilizing the proposed technique, the decoding opera...",,14-16 Oct.,10.1109/SiPS.2015.7344983,https://ieeexplore.ieee.org/document/7344983,new
ieee:7401607,conference,An irregular repeat accumulate coded adaptive amplify-and-forward scheme based on the EESM model,"Mingxiang Xie, Xiang Chen, Jing Huang","Cooperative communication is a bright technology to acquire diversity gain in wireless terminals by sharing their antennas. With the fixed amplify-and-forward (AF) mode, relay node always helps to relay the data of the source node with unchanged transmission power. Judging from the power efficiency, it is obviously not optimal, particularly when channel states are quite good. An adaptive AF mode i...",,14-16 Oct.,10.1109/BMEI.2015.7401607,https://ieeexplore.ieee.org/document/7401607,new
ieee:7345000,conference,Parallel block-layered nonbinary QC-LDPC decoding on GPU,"Huyen Thi Pham, Sabooh Ajaz, Hanho Lee",This paper presents an efficient implementation of a parallel block-layered nonbinary quasi-cyclic low-density parity-check (NB-QC-LDPC) decoder on a graphics processing unit (GPU) to achieve significant improvements in both flexibility and scalability. An efficient block-layered scheme and a data structure suitable for parallel computing are proposed to perform decoding on the GPU. The scheme is ...,,14-16 Oct.,10.1109/SiPS.2015.7345000,https://ieeexplore.ieee.org/document/7345000,new
