ID,Type,Title,Authors,Abstract,Categories,Published,DOI,PDF URL,Status
ieee:7345024,conference,A fully-unrolled LDPC decoder based on quantized message passing,"Alexios Balatsoukas-Stimming, Michael Meidlinger, Reza Ghanaatian, Gerald Matz, Andreas Burg","In this paper, we propose a finite alphabet message passing algorithm for LDPC codes that replaces the standard min-sum variable node update rule by a mapping based on generic look-up tables. This mapping is designed in a way that maximizes the mutual information between the decoder messages and the codeword bits. We show that our decoder can deliver the same error rate performance as the conventi...",,14-16 Oct.,10.1109/SiPS.2015.7345024,https://ieeexplore.ieee.org/document/7345024,new
ieee:7345006,conference,A high-throughput multi-rate LDPC decoder for error correction of solid-state drives,"Yishan Zhang, Chun Zhang, Zhiyuan Yan, Shuang Chen, Hanjun Jiang","This paper presents a high-throughput multi-rate low density parity check (LDPC) decoder for error correction in solid-state drives (SSDs). In order to meet the high throughput requirement of SSDs, an adaptive normalized min-sum algorithm (NMSA) is implemented by using multiple look-up tables. With the proposed technique, a reduction in average iteration number of around 22.5%∼30.3% is achieved wh...",,14-16 Oct.,10.1109/SiPS.2015.7345006,https://ieeexplore.ieee.org/document/7345006,new
ieee:7388304,conference,A parallel-routing network for reliability inferences of single-parity-check decoder,"Qing Lu, Zhuoer Shen, Chiu-Wing Sham, Francis C. M. Lau","The computation of the reliability inferences among the variables of a single-parity-check (SPC) code is a common challenge to the implementation of channel decoders. Applicable to a variety of computational mechanisms using disparate kernels, a parallel-routing network has been developed, which is, compared to the state-of-art structure, exploring the best of its parallel nature for an improved t...",,14-16 Oct.,10.1109/ATC.2015.7388304,https://ieeexplore.ieee.org/document/7388304,new
ieee:7344986,conference,Low complexity belief propagation polar code decoder,"Syed Mohsin Abbas, YouZhe Fan, Ji Chen, Chi-Ying Tsui","Since their invention, polar codes have received a lot of attention because of their capacity-achieving performance and low encoding and decoding complexity. Successive cancellation decoding (SCD) and belief propagation decoding (BPD) are two approaches for decoding polar codes. SCD is able to achieve good error-correcting performance and is less computationally expensive as compared to BPD. Howev...",,14-16 Oct.,10.1109/SiPS.2015.7344986,https://ieeexplore.ieee.org/document/7344986,new
ieee:7344984,conference,Reduced complexity belief propagation decoders for polar codes,"Jun Lin, Chenrong Xiong, Zhiyuan Yan","Polar codes are newly discovered capacity-achieving codes, which have attracted lots of research efforts. Polar codes can be efficiently decoded by the low-complexity successive cancelation (SC) algorithm and the SC list (SCL) decoding algorithm. The belief propagation (BP) decoding algorithm not only is an alternative to the SC and SCL decoders, but also provides soft outputs that are necessary f...",,14-16 Oct.,10.1109/SiPS.2015.7344984,https://ieeexplore.ieee.org/document/7344984,new
ieee:7412602,conference,Link-adaptable vector-perturbation ZFBF precoder for multi-point 3D-beamformers,Masaaki Fujii,"A link adaptation scheme is devised for vector-perturbation (VP) zero-forcing beamforming (ZFBF) MIMO precoding and a link-adaptable VP-ZFBF precoder is applied to multi-point three-dimensional (3D) beamformers to be used in mmWave-band wireless access systems. Channel coding schemes used in current systems, e.g., turbo codes, possess systematic code structures. The perturbation gain can thus be p...",,14-16 Oct.,10.1109/APCC.2015.7412602,https://ieeexplore.ieee.org/document/7412602,new
ieee:7315157,conference,Low-power LDPC decoder design exploiting memory error statistics,"Junlin Chen, Lei Wang","This paper presents a low-power LDPC decoder design by exploiting inherent memory error statistics due to voltage scaling. By analyzing the error sensitivity to the decoding performance at different memory bits and memory locations in the LDPC decoder, the scaled supply voltage is applied to memory bits with high algorithmic error-tolerance capability to reduce the memory power consumption while m...",,12-14 Oct.,10.1109/DFT.2015.7315157,https://ieeexplore.ieee.org/document/7315157,new
ieee:7360758,conference,Anytime properties of protograph-based repeat-accumulate codes,"Nan Zhang, Md. Noor-A-Rahim, Badri N. Vellambi, Khoa D. Nguyen","In this paper, a highly efficient protograph-based repeat-accumulate (P-RA) anytime code is proposed, which is derived from the combination of protograph-based low-density parity-check convolutional (P-LDPCC) and spatially coupled low-density parity-check convolutional (SC-LDPCC) codes. Density evolution technique is applied to demonstrate the anytime properties of the P-RA codes over the binary e...",,11-15 Oct.,10.1109/ITWF.2015.7360758,https://ieeexplore.ieee.org/document/7360758,new
ieee:7360760,conference,Construction of polar codes for channels with memory,"Runxin Wang, Junya Honda, Hirosuke Yamamoto, Rongke Liu, Yi Hou",Polar codes for channels with memory are considered in this paper. ŗaşoğlu proved that Arikan&#39;s polarization applies to finite-state memory channels but practical decoding algorithms of polar codes for such channels have been unknown. This paper proposes a generalization of successive cancellation algorithm for channels with memory where the complexity is polynomial in the number of states. In add...,,11-15 Oct.,10.1109/ITWF.2015.7360760,https://ieeexplore.ieee.org/document/7360760,new
ieee:7360750,conference,Threshold saturation for spatially coupled turbo-like codes over the binary erasure channel,"Saeedeh Moloudi, Michael Lentmaier, Alexandre Graell i Amat","In this paper we prove threshold saturation for spatially coupled turbo codes (SC-TCs) and braided convolutional codes (BCCs) over the binary erasure channel. We introduce a compact graph representation for the ensembles of SC-TC and BCC codes which simplifies their description and the analysis of the message passing decoding. We demonstrate that by few assumptions in the ensembles of these codes,...",,11-15 Oct.,10.1109/ITWF.2015.7360750,https://ieeexplore.ieee.org/document/7360750,new
ieee:7360745,conference,Toward limits of constructing reliable memories from unreliable components,Lav R. Varshney,"There has been long-standing interest in constructing reliable memory systems from unreliable components like noisy bit-cells and noisy logic gates, under circuit complexity constraints. Prior work has focused exclusively on constructive achievability results, but here we develop converse theorems for this problem for the first time. The basic technique relies on entropy production/dissipation arg...",,11-15 Oct.,10.1109/ITWF.2015.7360745,https://ieeexplore.ieee.org/document/7360745,new
ieee:7360749,conference,Analysis of spatially-coupled counter braids,"Eirik Rosnes, Alexandre Graell i Amat","A counter braid (CB) is a novel counter architecture introduced by Lu et al. in 2007 for per-flow measurements on high-speed links. CBs achieve an asymptotic compression rate (under optimal decoding) that matches the entropy lower bound of the flow size distribution. Spatially-coupled CBs (SC-CBs) have recently been proposed. In this work, we further analyze single-layer CBs and SC-CBs using an eq...",,11-15 Oct.,10.1109/ITWF.2015.7360749,https://ieeexplore.ieee.org/document/7360749,new
ieee:7387584,conference,New PEG algorithm with low error floor for construction of irregular LDPC codes,"Feijin Shi, Shuangshuang Han","The progressive-edge-growth (PEG) algorithm for constructing Tanner graphs with large girth by progressively establishing edges/connections between symbol nodes and check nodes in an edge-by-edge way is highly known to construct low-density parity-check (LDPC) codes at short block lengths for achieving good performance. This paper proposed an improved PEG construction for irregular codes, which he...",,10-11 Oct.,10.1109/CompComm.2015.7387584,https://ieeexplore.ieee.org/document/7387584,new
ieee:7387582,conference,Linear-encodable rate-compatible QC-LDPC codes with low error floor,"Song Zhang, Linhua Ma, Le Ru, Haiwei Zhang, Xiao-ou Song, Hong Tang","A class of rate-compatible (RC) quasi-cycle low-density parity-check (QC-LDPC) codes that have linear encodable complexity and low error floor is presented. To ensure linear encoding complexity, a lower triangular (LT) form for the parity part of the mother parity-check matrix is designed. By the designed LT form, a recursive encoding strategy is proposed. This encoding strategy can achieve linear...",,10-11 Oct.,10.1109/CompComm.2015.7387582,https://ieeexplore.ieee.org/document/7387582,new
ieee:6977956,journal,Unequal Error Protection of Memories in LDPC Decoders,"Carlo Condo, Guido Masera, Paolo Montuschi","Memories are one of the most critical components of many systems: due to exposure to energetic particles, fabrication defects and aging they are subject to various kinds of permanent and transient errors. In this scenario, Unequal error protection (UEP) techniques have been proposed in the past to encode stored information, allowing to detect and possibly recover from errors during load operations...",,1 Oct. 201,10.1109/TC.2014.2378271,https://ieeexplore.ieee.org/document/6977956,new
