ID,Type,Title,Authors,Abstract,Categories,Published,DOI,PDF URL,Status
ieee:10856913,journal,A Novel Construction Approach of Irregular LDPC Codes Based on QC Structure and Zigzag Pattern,"Jing Lei, Chunguang Yao, Bin Chen, Lei Wen, Wei Liu","This paper presents a novel construction method of irregular Low-density parity-check (LDPC) codes based on Quasi-cyclic (QC) structure and zigzag pattern. By using the proposed method, a class of irregular and highly structured LDPC codes can be designed with the advantages of low storage requirement and linear time encoding complexity. The constructed codes are called Irregular repeat-accumulate...",,October 20,10.1049/cje.2015.10.020,https://ieeexplore.ieee.org/document/10856913,new
ieee:6942228,journal,Multimode Radix-4 SISO Kernel Design for Turbo/LDPC Decoding,"Cheng-Hung Lin, Chih-Shiang Yu","To increase the quality of wireless transmission, wireless communication systems employ advanced forward error correction codes such as turbo codes and low-density parity-check (LDPC) codes. To achieve smooth transition between turbo and LDPC decoding in different communication standards, we propose a VLSI design of a multimode radix-4 soft-input soft-output (SISO) kernel in this paper. The propos...",,Oct. 2015,10.1109/TVLSI.2014.2363777,https://ieeexplore.ieee.org/document/6942228,new
ieee:6948239,journal,Design and Analysis of Bit-Interleaved Coded Modulation With Pseudorandom Sequence,"Zhiyong Chen, Hui Liu, Bin Xia","In this paper, we design and analyze an improved bit-interleaved coded modulation (CM) scheme with a pseudorandom sequence (BICM-P). For the proposed scheme, the pseudorandom sequence is introduced into a systematic encoder at the transmitter and serves as side information at the receiver. With this design, the receiver can enjoy the benefit of increased Hamming distance when applying this side in...",,Oct. 2015,10.1109/TVT.2014.2367514,https://ieeexplore.ieee.org/document/6948239,new
ieee:7163569,journal,Convolutional-Code-Specific CRC Code Design,"Chung-Yu Lou, Babak Daneshrad, Richard D. Wesel",Cyclic redundancy check (CRC) codes check if a codeword is correctly received. This paper presents an algorithm to design CRC codes that are optimized for the code-specific error behavior of a specified feedforward convolutional code. The algorithm utilizes two distinct approaches to computing undetected error probability of a CRC code used with a specific convolutional code. The first approach en...,,Oct. 2015,10.1109/TCOMM.2015.2459058,https://ieeexplore.ieee.org/document/7163569,new
ieee:7272776,journal,An Iterative Detection and Decoding Receiver for LDPC-Coded MIMO Systems,"Wei-Cheng Sun, Wei-Hsuan Wu, Chia-Hsiang Yang, Yeong-Luh Ueng","This paper presents a high-throughput, area-efficient and energy-efficient iterative detection and decoding (IDD) receiver for low-density parity-check (LDPC)-coded multiple-input multiple-output (MIMO) systems. A layered non-resetting IDD technique is used to minimize the number of inner iterations for a required error performance. An area-efficient minimum mean-square error with parallel interfe...",,Oct. 2015,10.1109/TCSI.2015.2468998,https://ieeexplore.ieee.org/document/7272776,new
ieee:7163287,journal,A New Scheme of High Performance Quasi-Cyclic LDPC Codes With Girth 6,"Sina Vafi, Narges Rezvani Majid","The letter presents a new technique for constructing regular and irregular quasi-cyclic (QC) low density parity check (LDPC) codes with girth 6. Codes are designed by the combinatorial concept, in which subsets representing circulant matrices are originated from a particular subset. Conducted simulations confirm that implemented codes have low error floor, while they provide good performance in th...",,Oct. 2015,10.1109/LCOMM.2015.2458322,https://ieeexplore.ieee.org/document/7163287,new
ieee:7277127,journal,Jointly Designed Nonbinary LDPC Convolutional Codes and Memory-Based Decoder Architecture,"Chia-Lung Lin, Chih-Lung Chen, Hsie-Chia Chang, Chen-Yi Lee","In this paper, a design approach for architecture- aware nonbinary low-density parity-check convolutional codes (NB-LDPC-CCs) is presented to jointly optimizes the code performance and decoder complexity for achieving high energy-efficiency decoder. The proposed NB-LDPC-CCs not only feature simple structure and low degree, but also compete with other published NB-LDPC-CCs on error-correction capab...",,Oct. 2015,10.1109/TCSI.2015.2471575,https://ieeexplore.ieee.org/document/7277127,new
ieee:7177078,journal,Lowest Density MDS Array Codes of Distance 3,"Zhijie Huang, Hong Jiang, Ke Zhou, Yuhong Zhao, Chong Wang","We present a new family of maximum-distance separable (MDS) array codes of distance 3, called S(ymmetry)-Code, which has the properties of: 1) optimality in encoding, decoding and update; 2) code length of either p or p - 1 with p being an odd prime; 3) requiring less I/O cost than most existing lowest density MDS array codes during single-erasure recovery; and 4) approaching the lower bound in I/...",,Oct. 2015,10.1109/LCOMM.2015.2464379,https://ieeexplore.ieee.org/document/7177078,new
ieee:7264976,journal,Error-Control Coding for Physical-Layer Secrecy,"Matthieu Bloch, Masahito Hayashi, Andrew Thangaraj","The renewed interest for physical-layer security techniques has put forward a new role for error-control codes. In addition to ensuring reliability, carefully designed codes have been shown to provide a level of information-theoretic secrecy, by which the amount of information leaked to an adversary may be controlled. The ability to achieve information-theoretic secrecy relies on the study of alte...",,Oct. 2015,10.1109/JPROC.2015.2463678,https://ieeexplore.ieee.org/document/7264976,new
ieee:7120175,journal,Network Code Division Multiplexing for Wireless Relay Networks,"Jing Yue, Zihuai Lin, Branka Vucetic, Guoqiang Mao, Ming Xiao, Baoming Bai, Kun Pang","In this paper, we investigate the performance of a wireless relay network with multiple transmission sessions, in which multiple groups of source nodes communicate with their respective destination nodes via a shared wireless relay network. A multiple transmission session model with network code division multiplexing (NCDM) scheme is proposed to remove the inter-session interference at each destin...",,Oct. 2015,10.1109/TWC.2015.2442581,https://ieeexplore.ieee.org/document/7120175,new
ieee:7192620,journal,Quasi-Primitive Block-Wise Concatenated BCH Codes With Collaborative Decoding for NAND Flash Memories,"Daesung Kim, Jeongseok Ha","In this work, we propose a novel design rule of block-wise concatenated Bose-Chaudhuri-Hocquenghem (BC-BCH) codes for storage devices using multi-level per cell (MLC) NAND flash memories. BC-BCH codes designed in accordance with the proposed design rule are called quasi-primitive BC-BCH codes in which constituent BCH codes are deliberately chosen for their lengths to be as close to primitive BCH c...",,Oct. 2015,10.1109/TCOMM.2015.2467384,https://ieeexplore.ieee.org/document/7192620,new
ieee:6920050,journal,Low-Latency Successive-Cancellation List Decoders for Polar Codes With Multibit Decision,"Bo Yuan, Keshab K. Parhi","Polar codes, as the first provable capacity-achieving error-correcting codes, have received much attention in recent years. However, the decoding performance of polar codes with traditional successive-cancellation (SC) algorithm cannot match that of the low-density parity-check or Turbo codes. Because SC list (SCL) decoding algorithm can significantly improve the error-correcting performance of po...",,Oct. 2015,10.1109/TVLSI.2014.2359793,https://ieeexplore.ieee.org/document/6920050,new
ieee:7154472,journal,Lattices Over Eisenstein Integers for Compute-and-Forward,"Nihat Engin Tunali, Yu-Chih Huang, Joseph J. Boutros, Krishna R. Narayanan","In this paper, we consider the use of lattice codes over Eisenstein integers for implementing a compute and-forward protocol in wireless networks when channel state information is not available at the transmitter. We extend the compute-and-forward paradigm of Nazer and Gastpar to decoding Eisenstein integer combinations of transmitted messages at relays by proving the existence of a sequence of pa...",,Oct. 2015,10.1109/TIT.2015.2451623,https://ieeexplore.ieee.org/document/7154472,new
ieee:7045526,journal,Iterative Receiver Design for ISI Channels Using Combined Belief- and Expectation-Propagation,"Peng Sun, Chuanzong Zhang, Zhongyong Wang, Carles N. Manchón, Bernard H. Fleury","In this letter, a message-passing algorithm that combines belief propagation and expectation propagation is applied to design an iterative receiver for intersymbol interference channels. We detail the derivation of the messages passed along the nodes of a vector-form factor graph representing the underlying probabilistic model. We also present a simple but efficient method to cope with the “negati...",,Oct. 2015,10.1109/LSP.2015.2404822,https://ieeexplore.ieee.org/document/7045526,new
ieee:7173010,journal,Unequal Message Protection: Asymptotic and Non-Asymptotic Tradeoffs,"Yanina Y. Shkel, Vincent Y. F. Tan, Stark C. Draper","We study a form of unequal error protection that we term unequal message protection (UMP). The message set of a UMP code is a union of  $m$  disjoint message classes. Each class has its own error protection requirement, with some classes needing better error protection than others. We analyze the tradeoff between rates of message classes and the levels of error protection; our analysis reveals new...",,Oct. 2015,10.1109/TIT.2015.2462846,https://ieeexplore.ieee.org/document/7173010,new
ieee:6977955,journal,Distributed Irregular Codes Relying on Decode-and-Forward Relays as Code Components,"Soon Xin Ng, Yonghui Li, Branka Vucetic, Lajos Hanzo",A near-capacity distributed coding scheme is conceived by incorporating multiple relay nodes (RNs) for constructing a virtual irregular convolutional code (IRCC). We first compute the relay channel&#39;s capacity and then design IRCCs for the source and relay nodes. Extrinsic information transfer (EXIT) charts are utilized to design the codes for approaching the achievable capacity of the relay channe...,,Oct. 2015,10.1109/TVT.2014.2370737,https://ieeexplore.ieee.org/document/6977955,new
ieee:7182759,journal,On  $A^{\ast}$ Algorithms for Decoding Short Linear Block Codes,"Tien-Hui Chen, Kuan-Chen Chen, Mao-Chao Lin, Chia-Fu Chang",The A* algorithm for decoding linear block codes is an efficient tree-search method for decoding short linear block codes. The information contained in the parity bits are potentially useful for reducing the edges needed in the tree search. We propose to extract the information embedded in the parity bits by considering sums of parity bits which can be decided by part of the message bits. Analysis...,,Oct. 2015,10.1109/TCOMM.2015.2466233,https://ieeexplore.ieee.org/document/7182759,new
ieee:7192607,journal,Efficient LLR Calculation for FBMC,"Soonki Jo, Jong-Soo Seo","Orthogonal frequency division multiplexing (OFDM) technology has been adopted in various communications and broadcasting systems, including LTE, WiMax, and DVB-T2. However, cyclic prefix (CP) and guard band are required to limit the inter-symbol and adjacent interference, which would cause loss of spectral efficiency. Filter bank multiple carrier (FBMC) technology is one of the alternative solutio...",,Oct. 2015,10.1109/LCOMM.2015.2467376,https://ieeexplore.ieee.org/document/7192607,new
ieee:7105864,journal,Efficient Private Information Retrieval Over Unsynchronized Databases,"Giulia Fanti, Kannan Ramchandran","Web search histories can reveal detailed and sensitive information about people. Private information retrieval (PIR) tackles this potential privacy violation by allowing users to retrieve the wth record of a database without revealing w to the server. However, most known PIR schemes are either very inefficient (and therefore unlikely to gain traction in a practical sense) or reliant on some restri...",,Oct. 2015,10.1109/JSTSP.2015.2432740,https://ieeexplore.ieee.org/document/7105864,new
ieee:6862930,journal,CEDAR: A Low-Latency and Distributed Strategy for Packet Recovery in Wireless Networks,"Chenxi Qiu, Haiying Shen, Sohraab Soltani, Karan Sapra, Hao Jiang, Jason O. Hallstrom","Underlying link-layer protocols of well-established wireless networks that use the conventional “store-and-forward” design paradigm cannot provide highly sustainable reliability and stability in wireless communication, which introduce significant barriers and setbacks in scalability and deployments of wireless networks. In this paper, we propose a Code Embedded Distributed Adaptive and Reliable (C...",,Oct. 2015,10.1109/TNET.2014.2332980,https://ieeexplore.ieee.org/document/6862930,new
ieee:7458315,conference,Protograph LDPC codes for STBC Rayleigh fading channels,"Yi Fang, Guojun Han, Pingping Chen, Lifan Zhao, Lingjun Kong","In wireless communications, spatial diversity techniques, such as space-time block code (STBC) and multiple-input multiple-output (MIMO), have attracted much attention in recent years because they possess powerful robustness against signal fading. In this paper, we investigate the performance of the protograph low-density parity-check (LDPC) codes over space-time block code (STBC) Rayleigh fading ...",,7-9 Oct. 2,10.1109/ISCIT.2015.7458315,https://ieeexplore.ieee.org/document/7458315,new
ieee:7323474,conference,Novel forward error correction concepts for coherent optical communications,Laurent Schmalen,"We discuss and present several new directions in forward error correction for coherent optical communications. In particular, we show how the class of spatially coupled codes can lead to new FEC schemes outperforming conventional codes.",,4-8 Oct. 2,10.1109/IPCon.2015.7323474,https://ieeexplore.ieee.org/document/7323474,new
ieee:7324464,conference,Improving the Bandwidth Efficiency of Multi-Terminal Satellite Communications,"Boulos Wadih Khoueiry, M. Reza Soleymani","This paper presents a new coding scheme that considerably increases the efficiency of the channel in multicast setting. Specifically, we study the scenario where three terminals exchange their messages via a satellite gateway. The main difference between the proposed scheme and conventional three-way relay channel is the use of joint channel and network coding. This allows three terminals to trans...",,4-7 Oct. 2,10.1109/ICUWB.2015.7324464,https://ieeexplore.ieee.org/document/7324464,new
ieee:7456880,conference,Cryptocoding system based on AES and concatenated coding scheme involving BCH and QC-LDPC,"Karthika Viswanath, P. V. Pearlsy","In single-level cell flash memory, the most popular error correction code used for protection of the stored data is Bose-Chaudhuri-Hocquenghem (BCH) codes. However, BCH codes are not adequate to meet the error requirements of multi-level cell flash memory. Serial concatenation of codes increases the error correcting capability of the resulting system. Hence, a favorable concatenated coding scheme ...",,29-31 Oct.,10.1109/ICATCCT.2015.7456880,https://ieeexplore.ieee.org/document/7456880,new
ieee:7456944,conference,FPGA implementation of BCH decoder for memory systems,"B. S. Chandrashekhara, K L Sudha",BCH (Bose-Chaudhuri-Hocquenghem) coding is very useful to detect and correct the errors in communication system and also on-chip (computer) memory systems. This paper presents a High-speed BCH decoder that corrects double-adjacent and single-bit errors in parallel and serially corrects multiple-bit errors instead of double-adjacent errors. Its operation is based on extending an existing decoder th...,,29-31 Oct.,10.1109/ICATCCT.2015.7456944,https://ieeexplore.ieee.org/document/7456944,new
ieee:7447188,conference,A low-latency algorithm for stochastic decoding of LDPC codes,"Kuo-Lun Huang, Vincent C. Gaudet, Masoud Salehi","We introduce a low-latency stochastic decoding algorithm, called conditional stochastic decoding, to implement iterative Low-Density Parity-Check (LDPC) decoders. The conditional stochastic decoder, which utilizes reliable messages in the decoding process and the channel receiving probability to generate stochastic streams, improves error rate performance and decreases decoding latency. Compared t...",,29 Sept.-2,10.1109/ALLERTON.2015.7447188,https://ieeexplore.ieee.org/document/7447188,new
ieee:7446993,conference,Concentration to zero bit-error probability for regular LDPC codes on the binary symmetric channel: Proof by loop calculus,"Marc Vuffray, Theodor Misiakiewicz",In this paper we consider regular low-density parity-check codes over a binary-symmetric channel in the decoding regime. We prove that up to a certain noise threshold the bit-error probability of the bit-sampling decoder converges in mean to zero over the code ensemble and the channel realizations. To arrive at this result we show that the bit-error probability of the sampling decoder is equal to ...,,29 Sept.-2,10.1109/ALLERTON.2015.7446993,https://ieeexplore.ieee.org/document/7446993,new
ieee:7446995,conference,Energy-adaptive codes,"Haewon Jeong, Pulkit Grover","We provide the first constructions of a new family of error-correcting codes called “energy-adaptive codes.” These codes are designed to enable adaptive circuit implementations that minimize the total system-level energy based on varying distances and target error probabilities. Recent work has explored fundamental limits and practical strategies for minimizing total (transmit + circuit) power, co...",,29 Sept.-2,10.1109/ALLERTON.2015.7446995,https://ieeexplore.ieee.org/document/7446995,new
ieee:7447167,conference,Exploring connections between Sparse Fourier Transform computation and decoding of product codes,"Nagaraj Thenkarai Janakiraman, Santosh Emmadi, Krishna Narayanan, Kannan Ramchandran",We show that the recently proposed Fast Fourier Aliasing-based Sparse Transform (FFAST) algorithm for computing the Discrete Fourier Transform (DFT) [1] of signals with a sparse DFT is equivalent to iterative hard decision decoding of product codes. This connection is used to derive the thresholds for sparse recovery based on a recent analysis by Justensen [2] for computing thresholds for product ...,,29 Sept.-2,10.1109/ALLERTON.2015.7447167,https://ieeexplore.ieee.org/document/7447167,new
ieee:7354642,conference,Deployment strategy analysis for underwater cooperative wireless sensor networks,"Zafar Iqbal, Heung-No Lee","Wireless sensor networks (WSNs) are widely used for underwater environment monitoring. Because of the harsh underwater environment, WSNs face the challenges of erroneous communication, lower lifetime, less robustness, and cost constraints. In this paper, we propose a cooperative WSN which uses a cooperative coded OFDM (COFDM) system and network coding to deal with the shadowing phenomenon present ...",,28-30 Oct.,10.1109/ICTC.2015.7354642,https://ieeexplore.ieee.org/document/7354642,new
ieee:7354592,conference,A low-complexity decoding algorithm for concatenated tree codes,"Daesung Kim, Jeongseok Ha","This work considers a modified belief-propagation algorithm with two way scheduling for concatenated tree (CT) codes in which tree codes are employed as constituent codes. It will be shown that constituent tree codes can be efficiently decoded with the modified algorithm. Thus, by repeatedly using the modified BP algorithm for the constituent tree codes, CT codes can be decoded in an efficient way...",,28-30 Oct.,10.1109/ICTC.2015.7354592,https://ieeexplore.ieee.org/document/7354592,new
ieee:7390449,conference,On performance analysis of IEEE 802.22 (PHY) for COST-207 channel models,"Abhijeet Bishnu, Vimal Bhatia","With rapid increase in demand for bandwidth, several researchers around the world have found that, majority of licensed bands are either unused or underused. These under-utilised bands allocated for TV transmission are known as TV white space (TVWS). The IEEE 802.22 wireless regional area network (WRAN) is the latest standard for effective utilization of TV bands. This standard is based on orthogo...",,28-30 Oct.,10.1109/CSCN.2015.7390449,https://ieeexplore.ieee.org/document/7390449,new
ieee:7354659,conference,On interleaver design for BICM system with low error-floors,"Sangha Lee, Jeongseok Ha, Jaeyoon Lee","In this paper, we propose a design rule of a modified quasi-cyclic structure for bit-interleaved coded modulation with iterative decoding (BICM-ID). The proposed structure is especially favorable for low-complexity hardware implementation. In addition, it will be shown that the proposed structure effectively removes low-weight codewords, which in turn greatly improves error-floor behaviors as comp...",,28-30 Oct.,10.1109/ICTC.2015.7354659,https://ieeexplore.ieee.org/document/7354659,new
ieee:7354756,conference,Performance of MIMO detectors with a capacity-approaching code,"Seol-Jun Yoon, Joongho Lee, Seokhyun Yoon","In this paper, we provides a comparison of low-complexity MIMO detector, including linear MMSE receiver with a capacity-approaching channel code. The impact of soft-decision provided by MIMO detection plays an important role especially when using capacity-approaching codes. Here, our focus is on linear MMSE receiver with soft-decision output, a.k.a., log-likelihood ratio, and its approximate versi...",,28-30 Oct.,10.1109/ICTC.2015.7354756,https://ieeexplore.ieee.org/document/7354756,new
ieee:7354700,conference,Optimal pilot design for space-time coded multi-user MIMO OFDM/SDMA systems,"Zhe Zhang, Jiankang Zhang, Shuangzhi Li, Xiaomin Mu","In this paper, we propose an optimal pilot design scheme for multi-user Multiple-Input Multiple-Output (MIMO) Orthogonal Frequency Division Multiplexing/Space Division Multiple Access (OFDM/SDMA) systems. We derive the optimal pilot design criterion with regard to the computational complexity and the Mean Square Error (MSE) of the Least Square (LS) estimator. Furthermore, we propose a binary-tree ...",,28-30 Oct.,10.1109/ICTC.2015.7354700,https://ieeexplore.ieee.org/document/7354700,new
ieee:7371567,conference,PSG-Codes: An Erasure Codes Family with High Fault Tolerance and Fast Recovery,"Shiyi Li, Qiang Cao, Lei Tian, Shenggang Wan, Lu Qian, Changsheng Xie","As hard disk failure rates are rarely improved and the reconstruction time for TB-level disks typically amounts to days, multiple concurrent disk/storage node failures in datacenter storage systems become common and frequent. As a result, the erasure coding schemes used in datacenters must meet the critical requirements of high fault tolerance, high storage efficiency, and fast fault recovery. In ...",,28 Sept.-1,10.1109/SRDS.2015.39,https://ieeexplore.ieee.org/document/7371567,new
ieee:7341738,conference,Fast decoding and LLR-computation algorithms for high-order set-partitioned 4D-QAM constellations,"Shota Ishimura, Kazuro Kikuchi",We propose digital-signal-processing algorithms that achieve fast decoding and LLR-computation for high-order set-partitioned 4D-QAM formats based on their parity-check functions. Computer-simulation results show that computational complexity of the decoder can significantly be reduced with negligible power penalty using such algorithms.,,27 Sept.-1,10.1109/ECOC.2015.7341738,https://ieeexplore.ieee.org/document/7341738,new
ieee:7341747,conference,Energy-efficient soft-decision LDPC FEC For long-haul optical communication,"Kevin Cushon, Per Larsson-Edefors, Peter Andrekson","We present forward error correction systems based on a low-complexity LDPC decoding algorithm and randomly-structured LDPC codes. Simulation and ASIC synthesis results show throughput and net coding gain sufficient for long-haul applications, with greatly reduced energy consumption.",,27 Sept.-1,10.1109/ECOC.2015.7341747,https://ieeexplore.ieee.org/document/7341747,new
ieee:7341655,conference,Experimental demonstration of multi-pilot aided carrier phase estimation for DP-64QAM and DP-256QAM,"Milutin Pajovic, David S. Millar, Toshiaki Koike-Akino, Robert Maher, Domanic¸ Lavery, Alex Alvarado, Milen Paskov, Keisuke Kojima, Kieran Parsons, Benn C. Thomsen, Seb J. Savory, Polina Bayvel","We present a statistical inference based multi-pilot aided CPE algorithm and analyze its performance via simulations. We experimentally verify LDPC coded back-to-back performance using 10 GBd DP-64QAM and DP-256QAM modulation, with transmitter and receiver linewidths of 100 kHz.",,27 Sept.-1,10.1109/ECOC.2015.7341655,https://ieeexplore.ieee.org/document/7341655,new
ieee:7341686,conference,2.05 Peta-bit/s super-nyquist-WDM SDM transmission using 9.8-km 6-mode 19-core fiber in full C band,"D. Soma, K. Igarashi, Y. Wakayama, K. Takeshima, Y. Kawaguchi, N. Yoshikane, T. Tsuritani, I. Morita, M. Suzuki","We demonstrate ultra-dense SDM transmission of 360-channel Super-Nyquist-WDM DP-QPSK signals over 9.8-km 6-mode 19-core fiber, achieving the record fiber capacity of 2.05 Pbit/s (360WDM×114SDM×50Gbit/s) with the highest aggregate spectral efficiency of 456 bit/s/Hz.",,27 Sept.-1,10.1109/ECOC.2015.7341686,https://ieeexplore.ieee.org/document/7341686,new
ieee:7341944,conference,A study on power-scaling of triple-concatenated FEC for optical transport networks,"Kenji Ishii, Keisuke Dohi, Kazuo Kubo, Kenya Sugihara, Yoshikuni Miyata, Takashi Sugihara",We studied the power scaling using the measured power consumption and error correction performance of a triple-concatenated FEC. It was confirmed that the triple-concatenated FEC enabled 98% power reduction by controlling the NCG to suit the OSNR of the link.,,27 Sept.-1,10.1109/ECOC.2015.7341944,https://ieeexplore.ieee.org/document/7341944,new
