ID,Type,Title,Authors,Abstract,Categories,Published,DOI,PDF URL,Status
ieee:10118717,conference,Image Segmentation Semantic Communication over Internet of Vehicles,"Qiang Pan, Haonan Tong, Jie Lv, Tao Luo, Zhilong Zhang, Changchuan Yin, Jianfeng Li","In this paper, the problem of semantic-based efficient image transmission is studied over the Internet of Vehicles (IoV). In the considered model, a vehicle shares massive amount of visual data perceived by its visual sensors to assist other vehicles in making driving decisions. However, it is hard to maintain a high reliable visual data transmission due to the limited spectrum resources. To tackle this problem, a semantic communication approach is introduced to reduce the transmission data amount while ensuring the semantic-level accuracy. Particularly, an image segmentation semantic communication (ISSC) system is proposed, which can extract the semantic features from the perceived images and transmit the features to the receiving vehicle that reconstructs the image segmentations. The ISSC system consists of an encoder and a decoder at the transmitter and the receiver, respectively. To accurately extract the image semantic features, the ISSC system encoder employs a Swin Transformer based multi-scale semantic feature extractor. Then, to resist the wireless noise and reconstruct the image segmentation, a semantic feature decoder and a reconstructor are designed at the receiver. Simulation results show that the proposed ISSC system can reconstruct the image segmentation accurately with a high compression ratio, and can achieve robust transmission performance against channel noise, especially at the low signal-to-noise ratio (SNR). In terms of mean Intersection over Union (mIoU), the ISSC system can achieve an increase by 75%, compared to the baselines using traditional coding methods.",,26-29 Marc,10.1109/WCNC55385.2023.10118717,https://ieeexplore.ieee.org/document/10118717,new
ieee:10118657,conference,An Investigation on Intelligent Relay assisted Semantic Communication Networks,"Shaobo Ma, Wei Liang, Boxuan Zhang, Dawei Wang","With the development of sixth generation (6G) networks, semantic communication is treated as an emerging technology to provide more intelligent communication between two parties for enhance the accuracy and efficiency of communications. Whereas, it demands to merge all physical layer blocks in the conventional communications, which heavily deteriorates the spectrum sparsity problem of wireless communication networks. For this sake, we develop a novel intelligent relay assisted semantic communications, by enhancing communication efficiency, which creates a paradigm for text transmission fusion in 6G networks. In this contribution, the semantic communication system we have designed combines traditional deep learning methods with intelligent semantic relays, based on which, the protocols about minimizing the semantic errors by recovering the meaning of sentences for addressing channel variations issues. Meanwhile, our designed system could be applied in the case of wireless channel deterioration or knowledge background mismatch at the transmitter and receiver, and is also a paradigm for future applications in one-to-many and many-to-many semantic communication. At last, we propose a range of research directions and open challenges for boosting the implementations of relay assisted semantic communications.",,26-29 Marc,10.1109/WCNC55385.2023.10118657,https://ieeexplore.ieee.org/document/10118657,new
ieee:10118690,conference,Reinforcement Learning Aided Link Adaptation for Downlink NOMA Systems With Channel Imperfections,"Qu Luo, Zeina Mheich, Gaojie Chen, Pei Xiao, Zilong Liu","Non-orthogonal multiple access (NOMA) is a promising candidate radio access technology for future wireless communication systems, which can achieve improved connectivity and spectral efficiency. Without sacrificing error rate performance, link adaptation combining with adaptive modulation and coding (AMC) and hybrid automatic repeat request (HARQ) can provide better spectral efficiency and reliable data transmission by allowing both power and rate to adapt to channel fading and enabling re-transmissions. However, current AMC or HARQ schemes may not be preferable for NOMA systems due to the imperfect channel estimation and error propagation during successive interference cancellation (SIC). To address this problem, a reinforcement learning based link adaptation scheme for downlink NOMA systems is introduced in this paper. Specifically, we first analyze the throughput and spectrum efficiency of NOMA system with AMC combined with HARQ. Then, taking into account the imperfections of channel estimation and error propagation in SIC, we propose SINR and SNR based corrections to correct the modulation and coding scheme selection. Finally, reinforcement learning (RL) is developed to optimize the SNR and SINR correction process. Comparing with a conventional fixed look-up table based scheme, the proposed solutions achieve superior performance in terms of spectral efficiency and packet error performance.",,26-29 Marc,10.1109/WCNC55385.2023.10118690,https://ieeexplore.ieee.org/document/10118690,new
ieee:10118867,conference,Concatenated Classic and Neural (CCN) Codes: ConcatenatedAE,"Onur Günlü, Rick Fritschek, Rafael F. Schaefer","Small neural networks (NNs) used for error correction were shown to improve on classic channel codes and to address channel model changes. We extend the code dimension of any such structure by using the same NN under one-hot encoding multiple times, then serially-concatenated with an outer classic code. We design NNs with the same network parameters, where each Reed-Solomon codeword symbol is an input to a different NN. Significant improvements in block error probabilities for an additive Gaussian noise channel as compared to the small neural code are illustrated, as well as robustness to channel model changes.",,26-29 Marc,10.1109/WCNC55385.2023.10118867,https://ieeexplore.ieee.org/document/10118867,new
ieee:10118822,conference,An Efficient Soft-Input Soft-Output Decoder for Polar Codes in MIMO Iterative Detection System,"Anna Fominykh, Alexey Frolov, Kangjian Qin","Iterative detection and decoding (IDD) induces higher performance than separate detection and decoding schemes. However, IDD requires the exchange of soft information between the detector and decoder, thus decoders should be able to process soft input and provide soft output (SISO). Existing SISO polar decoders such as belief propagation (BP) and soft cancellation (SCAN) give poor block error rate (BLER) performance compared with cyclic redundancy check (CRC)-aided successive cancellation list (CA-SCL) decoders, whereas other more sophisticated SISO decoders have high complexity albeit good BLER performance. In this paper, an efficient SISO decoder that provides both high BLER performance and low complexity is proposed for polar codes in IDD system. Specifically, the proposed SISO decoder employs the sum-product algorithm over the sparse parity-check matrix representation of polar codes for lower complexity and uses the best candidates from list decoders for good error correction performance. We comprehensively evaluate the proposed SISO decoder performance in MIMO iterative system. Simulation results show that the proposed SISO decoder outperforms the existing SCAN and BP decoders and achieves similar BLER performance, but lower complexity compared with the state-of-the-art Soft List decoder.",,26-29 Marc,10.1109/WCNC55385.2023.10118822,https://ieeexplore.ieee.org/document/10118822,new
ieee:10118631,conference,Buffers optimization for multi-core decoders,"Emmanuel Boutillon, Cédric Marchand","For very high-speed satellite communication (up to 10 Gbit/s), the natural level of parallelism of a single decoder might be insufficient to achieve the decoding throughput. A known solution is to implement several decoder cores working in parallel. This solution entails efficient control and design of the input and output buffers to regulate the varying number of decoding iterations of each decoder. This paper presents a methodology to build such a system effectively for iterative decoders with stopping criteria. As an application, we present the result of the implementation of 3 DVB-S2/S2X decoders in a single FPGA. Simulation results of the whole system show performance within (or very close to) the standard requirements. The implementation can handle code rates from 13/45 (3.3 Gbit/s air throughput) up to 9/10 (10 Gbit/s air throughput) for several modulation sizes.",,26-29 Marc,10.1109/WCNC55385.2023.10118631,https://ieeexplore.ieee.org/document/10118631,new
ieee:10118615,conference,An Efficient Deep Learning-based Spectrum Awareness Approach for Vehicular Communication,"Basit A. Zaidi, Mahmoud A. Shawky, Ahmad Taha, Qammer H. Abbasi, Muhammad Ali Imran, Shuja Ansari","Intelligent transportation systems require a reliable exchange of information between network terminals in different vehicular communication environments. Making effective use of the dedicated spectrum is crucial to maximizing communication performance. This requires optimising the modulation order according to different channel conditions. This paper proposes a lightweight spectrum awareness methodology that uses wideband spectrum monitoring and deep learning-based modulation classification techniques to optimise the modulation order. We introduce a channel quality indicator block in which the classifier’s accuracy of detection is used as a forward indicator for the choice of the best modulation type for transmission. By using a 3D stochastic vehicular channel, we evaluate the classification performance at different channel parameter settings, including, speed, variance, and signal-to-noise ratio in urban and rural areas. The experimental analyses demonstrate the capability of the proposed approach to supporting a high detection probability for acceptable false decision-making ≤ 20%.",,26-29 Marc,10.1109/WCNC55385.2023.10118615,https://ieeexplore.ieee.org/document/10118615,new
ieee:10118851,conference,Learned Source and Channel Coding for Talking-Head Semantic Transmission,"Weijie Yue, Jincheng Dai, Sixian Wang, Zhongwei Si, Kai Niu","How to efficiently transmit a special video over wireless channels? While the established systems work by combining H.26x video coding and 5G LDPC channel coding, its end-to-end transmission efficiency is still far away from the extreme for video sources in a specific domain. In this paper, we seek to design a special semantic communication system tailored for transmitting video calling streams over the wireless channels. Inspired by the recent progress in talking-head animation, we propose a talking- head semantic transmission (THST) system, which can efficiently transmit motion keypoint representation as compact semantic information to drive the free-view talk-heading synthesis at the receiver. Since the motion semantic key points are correlated, our THST system learns a nonlinear analysis transform to map the key points across multiple frames into latent space, then transmits the latent hyper semantic representation to the receiver via deep joint source-channel coding. Our system incorporates a latent prior to estimate the importance diversity on the semantic key points, accordingly, we realize variable rate joint source-channel coding to obtain system level coding gain. Extensive experimental validation shows that our THST system outperforms engineered competing systems on benchmark datasets. Moreover, due to the system level joint source and channel design, our method provides much more robust performance over noisy channels with only 33% bandwidth cost versus the current talking-head compression combined with 5G LDPC coded transmission systems.",,26-29 Marc,10.1109/WCNC55385.2023.10118851,https://ieeexplore.ieee.org/document/10118851,new
ieee:10070946,conference,MGC: Multiple-Gray-Code for 3D NAND Flash based High-Density SSDs,"Yina Lv, Liang Shi, Qiao Li, Congming Gao, Yunpeng Song, Longfei Luo, Youtao Zhang","QLC (4-bit-per-cell) and more-bit-per-cell 3D NAND flash memories are increasingly adopted in large storage systems. While achieving significant cost reduction, these memories face degraded performance and reliability issues. The industry has adopted two-step programming (TSP), rather than one-step programming, to perform fine-granularity program control and choose gray-code encoding, as well as LDPC (Low-Density Parity-Check Code) for error correction. Different flash manufacturers often integrate different gray-codes in their products, which exhibit different performance and reliability characteristics. Unfortunately, a fixed gray-code encoding design lacks the ability to meet the dynamic read and program performance requirements at both application and device levels.In this paper, we propose MGC, a multiple-gray-code encoding strategy, that adaptively chooses the best gray-code to meet the optimization goals at runtime. In particular, MGC first extracts the performance and reliability requirements based on application-level access patterns and detects the reliability degree of SSD. It then determines the appropriate gray-code to encode the data, either from host/user application or due to garbage collection, before writing the pages to the flash memory. MGC is integrated in FTL (flash translation layer) and enhances the flash controller to enable runtime gray-code arbitration. We evaluate the proposed MGC scheme. The results show that MGC achieves better performance and lifetime guarantee compared with state-of-the-arts and introduces little overhead.",,25 Feb.-1 ,10.1109/HPCA56546.2023.10070946,https://ieeexplore.ieee.org/document/10070946,new
ieee:10139772,conference,Active Antenna Concept in Small Satellite Applications,Marin Nedelchev,"Satellite communications using small satellites is one of the driving forces of the modern society with applications including weather monitoring and forecast, space exploration, telecommunications, high speed data transfer. These applications require constant communication between the satellite and the Earth, which can be a challenge for conventional communication modules and antennas. The current digital back-end realization is based on field-programmable gate array with SDR based radio frequency back end in one module. This configuration arises a lot problems connected to the heat dissipation, electromagnetic compatibility, higher mechanical requirements, and power loss in the cables. This paper proposes active antenna approach to small satellite applications in order to overcome the aforementioned drawbacks of the current configuration.",,22-25 Marc,10.1109/ECTIDAMTNCON57770.2023.10139772,https://ieeexplore.ieee.org/document/10139772,new
ieee:10084886,conference,An Adaptive Exponential Min Sum Decoding Algorithm,"Zhang Weijia, Dushantha Nalin K. Jayakody","The belief propagation (BP) algorithm for low density parity check (LDPC) codes has proven to have excellent performance and is close to the Shannon limit. However, the high computational complexity is not conducive to realistic use. Although the min sum algorithm (MSA) improves the computational convenience and applicability. It also weakens its decoding capability. In order to improve the decoding performance of MSA and exploit the potential, this paper propose an adaptive exponential correction factor. This can improve the decoding performance of MSA. Adaptive exponential min sum algorithm (AEMSA) demonstrate a noticeable improvement over the normalized min sum algorithm (NMSA) and the BP algorithm in high signal to noise ratio (SNR). AEMSA is also a simple, efficient, low power consuming and highly potential decoding algorithm that can be applied in hardware implementations.",,20-22 Marc,10.1109/CIoT57267.2023.10084886,https://ieeexplore.ieee.org/document/10084886,new
ieee:10091988,conference,Signal-Code Constructions for Wideband Signals Based on M-Cpfsk and Non-Binary Error-Correcting Codes,"N. A. Kandaurov, E. O. Lobova, V. O. Varlamov, K. E. Telengator",The article is devoted to the development of signal-code structures (SCC) for low-energy broadband radio links. The SCC is based on multi-frequency signals with a continuous phase (M-Cpfsk) and non-binary error-correcting codes (Non-binary low-density parity-check and turbo-like). An analysis is made of signal-code structures for bands up to 10 MHz with different parameters. These signal-code structures can be used for command-telemetry radio links from unmanned aerial vehicle (UAVs).,,14-16 Marc,10.1109/IEEECONF56737.2023.10091988,https://ieeexplore.ieee.org/document/10091988,new
