ID,Type,Title,Authors,Abstract,Categories,Published,DOI,PDF URL,Status
ieee:10099052,conference,Bounds on Pairwise Error Probability for LDPC coded CF-mMIMO System,"Chetan Fadnis, Sonali Chouhan","Low-density parity-check (LDPC) codes have been adapted for the fifth and ensuing sixth-generation wireless systems to enhance the throughput and meet low-latency communication applications. In this paper, we investigate the performance of a cell-free (CF) massive multiple-input multiple-output (mMIMO) system wherein the subset of access points serve the users in a user-centric manner. We consider the uplink data transmission scenario wherein LDPC codes are used to encode the source signal transmitted by a user. We incorporate the M-ary quadrature amplitude modulation scheme and present the analytical framework to derive the closed-form expressions for the bounds on pairwise error probability (PEP) for the considered system. Monte Carlo simulations confirm the correctness of the derived bounds. Interestingly, results show that the simulated PEP approaches close to lower bound in a high signal-to-interference plus noise ratio (SINR) regime with an increasing modulation index. Further, in a dense network with more active users than the serving antennas at AP, simulated PEP is nearer to the upper bounds in a high SINR regime.",,8-11 March,10.1109/CCWC57344.2023.10099052,https://ieeexplore.ieee.org/document/10099052,new
ieee:10126878,conference,Improved Partial Retransmission Hard-Decision Message-Passing ARQ,"Usana Tuntoolavest, Thunchanok Julnipitawong, Visuttha Manthamkarn","The proposed improvement on hard-decision message-passing (hMP-ARQ) method can verify correct symbols when there is a group of common error symbols in a pair of check nodes. This leads to a better performance than the existing hMP-ARQ. At symbol error probability (Ps) of 0.2, the average numbers of frames for successful transmission were reduced to only 42% and 46% of the existing hMP-ARQ for (45,30) and (60,30) codes respectively. With lower complexity, it even performs better than block Vector Symbol Decoding ARQ (BVSD-ARQ) for a (60,30) LDPC code and Ps < 0.175. Thus, it is a good choice for partial retransmission ARQ.",,8-10 March,10.1109/iEECON56657.2023.10126878,https://ieeexplore.ieee.org/document/10126878,new
ieee:10117150,conference,114 Pbit/s∙km Transmission using Three Vendor-Installed 60-km Standard Cladding Multi-Core Fiber Spans with Multiple Fusion Splicing,"Daiki Soma, Shohei Beppu, Yuichi Miyagawa, Noboru Yoshikane, Takehiro Tsuritani","63.58 Tbit/s transmission has been experimentally demonstrated over 1,800-km standard cladding trench-assisted profile 4-core fiber (TA-4CF) with multiple connections using installed multivendor TA-4CF optical cables in aerial areas and underground ducts for practical deployment.",,5-9 March ,10.1364/OFC.2023.Tu2C.5,https://ieeexplore.ieee.org/document/10117150,new
ieee:10116787,conference,Long-Haul Unidirectional Transmission over Weakly-Coupled MCF with Distance-Insensitive Inter-Core Skew Spread,"Kohki Shibahara, Megumi Hoshi, Takashi Matsui, Takayoshi Mori, Kazuhide Nakajima, Yutaka Miyamoto","We demonstrate unidirectional 3000-km transmission over homogeneous step-index weakly-coupled multi-core fiber. Distance-insensitive pulse broadening is obtained by inline core-permutation without any fan-in/fan-out device, enabling inter-core-crosstalk cancellation at 3000 km only with 3-ns-processing window in MIMO-DSP.",,5-9 March ,10.1364/OFC.2023.M2B.5,https://ieeexplore.ieee.org/document/10116787,new
ieee:10116747,conference,Inline Optical Compensation of Group Delay Ripple for Long-haul Transmission Using Offloaded 2×2 MIMO Filter,"Masaki Sato, Manabu Arikawa, Hidemi Noguchi, Junichiro Matsui, Jun’ichi Abe, Emmanuel Le Taillandier de Gabory","We demonstrated inline optical compensation of group delay ripple estimated with offloaded 2×2 MIMO filter for 84-GBaud PM-PCS-16QAM over 10,200 km SMF. We showed 38 % reduction of MIMO taps, compared to the conventional method.",,5-9 March ,10.1364/OFC.2023.W3E.6,https://ieeexplore.ieee.org/document/10116747,new
ieee:10117022,conference,Adaptive Turbo Equalization of Probabilistically Shaped Constellations,"Edson Porto da Silva, Metodi Plamenov Yankov","Fiber nonlinearity compensation of probabilistically shaped constellations with adaptive turbo equalization is investigated for the first time. Potential for more than 100% transmission reach extension is demonstrated by combining probabilistic shaping, single-channel digital backpropagation, and adaptive turbo equalization.",,5-9 March ,10.1364/OFC.2023.Th2A.26,https://ieeexplore.ieee.org/document/10117022,new
ieee:10127107,conference,Comparative Error Rate Performance Analysis of Quasi Cyclic LDPC Codes For 5G Radio Channel,"Sonu Lal, Roopam Gupta, Rakesh Kumar Arya","Fifth Generation New radio (5G) is in final stage for freezing frequency band by Release 16in between 1 GHz to 43 GHz. It is also attracting much attention because of short length and long length data transfer with high speed and low latency time resulting error rate performance will degrade. Researchers are thus in continuous working on construction of more efficient regular Quasi Cyclic LDPC Code with parity check matrices of column weight two on half code rate. We suggest is a construction of regular quasi-cyclic LDPC codes with parity-check matrices of column weight two have good capability to correct bursts errors of erasures that provides benefits in terms of the error rate performance. This paper presents fundamental concepts, review study and comparative analysis which carried out by different methods of constructions QC-LDPC codes for better BER, FER calculation and improved coding gain using latest techniques.",,4-5 March ,10.1109/IHCSP56702.2023.10127107,https://ieeexplore.ieee.org/document/10127107,new
ieee:10115816,conference,Low-Density Parity Check-Code in DVB-S2 versus Polar Code under SATCOM Fading,"Richard Lahman, Hyuck M. Kwon","In wireless terrestrial or satellite communications systems, the communication system engineers use many factors and techniques to combat the channel degradation. For example, the digital video broadcasting – second generation (DVB-S2) satellite communication system includes the adaptive code modulation (ACM), i.e., various combinations of modulation types and forward error correction (FEC) code rates. The Bose-Chaudhuri-Hocquenghem (BCH) code and low-density parity-check (LDPC) with various code rates are used as FEC codes to reduce the channel degradation. On the other hand, the polar FEC code is a more recently developed technique than the LDPC FEC code and has been used in fifth-generation (5G), third-generation partnership project (3GPP) wireless terrestrial communications to improve the channel capacity. The 5G 3GPP terrestrial communications also use the orthogonal frequency-division multiplexing (OFDM) modulation in addition to the polar FEC code. The objective of this paper is to study how to replace the LDPC FEC code in the DVB-S2 satellite communication system with the 5G terrestrial polar FEC code and OFDM, and compare bit error rate (BER) performance under the multipath Rayleigh fading channel environment. All other components in the DVB-S2 system, such as code word length, interleaver size, modulation, etc., are unchanged. This paper investigates the performance of the DVB-S2 ACM scheme by replacing the LDPC FEC code with the polar FEC code, and presents the required symbol energy-to-noise power spectral density ratio to achieve a BER equal to 10−5. Then, this paper claims that performance over the current DVB-S2 communication system can be enhanced by using the polar FEC code and OFDM.",,4-11 March,10.1109/AERO55745.2023.10115816,https://ieeexplore.ieee.org/document/10115816,new
ieee:10115825,conference,Relay Planning in the Perseverance Rover's First 600 Solar Days on Mars,"Emma Young, Genevie Yang, Travis Wagner, Flora Ridenhour, Christopher Lawler, Nagin Cox","Since landing in Jezero Crater on Mars on February 18, 2021, the Mars 2020 mission's Perseverance rover has been performing daily operations on the Martian surface and has been collecting samples that may one day be returned to Earth. The majority of science and engineering data from the Perseverance rover is returned through the Mars orbiters operated by the National Aeronautics and Space Administration (NASA) and the European Space Agency (ESA) that make up the Mars Relay Network: Mars Reconnaissance Orbiter (MRO), Mars Odyssey (ODY), Mars Atmosphere and Volatile Evolution (MAVEN), and Trace Gas Orbiter (TGO). Prior to the rover's landing, the Mars 2020 team joined the Mars Relay Network to begin planning relay through the coordinated, multi-mission process that is the cornerstone of relay planning. The Perseverance rover has now been on the Martian surface for more than 600 Martian solar days (“sols”) with several UHF relay sessions planned and executed per sol. The Mars 2020 relay planning team has established and improved upon the recurring process and tool suite to enable both data return and forward link of rover uplink products, and continues to coordinate and negotiate relay asset usages and constraints with the Mars Science Laboratory and Insight relay planning teams. Among many accomplishments, the relay planning team has supported checkouts and commissioning of Low-Density Parity-Check (LDPC) relay link configurations, the mission's first solar conjunction period, and several rover flight software transitions. The Mars 2020 team has also been performing a checkout and commissioning campaign for the use of bitstream, or “unreliable”, relay sessions. Nominal use of bitstream relay is a new operational capability intended for the Perseverance rover that will allow specific science or engineering activities to run in parallel with the relay session, rather than pausing all other activities during relay, enabling additional and more timely data return. Pending the completion of the checkout and commissioning campaign, the operations team plans to approve and begin regular scheduling and use of bitstream UHF relay sessions beginning in 2023. This paper describes the Mars 2020 relay planning processes and tool architecture, key accomplishments (including progress for the bitstream checkout and commissioning campaign), and lessons learned and ongoing challenges during the first 600 sols of the Mars 2020 surface mission.",,4-11 March,10.1109/AERO55745.2023.10115825,https://ieeexplore.ieee.org/document/10115825,new
ieee:10115701,conference,Modular Low SWaP-C SmallSats with Advanced Communications for Space Exploration,"Patrick Collier, Mehmet Adalier, Ali Luna Guarneros","NASA is pursuing rapid identification, development and testing of key technologies that further advance the capabilities of small spacecraft platforms to accelerate the pace of space exploration, scientific discovery and the expansion of space commerce in a sustainable manner. Under a NASA funded Lunar Sequential project titled “Efficient and Secure Communications for Spacecraft Beyond LEO,” Antara has been developing modular SpaceVNX+ based small spacecraft and a software package for secure, efficient, and scalable Delay and Disruption Tolerant Networking (DTN) communications for distributed platforms. The paper describes the SpaceVNX+ standard and the CubeSat platform that will host the soft-ware; the LunaNet compatible DTN software, taraION; and the planned Low Earth Orbit (LEO) mission to flight qualify the hardware and software. The LEO mission will be comprised of a small swarm of six SpaceVNX+ CubeSats that will demonstrate secure DTN and autonomous communications between ground stations and CubeSats as well as among the CubeSats. As a case study, the paper also covers the details and analysis of benchtop testing of the mission software and hardware. These emerging capabilities have the potential to make possible new mission architectures, enhance conventional missions and reduce development and deployment timelines, which will enable NASA and other space mission operators to achieve their objectives at significantly lower programmatic risk and cost than traditional approaches.",,4-11 March,10.1109/AERO55745.2023.10115701,https://ieeexplore.ieee.org/document/10115701,new
ieee:10112201,conference,An Efficient Image Encryption Reversible Data Hiding Technique to Improve Payload and High Security in Cloud Platforms,"S.S Neetha, J Bhuvana, R Suchithra","Researchers are becoming more intrigued by images (RDHEI) since of its potential applications in areas like privacy protection and cloud storage. If you need to include more information in the encrypted domain, RDHEI is a useful method that won’t compromise your security. An RDHEI technique is proposed in this paper, which is both fully reversible and capable of embedding a large payload. Once the content owner has encrypted the original picture via homomorphism encryption, the hider may insert the secret statistics into the encrypted portion of the image. Privacy may be protected via the use of data concealing in images. It employs a slew of deceptive techniques to conceal sensitive information. Heavily altering a histogram may make hidden information much harder to find. Additionally, the data is not expanded during homomorphism encryption, and the payload is still capable of being enhanced. The recipient of the encrypted watermarked picture needs just the data concealing key in order to access the hidden information. To decode a picture, all the recipient has to know is the encryption key. Having both the data concealing key and the encryption allows the receiver to decrypt the picture and restore the original data without any quality loss. The receiver will be able to decipher the secret communication and restore the unique picture with zero quality loss. The experimental results demonstrate not only an enhancement of the embedding payload, but also an exact extraction of the concealed data and a complete retrieval of the cover picture.",,3-4 March ,10.1109/ISCON57294.2023.10112201,https://ieeexplore.ieee.org/document/10112201,new
ieee:10113442,conference,Low Error Floor QC-LDPC Codes Construction Using Modified Cole's Trapping Sets Enumerating,Vasiliy S. Usatyuk,"In order to count the number of trapping sets (TS), we changed Cole's Importance Sampling (IS) approach, which led to a message-passing decoder problem. Several concepts have been combined to suggest improvements to Cole's IS: utilizing short cycles and simultaneous TS impulse tree decomposition, un-wrapping of message passing iterations Tanner Graph/Forney's Normal Graph symmetry's Graph Authomorphism is a complex yet simple concept. Superior Velasquez-Subramani and Karimi-Banihashemi TS enumerating techniques were supported. The proposed technique under PEG (1008, 504) Mackay code for single thread implementation is 43 times quicker than the original Cole's method and 5027 times (71463 times, multi-thread) faster than the Velasquez-Subramani LP method. For the TS enumerating problem at (2640, 1320), Margulis's code is 37958 times quicker than the suggested Velasquez-Subramani LP approach for single thread implementation, 82 times faster than Karimi-Banihashemi, and 134 times faster than Cole's original solution. On the basis of the creation of QC-LDPC codes, we demonstrate the effects of improved EMD spectrum and increased hamming distance on the TS spectrum and BER/FER error-floor level.",,29-31 Marc,10.1109/DSPA57594.2023.10113442,https://ieeexplore.ieee.org/document/10113442,new
ieee:10113447,conference,An Approach to Routes Enumeration in QC LDPC Base Matrices,"Aleksei Kharin, Konstantin Zavertkin, Sergei Ganin",This paper presents an approach to routes enumeration in QC LDPC base matrices. The approach is based on a tree search and allows to enumerate routes of arbitrary length in base matrices with circulants weight more than one. Equivalent cycles elimination mechanism and balanced cycle detection technique are included. Proposed approach also allows to build EMD-spectre for base matrices.,,29-31 Marc,10.1109/DSPA57594.2023.10113447,https://ieeexplore.ieee.org/document/10113447,new
ieee:10113403,conference,2D/3D ResNet Deep Neural Network for 4G and 5G NR Wireless Channel Estimation,"Vasiliy S. Usatyuk, Sergey I. Egorov","For estimating the MIMO channels for both the uplink and the downlink, we used residual deep neural network. The proposed residual deep neural network (ResNET) channel estimation outperforms the MMSE channel estimation by more than 2 dB under EPA uplink channels and is capable of operating on untrained wireless channels. According to the 3GPP NR release 15 standard, the proposed 3D ResNET channel estimation approach exhibits a 0.5 to 1 dB gap to the ideal channel estimation and a 1 to 1.6 dB gain over MMSE channel estimation for 5G New Radio (NR) physical layer links, including demodulation reference symbols (DM-RS Type 2) and synchronization signal (SS) bursts periodicity (30 ms), DL-SCH transport channel coding modulation and coding scheme 13 (MCS), code rate 490 over 1024 under 15 iterations of Normalize Min-sum 5G eMBB LDPC decoder with scale 0.75, HARQ off (no retransmissions), PDSCH precoding using SVD (PDSCH Mapping Type A, 4×4 antennas), 20 resource blocks (240 subcariers), clustered delay line (CDL-C) channel with subcarier spacing 30kHZ, delay spread 300e-9, doppler shift 5Hz, central frequency 3.5GHz demonstrates a 0.5 to 1 dB gap to the perfect channel estimate and a gain of between 1 and 1.6 dB over MMSE channel estimation. The suggested solution enables a 25% boost in 5G NR throughput.",,29-31 Marc,10.1109/DSPA57594.2023.10113403,https://ieeexplore.ieee.org/document/10113403,new
ieee:10110831,conference,The Computational Schemes of a Noise-Resistant Coding for Autonomous Robotic Complexes,"Evgeny A. Titenko, Oleg G. Dobroserdov, Dmitry P. Teterin","The article is shows to the approach to the hardware implementation of arithmetic operations in finite Gaul fields. Application area - control of ""short"" messages between mobile interacting robots. The goal is to reduce the hardware costs of functional units involved in error-correcting coding. The solution method is based on the use of a tabular transition to the logarithmic representation of the elements of the Galois field and the processing of logarithms of numbers. The article shows the features of the implementation of arithmetic operations in finite Galois fields. Calculation approaches in Galois fields were considered: iterative processing of polynomials, processing of field elements based on a programmable logic matrix, transition from numbers to powers, and processing of powers. The evaluation of the hardware and time complexity of the computational cores of the Galois processor is carried out. It has been established that the hardware implementation of the Galois processor core based on a table transformation has an advantage of 1.3 times for a practically significant capacity of the Galois field - 8 bits compared to the hardware implementation on a programmable logic matrix.",,27-31 Marc,10.1109/SmartIndustryCon57312.2023.10110831,https://ieeexplore.ieee.org/document/10110831,new
ieee:10118280,conference,Reliability of 3D NAND Flash for Future Storage Systems (Invited),"Akira Goda, Kishore Kumar Muchherla, Peter Feeley","The 3D NAND Flash technologies have been successful, having realized the high density, high performance and highly reliable storage systems. With the continuous technology scaling, significant challenges and opportunities are expected in the future. SLC NAND technology plays a critical role for the high performance systems. The increased block size with further layer stacking requires innovative solutions to realize enhanced system performance and cost scaling. For the bits per cell (BPC) scaling beyond QLC, the reduction of the total cost of ownership (TCO) at the system level is the key. In this paper, we review and discuss the challenges and opportunities of 3D NAND reliability from the storage system perspectives.",,26-30 Marc,10.1109/IRPS48203.2023.10118280,https://ieeexplore.ieee.org/document/10118280,new
ieee:10118720,conference,"The Best, the Requested, and the Default Elementary Check Node for EMS NB-LDPC Decoder","Joseph Jabour, Cédric Marchand, Emmanuel Boutillon","Non-Binary LDPC codes are known to have good decoding capability and high decoding complexity. Therefore, their utilization is limited to low-rate applications such as BeiDou, the Chinese Global Navigation Satellite Systems. Recently, a new decoding algorithm called the Best, Requested, and Default algorithm has been proposed. The algorithm significantly reduces the size of exchanged messages between the variable nodes and check nodes leading to simplifying the hardware architecture. This paper presents the adaptation and the impact of the algorithm on the Extended Min-Sum Forward-Backward check node processor. The proposed decoder is simulated for several code rates and negligible degradation is observed compared to the classical EMS algorithm. In addition, the proposed decoder is synthesized on FPGA in a fully-parallel fashion. The proposed decoder requires only 42% of the memory allocations and 85% of the computational resources of the classical EMS decoder.",,26-29 Marc,10.1109/WCNC55385.2023.10118720,https://ieeexplore.ieee.org/document/10118720,new
ieee:10118633,conference,Fully Parallel Fully Unrolled BP Decoding of LDPC and Polar Codes,"Alireza Hasani, Lukasz Lopacinski, Milos Krstic, Eckhard Grass","Low-Density Parity-Check (LDPC) and polar codes are two classes of channel codes potentially able to achieve the channel capacity, and both are used in current 5G communication systems. Belief Propagation (BP), which is the main decoding algorithm for LDPC codes could also be used for decoding polar codes. A fully parallel fully unrolled BP decoding architecture has been recently proposed for both of these codes. In this paper, we investigate these two architectures further and compare the two codes from the viewpoint of Bit-Error Rate (BER) performance, achieved throughput, latency, chip area, and also energy efficiency. Toward that, both architectures have been synthesized in a 28 nm CMOS technology, and corresponding results are provided.",,26-29 Marc,10.1109/WCNC55385.2023.10118633,https://ieeexplore.ieee.org/document/10118633,new
ieee:10118642,conference,Learning to Decode Protograph LDPC Codes over Fadings with Imperfect CSIs,"Chen Yang, Yanan Zhou, Zhongwei Si, Jincheng Dai","Recently a number of low-density parity-check (LDPC) decoding algorithms based on deep learning have been proposed in the literature. However, most of the work has been targeted for additive white Gaussian noise (AWGN) channels. For more practical scenarios, in this paper we investigate the neural-network based min-sum (MS) decoding for protograph LDPC codes in fading channels. Since the wireless channel is complex and varying, accurate channel state information (CSI) cannot be always available at the receiver. We classify the scenarios into three cases with perfect CSIs, imperfect CSIs, and no CSIs. By assigning learnable weights on the edges in the iterative decoding, the proposed neural decoder compensates for the performance loss caused by the error/lack of CSIs. The trajectory-based extrinsic information transfer (T-EXIT) chart is employed as a theoretical tool to select the proper training dataset for the neural network and the proper channel initialization scheme for the receiver. Numerical results in terms of block error rates are provided, which agree with the T-EXIT analysis. It can be seen that the proposed neural MS decoder clearly outperforms the traditional MS algorithm in Rayleigh fading channels. Meanwhile, the proposed decoder shows a good compatibility so that it can be applied to the cases with different accuracy of CSIs.",,26-29 Marc,10.1109/WCNC55385.2023.10118642,https://ieeexplore.ieee.org/document/10118642,new
ieee:10119062,conference,CRC in Coded Schemes with Bounded-Distance Decoding,Khaled A. S. Abdel-Ghaffar,"The undetected error probability of CRC combined with an error-correcting code with bounded-distance decoding is considered. It is shown that to minimize this probability, the CRC polynomial should be matched to the code. In particular, good CRC polynomials reported in the literature for pure CRC schemes may not be good when combined with coding. Guidelines to choose a good CRC polynomial to be combined with a given code are provided.",,26-29 Marc,10.1109/WCNC55385.2023.10119062,https://ieeexplore.ieee.org/document/10119062,new
