ID,Type,Title,Authors,Abstract,Categories,Published,DOI,PDF URL,Status
ieee:10115701,conference,Modular Low SWaP-C SmallSats with Advanced Communications for Space Exploration,"Patrick Collier, Mehmet Adalier, Ali Luna Guarneros","NASA is pursuing rapid identification, development and testing of key technologies that further advance the capabilities of small spacecraft platforms to accelerate the pace of space exploration, scientific discovery and the expansion of space commerce in a sustainable manner. Under a NASA funded Lunar Sequential project titled “Efficient and Secure Communications for Spacecraft Beyond LEO,” Antar...",,4-11 March,10.1109/AERO55745.2023.10115701,https://ieeexplore.ieee.org/document/10115701,new
ieee:10115724,conference,Flexible User Radio for Lunar Missions,"Roger Dendy, Dale Mortensen, Daniel Zeleznikar, Stephanie Booth","NASA&#39;s Artemis program and other lunar exploration and development programs are planning over 40 lunar missions before 2030. Lunar missions, both crewed and uncrewed, include orbiters, landers, rovers, and surface stations. All these missions require communications with Earth, either via Direct to Earth (DTE) links or through relays in lunar orbit. Multiple DTE options are available among existing...",,4-11 March,10.1109/AERO55745.2023.10115724,https://ieeexplore.ieee.org/document/10115724,new
ieee:10115989,conference,Diversity Techniques for Multipath Fading Channels between Earth and the Moon,"Dariush Divsalar, Marc Sanchez Net, Kar-Ming Cheung, Nader Damavandi, Alazar Tamrat","In this paper we design and analyze a communication system between a lander/rover on the surface of the lunar South Pole and an Earth station. To communicate to and from the lander/rover on the lunar South Pole, low and/or medium directional antennas onboard the lander/rover will have to be pointed at low elevation angles, thus causing multipath fading effects due to reflection of a portion of the...",,4-11 March,10.1109/AERO55745.2023.10115989,https://ieeexplore.ieee.org/document/10115989,new
ieee:10112201,conference,An Efficient Image Encryption Reversible Data Hiding Technique to Improve Payload and High Security in Cloud Platforms,"S.S Neetha, J Bhuvana, R Suchithra","Researchers are becoming more intrigued by images (RDHEI) since of its potential applications in areas like privacy protection and cloud storage. If you need to include more information in the encrypted domain, RDHEI is a useful method that won’t compromise your security. An RDHEI technique is proposed in this paper, which is both fully reversible and capable of embedding a large payload. Once the...",,3-4 March ,10.1109/ISCON57294.2023.10112201,https://ieeexplore.ieee.org/document/10112201,new
ieee:10113442,conference,Low Error Floor QC-LDPC Codes Construction Using Modified Cole's Trapping Sets Enumerating,Vasiliy S. Usatyuk,"In order to count the number of trapping sets (TS), we changed Cole&#39;s Importance Sampling (IS) approach, which led to a message-passing decoder problem. Several concepts have been combined to suggest improvements to Cole&#39;s IS: utilizing short cycles and simultaneous TS impulse tree decomposition, un-wrapping of message passing iterations Tanner Graph/Forney&#39;s Normal Graph symmetry&#39;s Graph Authomor...",,29-31 Marc,10.1109/DSPA57594.2023.10113442,https://ieeexplore.ieee.org/document/10113442,new
ieee:10113447,conference,An Approach to Routes Enumeration in QC LDPC Base Matrices,"Aleksei Kharin, Konstantin Zavertkin, Sergei Ganin",This paper presents an approach to routes enumeration in QC LDPC base matrices. The approach is based on a tree search and allows to enumerate routes of arbitrary length in base matrices with circulants weight more than one. Equivalent cycles elimination mechanism and balanced cycle detection technique are included. Proposed approach also allows to build EMD-spectre for base matrices.,,29-31 Marc,10.1109/DSPA57594.2023.10113447,https://ieeexplore.ieee.org/document/10113447,new
ieee:10113403,conference,2D/3D ResNet Deep Neural Network for 4G and 5G NR Wireless Channel Estimation,"Vasiliy S. Usatyuk, Sergey I. Egorov","For estimating the MIMO channels for both the uplink and the downlink, we used residual deep neural network. The proposed residual deep neural network (ResNET) channel estimation outperforms the MMSE channel estimation by more than 2 dB under EPA uplink channels and is capable of operating on untrained wireless channels. According to the 3GPP NR release 15 standard, the proposed 3D ResNET channel ...",,29-31 Marc,10.1109/DSPA57594.2023.10113403,https://ieeexplore.ieee.org/document/10113403,new
ieee:10110831,conference,The Computational Schemes of a Noise-Resistant Coding for Autonomous Robotic Complexes,"Evgeny A. Titenko, Oleg G. Dobroserdov, Dmitry P. Teterin",The article is shows to the approach to the hardware implementation of arithmetic operations in finite Gaul fields. Application area - control of &#34;short&#34; messages between mobile interacting robots. The goal is to reduce the hardware costs of functional units involved in error-correcting coding. The solution method is based on the use of a tabular transition to the logarithmic representation of the...,,27-31 Marc,10.1109/SmartIndustryCon57312.2023.10110831,https://ieeexplore.ieee.org/document/10110831,new
ieee:10118280,conference,Reliability of 3D NAND Flash for Future Storage Systems (Invited),"Akira Goda, Kishore Kumar Muchherla, Peter Feeley","The 3D NAND Flash technologies have been successful, having realized the high density, high performance and highly reliable storage systems. With the continuous technology scaling, significant challenges and opportunities are expected in the future. SLC NAND technology plays a critical role for the high performance systems. The increased block size with further layer stacking requires innovative s...",,26-30 Marc,10.1109/IRPS48203.2023.10118280,https://ieeexplore.ieee.org/document/10118280,new
ieee:10118720,conference,"The Best, the Requested, and the Default Elementary Check Node for EMS NB-LDPC Decoder","Joseph Jabour, Cédric Marchand, Emmanuel Boutillon","Non-Binary LDPC codes are known to have good decoding capability and high decoding complexity. Therefore, their utilization is limited to low-rate applications such as BeiDou, the Chinese Global Navigation Satellite Systems. Recently, a new decoding algorithm called the Best, Requested, and Default algorithm has been proposed. The algorithm significantly reduces the size of exchanged messages betw...",,26-29 Marc,10.1109/WCNC55385.2023.10118720,https://ieeexplore.ieee.org/document/10118720,new
ieee:10118633,conference,Fully Parallel Fully Unrolled BP Decoding of LDPC and Polar Codes,"Alireza Hasani, Lukasz Lopacinski, Milos Krstic, Eckhard Grass","Low-Density Parity-Check (LDPC) and polar codes are two classes of channel codes potentially able to achieve the channel capacity, and both are used in current 5G communication systems. Belief Propagation (BP), which is the main decoding algorithm for LDPC codes could also be used for decoding polar codes. A fully parallel fully unrolled BP decoding architecture has been recently proposed for both...",,26-29 Marc,10.1109/WCNC55385.2023.10118633,https://ieeexplore.ieee.org/document/10118633,new
ieee:10118642,conference,Learning to Decode Protograph LDPC Codes over Fadings with Imperfect CSIs,"Chen Yang, Yanan Zhou, Zhongwei Si, Jincheng Dai","Recently a number of low-density parity-check (LDPC) decoding algorithms based on deep learning have been proposed in the literature. However, most of the work has been targeted for additive white Gaussian noise (AWGN) channels. For more practical scenarios, in this paper we investigate the neural-network based min-sum (MS) decoding for protograph LDPC codes in fading channels. Since the wireless ...",,26-29 Marc,10.1109/WCNC55385.2023.10118642,https://ieeexplore.ieee.org/document/10118642,new
ieee:10119062,conference,CRC in Coded Schemes with Bounded-Distance Decoding,Khaled A. S. Abdel-Ghaffar,"The undetected error probability of CRC combined with an error-correcting code with bounded-distance decoding is considered. It is shown that to minimize this probability, the CRC polynomial should be matched to the code. In particular, good CRC polynomials reported in the literature for pure CRC schemes may not be good when combined with coding. Guidelines to choose a good CRC polynomial to be co...",,26-29 Marc,10.1109/WCNC55385.2023.10119062,https://ieeexplore.ieee.org/document/10119062,new
ieee:10118717,conference,Image Segmentation Semantic Communication over Internet of Vehicles,"Qiang Pan, Haonan Tong, Jie Lv, Tao Luo, Zhilong Zhang, Changchuan Yin, Jianfeng Li","In this paper, the problem of semantic-based efficient image transmission is studied over the Internet of Vehicles (IoV). In the considered model, a vehicle shares massive amount of visual data perceived by its visual sensors to assist other vehicles in making driving decisions. However, it is hard to maintain a high reliable visual data transmission due to the limited spectrum resources. To tackl...",,26-29 Marc,10.1109/WCNC55385.2023.10118717,https://ieeexplore.ieee.org/document/10118717,new
ieee:10118657,conference,An Investigation on Intelligent Relay assisted Semantic Communication Networks,"Shaobo Ma, Wei Liang, Boxuan Zhang, Dawei Wang","With the development of sixth generation (6G) networks, semantic communication is treated as an emerging technology to provide more intelligent communication between two parties for enhance the accuracy and efficiency of communications. Whereas, it demands to merge all physical layer blocks in the conventional communications, which heavily deteriorates the spectrum sparsity problem of wireless com...",,26-29 Marc,10.1109/WCNC55385.2023.10118657,https://ieeexplore.ieee.org/document/10118657,new
ieee:10118690,conference,Reinforcement Learning Aided Link Adaptation for Downlink NOMA Systems With Channel Imperfections,"Qu Luo, Zeina Mheich, Gaojie Chen, Pei Xiao, Zilong Liu","Non-orthogonal multiple access (NOMA) is a promising candidate radio access technology for future wireless communication systems, which can achieve improved connectivity and spectral efficiency. Without sacrificing error rate performance, link adaptation combining with adaptive modulation and coding (AMC) and hybrid automatic repeat request (HARQ) can provide better spectral efficiency and reliabl...",,26-29 Marc,10.1109/WCNC55385.2023.10118690,https://ieeexplore.ieee.org/document/10118690,new
ieee:10118867,conference,Concatenated Classic and Neural (CCN) Codes: ConcatenatedAE,"Onur Günlü, Rick Fritschek, Rafael F. Schaefer","Small neural networks (NNs) used for error correction were shown to improve on classic channel codes and to address channel model changes. We extend the code dimension of any such structure by using the same NN under one-hot encoding multiple times, then serially-concatenated with an outer classic code. We design NNs with the same network parameters, where each Reed-Solomon codeword symbol is an i...",,26-29 Marc,10.1109/WCNC55385.2023.10118867,https://ieeexplore.ieee.org/document/10118867,new
ieee:10118822,conference,An Efficient Soft-Input Soft-Output Decoder for Polar Codes in MIMO Iterative Detection System,"Anna Fominykh, Alexey Frolov, Kangjian Qin","Iterative detection and decoding (IDD) induces higher performance than separate detection and decoding schemes. However, IDD requires the exchange of soft information between the detector and decoder, thus decoders should be able to process soft input and provide soft output (SISO). Existing SISO polar decoders such as belief propagation (BP) and soft cancellation (SCAN) give poor block error rate...",,26-29 Marc,10.1109/WCNC55385.2023.10118822,https://ieeexplore.ieee.org/document/10118822,new
ieee:10118805,conference,Detecting Linear Block Codes via Deep Learning,"Arti Yardi, Vamshi Krishna Kancharla, Amrita Mishra","In the channel code detection problem, given a sequence of noise-affected codewords generated by an unknown code, the aim is to identify the correct channel code from the given set of potential codes. This problem has many applications in military spectrum surveillance and in cognitive radios. In this paper, we consider the situation when the set of potential channel codes consists of two linear b...",,26-29 Marc,10.1109/WCNC55385.2023.10118805,https://ieeexplore.ieee.org/document/10118805,new
ieee:10118631,conference,Buffers optimization for multi-core decoders,"Emmanuel Boutillon, Cédric Marchand","For very high-speed satellite communication (up to 10 Gbit/s), the natural level of parallelism of a single decoder might be insufficient to achieve the decoding throughput. A known solution is to implement several decoder cores working in parallel. This solution entails efficient control and design of the input and output buffers to regulate the varying number of decoding iterations of each decod...",,26-29 Marc,10.1109/WCNC55385.2023.10118631,https://ieeexplore.ieee.org/document/10118631,new
ieee:10118615,conference,An Efficient Deep Learning-based Spectrum Awareness Approach for Vehicular Communication,"Basit A. Zaidi, Mahmoud A. Shawky, Ahmad Taha, Qammer H. Abbasi, Muhammad Ali Imran, Shuja Ansari",Intelligent transportation systems require a reliable exchange of information between network terminals in different vehicular communication environments. Making effective use of the dedicated spectrum is crucial to maximizing communication performance. This requires optimising the modulation order according to different channel conditions. This paper proposes a lightweight spectrum awareness meth...,,26-29 Marc,10.1109/WCNC55385.2023.10118615,https://ieeexplore.ieee.org/document/10118615,new
ieee:10118851,conference,Learned Source and Channel Coding for Talking-Head Semantic Transmission,"Weijie Yue, Jincheng Dai, Sixian Wang, Zhongwei Si, Kai Niu","How to efficiently transmit a special video over wireless channels? While the established systems work by combining H.26x video coding and 5G LDPC channel coding, its end-to-end transmission efficiency is still far away from the extreme for video sources in a specific domain. In this paper, we seek to design a special semantic communication system tailored for transmitting video calling streams ov...",,26-29 Marc,10.1109/WCNC55385.2023.10118851,https://ieeexplore.ieee.org/document/10118851,new
ieee:10118612,conference,Implementation of chaotic frequency modulation based spread spectrum communication system in software-defined radio,"Arturs Aboltins, Filips Capligins, Nikolajs Hasjuks, Andreas Ahrens",This paper is devoted to the software-defined radio (SDR) implementation of frequency modulated antipodal chaos shift keying (FM-ACSK) communication system. This novel and perspective class of spread-spectrum systems employs chaotic synchronization for the acquisition and tracking of the spreading signal and does not need resource-demanding cross-correlation usually employed for this purpose. This...,,26-29 Marc,10.1109/WCNC55385.2023.10118612,https://ieeexplore.ieee.org/document/10118612,new
ieee:10119031,conference,Non-Orthogonal Multiple Access via Non-binary Factor Graphs,"Xinyi Sui, Zhongwei Si, Jincheng Dai, Sen Wang, Yifei Yuan","In this paper we propose a novel non-orthogonal multiple access (NOMA) scheme via non-binary factor graphs by introducing operations over Galois field GF(q). By utilizing sparse GF(q) spreading, the proposed scheme benefits from an improved diversity of the superimposed symbols and accordingly a lower probability of constellation overlapping. Meanwhile, the coordination with high-order modulation ...",,26-29 Marc,10.1109/WCNC55385.2023.10119031,https://ieeexplore.ieee.org/document/10119031,new
ieee:10070946,conference,MGC: Multiple-Gray-Code for 3D NAND Flash based High-Density SSDs,"Yina Lv, Liang Shi, Qiao Li, Congming Gao, Yunpeng Song, Longfei Luo, Youtao Zhang","QLC (4-bit-per-cell) and more-bit-per-cell 3D NAND flash memories are increasingly adopted in large storage systems. While achieving significant cost reduction, these memories face degraded performance and reliability issues. The industry has adopted two-step programming (TSP), rather than one-step programming, to perform fine-granularity program control and choose gray-code encoding, as well as L...",,25 Feb.-1 ,10.1109/HPCA56546.2023.10070946,https://ieeexplore.ieee.org/document/10070946,new
ieee:10116987,conference,Monte Carlo Simulation of the Non-Systematic and Systematic Polar Codes,"Navin Kumar, Deepak Kedia, Gaurav Purohit","To recreate the sent signal, we have spent the last few decades looking for methods that will decrease the effect of noise to a considerable amount. A brand-new idea created by Erdal Arikan is known as polar codes. The 3GPP standardized the polar codes for correcting the errors in the 5G control channels due to its unique property of splitting the channel into good and bad channels according to th...",,23-24 Marc,10.1109/SPIN57001.2023.10116987,https://ieeexplore.ieee.org/document/10116987,new
ieee:10125889,conference,A Novel Wireless Radio Technology Paradigm for Next Generation Wireless Networks,"Prabakaran Kasinathan, M Angulakshmi, Iswarya K, D. Elangovan, K. Chanthirasekaran, G Parthasarathy","A fifth-generation network is the need of the people in the year 2020 and it had been deployed all over the world. The drawbacks of the fifth-generation network include data rate, efficiency, reliability, processing, coverage globally, density. This has led to the progress of technology. There had been an increased need for a high-security system (RAT) has been developed. The next-generation wirel...",,23-24 Marc,10.1109/ICSPC57692.2023.10125889,https://ieeexplore.ieee.org/document/10125889,new
ieee:10139772,conference,Active Antenna Concept in Small Satellite Applications,Marin Nedelchev,"Satellite communications using small satellites is one of the driving forces of the modern society with applications including weather monitoring and forecast, space exploration, telecommunications, high speed data transfer. These applications require constant communication between the satellite and the Earth, which can be a challenge for conventional communication modules and antennas. The curren...",,22-25 Marc,10.1109/ECTIDAMTNCON57770.2023.10139772,https://ieeexplore.ieee.org/document/10139772,new
ieee:10125350,conference,Practical construction of sensing matrices for a greedy sparse recovery algorithm over finite fields,"Mégane Gammoudi, Christian Scheunert, Giang T. Nguyen, Frank Fitzek","Compressed sensing aims to retrieve sparse signals from very few samples. It relies on dedicated reconstruction algorithms and well-chosen measurement matrices. In combination with network coding, which operates traditionally over finite fields, it leverages the benefits of both techniques. However, compressed sensing has been primarily investigated over the real field. F2OMP is one of the few rec...",,21-24 Marc,10.1109/DCC55655.2023.00020,https://ieeexplore.ieee.org/document/10125350,new
ieee:10084886,conference,An Adaptive Exponential Min Sum Decoding Algorithm,"Zhang Weijia, Dushantha Nalin K. Jayakody","The belief propagation (BP) algorithm for low density parity check (LDPC) codes has proven to have excellent performance and is close to the Shannon limit. However, the high computational complexity is not conducive to realistic use. Although the min sum algorithm (MSA) improves the computational convenience and applicability. It also weakens its decoding capability. In order to improve the decodi...",,20-22 Marc,10.1109/CIoT57267.2023.10084886,https://ieeexplore.ieee.org/document/10084886,new
ieee:10092088,conference,Software Model of a 5G Data Transmission System with Increased Spectral Efficiency,"V. V. Butenko, M. V. Ivankovich, E. M. Lobov, A. A. Kuchumov, E.O. Lobova","At present, an actual task is to increase the throughput of cellular communication systems; in conditions of a limited frequency resource, the only solution is to increase the spectral efficiency of the signals used for data transmission. The signals used in the 5G system are based on orthogonal frequency division multiplexing, which for channels with memory requires the use of a cyclic prefix tha...",,14-16 Marc,10.1109/IEEECONF56737.2023.10092088,https://ieeexplore.ieee.org/document/10092088,new
ieee:10091988,conference,Signal-Code Constructions for Wideband Signals Based on M-Cpfsk and Non-Binary Error-Correcting Codes,"N. A. Kandaurov, E. O. Lobova, V. O. Varlamov, K. E. Telengator",The article is devoted to the development of signal-code structures (SCC) for low-energy broadband radio links. The SCC is based on multi-frequency signals with a continuous phase (M-Cpfsk) and non-binary error-correcting codes (Non-binary low-density parity-check and turbo-like). An analysis is made of signal-code structures for bands up to 10 MHz with different parameters. These signal-code stru...,,14-16 Marc,10.1109/IEEECONF56737.2023.10091988,https://ieeexplore.ieee.org/document/10091988,new
