ID,Type,Title,Authors,Abstract,Categories,Published,DOI,PDF URL,Status
ieee:10018202,journal,Free-Ride Coding for Constructions of Coupled LDPC Codes,"Qianfan Wang, Suihua Cai, Xiao Ma","Free-ride coding, as an approach that admits transmission of a few extra bits over a low-density parity-check (LDPC) coded link without bandwidth expansion, is applied in this paper to construct coupled LDPC codes. Firstly, we present a syndrome channel model and derive the lower and upper bounds on its capacity (referred to as accessible capacity), indicating the feasibility of the reliable transmission of extra bits. Secondly, we present the performance evaluation on both the word error rate (WER) and the bit error rate (BER) for the free-ride codes with simple lower and upper bounds. Then we propose three applications of free-ride coding to construct coupled LDPC codes, including implicit globally-coupled LDPC (GC-LDPC) codes, partial product-LDPC codes, and terminated spatially-coupled LDPC (SC-LDPC) codes, all of which have the figure of merits that they share the same code rates with the basic component LDPC codes. Simulation results show that: 1) the proposed GC-LDPC codes can outperform the component LDPC codes, yielding a coding gain of up to 0.8 dB; 2) the proposed product codes with  $(3,6)$ -regular LDPC component codes of length 1024 can lower the WER from  $10^{-2}$  down to  $10^{-6}$  at the SNR around 2 dB; 3) the proposed terminated SC-LDPC codes can perform as well as the conventional terminated SC-LDPC codes but without any rate loss.",,March 2023,10.1109/TCOMM.2023.3237253,https://ieeexplore.ieee.org/document/10018202,new
ieee:9868050,journal,Performance Evaluation of Burst Error Correction by LDPC Coding and Iterative Decoding System in Magnetic Tape Drive,"Yasuaki Nakamura, Taisei Akamatsu, Madoka Nishikawa, Yoshihiro Okamoto",The tolerance for burst error of interleaved low-density parity-check (LDPC) code is evaluated with the cross-interleaved Reed–Solomon code (CIRC) in the magnetic tape drive using a BaFe magnetic tape. We evaluate the interleaved LDPC coding and iterative decoding system with burst error detector (LDPC-BD) system by the required signal-to-noise ratio (SNR) to achieve “No errors” for the burst-like deterioration such as media defects to the CIRC with erasure error correction (CIRC-EC) system by computer simulation. The results clarify that the LDPC-BD system tolerates the longer burst errors than the CIRC-EC system and the LDPC-BD system achieves “No errors” with the 3.0–4.5 dB lower SNR than the CIRC-EC system.,,March 2023,10.1109/TMAG.2022.3201898,https://ieeexplore.ieee.org/document/9868050,new
ieee:9999682,journal,Efficient MP Decoding via Fast G-BADMM Approach for Binary LDPC Codes,"Jing Bai, Yuhao Chi, Chau Yuen","Mathematical programming (MP) decoding based on the alternate direction method of multipliers (ADMM) algorithm is a promising approach for low-density parity-check (LDPC) codes in recent years. For this kind of decoding, the convergence characteristic has been considered as a key factor to enhance its advantage in practice. In this letter, we propose an efficient decoding algorithm based on generalized Bregman ADMM (G-BADMM) technique to improve the convergence speed of ADMM-based MP decoding for binary LDPC codes. The G-BADMM algorithm is established by adding additional Bregman divergences to the ADMM iterations of MP decoding. Moreover, the resulted G-BADMM iterations are solved efficiently. Furthermore, we theoretically analyze the proposed G-BADMM algorithm including its decoding performance analysis and computational complexity. Simulations demonstrate the efficiency of the proposed G-BADMM-based decoding algorithm.",,March 2023,10.1109/LCOMM.2022.3232703,https://ieeexplore.ieee.org/document/9999682,new
ieee:9866067,journal,An Adaptive Single/Multiple Symbol Flipping Decoding Algorithm for Non-Binary LDPC Codes,"Haiqiang Chen, Yulin Li, Yaoling Wang, Chunjie Li, Youming Sun, Xiangcheng Li, Tuanfa Qin","This letter presents an adaptive single/multiple distance-symbol flipping decoding algorithm with prediction (ASMD-SFDP). Different from the D-SFDP, the presented algorithm consider both the global maximization and sec-maximization values of the reliability fluctuation quantity (RFQ). Flipping operation is performed only when the global maximization is greater than or equal to zero. Furthermore, a new flipping strategy is introduced based on the numerical gap between the global maximization and sec-maximization. The flipping operation is performed adaptively: 1) If the gap is greater than or equal to a designed threshold, only single symbol is flipped; 2) Otherwise, multiple symbols are flipped. Simulation results show that the presented algorithm can achieve a significant performance gain of 0.4 $\sim $ 0.5 dB compared with the original D-SFDP algorithm. More interestingly, the presented algorithm also shows a much faster convergence speed.",,March 2023,10.1109/LCOMM.2022.3201236,https://ieeexplore.ieee.org/document/9866067,new
ieee:9878357,journal,"A Unified, SNR-Aware SC-LDPC Code Design With Applications to Magnetic Recording","Homa Esfahanizadeh, Eshed Ram, Yuval Cassuto, Lara Dolecek","Spatially coupled (SC)-low-density parity-check (LDPC) codes are known to have outstanding error-correction performance and low decoding latency, which make them an excellent choice for high-density magnetic recording (MR) technologies. Whereas previous works on LDPC and SC-LDPC codes mostly take either an asymptotic or a finite-length design approach, we propose a unified framework for jointly optimizing the codes’ thresholds and cycle counts to address both regimes. We focus on circulant-based (CB) SC-LDPC code family as a representative, high-performance exemplar of structured SC-LDPC codes. The framework is based on efficient traversal and pruning of the code search space, building on the fact that the performance of a CB SC-LDPC code depends on some characteristics of the code’s partitioning matrix, which by itself is much smaller than the code’s full parity-check matrix. We then propose an algorithm that traverses all non-equivalent partitioning matrices and outputs a list of codes, each offering an attractive point on the trade-off between asymptotic and finite-length performance. Our simulations show that our framework results in SC-LDPC codes that outperform the state-of-the-art constructions, over both additive white Gaussian noise (AWGN) and partial response (PR) channel models, and that it offers the flexibility to choose low-signal-to-noise ratio (SNR), high-SNR, or in- between SNR region considering system requirements, e.g., that of the MR device.",,March 2023,10.1109/TMAG.2022.3204923,https://ieeexplore.ieee.org/document/9878357,new
ieee:10019266,journal,Optimization of Protograph LDPC Codes via Surrogate Channel for Unequal Power Allocation,"Qiwang Chen, Yu-Cheng He, Chen Chen, Lin Zhou","This paper investigates the possibilities of optimizing existing protograph low-density parity-check (PLDPC) codes and designing optimal PLDPC codes on both AWGN and Rayleigh channels under binary modulation with unequal power allocation (UPA) for nonuniform sources. While the binary UPA modulation achieves a power gain, it also results in unequal error protection on the coded bits in systematic codewords during transmission. For irregular codes, it is possible to best protect the information bits by optimizing the classification of variable nodes (VNs). Those VNs represent the coded bits in protograph that allows exploiting jointly the degree irregularity and the power differentiation. An algorithm for UPA-based protograph extrinsic information transfer (UPA-PEXIT) analysis on the Rayleigh channel is proposed with the concept of surrogate channel which circumvents the channel asymmetry problem with UPA. With the RJA code as example, it is shown that classification optimization does improve the decoding threshold when the source entropy is small. To design optimal codes, a UPA-based differential evolution (UPA-DE) algorithm is proposed in conjunction with the UPA-PEXIT analysis. A family of optimized codes are illustrated for three typical nonuniform source distributions and compared with the RJA and NND codes by simulations in error rate performance.",,March 2023,10.1109/TCOMM.2023.3237845,https://ieeexplore.ieee.org/document/10019266,new
ieee:9927492,journal,Convolutional Neural Network-Based Media Noise Prediction and Equalization for TDMR Turbo-Detection With Write/Read TMR,"Amirhossein Sayyafan, Ahmed Aboutaleb, Benjamin J. Belzer, Krishnamoorthy Sivakumar, Simon Greaves, Kheong Sann Chan, Ashish James","This article considers a turbo-detection system that includes a convolutional neural network (CNN)-based equalizer, a Bahl-Cocke-Jelinek-Raviv (BCJR) trellis detector, a CNN-based media noise predictor (MNP), and a low-density parity-check (LDPC) channel decoder for two-dimensional magnetic recording (TDMR) in the presence of track misregistration (TMR). The input readings are passed to a 2-D partial response (PR) equalizer, which is either linear or CNN-based. The equalized waveforms are inputs to a 2-D BCJR detector, which generates log-likelihood-ratio (LLR) outputs. The CNN MNP is provided with BCJR LLRs to estimate signal-dependent media noise samples and feed them back to the BCJR. A second pass through the BCJR produces LLRs, which are decoded by an LDPC decoder; achieved areal density (AD) is computed from the LDPC code rate. Spatially varying read- and write-TMR models are developed. We investigate the performance of the proposed system on simulated TDMR readback waveforms generated by grain-switching probabilistic (GSP) simulations. We have two types of GSP datasets. Dataset #1 includes two 10 nm bit length (BL) datasets with 18 and 24 nm track pitch (TP). Dataset #2 has 11 nm BL and 15 nm TP. The comparison baseline is a 1-D BCJR detector with pattern-dependent noise prediction (PDNP) and soft intertrack interference (ITI) subtraction, referred to as 1-D PDNP with LLR exchange. The write-TMR and read-TMR are modeled as cross-track-independent downtrack-correlated random processes. In the presence of joint write- and read-TMR, the proposed turbo-detection system achieves 8.34% and 0.70% AD gain over 1-D PDNP with LLR exchange for TP 18 and 24 nm dataset #1, respectively, and is more robust to TMR compared to the baseline.",,March 2023,10.1109/TMAG.2022.3216640,https://ieeexplore.ieee.org/document/9927492,new
ieee:10018263,journal,Probabilistic Shaping for Trellis-Coded Modulation With CRC-Aided List Decoding,"Linfang Wang, Dan Song, Felipe Areces, Thomas Wiegart, Richard D. Wesel","This paper applies probabilistic amplitude shaping (PAS) to cyclic redundancy check (CRC)-aided tail-biting trellis-coded modulation (TCM). CRC-TCM-PAS produces practical codes for short block lengths on the additive white Gaussian noise (AWGN) channel. In the transmitter, equally likely message bits are encoded by a distribution matcher (DM) generating amplitude symbols with a desired distribution. A CRC is appended to the sequence of amplitude symbols, and this sequence is then encoded and modulated by TCM to produce real-valued channel input signals. This paper proves that the sign values produced by the TCM are asymptotically equally likely to be positive or negative. The CRC-TCM-PAS scheme can thus generate channel input symbols with a symmetric capacity-approaching probability mass function. The paper provides an analytical upper bound on the frame error rate of the CRC-TCM-PAS system over the AWGN channel. This FER upper bound is the objective function used for jointly optimizing the CRC and convolutional code. Additionally, this paper proposes a multi-composition DM, which is a collection of multiple constant-composition DMs. The optimized CRC-TCM-PAS systems achieve frame error rates below the random coding union (RCU) bound in AWGN and outperform the short-blocklength PAS systems with various other forward error correction codes studied in Coşkun et al. (2019).",,March 2023,10.1109/TCOMM.2023.3237263,https://ieeexplore.ieee.org/document/10018263,new
ieee:10023510,journal,Mesh Model-Based Merging Method for DP-LDPC Code Pair,"Dan Song, Lin Wang, Pingping Chen","For the double protograph low-density parity-check (DP-LDPC) code pair, indicating the source and channel codes utilized in the joint source channel coding, the coding optimization is generally implemented by the differential evolution searching with high complexity. In this paper, a new structured design of the DP-LDPC code pair is proposed based on Graph theory to reduce the searching complexity, namely mesh model-based merging (M3) method. Firstly, four basic mesh models are designed to merge the protographs at any dimension. According to the different structures of the source and channel codes, the merging boundary constraint is statistically established to limit the using number of basic models. Then, a prior sorting algorithm is proposed to arrange the selection priorities of basic models for source and channel codes, respectively, which greatly refines the merging accuracy. Since most of the degrees are symmetric and predetermined in the merged protographs, the searching complexity is significantly reduced when the merged protographs are used as the initial input. Finally, simulation results demonstrate that the merging DP-LDPC code pairs show better performances compared to the existing code pairs. Furthermore, the proposed M3 method is hardware-friendly in Internet of Things because of its simple structure.",,March 2023,10.1109/TCOMM.2023.3238363,https://ieeexplore.ieee.org/document/10023510,new
ieee:10004953,journal,A New Transceiver Design for Protograph LDPC-Coded LACO-OFDM VLC Systems With Deep Learning,"Lin Dai, Yi Fang, Pingping Chen, Guohua Zhang, Mohsen Guizani","As a spectral-efficient and transmission-reliable technique, channel coded layered asymmetrically clipped optical orthogonal frequency-division multiplexing (LACO-OFDM) has attracted considerable interest in visible light communications. In this letter, we investigate the protograph low-density parity-check (LDPC)-coded LACO-OFDM VLC systems. Specially, we design a novel type of interleaving scheme, referred to as “variable-node subcarrier matched mapping (VNSMM)” to optimize the performance of protograph-coded LACO-OFDM VLC systems. In such scenario, the conventional iterative detection framework cannot completely eliminate the inter-layer interference (ILI), which degrades the system performance. To further suppress the ILI at the receiver, we propose a deep learning (DL)-based detection framework, called “DeepLACO”, to simultaneously obtain the log-likelihood ratios (LLRs) used for the protograph decoders in all layers without the knowledge of channel state information (CSI). Analyses and simulations demonstrate that the protograph-coded LACO-OFDM exploiting the proposed interleaving scheme and detection framework can achieve excellent performance in VLC systems.",,March 2023,10.1109/LCOMM.2022.3233628,https://ieeexplore.ieee.org/document/10004953,new
ieee:9925625,journal,A Flexible Encoding/Decoding Procedure for 6G SCMA Wireless Networks via Adversarial Machine Learning Techniques,"Luciano Miuccio, Daniela Panno, Salvatore Riolo","5G networks may not be competent in fully supporting the high data rates, system capacity, and spectral efficiency expected in the upcoming 6G networks. An enabling factor to achieve these requirements is the adoption of the Sparse Code Multiple Access (SCMA), which is one of the most promising code-domain Non-Orthogonal Multiple Access (NOMA) techniques. Nowadays, there are two major challenges for the implementation of SCMA in practical networks. First, the design of a near-optimal codebook set at the transmitter, which heavily impacts the network performance. Second, an efficient decoding algorithm at the receiver, which dominates the computational complexity of the system. The two aspects are not independent from each other; therefore the optimization of an SCMA network should address jointly both the Encoder and the Decoder side. However, most of the works available in the literature address only one aspect and also are not tailored for a given radio channel. In this paper, we design an end-to-end SCMA en/deconding structure based on the integration between a state-of-the-art AutoEncoder (AE) architecture and a novel Wasserstein Generative Adversarial Network (WGAN). The aim is to jointly create a near-optimal codebook design and a non-computationally heavy Decoder that are robust to the given channel statistics. Finally, we trained our model to be flexible to support different channel conditions and compared its performance against the state-of-the-art AE and the best conventional Decoders. The simulation results show that our innovative design exhibits decoding performance very similar to conventional Decoders with a reduced decoding latency.",,March 2023,10.1109/TVT.2022.3216028,https://ieeexplore.ieee.org/document/9925625,new
ieee:10018203,journal,Short Blocklength Wiretap Channel Codes via Deep Learning: Design and Performance Evaluation,"Vidhi Rana, Rémi A. Chou","We design short blocklength codes for the Gaussian wiretap channel under information-theoretic security guarantees. Our approach consists in decoupling the reliability and secrecy constraints in our code design. Specifically, we handle the reliability constraint via an autoencoder, and handle the secrecy constraint with hash functions. For blocklengths smaller than or equal to 128, we evaluate through simulations the probability of error at the legitimate receiver and the leakage at the eavesdropper for our code construction. This leakage is defined as the mutual information between the confidential message and the eavesdropper’s channel observations, and is empirically measured via a neural network-based mutual information estimator. Our simulation results provide examples of codes with positive secrecy rates that outperform the best known achievable secrecy rates obtained non-constructively for the Gaussian wiretap channel. Additionally, we show that our code design is suitable for the compound and arbitrarily varying Gaussian wiretap channels, for which the channel statistics are not perfectly known but only known to belong to a pre-specified uncertainty set. These models not only capture uncertainty related to channel statistics estimation, but also scenarios where the eavesdropper jams the legitimate transmission or influences its own channel statistics by changing its location.",,March 2023,10.1109/TCOMM.2023.3237259,https://ieeexplore.ieee.org/document/10018203,new
ieee:9895161,journal,Mixed RF/FSO SWIPT-Based OSLMD Coded AF Cooperative Communication System: Performance Analysis,"Souad Labghough, Fouad Ayoub, Faissal El Bouanani, Mostafa Belkasmi, Khalid A. Qaraqe","In this paper, the performance analysis of simultaneous wireless information and power transfer (SWIPT) using time switching (TS) protocol-based amplify-and-forward (AF) dual-hop mixed radio-frequency/free-space optic (RF/FSO) coded and uncoded communication system (CC and UC) is investigated. Specifically, we look at using the One-Step Majority-Logic Decodable (OSMLD) codes at the source and a majority logic decoding algorithm (MLGD) at the destination, jointly with the use of maximal-ratio combining and SWIPT/TS techniques at the relay. Furthermore, the RF link undergoes Nakagami- $m$  model, while the second-hop is subject to Máalaga- $\mathcal {M}$  atmospheric turbulence with the effect of pointing errors. Closed-form and asymptotic formulations for the average bit error probability (ABEP) are obtained in terms of the system parameters for both CC and UC scenarios in addition of the average channel capacity analysis. Computer-based Monte Carlo simulations were used to numerically validate all of the obtained mathematical formulations. Expectedly, it is shown that significant coding gains are achieved using OSMLD codes in comparison with UC. In addition, above a specific threshold of energy efficiency, the system performance gets steady in the high signal-to-noise-ratio regime. Moreover, the decoding method used in this work has been shown to be suitable for the SWIPT/TS-assisted RF/FSO coded AF cooperative communication system where high performance alongside low computational complexity are required.",,March 2023,10.1109/TGCN.2022.3207096,https://ieeexplore.ieee.org/document/9895161,new
ieee:9893113,journal,Track Mis-Registration Estimator Based on K-Means Algorithm for Bit-Patterned Media Recording,"Seongkwon Jeong, Jaejin Lee","Bit-patterned media recording (BPMR) has been considered among the key technologies to extend recording densities to 1 Tb/in2 and beyond. However, the BPMR system encounters the challenges of two-dimensional intersymbol interference and track mis-registration (TMR). In this article, we propose a TMR estimator based on the  $K$ -means algorithm for estimating the TMR levels and preventing the performance degradation of the BPMR system. The TMR estimator calculates the distances between the centroid of the readback signal and predetermined centroids according to the TMR level. The equalizer coefficients and partial response target are adjusted to the corresponding TMR level. At a bit error rate of 10−3 and a TMR of 10%, the proposed detection scheme performs better by approximately 1 dB in comparison with the conventional detection.",,March 2023,10.1109/TMAG.2022.3206904,https://ieeexplore.ieee.org/document/9893113,new
ieee:10024991,journal,On the Maximum Communication Data Rate of Resonant Antennas,"Carl Pfeiffer, Bae-Ian Wu","A simple expression for the maximum data rate that can be reliably communicated (i.e., capacity) through a narrowband, resonant antenna with a Lorentzian frequency response is derived. Both transmit and receive cases are considered. In general, resonant antennas handle different data rates on receive than transmit because receive antennas filter out some of the external noise, but they also add their own loss related noise. It is also shown how adding loss, an impedance mismatch, or a matching network can increase the channel capacity by widening the resonant bandwidth at the expense of a reduced signal strength. A baseband simulation of communication between a narrowband transmitter and wideband receiver employing single-carrier quadrature amplitude modulation (QAM) is developed. The simulated data rates closely approach the derived theoretical limit. Finally, the simulation is experimentally validated by transmitting a quadrature phase shift keyed (QPSK) modulated signal through a single-resonant narrowband filter.",,March 2023,10.1109/TCOMM.2023.3239506,https://ieeexplore.ieee.org/document/10024991,new
ieee:9925574,journal,Energy-Efficient Backscatter-Assisted Coded Cooperative NOMA for B5G Wireless Communications,"Muhammad Asif, Asim Ihsan, Wali Ullah Khan, Ali Ranjha, Shengli Zhang, Sissi Xiaoxiao Wu","In this manuscript, we propose an alternating optimization framework to maximize the energy efficiency of a backscatter-enabled cooperative Non-orthogonal multiple access (NOMA) system by optimizing the transmit power of the source, power allocation coefficients (PAC), and power of the relay node under imperfect successive interference cancellation (SIC) decoding. A three-stage low-complexity energy-efficient alternating optimization algorithm is introduced which optimizes the transmit power, PAC, and relay power by considering the quality of service (QoS), power budget, and cooperation constraints. Subsequently, a joint channel coding framework is introduced to enhance the performance of far user which has no direct communication link with the base station (BS) and has bad channel conditions. In the destination node, the far user data is jointly decoded using a Sum-product algorithm (SPA) based joint iterative decoder realized by jointly-designed Quasi-cyclic Low-density parity-check (QC-LDPC) codes. Simulation results evince that the proposed backscatter-enabled cooperative NOMA system outperforms its counterpart by providing an efficient performance in terms of energy efficiency. Also, proposed jointly-designed QC-LDPC codes provide an excellent bit-error-rate (BER) performance by jointly decoding the far user data for considered BSC cooperative NOMA system with only a few decoding iterations.",,March 2023,10.1109/TGCN.2022.3216209,https://ieeexplore.ieee.org/document/9925574,new
ieee:10018210,journal,Distributed Video Coding Based on Polar Codes,"Grigorii Trofimiuk, Evgeny Belyaev, Peter Trifonov","In this letter we present an improved distributed video coding (DVC) scheme based on polar coding techniques. Firstly, we adapt log-likelihood ratios (LLRs) for DVC with integer implementation of a discrete cosine transform (DCT). We propose a computationally efficient and numerically stable modification of these LLRs based on the simplified methods of polar codes decoding. We show that on average this approach provides 0.3 dB PSNR gain for DVC with LDPC accumulated (LDPCA) codes. Secondly, we introduce the nested shortened polar codes construction algorithm. We demonstrate that replacement of LDPCA by polar codes improves PSNR by 0.1 dB on average, whereas, for videos with relatively high motion level, the gain reaches up to 0.23, 0.39 and 0.55 dB for Group of Pictures (GOP) lengths 2, 4 and 8 frames, respectively. Finally, experimental results demonstrate that DVC with polar codes and Tal-Vardy list decoder operates up to two times faster than DVC with LDPCA code and belief propagation (BP) decoder.",,March 2023,10.1109/LCOMM.2023.3237285,https://ieeexplore.ieee.org/document/10018210,new
