ID,Type,Title,Authors,Abstract,Categories,Published,DOI,PDF URL,Status
ieee:4737273,conference,A novel space-time FFH-MIMO system with generalized wide-interval fh patterns,"Zhao Ying, Xiao Yang","This paper presents a novel space-time fast frequency hopping (FFH) multiple input multiple output (MIMO) wireless communication system over rayleigh fading channel. With the M-ary frequency shifting keying (MFSK) modulation and noncoherent demodulation, the structure of a new system is discussed based on the combination of FFH technique and MIMO system. The concept of generalized wide-interval FH...",,19-21 Nov.,10.1109/ICCS.2008.4737273,https://ieeexplore.ieee.org/document/4737273,new
ieee:4737179,conference,Iterative coding and decoding algorithm of RS digital fountain code,"Weijia Lei, Guangjun Li, Xiangming Li, Xianzhong Xie","Combining forward error correcting and automatic repeat request is a commonly used method in digital communication system. But in broadcast communication system, this method will compromise the communication efficiency and cause longer transmission delay due to the need of retransmitting data. This problem, however, can be effectively solved by the use of digital fountain code. RS code has the pot...",,19-21 Nov.,10.1109/ICCS.2008.4737179,https://ieeexplore.ieee.org/document/4737179,new
ieee:4737307,conference,Soft-quantized demodulation for BPSK over discrete-time memoryless fading channel,"Qiuliang Xie, Kewu Peng, Jian Song, Changyong Pan, Zhixing Yang","The demapping method that simply multiplies the received symbols with channel state information (CSI) coefficients is proved optimal in this paper for any BPSK modulated discrete-time memoryless fading channel (DMFC) from the viewpoint of channel capacity, when CSI is available at the receiver. A generic method to calculate the channel capacity of BPSK modulated DMFC subjected to uniform soft quan...",,19-21 Nov.,10.1109/ICCS.2008.4737307,https://ieeexplore.ieee.org/document/4737307,new
ieee:4753226,conference,Bounded angle iterative decoding of LDPC codes,"Sam Dolinar, Kenneth Andrews, Fabrizio Pollara, Dariush Divsalar","A modification to the usual iterative decoding algorithm for LDPC codes, called bounded angle iterative (BA-I) decoding, is introduced. The modified decoder erases codewords detected during iterations that fall outside a maximum decoding angle with respect to the received observation. The new algorithm is applicable in scenarios that demand a very low undetected error rate but require short LDPC c...",,16-19 Nov.,10.1109/MILCOM.2008.4753226,https://ieeexplore.ieee.org/document/4753226,new
ieee:4753227,conference,Adaptive-rate nonbinary LDPC coding for frequency-hop communications,"Michael B. Pursley, Thomas C. Royster",We evaluate the performance of irregular low-density parity-check (LDPC) codes in slow frequency-hop spread-spectrum systems with nonbinary orthogonal modulation. We also evaluate the performance of two adaptive coding protocols for the LDPC codes. The protocols use information derived by the iterative decoder during the decoding of each packet to select the code rate for the next packet. Performa...,,16-19 Nov.,10.1109/MILCOM.2008.4753227,https://ieeexplore.ieee.org/document/4753227,new
ieee:4753232,conference,Performance under delay constraints on iterative decoding of LDPC codes,"JaWone Kennedy, Daniel L. Noneaker",The performance of a system with a quasi-cyclic low-density parity-check code is examined under various constraints on the decoding delay. Two alternatives are considered for the message-passing decoding algorithm: the sum-product algorithm and the turbo-decoding message-passing algorithm. It is shown that their relative performance depends heavily on the stringency of the delay constraint; the TD...,,16-19 Nov.,10.1109/MILCOM.2008.4753232,https://ieeexplore.ieee.org/document/4753232,new
ieee:4753230,conference,The performance of flexible LDPC codes on Gaussian channels with bursty erasures,"Cenk Kose, Thomas R. Halford","The burst-erasure channel with additive white Gaussian noise (AWGN), or BuEC-G, is useful both as an abstraction of a number of military communications channels, and as a surrogate for the design of codes on correlated Rayleigh fading channels. While codes for the BuEC-G have been presented in the literature, the focus has largely been on highly optimized inflexible point designs that are not amen...",,16-19 Nov.,10.1109/MILCOM.2008.4753230,https://ieeexplore.ieee.org/document/4753230,new
ieee:4753229,conference,"Error floor analysis for an ensemble of easily implementable irregular (2048, 1024) LDPC codes",Chad A. Cole,"The following paper describes a design process for constructing semirandom LDPC codes with characteristics that are suitable for a relatively simple implementation for both the encoding and decoding operation. The paper will focus on two particular code ensembles - both rate-1/2 (2048, 1024) designs with a specified irregular degree distribution. These code parameters were chosen simply because th...",,16-19 Nov.,10.1109/MILCOM.2008.4753229,https://ieeexplore.ieee.org/document/4753229,new
ieee:4753265,conference,"Doubly iterative LDPC-coded DS-CDMA receivers with coherent detection, EM channel estimation, and no pilot symbols","Don Torrieri, Amitav Mukherjee, Hyuck M. Kwon","In this paper, we describe direct-sequence code-division multiple-access (CDMA) systems with M-ary modulation in which channel estimation, coherent demodulation, and decoding are iteratively performed without the use of any training or pilot symbols. An expectation-maximization channel-estimation algorithm for the fading amplitude and interference-plus-noise power spectral density (PSD) is propose...",,16-19 Nov.,10.1109/MILCOM.2008.4753265,https://ieeexplore.ieee.org/document/4753265,new
ieee:4753299,conference,Spectral efficiency maximization using pragmatic modern rate-compatible code families,"Thomas R. Halford, Cenk Kose","In communication links employing incremental redundancy (IR), the strength of the code used for forward error correction is adapted in order to maximize instantaneous spectral efficiency in time-varying channels. In this paper, a simple two-phase IR transmission scheme is studied in a block-fading channel in order to illuminate the effects on protocol design and achievable spectral efficiency of t...",,16-19 Nov.,10.1109/MILCOM.2008.4753299,https://ieeexplore.ieee.org/document/4753299,new
ieee:4753231,conference,Efficient quantization schemes for LDPC decoders,"Radivoje Zarubica, Ryan Hinton, Stephen G. Wilson, Eric K. Hall","LDPC codes have attracted much attention recently for their near-capacity performance and high throughput owing to parallel decoding architectures. While simulations are normally done with floating point computation, any practical implementation (ASIC or FPGA) will be built with fixed-point computation. Obviously, decoder speed will increase, and resource requirements will drop, with low-precision...",,16-19 Nov.,10.1109/MILCOM.2008.4753231,https://ieeexplore.ieee.org/document/4753231,new
ieee:4753233,conference,A soft-decision scaling metric employing receiver statistics for direct-sequence spread-spectrum packet radio networks,"Steven W. Boyd, Michael B. Pursley, Thomas C. Royster, Harlan B. Russell","Packet radios for tactical networks must be able to communicate over highly dynamic links that are susceptible to variations in propagation loss, jamming, and multiple-access interference. We describe and evaluate an adaptive scaling metric for soft-decision decoding in direct-sequence spread-spectrum receivers for tactical radio networks. The metric is derived from post-detection signal quality s...",,16-19 Nov.,10.1109/MILCOM.2008.4753233,https://ieeexplore.ieee.org/document/4753233,new
ieee:4753286,conference,Scalar quantizers for decentralized estimation of multiple random sources,"Azadeh Vosoughi, Ren Gang","We consider a new inference-centric application for a distributed sensor network. Consider multiple signal sources, i.e., acoustic sources, in the field being monitored. Governed by physics law each sensor’s measurement can be modeled as a linear combination of the original multiple signal sources, corrupted by the additive measurement noise. In a non-cooperative communication scenario, each senso...",,16-19 Nov.,10.1109/MILCOM.2008.4753286,https://ieeexplore.ieee.org/document/4753286,new
ieee:4716279,conference,Reduced complexity and improved performance decoding algorithm for nonbinary LDPC codes over GF(q),"Xin Chen, Aidong Men","Low-density parity-check (LDPC) codes over finite fields GF(q) have a better performance than those of the binary low-density parity-check codes, at short and medium block lengths, but the decoder of GF(q)-LDPC has more complexity. In this paper, we present a new reduced-complexity belief propagation (BP) decoding algorithm for GF(q)-LDPC codes by analyzing the reliability of code symbols. Instead...",,10-12 Nov.,10.1109/ICCT.2008.4716279,https://ieeexplore.ieee.org/document/4716279,new
ieee:4716209,conference,A novel mapping scheme in non-binary LDPC coded modulation system,"Chen Luo, Keke Liu, Zesong Fei, Jingming Kuang","In this paper, we propose a novel mapping scheme in non-binary LDPC coded modulation system. Contrary to the mapping method in [1], we assign the variable node of less degree to the more significant bits(MSBs) of signal constellation, for the purpose of the balanced protection. Simulation results show that compare to the traditional mapping scheme, the proposed method gives 0.1dB–0.5dB performance...",,10-12 Nov.,10.1109/ICCT.2008.4716209,https://ieeexplore.ieee.org/document/4716209,new
ieee:4716208,conference,Prediction of hybrid-ARQ based on mutual information model for LDPC coded OFDM system,"Xiang Chen, Zesong Fei, Jingming Kuang, Wei Sun","An accurate and simple link quality model is of utmost importance in link adaptation (LA) design. Our previous work in has verified the good accuracy of the mutual information (MI) model for rate compatible (RC) LDPC coded OFDM system. In this paper, the MI model is used to predict the retransmission length T of two hybrid ARQ schemes, partial chase combining (PCC) and incremental redundancy (IR)....",,10-12 Nov.,10.1109/ICCT.2008.4716208,https://ieeexplore.ieee.org/document/4716208,new
ieee:4716165,conference,Keynote Address IV Gbps wireless communication system,Zhang Ping,"This paper introduces the developments of TDD based Giga bits per second (Gbps) wireless communication system in wireless technology innovation (WTI) institute of BUPT. Radio link transmission design are presented in this paper, including promising key techniques of physical layer such as Channel measurement and modeling, multiple input multiple output (MIMO), low density parity check (LDPC) code,...",,10-12 Nov.,10.1109/ICCT.2008.4716165,https://ieeexplore.ieee.org/document/4716165,new
ieee:4716217,conference,A decode-and-forward relaying scheme based on orthogonal superposition modulation,"Li Huang, Zesong Fei, Jingming Kuang","In this paper, we proposed a new scheme of cooperative relaying scheme base on orthogonal superposition modulation and soft demodulation which is similar with multiuser detection. The new scheme can be considered as a different way to achieve a similar purpose with superposition modulation [6]. We optimized the parameter in order to achieve the best performance. Simulation results show that our ne...",,10-12 Nov.,10.1109/ICCT.2008.4716217,https://ieeexplore.ieee.org/document/4716217,new
ieee:4716182,conference,A new paradigm of coding for scalable video coding with wavelet-based,"Zhe Li, Sheng Fang, Xujian Li, Ke Xu","In this paper, we propose a new wavelet video coding based on MCTF-WZ through introducing Wyner-Ziv coding, which is a new coding structure. Low and high frequency frames in temporal domain are encoded through the distinct coding manner, where the former is encoded by the BISK algorithm after spatial analysis. But the latter is encoded by two distinct ways according to the correlation between the ...",,10-12 Nov.,10.1109/ICCT.2008.4716182,https://ieeexplore.ieee.org/document/4716182,new
