ID,Type,Title,Authors,Abstract,Categories,Published,DOI,PDF URL,Status
ieee:4686837,journal,LDPC Code Design for Half-Duplex Cooperative Relay,"Chuxiang Li, Guosen Yue, Xiaodong Wang, Mohammad Ali Khojastepour","The authors consider the design of LDPC codes for cooperative relay systems in the half-duplex mode. The capacity of halfduplex relay channels has been studied previously but the design of good channel codes for such channels remains a challenging problem. Employing an efficient relay protocol, we transform the half-duplex relay code design problem into a problem of ratecompatible LDPC code design...",,November 2,10.1109/T-WC.2008.070482,https://ieeexplore.ieee.org/document/4686837,new
ieee:4686263,journal,CRC-assisted error correction in a convolutionally coded system,"Renqiu Wang, Wanlun Zhao, Georgios B. Giannakis","In communication systems employing a serially concatenated cyclic redundancy check (CRC) code along with a convolutional code (CC), erroneous packets after CC decoding are usually discarded. The list Viterbi algorithm (LVA) and the iterative Viterbi algorithm (IVA) are two existing approaches capable of recovering erroneously decoded packets. We here employ a soft decoding algorithm for CC decodin...",,November 2,10.1109/TCOMM.2008.060543,https://ieeexplore.ieee.org/document/4686263,new
ieee:4644053,magazine,Antijamming coding techniques,Guosen Yue,"In this article, we have provided an overview of several coding techniques for erasure channels which can be or have been applied to cognitive radio systems as antijamming coding schemes for link maintenance purpose. We have discussed in detail the conventional erasure codes, LDPC codes, rate less codes, as well as recently proposed piecewise coding. Among these coding schemes, conventional RS cod...",,November 2,10.1109/MSP.2008.929285,https://ieeexplore.ieee.org/document/4644053,new
ieee:4686840,journal,Optimizing Joint Erasure- and Error-Correction Coding for Wireless Packet Transmissions,"Christian R. Berger, Shengli Zhou, Yonggang Wen, Peter Willett, Krishna Pattipati","To achieve reliable packet transmission over a wireless link without feedback, we propose a layered coding approach that uses error-correction coding within each packet and erasure-correction coding across the packets. This layered approach is also applicable to an end-to-end data transport over a network where a wireless link is the performance bottleneck. We investigate how to optimally combine ...",,November 2,10.1109/T-WC.2008.070581,https://ieeexplore.ieee.org/document/4686840,new
ieee:4711201,journal,Reduced front-end reception requirements for satellite broadcast using interference processing,"Enrico Casini, Gennaro Gallinaro, Joel Grotz",The problem of fixed satellite broadcast reception is considered. The possibility of reducing the requirements on the antenna front-end dimensions is investigated. Interference processing and mitigation techniques are employed to cope with the increased level of adjacent system interference at the satellite broadcast receiver resulting from the less directive antenna. A novel satellite reception f...,,November 2,10.1109/TCE.2008.4711201,https://ieeexplore.ieee.org/document/4711201,new
ieee:4717467,journal,Nonbinary LDPC Codes for 4-kB Sectors,"Wu Chang, J. R. Cruz","The performance of nonbinary LDPC codes on perpendicular magnetic recording channels (PMRCs) with 4-kB sectors is investigated. Each sector is encoded by either 4- or 0.5-kB-long codes. Both quasi-cyclic (QC) and nonquasi-cyclic (non-QC) nonbinary low-density parity-check (LDPC) codes are designed, and a set of simulations in a mixture of 10% additive white Gaussian noise (AWGN) and 90% position j...",,Nov. 2008,10.1109/TMAG.2008.2002368,https://ieeexplore.ieee.org/document/4717467,new
ieee:4717796,journal,A New Burst Detection Scheme Using Parity Check Matrix of LDPC Code for Bit Flipping Burst-like Signal Degradation,"Yasuaki Nakamura, Mitsuhiro Nishimura, Yoshihiro Okamoto, Hisashi Osawa, Hiroaki Muraoka","In this paper, a new burst detection method using the check matrix of low-density parity-check (LDPC) code is proposed. The burst detection for the bit flipping burst-like signal degradation which the conventional burst detection using a reproducing waveform, an equalizer output, an a posteriori probability (APP) decoder output and so on cannot detect is studied. The performance of the LDPC coding...",,Nov. 2008,10.1109/TMAG.2008.2002424,https://ieeexplore.ieee.org/document/4717796,new
ieee:4602535,journal,Fully Parallel Stochastic LDPC Decoders,"Saeed Sharifi Tehrani, Shie Mannor, Warren J. Gross","Stochastic decoding is a new approach to iterative decoding on graphs. This paper presents a hardware architecture for fully parallel stochastic low-density parity-check (LDPC) decoders. To obtain the characteristics of the proposed architecture, we apply this architecture to decode an irregular state-of-the-art (1056,528) LDPC code on a Xilinx Virtex-4 LX200 field-programmable gate-array (FPGA) d...",,Nov. 2008,10.1109/TSP.2008.929671,https://ieeexplore.ieee.org/document/4602535,new
ieee:4594628,journal,Stochastic Decoding of Linear Block Codes With High-Density Parity-Check Matrices,"Saeed Sharifi Tehrani, Christophe Jego, Bo Zhu, Warren J. Gross",This correspondence extends the application of the recently proposed stochastic decoding approach to decode linear block codes with high-density parity-check matrices and discusses its hardware complexity. Results demonstrate decoding performance close to floating-point iterative soft-input soft-output (SISO) decoding while offering nodes with considerably lower complexity compared to fixed-point ...,,Nov. 2008,10.1109/TSP.2008.929337,https://ieeexplore.ieee.org/document/4594628,new
ieee:4655474,journal,Average Stopping Set Weight Distributions of Redundant Random Ensembles,Tadashi Wadayama,"In this paper, redundant random ensembles are defined and their average stopping set (SS) weight distributions are analyzed. A redundant random ensemble consists of a set of binary matrices with linearly dependent rows. These linearly dependent rows significantly reduce the number of stopping sets (SS) of small size. Upper and lower bounds on the average SS weight distribution of the redundant ran...",,Nov. 2008,10.1109/TIT.2008.929973,https://ieeexplore.ieee.org/document/4655474,new
ieee:4451656,journal,New List Sphere Decoding (LSD) and Iterative Synchronization Algorithms for MIMO-OFDM Detection With LDPC FEC,"Ahmed D. Kora, Amir Saemi, Jean Pierre Cances, Vahid Meghdadi","New sphere decoding and synchronization algorithms for multiple-input-multiple-output (MIMO) orthogonal frequency-division multiplexing (OFDM) systems are proposed in this paper. In particular, an iterative list branch-and-bound (BB) algorithm based on the basic BB algorithm is described to obtain a candidate list to compute soft information that is used in the iterative detector. Furthermore, an ...",,Nov. 2008,10.1109/TVT.2008.918696,https://ieeexplore.ieee.org/document/4451656,new
ieee:4717668,journal,Areal-Density Capability of a Magnetic Recording System Using a “747” Test Based Only on Data-Block Failure-Rate,"Zhen Jin, Michael Salo, Roger Wood","The ldquo747rdquo test provides a well-established basis for determining the areal-density capability of a magnetic recording system. When new record areal densities are announced, they are usually accompanied by a 747 plot to support the claim. The 747 curve plots how far the read-head can be moved off-track versus the distance to an adjacent ldquosqueezingrdquo track. The criterion for off-track...",,Nov. 2008,10.1109/TMAG.2008.2003044,https://ieeexplore.ieee.org/document/4717668,new
ieee:4717620,journal,Enhanced Message Passing in Turbo Product Code,"Nan-Hsiung Yeh, Philip L. Steiner, Yan Li","Turbo product code with single parity check (TPC/SPC) has demonstrated superior error correction capability over the conventional PRML channel. However, the performance usually suffers at higher code rate. A scheme to improve BER of TPC/SPC at higher code rate is proposed. By adding cyclic redundancy check (CRC) to TPC/SPC, a sub-block can be ensured error free after passing both the parity check ...",,Nov. 2008,10.1109/TMAG.2008.2002406,https://ieeexplore.ieee.org/document/4717620,new
ieee:4694140,journal,The Read Channel,"Aleksandar Kavcic, Ara Patapoutian","In this paper, we provide a survey of the novel read channel technologies that found their implementation in products over the past decade, and we outline possible technology directions for the future of read channels. Recently, magnetic recording read channels have undergone several changes. In addition to switching from longitudinal to perpendicular recording channels, detectors tuned to media n...",,Nov. 2008,10.1109/JPROC.2008.2004310,https://ieeexplore.ieee.org/document/4694140,new
ieee:4490159,journal,Fixed-Rate Raptor Codes Over Rician Fading Channels,"Bharathram Sivasubramanian, Harry Leib","This paper considers the newly introduced fountain codes for fixed-rate error control coding, with emphasis on Raptor codes. The performance of Raptor codes of low-to-moderate rates with iterative decoding is evaluated over memoryless, as well as correlated, fading channels. A global decoding algorithm, incorporating feedback between the component codes of the Raptor code, is introduced. Results s...",,Nov. 2008,10.1109/TVT.2008.923664,https://ieeexplore.ieee.org/document/4490159,new
ieee:4688764,conference,Increasing optical fiber transmission capacity beyond next-generation systems,"Ezra Ip, Joseph M. Kahn","We discuss how improvements in optical fibers and amplifiers, modulation formats, and digital signal processing algorithms can increase the capacity of long-haul fiber-optic transmission beyond that of next-generation systems.",,9-13 Nov. ,10.1109/LEOS.2008.4688764,https://ieeexplore.ieee.org/document/4688764,new
ieee:4688905,conference,Coding for free space optical communications,Ivan B. Djordjevic,"Free-space optical (FSO) systems that are robust in the presence of atmospheric turbulence are discussed in this invited paper: (i) coded-OFDM, (ii) coded MIMO concept, and (iii) raptor code based FSO systems.",,9-13 Nov. ,10.1109/LEOS.2008.4688905,https://ieeexplore.ieee.org/document/4688905,new
ieee:4746952,conference,A reconfigurable FPGA implementation of an LDPC decoder for unstructured codes,"S. M. Ehsan Hosseini, Kheong Sann Chan, Wang Ling Goh","This paper describes the implementation of a general and embedded decoder for the evaluation of unstructured low-density parity-check (LDPC) codes over additive-white Gaussian noise (AWGN) channels. The decoder, which has a serial architecture and moderate throughput, is a peripheral connected to the embedded Power PC processor of a Xilinx Virtex-II Pro FPGA and is managed by the processor. This m...",,7-9 Nov. 2,10.1109/ICSCS.2008.4746952,https://ieeexplore.ieee.org/document/4746952,new
ieee:4708787,conference,"A 7.39mm2 76mW (1944, 972) LDPC decoder chip for IEEE 802.11n applications","Xin-Yu Shih, Cheng-Zhou Zhan, An-Yeu Wu","This paper presents the LDPC decoder chip for (1944,972) QC-LDPC codes in IEEE 802.11n communication system. The efficient LDPC decoder chip is designed with three design techniques, including Group Comparison (GC), Dynamic Wordlength Assignment (DWA), and Data Packet Scheme (DPS). When the target BER is 10−6, the decoding performance can be improved by the coding gain of 0.48 dB and 0.63 dB with ...",,3-5 Nov. 2,10.1109/ASSCC.2008.4708787,https://ieeexplore.ieee.org/document/4708787,new
ieee:4708786,conference,A 820 Mb/s baseband processor LSI based on LDPC coded OFDM for UWB systems,"Shinsuke Ushiki, Koichi Nakamura, Kazunori Shimizu, Qi Wang, Yuta Abe, Satoshi Goto, Takeshi Ikenaga","This paper presents a high-throughput and highly-reliable baseband processor LSI based on LDPC coding OFDM UWB. This LSI targets for wireless LAN systems inside a car which enable to translate a high-resolution video under noisy environment. A chip capable of operating at 147 MHz was fabricated using UMC 0.13 mum 1P8M CMOS technology. By adopting the OFDM modulation with 1024 sub-carriers, it achi...",,3-5 Nov. 2,10.1109/ASSCC.2008.4708786,https://ieeexplore.ieee.org/document/4708786,new
ieee:4772987,conference,Asymmetric quantum BCH codes,Salah A. Aly,"Recently, the theory of quantum error control codes has been extended to include quantum codes over asymmetric quantum channels - qubit-flip and phase-shift errors may have equal or different probabilities. Previous work in constructing quantum error control codes has focused on code constructions for symmetric quantum channels. In this paper we establish a method to construct asymmetric quantum c...",,25-27 Nov.,10.1109/ICCES.2008.4772987,https://ieeexplore.ieee.org/document/4772987,new
ieee:4812877,conference,Low complexity iterative decoding algorithm for low-density parity-check (LDPC) codes,"Hany R. Zeidan, Maha M. Elsabrouty",The reliability ratio weighted based bit-flipping (RRWBF) algorithm for decoding low-density parity-check (LDPC) codes has recently been developed to provide the best performance among all existing bit-flipping based algorithms. The implementation efficient reliability ratio weighted based bit-flipping (IERRWBF) algorithm speedup the original algorithm to decrease the processing time used. A drawb...,,24-27 Nov.,10.1109/WD.2008.4812877,https://ieeexplore.ieee.org/document/4812877,new
ieee:4812880,conference,Decoding architectures for Projective Geometry based LDPC codes,"S.G Harihara, M. Girish Chandra, Tarakapraveen Uppalapati, B.S. Adiga","Projective Geometry (PG) based Low Density Parity Check (LDPC) codes have many useful properties, including easy encoding and decoding by simple majority logic technique. With these useful features, they can be useful error control codes in future. In this paper, we present three novel architectures comprising of one parallel and two semi-parallel decoder architectures for popular PG-based LDPC co...",,24-27 Nov.,10.1109/WD.2008.4812880,https://ieeexplore.ieee.org/document/4812880,new
ieee:4815676,conference,New sum-product algorithm using approximation method for low complexity LDPC decoding,"Jae Hee Han, Myung Hoon Sunwoo","This paper proposes a new sum-product algorithm to improve BER performance for low-density parity-check codes. The proposed algorithm can replace multiplications and divisions with additions and subtractions by adding the logarithmic and exponential functions. In addition, the proposed algorithm can simplify both the ln[tanh(x)] and tanh-1[exp(x)] functions by using two quantization tables which c...",,24-25 Nov.,10.1109/SOCDC.2008.4815676,https://ieeexplore.ieee.org/document/4815676,new
ieee:4815678,conference,Low complexity soft-decision demapper for high order modulation of DVB-S2 system,"Jang Woong Park, Myung Hoon Sunwoo, Pan Soo Kim, Dae-Ig Chang","This paper presents an efficient soft-decision demapper interface and a low complexity demapper for high-order modulation scheme. The proposed soft-decision demapper interface can operate at a symbol rate and replace the parallel to serial converter by locating between the M-PSK demodulator and the soft-decision demapper. In addition, the proposed soft-decision demapper can reduce the hardware com...",,24-25 Nov.,10.1109/SOCDC.2008.4815678,https://ieeexplore.ieee.org/document/4815678,new
ieee:4696906,conference,Analog Logic Automata,"Kailiang Chen, Jonathan Leu, Neil Gershenfeld","Analog logic circuits work on digital problems using an analog representation of the digital variables, relaxing the state space of the digital system from the vertices of a hypercube to the interior. This lets us gain speed, power, and accuracy over digital implementations. Logic automata are distributed, scalable and programmable digital computation media with local connections and logic operati...",,20-22 Nov.,10.1109/BIOCAS.2008.4696906,https://ieeexplore.ieee.org/document/4696906,new
ieee:4737395,conference,A stopping criterion for nonbinary LDPC codes over GF(q),"Xin Chen, Aidong Men, Wei Zhou","Nonbinary low-density parity-check (LDPC) codes over finite fields GF(q) have a better performance than those of the binary low-density parity-check codes, at short and medium block lengths, but the decoder of GF(q)-LDPC has more complexity. In this paper, a new stopping criterion is proposed. Based on the changes of the variance of variable node¿s extrinsic information, the criterion can predict ...",,19-21 Nov.,10.1109/ICCS.2008.4737395,https://ieeexplore.ieee.org/document/4737395,new
ieee:4737397,conference,Compressing construction of QC-LDPC codes,"Shuqi Sun, Wuyang Zhou","Two compressing construction methods of Quasi-Cyclic LDPC (QC-LDPC) codes are proposed, which can be called recursive-compressing and single-compressing respectively. Selecting a good QC-LDPC code as the Mother, the son codes constructed through the compressing methods are still good codes, i.e., have high girth and few short cycles, moreover, they have continuous code length and require smaller m...",,19-21 Nov.,10.1109/ICCS.2008.4737397,https://ieeexplore.ieee.org/document/4737397,new
ieee:4737391,conference,Good encodable irregular quasi-cyclic LDPC codes,"Yang Xiao, Kiseon Kim","The existing encodable irregular LDPC codes may have a degraded BER performance when it is derived from classical regular QC LDPC codes since both girth property and weight property are not carefully given attention to two or more thing, which lead to some codes with large girths have small minimum weights and poor BER performance. To solve the problem, we propose a new approach to construct the e...",,19-21 Nov.,10.1109/ICCS.2008.4737391,https://ieeexplore.ieee.org/document/4737391,new
ieee:4737394,conference,The analysis of cycle structure for a class of quasi-cyclic LDPC codes,"Jing Lei, Jianhui Wang, Yongqiang Gao","In this paper, we analyse the cycle structure of a class of quasi-cyclic LDPC codes, and divide the cycles of this kind of LDPC codes into three classes. It offers some help for improving the existing construction algorithms of this kind of LDPC codes. The cycles in base matrix could be extended as long as possible when p the row¿s(or column¿s) number of block-elements was prime.",,19-21 Nov.,10.1109/ICCS.2008.4737394,https://ieeexplore.ieee.org/document/4737394,new
ieee:4737184,conference,A method to construct girth-8 low density lattice codes,"Xiaosong Wang, Guiran Chang","First a new lattice coding scheme, low density lattice codes (LDLC), and its iterative decoding algorithm are introduced in this paper. Based on circular shift of the candidate sequence and the removal of size-6 loop, a new method is proposed to form a LDLC check matrix with minimum loop size 8. Simulation results show that the performance using the girth-8 check matrix can be improved efficiently...",,19-21 Nov.,10.1109/ICCS.2008.4737184,https://ieeexplore.ieee.org/document/4737184,new
ieee:4766569,conference,Improved performance irregular quasi-cyclic LDPC code design from BIBD’s using threshold minimization,"Siddarama R. Patil, Sant S. Pathak",In this paper we propose a novel method for designing irregular quasi-cyclic low-density parity-check (LDPC) codes from Balanced Incomplete Block Designs (BIBDpsilas). The design method hinges around finding the optimum degree profile by minimizing the threshold using density evolution. The approach for designing short block length codes is robust for practical implementation and has been found to...,,19-21 Nov.,10.1109/TENCON.2008.4766569,https://ieeexplore.ieee.org/document/4766569,new
ieee:4737274,conference,Log-domain iterative decoding combined USTM with codes over GF(2m) on flat Rayleigh fading channel,"Haiyan Cao, Guangqiu Li, Zemao Zhao, Jun Li","In this paper, a serial concatenated scheme combining USTM with LDPC codes over GF(2m) is presented. A modulation technique of USTM, Unitary space-time modulation, can efficiently work on decoding when the channel state information is unknown at the receiver in multi-input multi output system over flat raleigh fading channel. The BER performance of USTM system in MIMO channel will largely be impro...",,19-21 Nov.,10.1109/ICCS.2008.4737274,https://ieeexplore.ieee.org/document/4737274,new
ieee:4737396,conference,Flexible low-complexity decoding architecture for QC-LDPC codes,"Nan Jiang, Kewu Peng, Zhixing Yang","A novel flexible decoding architecture for quasi-cyclic (QC) low-density parity-check (LDPC) code is proposed in this paper to reduce decoding complexity. The novelty of this architecture lies in a new time-sharing scheme of processing units, which provides low complexity and flexible serial factor of decoding hardware. Without loss of coding performance, the architecture requires significantly le...",,19-21 Nov.,10.1109/ICCS.2008.4737396,https://ieeexplore.ieee.org/document/4737396,new
ieee:4737457,conference,Design and optimization of joint network-channel LDPC code for wireless cooperative communications,"Du Bing, Zhang Jun","In this paper, we develop a joint design method of network-channel low density parity check codes (LDPC) codes by constructing joint network-channel parity check matrix. Random network coding is performed to provide side information for both the source and relay¿s transmission. This system matrix makes an easy way to collect all independent signal copies to provide a spatial diversity gain. And th...",,19-21 Nov.,10.1109/ICCS.2008.4737457,https://ieeexplore.ieee.org/document/4737457,new
ieee:4737183,conference,Comparison of decoding turbo Gallager codes in hybrid decoding arrangements with different iterative decoders over the erasure channel,"Li Yang, Marcel Ambroze, Martin Tomlinson","In this paper, different iterative decoders for turbo Gallager codes are optimised and compared for the binary erasure channel. The complexity and performance differences between turbo decoder, BCJR-based Look-Up Table decoder and belief propagation decoder are analysed and evaluated. A hybrid decoding arrangement, which uses an iterative decoder followed by a maximum likelihood ¿In-Place¿ matrix ...",,19-21 Nov.,10.1109/ICCS.2008.4737183,https://ieeexplore.ieee.org/document/4737183,new
ieee:4766717,conference,Performance analysis of Raptor codes in Wi-Max systems over fading channel,"P. Palanisamy, T.V.S. Sreedhar","In modern wireless communication systems, forward error correcting codes are employed for efficient transmission of data in noisy environments. Achieving a very less bit error rate (BER) has been the major task in the field of error control coding. The recently developed Raptor codes, which are a class of Fountain codes and the extension of LT codes, tend to give better performance than the low de...",,19-21 Nov.,10.1109/TENCON.2008.4766717,https://ieeexplore.ieee.org/document/4766717,new
ieee:4737393,conference,Shaping gain for AWGN channel by non-uniform constellation in LDPC-Coded system,"Xiaoqing Wang, Jian Fu, Jun Wang, Changyong Pan, Zhixing Yang","It is commonly believed that there is a gap between the channel capacity and the highest achievable rate of equiprobable uniform constellation. To achieve shaping gain, non-uniform constellation following a Gaussian distribution has been designed for the AWGN channel and discussed widely along with Turbo codes. In this paper, we investigate the effect of non-uniform constellation and propose a sch...",,19-21 Nov.,10.1109/ICCS.2008.4737393,https://ieeexplore.ieee.org/document/4737393,new
ieee:4737398,conference,An efficient early stopping scheme for LDPC decoding based on check-node messages,"Z. H. Cai, J. Hao, L. Wang",An efficient early stopping method is proposed in this paper to reduce the average number of iterations for low density parity check (LDPC) decoders. The method is very efficient especially when the channel signal-to-noise ratio (SNR) is low. It is based on the estimation of the log-likelihood ratio (LLR) messages of the check nodes.,,19-21 Nov.,10.1109/ICCS.2008.4737398,https://ieeexplore.ieee.org/document/4737398,new
ieee:4737185,conference,Efficient performance evaluation of Forward Error Correcting codes,"S. Kakakhail, S. Reynal, D. Declercq, V. Y. Heinrich",Standard Monte Carlo (SMC) simulation is employed to evaluate the performance of forward error correcting (FEC) codes. This performance is in terms of the probability of error during the transmission of information through digital communication systems. The time taken by SMC simulation to estimate the FER increases exponentially with the increase in signal-to-noise ratio (SNR). We hereby present a...,,19-21 Nov.,10.1109/ICCS.2008.4737185,https://ieeexplore.ieee.org/document/4737185,new
ieee:4737413,conference,Analysis and performance comparison of DVB-T and DTMB systems for terrestrial digital TV,"Ming Liu, Matthieu Crussiere, Jean-Francois Helard, Oudomsack Pierre Pasquero","Orthogonal frequency-division multiplexing (OFDM) is the most popular transmission technology in digital terrestrial broadcasting (DTTB), adopted by many DTTB standards. In this paper, the bit error rate (BER) performance of two DTTB systems, namely cyclic prefix OFDM (CP-OFDM) based DVB-T and time domain synchronous OFDM (TDS-OFDM) based DTMB, is evaluated in different channel conditions. Spectru...",,19-21 Nov.,10.1109/ICCS.2008.4737413,https://ieeexplore.ieee.org/document/4737413,new
