ID,Type,Title,Status,Reason,Authors,Abstract,Categories,Published,DOI,PDF URL
ieee:11100947,conference,SC-CDM: Enhancing Quality of Image Semantic Communication with a Compact Diffusion Model,❌,세만틱 통신 + diffusion 이미지 전송; ECC 디코더/코드설계 기여 없음,"Kexin Zhang, Lixin Li, Wensheng Lin, Yuna Yan, Wenchi Cheng, Zhu Han","Semantic Communication (SC) is an emerging technology that has attracted much attention in the sixth-generation (6G) mobile communication systems. However, few literature has fully considered the perceptual quality of the reconstructed image. To solve this problem, we propose a generative SC for wireless image transmission (denoted as SC-CDM). This approach leverages compact diffusion models to improve the fidelity and semantic accuracy of the images reconstructed after transmission, ensuring that the essential content is preserved even in bandwidth-constrained environments. Specifically, we aim to redesign the swin Transformer as a new backbone for efficient semantic feature extraction and compression. Next, the receiver integrates the slim prior and image reconstruction networks. Compared to traditional Diffusion Models (DMs), it leverages DMs’ robust distribution mapping capability to generate a compact condition vector, guiding image recovery, thus enhancing the perceptual details of the reconstructed images. Finally, a series of evaluation and ablation studies are conducted to validate the effectiveness and robustness of the proposed algorithm and further increase the Peak Signal-to-Noise Ratio (PSNR) by over 17% on top of CNN-based DeepJSCC.",,8-12 Dec. ,10.1109/GCWkshp64532.2024.11100947,https://ieeexplore.ieee.org/document/11100947
ieee:10901255,conference,From Biology to Communication: A Practice for the Non-uniform Constellations Design,❌,"비균일 성상도(NUC) 설계·복조 기법으로 LDPC ECC와 무관, 떼어낼 디코더/코드설계 기법 없음","Dong Wang, Shiwen Ma, Xiangying Hu, Chunhua Wang, Rongrong Li, Jia Wang","Non-uniform constellations (NUCs) present a promising technique to improve the spectral efficiency whereas the existing NUCs do not fully exploit the degree of freedom for the constellation design. This paper performs an interesting practice of the biology-motivated communication design to geometrically arrange the constellations. Specifically, we reformulate the traditional constellation design problem as the seed arrangement problem within a circular region. The centroidal Voronoi tessellation is employed to model the seed growth for enlarging the Euclidean distances among the constellations. Besides, we propose a particle swarm optimization based constellation design to minimize the averaged bit error probability. Finally, a lightweight machine learning enhanced demodulation is developed to reduce the complexity introduced by the asymmetric feature of NUCs. Simulation results demonstrate that the proposed scheme outperforms quadrature amplitude modulation and gold angle modulation, highlighting the potential of biology-inspired design techniques for communication systems.",,8-12 Dec. ,10.1109/GLOBECOM52923.2024.10901255,https://ieeexplore.ieee.org/document/10901255
ieee:10901224,conference,Saturation Throughput Analysis of Hybrid Access MAC Protocol in IEEE 802.11ax WLANs,❌,"WLAN MAC 프로토콜 처리량 분석, ECC/LDPC 무관","S. Arthi, Neelesh B. Mehta","Current generation wireless local area networks (WLANs) based on the IEEE 802.11ax standard employ a novel hybrid medium access control (MAC) protocol, which combines contention-based random access (UORA) and contention-free scheduled access (SA) transmissions over orthogonal resource units (RUs). We present a novel fixed-point analysis of the saturation throughput of IEEE 802.11ax that accounts for hybrid access, discrete rate adaptation, and schedulers. Our analysis captures the dynamic flow of users between UORA and SA in hybrid access. The variability in the number of users, which depends on the number of RUs allocated to UORA and the MAC contention protocol, affects the performance of the scheduler. Our approach differs from the literature, which models either UORA or SA (but not both) or assumes a fixed number of SA users. Our results verify the accuracy of the analysis despite its simplicity and reveal that the conventional approaches can overestimate the UORA and SA throughputs.",,8-12 Dec. ,10.1109/GLOBECOM52923.2024.10901224,https://ieeexplore.ieee.org/document/10901224
ieee:10901264,conference,Scalable and Reliable Over-the-Air Federated Edge Learning,❌,"AirComp 연합학습용 격자(lattice) 부호 구성으로 LDPC 무관, NAND 이식 기법 없음","Maximilian Egger, Christoph Hofmeister, Cem Kaya, Rawad Bitar, Antonia Wachter-Zeh","Federated edge learning (FEEL) has emerged as a core paradigm for large-scale optimization. However, FEEL still suffers from a communication bottleneck due to the transmission of high-dimensional model updates from the clients to the federator. Over-the-air computation (AirComp) leverages the additive property of multiple-access channels by aggregating the clients’ updates over the channel to save communication resources. While analog uncoded transmission can benefit from the increased signal-to-noise ratio (SNR) due to the simultaneous transmission of many clients, potential errors may severely harm the learning process for small SNRs. To alleviate this problem, channel coding approaches were recently proposed for AirComp in FEEL. However, their error-correction capability degrades with an increasing number of clients. We propose a digital lattice-based code construction with constant error-correction capabilities in the number of clients, and compare to nested-lattice codes, well-known for their optimal rate and power efficiency in the point-to-point AWGN channel.",,8-12 Dec. ,10.1109/GLOBECOM52923.2024.10901264,https://ieeexplore.ieee.org/document/10901264
ieee:10900996,conference,CRC-Aided Adaptive Successive Cancellation List Decoder for 5G NR Polar Codes Using RBIR,❌,"Polar 코드 CA-SCL 디코더, LDPC 아님 — 대상 부호 불일치","Anusha Gunturu, Ashok Kumar Reddy Chavva","Cyclic redundancy check (CRC)-aided successive cancellation list (SCL) decoder, also termed as CA-SCL decoder, is used for decoding the polar codes in practical 5G new radio (NR) systems. The list size used in CA-SCL decoder is directly proportional to the power consumption and the complexity of the decoding process. In practice, a fixed list size (L) is used for CA-SCL decoding. However, we have observed that the required list size varies with signal to noise ratio (SNR) for achieving a target block error rate (BLER) performance. In this paper, we propose an adaptive CA-SCL (CA-ASCL) decoding algorithm, that reduces the average list size and hence the complexity of the CA-SCL decoder by identifying the right list size to be used for each decoding process, using a link abstraction metric called received bit information rate (RBIR), that maps to received SNR. We show that for a target BLER of 10%, the proposed CA-ASCL decoder that chooses the list size adaptively among the set {2, 4, 8, 16, 32} has upto 61.51% reduction in list size compared to that of CA-SCL decoder with L = 32, without any loss in BLER performance, and upto 72.23% reduction with performance loss limited to 0.05 dB in SNR, respectively, for 3GPP defined 5G NR TDL-A channel model, with delay spread of 30 ns and maximum Doppler shift of 100 Hz.",,8-12 Dec. ,10.1109/GLOBECOM52923.2024.10900996,https://ieeexplore.ieee.org/document/10900996
ieee:11101532,conference,An Over-the-Air Multi-user Tailbiting Code for URLLC,❌,tail-biting 컨볼루션 코드(TBCC) + Viterbi; LDPC 무관,"Rafael Santos, Daniel Castanheira, Adão Silva, Atílio Gameiro","The strict latency and reliability requirements of URLLC are particularly difficult to comply with, due to the inherent trade-off between these two factors. Most applications falling under the URLLC umbrella rely on the exchange of small packets. Convolutional codes (CC) exhibit near-optimal performance when encoding small information blocks. In order to operate in packet based transmission, it is necessary to introduce some kind of termination to the CC. Tail-biting CCs (TBCC) avoid rate loss and maintains equal error protection for all information bits. However, its ML decoding algorithm requires a Viterbi algorithm (VA) execution for each possible initial trellis states, which rapidly becomes unpractical. This becomes increasingly problematic in a multi-user scenario, where several URLLC users need fast decoding at the same time. This work proposes a novel distributed multi-user TBCC (MU-TBCC) coding scheme, which completely eliminates the ZTCC rate-loss and reduces decoding complexity for any multi-user scenario. In fact, the decoding algorithm complexity converges to the one of the VA as the number of users increase. The results shows that, as the SNR increases, the error performance of the MU-TBCC approaches the one of orthogonal transmissions. This scheme can be also interpreted as non-orthogonal multiple access scheme, whose structure enables efficient joint detection and decoding.",,8-12 Dec. ,10.1109/GCWkshp64532.2024.11101532,https://ieeexplore.ieee.org/document/11101532
ieee:10901839,conference,Nonlinear-Transform Source-Channel Coding for Cooperative Relay Networks,❌,"비선형 변환 소스-채널 결합부호(JSCC) — LDPC ECC 기법 아님, 제외 대상","Tong Jiao, Yilun Zhang, Zhongwei Si","In this paper, we propose a novel nonlinear-transform source-channel encoding and decoding scheme for cooperative relay (NTSC-R) systems. This scheme initially maps the source image to a latent space using a learned nonlinear-analysis transform, generating a latent representation. This representation is then encoded into variable-length codewords, which are broadcast to both the relay and destination. At the relay, the messages are either amplified and forwarded (AF) or decoded and forwarded (DF) to the destination. The destination integrates these signals, taking into account their respective contributions to the outcome, to reconstruct a higher-quality image. Unlike existing deep joint source-channel coding (deep JSCC) methods, our approach incorporates an entropy model as a prior for the latent representation, which enables the encoder to adapt codeword lengths based on the significance of the information. At the destination, the receiver merges information considering the quality and confidence level of each received signal. The entire system is trained end-to-end to optimize rate-distortion performance under established metrics. The simulations demonstrate that the proposed NTSC-R outperforms traditional baselines using BPG compression and polar codes, as well as current deep JSCC methods in both AF and DF modes across various image resolutions.",,8-12 Dec. ,10.1109/GLOBECOM52923.2024.10901839,https://ieeexplore.ieee.org/document/10901839
ieee:10901165,conference,Turbo Equalization with Coarse Quantization using the Information Bottleneck Method,✅,"Information Bottleneck 기반 coarse 양자화 LUT 디코더/HW — LLR 양자화·LUT 디코더 기법 NAND 이식 가능(C/D), 애매하면 살림","Philipp Mohr, Jasper Brüggmann, Gerhard Bauch","This paper proposes a turbo equalizer for inter-symbol interference channels (ISI) that uses coarsely quantized messages across all receiver components. Lookup tables (LUTs) carry out compression operations designed with the information bottleneck method aiming to maximize relevant mutual information. The turbo setup consists of an equalizer and a decoder that provide extrinsic information to each other over multiple turbo iterations. We develop simplified LUT structures to incorporate the decoder feedback in the equalizer with significantly reduced complexity. The proposed receiver is optimized for selected ISI channels. A conceptual hardware implementation is developed to compare the area efficiency and error correction performance. A thorough analysis reveals that LUT-based configurations with very coarse quantization can achieve higher area efficiency than conventional equalizers. Moreover, the proposed turbo setups can outperform the respective non-turbo setups regarding area efficiency and error correction capability.",,8-12 Dec. ,10.1109/GLOBECOM52923.2024.10901165,https://ieeexplore.ieee.org/document/10901165
ieee:11100878,conference,Wireless Video Transmission with Joint Semantic-Channel Coding,❌,"세만틱-채널 결합 코딩(JSCC); LDPC는 비교 베이스라인일 뿐, 떼어낼 ECC 기법 없음","Yinhuan Huang, Zhijin Qin","With the advent of the 6G era, the efficient transmission of large-scale, high-resolution videos poses a significant challenge to existing communication systems. Compared to traditional video communication systems, which are becoming increasingly complex and difficult to optimize, semantic communication offers new possibilities and flexibility for optimization, effectively resisting noise interference with low-design-complexity joint coding. In this paper, we propose an efficient semantic-channel joint coding model for wireless video transmission, which adjusts the rate output based on the contextual information of video sequences and channel conditions, ensuring the reliability of video transmission even under different channel conditions. Across standard video test sequences under different scenarios, experiments show that under reliable channel state conditions, our scheme can save 22% to 56% of bandwidth compared to traditional video wireless transmission systems composed of H.265, 5G LDPC, and digital modulation, while also overcoming the cliff effect and achieving efficient video transmission under harsh channel conditions. Our scheme provides strong technical support for the practical application of semantic communication.",,8-12 Dec. ,10.1109/GCWkshp64532.2024.11100878,https://ieeexplore.ieee.org/document/11100878
ieee:11117413,conference,An LDPC Decoding Method Using a Neural Network as a De-Mapper,✅,신경망 디맵퍼 + 수정 BP 결합 LDPC 디코더 — 이식 가능한 신경망 디코더 기법(C),"Shuailong Zhu, Lijun Zhang","In this paper, we propose a novel LDPC decoding model that employs a fully connected neural network as a demapper to achieve excellent decoding performance while maintaining low computational complexity and computational effort. This neural network model does not need to rely on external coding during the training process, thus significantly reducing the required computational resources. In addition, the model can quickly converge to a parameter configuration with excellent performance through a limited number of iterations. To further enhance the decoding results, this paper also combines this neural demapper with a modified version of the confidence propagation (BP) algorithm. The integrated model achieves excellent decoding performance while keeping the computational load low, even under more stringent conditions.",,6-8 Dec. 2,10.1109/IAECST64597.2024.11117413,https://ieeexplore.ieee.org/document/11117413
ieee:10899709,conference,Downlink and Uplink Performance of Polar Codes in 5G Standard,❌,"5G 폴라 코드 성능 평가, LDPC는 비교 베이스라인일 뿐 떼어낼 ECC 기법 없음","Amit Kumar Shrivastava, Tallam Sai Nithin, Rohit Bethala, Vijay Rao Kumbhare, Ashwini Kumar Varma, Bittu Kumar","Polar coding is primarily used as a channel coding scheme for downlink and uplink control information related to enhanced Mobile Broadband Communication service. Therefore, this work evaluates complexity and the Block Error Rate (BLER) performance of polar codes in 5G standard which use the concept of channel polarization. At first, message segmentation is performed that is followed by Cyclic Redundancy Check (CRC) encoding. Further, the input bits interleaving and sub channel al-location are carried out. Furthermore, polar code encoding, sub-block interleaving, and rate matching are performed. Moreover, decoding is performed using CRC-assisted successive cancellation list decoding. BLER for different list sizes and code rates are demonstrated at various Signal-to-Noise for both downlink and uplink. Low complexity encoding and better BLER performance than Low-Density Parity Check codes is also shown.",,6-8 Dec. 2,10.1109/CICT64037.2024.10899709,https://ieeexplore.ieee.org/document/10899709
ieee:11117794,conference,Fault-Tolerant Polar Code Decoding Algorithm for Satellite Communication,❌,"폴라 코드 BP 디코더의 회로 결함 내성 기법, LDPC 부호 아님이며 NAND 이식 기법 없음",Yuanhao Yang,"As the key underlying technology of communication system, channel coding determines the reliability of information transmission of satellite communication. As a control channel coding scheme in the 5G standard, polar code can realize efficient encoding and decoding of control and instruction information in satellite communications. Therefore, polar code has good performance and potential for development and improvement in satellite communication. As one of the decoding algorithms of polar codes, Belief Propagation (BP) decoding has received a lot of attention due to its high degree of parallelism. Because the high radiation environment in satellite communication may cause the circuit failure and generate errors. In this paper, an accumulating polar code decoding algorithm with hardware fault tolerance is designed based on the traditional BP decoding algorithm. The algorithm realizes the algorithm fault tolerance by accumulating the iterative information of the decoder, and does not need to change the original decoding structure. The simulation results show that under a reliable circuit, the cumulative BP decoding algorithm will not cause performance impacts compared to traditional BP decoding. In the case of transient errors in the circuit, it can improve the fault tolerance of the decoder from 10e−6 to 10e−2.",,6-8 Dec. 2,10.1109/IAECST64597.2024.11117794,https://ieeexplore.ieee.org/document/11117794
ieee:10793348,conference,Algebraic Construction of Non-Primitive BCH Codes on GF(2m) with Minimum Distance Checking for Degrees up to 10,❌,"비원시 BCH 부호 대수적 구성 — LDPC 구성에 활용 가능성 언급뿐, 제시된 새 기여는 BCH 부호 자체로 이식할 LDPC 기법 없음","Mustapha Hilia, Bouchaib Aylaj, Fouad Ayoub, Adil Hilmani, Khalil Ibrahimi, Faissal El Bouanani","In coding theory, Bose-Chaudhuri-Hocquenghem (BCH) codes possess an excellent error correction capability, which allows them to become crucial for use in communication and storage systems. However, non-primitive BCH codes that hide interesting properties have received less attention than their primitive counterpart. In this work, we present an algebraic method to construct non-primitive BCH codes of length and dimension fixed, with a varying minimum distance, on a Galois finite field $G F\left(2^{m}\right)$ for extensions of degree m between 4 and 10. In this method, we will describe the construction of generating polynomials using non-primitive algebraic roots and verify the parameters of the codes obtained with an Algebraic Calculator. The resultant list of these non-primitive BCH codes give optimal properties in terms of coding rate and minimum distance, providing valuable flexibility for the construction of Low-density parity check (LDPC) codes.",,4-6 Dec. 2,10.1109/CommNet63022.2024.10793348,https://ieeexplore.ieee.org/document/10793348
ieee:10793358,conference,Analyzing the Impact of Thresholds in Bit-Flipping Decoding for QC-MDPC based McEliece cryptosystems,❌,QC-MDPC McEliece 암호용 bit-flipping threshold 분석 — 코드기반 암호/보안 도메인이고 MDPC bit-flipping은 NAND 고전 LDPC ECC로 이식할 새 기법 아님,"Abdellatif Kichna, Abderrazak Farchane, Said Hakimi","This paper investigates the effect of various threshold configurations in the bit-flipping decoding algorithm for quasi-cyclic moderate density parity-check (QC-MDPC) codes within the McEliece cryptosystem. The choice of threshold plays a crucial role in determining the efficiency and accuracy of error correction in these code-based cryptographic schemes. We propose and evaluate several threshold formulas, comparing their performance across different error weights and security levels. Our results highlight the impact of threshold adjustments on the average number of decoding iterations, decoding failure rates (DFR), and syndrome weight behavior over multiple iterations. Through extensive simulations, we demonstrate how optimal threshold selection can significantly enhance the decoding process, providing insights for improving the robustness of postquantum secure McEliece cryptosystems.",,4-6 Dec. 2,10.1109/CommNet63022.2024.10793358,https://ieeexplore.ieee.org/document/10793358
ieee:10822884,conference,On Using BERT Embeddings for Text Semantic Communication,❌,"BERT 임베딩 기반 텍스트 시맨틱 통신; LDPC ECC 무관, 떼어낼 채널코딩 기법 없음","Asma Mahgoub, Elias Yaacoub","The current technological advancements carry stringent communication requirements. These requirements cannot be achieved by current networks. Therefore, a new paradigm called semantic communication is proposed. Semantic communication is the transmission of the meaning of data. Different semantic communication algorithms were proposed in literature, but they are complex and non-universal. In this work, a text semantic communication algorithm will be modified to be simple and universal. The modified algorithm uses a transformer network with 1 encoder layer and 3 decoder layers. The embedding layer uses pretrained embeddings from a Bidirectional Encoder Representations from Transformers (BERT) model. The algorithm is trained to optimize both the cross-entropy loss and the mutual information. Training and testing are done using the European parliament proceedings dataset. The performance of the modified algorithm is comparable to the original algorithm although it uses 50% of the layers. This work indicates the potential of using pretrained embeddings to simplify and enhance universality of existing semantic communication algorithms.",,3-5 Dec. 2,10.1109/HONET63146.2024.10822884,https://ieeexplore.ieee.org/document/10822884
ieee:10929121,conference,Analysis of JPEXIT Decoding Thresholds for DP-LDPC Based on Global and Separating Strategies,❌,"JSCC용 DP-LDPC의 JPEXIT 임계값 분석으로 소스-채널 결합 + 순수 이론, 떼어낼 ECC 기법 없음","Shiyao Li, Lin Zhou, Sanya Liu, Qiufang Lian, Songhe Lu","Double Photograph LDPC Codes (DP-LDPC) demonstrate superior Bit Error Rate (BER) performance in Joint Source-Channel Coding (JSCC) systems compared to Source-Channel Separation Coding systems. To analyze the theoretical performance of DP-LDPC codes, this paper employs Joint Photograph Extrinsic Information Transfer (JPEXIT) chats as a tool for performance assessment. We design both global strategy and separating strategy JPEXIT for decoding threshold analysis. The results indicate that the decoding thresholds of the global strategy and separating strategy JPEXIT are nearly equal under the same joint base matrix. Additionally, the time complexity of both strategies is the same. However, from the perspectives of code implementation complexity and program execution time, the global strategy JPEXIT is more advantageous.",,27-29 Dec.,10.1109/EIECC64539.2024.10929121,https://ieeexplore.ieee.org/document/10929121
ieee:10929261,conference,Integration and Configuration of LDPC IP Cores in FPGAs,❌,"5G 무선용 LDPC IP 코어 FPGA 통합으로 표준 LDPC 적용 수준, 새 디코더/HW 아키텍처 기여 없음","Zhaochuan Wei, Qingfeng Guo, Jingyue Huang, Yuanfa Ji","Low-density parity check (LDPC) coding is an efficient error-correction coding technique that is widely used in modern wireless communication systems, especially excelling in high signal-to-noise ratio environments. With the increased demand for high-speed data transmission and low latency in wireless communications, LDPC coding has become a key technique to improve the performance of communication systems. In this paper, we discuss the integration and configuration of LDPC IP cores in FPGAs, focus on the integration strategy to implement the LDPC encoding and decoding process on FPGA platforms, propose an optimized integration scheme, and validate its effectiveness in 5G applications through tests. The study aims to provide theoretical basis and practical guidance for the application of LDPC coding in future FPGA designs, and to promote the wide application of this technology in the field of wireless communications.",,27-29 Dec.,10.1109/EIECC64539.2024.10929261,https://ieeexplore.ieee.org/document/10929261
