ID,Type,Title,Status,Reason,Authors,Abstract,Categories,Published,DOI,PDF URL
ieee:10917564,conference,Restoring Unintended Model Learning by Error Correcting Code,❌,"모델 파라미터 복원에 ECC 적용, LDPC ECC 부호설계/디코더 기법 아님 — 채널코딩 ECC 아님","Nami Ashizawa, Toshiki Shibahara, Naoto Kiribuchi, Osamu Saisho, Naoto Yanai","This paper proposes a method to restore model parameters after unintended training to those before such training by error correction. Restoring model parameters with error-correcting code helps the model avoid relearning from scratch and storing model parameters in the cloud. Error correction restores a message even with some errors through its transmission. Decoding the codeword generated by encoding a message corrects errors in the message. In this paper, we regard parameter changes caused by training as errors and restore the changed parameters to their prior by error correction. The proposed method can reduce the error-correcting costs while maintaining the accuracy of model inference by restoring only part of the more critical parameters. The metrics to select parameters for error correction are the influence of a parameter on training. We apply a technique of model pruning that observes the backpropagation process to define the influence. We experimentally evaluated the proposed error correction for model parameters under two scenarios: injecting incorrect data to mislead models and specializing the model, namely overfitting, by learning more epochs than necessary. We used Convolutional Neural Networks (CNNs) and vision transformer (ViT) trained to classify images in the experiment. The experimental results show that error correction restored inference outputs under the scenarios up to 60.75% of the inference outputs before learning the scenarios, even when it saved more than 33.97% of the computational costs and corrected errors of the 80% parameters.",,9-10 Dec. ,10.1109/ACSACW65225.2024.00013,https://ieeexplore.ieee.org/document/10917564
ieee:11101127,conference,The Hybrid Decoder of Belief Propagation and Ordered Statistics Decoding for LDPC Codes,✅,"짧은 LDPC용 BP+OSD 하이브리드 디코더, 이식 가능한 새 디코더 알고리즘(C)","Xuanyu Li, Kai Niu, Yuxin Han","To enhance the performance of short low-density parity-check (LDPC) codes, we introduce an innovative hybrid decoder that seamlessly integrates belief propagation (BP) with ordered statistics decoding (OSD). This hybrid approach initially employs BP to decode received vectors until successful or upon reaching specified conditions, either a maximum iteration limit or a trapping iteration threshold, indicating the stagnation of BP’s hard output. Upon these conditions, the decoder transitions to a pre-configured error pattern (PEP) OSD. The PEPOSD phase then pursues a valid result, flexibly utilizing either the received vectors or the soft values of BP as input, contingent upon the signal-to-noise ratio (SNR). Given the minimal error overlap between BP and OSD, simulations reveal that this hybrid decoder achieves a notable gain of 1.5dB over BP and 0.3-0.6dB over PEPOSD, while maintaining comparable complexity to BP alone.",,8-12 Dec. ,10.1109/GCWkshp64532.2024.11101127,https://ieeexplore.ieee.org/document/11101127
ieee:11100470,conference,Rate-Compatible Root-Protograph-based LDPC Codes for IR-HARQ Systems,❌,"IR-HARQ 블록페이딩용 root-protograph RC-LDPC 코드 설계 — full-diversity는 페이딩 채널 특이적, NAND(메모리)에 이식할 코드설계 기여 약함","Zhaojie Yang, Xiaoxi Yu, Yi Fang, Yong Liang Guan","This paper studies a new type of root-protograph-based low-density parity-check (RP-LDPC) codes, called rate-compatible RP-LDPC (RC-RP-LDPC) codes, designed for the incremental-redundancy hybrid ARQ (IR-HARQ) system over block-fading (BF) channels. We begin the study with analyzing the limitations of traditional RP-LDPC codes in the IR-HARQ system over BF channels, revealing that they fail to achieve full diversity in this scenario. To address this issue, we propose a design methodology for RC-RP-LDPC codes, which can guarantee that the resultant codes not only have both full-diversity property and outage-limit-approaching performance, but also can realize rate compatibility. The outage-boundary analyses and word-error-rate (WER) simulations demonstrate that the proposed RC-RP-LDPC codes significantly outperform prior-art protograph LDPC and RP-LDPC codes in the IR-HARQ system over BF channels.",,8-12 Dec. ,10.1109/GCWkshp64532.2024.11100470,https://ieeexplore.ieee.org/document/11100470
ieee:10901442,conference,An Efficient Ordered Likelihood Decoder for Rate-Compatible Short LDPC codes,✅,단블록 LDPC용 BP+OSD 변형(MB-OLD) 디코더 신규 제안 — C 이식 가능 디코더 알고리즘,"Chunjie Li, Ke Zhang, Ye Wang, Jian Jiao, Xiao Ma, Qinyu Zhang","This paper proposes a concatenated multi-belief ordered likelihood decoding (MB-OLD) algorithm for rate-compatible (RC) short low-density parity check (LDPC) codes, where the output log-likelihood ratios (LLRs) of belief propagation (BP) are sent to a well-designed bit-flipping decoder, which we called ordered likelihood decoder (OLD). In contrast to conventional ordered statistic decoder (OSD), the test error patterns (TEPs) sequence of OLD is generated from most likely to least likely, where the ordered reliability sequence associated with the most reliable basis (MRB) is approximated as multiple lines, and a stopping criterion (SC) is taken to reduce the decoding complexity. Furthermore, we analyze the LLR behavior of BP decoder in short block-length regimes, and propose an optimal iteration number. Based on these analyses, the output LLRs of BP within the optimal number of iterations are well combined and sent to OLD. Simulation results show that the proposed MB-OLD has the superior decoding performances in terms of error-rate and decoding complexity than its counterparts.",,8-12 Dec. ,10.1109/GLOBECOM52923.2024.10901442,https://ieeexplore.ieee.org/document/10901442
ieee:11100961,conference,Low Complexity High Throughput Coding Scheme for 6G Immersive Communication,✅,QC-SC-LDPC 구성 + 4-bit AQNMSA(적응 양자화 정규화 min-sum) + row-parallel/layered 슬라이딩윈도; 저비트폭 디코더·HW 이식 가능(C/D/E),"Xia An, Chao Zhang, Kewu Peng, Zhitong He, Jian Song","The immersive communication scenario in 6G, stemming from the enhanced mobile broadband (eMBB) scenario in 5G, demands low-complexity high-throughput channel coding scheme due to its huge data traffic. The current data channel coding scheme of eMBB, i.e., 5G new radio (5G-NR) low-density parity-check (LDPC) codes, shows limitation on further improvements of high throughput due to their highly irregular base graph structure. In this paper, we first introduce a rate compatible quasi-cyclic (QC-) spatially-coupled (SC-) LDPC code structure, and then apply an adaptive quantized and normalized min-sum algorithm (AQNMSA) with very low message passing bit-width of 4-bit to the QC-SC-LDPC codes. The asymptotic decoding thresholds provided by multi-edge-type density evolution tool and the simulation results both show that QC-SC-LDPC codes with 4-bit AQNMSA have better decoding performance than conventional non-adaptive normalized min-sum algorithm as well as approaching decoding performance compared to 5G-NR LDPC codes with optimal belief propagation decoding. In general, QC-SC-LDPC codes with AQNMSA, row-parallel architecture, and layered-scheduling sliding window decoding could achieve superior decoding performance than current coding scheme, including at least 30 times of throughput gain and better decoding performance with lower decoding complexity.",,8-12 Dec. ,10.1109/GCWkshp64532.2024.11100961,https://ieeexplore.ieee.org/document/11100961
ieee:11100976,conference,Low-Complexity Layered Decoding for LDPC Codes,✅,"layered 디코딩 복잡도 감소: 신뢰 높은 비트채널 기반 variable node 비활성화 기법, NAND LDPC 디코더 이식 가능(C)","Heping Wan, Joonyoung Cho, Min Jang, Charlie Jianzhong Zhang","This paper presents methods to reduce the complexity of the layered decoding for LDPC codes with negligibly impacting the error-correcting performance. We accomplish this by deactivating variable nodes. The LLR updates associated with the deactivated variable nodes are skipped. To determine which variable nodes should be deactivated, the most reliable bit-level channels, derived from the M−ary input channel, are identified. Then, from the variable nodes assigned to the most reliable bit-level channels, we select those with initial LLRs above a threshold as the deactivated variable nodes. We establish an analytical relationship between the threshold and a desired error probability. The threshold can be adjusted accordingly by specifying the desired error probability. The standard 5G LDPC codes are simulated. By setting the desired error probability to 10−3, more than 20% of the variable nodes are deactivated while the error-correcting performance is preserved.",,8-12 Dec. ,10.1109/GCWkshp64532.2024.11100976,https://ieeexplore.ieee.org/document/11100976
ieee:11100402,conference,Analysis of Efficient Scheduling in Layered Decoding of LDPC Codes,✅,레이어드 BP 스케줄링 분석 및 동적 스케줄링 알고리즘 신규 제안 — C 이식 가능 디코더(LBP 스케줄),"Dongxu Chang, Guanghui Wang, Guiying Yan, Zhiming Ma","In this study, we analyze the characteristics of scheduling sequences for Layered belief propagation (LBP) that can result in efficient decoding on Low-density parity-check (LDPC) codes. Specifically, we claim that scheduling sequences leading to high decoding efficiency should prioritize updating check nodes with lower error probabilities aggregated from neighboring variable nodes. We prove this conclusion separately in both BEC and BI-AWGN channels. Some observable characteristics in ""good"" scheduling sequences regarding row weights, rows connected to punctured columns, and column weights can serve as corollaries to this conclusion. Based on these, we design a dynamic scheduling algorithm, which can further demonstrate the effectiveness of these characteristics through simulation experiments.",,8-12 Dec. ,10.1109/GCWkshp64532.2024.11100402,https://ieeexplore.ieee.org/document/11100402
ieee:11100601,conference,Parallel Network Structure-aided Neural Shuffled Offset Min-Sum Decoder,✅,protograph LDPC용 신경망 shuffled offset min-sum 디코더(NSOMS) 신규 제안 — C 이식 가능 디코더,"Liang Lv, Yurong Wang, Yi Fang, Pingping Chen","The paper carries out an in-depth investigation on the neural decoder design for protograph low-density parity-check (LDPC) codes. To be specific, based on the model-driven method, we propose a new type of protograph neural decoder with the parallel network (ParNet) decoding structure, called neural shuffled offset min-sum (NSOMS) decoder. The ParNet uses the model-driven method to unfold shuffled LDPC decoding algorithms into the interpretable network. Furthermore, with the aid of the over-estimation value (OEV), we optimize the training method to accelerate the convergence speed of the proposed decoding network. Theoretical and simulation results indicate that the proposed NSOMS decoder exhibits desirable performance compared to the state-of-the-art counterparts. Hence, the proposed NSOMS decoder can be regarded as a terrific solution for high-reliability communications.",,8-12 Dec. ,10.1109/GCWkshp64532.2024.11100601,https://ieeexplore.ieee.org/document/11100601
ieee:10901425,conference,Decoding Quantum LDPC Codes Using Graph Neural Networks,❌,"QLDPC를 GNN으로 디코딩 — 양자 코드 대상이며 GNN 디코더가 양자 그래프 구조에 특화, 고전 바이너리 이식 명확치 않아 원칙 제외","Vukan Ninkovic, Ognjen Kundacina, Dejan Vukobratovic, Christian Häger, Alexandre Graell i Amat","In this paper, we propose a novel decoding method for Quantum Low-Density Parity-Check (QLDPC) codes based on Graph Neural Networks (GNNs). Similar to the Belief Propagation (BP)-based QLDPC decoders, the proposed GNN-based QLDPC decoder exploits the sparse graph structure of QLDPC codes and can be implemented as a message-passing decoding algorithm. We compare the proposed GNN-based decoding algorithm against selected classes of both conventional and neural–enhanced QLDPC decoding algorithms across several QLDPC code designs. The simulation results demonstrate excellent performance of GNN-based decoders along with their low complexity compared to competing methods.",,8-12 Dec. ,10.1109/GLOBECOM52923.2024.10901425,https://ieeexplore.ieee.org/document/10901425
ieee:11100905,conference,Practical Decoding for Deep Polar Codes,❌,폴라 코드 + SCL-BPC 디코더; LDPC가 아니며 이식 가능한 LDPC 기법 없음,"Donghwa Han, Min Jang, Donghun Lee, Seho Mlyung, Namyoon Lee","Pre-transformed polar codes constitute a broad class of codes constructed through the serial concatenation of outer codes and polar codes, enhancing the performance of standalone polar codes either by improving the weight distribution or by increasing the error-decay rate. Deep polar codes, a novel variant within this class, are constructed through a pre-transformation that involves a series of nested polar codes with increasing dimensions across layers. The proposed successive cancellation list with backpropagation parity check (SCL-BPC) decoder exploits the parity equations naturally arising from this nested encoding structure. In certain scenarios, deep polar codes with SCL-BPC decoding demonstrate superior performance compared to other pre-transformed polar codes. However, the SCL-BPC algorithm incurs additional decoding complexity and results in uneven decoding times. To address these issues, we investigate the matrix representation of the pre-transformation in deep polar codes and develop efficient implementation solutions for SCL-BPC decoding. Additionally, we introduce a low-complexity approach to SCL-BPC, which exhibits only a marginal reduction in performance.",,8-12 Dec. ,10.1109/GCWkshp64532.2024.11100905,https://ieeexplore.ieee.org/document/11100905
ieee:10901680,conference,Single Sparse Graph Enhanced Expectation Propagation Design for Uplink MIMO-SCMA,❌,"MIMO-SCMA 수신기(SSG-EPA), LDPC는 그래프 통합 베이스라인일 뿐 무선 응용 특이적, 떼어낼 ECC 기법 없음","Qu Luo, Jing Zhu, Gaojie Chen, Pei Xiao, Rahim Tafazolli","Sparse code multiple access (SCMA) and multiple input multiple output (MIMO) are considered as two efficient techniques to provide both massive connectivity and high spectrum efficiency for future machine-type wireless networks. This paper proposes a single sparse graph (SSG) enhanced expectation propagation algorithm (EPA) receiver, referred to as SSG-EPA, for uplink MIMO-SCMA systems. Firstly, we reformulate the sparse codebook mapping process using a linear encoding model, which transforms the variable nodes (VNs) of SCMA from symbol-level to bit-level VNs. Such transformation facilitates the integration of the VNs of SCMA and low-density parity-check (LDPC), thereby emerging the SCMA and LDPC graphs into a SSG. Subsequently, to further reduce the detection complexity, the message propagation between SCMA VNs and function nodes (FNs) are designed based on EPA principles. Different from the existing iterative detection and decoding (IDD) structure, the proposed EPA-SSG allows a simultaneously detection and decoding at each iteration, and eliminates the use of interleavers, de-interleavers, symbol-to-bit, and bit-to-symbol LLR transformations. Simulation results show that the proposed SSG-EPA achieves better error rate performance compared to the state-of-the-art schemes.",,8-12 Dec. ,10.1109/GLOBECOM52923.2024.10901680,https://ieeexplore.ieee.org/document/10901680
ieee:11101205,conference,"A Simple PHY-Aware Outer Coding (SPOC) Scheme for Reliable, Low-Latency Communication",❌,"MAC 계층 패킷 단위 outer coding(MDS 기반); LDPC는 코드블록 단위 언급뿐, 떼어낼 LDPC ECC 기법 없음","Srivathsa Acharya, Shobhit Bhatnagar, Gayathri R, Ankita Mahato, M. Saadat Fardeen, D. Gayathri Reddy, Arijit Dey, Suddapu Krishna, P.P.V. Narasimha, P. Vijay Kumar","A simple, PHY-aware, packet-level outer coding scheme (SPOC) for beyond 5G is presented that permits reliable communication over just a single Transmission Time Interval (TTI), whenever there are two or more datalink paths between transmitter and receiver. The scheme has the following features: outer coding is positioned at the MAC layer, and each packet is made to correspond to a single LDPC code block, thereby enabling the scheme to take advantage of partially-decoded transport blocks; PHY layers at the receiver end are instructed to pass on to the MAC layer all correctly-decoded code blocks even if the entire transport block has not been correctly decoded. Simulation results are presented to show that the SPOC scheme outperforms the PDCP duplication feature present in the 5G standard, at no additional cost to spectral efficiency. Performance benefits are shown to increase with increased packet sizes, thus making the scheme attractive for high data rate applications that seek reliable communication with extremely low latency. Where latency constraints permit, the scheme can also take advantage of HARQ retransmissions to improve reliability. While the base scheme employs MDS codes, the scheme can be extended to incorporate binary codes as well.",,8-12 Dec. ,10.1109/GCWkshp64532.2024.11101205,https://ieeexplore.ieee.org/document/11101205
ieee:10901230,conference,Finite Blocklength Analysis for Optical Fiber MIMO Channels,❌,"광섬유 MIMO 유한블록길이 이론 bound, LDPC는 비교 베이스라인 — 순수 이론 bound 제외","Xin Zhang, Dongfang Xu, Xianghao Yu, Shenghui Song, Mérouane Debbah","The multiple-input and multiple-output (MIMO) technique is considered as a promising approach for improving the throughput and reliability of optical fiber communications. However, the finite blocklength (FBL) analysis of optical fiber MIMO systems is not available in the literature. Considering the Jacobi MIMO channel, which was proposed to model the nearly lossless propagation and the crosstalks in optical fiber channels, this paper studies the optimal average error probability (OAEP) of optical fiber multicore/multimode systems in the FBL regime. In particular, we consider the case where the coding rate is in the ${\mathcal{O}}\left({\frac{1}{{\sqrt {LM} }}}\right)$ proximity of the capacity, with M and L denoting the number of transmit channels and blocklength, respectively. To this end, a central limit theorem (CLT) for the information density is first established in the asymptotic regime where the blocklength and the number of transmit, receive, and available channels approach infinity with fixed ratios. With the aid of the CLT, the closed-form upper and lower bounds for the OAEP with the concerned rate are then derived. It is shown that the derived bounds could degenerate to those for Rayleigh MIMO channels if the number of available channels goes to infinity. Numerical simulations indicate that the derived bounds are closer to the performance of low-density parity check (LDPC) coding schemes than outage probability, thus providing a better characterization with the concerned the rate.",,8-12 Dec. ,10.1109/GLOBECOM52923.2024.10901230,https://ieeexplore.ieee.org/document/10901230
ieee:10901175,conference,Optimizing Real-Time Freshness: Deep Joint Source–Channel Coding Based AoI in Wireless Networks,❌,"Deep JSCC 기반 AoI 최소화, LDPC 미등장·소스채널결합 — 떼어낼 ECC 기법 없음","Chathuranga M. Wijerathna Basnayaka, Dushantha Nalin K. Jayakody, Marko Beko","This paper proposes a deep joint source-channel coding (DJSCC) to minimize the age of information (AoI) for image transmission. A new content-based AoI metric called age of misclassified information (AoMI) is introduced to estimate the freshness of the information in an image classification system. AoMI is a critical metric in timely information delivery, measuring the age of the most recently received and correctly classified image at the receiver. The proposed system leverages a deep neural network at the transmitter to map image pixels directly to channel input symbols, eliminating the need for separate source and channel coding. At the receiver, the channel output is processed to perform image classification. To analyze the AoMI performance of the system, a stochastic hybrid systems (SHS) approach is employed. Closed-form expressions for the average AoMI (AAoMI) are derived, providing insights into the impact of system parameters on the AoMI. Simulation results demonstrate the effectiveness of the proposed DJSCC-based system in achieving lower AoMI compared to traditional separate source and channel coding schemes. The findings highlight the potential of deep learning techniques to maintain the freshness of the information in wireless communication systems. This work paves the way for the design of wireless communication systems that prioritize the freshness of delivered information – this is crucial in applications such as real-time monitoring, surveillance, and control systems.",,8-12 Dec. ,10.1109/GLOBECOM52923.2024.10901175,https://ieeexplore.ieee.org/document/10901175
ieee:11101684,conference,Generative Semantic Communication for Text-to-Speech Synthesis,❌,생성형 세만틱 통신 TTS; ECC 디코더/코드설계 기여 없음,"Jiahao Zheng, Jinke Ren, Peng Xu, Zhihao Yuan, Jie Xu, Fangxin Wang, Gui Gui, Shuguang Cui","Semantic communication is a promising technology to improve communication efficiency by transmitting only the semantic information of the source data. However, traditional semantic communication methods primarily focus on data reconstruction tasks, which may not be efficient for emerging generative tasks such as text-to-speech (TTS) synthesis. To address this limitation, this paper develops a novel generative semantic communication framework for TTS synthesis, leveraging generative artificial intelligence technologies. Firstly, we utilize a pre-trained large speech model called WavLM and the residual vector quantization method to construct two semantic knowledge bases (KBs) at the transmitter and receiver, respectively. The KB at the transmitter enables effective semantic extraction, while the KB at the receiver facilitates lifelike speech synthesis. Then, we employ a transformer encoder and a diffusion model to achieve efficient semantic coding without introducing significant communication overhead. Finally, numerical results demonstrate that our framework achieves much higher fidelity for the generated speech than four baselines, in both cases with additive white Gaussian noise channel and Rayleigh fading channel.",,8-12 Dec. ,10.1109/GCWkshp64532.2024.11101684,https://ieeexplore.ieee.org/document/11101684
ieee:11100771,conference,AdaJSCC: Instance-Adaptive Joint Source-Channel Coding for Wireless Image Transmission,❌,DeepJSCC 무선 이미지 전송 — 소스-채널 결합부호로 LDPC ECC 기법 아님,"Tianjian Dang, Shengshi Yao, Siye Wang, Kai Niu, Zhenyu Liu, Jincheng Dai","Recent works in wireless image transmission based on deep joint source-channel coding (DeepJSCC) have exhibited superior performance against many traditional source and channel coding methods. While so far, research efforts mainly concentrate on architecture and model improvements toward a static target domain. In this work, we propose a novel lightweight instance-adaptive DeepJSCC approach to further improve the transmission performance for each image instance. We leverage the idea of a dynamic convolution kernel to build the DeepJSCC codec. In such way, apart from the general coded content stream, an additional model stream is extracted from each individual image instance and transmitted to the decoder side for generating the dynamic convolutional kernel parameters. The model stream enables the codec to update the off-the-shelf pretrained models after deployment in a lightweight online fashion. Experiments over various wireless channel models verify the effectiveness and robustness of our method.",,8-12 Dec. ,10.1109/GCWkshp64532.2024.11100771,https://ieeexplore.ieee.org/document/11100771
