ID,Type,Title,Authors,Abstract,Categories,Published,DOI,PDF URL,Status
ieee:6135499,journal,Cyclic and Quasi-Cyclic LDPC Codes on Constrained Parity-Check Matrices and Their Trapping Sets,"Qin Huang, Qiuju Diao, Shu Lin, Khaled Abdel-Ghaffar","This paper is concerned with construction and structural analysis of both cyclic and quasi-cyclic codes, particularly low-density parity-check (LDPC) codes. It consists of three parts. The first part shows that a cyclic code given by a parity-check matrix in circulant form can be decomposed into descendant cyclic and quasi-cyclic codes of various lengths and rates. Some fundamental structural prop...",,May 2012,10.1109/TIT.2011.2179842,https://ieeexplore.ieee.org/document/6135499,new
ieee:6168878,journal,Design of Length-Compatible Low-Density Parity-Check Codes,"Kyung-Joong Kim, Jin-Ho Chung, Kyeongcheol Yang","Length-compatible low-density parity-check (LC-LDPC) codes are a class of low-density parity-check (LDPC) codes which can support a wide range of lengths for a given rate. They may be obtained by applying shortening and puncturing schemes to good LDPC codes. However, this conventional approach does not always guarantee them to have a good performance because their degree distributions may be wildl...",,May 2012,10.1109/LCOMM.2012.030912.120231,https://ieeexplore.ieee.org/document/6168878,new
ieee:6168867,journal,An Enhanced Soft Value Calculation for LDPC Coded Pulse-Position-Modulation,"Yongsheng Wu, Aiying Yang, Yu-nan Sun, Chunxue Yang","In this letter, a simplified soft value extraction algorithm for LDPC coded PPM modulated signals is presented. The Monte Carlo simulations are applied to get the BER curves of the system based on the simplified AWGN channel. Through rearranging the soft value by the exponential function, we get an even better performance of the system.",,May 2012,10.1109/LCOMM.2012.030912.112351,https://ieeexplore.ieee.org/document/6168867,new
ieee:6168188,journal,LLR Approximation for Wireless Channels Based on Taylor Series and its Application to BICM With LDPC Codes,"Reza Asvadi, Amir H. Banihashemi, Mahmoud Ahmadian-Attari, Hamid Saeedi","A new approach for the approximation of the channel log-likelihood ratio (LLR) for wireless channels based on Taylor series is proposed. The approximation is applied to uncorrelated flat fading channels with unknown channel state information at the receiver. It is shown that the proposed approximation greatly simplifies the calculation of channel LLRs, and yet provides results almost identical to ...",,May 2012,10.1109/TCOMM.2012.030712.110142,https://ieeexplore.ieee.org/document/6168188,new
ieee:6192279,journal,Low Latency Coding: Convolutional Codes vs. LDPC Codes,"Shashank V. Maiya, Daniel J. Costello, Thomas E. Fuja","This paper compares the performance of convolutional codes to that of LDPC block codes with identical decoding latencies. The decoding algorithms considered are the Viterbi algorithm and stack sequential decoding for convolutional codes and iterative message passing for LDPC codes. It is shown that, at very low latencies, convolutional codes with Viterbi decoding offer the best performance, wherea...",,May 2012,10.1109/TCOMM.2012.042712.110189,https://ieeexplore.ieee.org/document/6192279,new
ieee:6227455,journal,Energy efficient low-cost video communications,"Alberto Corrales-Garcia, Jose Luis Martinez, Gerardo Fernandez-Escribano, Francisco Jose Quiles","Although traditional video coding is based on complex encoders and simple decoders, more recent codecs can reverse the complexity in order to provide low-cost encoders for mobile devices. However, the complexity is moved from the encoder to the decoder, accumulating high complexity on the decoder side. In this work, a parallel decoding architecture is proposed which exploits multiplecore processor...",,May 2012,10.1109/TCE.2012.6227455,https://ieeexplore.ieee.org/document/6227455,new
ieee:6135505,journal,LDPC Codes for Compressed Sensing,"Alexandros G. Dimakis, Roxana Smarandache, Pascal O. Vontobel","We present a mathematical connection between channel coding and compressed sensing. In particular, we link, on the one hand, channel coding linear programming decoding (CC-LPD), which is a well-known relaxation of maximum-likelihood channel decoding for binary linear codes, and, on the other hand, compressed sensing linear programming decoding (CS-LPD), also known as basis pursuit, which is a wide...",,May 2012,10.1109/TIT.2011.2181819,https://ieeexplore.ieee.org/document/6135505,new
ieee:6168872,journal,On the Design of LDPC-Convolutional Ensembles Using the TEP Decoder,"Pablo M. Olmos, Luis Salamanca, Juan Jose Murillo-Fuentes, Fernando Perez-Cruz","Low-density parity-check convolutional (LDPCC) codes asymptotically achieve channel capacity under belief propagation (BP) decoding. In this paper, we decode LDPCC codes using the Tree-Expectation Propagation (TEP) decoder, recently proposed as an alternative decoding method to the BP algorithm for the binary erasure channel (BEC). We show that, for LDPCC codes, the TEP decoder improves the BP sol...",,May 2012,10.1109/LCOMM.2012.030912.120092,https://ieeexplore.ieee.org/document/6168872,new
ieee:6168190,journal,On the Overflow Problem in Finite Precision Turbo Decoding Message Passing,Wojciech Sulek,"Much attention has been paid recently to the so-called layered decoding of LDPC codes, also known as turbo-decoding message passing (TDMP). The TDMP algorithm for decoding LDPC codes is known to possess some desirable features, such as fast convergence speed, reduced memory requirements and reduced implementation complexity in comparison with standard two-phase message passing algorithm. In this p...",,May 2012,10.1109/TCOMM.2012.030712.110545,https://ieeexplore.ieee.org/document/6168190,new
ieee:6226962,journal,Zigzag-coded modulation for high-speed fiber optical channels,"Salim Kahveci, Chen Gong, Xiaodong Wang","We propose new coded modulation schemes for ultra-high-speed optical transmission (e.g., 100 Gb/s and above) using component concatenated zigzag codes in combination with high-order digital modulation and coherent detection. In particular, we propose single-level coded modulation and multi-level coded modulation using concatenated zigzag codes. For single-level coded modulation, only one concatena...",,May 2012,10.1364/JOCN.4.000382,https://ieeexplore.ieee.org/document/6226962,new
ieee:6129544,journal,Bayesian Equalization for LDPC Channel Decoding,"Luis Salamanca, Juan José Murillo-Fuentes, Fernando Perez-Cruz","We describe the channel equalization problem, and its prior estimate of the channel state information (CSI), as a joint Bayesian estimation problem to improve each symbol posterior estimates at the input of the channel decoder. Our approach takes into consideration not only the uncertainty due to the noise in the channel, but also the uncertainty in the CSI estimate. However, this solution cannot ...",,May 2012,10.1109/TSP.2012.2184098,https://ieeexplore.ieee.org/document/6129544,new
ieee:6081940,journal,Adaptive Distributed Source Coding,"David Varodayan, Yao-Chung Lin, Bernd Girod","We consider distributed source coding in the presence of hidden variables that parameterize the statistical dependence among sources. We derive the Slepian-Wolf bound and devise coding algorithms for a block-candidate model of this problem. The encoder sends, in addition to syndrome bits, a portion of the source to the decoder uncoded as doping bits. The decoder uses the sum-product algorithm to s...",,May 2012,10.1109/TIP.2011.2175936,https://ieeexplore.ieee.org/document/6081940,new
ieee:6142073,journal,The Performance of Serial Turbo Codes Does Not Concentrate,"Federica Garin, Giacomo Como, Fabio Fagnani","Minimum distances and maximum likelihood error probabilities of serial turbo codes with uniform interleaver are analyzed. It is shown that, for a fraction of interleavers approaching one as the block-length grows large, the minimum distance of serial turbo codes grows as a positive power of their block-length, while their error probability decreases exponentially fast in some positive power of the...",,May 2012,10.1109/TIT.2012.2184673,https://ieeexplore.ieee.org/document/6142073,new
ieee:6174415,journal,A New Joint Source-Channel Coding Scheme Based on Nested Lattice Codes,"Zheng Yang, Shancheng Zhao, Xiao Ma, Baoming Bai","In this paper, we propose a new joint source-channel coding (JSCC) method for transmission of a Gaussian source through an additive white Gaussian noise (AWGN) channel whose bandwidth is higher than that of the source. Firstly, a sequence of random variables from a Gaussian source is discretized with a lattice-based quantizer, resulting in a sequence of lattice points. Secondly, by driving an enco...",,May 2012,10.1109/LCOMM.2012.031912.120151,https://ieeexplore.ieee.org/document/6174415,new
ieee:6170863,journal,100G and Beyond Transmission Technologies for Evolving Optical Networks and Relevant Physical-Layer Issues,"Ezra Ip, Philip Ji, Eduardo Mateo, Yue-Kai Huang, Lei Xu, Dayou Qian, Neng Bai, Ting Wang","As 100-Gb/s digital coherent systems enter commercial deployment, an effort is underway to uncover the technologies that will enable the next-generation optical fiber communication systems. We envisage that future optical transport will be software-defined, enabling flexible allocation of bandwidth resources, with dynamically adjustable per-channel data rates based on instantaneous traffic demand ...",,May 2012,10.1109/JPROC.2012.2183329,https://ieeexplore.ieee.org/document/6170863,new
ieee:6192276,journal,Analytical Performance Derivation of Hybrid ARQ Schemes at IP Layer,"Christophe J. Le Martret, Aude Le Duc, Sebastien Marcille, Philippe Ciblat","In this paper we derive performance metrics closed-form expressions of retransmission schemes such as Automatic Repeat reQuest (ARQ) and Hybrid ARQ (HARQ) in the case of memoryless block fading channels. As performance metrics, we consider the Packet Error Rate (PER), the efficiency, and the packet delay. The novelty of the paper is twofold: i) the metrics are considered at the Network level; ii) ...",,May 2012,10.1109/TCOMM.2012.042712.110058A,https://ieeexplore.ieee.org/document/6192276,new
ieee:6069852,journal,Adaptive Correlation Estimation With Particle Filtering for Distributed Video Coding,"Shuang Wang, Lijuan Cui, Lina Stankovic, Vladimir Stankovic, Samuel Cheng","Distributed video coding (DVC) is rapidly gaining popularity as a low cost, robust video coding solution, that reduces video encoding complexity. DVC is built on distributed source coding (DSC) principles where correlation between sources to be compressed is exploited at the decoder side. In the case of DVC, a current frame available only at the encoder is estimated at the decoder with side inform...",,May 2012,10.1109/TCSVT.2011.2171263,https://ieeexplore.ieee.org/document/6069852,new
ieee:6142082,journal,Analysis of the Second Moment of the LT Decoder,"Ghid Maatouk, Amin Shokrollahi","In this paper, the second moment of the ripple size during the Luby transform (LT) decoding process is analyzed. Combined with a result by Karp et al. (2004) stating that the expectation of the ripple size is of the order of k , our study gives bounds on the error probability of the LT decoder. Furthermore, an analytic expression for the variance of the ripple size up to terms of constant order is...",,May 2012,10.1109/TIT.2012.2184690,https://ieeexplore.ieee.org/document/6142082,new
ieee:6171810,journal,Achieving AWGN Multiple Access Channel Capacity with Spatial Graph Coupling,Dmitri Truhachev,Communication over a multiple access channel is considered. Each user modulates his signal as a superposition of redundant data streams where interconnection of data bits can be represented by means of a sparse graph. The receiver observes a signal resulting from the coupling of the sparse modulation graphs. Iterative interference cancellation decoding is analyzed. It is proved that spatial graph ...,,May 2012,10.1109/LCOMM.2012.031212.120228,https://ieeexplore.ieee.org/document/6171810,new
ieee:6177197,journal,Soft-Input Inner Decoder for the Davey-MacKay Construction,"Xiaopeng Jiao, Marc A. Armand","The Davey-MacKay (DM) construction is a promising concatenated coding scheme for the binary-input, binary-output, insertion-deletion-substitution (IDS) channel. Many practical channels however have continuous output. We therefore develop a soft-input inner decoder for this coding scheme under a cascaded channel model consisting of the IDS channel followed by a binary-input, continuous-output, addi...",,May 2012,10.1109/LCOMM.2012.032612.112621,https://ieeexplore.ieee.org/document/6177197,new
ieee:6187783,journal,"Comparing Analytical, Micromagnetic and Statistical Channel Models at 4 Tcbpsi Patterned Media Recording","M. Chua, M. R. Elidrissi, K. Eason, S. H. Zhang, Z. L. Qin, K. S. Chai, K. P. Tan, K. Cai, K. S. Chan, W. L. Goh, Y. Dong, R. H. Victora","Bit patterned media recording (BPMR) is a candidate technology proposed to extend the areal density growth capability of magnetic recording systems. In conventional granular magnetic recording (CGMR), bits of information are recorded onto a number of randomly distributed magnetic grains. The difficulty for the granular media approach is that due to the randomness of the grains, a certain minimum n...",,May 2012,10.1109/TMAG.2011.2169654,https://ieeexplore.ieee.org/document/6187783,new
ieee:6188993,journal,Finite-SNR Diversity-Multiplexing Trade-Off of Dual Hop Multiple-Relay Channels,"Ying Liu, Prathapasinghe Dharmawansa, Matthew R. McKay, Khaled Ben Letaief","This paper investigates the finite signal-to-noise ratio (SNR) diversity-multiplexing trade-off (DMT) of point-to-point wireless channels assisted by multiple relays. Results are derived for both amplify-and-forward (AF) and decode-and-forward (DF) relaying protocols. For the AF protocol, we derive accurate approximations for the system outage probability when the relays are clustered between the ...",,May 2012,10.1109/TCOMM.2012.041212.100768,https://ieeexplore.ieee.org/document/6188993,new
ieee:6198403,journal,Wyner-Ziv Coding Based on Multidimensional Nested Lattices,"Cong Ling, Su Gao, Jean-Claude Belfiore",Distributed source coding addresses the compression of correlated sources without communication links among them. This paper is concerned with the Wyner-Ziv problem: coding of an information source with side information available only at the decoder in the form of a noisy version of the source. Both the problems of theoretical analysis and code design are addressed in the framework of multi-dimens...,,May 2012,10.1109/TCOMM.2012.12.110328,https://ieeexplore.ieee.org/document/6198403,new
ieee:6213331,conference,Feedback-free distributed video coding using parallelized design,"Feng Ye, Aidong Men, He Xiao, Jinhong Di, Bo Yang","Distributed video coding (DVC) has a great development during the past decade for its simpler encoder and higher robustness against the channel noises. However, typical DVC schemes, such as DISCOVER, are almost based on the feedback channel between the encoder and the decoder, and the decoding process is very complex, which causes difficulty in feedback-free or tight delay constraint video applica...",,7-9 May 20,10.1109/PCS.2012.6213331,https://ieeexplore.ieee.org/document/6213331,new
ieee:6213313,conference,Feedback-constrained Wyner-Ziv video coding,"Jürgen Slowack, Nikos Deligiannis, Peter Lambert, Adrian Munteanu, Rik Van de Walle","Distributed video coding (DVC) systems described in the literature often make use of a feedback channel to determine the rate. However, supporting such a feedback channel in practice may be difficult, particularly considering that current approaches are unable to incorporate constraints on feedback channel usage. Therefore, in this paper we propose a system in which the number of requests per Wyne...",,7-9 May 20,10.1109/PCS.2012.6213313,https://ieeexplore.ieee.org/document/6213313,new
ieee:6239927,conference,Incremental Redundancy for LDPC Codes of 2nd Generation DVB Systems,"Nabil Sven Loghin, Makiko Kan, Jan Zollner","In 2nd generation Digital Video Broadcasting (DVB) systems, low-density parity-check codes (LDPCCs) are applied. In this paper, we propose extension of the standardized LDPCCs to allow for additional incremental redundancy (IR). Several use-cases of IR in broadcasting systems are outlined. We derive an algorithm to extend a given LDPCC with optimized degree sequences. The extended LDPCC yields bot...",,6-9 May 20,10.1109/VETECS.2012.6239927,https://ieeexplore.ieee.org/document/6239927,new
ieee:6240094,conference,Factor Graph Based Joint Detection/Decoding for LDPC Coded Large-MIMO Systems,"T. Lakshmi Narasimhan, A. Chockalingam, B. Sundar Rajan","In this paper, we employ message passing algorithms over graphical models to jointly detect and decode symbols transmitted over large multiple-input multiple-output (MIMO) channels with low density parity check (LDPC) coded bits. We adopt a factor graph based technique to integrate the detection and decoding operations. A Gaussian approximation of spatial interference is used for detection. This s...",,6-9 May 20,10.1109/VETECS.2012.6240094,https://ieeexplore.ieee.org/document/6240094,new
ieee:6239851,conference,Iterative Timing Recovery with Turbo Decoding at Very Low SNRs,"Jianrong Bao, Minjian Zhao, Jie Zhong, Yunlong Cai","Turbo codes are near Shannon limit channel codes widely used in space communication systems and so on at low signal-to-noise rate (SNR). Timing recovery is one of the key technologies for these systems to work effectively. In this paper, an efficiently iterative timing recovery with Turbo decoding is presented. By maximizing the sum of the square of soft decision metrics from Turbo decoding, it ca...",,6-9 May 20,10.1109/VETECS.2012.6239851,https://ieeexplore.ieee.org/document/6239851,new
ieee:6240152,conference,Unsupervised Bit Error Rate Estimation Using Maximum Likelihood Kernel Methods,"Jia Dong, Tarik Ait-Idir, Samir Saoudi","This paper addresses the problem of unsupervised Bit Error Rate (BER) estimation for communication systems where no prior information about transmitted bits is available at the receiver. We introduce a new technique using kernel probability density function (pdf) estimation together with Maximum Likelihood-based smoothing parameter computation. Performance is evaluated in the case of CDMA, Turbo a...",,6-9 May 20,10.1109/VETECS.2012.6240152,https://ieeexplore.ieee.org/document/6240152,new
ieee:6240144,conference,Factor-Graph-Based Iterative Receiver Design in the Presence of Strong Phase Noise,"Hongjie Zhao, Nan Wu, Hua Wang, Jingming Kuang","In this paper, we propose an improved iterative receiver scheme for low density parity check (LDPC) codes transmitted over unknown channels affected by a strong phase noise. For achieving joint channel parameter estimation, data detection and decoding, the proposed algorithm utilizes the sum product algorithm (SPA) implemented on the factor graph (FG) that represents the joint a posteriori probabi...",,6-9 May 20,10.1109/VETECS.2012.6240144,https://ieeexplore.ieee.org/document/6240144,new
ieee:6325888,conference,Hybrid LDPC-coded modulation schemes for optical communication systems,"Murat Arabaci, Ivan B. Djordjevic, Lei Xu, Ting Wang",We propose hybrid LDPC-coded modulation schemes whose error correction performances and decoding complexities can be adjusted by changing the field orders of its component codes. Such flexible schemes are crucial assets in link budget analysis.,,6-11 May 2,10.1364/CLEO_SI.2012.CTh3C.3,https://ieeexplore.ieee.org/document/6325888,new
ieee:6325553,conference,LDPC-coded mode-multiplexed CO-OFDM over 1000 km of few-mode fiber,"Ding Zou, Changyu Lin, Ivan B. Djordjevic",We demonstrate by simulations that four independent LDPC-coded 80Gb/s QPSK OFDM signals can be transmitted by mode-multiplexing over 1000km of few-mode fiber using coherent detection with a powerful channel estimation technique.,,6-11 May 2,,https://ieeexplore.ieee.org/document/6325553,new
ieee:6325887,conference,Feedback channel capacity inspired optimum signal constellation design for high-speed optical transmission,"Tao Liu, Ivan B. Djordjevic, Lei Xu, Ting Wang","In this paper, we describe a feedback channel capacity inspired optimum signal constellation design (FCC-OSCD), for channel capacity achieving source distribution. The constellations obtained by FCC-OSCD are OSNR dependent. We demonstrate by Monte Carlo simulations that 32-ary signal constellation, obtained by FCC-OSCD, outperforms previously proposed optimized 32-ary signal constellation by 1.2 d...",,6-11 May 2,,https://ieeexplore.ieee.org/document/6325887,new
ieee:6233858,conference,A wind energy generator for smart grid applications using wireless coding neuro-fuzzy power control,"J. L. Azcue, A. J. Sguarezi Filho, C. E. Capovilla, Ivan R. S. Casella, E. Ruppert","The wind energy generation is the huge driver behind the push for supergrids and cross-border infrastructure for renewable energy systems into smart grids. To provide balance supply, demand, and storage of energy over a region in a much more efficient manner than it is done today, smart grids will need to use an advanced communication infrastructure into a robust control system. Towards this objec...",,29-31 May ,10.1109/FSKD.2012.6233858,https://ieeexplore.ieee.org/document/6233858,new
ieee:6239819,conference,Shortening Design Time through Multiplatform Simulations with a Portable OpenCL Golden-model: The LDPC Decoder Case,"G. Falcao, M. Owaida, D. Novo, M. Purnaprajna, N. Bellas, C.D. Antonopoulos, G. Karakonstantis, A. Burg, P. Ienne","Hardware designers and engineers typically need to explore a multi-parametric design space in order to find the best configuration for their designs using simulations that can take weeks to months to complete. For example, designers of special purpose chips need to explore parameters such as the optimal bit width and data representation. This is the case for the development of complex algorithms s...",,29 April-1,10.1109/FCCM.2012.46,https://ieeexplore.ieee.org/document/6239819,new
ieee:6237261,conference,Performance of combined error correction and error detection for very short block length codes,"Matthias Breuninger, Joachim Speidel","A combination of error correction and error detection for channel coding under additive white Gaussian noise (AWGN) is proposed, where the error detection is based on the statistics of a metric, that is defined as a function of the received and the decoded data stream, hence, no additional redundancy is required. This approach is especially useful for applications, where short block lengths are ap...",,28-31 May ,10.1109/ISIE.2012.6237261,https://ieeexplore.ieee.org/document/6237261,new
ieee:6221374,conference,TS-LDPC analog decoding based on the Min-Sum algorithm,"Alireza Rabbani Abolfazli, Yousef R. Shayan, Glenn E. R. Cowan","It has been shown that Min-Sum (MS) algorithms have low complexity in the implementation of analog VLSI decoders compared to the Sum-Product (SP) algorithm. Moreover, Turbo-structured LDPC (TS-LDPC) codes are known to have lower error floor than random LDPC codes. In this paper, Min-Sum and Min-Sum with correction factor algorithms are reviewed and adapted with TS-LDPC codes for future analog VLSI...",,28-29 May ,10.1109/QBSC.2012.6221374,https://ieeexplore.ieee.org/document/6221374,new
ieee:6221348,conference,Absorbing sets of Fountain codes over noisy channels,"Seyed Masoud Mirrezaei, Karim Faez, Shahram Yousefi","Although error-prone patterns have been extensively studied for low-density parity-check (LDPC) codes, to the best of our knowledge, they have never been fully explored for Fountain codes. It is shown that dominant trapping sets of Fountain codes are the absorbing sets. They happen in the so-called error floor, corresponding to a significant flattening in the error probability curves. In this pape...",,28-29 May ,10.1109/QBSC.2012.6221348,https://ieeexplore.ieee.org/document/6221348,new
ieee:6221376,conference,Transmit rate reduction of Wyner-Ziv video coding (WZVC) using multiple uncorrelated wireless receivers,"K. Thambu, X. N. Fernando, L. Guan","Wyner-Ziv video coding (WZVC) is very attractive for low power wireless video sensors. In this paper we show that how the transmission bit-rate of WZVC can be further reduced when multiple uncorrelated wireless receiving points are deployed at the decoder. This is different from classical SIMO in the sense of cross layer coding is deployed. When the wireless channel degrades, decoder is fed with a...",,28-29 May ,10.1109/QBSC.2012.6221376,https://ieeexplore.ieee.org/document/6221376,new
ieee:6314384,conference,Simulations of Low-Density Parity-Check Codes under high-order modulation,"Xin Zhao, Lidong Zhu, Yantao Guo, Xiaogang Gou","Improving the spectral efficiency as far as possible while guaranteeing communication quality by channel coding becomes the development direction of the communication system. This paper studies the application of Low-Density Parity-Check Codes under high-order modulation, which not only considers improving the reliability of communication through the LDPC channel coding, but also taking the effect...",,27-30 May ,10.1109/GSMM.2012.6314384,https://ieeexplore.ieee.org/document/6314384,new
