ID,Type,Title,Status,Reason,Authors,Abstract,Categories,Published,DOI,PDF URL
arxiv:cs/0702147v1,preprint,On the Complexity of Exact Maximum-Likelihood Decoding for Asymptotically Good Low Density Parity Check Codes,⬜ 미선별,,"Weiyu Xu, Babak Hassibi","Since the classical work of Berlekamp, McEliece and van Tilborg, it is well known that the problem of exact maximum-likelihood (ML) decoding of general linear codes is NP-hard. In this paper, we show that exact ML decoding of a classs of asymptotically good error correcting codes--expander codes, a special case of low density parity check (LDPC) codes--over binary symmetric channels (BSCs) is possible with an expected polynomial complexity. More precisely, for any bit-flipping probability, $p$, in a nontrivial range, there exists a rate region of non-zero support and a family of asymptotically good codes, whose error probability decays exponentially in coding length $n$, for which ML decoding is feasible in expected polynomial time. Furthermore, as $p$ approaches zero, this rate region approaches the channel capacity region. The result is based on the existence of polynomial-time suboptimal decoding algorithms that provide an ML certificate and the ability to compute the probability that the suboptimal decoder yields the ML solution. One such ML certificate decoder is the LP decoder of Feldman; we also propose a more efficient $O(n^2)$ algorithm based on the work of Sipser and Spielman and the Ford-Fulkerson algorithm. The results can be extended to AWGN channels and suggest that it may be feasible to eliminate the error floor phenomenon associated with message-passage decoding of LDPC codes in the high SNR regime. Finally, we observe that the argument of Berlekamp, McEliece and van Tilborg can be used to show that ML decoding of the considered class of codes constructed from LDPC codes with regular left degree, of which the considered expander codes are a special case, remains NP-hard; thus giving an interesting contrast between the worst-case and expected complexities.",cs.IT,2007-02-25,10.1109/ITW.2007.4313065,https://arxiv.org/pdf/cs/0702147v1
arxiv:cs/0702146v1,preprint,A Local Tree Structure is NOT Sufficient for the Local Optimality of Message-Passing Decoding in Low Density Parity Check Codes,⬜ 미선별,,Weiyu Xu,"We address the problem,`Is a local tree structure sufficient for the local optimality of message passing algorithm in low density parity check codes?'.It is shown that the answer is negative. Using this observation, we pinpoint a flaw in the proof of Theorem 1 in the paper `The Capacity of Low-Density Parity-Check Codes Under Message-Passing Decoding' by Thomas J. Richardson and Rüdiger L.Urbanke\cite{RUCapacity}. We further provide a new proof of that theorem based on a different argument.",cs.IT,2007-02-25,,https://arxiv.org/pdf/cs/0702146v1
arxiv:quant-ph/0702184v3,preprint,Constructing CSS Codes with LDPC Codes for the BB84 Quantum Key Distribution Protocol,⬜ 미선별,,"Maki Ohata, Kanta Matsuura","In this paper, we propose how to simply construct a pair of linear codes for the BB84 quantum key distribution protocol. This protocol allows unconditional security in the presence of an eavesdropper, and the pair of linear codes is used for error correction and privacy amplification. Since their high decoding performance implies low eavesdropper's mutual information, good design of the two codes is required. The proposed method admits using arbitrary low-density parity-check (LDPC) codes. Therefore, it has low complexity and high performance for hardware implementation. Simulation results show that the pair of codes performs well against practical and various noise levels.",quant-ph,2007-02-19,,https://arxiv.org/pdf/quant-ph/0702184v3
arxiv:cs/0702073v1,preprint,Tradeoff between decoding complexity and rate for codes on graphs,⬜ 미선별,,Pulkit Grover,"We consider transmission over a general memoryless channel, with bounded decoding complexity per bit under message passing decoding. We show that the achievable rate is bounded below capacity if there is a finite success in the decoding in a specified number of operations per bit at the decoder for some codes on graphs. These codes include LDPC and LDGM codes. Good performance with low decoding complexity suggests strong local structures in the graphs of these codes, which are detrimental to the code rate asymptotically. The proof method leads to an interesting necessary condition on the code structures which could achieve capacity with bounded decoding complexity. We also show that if a code sequence achieves a rate epsilon close to the channel capacity, the decoding complexity scales at least as O(log(1/epsilon).","cs.IT, cs.CC",2007-02-13,,https://arxiv.org/pdf/cs/0702073v1
arxiv:math/0702007v2,preprint,Finite size scaling for the core of large random hypergraphs,⬜ 미선별,,"Amir Dembo, Andrea Montanari","The (two) core of a hypergraph is the maximal collection of hyperedges within which no vertex appears only once. It is of importance in tasks such as efficiently solving a large linear system over GF[2], or iterative decoding of low-density parity-check codes used over the binary erasure channel. Similar structures emerge in a variety of NP-hard combinatorial optimization and decision problems, from vertex cover to satisfiability. For a uniformly chosen random hypergraph of $m=nρ$ vertices and $n$ hyperedges, each consisting of the same fixed number $l\geq3$ of vertices, the size of the core exhibits for large $n$ a first-order phase transition, changing from $o(n)$ for $ρ>ρ_{\mathrm{c}}$ to a positive fraction of $n$ for $ρ<ρ_{\mathrm{c}}$, with a transition window size $Θ(n^{-1/2})$ around $ρ_{\mathrm{c}}>0$. Analyzing the corresponding ``leaf removal'' algorithm, we determine the associated finite-size scaling behavior. In particular, if $ρ$ is inside the scaling window (more precisely, $ρ=ρ_{\mathrm{c}}+rn^{-1/2}$), the probability of having a core of size $Θ(n)$ has a limit strictly between 0 and 1, and a leading correction of order $Θ(n^{-1/6})$. The correction admits a sharp characterization in terms of the distribution of a Brownian motion with quadratic shift, from which it inherits the scaling with $n$. This behavior is expected to be universal for a wide collection of combinatorial problems.","math.PR, math.CO",2007-02-01,10.1214/07-AAP514,https://arxiv.org/pdf/math/0702007v2
