ID,Type,Title,Status,Reason,Authors,Abstract,Categories,Published,DOI,PDF URL
ieee:6876673,conference,Underwater wireless optical communication; recent advances and remaining challenges,❌,수중 광통신(UWOC) 채널/시스템 리뷰 — ECC·LDPC 기법 부재,"Mohammad-Ali Khalighi, Chadi Gabriel, Tasnim Hamza, Salah Bourennane, Pierre Léon, Vincent Rigaud","Because of its ability of providing very high data transmission rates over distances up to several tens of meters, underwater wireless optical communication (UWOC) has attracted considerable interest during the past few years. The underwater channel is a challenging environment, especially because of its high attenuation. The difficulty of precise localization underwater also leads to unavoidable link misalignments that can have an important impact on the link availability and otherwise on the quality of signal transmission. In this paper, after a review of the recent research works on UWOC and the available commercialized systems, we present the performance study of a typical UWOC system under some simplifying assumptions for system modeling. We also address the open issues and the challenges that we are faced with in practice.",,6-10 July ,10.1109/ICTON.2014.6876673,https://ieeexplore.ieee.org/document/6876673
ieee:6876270,conference,Flexible FEC codes for next-generation software-defined optical transceivers,❌,"광 트랜시버용 flexible FEC 오버뷰/FPGA 검증 프레임워크 — 신규 디코더·구성 기여 없는 개관성, 떼어낼 LDPC 기법 부재","Christoforos Kachris, George Tzimpragos, Guido Borriello, Panagiotis Zakynthinos, Ioannis Tomkos","The tremendous increase of the traffic and fluctuation of the optical networks during the last decade imposes the development of flexible transceivers capable of adapting effectively to different signal qualities, power requirements and transmission rates. Conventionally, optical transceivers are rarely reconfigured. However, recent advances in the domain of the software-defined optical transceivers (SDOT) for future flexible optical made possible the change of the fixed properties of the optical channels. For the realization of such schemes, the development of advanced electro-optical components is required. The scope of this paper is to present an overview of the various existing trade-offs concerning the hardware realization of such flexible electronic components. More specifically, emphasis is laid on the design and verification of flexible FEC schemes. A HW/SW FPGA-based framework for rapid verification is presented, as well.",,6-10 July ,10.1109/ICTON.2014.6876270,https://ieeexplore.ieee.org/document/6876270
ieee:6990357,conference,Performance analysis of distributed raptor codes in wireless relay networks,❌,"Raptor(fountain) 코드 기반 분산 네트워크코딩 BER bound 유도, LDPC ECC 기법 아님(원칙 제외)","Jing Yue, Zihuai Lin, Branka Vucetic, Guoqiang Mao, Tor Aulin","In this paper, we propose a distributed network coding (DNC) scheme based on the Raptor codes for wireless relay networks (WRNs), where a group of source nodes communicate with a single sink through a common relay network in a multi-hop fashion. At the sink, a graph-based Raptor code is formed on the fly. After receiving a sufficient number of encoded packets, the sink begins to decode. The main contributions of this paper are the derivations of upper and lower bit error rate (BER) bounds for the proposed Raptor-based DNC scheme.",,30 June-3 ,10.1109/SAHCN.2014.6990357,https://ieeexplore.ieee.org/document/6990357
ieee:6872717,conference,Green improvements of IEEE 802.11 directional multi-gigabit physical layer specifications,❌,"60GHz IEEE 802.11 DMG PHY 에너지효율 개선용 부호 교체, 떼어낼 LDPC ECC 신규 기법 없음","Marc-Antoine Bouzigues, Isabelle Siaud, Anne-Marie Ulmer-Moll, Maryline Hélard","In the context of green communications, millimeter wave bands are investigated to ensure mobile access and backhauling. Such transmissions can be performed with the IEEE 802.11 Directional Multi-Gigabit (DMG) modes, designed for very high throughput in the 60 GHz band. However, the DMG Orthogonal Frequency-Division Multiplexing (OFDM) physical (PHY) layer specifications corresponding to the highest data rates are not energy-efficient. Therefore, in this article, we propose easily implementable green improvements for IEEE 802.11 DMG OFDM PHY: a change of error correcting code and a new modulation and coding scheme. Binary error rate performance evaluations are made to show the green benefits of our improvements.",,30 June-3 ,10.1109/PRIME.2014.6872717,https://ieeexplore.ieee.org/document/6872717
ieee:6953046,conference,Performance evaluation of column-scaled LDPC codes under fading channel conditions,❌,"비이진 GF H에서 유도된 column-scaled LDPC를 페이딩채널 성능평가만, 새 디코더/HW 기여 없음","B. Rajasekar, E. Logashanmugam","Column scaling of LDPC codes is generally done to reduce the decoding complexity without degradation in bit error rate. It has been deduced that, the so constructed CS-LDPC codes had better performance than the existing regular and deterministic LDPC in terms of Bit Error Rate (BER). In this paper, ability of Column Scaled LDPC codes in reaching the best performance is evaluated for different fading channel conditions such as Additive White Gaussian Noise (AWGN), Rayleigh and Rician channels. Diagonal elements (that are not equal to zero) are distributed randomly in order to generate CS-LDPC. In Column Scaled Low density Parity Check codes, non binary parity check matrix, H is derived using Galios field or finite field polynomial and then non-binary H matrix is converted to binary H matrix. CS-LDPC codes have parity-check matrix that are composed of binary and diagonal matrix that eases implementation and analysis results shows that the CS-LDPC scheme improves Bit Error Rate and Frame Error Rate for AWGN and Rician channels and no significant improvement for Rayleigh channels.",,3-5 July 2,10.1109/EmbeddedSys.2014.6953046,https://ieeexplore.ieee.org/document/6953046
ieee:6874958,conference,Performance comparison of non-binary LDPC block and spatially coupled codes,❌,non-binary SC-LDPC vs block 성능 비교 — 비이진 LDPC이므로 제외,"Kechao Huang, David G.M. Mitchell, Lai Wei, Xiao Ma, Daniel J. Costello","In this paper, we compare the finite-length performance of non-binary spatially coupled low-density parity-check (NB SC-LDPC) codes constructed from protographs to non-binary LDPC block codes (NB LDPC-BCs). A sliding window decoding architecture with a stopping rule based on a soft bit-error-rate (BER) estimate for the NB SC-LDPC codes is considered. It is demonstrated that NB SC-LDPC codes with sliding window decoding outperform NB LDPC-BCs with no increase in decoding complexity when the decoding latency of the SC-LDPC codes equals the block length of the LDPC-BCs. We also investigate the relationship between the protograph lifting factor, the decoding window size, and the decoding performance of NB SC-LDPC codes when the decoding latency is fixed. Simulation results for several (3,6)-regular NB code examples confirm that NB SC-LDPC codes can significantly outperform both binary LDPC-BCs and binary SC-LDPC codes with the same decoding latency.",,29 June-4 ,10.1109/ISIT.2014.6874958,https://ieeexplore.ieee.org/document/6874958
ieee:6874925,conference,Design of high-rate irregular non-binary LDPC codes using algorithmic stopping-set cancellation,❌,non-binary LDPC 코드 설계(stopping-set cancellation) — 비이진 LDPC이므로 제외,"Sudarsan V. S. Ranganathan, Dariush Divsalar, Kasra Vakilinia, Richard D. Wesel","Following Poulliat et al.'s design of (2, dc) nonbinary LDPC (NB-LDPC) codes, this paper designs high-rate irregular NB-LDPC codes by addressing the problem of minimum symbol distance. The design procedure first identifies all stopping sets up to weight five in an LDPC code and enumerates them via a message passing algorithm. For each identified stopping set, careful labeling forces its corresponding parity-check sub-matrix to be full rank, thereby preventing the stopping set from being a sub-code and ensuring a minimum distance of at least six symbols. Simulation results for codes designed through this procedure show a significant improvement in the error-floor region over randomized labeling.",,29 June-4 ,10.1109/ISIT.2014.6874925,https://ieeexplore.ieee.org/document/6874925
ieee:6875273,conference,Non-binary LDPC codes with large alphabet size,❌,large alphabet non-binary LDPC — 비이진 제외,"Koji Tazoe, Kenta Kasai, Kohichi Sakaniwa",We study LDPC codes for the channel with input x ∈ Fqm and output y = x + z ∈ Fqm. The aim of this paper is to evaluate decoding performance of qm-ary non-binary LDPC codes for large m. We give density evolution and decoding performance evaluation for regular non-binary LDPC codes and spatially-coupled (SC) codes. We show the regular codes do not achieve the capacity of the channel while SC codes ...,,29 June-4 ,10.1109/ISIT.2014.6875273,https://ieeexplore.ieee.org/document/6875273
ieee:6875182,conference,On LDPC codes for Gaussian interference channels,❌,"GIC용 LDPC degree distribution 최적화 — 표준 DE/EXIT 기법, 무선 간섭채널 특이적이라 NAND에 떼어낼 신규 구성 없음","Shahrouz Sharifi, A. Korhan Tanc, Tolga M. Duman","In this paper, we focus on the two-user Gaussian interference channel (GIC), and study the Han-Kobayashi (HK) coding/decoding strategy with the objective of designing low-density parity-check (LDPC) codes. A code optimization algorithm is proposed which adopts a random perturbation technique via tracking the average mutual information. The degree distribution optimization and convergence threshold computation are carried out for strong and weak interference channels, employing binary phase-shift keying (BPSK). Under strong interference, it is observed that optimized codes operate close to the capacity boundary. For the case of weak interference, it is shown that via the newly designed codes, a nontrivial rate pair is achievable, which is not attainable by single user codes with time-sharing. Performance of the designed LDPC codes are also studied for finite block lengths through simulations of specific codes picked from the optimized degree distributions.",,29 June-4 ,10.1109/ISIT.2014.6875182,https://ieeexplore.ieee.org/document/6875182
ieee:6875203,conference,LDPC codes for partial-erasure channels in multi-level memories,❌,"q-ary partial erasure 채널 위 non-binary LDPC threshold 분석 — 비이진+순수 이론, 디코더/HW 없음","Rami Cohen, Yuval Cassuto","In this paper, we develop a new channel model, which we name the q-ary partial erasure channel (QPEC). QPEC has a q-ary input, and its output is either one symbol or a set of M possible values. This channel mimics situations when current/voltage levels in measurement channels are only partially known, due to high read rates or imperfect current/voltage sensing. Our investigation is concentrated on the performance of low-density parity-check (LDPC) codes when used over this channel, due to their low decoding complexity with iterative-decoding algorithms. We give the density evolution equations of this channel, and develop its decoding-threshold analysis. Part of the analysis shows that finding the exact decoding threshold efficiently lies upon a solution to an open problem in additive combinatorics. For this part, we give bounds and approximations.",,29 June-4 ,10.1109/ISIT.2014.6875203,https://ieeexplore.ieee.org/document/6875203
ieee:6875274,conference,ADMM decoding of non-binary LDPC codes in F2m,❌,비이진(F2m) LDPC ADMM/LP 디코딩 — non-binary LDPC는 기준상 제외,"Xishuo Liu, Stark C. Draper","In this paper, we develop an efficient algorithm for linear programming (LP) decoding of non-binary low-density parity-check (LDPC) codes. We build our algorithm on the decomposition method based on the alternating direction method of multipliers (ADMM). Although expressing the LP decoding problem using ADMM is not hard, a sub-routine of ADMM - projection onto a polytope formed from embeddings of the non-binary single parity-check code - is not straightforward. In this work, we focus on non-binary codes in fields of characteristic two. This allows us to use operations in F2 to relax the polytope under consideration into a form that is computational friendly. We introduce a rotation step that normalizes the geometry under consideration. We then apply ADMM a second time to solve the projection problem, which is a quadratic program (QP). Our decoding algorithm scales linearly with block length, linearly with check degree, and quadratically with field size.",,29 June-4 ,10.1109/ISIT.2014.6875274,https://ieeexplore.ieee.org/document/6875274
ieee:6874885,conference,Non-binary algebraic spatially-coupled quasi-cyclic LDPC codes,❌,non-binary SC QC-LDPC — 비이진 LDPC이므로 제외,"Keke Liu, Mostafa El-Khamy, Jungwon Lee, Inyup Kang, Arvind Yedla","This paper considers the algebraic construction and performance of non-binary spatially-coupled low density parity check (LDPC) codes. A replicate-and-mask approach is presented to construct finite-length algebraic quasi-cyclic (QC) spatially-coupled (SC) LDPC codes. Numerical results show the superiority of non-binary algebraic SC QC LDPC codes over the corresponding random non-binary (block and SC) LDPC codes. In this paper, it is demonstrated that the threshold saturation phenomenon, previously demonstrated for binary SC LDPC codes, also holds for non-binary SC LDPC codes over the binary-input AWGN channel with BPSK modulation.",,29 June-4 ,10.1109/ISIT.2014.6874885,https://ieeexplore.ieee.org/document/6874885
ieee:6875278,conference,Achievability bounds for rate-compatible codes,❌,"rate-compatible 코드의 유한블록 achievability bound — 순수 이론, 떼어낼 디코더/HW/구성 없음","Tsung-Yi Chen, Dariush Divsalar, Richard D. Wesel","This paper considers finite-blocklength achievability for rate-compatible codes. For a fixed number of messages, random coding analysis determines a sequence of achievable error probabilities for a sequence of blocklengths. However, traditional random coding achievability draws each code independently so that it does not show that a family of rate-compatible codes achieves that same sequence of error probabilities. Using random code extension, this paper shows achievable error probabilities for rate-compatible channel codes with finite blocklengths. This paper also shows that for a class of input-invariant channels, the rate-compatible constraint does not affect the achievability bounds on error rates when a threshold decoder is used.",,29 June-4 ,10.1109/ISIT.2014.6875278,https://ieeexplore.ieee.org/document/6875278
ieee:6875382,conference,Enhanced belief propagation decoding of polar codes through concatenation,❌,"Polar BP decoding improved via concatenated LDPC; polar-specific (frozen/intermediate bit-channels), no portable binary-LDPC decoder technique","Jing Guo, Minghai Qin, Albert Guillén i Fàbregas, Paul H. Siegel","The bit-channels of finite-length polar codes are not fully polarized, and a proportion of such bit-channels are neither completely “noiseless” nor completely “noisy”. By using an outer low-density parity-check code for these intermediate channels, we show how the performance of belief propagation (BP) decoding of the overall concatenated polar code can be improved. A simple example reports an improvement in Eb over N0 of 0.3 dB with respect to the conventional BP decoder.",,29 June-4 ,10.1109/ISIT.2014.6875382,https://ieeexplore.ieee.org/document/6875382
ieee:6875000,conference,Numerical techniques for finding the distances of quantum codes,❌,"양자/고전 코드 거리 계산 수치기법(서베이+linked-cluster) — 디코더/HW/구성 신규 기여 아님, 거리계산 도구일 뿐","Ilya Dumer, Alexey A. Kovalev, Leonid P. Pryadko","We survey the existing techniques for calculating code distances of classical codes and apply these techniques to generic quantum codes. For classical and quantum LDPC codes, we also present a new linked-cluster technique. It reduces complexity exponent of all existing deterministic techniques designed for codes with small relative distances (which include all known families of quantum LDPC codes), and also surpasses the probabilistic technique for sufficiently high code rates.",,29 June-4 ,10.1109/ISIT.2014.6875000,https://ieeexplore.ieee.org/document/6875000
ieee:6875183,conference,Improved performance of LDPC-coded MIMO systems with EP-based soft-decisions,❌,"기여가 MIMO EP 소프트검출기이고 LDPC 디코더 자체 개선 아님 — 무선 검출 특이적, 이식 가능 ECC 기법 없음","Javier Céspedes, Pablo M. Olmos, Matilde Sánchez-Fernández, Fernando Perez-Cruz","Modern communications systems use efficient encoding schemes, multiple-input multiple-output (MIMO) and high-order QAM constellations for maximizing spectral efficiency. However, as the dimensions of the system grow, the design of efficient and low-complexity MIMO receivers possesses technical challenges. Symbol detection can no longer rely on conventional approaches for posterior probability computation due to complexity. Marginalization of this posterior to obtain per-antenna soft-bit probabilities to be fed to a channel decoder is computationally challenging when realistic signaling is used. In this work, we propose to use Expectation Propagation (EP) algorithm to provide an accurate low-complexity Gaussian approximation to the posterior, easily solving the posterior marginalization problem. EP soft-bit probabilities are used in an LDPC-coded MIMO system, achieving outstanding performance improvement compared to similar approaches in the literature for low-complexity LDPC MIMO decoding.",,29 June-4 ,10.1109/ISIT.2014.6875183,https://ieeexplore.ieee.org/document/6875183
ieee:6875306,conference,Density evolution analysis of braided convolutional codes on the erasure channel,❌,"braided convolutional(turbo-like) 코드의 BEC density evolution — 비-LDPC, 바이너리 LDPC BP로 떼어낼 기법 없음","Saeedeh Moloudi, Michael Lentmaier","Braided convolutional codes (BCCs) are a class of spatially coupled turbo-like codes with a structure that is similar to product codes or generalized LDPC codes. We derive explicit input/output transfer functions of the component convolutional decoders for the binary erasure channel (BEC). These are then used to formulate exact density evolution equations for blockwise BCCs under belief propagation (BP) decoding with optimal component APP decoders. Thresholds are computed for the coupled and uncoupled case, which is equivalent to tailbiting. Due to the relatively high rate of the component codes a significant threshold improvement by spatial coupling can be observed.",,29 June-4 ,10.1109/ISIT.2014.6875306,https://ieeexplore.ieee.org/document/6875306
ieee:6874887,conference,Spatially-coupled precoded rateless codes with bounded degree achieve the capacity of BEC under BP decoding,❌,"SC precoded rateless(Raptor) BEC 용량 달성 증명 — rateless/fountain 이론, 떼어낼 NAND ECC 기법 없음","Kosuke Sakata, Kenta Kasai, Kohichi Sakaniwa",Raptor codes are known as precoded rateless codes that achieve the capacity of BEC. However the maximum degree of Raptor codes needs to be unbounded to achieve the capacity. In this paper we prove that spatially-coupled precoded rateless codes achieve the capacity with bounded degree under BP decoding.,,29 June-4 ,10.1109/ISIT.2014.6874887,https://ieeexplore.ieee.org/document/6874887
ieee:6874886,conference,Spatially-coupled codes for side-information problems,❌,SC LDGM/LDPC를 Wyner-Ziv/Gelfand-Pinsker 측정보 문제에 적용 — 채널 ECC가 아닌 소스/측정보 코딩,"Santhosh Kumar, Avinash Vem, Krishna Narayanan, Henry D. Pfister","For compound LDGM/LDPC codes with maximum a posteriori (MAP) processing, Wainwright and Martinian showed that the information-theoretic rate regions of the Wyner-Ziv (WZ) and Gelfand-Pinsker (GP) problems are achievable. For the same ensemble, these rates do not appear to be achievable with message-passing guided decimation (GD). Fortunately, spatially-coupled (SC) codes seem to provide an elegant remedy when iterative decoding falls short of MAP decoding. In particular, Aref et al. recently introduced SC LDGM codes that approach the rate-distortion region with belief-propagation guided decimation (BPGD). In this paper, we show that SC compound LDGM/LDPC codes with BPGD can approach the rate regions of the WZ and GP problems.",,29 June-4 ,10.1109/ISIT.2014.6874886,https://ieeexplore.ieee.org/document/6874886
ieee:6874959,conference,Threshold analysis of non-binary spatially-coupled LDPC codes with windowed decoding,❌,non-binary SC-LDPC windowed decoding threshold 분석 — 비이진 LDPC이므로 제외,"Lai Wei, Toshiaki Koike-Akino, David G. M. Mitchell, Thomas E. Fuja, Daniel J. Costello","We study the iterative decoding threshold performance of non-binary spatially-coupled low-density parity-check (NB-SC-LDPC) code ensembles for both the binary erasure channel (BEC) and the binary-input additive white Gaussian noise channel (BIAWGNC), with particular emphasis on windowed decoding (WD). We consider both (2, 4)-regular and (3, 6)-regular NB-SC-LDPC code ensembles constructed using protographs and compute their thresholds using protograph versions of NB density evolution and NB extrinsic information transfer analysis. For these code ensembles, we show that WD of NB-SC-LDPC codes, which provides a significant decrease in latency and complexity compared to decoding across the entire parity-check matrix, results in a negligible decrease in the near-capacity performance for a sufficiently large window size W on both the BEC and the BIAWGNC. Also, we show that NBSC-LDPC code ensembles exhibit gains in the WD threshold compared to the corresponding block code ensembles decoded across the entire parity-check matrix, and that the gains increase as the finite field size q increases. Moreover, from the viewpoint of decoding complexity, we see that (3, 6)-regular NB-SC-LDPC codes are particularly attractive due to the fact that they achieve near-capacity thresholds even for small q and W.",,29 June-4 ,10.1109/ISIT.2014.6874959,https://ieeexplore.ieee.org/document/6874959
ieee:6874807,conference,On the puncturing patterns for punctured polar codes,❌,"punctured polar code 천공 패턴 설계; polar 전용, 바이너리 LDPC BP에 이식되는 부호 비의존 디코더 기법 없음","Liang Zhang, Zhaoyang Zhang, Xianbin Wang, Qilian Yu, Yan Chen","Puncturing is widely used to generate rate-compatible codes. However, for punctured polar codes, some puncturing patterns may greatly affect the split bit channels and cause considerable performance loss. In this paper, we aim to investigate how the split bit channels are affected by various puncturing patterns, and then evaluate the performances of these patterns. We propose a search algorithm to design good punctured polar codes, and prove that designing the optimal puncturing pattern for output bits is equivalent to finding the optimal puncturing pattern for frozen bits. We also propose a heuristic approach based on the idea of polarization to select the position of each punctured output bit, and simulations show that the puncturing pattern designed this way almost achieves the same performance as the optimal one selected by exhaustive search.",,29 June-4 ,10.1109/ISIT.2014.6874807,https://ieeexplore.ieee.org/document/6874807
ieee:6874997,conference,A decoding algorithm for CSS codes using the X/Z correlations,❌,"양자 CSS/표면코드용 perfect matching 디코더 — 스태빌라이저 X/Z 상관 의존, 고전 바이너리 LDPC BP에 이식 불가","Nicolas Delfosse, Jean-Pierre Tillich","We propose a simple decoding algorithm for CSS codes taking into account the correlations between the X part and the Z part of the error. Applying this idea to surface codes, we derive an improved version of the perfect matching decoding algorithm which uses these X/Z correlations.",,29 June-4 ,10.1109/ISIT.2014.6874997,https://ieeexplore.ieee.org/document/6874997
ieee:6875301,conference,Decoding of quasi-cyclic codes up to a new lower bound on the minimum distance,❌,"준순환 코드 최소거리 하한+신드롬 기반 대수적 디코딩 — LDPC BP 아닌 비-LDPC 대수 디코딩, 이식성 없음","Alexander Zeh, San Ling","A new lower bound on the minimum Hamming distance of linear quasi-cyclic codes over finite fields is proposed. It is based on spectral analysis and generalizes the Semenov-Trifonov bound in a similar way as the Hartmann-Tzeng bound extends the BCH approach for cyclic codes. Furthermore, a syndrome-based algebraic decoding algorithm is given.",,29 June-4 ,10.1109/ISIT.2014.6875301,https://ieeexplore.ieee.org/document/6875301
