ID,Type,Title,Status,Reason,Authors,Abstract,Categories,Published,DOI,PDF URL
ieee:6785991,journal,"Non-Binary Protograph-Based LDPC Codes: Enumerators, Analysis, and Designs",❌,비이진(non-binary) protograph LDPC 설계·분석 — 비이진 LDPC는 제외 대상,"Lara Dolecek, Dariush Divsalar, Yizeng Sun, Behzad Amiri","This paper provides a comprehensive analysis of nonbinary low-density parity check (LDPC) codes built out of protographs. We consider both random and constrained edge-weight labeling, and refer to the former as the unconstrained nonbinary protograph-based LDPC codes (U-NBPB codes) and to the latter as the constrained nonbinary protograph-based LDPC codes (C-NBPB codes). Equipped with combinatorial definitions extended to the nonbinary domain, ensemble enumerators of codewords, trapping sets, stopping sets, and pseudocodewords are calculated. The exact enumerators are presented in the finite-length regime, and the corresponding growth rates are calculated in the asymptotic regime. An EXIT chart tool for computing the iterative decoding thresholds of protograph-based LDPC codes is presented, followed by several examples of finite-length U-NBPB and C-NBPB codes with high performance. Throughout this paper, we provide accompanying examples, which demonstrate the advantage of nonbinary protograph-based LDPC codes over their binary counterparts and over random constructions. The results presented in this paper advance the analytical toolbox of nonbinary graph-based codes.",,July 2014,10.1109/TIT.2014.2316215,https://ieeexplore.ieee.org/document/6785991
ieee:10851212,journal,A Novel Least-Entanglement-Assisted Asymmetric Quantum Codes Based on Sliding Grill,❌,"비대칭 양자코드(entanglement-assisted), 양자 전용 ebit/스태빌라이저 의존; 양자 LDPC 제외","Dong Cao, Yaoliang Song, Cheng Zhu","We propose new methods for constructing novel entanglement-assisted asymmetric quantum codes based on combinatorial designs and sliding grill. Based on a special case of combinatorial designs, our proposed method can construct a type of parity check matrix with greater column weight and better decoding performance. Combined with the characteristic of asymmetric quantum channel, we propose new method of sliding grill. Mother matrix and submatrix can be constructed. The null space of the parity-check matrix gives entanglement-assisted asymmetric quantum code. Tanner graph of the code has a girth of at least 6. Our proposed quantum code has higher code rate with the same error correction capability. These families of entanglement-assisted asymmetric quantum codes consume only one copy of maximally entangled state (ebit), and outperform other quantum codes based on similar construction method according to our numerical computation.",,July 2014,10.23919/CJE.2014.10851212,https://ieeexplore.ieee.org/document/10851212
ieee:6834828,journal,Minimum Pseudoweight Analysis of 3-Dimensional Turbo Codes,❌,"3D 터보 부호의 LP 디코딩/의사부호어 이론 분석으로 비-LDPC, 떼어낼 바이너리 LDPC BP 디코더 기법 없음","Eirik Rosnes, Michael Helmling, Alexandre Graell i Amat","In this paper, we consider pseudocodewords of (relaxed) linear programming (LP) decoding of 3-dimensional turbo codes (3D-TCs). We present a relaxed LP decoder for 3D-TCs, adapting the relaxed LP decoder for conventional turbo codes proposed by Feldman in his thesis. We show that the 3D-TC polytope is proper and  $C$-symmetric and make a connection to finite graph covers of the 3D-TC factor graph. This connection is used to show that the support set of any pseudocodeword is a stopping set of iterative decoding of 3D-TCs using maximum a posteriori constituent decoders on the binary erasure channel. Furthermore, we compute ensemble-average pseudoweight enumerators of 3D-TCs and perform a finite-length minimum pseudoweight analysis for small cover degrees. Moreover, an explicit description of the fundamental cone of the 3D-TC polytope is given. Finally, we present an extensive numerical study of small-to-medium block length 3D-TCs, which shows that 1) typically (i.e., in most cases), when the minimum distance  $d_{\min}$ and/or the stopping distance  $h_{\min}$ is high, the minimum pseudoweight (on the additive white Gaussian noise channel) is strictly smaller than both  $d_{\min}$ and  $h_{\min}$ and that 2) the minimum pseudoweight grows with the block length, at least for small-to-medium block lengths.",,July 2014,10.1109/TCOMM.2014.2329690,https://ieeexplore.ieee.org/document/6834828
ieee:6779691,journal,Sum-Rate Optimization and Performance Analysis of Distributed Coding for Sensor Networks: Application to a Distributed Product Code,❌,"센서네트워크 분산 product code, min-distance 디코딩. 비-LDPC, NAND LDPC로 떼어낼 기법 없음","Karine Amis, Yizhi Yin, Ramesh Pyndiah","This paper deals with distributed coding for sensor networks. We consider energy-and-complexity-constrained sensors that communicate with a distant sink at a relatively low data rate with the help of a relay with higher-power and better-processing capabilities. We assume an orthogonal multiple access to the resources. Sources transmit independently and use simple short block codes to limit delay and complexity. The relay performs network encoding of the detected codewords and forwards either partial or complete coded information. The sink jointly decodes observations coming both from sources and relay to simultaneously estimate the information sent by the source nodes. We first analyse the cooperative scheme from an information theoretical point of view in order to determine the resource allocation strategy between the sources and the relay, which maximizes the overall network sum-rate. When a single relay is used and the source-to-relay link is not error-free, occasional detection errors introduce additional errors at the relay output, which, in turn, critically affect decoding performance and yield error-floors at the destination. In the case of a distributed coding scheme based on product codes, we obtain a closed-form asymptotically-tight approximation of the error probability under a minimum-distance decoding of the product code at the destination. The proposed analysis takes explicitly into account the error propagation at the relay output and may be extended to other forms of distributed coding schemes.",,July 2014,10.1109/TWC.2014.2314095,https://ieeexplore.ieee.org/document/6779691
ieee:6823688,journal,Construction and Block Error Rate Analysis of Polar Codes Over AWGN Channel Based on Gaussian Approximation,❌,"Polar code 구성 + SC 디코딩 BLER(GA). polar 전용, 부호비의존 BP 이식기법 없음","Daolong Wu, Ying Li, Yue Sun","Polar codes are usually constructed to minimize the upper bound of a block error ratio (BLER). In this paper, we discuss the estimation of the exact BLERs of polar codes as well as the construction of polar codes. Assuming that successive cancellation (SC) decoding is employed, we present a method for estimating the exact BLER of polar codes with the help of Gaussian approximation (GA). A new algorithm is proposed to construct polar codes, aimed at minimizing the exact BLER, instead of the upper bound of the BLER. Analysis indicates that the new method is less complex than the existing methods. It is also shown that the estimation results match the simulations well.",,July 2014,10.1109/LCOMM.2014.2325811,https://ieeexplore.ieee.org/document/6823688
ieee:6840300,journal,Cyber–Physical Device Authentication for the Smart Grid Electric Vehicle Ecosystem,❌,스마트그리드 EV 기기 인증 프로토콜로 ECC/LDPC 무관,"Aldar C.-F. Chan, Jianying Zhou","Entity authentication and related key management is an active research topic in smart grid security. However, existing works seem to have overlooked the significance that the smart grid is a cyber–physical system, which entails more considerations in the integration of its cyber and physical domains. Ignoring this could possibly undermine security since the effects of cyber authorization in the smart grid are usually extended into the physical domain. The substitution attack, a kind of the man-in-the-middle attack, has been demonstrated using this gap. This paper proposes a two-factor cyber–physical device authentication protocol to defend against coordinated cyber–physical attacks in the smart grid. The idea is to combine a novel contextual factor based on physical connectivity in the power grid with the conventional authentication factor in the challenge–response protocol, widely used in cybersecurity. The resulting protocol provides assurance on not only the digital identity of a device but also the device's controllability in the physical domain. While the design is for the electric vehicle ecosystem, the framework could be readily extended to other smart grid subsystems.",,July 2014,10.1109/JSAC.2014.2332121,https://ieeexplore.ieee.org/document/6840300
ieee:6693678,journal,Scrutinizing Bit- and Symbol-Errors of IEEE 802.15.4 Communication in Industrial Environments,❌,"무선 채널 비트에러 분석 + RS(15,k) 블록코드. LDPC 아님, 떼어낼 디코더/HW/코드설계 기법 없음","Filip Barac, Mikael Gidlund, Tingting Zhang","The knowledge of error nature in wireless channels is an essential constituent of efficient communication protocol design. To this end, this paper is the first comprehensive bit- and symbol-level analysis of IEEE 802.15.4 transmission errors in industrial environments. The intention with this paper is to extract the error properties relevant for future improvements of wireless communication reliability and coexistence of radio systems in these harsh conditions. An extensive set of bit-error traces was collected in a variety of scenarios and industrial environments, showing that error behavior is highly dependent on the cause of packet corruption. It is shown that errors inflicted by multipath fading and attenuation exhibit different properties than those imposed by IEEE 802.11 interference. The statistical behavior of these two patterns is concurrently investigated in terms of differences in bit-error distribution, error burst length, channel memory length, and the scale of packet corruption. With these conclusions at hand, abiding to the computational constraints of embedded sensors and the statistical properties of bit-errors, a Reed-Solomon (15,k) block code is chosen to investigate the implications of bit-error nature on practical aspects of channel coding and interleaving. This paper is concluded by a number of findings of high practical relevance, concerning the optimal type, depth, and meaningfulness of interleaving.",,July 2014,10.1109/TIM.2013.2293235,https://ieeexplore.ieee.org/document/6693678
ieee:6782359,journal,On the Performance of Adaptive Packetized Wireless Communication Links Under Jamming,❌,재밍 하 게임이론 통신 링크 최적화. 부호/디코더 기법 없음,"Koorosh Firouzbakht, Guevara Noubir, Masoud Salehi","We employ a game theoretic approach to formulate communication between two nodes over a wireless link in the presence of an adversary. We define a constrained, two-player, zero-sum game between a transmitter/receiver pair with adaptive transmission parameters and an adversary with average and maximum power constraints. In this model, the transmitter's goal is to maximize the achievable expected performance of the communication link, defined by a utility function, while the jammer's goal is to minimize the same utility function. Inspired by capacity/rate as a performance measure, we define a general utility function and a payoff matrix which may be applied to a variety of jamming problems. We show the existence of a threshold  $(J_{\rm TH})$ such that if the jammer's average power exceeds  $J_{\rm TH}$, the expected payoff of the transmitter at Nash Equilibrium (NE) is the same as the case when the jammer uses its maximum allowable power,  $J_{\max}$, all the time. We provide analytical and numerical results for transmitter and jammer optimal strategies and a closed form expression for the expected value of the game at the NE. As a special case, we investigate the maximum achievable transmission rate of a rate-adaptive, packetized, wireless AWGN communication link under different jamming scenarios and show that randomization can significantly assist a smart jammer with limited average power.",,July 2014,10.1109/TWC.2014.2314105,https://ieeexplore.ieee.org/document/6782359
ieee:6798756,journal,Linear Precoder Design for Doubly Correlated Partially Coherent Fading MIMO Channels,❌,MIMO 선형 프리코더 설계. LDPC/디코더 무관,"Animesh Yadav, Markku Juntti, Jorma Lilleberg","We consider the single-user multiple-input multiple-output (MIMO) precoder design problem for the doubly spatially correlated partially coherent Rayleigh fading channels with discrete inputs. The objective is to design a linear precoder to adapt to the degradation caused by the imperfect channel estimation at the receiver and the transmit-receive antenna correlation. The system is partially coherent so that the MIMO channel coefficients are estimated at the receiver and its error covariance matrix is fed back to the transmitter. We utilized the cutoff rate (CR) expression, an alternative to the mutual information (MI), and propose to use it as a design criterion to design the linear precoders. A linear precoder is obtained by numerically maximizing the CR with respect to the precoder matrix with a given average power constraint. Furthermore, the precoder matrix is decomposed using singular value decomposition (SVD) into the input shaping matrix, power loading matrix, and beamforming matrix. The beamforming matrix is found to coincide with the eigenvectors of the transmit correlation matrix. The power loading and input shaping matrices are solved numerically using the difference of convex (d.c.) functions programming algorithm and optimization under the unitary constraint, respectively. A 2-block alternating optimization (AO) algorithm is proposed to solve the input shaping matrix and power loading matrix iteratively. Precoders are designed to be used in conjunction with two MIMO transmission schemes: the spatial multiplexing (SM) and space–time (ST) block transmission modes. The frame error rate (FER) and average MI are used as the performance metrics to validate the performance of the newly designed CR-precoders in comparison with the conventional no-precoding case and cutoff rate optimized partially coherent constellations (PCCs). Numerical examples show that the performance gains of the designed precoders are significant compared to the CR-PCCs and conventional codewords.",,July 2014,10.1109/TWC.2014.2317490,https://ieeexplore.ieee.org/document/6798756
ieee:6817593,journal,Orthogonal Multiple Access With Correlated Sources: Achievable Region and Pragmatic Schemes,❌,"상관소스 직교다중접속, serially concatenated convolutional code + EXIT. LDPC ECC 기법 아님","Andrea Abrardo, Gianluigi Ferrari, Marco Martalò, Michele Franceschini, Riccardo Raheli","In this paper, we consider orthogonal multiple access coding schemes, where correlated sources are encoded in a distributed fashion and transmitted through additive white Gaussian noise (AWGN) channels to an access point (AP). At the AP, component decoders, which are associated with the source encoders, iteratively exchange soft information by taking into account the source correlation. The first goal of this paper is to investigate the ultimate achievable performance limits in terms of a multi-dimensional feasible region in the space of channel parameters, deriving insights on the impact of the number of sources. The second goal is the design of pragmatic schemes, where the sources use “off-the-shelf” channel codes. In order to analyze the performance of given coding schemes, we propose an extrinsic information transfer-based approach, which allows to determine the corresponding multi-dimensional feasible regions. On the basis of the proposed analytical framework, the performance of pragmatic coded schemes, based on serially concatenated convolutional codes, is discussed.",,July 2014,10.1109/TCOMM.2014.2325039,https://ieeexplore.ieee.org/document/6817593
ieee:6814311,journal,Coded Sampling Bound—How Much Training is Needed for Iterative Semi-Blind Channel Estimation?,❌,"반맹 채널추정용 coded sampling bound. 부호종속 없는 추정이론, 떼어낼 ECC 기법 없음","Christopher Knievel, Peter Adam Hoeher","Coherent detection is commonly facilitated by means of pilot-aided channel estimation. While this approach offers a high estimation accuracy, the spectral and power efficiencies are reduced due to the pilot overhead. In the case that redundancy due to channel coding is not used for the purpose of channel estimation, the maximum pilot spacing for which a time-varying channel can be reconstructed without distortion is given by the Nyquist-Shannon sampling theorem. In this paper, it is shown that if channel coding is taken into account for channel estimation in an iterative fashion, the maximum spacing can be significantly extended, which results in an increased spectral efficiency. Towards this goal, a so-called coded sampling bound is derived. This semi-analytical bound is compared with the Nyquist-Shannon sampling theorem. The presented results indicate that the maximum pilot spacing can be arbitrarily large given a suitable channel code and code rate.",,July 2014,10.1109/TCOMM.2014.2323068,https://ieeexplore.ieee.org/document/6814311
ieee:6828749,journal,Mode-Multiplexed Multi-Tb/s Superchannel Transmission With Advanced Multidimensional Signaling in the Presence of Fiber Nonlinearities,❌,비이진(non-binary) QC-LDPC + 광전송 응용; 바이너리 한정 기준에 위배,"Changyu Lin, Ivan B. Djordjevic, Milorad Cvijetic, Ding Zou","We have analyzed the possibility of long-haul superchannel transmission with an aggregate serial bit rate exceeding 1 Tb/s by using the mode-multiplexed multidimensional signaling. We considered nonbinary quasi-cyclic LDPC-coded OFDM signals transmitted over few-mode fibers (FMFs). The optimum vector-form nonlinear Schrödinger equation is developed to evaluate the performance of the proposed system. Both the impacts of nonlinear effects and nonlinear interaction between spatial modes have been included through the modified nonlinear Schrödinger equation we applied for the FMF case. Both two-dimensional and optimized four-dimensional (4D) signal constellations have been considered. To overcome the constraints imposed by the linear and nonlinear impairments in FMF, we proposed the use of block-coded modulation with advanced channel estimation and compensation techniques. We verified by means of simulation that the transmission of an aggregate serial bit rate of 1.2 Tb/s over 3000 km is achievable with a proposed LDPC-coded QPSK-OFDM format, whereas superchannel transmission with an aggregate serial rate of 2.4 Tb/s over 1800 km is achievable with the 16-QAM format. When a 4D 16-ary optimized constellation is used, we can extend the transmission distance of mode-multiplexed QPSK-OFDM by an additional 300 km.",,July 2014,10.1109/TCOMM.2014.2329847,https://ieeexplore.ieee.org/document/6828749
ieee:6889339,conference,Deterministic complex-valued measurement matrices based on Berlekamp-Justesen codes,❌,"압축센싱 측정행렬 결정론적 구성(Berlekamp-Justesen) — 채널 ECC 아님, LDPC 디코더/코드 설계 기여 없음","Lu Liu, Xin-Ji Liu, Shu-Tao Xia","Nowadays deterministic construction of measurement matrices is a hot topic in compressed sensing. In this paper, we propose two classes of deterministic complex-valued measurement matrices based on Berlekamp-Justesen codes. Row and column numbers of these matrices are tunable through row and column puncturing. Moreover, the proposed matrices are obtained from circular matrices, thus the storage costs of them are relatively low and both the sampling and recovery process can be simpler. Simulation results show that the proposed matrices perform better than Gaussian random matrices and some other deterministic measurement matrices under OMP recovery, especially for image reconstruction.",,9-13 July ,10.1109/ChinaSIP.2014.6889339,https://ieeexplore.ieee.org/document/6889339
ieee:6868708,conference,"N-queens problem by efficient non-backtracking algorithm using local search, heuristics and Tabu search elements",❌,n-queens 문제용 local search/Tabu 알고리즘 — LDPC/ECC와 무관.,Marian Kovac,"This paper presents an efficient algorithm using Local search, various heuristics and Tabu search elements, which is capable to find solution for huge instances of the n-queens (hundreds of millions n). The algorithm returns random solutions in short time even on an ordinary personal computer. There is no other faster algorithm in n-Queens bibliography as our presented algorithm so far.",,9-11 July ,10.1109/DT.2014.6868708,https://ieeexplore.ieee.org/document/6868708
ieee:6966333,conference,Performance analysis of various FEC codes for wireless communication,❌,"FEC 부호 성능 비교(RS/BCH/LDPC) 서베이 수준, 새 디코더·구성·HW 기여 없음","J. Manikandan, M. Manikandan","Forward Error Correction code (FEC) is important for Wireless Communication and Cryptography applications to perform the Error Detection and Correction (EDC) mechanisms. FEC codes are classified into two types such as Convolutional code and Block code. Various FEC codes can be used in Wireless Communication likes Viterbi code, Reed Solomon code, Golay, BCH, Multidimensional parity, Hamming code and LDPC codes. In this paper, an analysis between Reed Solomon code, Bose, Chaudhuri, and Hocquenghem (BCH) code and LDPC codes are presented. A Low Density Parity Check (LDPC) code provides low area and high speed than all other codes. Simulation is carried out by ModelSim6.3C and Synthesis is carried out by Xilinx10.1.",,8-8 July 2,10.1109/ICCTET.2014.6966333,https://ieeexplore.ieee.org/document/6966333
ieee:6876783,conference,LT codes with loss rate and decreasing ripple size for wireless relay communications,❌,"LT/fountain 부호(무선 릴레이, degree distribution) — fountain/erasure, ECC 디코더 기법 아님","Lei Zhang, Jianxin Liao, Jingyu Wang, Qi Qi","In this paper, new fountain codes named LT-LR-DRS (Luby Transfer with Loss Rate and Decreasing Ripple Size) codes are proposed for wireless relay communications. The transmission is divided into two phases: at first phase, all original symbols are transmitted and some original symbols are lost during transmission; encoded symbols generated by LT-LR-DRS codes are transmitted at second phase to recover the lost symbols. In LT-LR-DRS, an innovative degree distribution instead of RSD (Robust Soliton degree Distribution) is proposed. The minimum degree of encoded symbols is decided by loss rate and the ripple size is decreased during decoding process. We show both analytically and through real experiments, that LT-LR-DRS codes have better performance in term of average overhead, complexity and memory usage compared to LT, SLT-LR (Shifted LT with Loss Rate), LT-DRS (LT with Decreasing Ripple Size) codes.",,8-11 July ,10.1109/ICUFN.2014.6876783,https://ieeexplore.ieee.org/document/6876783
ieee:6904380,conference,Evaluation of a 60 GHz compact-range gigabit wireless access system using a large array antenna,❌,"60GHz 무선 액세스 안테나/RF 시스템 평가 — LDPC/ECC 무관, 떼어낼 코딩 기법 없음","Miao Zhang, Koji Toyosaki, Jiro Hirokawa, Makoto Ando","A novel compact-range gigabit wireless access system in the 60 GHz band is proposed for burst-type data transfer. A large array antenna adopted in the access point forms a stable communication zone proportional to the antenna size. The mobile user standing everywhere within the coverage, receives a stable signal almost free of multi-path. The circularly-polarized waveguide slot arrays with different numbers of elements are realized for demonstrations. A RF front-end and a BB module are integrated on the backside of those antennas to construct the prototype of a compact-range Gigabit wireless access system. The system performance, especially the bit-error rate is evaluated as the function of relative positions between transmitter and receiver.",,6-11 July ,10.1109/APS.2014.6904380,https://ieeexplore.ieee.org/document/6904380
ieee:6888200,conference,Transceiver specifications for LDPC coded OOK optical links,❌,"LDPC OOK 광링크의 TIA/ADC 사양·에너지 분석 — 응용 특이적, 떼어낼 디코더/HW/코드 기법 없음","Behnam Sedighi, Bipin Sankar Gopalakrishna Pillai, N. Prasanth Anthapadmanabhan",This paper investigates specifications of the transimpedance amplifier and analog-to-digital converter required for incorporating soft-decision low density parity check codes into an optical transceiver and determines impact of forward error correction on transceiver energy dissipation.,,6-10 July ,,https://ieeexplore.ieee.org/document/6888200
ieee:6888354,conference,Adaptive nonbinary LDPC coded modulation for optical transport networks,❌,비이진(nonbinary) QC-LDPC coded modulation — 비이진이라 제외,"Ivan B. Djordjevic, Yequn Zhang","In this invited paper, we describe an adaptive nonbinary LDPC coded modulation scheme suitable for high-speed optical transport networks, which is based on irregular quasi-cyclic-LDPC codes derived from pairwise balanced designs, providing excellent coding gains.",,6-10 July ,,https://ieeexplore.ieee.org/document/6888354
