"Deterministic construction of Quasi-Cyclic sparse sensing matrices from one-coincidence sequence","W. Zeng; H. Wang; G. Xu; L. Gan","Institute of Communications Engineering, PLA University of Science and Technology, Nanjing, China; Institute of Communications Engineering, PLA University of Science and Technology, Nanjing, China; Institute of Communications Engineering, PLA University of Science and Technology, Nanjing, China; School of Engineering and Design, Brunel University, West London, United Kingdom",2015 International Conference on Sampling Theory and Applications (SampTA),"9 Jul 2015","2015","","","153","157","In this paper, a new class of deterministic sparse matrices derived from Quasi-Cyclic (QC) low-density parity-check (LDPC) codes is presented for compressed sensing (CS). In contrast to random and other deterministic matrices, the proposed matrices are generated based on circulant permutation matrices, which require less memory for storage and low computational cost for sensing. Its size is also quite flexible compared with other existing fixed-sizes deterministic matrices. Furthermore, both the coherence and null space property of proposed matrices are investigated, specially, the upper bounds of signal sparsity k is given for exactly recovering. Finally, we carry out many numerical simulations and show that our sparse matrices outperform Gaussian random matrices under some scenes.","","978-1-4673-7353-1","10.1109/SAMPTA.2015.7148870","","https://ieeexplore.ieee.org/stamp/stamp.jsp?arnumber=7148870","","Sparse matrices;Sensors;Coherence;Linear matrix inequalities;Compressed sensing;Arrays;Parity check codes","","1","","18","IEEE","9 Jul 2015","25-29 May 2015","25-29 May 2015","IEEE","IEEE Conferences"
"Protection of memory using code redundancies a survey","K. Preethi; T. Karthik","Karpagam College Of Engineering Coimbatore, India; Karpagam College Of Engineering Coimbatore, India",2015 Online International Conference on Green Engineering and Technologies (IC-GET),"19 Apr 2016","2015","","","1","4","The issue of soft errors is an important emerging concern in the design and implementation of microprocessors. It is necessary to protect memory cells using Error Detection and error correction (ECC) codes such as hamming codes, Parity Matrix codes, Reed-Solomon codes, Punctured difference set (PDS) codes, LDPC codes and so on. The main problem is that they require complex architecture, higher delay overhead and more redundant bits. In this paper, a survey of such codes and their issues are presented. This paper is based on Decimal matrix code (DMC) with Encoder Reuse Technique (ERT) used to minimize area overhead.","","978-1-4673-9781-0","10.1109/GET.2015.7453847","","https://ieeexplore.ieee.org/stamp/stamp.jsp?arnumber=7453847","Soft errors;Error Correction Codes (ECC);Decimal Matrix Code (DMC)","Decoding;Parity check codes;Encoding;Reed-Solomon codes;Delays;Circuit faults","","","","9","IEEE","19 Apr 2016","27-27 Nov. 2015","27-27 Nov. 2015","IEEE","IEEE Conferences"
"Clustered Multiuser Detection Using SC-FDE Transmission with Iterative Receivers","J. Gante; M. Gomes; R. Dinis; V. Silva","Department of Electrical and Computer Engineering, University of Coimbra, Coimbra, Portugal; Department of Electrical and Computer Engineering, University of Coimbra, Coimbra, Portugal; FCT-UNL, Caparica, Portugal; Department of Electrical and Computer Engineering, University of Coimbra, Coimbra, Portugal",2015 IEEE 81st Vehicular Technology Conference (VTC Spring),"2 Jul 2015","2015","","","1","5","Iterative block decision feedback equalization (IB-DFE) algorithms are proven to be powerful tools when detecting several uplink signals sharing the same physical channel. However, those algorithms may face some constraints -- the IB-DFE has some difficulty picking certain signals up if they are considerably weaker than the rest and the computational effort grows exponentially with the number of signals to be detected. In this paper we present a clustered multiuser detection scheme, based on an IB-DFE algorithm. It is demonstrated that if the mobile terminals (MTs) have enough power and are distributed in clusters, with considerable power difference between them, it is possible to successfully detect them all while containing the computational complexity. Our scheme also requires fewer receiving antennas than the original IB-DFE implementations and, with the aid of low-density parity- check (LDPC) and turbo- equalization, it is able to reach high performance levels with low power requirements.","1550-2252","978-1-4799-8088-8","10.1109/VTCSpring.2015.7145747","","https://ieeexplore.ieee.org/stamp/stamp.jsp?arnumber=7145747","","Bit error rate;Estimation;Noise;Frequency-domain analysis;Receiving antennas;Interference","","","","10","IEEE","2 Jul 2015","11-14 May 2015","11-14 May 2015","IEEE","IEEE Conferences"
"Approach to frame-misalignment in physical-layer network coding","B. Nguyen; D. Haley; Y. Chen; T. Chan",Institute for Telecommunications Research University of South Australia; Institute for Telecommunications Research University of South Australia; Institute for Telecommunications Research University of South Australia; Institute for Telecommunications Research University of South Australia,"2015 IEEE International Conference on Acoustics, Speech and Signal Processing (ICASSP)","6 Aug 2015","2015","","","3123","3127","By exploiting superimposed signals at relays, physicallayer network coding (PNC) could significantly improve the throughput of wireless communications systems. However, it is challenging to achieve perfect synchronization between superimposed signals at the relay. In this paper, we propose an approach to resolve the issue of frame-misalignment in PNC using type-I Euclidean geometry low-density parity-check (EG-LDPC) codes with cyclic prefix or zero padding. To estimate the arrival delay between two transmitted signals at the relay, Gold sequences are adopted as pilot sequences in our transmit frames. Simulation results show that our approach can effectively resolve the frame-misalignment issue in PNC.","2379-190X","978-1-4673-6997-8","10.1109/ICASSP.2015.7178546","","https://ieeexplore.ieee.org/stamp/stamp.jsp?arnumber=7178546","PNC;cyclic prefix;zero padding","Relays;Decoding;Gold;Network coding;Delays;Signal resolution;Parity check codes","","","","13","IEEE","6 Aug 2015","19-24 April 2015","19-24 April 2015","IEEE","IEEE Conferences"
"Obtaining diversity gain by block Markov superposition transmission","Jinshun Zhu; X. Ma","Department of Electronics and Communication Engineering, Sun Yat-sen University, Guangzhou, GD, China; Department of Electronics and Communication Engineering, Sun Yat-sen University, Guangzhou, GD, China",2015 International Workshop on High Mobility Wireless Communications (HMWC),"17 Dec 2015","2015","","","66","70","In time-varying wireless channels, the radio signals suffer from time-varying fading which may cause severe signal attenuation. In this paper, we present a new approach, called block Markov superposition transmission (BMST) over real field, to obtain diversity which increases the transmission reliability under the fading channels. The proposed scheme is similar to BMST over binary field, which has been used to construct big convolutional codes from short codes. However, unlike superposition in BMST over binary field, superposition in the proposed scheme is over real field. We also present an iterative sliding-window detection/decoding algorithm for the proposed transmission scheme. The performance of BMST over real field can be lower bounded by that of the equivalent system. Progressive edge-growth (PEG) constructed LDPC code of rate 0.5 with length 504 and bipolar basic mapping are chosen for simulation, and numerical results show that: 1) in additive white gaussian noise (AWGN) channels, no performance gain is obtained; 2) in fast Rayleigh fading channels, an extra diversity gain of 1.3 dB can be obtained by the proposed approach at bit-error-rate (BER) of 10−5; 3) in block Rayleigh fading channels, about 22 dB performance gain are obtained by the proposed approach at BER of 10−5.","","978-1-4673-7629-7","10.1109/HMWC.2015.7354337","","https://ieeexplore.ieee.org/stamp/stamp.jsp?arnumber=7354337","","Bit error rate;Reliability;AWGN channels;Signal to noise ratio;Parity check codes;Binary phase shift keying","","","","12","IEEE","17 Dec 2015","21-23 Oct. 2015","21-23 Oct. 2015","IEEE","IEEE Conferences"
"List message passing algorithm for noiseless compressed sensing","F. Ramirez-Javega; M. Lamarca","Dept. of Signal Theory and Communications. (TSC), Universitat Politecnica de Catalunya (UPC); Dept. of Signal Theory and Communications. (TSC), Universitat Politecnica de Catalunya (UPC)",2015 Asia-Pacific Signal and Information Processing Association Annual Summit and Conference (APSIPA),"25 Feb 2016","2015","","","1116","1120","We propose a verification-based algorithm for noiseless Compressed Sensing that reconstructs the original signal operating on a sparse graph. The proposed scheme has affordable computational complexity and its performance is significantly better than previous verification-based algorithms and similar to AMP-based algorithms. We also show that the performance of a noiseless compressed sensing scheme when verification-based algorithms and a sparse matrix is employed to reconstruct the original signal can be upper bounded by the performance of a LDPC code employing the same parity matrix when correcting a codeword transmitted through a BEC.","","978-9-8814-7680-7","10.1109/APSIPA.2015.7415444","","https://ieeexplore.ieee.org/stamp/stamp.jsp?arnumber=7415444","","Compressed sensing;Algorithm design and analysis;Message passing;Sparse matrices;Parity check codes;Decoding;Computational complexity","","","","15","","25 Feb 2016","16-19 Dec. 2015","16-19 Dec. 2015","IEEE","IEEE Conferences"
"Novel reliability evaluation method for NAND flash memory","Jiang Xiao-bo; Tan Xue-qing; Huang Wei-pei","School of Electronic and Information, South China University of Technology, Guangzhou, China; School of Electronic and Information, South China University of Technology, Guangzhou, China; School of Electronic and Information, South China University of Technology, Guangzhou, China",TENCON 2015 - 2015 IEEE Region 10 Conference,"7 Jan 2016","2015","","","1","4","The evaluation of error correction code (ECC) for NAND flash memory is increasingly complicated by the increasing bit error rate in memory. The concept of error-free information capacity is proposed to evaluate the performance ECC of NAND flash memory. The new method simultaneously considers the capacity and reliability of NAND flash memory. Low-density parity-check (LDPC) codes with a medium code rate can improve the integrated performance of NAND flash memory in order of magnitudes. Observations provide guides for the development of ECC schemes in NAND flash memory in future.","2159-3450","978-1-4799-8641-5","10.1109/TENCON.2015.7372718","","https://ieeexplore.ieee.org/stamp/stamp.jsp?arnumber=7372718","NAND flash memory;Error-free information capacity;ECC structure","Flash memories;Error correction codes;Channel models;Reliability;Bit error rate;Parity check codes;Encoding","","","","23","IEEE","7 Jan 2016","1-4 Nov. 2015","1-4 Nov. 2015","IEEE","IEEE Conferences"
"The multi-step PEG and ACE constrained PEG algorithms can design the LDPC codes with better cycle-connectivity","X. He; L. Zhou; J. Du; Z. Shi","National Key Laboratory of Science and Technology on Communications, University of Electronic Science and Technology of China, Chengdu, P. R. China; National Key Laboratory of Science and Technology on Communications, University of Electronic Science and Technology of China, Chengdu, P. R. China; National Key Laboratory of Science and Technology on Communications, University of Electronic Science and Technology of China, Chengdu, P. R. China; National Key Laboratory of Science and Technology on Communications, University of Electronic Science and Technology of China, Chengdu, P. R. China",2015 IEEE International Symposium on Information Theory (ISIT),"1 Oct 2015","2015","","","46","50","This paper proposes two new cycle-optimized algorithms, called the multi-step progressive edge-growth (PEG) algorithm and the multi-step approximate cycle extrinsic message degree (ACE) constrained PEG algorithm, to design an LDPC code with larger girth and better cycle-connectivity. In addition, an efficient method is developed to calculate the distances between the variable nodes (VNs) and the check nodes (CNs) in the proposed algorithms. Simulation results show that compared to the conventional cycle-optimized algorithms, the proposed algorithms can achieve both better cycle-connectivity and foreseeable lower error floors.","2157-8117","978-1-4673-7704-1","10.1109/ISIT.2015.7282414","","https://ieeexplore.ieee.org/stamp/stamp.jsp?arnumber=7282414","","Algorithm design and analysis;Parity check codes;Floors;Measurement;Computational complexity;Approximation algorithms;Bit error rate","","8","","10","IEEE","1 Oct 2015","14-19 June 2015","14-19 June 2015","IEEE","IEEE Conferences"
"A full layer parallel QC-LDPC decoder for WiMAX and Wi-Fi","W. Zhang; S. Chen; X. Bai; D. Zhou","Dept. of Electronic Sci. & Tech., University of Science and Technology of China, Hefei, China; Dept. of Electronic Sci. & Tech., University of Science and Technology of China, Hefei, China; Dept. of Electronic Sci. & Tech., University of Science and Technology of China, Hefei, China; Faculty of Science and Engineering, Waseda University, Kitakyushu, Japan",2015 IEEE 11th International Conference on ASIC (ASICON),"21 Jul 2016","2015","","","1","4","This paper presents a full layer parallel quasi-cyclic low density parity check (QC-LDPC) code decoder for IEEE 802.16e (WiMAX) and IEEE 802.11n (Wi-Fi). By adopting three techniques including reusable fully parallel check node unit (CNU) structure, path rerouting network (PRN) and reusable permutation network (PN), the proposed decoder gets Gbps level throughput and could support two standards and most code modes of them with low hardware cost. By using turbo-decoding message-passing normalized min-sum (TDMP-NMS) decoding strategy, the bit error rate (BER) of the proposed decoder is decreasing fast to 10−5 at 2.2 dB. It only takes 30∼40/30∼60 clock cycles in each decoding iteration for WiMAX/Wi-Fi. Using SMIC 40nm low leakage HS RVT CMOS process and 7-bit quantization, the proposed decoder attains 789∼2227/470∼1879 Mbps for WiMAX/Wi-Fi at 290 MHz, 10 iterations, and only occupies 2.26 mm2 area.","2162-755X","978-1-4799-8485-5","10.1109/ASICON.2015.7517004","","https://ieeexplore.ieee.org/stamp/stamp.jsp?arnumber=7517004","","Decoding;WiMAX;IEEE 802.11 Standard;Clocks;Phase change materials;Computer architecture;Parity check codes","","7","","8","IEEE","21 Jul 2016","3-6 Nov. 2015","3-6 Nov. 2015","IEEE","IEEE Conferences"
"Performance of frequency hopping D-BLAST MIMO Architecture using LDPC and BPSK","J. J. Mroczek; M. J. Gans; L. L. Joiner","U.S. Air Force Research Laboratory, Rome, NY, USA; U.S. Air Force Research Laboratory, Rome, NY, USA; Electrical and Computer Engineering Department, University of Alabama in Huntsville, Huntsville, AL, USA",MILCOM 2015 - 2015 IEEE Military Communications Conference,"17 Dec 2015","2015","","","860","865","In this paper we introduce frequency hopping spread spectrum (FHSS) into Diagonal Bell Laboratories Layered Space-Time (D-BLAST) Multiple Input Multiple Output (MIMO) architecture. We evaluate the performance of the system containing a single interference affecting the system with various probabilities and power. An LDPC code and BPSK modulation is used as a test case to obtain message bit error rate and is compared to non-frequency hopping D-BLAST MIMO architecture.","","978-1-5090-0073-9","10.1109/MILCOM.2015.7357553","","https://ieeexplore.ieee.org/stamp/stamp.jsp?arnumber=7357553","Frequency hopping;multiple antennas;multiple input;multiple output;wireless communications","Interference;MIMO;Signal to noise ratio;Transmitting antennas;Bit error rate;Receiving antennas","","1","","3","IEEE","17 Dec 2015","26-28 Oct. 2015","26-28 Oct. 2015","IEEE","IEEE Conferences"
"A 934MHz 9Gb/s 3.2pJ/b/iteration charge-recovery LDPC decoder with in-package inductors","T. -C. Ou; Z. Zhang; M. C. Papaefthymiou","University of Michigan, Ann Arbor, MI; University of Michigan, Ann Arbor, MI; University of Michigan, Ann Arbor, MI",2015 IEEE Asian Solid-State Circuits Conference (A-SSCC),"21 Jan 2016","2015","","","1","4","A 576-bit LDPC decoder is designed using a charge-recovery logic family and in-package inductors. The decoder testchip is fabricated in a 65nm CMOS flip-chip process. Unlike all previously published high-performance charge-recovery chips, which use on-chip inductors to recover charge from parasitic capacitance, this charge-recovery design uses in-package inductors, avoiding the area overheads of on-chip inductors and achieving higher quality factors. Specifically, charge recovery is performed using 16 high-quality inductors that have been embedded in a custom-designed 6-layer FC-BGA package, significantly improving the area efficiency and energy consumption of the design compared to alternative implementations with on-chip inductors. When operating at 934MHz, the decoder consumes 3.2pJ/b/iteration to deliver a throughput of 9Gb/s at 10 decoding iterations.","","978-1-4673-7191-9","10.1109/ASSCC.2015.7387474","","https://ieeexplore.ieee.org/stamp/stamp.jsp?arnumber=7387474","","Inductors;Decoding;Logic gates;Parity check codes;Substrates;Clocks;System-on-chip","","","","9","IEEE","21 Jan 2016","9-11 Nov. 2015","9-11 Nov. 2015","IEEE","IEEE Conferences"
"Implementation of trellis shaping on LDPC coded modulation DSL systems","J. Liu; R. Liu; B. Zhou","Huawei Technoligies, Bantian Industrial Base, Shenzhen, China; Huawei Technoligies, Bantian Industrial Base, Shenzhen, China; Huawei Technoligies, Bantian Industrial Base, Shenzhen, China",2015 IEEE/CIC International Conference on Communications in China (ICCC),"7 Apr 2016","2015","","","1","4","Shaping gain for trellis shaping is presented in LDPC-coded QAM DSL system. A labelling scheme is designed for current constellations to derive regional shaping effects. The performance of BER results are investigated for various QAM orders from 256QAM to 32768QAM. It is found that for even bits QAM the shaping gain is more evident than odd bits QAM, especially when the QAM order is high; and larger order QAMs are in general have better shaping gains than smaller order QAMs. Based on the BER results with regard to normalized SNR, it is concluded that overall shaping gains of 0.51dB (even bits QAM) and 0.45dB (odd bits QAM) can be derived at BER 10-7 from the presented scheme.","","978-1-5090-0243-6","10.1109/ICCChina.2015.7448656","","https://ieeexplore.ieee.org/stamp/stamp.jsp?arnumber=7448656","","Gain;Quadrature amplitude modulation;Parity check codes;Bit error rate;Channel coding","","","","12","IEEE","7 Apr 2016","2-4 Nov. 2015","2-4 Nov. 2015","IEEE","IEEE Conferences"
"Enhancing secrecy of the Gaussian wiretap channel using rate compatible LDPC codes with error amplification","M. H. Taieb; J. -Y. Chouinard","Departement of Electrical and Computer Engineering, Laval University Quebec, Quebec, Canada; Departement of Electrical and Computer Engineering, Laval University Quebec, Quebec, Canada",2015 IEEE 14th Canadian Workshop on Information Theory (CWIT),"14 Sep 2015","2015","","","41","45","This paper proposes a physical layer coding scheme to secure communications over the Gaussian wiretap channel. This scheme is based on non-systematic Rate-Compatible Low-Density-Parity-Check (RC-LDPC) codes. The rate compatibility involves the presence of a feedback channel that allows transmission at the minimum rate required for legitimate successful decoding. Whenever the decoding is unsuccessful, a feedback request is sent back by the intended receiver, favoring the legitimate recipient over an unauthorized receiver (eavesdropper). The proposed coding scheme uses a finer granularity rate compatible code to increase the eavesdropper decoding failure rate. However, finer granularity also implies longer decoding delays. For this reason, a rate estimator based on the wiretap channel capacity is used. For this purpose, a set of packets is sent at once and then successive small packets are added subsequently as needed until successful decoding by the legitimate receiver is achieved. Since the secrecy level can be assessed through the bit error rate (BER) at the unintended receiver, an error amplifier is proposed to convert the loss of only few packets in the wiretap channel into much higher BERs for the eavesdroppers. Simulation results show the secrecy improvements obtained in terms of error amplification with the proposed coding scheme. Negative security gaps can also be achieved at the physical layer.","","978-1-4799-6560-1","10.1109/CWIT.2015.7255148","","https://ieeexplore.ieee.org/stamp/stamp.jsp?arnumber=7255148","","Decoding;Parity check codes;Security;Encoding;Receivers;Bit error rate;Error probability","","","1","10","IEEE","14 Sep 2015","6-9 July 2015","6-9 July 2015","IEEE","IEEE Conferences"
"Low-overhead low-power-consumption LDPC-based FEC solution for next-generation high-speed optical systems","Mo Li; Zhiyu Xiao; Fan Yu; N. Stojanovic; I. B. Djorjdevic; Xiaozhong Shi; Liangchuan Li","Network Research Department, Huawei Technologies Co. Ltd., Shenzhen, China; Network Research Department, Huawei Technologies Co. Ltd., Shenzhen, China; Network Research Department, Huawei Technologies Co. Ltd., Shenzhen, China; Huawei Technologies Duesseldorf GmbH, European Research Center, Munich, Germany; Department of electrical and Computer Engineering, University of Arizona, Tucson, AZ; Network Research Department, Huawei Technologies Co. Ltd., Shenzhen, China; Network Research Department, Huawei Technologies Co. Ltd., Shenzhen, China",2015 Optical Fiber Communications Conference and Exhibition (OFC),"15 Jun 2015","2015","","","1","3","A low-overhead low-power-consumption LDPC-based FEC solution for next-generation high-speed optical systems is proposed. The novel concept provides 10.2-dB NCG with 12% total overhead and less than 2-W power consumption for 100-Gbps throughput.","","978-1-5575-2937-4","","","https://ieeexplore.ieee.org/stamp/stamp.jsp?arnumber=7121703","","Decision support systems;Handheld computers","","","","6","","15 Jun 2015","22-26 March 2015","22-26 March 2015","IEEE","IEEE Conferences"
"Dynamic window decoding for LDPC convolutional codes in low-latency optical communications","Tian Xia; T. Koike-Akino; D. S. Millar; K. Kojima; K. Parsons; Y. Miyata; K. Sugihara; W. Matsumoto","School of Electrical Engineering and Computer Science, Louisiana State University, Baton Rouge, LA, USA; Mitsubishi Electric Research Labs. (MERL), Cambridge, MA, USA; Mitsubishi Electric Research Labs. (MERL), Cambridge, MA, USA; Mitsubishi Electric Research Labs. (MERL), Cambridge, MA, USA; Mitsubishi Electric Research Labs. (MERL), Cambridge, MA, USA; Information Technology R&D Center, Mitsubishi Electric Corporation, Japan; Information Technology R&D Center, Mitsubishi Electric Corporation, Japan; Information Technology R&D Center, Mitsubishi Electric Corporation, Japan",2015 Optical Fiber Communications Conference and Exhibition (OFC),"15 Jun 2015","2015","","","1","3","We propose a dynamic window decoding scheme for LDPC convolutional codes to reduce the latency compared to the belief propagation decoding. The BER performance of our proposed memory-efficient decoding scheme is verified by simulations.","","978-1-5575-2937-4","","","https://ieeexplore.ieee.org/stamp/stamp.jsp?arnumber=7121705","","Decoding;Parity check codes;Phase change materials;Convolutional codes;Bit error rate;Optical fiber communication;Memory management","","","","7","","15 Jun 2015","22-26 March 2015","22-26 March 2015","IEEE","IEEE Conferences"
"Linear locally repairable codes with availability","P. Huang; E. Yaakobi; H. Uchikawa; P. H. Siegel","Electrical and Computer Engineering Dept., University of California, San Diego La Jolla, CA, U.S.A; Computer Science Dept., Technion-Israel Institute of Technology, Haifa, Israel; Computer Science Dept., Technion-Israel Institute of Technology, Haifa, Israel; Electrical and Computer Engineering Dept., University of California, San Diego La Jolla, CA, U.S.A",2015 IEEE International Symposium on Information Theory (ISIT),"1 Oct 2015","2015","","","1871","1875","In this work, we present a new upper bound on the minimum distance d of linear locally repairable codes (LRCs) with information locality and availability. The bound takes into account the code length n, dimension k, locality r, availability t, and field size q. We use tensor product codes to construct several families of LRCs with information locality, and then we extend the construction to design LRCs with information locality and availability. Some of these codes are shown to be optimal with respect to their minimum distance, achieving the new bound. Finally, we study the all-symbol locality and availability properties of several classes of one-step majority-logic decodable codes, including cyclic simplex codes, cyclic difference-set codes, and 4-cycle free regular low-density parity-check (LDPC) codes. We also investigate their optimality using the new bound.","2157-8117","978-1-4673-7704-1","10.1109/ISIT.2015.7282780","","https://ieeexplore.ieee.org/stamp/stamp.jsp?arnumber=7282780","","Systematics;Upper bound;Maintenance engineering;Tensile stress;Linear codes;Product codes;Binary codes","","46","","20","IEEE","1 Oct 2015","14-19 June 2015","14-19 June 2015","IEEE","IEEE Conferences"
