"Performance evaluation of next generation broadcast wireless systems in the UHF TV band","Y. Xu; F. Wang; Y. Kou; Rongfang Song","Naniing University of Posts and Telecommunications, Nanjing, China; Shanghai Advanced Research Institute, Chinese Academy of Sciences, Shanghai, China; Shanghai Advanced Research Institute, Chinese Academy of Sciences, Shanghai, China; Naniing University of Posts and Telecommunications, Nanjing, China",2015 10th International Conference on Communications and Networking in China (ChinaCom),"23 Jun 2016","2015","","","681","686","A simulation platform for Chinese next generation broadcast wireless (NGB-W) terrestrial broadcast systems is introduced. The performance of NGB-W terrestrial broadcast systems in the ultra high frequency TV band is evaluated by simulations under various conditions. It is shown that the performance of NGB-W terrestrial broadcast systems is much better than that of the second generation terrestrial broadcast systems of Digital Video Broadcasting (DVB-T2).","","978-1-4799-8795-5","10.1109/CHINACOM.2015.7498024","","https://ieeexplore.ieee.org/stamp/stamp.jsp?arnumber=7498024","next-generation broadcast wireless terrestrial broad system;performance evaluation;ultra high frequency","Mobile communication;TV;Antennas;Binary phase shift keying;Performance evaluation","","1","","6","IEEE","23 Jun 2016","15-17 Aug. 2015","15-17 Aug. 2015","IEEE","IEEE Conferences"
"ADMM decoding of error correction codes: From geometries to algorithms","X. Liu; S. C. Draper","Dept. of Electrical & Computer Eng, University of Wisconsin-Madison, Madison, WI, USA; Dept. of Electrical & Computer Eng, University of Wisconsin-Madison, Madison, WI, USA",2015 IEEE Information Theory Workshop (ITW),"25 Jun 2015","2015","","","1","5","Many code constraints can be represented using factor graphs. By relaxing these factorable coding constraints to linear constraints, it is straightforward to form a decoding optimization problem. Furthermore, by pairing these factor graphs with the alternating directions method of multipliers (ADMM) technique of large-scale optimization, one can develop distributed algorithms to solve the decoding optimization problems. However, the non-trivial part has always been developing an efficient algorithm for the subroutines of ADMM, which directly relates to the geometries of the relaxed coding constraints. In this paper, we focus on summarizing existing results and distilling insights to these problems. First, we review the ADMM formulation and geometries involved in the subroutines. Next, we present a linear time algorithm for projecting onto an ℓ1 ball with box constraints.","","978-1-4799-5526-8","10.1109/ITW.2015.7133156","","https://ieeexplore.ieee.org/stamp/stamp.jsp?arnumber=7133156","","Iterative decoding;Optimization;Geometry;Linear programming;Maximum likelihood decoding","","1","","33","IEEE","25 Jun 2015","26 April-1 May 2015","26 April-1 May 2015","IEEE","IEEE Conferences"
"Triple Failure Tolerant Storage Systems Using Only Exclusive-Or Parity Calculations","T. Schwarz; D. D. E. Long; J. -F. Pâris","Universidad CentroAmericana La Libertad, El Salvador; University of California, Santa Cruz, CA; University of Houston, Houston, TX",2015 IEEE 21st Pacific Rim International Symposium on Dependable Computing (PRDC),"7 Jan 2016","2015","","","245","254","We present a disk array organization that can survive three simultaneous disk failures while only using exclusive-or operations to calculate the parities that generate this failure tolerance. The reliability of storage systems using magnetic disks depends on how prone individual disks are to failure. Unfortunately, disk failure rates are impossible to predict and it is well known that individual batches might be subject to much higher failure rates at some point during their lifetime. It is also known that many disk drive families, but not all, suffer a substantially higher failure rate at the beginning and some at the end of their economic lifespan. Our proposed organization can be built on top of a dense two-failure tolerant layout using only exclusive-or operations and with a ratio of parity to data disks of 2/k. If the disk failure rates are higher than expected, the new organization can be super-imposed on the existing two-failure tolerant organization by introducing (k+1)/2 new parity disks and (k+1)/2 new reliability stripes to yield a three-failure tolerant layout without moving any data or calculating any other parity but the new one. We derive the organization using a graph visualization and a construction by Lawless of factoring a complete graph into paths.","","978-1-4673-9376-8","10.1109/PRDC.2015.17","","https://ieeexplore.ieee.org/stamp/stamp.jsp?arnumber=7371868","","Arrays;Layout;Organizations;Data visualization;Zinc;Reliability engineering","","1","","27","IEEE","7 Jan 2016","18-20 Nov. 2015","18-20 Nov. 2015","IEEE","IEEE Conferences"
"Higher LSB optimize data hiding mechanism on encrypted image","P. V. Deshmukh; A. K. Shahade; G. Y. Patil","Department of Computer Sci and Engg, Shri Sant Gajanan Maharaj COE, Shegaon, Maharashtra, India; Department of Information Technology, Shri Sant Gajanan Maharaj COE, Shegaon, Maharashtra, India; Department of Information Technology, Shri Sant Gajanan Maharaj COE, Shegaon, Maharashtra, India",2015 International Conference on Pervasive Computing (ICPC),"16 Apr 2015","2015","","","1","4","Now a day's to keep up secrecy and confidentiality of an information could be a vivacious field with 2 totally different approaches being followed, the primary being encrypting the pictures through cryptography algorithms victimization keys, the opposite approach involves concealing knowledge victimization data concealing algorithmic program to keep up the pictures secrecy. A content owner use cryptography key to perform the cryptography of original pictures, and employing a information hiding key a data hider will plant further data into the encrypted image although he doesn't recognize the first content, because the encrypted image contains some further information, with the assistance of cryptography key a receiver first decipher it then extract the embedded information and recover the first image in line with the data-hiding key.","","978-1-4799-6272-3","10.1109/PERVASIVE.2015.7087014","","https://ieeexplore.ieee.org/stamp/stamp.jsp?arnumber=7087014","Cowl image;Knowledge concealing;Knowledge extraction;Image secret writing;Image decoding;Knowledge recovery;DWT","Image coding;Feature extraction;Receivers;Data mining;Encryption","","1","","10","IEEE","16 Apr 2015","8-10 Jan. 2015","8-10 Jan. 2015","IEEE","IEEE Conferences"
"Code selection approach for partitioned cyclic code shift keying to improve multinet capability","H. Noh; J. Yu; K. Lee; J. Lim","Communication Researech Center, Seongnam, South Korea; Communication Researech Center, Seongnam, South Korea; Communication Researech Center, Seongnam, South Korea; Department of Computer Engineering, Ajou University, Suwon, South Korea",MILCOM 2015 - 2015 IEEE Military Communications Conference,"17 Dec 2015","2015","","","836","841","In this paper, we propose a new code selection approach for partitioned cyclic code shift keying (PCCSK) to improve the multinet capability of Joint Tactical Information Distribution Systems (JTIDS). The multinet capability of JTIDS enables concurrent operations in battle fields by allowing simultaneous data transmission and reception. PCCSK is a spread spectrum technique that supports various data rates and improves the data rate of JTIDS. The existing approach to PCCSK employs Reed Solomon (RS) code selection, and allows the dissemination of multiple access interference from the contaminated pulse to other pulses, and degrades the multinet capability. To prevent this error propagation, the proposed code selection approach restricts the RS symbol to be transmitted within one pulse. Simulation results show that the waveforms obtained using the proposed scheme outperform the previous waveforms including the JTIDS waveform with respect to both the multinet capability and the data rate.","","978-1-5090-0073-9","10.1109/MILCOM.2015.7357549","","https://ieeexplore.ieee.org/stamp/stamp.jsp?arnumber=7357549","Multinet;Partitioned Cyclic Code Shift Keying (PCCSK);Reed Solomon (RS);Joint Tactical Information Data Distribution (JTIDS)","Jitter;Robustness;Bandwidth;Fading","","1","","13","IEEE","17 Dec 2015","26-28 Oct. 2015","26-28 Oct. 2015","IEEE","IEEE Conferences"
"Mutual Information and Coded BER Analysis of PAPR Reduced OFDM System with Active Constellation Extension","R. Yoshizawa; H. Ochiai","Department of Electrical and Computer Engineering, Yokohama National University, Kanagawa, Japan; Department of Electrical and Computer Engineering, Yokohama National University, Kanagawa, Japan",2015 IEEE Global Communications Conference (GLOBECOM),"25 Feb 2016","2015","","","1","6","Active constellation extension (ACE) has been proposed for a peak-to-average power (PAPR) reduction of orthogonal frequency- division multiplexing (OFDM) signals, which projects the clipping noise generated by iterative clipping and filtering (CAF) onto the outside region of the constellation such that its minimum Euclidean distance (MED) is not reduced. Due to this arrangement, some amount of average power increase is introduced, but ACE can achieve better trade-off between uncoded bit-error rate (BER) and power amplifier (PA) efficiency compared to simple CAF. However, the coded BER of ACE has not been analyzed so far, where the degradation of signal-to-noise power ratio (SNR) due to the average power increase may have dominant effect on the performance. Moreover, in order to perform effective error correction, the statistical property of the clipping noise imposed by ACE should be developed. This paper empirically models the clipping noise distribution after ACE such that soft decoding can be employed at its receiver, and investigates its performance in terms of mutual information and coded BER employing near optimal channel coding. It is revealed that the simple CAF may outperform the ACE in terms of both PA efficiency and BER performance when both are protected by practical channel coding.","","978-1-4799-5952-5","10.1109/GLOCOM.2015.7417808","","https://ieeexplore.ieee.org/stamp/stamp.jsp?arnumber=7417808","","Peak to average power ratio;Bit error rate;Mathematical model;Constellation diagram;Phase shift keying;Probability density function","","1","","26","IEEE","25 Feb 2016","6-10 Dec. 2015","6-10 Dec. 2015","IEEE","IEEE Conferences"
"Comparative analysis of low power novel encoders for Flash ADC in 45nm technology","A. Kar; M. Das; B. Nath; D. Sarkar; A. Majumder","Department of ETCE, Tripura Institute of Technology, Agartala, India; Department of ETCE, Tripura Institute of Technology, Agartala, India; Department of ETCE, Tripura Institute of Technology, Agartala, India; Department of ETCE, Tripura Institute of Technology, Agartala, India; Department of ECE, NIT, Yupia, Arunachal Pradesh, India","2015 International Conference on Smart Technologies and Management for Computing, Communication, Controls, Energy and Materials (ICSTM)","27 Aug 2015","2015","","","360","365","The electronics world is faced with various challenges when attempting to integrate analog signals with discrete or digital systems. The ADC is not a new concept b y any means, but is still a topic of interest when it comes to technology due to its inevitable necessity in many systems being used today. Power consumption in ICs was always a challenging issue. Most of the technology emphasizes on speed, accuracy, less power consumption. In almost all digital functioning, encoders are mandatory. Decreasing power consumption in an encoder is an area of strong desire. In this paper, we have designed two novel ultra low power encoders for Flash ADC application and also show its comparison with previous encoder available in literature. The work has been done on Tanner tool v15 in 45 nm technology with various DC voltage supplies.","","978-1-4799-9855-5","10.1109/ICSTM.2015.7225442","","https://ieeexplore.ieee.org/stamp/stamp.jsp?arnumber=7225442","Encoder;Fat tree encoder;Gray encoder;Binary encoder","Power demand;Logic gates;Multiplexing;Low-power electronics;Analog-digital conversion;Integrated circuits","","1","","16","IEEE","27 Aug 2015","6-8 May 2015","6-8 May 2015","IEEE","IEEE Conferences"
"Transition from analog to digital television a much awaited change in India","S. Gupta; M. Tiwari; A. Deep; A. Gupta; H. Garg; A. K. Yadav","School of Electronics and Communication Engineering, Shri Mata Vaishno Devi University Katra, India; Department of Computer Science &, IT University of Jammu, Jammu, India; School of Electronics and Communication Engineering, Shri Mata Vaishno Devi University Katra, India; School of Electronics and Communication Engineering, Shri Mata Vaishno Devi University Katra, India; School of Electronics and Communication Engineering, Shri Mata Vaishno Devi University Katra, India; School of Electronics and Communication Engineering, Shri Mata Vaishno Devi University Katra, India","2015 IEEE International Conference on Electrical, Computer and Communication Technologies (ICECCT)","27 Aug 2015","2015","","","1","5","India despite being one of the technologically developing nations is still far behind in the race of adopting modern technologies. This is quite evident from the fact that Indian televisions are still tuned to analog channels and digital TV has not pervaded the society be it rural or semi-urban. Though metro cities have adopted digital TV as the only mechanism of relaying channels, transition is still due in rest of the cities. In this paper, a thrust have been given on digital TV technologies along with the reasons behind the requirement for rapid changeover from analog to digital TV for better development and better benefit per unit.","","978-1-4799-6085-9","10.1109/ICECCT.2015.7226180","","https://ieeexplore.ieee.org/stamp/stamp.jsp?arnumber=7226180","TV;Digital TV;QAM;QPSK;OFDM","Digital video broadcasting;TV;Quadrature amplitude modulation;Frequency modulation;Standards;Phase shift keying;Satellites","","1","","19","IEEE","27 Aug 2015","5-7 March 2015","5-7 March 2015","IEEE","IEEE Conferences"
"A Diversity-Based Approach for Communication Integrity in Critical Embedded Systems","A. Zammali; A. De Bonneval; Y. Crouzet","CNRS, LAAS, Toulouse, France; Laboratoire d'analyse et d'architecture des systemes, Toulouse, FR; CNRS, LAAS, Toulouse, France",2015 IEEE 16th International Symposium on High Assurance Systems Engineering,"2 Feb 2015","2015","","","215","222","We present, in this paper, a fault-tolerant approach to cope with accidental communication data corruption in critical embedded systems. One of the classical integrity approaches is the redundancy-based approach that consists particularly in replicating the message and sending all copies via the same communication channel consecutively or sending them via replicated communication channels. Yet, such approach is vulnerable to some cases of Common-Mode Failure. So, we propose to diversify the copies to be sent via two independent proposals: i) diversifying either the error detection function (which generate the check bits) or ii) the data payload. This paper focus on the first proposal by presenting experiments and results to validate its effectiveness. Besides, it describes basic theoretical concepts of the second proposal. Our case study is the Flight Control System (FCS). Yet, our approach could be deployed in other systems for which we describe the key properties.","1530-2059","978-1-4799-8111-3","10.1109/HASE.2015.39","","https://ieeexplore.ieee.org/stamp/stamp.jsp?arnumber=7027434","fault tolerance;diversity;communication integrity;critical embedded systems;flight control system","Redundancy;Embedded systems;Aerospace control;Proposals;Payloads;Safety;Computational efficiency","","1","","18","IEEE","2 Feb 2015","8-10 Jan. 2015","8-10 Jan. 2015","IEEE","IEEE Conferences"
"Multi-gigabit coherent communications using low-rate FEC to approach the Shannon capacity limit","D. J. Geisler; V. Chandar; T. M. Yarnall; M. L. Stevens; S. A. Hamilton","Massachusetts Institute of Technology, Lincoln Laboratory, Lexington, MA, USA; D. E. Shaw and Co., New York, NY, USA; Massachusetts Institute of Technology, Lincoln Laboratory, Lexington, MA, USA; Massachusetts Institute of Technology, Lincoln Laboratory, Lexington, MA, USA; Massachusetts Institute of Technology, Lincoln Laboratory, Lexington, MA, USA",2015 Conference on Lasers and Electro-Optics (CLEO),"13 Aug 2015","2015","","","1","2","Combining a rate-¼ forward error-correcting code, a coherent receiver, and an optical phase-locked loop yields near error-free performance with 2-dB photon-per-bit sensitivity, which is <;3-dB from the Shannon limit for a rate-¼, pre-amplified, coherent receiver.","2160-8989","978-1-55752-968-8","10.1364/CLEO_SI.2015.SW1M.2","","https://ieeexplore.ieee.org/stamp/stamp.jsp?arnumber=7184330","","Forward error correction;Parity check codes;Sensitivity;Signal to noise ratio;Adaptive optics;Optical receivers","","1","","10","","13 Aug 2015","10-15 May 2015","10-15 May 2015","IEEE","IEEE Conferences"
"Layered lossless video coding based on Slepian-Wolf theorem","T. Nakachi; T. Fujii","NTT Network Innovation Laboratories, Yokosukai-shi, Kanagawa, JAPAN; NTT Network Innovation Laboratories, Yokosukai-shi, Kanagawa, JAPAN",2015 International Symposium on Intelligent Signal Processing and Communication Systems (ISPACS),"14 Mar 2016","2015","","","652","657","In this paper, we propose a layered lossless video coding scheme based on the Slepian-Wolf (SW) theorem. Motion JPEG2000 is performed as the base layer coder for real-time streaming and a SW coder is used as the enhancement layer coder. The computation burden is shifted to the network side so this scheme achieves low-complexity encoding. The proposed SW coder significantly improves the prediction accuracy of Side Information (SI). In addition to accurate prediction, SW exploits Discrete Wavelet Transform (DWT) to improve lossless coding performance. Simulation results show that the proposed scheme gives higher coding performance than the existing JPEG2000 lossless mode.","","978-1-4673-6499-7","10.1109/ISPACS.2015.7432852","","https://ieeexplore.ieee.org/stamp/stamp.jsp?arnumber=7432852","","Encoding;Transform coding;Wavelet domain;Video coding;Decoding;Correlation;Discrete wavelet transforms","","1","","16","IEEE","14 Mar 2016","9-12 Nov. 2015","9-12 Nov. 2015","IEEE","IEEE Conferences"
"Write process modeling in MLC flash memories using renewal theory","M. Asadi; E. F. Haratsch; A. Kavcic; N. P. Santhanam","Department of Electrical Engineering, University of Hawaii at Manoa, Honolulu, HI; Seagate Technology, Fremont, CA; Department of Electrical Engineering, University of Hawaii at Manoa, Honolulu, HI; Department of Electrical Engineering, University of Hawaii at Manoa, Honolulu, HI",2015 IEEE International Symposium on Information Theory (ISIT),"1 Oct 2015","2015","","","651","655","In the write process of multilevel per cell (MLC) flash memories, an iterative approach is used to mitigate the monotonicity problem. The monotonicity in programming is considered to be the major restriction in MLC flash. In this paper, we are mostly concerned with deriving a mathematical model for iterative programming using the framework of “renewal processes”. Then, we approximate the maximum number of steps in iterative programming, and obtain the voltage distribution in flash due to iterative programming. Moreover, the obtained results help us to accurately analyze the effect of inter-cell interference (ICI) in this type of memory. Finally, we obtain a more precise voltage distribution for the symbol states in flash memory. Simulation results show the effect of varying the step size in the iterative programming and the effect of ICI on the information rate.","2157-8117","978-1-4673-7704-1","10.1109/ISIT.2015.7282535","","https://ieeexplore.ieee.org/stamp/stamp.jsp?arnumber=7282535","Data storage;information rate;renewal process","Ash;Programming;Threshold voltage;Information rates;Mathematical model;Detectors;Interference","","1","","9","IEEE","1 Oct 2015","14-19 June 2015","14-19 June 2015","IEEE","IEEE Conferences"
"Joint Source-Channel Coding for First-Order Hidden Markov Source","H. Yang; L. Qing; X. He; H. Yang","College of Electroincs and Information Engineering, Sichuan University, Chengdu, China; College of Electroincs and Information Engineering, Sichuan University, Chengdu, China; Chengdu College, University of Electronic Science and Technology, Chengdu, China; College of Electroincs and Information Engineering, Sichuan University, Chengdu, Sichuan, CN",2015 International Conference on Computational Intelligence and Communication Networks (CICN),"18 Aug 2016","2015","","","635","638","In this paper, a novel Joint Source-Channel Coding scheme based on Irregular Repeat-Accumulate codec is proposed for the transmission of Hidden Markov Source in AWGN scenarios. The encoder structure of the scheme consists of two units, one for source assign and another for encode. The simulation results demonstrate that the proposed scheme have better compression performance than the traditional code model and can exploit the different transmission performance based on four different types sources.","2472-7555","978-1-5090-0076-0","10.1109/CICN.2015.130","","https://ieeexplore.ieee.org/stamp/stamp.jsp?arnumber=7546172","Joint Source-Channel Coding;Hidden Markov Source;Irregular Repeat-Accumulate codec","Hidden Markov models;Decoding;Markov processes;Encoding;Correlation;Iterative decoding","","1","","12","IEEE","18 Aug 2016","12-14 Dec. 2015","12-14 Dec. 2015","IEEE","IEEE Conferences"
"Adaptive Modulation and Coding based error resilience for transmission of compressed video","R. Perera; A. Fernando; H. K. Arachchi; M. A. Imran","Department of Electronic Engineering, University of Surrey, United Kingdom; Department of Electronic Engineering, University of Surrey, United Kingdom; Department of Electronic Engineering, University of Surrey, United Kingdom; Department of Electronic Engineering, University of Surrey, United Kingdom",2015 International Wireless Communications and Mobile Computing Conference (IWCMC),"5 Oct 2015","2015","","","1127","1132","High spectral efficiency is at the core of any effort made to achieve the data rates and capacity requirements demanded by next generation mobile technologies. Adaptive Modulation and Coding (AMC) is considered a powerful tool for the efficient usage of spectrum and for the provision of channel adaptive error resilience. In this paper, a novel AMC based transmission scheme is introduced for Long Term Evolution-Advanced (LTE-A) networks to impose adaptive error resilience on High Efficiency Video Coding (HEVC) based video data at the physical layer. A model is proposed to rank REs at the LTE-A transmitter based on channel information. Data are allocated onto ranked REs to maximise the efficiency of the users' allocated bandwidth while maintaining video quality. This is achieved by imposing a stronger Modulation and Coding Scheme (MCS) for data that have a high probability of being distorted, thus spanning the entire allocated bandwidth. Simulation results show that the proposed Unequal Error Protection (UEP) strategy helps to minimise the LTE-A transmitter power by up to 8dB with guaranteed video quality. In effect, this is a reduction of approximately 84% of the transmit power.","2376-6506","978-1-4799-5344-8","10.1109/IWCMC.2015.7289241","","https://ieeexplore.ieee.org/stamp/stamp.jsp?arnumber=7289241","AMC;channel estimation;error resilience;HEVC;LTE-A;OFDM;QoS;unequal error protection","Signal to noise ratio;Streaming media;Video sequences;Resource management;Modulation;Channel estimation;Resilience","","1","","12","IEEE","5 Oct 2015","24-28 Aug. 2015","24-28 Aug. 2015","IEEE","IEEE Conferences"
"Partitioned scheduling for sphere decoding with runtime constraints for practical MIMO communication systems","T. -H. Kim; J. -H. Kim","School of Electronics and Information Engineering, Korea Aerospace University, Gyung-gi-do, South Korea; School of Electronics and Information Engineering, Korea Aerospace University, Gyung-gi-do, South Korea","2015 IEEE 26th Annual International Symposium on Personal, Indoor, and Mobile Radio Communications (PIMRC)","3 Dec 2015","2015","","","721","725","This paper presents a simple but effective scheduling scheme for sphere decoding (SD) with runtime constraints in multiple-input multiple-output communication systems. The proposed scheme imposes runtime constraints on SD to distribute the errors due to the early termination of SD. Because the distributed errors may be corrected effectively by forward error correction, the error-rate performance can be improved; experimental results show that the performance improvement is approximately 2 dB in terms of the signal-to-noise ratio to achieve a bit-error rate of 10-4 in 4×4 16-QAM systems.","","978-1-4673-6782-0","10.1109/PIMRC.2015.7343392","","https://ieeexplore.ieee.org/stamp/stamp.jsp?arnumber=7343392","","MIMO;Wireless LAN;Transmitters;Receivers;Erbium;Decoding;Transceivers","","1","","17","IEEE","3 Dec 2015","30 Aug.-2 Sept. 2015","30 Aug.-2 Sept. 2015","IEEE","IEEE Conferences"
