"Analysis of ADMM-LP algorithm for LDPC decoding, a first step to hardware implementation","I. Debbabi; B. Le Gal; N. Khouja; F. Tlili; C. Jego","GRESCOM Laboratory, Carthage University, Tunisia; Bordeaux INP, University of Bordeaux, Talence, France; GRESCOM Laboratory, Carthage University, Tunisia; GRESCOM Laboratory, Carthage University, Tunisia; Bordeaux INP, University of Bordeaux, Talence, France","2015 IEEE International Conference on Electronics, Circuits, and Systems (ICECS)","24 Mar 2016","2015","","","356","359","The recent interest in linear programming techniques for LDPC decoding showed that these methods are too complex for real applicability. Alternating direction method of multipliers is a classic technique in convex optimization theory. When applied to the linear programming decoding of LDPC codes, the ADMM algorithm acts as a message passing decoding method. In this work, we present a complexity analysis of the ADMM LDPC decoder compared with the sum product approach and we explain the parallelism levels that are explored in the ADMM algorithm. A software implementation by taking advantage of the architectural features of the multi-core processors parallelism is presented. The overall analysis provides a better understanding of the ADMM approach complexity which makes a start to possible hardware implementations.","","978-1-5090-0246-7","10.1109/ICECS.2015.7440322","","https://ieeexplore.ieee.org/stamp/stamp.jsp?arnumber=7440322","","Parity check codes;Complexity theory;Parallel processing;Maximum likelihood decoding;Algorithm design and analysis;Kernel","","5","","12","IEEE","24 Mar 2016","6-9 Dec. 2015","6-9 Dec. 2015","IEEE","IEEE Conferences"
"Quantized message passing for LDPC codes","M. Meidlinger; A. Balatsoukas-Stimming; A. Burg; G. Matz","Vienna University of Technology, Austria; EPFL, Switzerland; EPFL, Switzerland; Vienna University of Technology, Austria","2015 49th Asilomar Conference on Signals, Systems and Computers","29 Feb 2016","2015","","","1606","1610","We propose a quantized decoding algorithm for low- density parity-check codes where the variable node update rule of the standard min-sum algorithm is replaced with a look-up table (LUT) that is designed using an information-theoretic criterion. We show that even with message resolutions as low as 3 bits, the proposed algorithm can achieve better error rates than a floating-point min-sum decoder. Moreover, we study in detail the effect of different decoder design parameters, like the design SNR and the LUT tree structure on the performance of our decoder, and we propose some complexity reduction techniques, such as LUT re-use and message alphabet downsizing.","1058-6393","978-1-4673-8576-3","10.1109/ACSSC.2015.7421419","","https://ieeexplore.ieee.org/stamp/stamp.jsp?arnumber=7421419","","Table lookup;Decoding;Algorithm design and analysis;Parity check codes;Signal to noise ratio;Error analysis;Complexity theory","","25","2","8","IEEE","29 Feb 2016","8-11 Nov. 2015","8-11 Nov. 2015","IEEE","IEEE Conferences"
"LDPC codes for optical channels: Is the “FEC limit” a good predictor of post-FEC BER?","A. Alvarado; E. Agrell; D. Lavery; P. Bayvel","Optical Networks Group, University College London (UCL), London, UK; Department of Signals and Systems, Chalmers University of Technology, Gothenburg, Sweden; Optical Networks Group, University College London (UCL), London, UK; Optical Networks Group, University College London (UCL), London, UK",2015 Optical Fiber Communications Conference and Exhibition (OFC),"15 Jun 2015","2015","","","1","3","We answer the question in the title negatively. More precisely, the FEC limit is invalid for soft decision decoding and low to medium code rates. A better predictor is the generalized mutual information.","","978-1-5575-2937-4","10.1364/OFC.2015.Th3E.5","","https://ieeexplore.ieee.org/stamp/stamp.jsp?arnumber=7121706","","Bit error rate;Decoding;Forward error correction;Receivers;Parity check codes;Mutual information;Modulation","","14","","8","","15 Jun 2015","22-26 March 2015","22-26 March 2015","IEEE","IEEE Conferences"
"Latency-optimized stochastic LDPC decoder for high-throughput applications","D. Wu; Y. Chen; Q. Zhang; L. Zheng; X. Zeng; Y. -l. Ueng","State Key Laboratory of ASIC & system Fudan University Shanghai, China; State Key Laboratory of ASIC & system Fudan University Shanghai, China; State Key Laboratory of ASIC & system Fudan University Shanghai, China; State Key Laboratory of ASIC & system Fudan University Shanghai, China; State Key Laboratory of ASIC & system Fudan University Shanghai, China; Department of Electrical Engineering National Tsing Hua University, Taiwan",2015 IEEE International Symposium on Circuits and Systems (ISCAS),"30 Jul 2015","2015","","","3044","3047","Stochastic decoding can be applied to Low-Density Parity-Check codes in order to achieve high throughput with less area. However, most architectures suffer from large decoding latencies, due to the mechanism of stochastic computation. In this paper, three novel strategies, including the LUT-based initialization, the posterior-information-based hard decision and the Bit-Flipping-based post processing, are proposed in order to reduce decoding latency and hence improve throughput. For the standard IEEE 802.3an (2048, 1723) code, simulation indicates 75.7% reduction in average decoding cycles at 4.5 dB with satisfied bit error rate. Moreover, hardware implementation shows that the area of variable node units is reduced significantly in SMIC 65 nm technology.","2158-1525","978-1-4799-8391-9","10.1109/ISCAS.2015.7169329","","https://ieeexplore.ieee.org/stamp/stamp.jsp?arnumber=7169329","Bit-Flipping Algorithm;Low-Density Parity-Check Codes;High-throughput Decoder;Stochastic decoding","Decoding;Parity check codes;Radiation detectors;Bit error rate;High definition video;Throughput;Hardware","","3","","11","IEEE","30 Jul 2015","24-27 May 2015","24-27 May 2015","IEEE","IEEE Conferences"
"A comparison between RS+TCM and LDPC for G.fast channel coding","M. Takeda; F. Smith; A. Klautau","Signal Processing Laboratory, Federal University of Pará, Brazil; Signal Processing Laboratory, Federal University of Pará, Brazil; Signal Processing Laboratory, Federal University of Pará, Brazil",2015 IEEE 6th Latin American Symposium on Circuits & Systems (LASCAS),"10 Sep 2015","2015","","","1","5","We compare schemes from two different standards for copper twisted pairs in light of the upcoming G.fast standard for Digital Subscriber Lines. Various configurations are compared based on error performance. This contribution confirms quantitatively that Low-Density Parity-Check codes perform better than the traditional interleaved Reed Solomon with Trellis Coded Modulation from an error performance perspective.","","978-1-4799-8332-2","10.1109/LASCAS.2015.7250472","","https://ieeexplore.ieee.org/stamp/stamp.jsp?arnumber=7250472","Channel coding;Reed-Solomon;Low-Density Parity-Check","Parity check codes;Encoding;Signal to noise ratio;Decoding;Standards;Error analysis;Approximation algorithms","","","","10","IEEE","10 Sep 2015","24-27 Feb. 2015","24-27 Feb. 2015","IEEE","IEEE Conferences"
"LDPC coded modulation schemes with largely unequal error protection","G. Ricciutelli; M. Baldi; N. Maturo; F. Chiaraluce","DII, Università Politecnica delle Marche, Ancona, Italy; DII, Università Politecnica delle Marche, Ancona, Italy; DII, Università Politecnica delle Marche, Ancona, Italy; DII, Università Politecnica delle Marche, Ancona, Italy",2015 IEEE International Black Sea Conference on Communications and Networking (BlackSeaCom),"13 Aug 2015","2015","","","48","52","Coding and modulation schemes able to achieve unequal error protection are of interest for many applications in which parts of the payload must be differently protected against the noise. They are also useful for physical layer security of transmissions over the broadcast channel with confidential messages. Classical design approaches aim at optimizing the performance over all the protection classes, independently of the separation between them. We instead propose a solution to improve the performance over the most protected bits, at the expense of performance over the least protected ones. This allows to design coded modulation schemes with largely unequal error protection. We also consider the use of high order modulations, and propose a technique to study the performance over each protection class in the asymptotic regime of infinite code length.","","978-1-4799-8505-0","10.1109/BlackSeaCom.2015.7185084","","https://ieeexplore.ieee.org/stamp/stamp.jsp?arnumber=7185084","","Parity check codes;Error correction codes;Labeling;Polynomials;Binary phase shift keying;Conferences","","","2","14","IEEE","13 Aug 2015","18-21 May 2015","18-21 May 2015","IEEE","IEEE Conferences"
"High-Throughput FPGA-Based QC-LDPC Decoder Architecture","S. Mhaske; H. Kee; T. Ly; A. Aziz; P. Spasojevic","Wireless Information Network Laboratory, Rutgers University, New Brunswick, NJ, USA; National Instruments Corporation, Austin, TX, USA; National Instruments Corporation, Austin, TX, USA; National Instruments Corporation, Austin, TX, USA; Wireless Information Network Laboratory, Rutgers University, New Brunswick, NJ, USA",2015 IEEE 82nd Vehicular Technology Conference (VTC2015-Fall),"28 Jan 2016","2015","","","1","5","We propose without loss of generality strategies to achieve a high-throughput FPGA-based architecture for a binary Quasi-Cyclic Low-Density Parity-Check (QC-LDPC) code based on a circulant-1 identity matrix construction. We present a novel representation of the parity-check matrix (PCM) providing a multi-fold throughput gain. Splitting of the node processing algorithm enables us to achieve pipelining of blocks and hence layers. By partitioning the PCM into not only layers but superlayers we derive an upper bound on the two-layer pipelining depth for the compact representation. To validate the architecture, a decoder for the IEEE 802.11n (2012) QC-LDPC is implemented on the Xilinx Kintex-7 FPGA with the help of the FPGA IP compiler available in the NI LabVIEW Communication System Design Suite (CSDS). It offers an automated and systematic compilation flow where an optimized hardware implementation from the LDPC algorithm was generated, achieving an overall throughput of 608Mb/s (at 260MHz). As per our knowledge this is the fastest implementation of the IEEE 802.11n QC-LDPC decoder using an algorithmic compiler.","","978-1-4799-8091-8","10.1109/VTCFall.2015.7390967","","https://ieeexplore.ieee.org/stamp/stamp.jsp?arnumber=7390967","","Decoding;Throughput;Parity check codes;Phase change materials;Pipeline processing;Field programmable gate arrays;Hardware","","20","","23","IEEE","28 Jan 2016","6-9 Sept. 2015","6-9 Sept. 2015","IEEE","IEEE Conferences"
"A PEG-like LDPC code design avoiding short trapping sets","M. Diouf; D. Declercq; S. Ouya; B. Vasic","ETIS, Univ. Cergy-Pontoise, Cergy-Pontoise Cedex, France; ETIS, Univ. Cergy-Pontoise, Cergy-Pontoise Cedex, France; LIRT, Univ. Cheikh Anta DIOP, Dakar, Senegal; Department of Elec. and Comp. Eng, University of Arizona, Tucson, AZ, USA",2015 IEEE International Symposium on Information Theory (ISIT),"1 Oct 2015","2015","","","1079","1083","In this paper, we propose a predictive method to construct regular column-weight-three LDPC codes with girth g = 8 so that their Tanner graphs contain a minimum number of small trapping sets. Our construction is based on improvements of the Progressive Edge-Growth (PEG) algorithm. We first show how to detect the smallest trapping sets (5; 3) and (6; 4) in the computation tree spread from variable nodes during the edge assignment. A precise and rigorous characterization of trapping sets (5; 3) and (6; 4) are given, and we then derive a modification of the Randomized Progressive Edge-Growth (RandPEG) algorithm [1] to take into account a new cost function that allows to build regular column-weight dv = 3, girth 8 LDPC codes free of (5,3) and with a minimization of (6,4). We present the construction and the performance results in the context of quasi-cyclic LDPC (QC-LDPC) codes.","2157-8117","978-1-4673-7704-1","10.1109/ISIT.2015.7282621","","https://ieeexplore.ieee.org/stamp/stamp.jsp?arnumber=7282621","Trapping sets;Error floor;Progressive Edge-Growth (PEG);Low Density Parity Check (LDPC) codes;Tanner graphs","Charge carrier processes;Parity check codes;TV;Algorithm design and analysis;Decoding;Prediction algorithms;Image edge detection","","18","","13","IEEE","1 Oct 2015","14-19 June 2015","14-19 June 2015","IEEE","IEEE Conferences"
"Finite-length performance of multi-edge protograph-based spatially coupled LDPC codes","M. Stinner; P. M. Olmos","Institute for Communications Engineering, Technische Universität München, Germany; Departamento de Teoría de la Señal y Comunicaciones, Universidad Carlos III de Madrid, Spain",2015 IEEE International Symposium on Information Theory (ISIT),"1 Oct 2015","2015","","","889","893","The finite-length performance of multi-edge spatially coupled low-density parity-check (SC-LDPC) codes over the binary erasure channel (BEC) is analyzed. Existing scaling laws are extended to arbitrary protograph base matrices that include puncturing patterns and multiple edges between nodes. A regular protograph-based SC-LDPC construction based on the (4; 8)-regular LDPC block code works well in the waterfall region compared to more involved rate-1/2 structures proposed to improve the threshold to minimum distance trade-off. Scaling laws are also used for code design and to estimate the block length of a given SC-LDPC code ensemble to match the performance of some other code. Estimates on the performance degradation are developed if the chain length varies.","2157-8117","978-1-4673-7704-1","10.1109/ISIT.2015.7282583","","https://ieeexplore.ieee.org/stamp/stamp.jsp?arnumber=7282583","finite-length performance;spatially-coupled LDPC codes","Decoding;Couplings;Steady-state;Error analysis;Iterative decoding;Block codes","","1","","9","IEEE","1 Oct 2015","14-19 June 2015","14-19 June 2015","IEEE","IEEE Conferences"
"LDPC (512,480) genetic design as alternative to CRC in implementation of AODV routing protocol stack","R. Salom; J. Broulim","Faculty of Electrical Engineering, University of West Bohemia in Pilsen, Pilsen, Czech Republic; Faculty of Electrical Engineering, University of West Bohemia in Pilsen, Pilsen, Czech Republic",2015 23rd Telecommunications Forum Telfor (TELFOR),"11 Jan 2016","2015","","","643","645","This paper presents a design of LDPC (Low Density Parity Check) code. Algorithm deals with code optimization based on Tanner graph mutations. The LDPC code was designed to replace CRC (Cyclic Redundancy Check) code in the application of a tiny AODV routing protocol stack. Own AODV routing protocol stack was previously designed especially for wireless sensor networks with constrained resources and it is intended for usage in wireless mesh network formed by Intelligent firemen suits. Link layer of target platform uses 64B long packet with 4B for LDPC parity. The code was designed to provide the most optimal detection and correction capability with the lowest possible parity bites.","","978-1-5090-0055-5","10.1109/TELFOR.2015.7377549","","https://ieeexplore.ieee.org/stamp/stamp.jsp?arnumber=7377549","LDPC;AODV;CRC;Error correction;Error detection;Parity-check;Sensor wireless networks","Parity check codes;Routing protocols;Wireless networks;Optimization;Genetics;Mesh networks;Network topology","","","","8","IEEE","11 Jan 2016","24-26 Nov. 2015","24-26 Nov. 2015","IEEE","IEEE Conferences"
"Post and pre-layout analysis of Low Density Parity Check (LDPC) decoder using 120nm technology Cadence Encounter Tool","A. Jemima; G. Manoj","VLSI Design, Department of ECE; Department of ECE, Karunya University, Coimbatore, India",2015 2nd International Conference on Electronics and Communication Systems (ICECS),"18 Jun 2015","2015","","","342","349","Low Density Parity Check (LDPC) codes are the one most powerful error correction codes (ECCs) and approach the Shannon limit[1]. The main advantage of the parity check matrix is the decoder can correct all single-bit errors. A decoding algorithm called Min-Sum (MS) algorithm is used in LDPC decoder. In a MIN-SUM decoding algorithm, check node units (CNU) and variable node units (VNU) are iteratively exchange messages with one another following the rule described by the Tanner graph. Min-Sum decoding is widely used for decoding LDPC codes in many modern digital video broadcasting decoding due to its relative low complexity and robustness against quantization error. In this proposed method, the front-end design flow is done in Verilog and the hardware core is simulated in ModelSim and the performance analysis for various parameters are area (2.153mm2), power(59.035mW)and memory (260.864Megabytes). The Design Rule Check (DRC) is done for back-end design flow by using Cadence Encounter Tool and the comparison results are analysed between the pre-layout and post-layout design flow of LDPC Decoder.","","978-1-4799-7225-8","10.1109/ECS.2015.7124921","","https://ieeexplore.ieee.org/stamp/stamp.jsp?arnumber=7124921","Low Density Parity Check (LDPC);Variable Node Units(VNU);Check Node Units (CNU);Min-Sum(MS) algorithm;Design RuleCheck(DRC)","Decoding;Iterative decoding;Algorithm design and analysis;Simulation;Hardware design languages;Mathematical model","","","","12","IEEE","18 Jun 2015","26-27 Feb. 2015","26-27 Feb. 2015","IEEE","IEEE Conferences"
"A simplifed joint demapping and decoding for LDPC coded BICM systems","Ping Huang; Yueheng Li; Meiyan Ju","Department of Computer Information, Hohai University, Nanjing, China; Department of Computer Information, Hohai University, Nanjing, China; Department of Computer Information, Hohai University, Nanjing, China","11th International Conference on Wireless Communications, Networking and Mobile Computing (WiCOM 2015)","7 Apr 2016","2015","","","1","5","To make full use of the characteristics of LDPC decoding, Stephan ten Brink had proposed a joint iterative demapping and decoding algorithm for LDPC coded BICM systems. Based on Brink proposed algorithm, we propose a modified joint iterative scheme to further reduce the computation complex. Different from the algorithm presented by Brink, in the process of iterative demapping and decoding, the proposed method simplifies the update calculation of the LDPC parity check nodes by adopting the UMP-BP. More importantly, to compensate for the performance degradation brought by UMP-BP, LLRs optimization based on certain optimality criterion is employed for the proposed method. Numerical analysis shows that the complexity of the proposed method is less than traditional joint iterative algorithm. Simulation results also show that by LLRs optimization the proposed method achieves noticeable performance improvement compared with the BICM-ID and the joint iterative algorithm.","","978-1-78561-035-6","10.1049/cp.2015.0632","","https://ieeexplore.ieee.org/stamp/stamp.jsp?arnumber=7446764","BICM;LDPC;Joint Iterative Demapping and Decoding;LLRs Optimization","","","","","","","7 Apr 2016","21-23 Sept. 2015","21-23 Sept. 2015","IET","IET Conferences"
"Asymptotic performance analysis of protograph LDPC-coded STBC systems in fading channels","Y. Fang; G. Han; P. Chen; Y. L. Guan; G. Bi","School of Information Engineering, Guangdong University of Technology, Guangzhou, China; School of Information Engineering, Guangdong University of Technology, Guangzhou, China; College of Physics and Information Engineering, Fuzhou University, Fuzhou, China; School of Electrical and Electronic Engineering, Nanyang Technological University, Singapore; School of Electrical and Electronic Engineering, Nanyang Technological University, Singapore","2015 IEEE 26th Annual International Symposium on Personal, Indoor, and Mobile Radio Communications (PIMRC)","3 Dec 2015","2015","","","132","137","In this paper, we investigate the performance of the protograph low-density parity-check (LDPC) codes concatenated with space-time block code (STBC) over Rayleigh fading channels. We firstly extend the modified protograph extrinsic information transfer (PEXIT) algorithm in order to analyze the convergence performance of protograph codes. Based on the extended PEXIT algorithm and Gaussian approximation, we further derive the asymptotic bit-error-rate (BER) expression of protograph codes. Utilizing the PEXIT algorithm, theoretical and simulated BERs, we compare the performance of two classical protograph codes, i.e., accumulate-repeat-by-3-accumulate (AR3A) code and accumulate-repeat-by-4-jagged-accumulate (AR4JA) code, regular LDPC code, and optimized irregular LDPC codes, and illustrate that the AR3A code is superior to other three codes. Additionally, we discuss the impact of the number of receive antennas (i.e., NR) on the system performance and verify that the theoretical analyses hold as NR varies. As a result, the AR3A code stands out as a good candidate for wireless communication applications with multiple antennas.","","978-1-4673-6782-0","10.1109/PIMRC.2015.7343282","","https://ieeexplore.ieee.org/stamp/stamp.jsp?arnumber=7343282","","Parity check codes;Fading;Bit error rate;Receiving antennas;Land mobile radio;Wireless communication;MIMO","","4","","17","IEEE","3 Dec 2015","30 Aug.-2 Sept. 2015","30 Aug.-2 Sept. 2015","IEEE","IEEE Conferences"
"An energy efficient 18Gbps LDPC decoding processor for 802.11ad in 28nm CMOS","M. Li; J. -W. Weijers; V. Derudder; I. Vos; M. Rykunov; S. Dupont; P. Debacker; A. Dewilde; Y. Huang; L. Van der Perre; W. Van Thillo","IMEC, Perceptive systems department, Leuven, Belgium; IMEC, Perceptive systems department, Leuven, Belgium; IMEC, Perceptive systems department, Leuven, Belgium; IMEC, Perceptive systems department, Leuven, Belgium; IMEC, Perceptive systems department, Leuven, Belgium; IMEC, Perceptive systems department, Leuven, Belgium; IMEC, Perceptive systems department, Leuven, Belgium; IMEC, Perceptive systems department, Leuven, Belgium; IMEC, Perceptive systems department, Leuven, Belgium; IMEC, Perceptive systems department, Leuven, Belgium; IMEC, Perceptive systems department, Leuven, Belgium",2015 IEEE Asian Solid-State Circuits Conference (A-SSCC),"21 Jan 2016","2015","","","1","5","The design of multi-Gbps LDPC decoder has become a hot topic in recent years as the demand of transformation towards 5G. An energy efficient 18Gbps LDPC decoder based on LDPC ASIP with half layer paralleled architecture is proposed. The feasibility of the design is proven by its demonstrator silicon in 28nm CMOS technology, with a record energy efficiency of 18.4 pJ/decoded bit and area efficiency of 23.8 Gbps/mm2 for the ½ coding rate working at 18.4Gbps. With frequency, voltage scaling and multi-core management, the decoder supports a wide range of throughput, from 1.8Gbps to 18.4Gbps. The measurement results show the ASIP based design not only provides an energy efficient high speed solution but also be competitive with published ASIC solution at low and medium throughput scenarios.","","978-1-4673-7191-9","10.1109/ASSCC.2015.7387473","","https://ieeexplore.ieee.org/stamp/stamp.jsp?arnumber=7387473","LDPC;802.11ad;processor","Decoding;Throughput;Parity check codes;Encoding;Energy efficiency;Standards;Computer architecture","","14","","6","IEEE","21 Jan 2016","9-11 Nov. 2015","9-11 Nov. 2015","IEEE","IEEE Conferences"
"Parallel block-layered nonbinary QC-LDPC decoding on GPU","H. T. Pham; S. Ajaz; H. Lee","Department of Information and Communication Engineering, Inha University, Incheon, Korea; Department of Information and Communication Engineering, Inha University, Incheon, Korea; Department of Information and Communication Engineering, Inha University, Incheon, Korea",2015 IEEE Workshop on Signal Processing Systems (SiPS),"3 Dec 2015","2015","","","1","6","This paper presents an efficient implementation of a parallel block-layered nonbinary quasi-cyclic low-density parity-check (NB-QC-LDPC) decoder on a graphics processing unit (GPU) to achieve significant improvements in both flexibility and scalability. An efficient block-layered scheme and a data structure suitable for parallel computing are proposed to perform decoding on the GPU. The scheme is applied to a min-max decoding algorithm that exploits the inherent massive parallelization capabilities of NB-QC-LDPC decoder. The results of the proposed approach demonstrate that the layered scheme can be efficiently implemented in a GPU device. Moreover, experimental results show that the proposed GPU-based block-layered NB-QC-LDPC decoder provides a faster decoding runtime compare to CPU-based implementation and obtains a coding gain under a low 10-10 BER and low 10-7 FER.","","978-1-4673-9604-2","10.1109/SiPS.2015.7345000","","https://ieeexplore.ieee.org/stamp/stamp.jsp?arnumber=7345000","nonbinary;quasi-cyclic;LDPC;GPU;parallel computation;CUDA","Graphics processing units;Decoding;Algorithm design and analysis;Iterative decoding;Kernel;Manganese","","7","","12","IEEE","3 Dec 2015","14-16 Oct. 2015","14-16 Oct. 2015","IEEE","IEEE Conferences"
