"Scaling tape-recording areal densities to 100 Gb/in2","A. J. Argumedo; D. Berman; R. G. Biskeborn; G. Cherubini; R. D. Cideciyan; E. Eleftheriou; W. Häberle; D. J. Hellman; R. Hutchins; W. Imaino; J. Jelitto; K. Judd; P. . -O. Jubert; M. A. Lantz; G. M. McClelland; T. Mittelholzer; C. Narayan; S. Ölçer; P. J. Seger","IBM Systems and Technology Group, Almaden Research Center, San Jose, CA, USA; IBM Research Division, Almaden Research Center, San Jose, CA, USA; IBM Research Division, Almaden Research Center, San Jose, CA, USA; IBM Research Division, Zurich Research Laboratory, Ruschlikon, Switzerland; IBM Research Division, Zurich Research Laboratory, Ruschlikon, Switzerland; IBM Research Division, Zurich Research Laboratory, Ruschlikon, Switzerland; IBM Research Division, Zurich Research Laboratory, Säumerstrasse 4, 8803 Rüschlikon, Switzerland; IBM Systems and Technology Group, Tucson, AZ, USA; IBM Systems and Technology Group, Tucson, AZ, USA; IBM Research Division, Almaden Research Center, San Jose, CA, USA; IBM Research Division, Zurich Research Laboratory, Ruschlikon, Switzerland; IBM Systems and Technology Group, Tucson, AZ, USA; Research Division, Almaden Research Center, IBM, San Jose, CA, USA; IBM Research Division, Zurich Research Laboratory, Ruschlikon, Switzerland; IBM Research Division, Almaden Research Center, San Jose, CA, USA; IBM Research Division, Zurich Research Laboratory, Ruschlikon, Switzerland; Research Division, IBM, San Jose, CA, USA; IBM Research Division, Zurich Research Laboratory, Säumerstrasse 4, 8803 Rüschlikon, Switzerland; IBM Systems and Technology Group, Tucson, AZ, USA",IBM Journal of Research and Development,"6 Apr 2010","2008","52","4.5","513","527","We examine the issue of scaling magnetic tape-recording to higher areal densities, focusing on the challenges of achieving 100 Gb/in2 in the linear tape format. The current highest achieved areal density demonstrations of 6.7 Gb/in2 in the linear tape and 23.0 Gb/in2 in the helical scan format provide a reference for this assessment. We argue that controlling the head-tape interaction is key to achieving high linear density, whereas track-following and reel-to-reel servomechanisms as well as transverse dimensional stability are key for achieving high track density. We envision that advancements in media, data-detection techniques, reel-to-reel control, and lateral motion control will enable much higher areal densities. An achievable goal is a linear density of 800 Kb/in and a track pitch of 0.2 µm, resulting in an areal density of 100 Gb/in2.","0018-8646","","10.1147/rd.524.0513","","https://ieeexplore.ieee.org/stamp/stamp.jsp?arnumber=5388603","","","","33","33","","","6 Apr 2010","July 2008","","IBM","IBM Journals"
"A Quasi-Random Approach to Space–Time Codes","K. Wu; L. Ping","Research and Innovation Center, Alcatel Shanghai Bell Corporation Limited, Shanghai, China; Department of Electronic Engineering, City University of Hong Kong, Hong Kong, China",IEEE Transactions on Information Theory,"22 Feb 2008","2008","54","3","1073","1085"," This paper presents a quasi-random approach to space–time (ST) codes. The basic principle is to transmit randomly interleaved versions of forward error correction (FEC)-coded sequences simultaneously from all antennas in a multilayer structure. This is conceptually simple, yet still very effective. It is also flexible regarding the transmission rate, antenna numbers, and channel conditions (e.g., with intersymbol interference). It provides a unified solution to various applications where the traditional ST codes may encounter difficulties. We outline turbo-type iterative joint detection and equalization algorithms with complexity (per FEC-coded bit) growing linearly with the transmit antenna number and independently of the layer number. We develop a signal-to-noise-ratio (SNR) evolution technique and a bounding technique to assess the performance of the proposed code in fixed and quasi-static fading channels, respectively. These performance assessment techniques are very simple and reasonably accurate. Using these techniques as a searching tool, efficient power allocation strategies are examined, which can greatly enhance the system performance. Simulation results show that the proposed code can achieve near-capacity performance with both low and high rates at low decoding complexity. ","1557-9654","","10.1109/TIT.2007.915889","","https://ieeexplore.ieee.org/stamp/stamp.jsp?arnumber=4455765","Equalization;forward error correction (FEC);iterative decoding;power allocation;quasi-random code;space–time (ST) code","Transmitting antennas;Forward error correction;Diversity methods;Intersymbol interference;Signal to noise ratio;Iterative decoding;Interleaved codes;Signal design;Parity check codes;Nonhomogeneous media","","21","1","42","IEEE","22 Feb 2008","March 2008","","IEEE","IEEE Journals"
"Universal Algorithms for Channel Decoding of Uncompressed Sources","E. Ordentlich; G. Seroussi; S. Verdu; K. Viswanathan","Hewlett Packard Laboratories, Palo Alto, CA, USA; Hewlett Packard Laboratories, Palo Alto, CA, USA; Department of Electrical Engineering, Princeton University, Princeton, NJ, USA; Hewlett Packard Laboratories, Palo Alto, CA, USA",IEEE Transactions on Information Theory,"22 Apr 2008","2008","54","5","2243","2262"," In many applications, an uncompressed source stream is systematically encoded by a channel code (which ignores the source redundancy) for transmission over a discrete memoryless channel. The decoder knows the channel and the code but does not know the source statistics. This paper proposes several universal channel decoders that take advantage of the source redundancy without requiring prior knowledge of its statistics. ","1557-9654","","10.1109/TIT.2008.920187","","https://ieeexplore.ieee.org/stamp/stamp.jsp?arnumber=4494696","Belief propagation;channel decoding;denoising;discrete memoryless channels;joint source–channel decoding;lossless compression;soft decoding;universal algorithms","Redundancy;Maximum likelihood decoding;Statistics;Memoryless systems;Information theory;Channel capacity;GSM;Probability;Noise reduction;Propagation losses","","21","1","48","IEEE","22 Apr 2008","May 2008","","IEEE","IEEE Journals"
"A necessary and sufficient condition for determining the girth of quasi-cyclic LDPC codes","X. Wu; X. You; C. Zhao","National Mobile Communications Research Laboratory, South-East University, Nanjing, China; National Mobile Communications Research Laboratory, South-East University, Nanjing, China; National Mobile Communications Research Laboratory, South-East University, Nanjing, China",IEEE Transactions on Communications,"13 Jun 2008","2008","56","6","854","857","The parity-check matrix of a quasi-cyclic low- density parity-check (QC-LDPC) code can be compactly represented by a polynomial parity-check matrix. By using this compact representation, we derive a necessary and sufficient condition for determining the girth of QC-LDPC codes in a systematic way. The new condition avoids an explicit enumeration of cycles for determining the girth of codes, and thus can be well employed to generate QC-LDPC codes with large girth.","1558-0857","","10.1109/TCOMM.2008.060362","","https://ieeexplore.ieee.org/stamp/stamp.jsp?arnumber=4542738","","Sufficient conditions;Parity check codes;Mobile communication;Iterative decoding;Encoding;Circuits;Routing;Hardware;Communications Society;Information theory","","27","","9","IEEE","13 Jun 2008","June 2008","","IEEE","IEEE Journals"
"Adaptive network coded cooperation (ANCC) for wireless relay networks: matching code-on-graph with network-on-graph","X. Bao; J. Li","Department of Electrical and Computer Engineering, Lehigh University, Bethlehem; Lehigh Univ., Bethlehem",IEEE Transactions on Wireless Communications,"15 Feb 2008","2008","7","2","574","583","We consider user cooperation in a relay network that comprises a large collection of transmitters sending wireless data to a common receiver. A new framework exploiting the network coding technology, referred to as adaptive network coded cooperation (ANCC), is proposed to combat the lossy nature of wireless links and to adapt to the changing network topology. The central idea is to match network-on-graph, i.e. instantaneous network topologies described in graphs, with the well-known class of code-on-graph, i.e. low-density parity-check (LDPC) codes and LDPC-like codes. Both achievable rates and outage probabilities are evaluated for ANCC, and closed-form expressions are derived for the asymptotic case where the network size increases without bound. Compared with the existing schemes, ANCC significantly outperforms repetition-based schemes and performs on par with space-time coded cooperation (STCC), but obviates the need for stringent inter-user synchronization at the bit/baud level.","1558-2248","","10.1109/TWC.2008.060439","","https://ieeexplore.ieee.org/stamp/stamp.jsp?arnumber=4450825","","Adaptive systems;Relays;Network coding;Parity check codes;Network topology;Throughput;Wireless networks;Protocols;Routing;Transmitters","","151","2","17","IEEE","15 Feb 2008","February 2008","","IEEE","IEEE Journals"
"Design of regular (2,d/sub c/)-LDPC codes over GF(q) using their binary images","C. Poulliat; M. Fossorier; D. Declercq","ENSEA-UCP-CNRS, Cergy-Pontoise, France; Department of Electrical Engineering, University of Hawaii, Manoa, Honolulu, USA; ENSEA-UCP-CNRS, Cergy-Pontoise, France",IEEE Transactions on Communications,"10 Oct 2008","2008","56","10","1626","1635","In this paper, a method to design regular (2, dc)- LDPC codes over GF(q) with both good waterfall and error floor properties is presented, based on the algebraic properties of their binary image. First, the algebraic properties of rows of the parity check matrix H associated with a code are characterized and optimized to improve the waterfall. Then the algebraic properties of cycles and stopping sets associated with the underlying Tanner graph are studied and linked to the global binary minimum distance of the code. Finally, simulations are presented to illustrate the excellent performance of the designed codes.","1558-0857","","10.1109/TCOMM.2008.060527","","https://ieeexplore.ieee.org/stamp/stamp.jsp?arnumber=4641893","Channel coding;error correction coding;non-binary LDPC codes;iterative decoding;binary image","Parity check codes;Iterative decoding;Binary codes;Image coding;Design methodology;Error correction codes;Optimization methods;Hamming weight;Belief propagation;Iterative algorithms","","248","7","23","IEEE","10 Oct 2008","October 2008","","IEEE","IEEE Journals"
"Generalized IRA Erasure Correcting Codes for Hybrid Iterative/Maximum Likelihood Decoding","E. Paolini; G. Liva; B. Matuz; M. Chiani","DEISWiLAB, University of Bologna, Cesena, Italy; Deutsches Zentrum fur Luft-und Raumfahrt (DLR), Wessling, Germany; Deutsches Zentrum fur Luft-und Raumfahrt (DLR), Wessling, Germany; DEIS WiLAB, University of Bologna, Cesena, Italy",IEEE Communications Letters,"13 Jun 2008","2008","12","6","450","452","The design of low-density parity-check (LDPC) codes under hybrid iterative / maximum likelihood decoding is addressed for the binary erasure channel (BEC). Specifically, we focus on generalized irregular repeat-accumulate (GeIRA) codes, which offer both efficient encoding and design flexibility. We show that properly designed GeIRA codes tightly approach the performance of an ideal maximum distance separable (MDS) code, even for short block sizes. For example, our (2048,1024) code reaches a codeword error rate of 10-5 at channel erasure probability isin= 0.450, where an ideal (2048,1024) MDS code would reach the same error rate at isin = 0.453.","1558-2558","","10.1109/LCOMM.2008.080221","","https://ieeexplore.ieee.org/stamp/stamp.jsp?arnumber=4542779","","Maximum likelihood decoding;Parity check codes;Iterative decoding;Error analysis;Guidelines;Error correction codes;Communication channels;Degradation;Feedback;Encoding","","33","","14","IEEE","13 Jun 2008","June 2008","","IEEE","IEEE Journals"
"Hybrid Iterative Decoding for Low-Density Parity-Check Codes Based on Finite Geometries","J. Li; X. -d. Zhang","Department of Automation, Tsinghua University, Beijing, China; Department of Automation, Tsinghua University, Beijing, China",IEEE Communications Letters,"16 Jan 2008","2008","12","1","29","31","In this letter, a two-stage hybrid iterative decoding algorithm which combines two iterative decoding algorithms is proposed to reduce the computational complexity of finite geometry low-density parity-check (FG-LDPC) codes. We introduce a fast weighted bit-flipping (WBF) decoding algorithm for the first stage decoding. If the first stage decoding fails, the decoding is continued by the powerful belief propagation (BP) algorithm. The proposed hybrid decoding algorithm greatly reduces the computational complexity while maintains the same performance compared to that of using the BP algorithm only.","1558-2558","","10.1109/LCOMM.2008.071563","","https://ieeexplore.ieee.org/stamp/stamp.jsp?arnumber=4432324","","Iterative decoding;Parity check codes;Iterative algorithms;Computational complexity;Belief propagation;AWGN;Computational geometry;Error correction;Sparse matrices;Binary phase shift keying","","13","","7","IEEE","16 Jan 2008","January 2008","","IEEE","IEEE Journals"
"Rate-compatible low-density generator matrix codes","H. Lou; J. Garcia-Frias","Department of Electrical and Computer Engineering, University of Delaware, USA; Department of Electrical and Computer Engineering, University of Delaware, USA",IEEE Transactions on Communications,"14 Mar 2008","2008","56","3","321","324","We propose a family of rate-compatible codes based on the concatenation of two linear codes with low-density generator matrix, which are a special class of LDPC codes with low encoding complexity. The proposed scheme is characterized by its simplicity of construction, and does not require optimization of the puncturing pattern.","1558-0857","","10.1109/TCOMM.2008.050140","","https://ieeexplore.ieee.org/stamp/stamp.jsp?arnumber=4471922","","Parity check codes;Linear code;Concatenated codes;Encoding;Automatic repeat request;Forward error correction;Collaborative work;Government;Sparse matrices;Iterative decoding","","8","","21","IEEE","14 Mar 2008","March 2008","","IEEE","IEEE Journals"
"Multi-Level Dirty Paper Coding","S. -Y. Chung","School of EECS, KAIST, Daejeon, South Korea",IEEE Communications Letters,"13 Jun 2008","2008","12","6","456","458","We propose multi-level coding and successive decoding for dirty paper coding (DPC) in the high signal-to-noise ratio (SNR) regime. We divide the channel code into two levels, the upper code interacting with the shaping code and the lower code that does not such that it is information lossless. Our code design is more intuitive for designing DPC in the high SNR regime. The design of the lower code becomes trivial since it does not interact with the shaping code anymore. The design of the upper code is also simplified since we can now assume binary signaling for the code. We evaluate the capacity of each level and design codes to approach the estimated capacity. We demonstrate a good performance can indeed be achieved by simulations using low- density parity-check (LDPC) codes at each level. Our best code is only 0.45 dB from the no-interference Gaussian capacity at the spectral efficiency of 3 b/s/Hz.","1558-2558","","10.1109/LCOMM.2008.080278","","https://ieeexplore.ieee.org/stamp/stamp.jsp?arnumber=4542781","","Lattices;MIMO;Broadcasting;Signal to noise ratio;Parity check codes;Signal design;Interference cancellation;Iterative decoding;Memoryless systems;Transmitters","","5","","16","IEEE","13 Jun 2008","June 2008","","IEEE","IEEE Journals"
"Stability analysis of an improved min-sum decoder","M. Ramezani; R. Yazdani; M. Ardakani","Department of Electrical and Computer Engineering, University of Alberta, Edmonton, AB, Canada; Department of Electrical and Computer Engineering, University of Alberta, Edmonton, AB, Canada; Department of Electrical and Computer Engineering, University of Alberta, Edmonton, AB, Canada",IEEE Communications Letters,"15 Aug 2008","2008","12","8","581","583","It has been shown that under min-sum (MS) decoding, scaling the messages at the output of check nodes can improve the performance of regular low-density parity-check (LDPC) codes. However, for irregular codes designed for the sum-product decoder, linear scaling can hinder the performance. The problem of code design for MS and linear scaling min-sum (LSMS) decoders have been recently investigated. It is shown that the gap to the capacity for LSMS codes is better than MS codes, but compared to sum-product codes the gap is still considerable. In this letter, a modified MS decoding is proposed and studied. We use the stability analysis of density evolution to show that the proposed method allows for a larger fraction of edges connected to degree-2 variable nodes than LSMS codes. Finally, by designing codes based on the modified method, we show that compared to MS and LSMS codes, a smaller gap to the capacity can indeed be achieved while the complexity of decoding remains essentially the same.","1558-2558","","10.1109/LCOMM.2008.080597","","https://ieeexplore.ieee.org/stamp/stamp.jsp?arnumber=4601446","","Stability analysis;Decoding;Parity check codes;Error correction codes;Degradation;Design methodology","","","","9","IEEE","15 Aug 2008","Aug. 2008","","IEEE","IEEE Journals"
"Generalized ACE Constrained Progressive Edge-Growth LDPC Code Design","D. Vukobratovic; V. Senk","Department of Communications and Signal Processing, University of Novi Sad, Novi Sad, Serbia; Department of Communications and Signal Processing, University of Novi Sad, Novi Sad, Serbia",IEEE Communications Letters,"16 Jan 2008","2008","12","1","32","34","In this letter, we propose a generalization of the progressive edge-growth (PEG) algorithm with the aim of designing LDPC code graphs with substantially improved approximated cycle extrinsic message degree (ACE) properties. The proposed realization of generalized PEG algorithm outperforms original PEG algorithm and its subsequent modification proposed by Xiao and Banihashemi.","1558-2558","","10.1109/LCOMM.2008.071457","","https://ieeexplore.ieee.org/stamp/stamp.jsp?arnumber=4432325","","Parity check codes;Algorithm design and analysis;Signal processing algorithms;Bit error rate;Iterative decoding;Iterative algorithms;Proposals;Design methodology;Design optimization","","58","2","12","IEEE","16 Jan 2008","January 2008","","IEEE","IEEE Journals"
"Multiuser Detection of Sparsely Spread CDMA","D. Guo; C. -c. Wang","Department of Electrical Engineering & Computer, Northwestern University, Evanston, IL, USA; Center for Wireless Systems and Applications(CWSA), Purdue University, West Lafayette, IN, USA",IEEE Journal on Selected Areas in Communications,"3 Apr 2008","2008","26","3","421","431","Code-division multiple access (CDMA) is the basis of a family of advanced air interfaces in current and future generation networks. The benefits promised by CDMA have not been fully realized partly due to the prohibitive complexity of optimal detection and decoding of many users communicating simultaneously using the same frequency band. From both theoretical and practical perspectives, this paper advocates a new paradigm of CDMA with sparse spreading sequences, which enables near-optimal multiuser detection using belief propagation (BP) with low-complexity. The scheme is in part inspired by capacity-approaching low-density parity-check (LDPC) codes and the success of iterative decoding techniques. Specifically, it is shown that BP-based detection is optimal in the large-system limit under many practical circumstances, which is a unique advantage of sparsely spread CDMA systems. Moreover, it is shown that, from the viewpoint of an individual user, the CDMA channel is asymptotically equivalent to a scalar Gaussian channel with some degradation in the signal-to-noise ratio (SNR). The degradation factor, known as the multiuser efficiency, can be determined from a fixed-point equation. The results in this paper apply to a broad class of sparse, semi-regular CDMA systems with arbitrary input and power distribution. Numerical results support the theoretical findings for systems of moderate size, which further demonstrate the appeal of sparse spreading in practical applications.","1558-0008","","10.1109/JSAC.2008.080402","","https://ieeexplore.ieee.org/stamp/stamp.jsp?arnumber=4481368","","Multiuser detection;Multiaccess communication;Parity check codes;Degradation;Frequency;Belief propagation;Iterative decoding;Gaussian channels;Signal to noise ratio;Equations","","120","2","25","IEEE","3 Apr 2008","April 2008","","IEEE","IEEE Journals"
"Iterative Carrier Frequency Offset and Channel Estimation for Underwater Acoustic OFDM Systems","T. Kang; R. A. Iltis","Department of Electrical and Computer Engineering, University of California, Santa Barbara, CA, USA; Department of Electrical and Computer Engineering, University of California, Santa Barbara, CA, USA",IEEE Journal on Selected Areas in Communications,"25 Nov 2008","2008","26","9","1650","1661","This paper presents a practical low-density parity-check (LDPC) coded OFDM system designed for the underwater acoustic channel with its attendant sparse multipath channel and Doppler effects. The carrier frequency offset (CFO) and channel state information (CSI) are assumed unavailable to both to the transmitter and the receiver. Several different receiver structures are considered, all of which perform CFO/channel estimation, detection and decoding in an iterative manner. The convergence behavior of the iterative receivers and their asymptotic performance are evaluated using the extrinsic information transfer (EXIT) chart method. OFDM receiver performance is further evaluated through simulations and field tests in shallow water.","1558-0008","","10.1109/JSAC.2008.081205","","https://ieeexplore.ieee.org/stamp/stamp.jsp?arnumber=4686804","OFDM, low-density parity-check codes, underwater acoustic communications, iterative receiver, carrier frequency offset, Matching Pursuits, EXIT chart","Frequency estimation;Channel estimation;Underwater acoustics;OFDM;Parity check codes;Multipath channels;Doppler effect;Channel state information;Transmitters;Acoustic signal detection","","120","9","62","IEEE","25 Nov 2008","December 2008","","IEEE","IEEE Journals"
"Design of versatile eIRA codes for parallel decoders","L. Dinoi; F. Sottile; S. Benedetto","Istituto Superiore Mario Boella, Torino, Italy; Istituto Superiore Mario Boella, Torino, Italy; Dipartimento di Elettronica, Politecnico di Torino, Torino, Italy",IEEE Transactions on Communications,"12 Dec 2008","2008","56","12","2060","2070","In this paper we propose a semi-random technique for the generation of a class of eIRA codes (a popular class of irregular LDPC codes that can be encoded in linear time) suited to partially parallel decoder implementations. The suggested technique tries to avoid both low-weight codewords and nearcodewords, which limit the performance of the belief propagation decoder. Its effectiveness is verified by comparison with literature results. The obtained codes are versatile, in terms of code-rate and block length, and they are characterized by a low error floor.","1558-0857","","10.1109/TCOMM.2008.050022","","https://ieeexplore.ieee.org/stamp/stamp.jsp?arnumber=4711170","","Parity check codes;Iterative decoding;Turbo codes;Delay;Multimedia communication;Modulation coding;Algorithm design and analysis;Belief propagation;Channel coding;Channel capacity","","12","","45","IEEE","12 Dec 2008","December 2008","","IEEE","IEEE Journals"
"Reduced-Complexity Belief Propagation for System-Wide MUD in the Uplink of Cellular Networks","S. Bavarian; J. K. Cavers","School of Engineering Science, Simon Fraser University, Burnaby, BC, Canada; School of Engineering Science, Simon Fraser University, Burnaby, BC, Canada",IEEE Journal on Selected Areas in Communications,"3 Apr 2008","2008","26","3","541","549","System-wide multiuser detection (MUD), in which all base stations (BSs) of a cellular system cooperate to detect the data of all mobile stations (MSs), has much promise. However, little is known at present about practical techniques or their performance. An attractive method is belief propagation (BP), with message exchange between nearby cooperating BSs over a backbone landline network, but its performance is known only for a greatly simplified network model and its computation load grows exponentially with the number of interfering MS symbols at each BS. In this paper, we present a reduced complexity variation of BP (RCBP) and show that its performance is close to or identical to that of BP in the simplified network. We also observe excellent performance by iterative multiuser detection and decoding of low-density parity check codes (LDPC). Furthermore, we examine RCBP performance in a realistic wireless network model, with path loss, shadowing, fading and power control. These results, though poorer than those of the simplified network, show that system-wide MUD with cooperating BSs provides great improvement compared with conventional systems.","1558-0008","","10.1109/JSAC.2008.080412","","https://ieeexplore.ieee.org/stamp/stamp.jsp?arnumber=4481378","","Belief propagation;Multiuser detection;Land mobile radio cellular systems;Parity check codes;Base stations;Spine;Computational modeling;Computer networks;Iterative decoding;Performance loss","","12","","17","IEEE","3 Apr 2008","April 2008","","IEEE","IEEE Journals"
