"Design of Length-Compatible Low-Density Parity-Check Codes","K. -J. Kim; J. -H. Chung; K. Yang","Department of Electrical Engineering, Pohang University of Science and Technology, Pohang, Gyeongbuk, South Korea; Department of Electrical Engineering, Pohang University of Science and Technology, Pohang, Gyeongbuk, South Korea; Department of Electrical Engineering, Pohang University of Science and Technology, Pohang, Gyeongbuk, South Korea",IEEE Communications Letters,"11 May 2012","2012","16","5","734","737","Length-compatible low-density parity-check (LC-LDPC) codes are a class of low-density parity-check (LDPC) codes which can support a wide range of lengths for a given rate. They may be obtained by applying shortening and puncturing schemes to good LDPC codes. However, this conventional approach does not always guarantee them to have a good performance because their degree distributions may be wildly varied. In this paper we propose a novel algorithm to generate a mother code for LC-LDPC codes of a given rate such that their degree distributions are almost the same as the degree distribution of the mother code. Numerical results show that LC-LDPC codes constructed by our approach perform much better than those by the conventional approach.","1558-2558","","10.1109/LCOMM.2012.030912.120231","","https://ieeexplore.ieee.org/stamp/stamp.jsp?arnumber=6168878","Low-density parity-check (LDPC) codes;progressive edge-growth (PEG) algorithm;length compatibility;degree distributions","Parity check codes;Nickel;Bit error rate;Decoding;Noise;Merging;Digital video broadcasting","","3","","19","IEEE","13 Mar 2012","May 2012","","IEEE","IEEE Journals"
"Addendum to “An Efficient Algorithm to Find All Small-Size Stopping Sets of Low-Density Parity-Check Matrices”","E. Rosnes; Ø. Ytrehus; M. A. Ambroze; M. Tomlinson","Selmer Center, Department of Informatics, University of Bergen, Bergen, Norway; Selmer Center, Department of Informatics, University of Bergen, Bergen, Norway; Fixed and Mobile Communications Research Center, University of Plymouth, Plymouth, UK; Fixed and Mobile Communications Research Center, University of Plymouth, Plymouth, UK",IEEE Transactions on Information Theory,"5 Jan 2012","2012","58","1","164","171","In an earlier transactions paper, Rosnes and Ytrehus presented an efficient algorithm for determining all stopping sets of low-density parity-check (LDPC) codes, up to a specified weight, and also gave results for a number of well-known codes including the family of IEEE 802.16e LDPC codes, commonly referred to as the WiMax codes. It is the purpose of this short paper to review the algorithm for determining the initial part of the stopping set weight spectrum (which includes the codeword weight spectrum), and to provide some improvements to the algorithm. As a consequence, complete stopping set weight spectra up to weight 32 (for selected IEEE 802.16e LDPC codes) can be provided, while in previous work only stopping set weights up to 28 are reported. In the published standard for the IEEE 802.16e codes there are two methods of construction presented, depending upon the code rate and the code length. We compare the stopping sets of the resulting codes and provide complete stopping set weight spectra (up to five terms) for all IEEE 802.16e LDPC codes using both construction methods.","1557-9654","","10.1109/TIT.2011.2171531","","https://ieeexplore.ieee.org/stamp/stamp.jsp?arnumber=6122000","Binary erasure channel;branch-and-bound;exhaustive stopping set enumeration;IEEE 802.16e;low-density parity-check (LDPC) code;minimum distance;stopping distance;stopping set;tree search;weight spectrum","IEEE 802.16 Standards;Vectors;Hamming weight;Iterative decoding;Indexes;WiMAX","","28","","12","IEEE","5 Jan 2012","Jan. 2012","","IEEE","IEEE Journals"
"Design of LDPC Codes with Strong Universal Properties","C. Zheng; A. Sanaei; M. Ardakani","Electrical and Computer Engineering Department, University of Alberta, Edmonton, AB, Canada; University of Michigan, USA; Electrical and Computer Engineering Department, University of Alberta, Edmonton, AB, Canada",IEEE Wireless Communications Letters,"20 Aug 2012","2012","1","4","392","395","Using the information combining bounds together with a Gaussian approximation, a method for finding low-density parity-check codes with strong universal properties that achieve a high percentage of the channel capacity is proposed. For a given channel capacity C, it is proven that the designed codes satisfy the stability condition for all channels with capacity C. Our experimental results also verify the strong universal properties of codes designed by the proposed method.","2162-2345","","10.1109/WCL.2012.061212.120235","","https://ieeexplore.ieee.org/stamp/stamp.jsp?arnumber=6220292","Universal code;information combining;irregular low-density parity-check codes;code design","Parity check codes;Channel capacity;Convergence;Decoding;Mutual information;Gaussian approximation;Error analysis","","1","","14","IEEE","18 Jun 2012","August 2012","","IEEE","IEEE Journals"
"FFT Based Sum-Product Algorithm for Decoding LDPC Lattices","L. Safarnejad; M. -R. Sadeghi","Faculty of Mathematics and Computer Science, Amirkabir University of Technology슠, Tehran, Iran; Faculty of Mathematics and Computer Science, Amirkabir University of Technology슠, Tehran, Iran",IEEE Communications Letters,"14 Sep 2012","2012","16","9","1504","1507","LDPC lattices were introduced by Sadeghi et al. in [13] and have a good performance under generalized minsum and sum-product algorithms. The high complexity of these algorithms is mainly due to the search for local valid codewords in each check node process. In addition, when the dimension of such lattices is increased, these decoding algorithms are very time-consuming. In this paper, we propose an FFT based sum-product algorithm to decode LDPC lattices. In the check node process, using the FFT method reduces the check node complexity from O(dcg2) to O(dcg log g) where dc is the degree of a check equation and g is the alphabet size of an LDPC lattice. As a result, with almost the same complexity cost, we have a significant improvement over the performance of the minsum based decoding 2-level LDPC lattices with the symbol error probability smaller than 10-5 at SNR = 1.5 dB.","1558-2558","","10.1109/LCOMM.2012.073112.120996","","https://ieeexplore.ieee.org/stamp/stamp.jsp?arnumber=6259793","LDPC lattice;Sum-product algorithm;FFT method","Lattices;Parity check codes;Decoding;Sum product algorithm;Complexity theory;Equations;Vectors","","18","","19","IEEE","3 Aug 2012","September 2012","","IEEE","IEEE Journals"
"Windowed Decoding of Protograph-Based LDPC Convolutional Codes Over Erasure Channels","A. R. Iyengar; M. Papaleo; P. H. Siegel; J. K. Wolf; A. Vanelli-Coralli; G. E. Corazza","Department of Electrical and Computer Engineering and the Center for Magnetic Recording Research, University of California, San Diego, La Jolla, CA, USA; Qualcomm, Inc., San Diego, CA, USA; Department of Electrical and Computer Engineering and the Center for Magnetic Recording Research, University of California, San Diego, La Jolla, CA, USA; Department of Electrical and Computer Engineering and the Center for Magnetic Recording Research, University of California, San Diego, La Jolla, CA, USA; DEIS-ARCES, University of Bologna, Bologna, Italy; DEIS-ARCES, University of Bologna, Bologna, Italy",IEEE Transactions on Information Theory,"15 Mar 2012","2012","58","4","2303","2320","We consider a windowed decoding scheme for LDPC convolutional codes that is based on the belief-propagation (BP) algorithm. We discuss the advantages of this decoding scheme and identify certain characteristics of LDPC convolutional code ensembles that exhibit good performance with the windowed decoder. We will consider the performance of these ensembles and codes over erasure channels with and without memory. We show that the structure of LDPC convolutional code ensembles is suitable to obtain performance close to the theoretical limits over the memoryless erasure channel, both for the BP decoder and windowed decoding. However, the same structure imposes limitations on the performance over erasure channels with memory.","1557-9654","","10.1109/TIT.2011.2177439","","https://ieeexplore.ieee.org/stamp/stamp.jsp?arnumber=6086762","Belief propagation;convolutional codes;decoding thresholds;erasure channels;iterative decoding;low-density parity-check codes;stopping sets;windowed decoding","Decoding;Polynomials;Iterative decoding;Convolutional codes;Bismuth;Block codes","","207","7","42","IEEE","23 Nov 2011","April 2012","","IEEE","IEEE Journals"
"On the Construction of Structured LDPC Codes Free of Small Trapping Sets","D. V. Nguyen; S. K. Chilappagari; M. W. Marcellin; B. Vasic","Department of Electrical and Computer Engineering, University of Arizona Tucson, Tucson, AZ, USA; Marvell Semiconductors, Santa Clara, CA, USA; Department of Electrical and Computer Engineering, University of Arizona Tucson, Tucson, AZ, USA; Department of Electrical and Computer Engineering, University of Arizona Tucson, Tucson, AZ, USA",IEEE Transactions on Information Theory,"15 Mar 2012","2012","58","4","2280","2302","We present a method to construct low-density parity-check (LDPC) codes with low error floors on the binary symmetric channel. Codes are constructed so that their Tanner graphs are free of certain small trapping sets. These trapping sets are selected from the trapping set ontology for the Gallager A/B decoder. They are selected based on their relative harmfulness for a given decoding algorithm. We evaluate the relative harmfulness of different trapping sets for the sum–product algorithm by using the topological relations among them and by analyzing the decoding failures on one trapping set in the presence or absence of other trapping sets. We apply this method to construct structured LDPC codes. To facilitate the discussion, we give a new description of structured LDPC codes whose parity-check matrices are arrays of permutation matrices. This description uses Latin squares to define a set of permutation matrices that have disjoint support and to derive a simple necessary and sufficient condition for the Tanner graph of a code to be free of four cycles.","1557-9654","","10.1109/TIT.2011.2173733","","https://ieeexplore.ieee.org/stamp/stamp.jsp?arnumber=6169192","Error floor;Latin squares;structured low-density parity-check codes;trapping sets","Charge carrier processes;Decoding;Iterative decoding;Merging;Databases;Algorithm design and analysis","","88","","69","IEEE","15 Mar 2012","April 2012","","IEEE","IEEE Journals"
"Maximum Likelihood Erasure Decoding of LDPC Codes: Pivoting Algorithms and Code Design","E. Paolini; G. Liva; B. Matuz; M. Chiani","CNIT, DEI, University of Bologna, Cesena, Italy; Institute of Communications and Navigation, German AeroSpace Center, Wessling, Germany; Institute of Communications and Navigation, German AeroSpace Center, Wessling, Germany; CNIT, DEI, University of Bologna, Cesena, Italy",IEEE Transactions on Communications,"29 Nov 2012","2012","60","11","3209","3220","This paper investigates efficient maximum-likelihood (ML) decoding of low-density parity-check (LDPC) codes over erasure channels. A set of algorithms, referred to as pivoting algorithms, is developed. The aim is to limit the average number of pivots (or reference variables) from which all the other erased symbols are recovered iteratively. The suggested algorithms exhibit different trade-offs between complexity of the pivoting phase and average number of pivots. Moreover, a systematic procedure to design LDPC code ensembles for efficient ML decoding is proposed. Numerical results illustrate that the designed LDPC codes achieve a near-optimum performance (very close to the Singleton bound, at least down to a codeword error rate level 10-8) with an affordable decoding complexity. For one of the presented codes and algorithms, a software implementation has been developed which is capable to provide data rates above 1.5 Gbps on a commercial computing platform.","1558-0857","","10.1109/TCOMM.2012.081012.110363","","https://ieeexplore.ieee.org/stamp/stamp.jsp?arnumber=6266770","Ensemble design;erasure channel;Gaussian elimination;low-density parity-check codes;maximum likelihood decoding;pivoting algorithms","Maximum likelihood decoding;Bipartite graph;Complexity theory;Algorithm design and analysis;Iterative decoding","","33","1","34","IEEE","13 Aug 2012","November 2012","","IEEE","IEEE Journals"
"Quantum Error Correction Beyond the Bounded Distance Decoding Limit","K. Kasai; M. Hagiwara; H. Imai; K. Sakaniwa","Department of Science and Engineering, Tokyo Institute of Technology, Tokyo, Japan; Department of Science and Engineering, Tokyo Institute of Technology, Tokyo, Japan; Department of Science and Engineering, Tokyo Institute of Technology, Tokyo, Japan; Department of Science and Engineering, Tokyo Institute of Technology, Tokyo, Japan",IEEE Transactions on Information Theory,"6 Feb 2012","2012","58","2","1223","1230","In this paper, we consider quantum error correction over depolarizing channels with nonbinary low-density parity-check codes defined over Galois field of size 2p. The proposed quantum error correcting codes are based on the binary quasi-cyclic Calderbank, Shor, and Steane (CSS) codes. The resulting quantum codes outperform the best known quantum codes and surpass the performance limit of the bounded distance decoder. By increasing the size of the underlying Galois field, i.e., 2p, the error floors are considerably improved.","1557-9654","","10.1109/TIT.2011.2167593","","https://ieeexplore.ieee.org/stamp/stamp.jsp?arnumber=6017122","Belief propagation;Calderbank, Shor, and Steane (CSS) codes;Galois field;iterative decoding;low-density parity-check (LDPC) code;nonbinary LDPC codes;quantum error-correcting codes","Parity check codes;Cascading style sheets;Sparse matrices;Error correction codes;Decoding;Indexes;High definition video","","43","","20","IEEE","12 Sep 2011","Feb. 2012","","IEEE","IEEE Journals"
"Nonbinary LDPC-Coded Mode-Multiplexed Coherent Optical OFDM 1.28-Tbit/s 16-QAM Signal Transmission Over 2000 km of Few-Mode Fibers With Mode-Dependent Loss","C. Lin; I. B. Djordjevic; D. Zou; M. Arabaci; M. Cvijetic","Department of Electrical and Computer Engineering, College of Engineering, University of Arizona Tucson, Tucson, AZ, USA; Department of Electrical and Computer Engineering, College of Engineering, College of Optical Sciences, University of Arizona Tucson, Tucson, AZ, USA; Department of Electrical and Computer Engineering, College of Engineering, University of Arizona Tucson, Tucson, AZ, USA; Department of Electrical and Computer Engineering, College of Engineering, University of Arizona Tucson, Tucson, AZ, USA; College of Optical Sciences, University of Arizona Tucson, Tucson, AZ, USA",IEEE Photonics Journal,"2 Oct 2012","2012","4","5","1922","1929","We demonstrate the possibility of nonbinary LDPC-coded mode-multiplexed coherent optical OFDM 1.28-Tbit/s 16-QAM signal transmission over 2000 km of few-mode fiber (FMF) with mode-dependent loss (MDL) by using an advanced mode-coupling compensation scheme. The performance of proposed coded-modulation scheme is evaluated for different number of spatial modes. The simulation results indicate that the MDL is the predominant effect in the long-haul optical transmission based on FMFs. Different pilot-aided OFDM based compensation methods are studied, and it has been found that minimum mean-square estimation with linear interpolation method is the most robust against mode coupling and MDL. We also show that the nonbinary LDPC-coded modulation provides about 1 dB improvement over binary LDPC-coded modulation (16 QAM OFDM and MDL of 25 dB). Finally, we study the degradation of increasing the number of modes and investigate the proposed scheme for different MDL values in both fourand eight-mode fibers.","1943-0655","","10.1109/JPHOT.2012.2219515","","https://ieeexplore.ieee.org/stamp/stamp.jsp?arnumber=6305455","Microwave photonics signal processing;nonbinary LDPC-coded modulation;orthogonal frequency-division multiplexing (OFDM);few-mode fiber (FMF) communications;multi-Tb/s optical transport","Parity check codes;OFDM;Optical fibers;Channel estimation;Bit error rate;Optical transmitters","","7","1","12","IEEE","18 Sep 2012","Oct. 2012","","IEEE","IEEE Journals"
"Low-Complexity Z_4 LDPC Code Design under a Gaussian Approximation","M. Ferrari; S. Bellini; A. Tomasoni","IEIIT Institute of the Italian National Research Council (CNR), Milano, Italy; Politecnico di Milano, Milano, Italy; IEIIT Institute of the Italian National Research Council (CNR), Milano, Italy",IEEE Wireless Communications Letters,"10 Dec 2012","2012","1","6","589","592","In this paper we propose low complexity LDPC code design and decoding in Z4 which may be useful to combat phase ambiguities in wireless links affected by strong phase noise. We approximate messages exchanged on the Tanner graph using separable probability density functions. This allows a substantial reduction of decoder memory and complexity, with a negligible performance penalty, compared to ideal Z4 decoding. Furthermore, we show that the Density Evolution analysis of this suboptimal decoder leads to irregular LDPC designs matching the criteria of binary LDPC codes.","2162-2345","","10.1109/WCL.2012.082712.120471","","https://ieeexplore.ieee.org/stamp/stamp.jsp?arnumber=6290311","LDPC codes;density evolution;Z_4","Parity check codes;Decoding;Vectors;Binary codes;Equations;Convolution","","5","","8","IEEE","29 Aug 2012","December 2012","","IEEE","IEEE Journals"
"Multi-Input Multi-Output Deletion Channel","F. Wang; T. M. Duman","Department of Electrical and Electronics Engineering, Bilkent University, Bilkent, Ankara, Turkey; Department of Electrical and Electronics Engineering, Bilkent University, Bilkent, Ankara, Turkey",IEEE Communications Letters,"26 Nov 2012","2012","16","11","1729","1732","We describe a new channel model suitable in certain applications, namely the multi-input multi-output (MIMO) deletion channel. This channel models the scenarios where multiple transmitters and receivers suffering from synchronization errors are employed. We then consider a coding scheme over such channels based on a serial concatenation of a low-density parity check (LDPC) code, a marker code and a layered space-time code. We design two detectors operating at the bit level which jointly achieve synchronization for the deletion channel (with the help of the marker code) and detection for the MIMO channel. Utilizing the proposed detector together with an LDPC code with powerful error-correction capabilities, we demonstrate that reliable transmission over a MIMO deletion channel is feasible.","1558-2558","","10.1109/LCOMM.2012.092112.121290","","https://ieeexplore.ieee.org/stamp/stamp.jsp?arnumber=6317096","MIMO;deletion channel;marker codes;LDPC codes","MIMO;Parity check codes;Synchronization;Channel models;Integrated circuits;Detectors;Decoding","","","","12","IEEE","1 Oct 2012","November 2012","","IEEE","IEEE Journals"
"Precoding for Word Error Rate Minimization of LDPC Coded Modulation on Block Fading Channels","D. Duyck; J. J. Boutros; M. Moeneclaey","Department of Telecommunications and Information Processing, Ghent University, Gent, Belgium; Texas A and M University, Qatar, Doha, Qatar; Department of Telecommunications and Information Processing, Ghent University, Gent, Belgium",IEEE Transactions on Wireless Communications,"13 Jul 2012","2012","11","7","2457","2467","In wireless communications, the block fading (BF) channel is an important channel model. A key quality indicator in coded transmission is the word error rate (WER), which is the fraction of packets that cannot be decoded correctly at the receiver. We study Low-Density Parity-Check (LDPC) coded modulation with precoding, with the aim to minimize the WER on BF channels without channel state information at the transmitter. In the literature, it was not yet known how to optimize the system parameters for this channel model, mainly due to the fading gain distribution. One of the existing approaches to combining coding and modulation is bit-interleaved coded modulation with iterative decoding (BICM-ID). This work uses precoding to optimize BICM-ID with LDPC codes for BF channels, and is a continuation of previous work that used precoding to minimize the outage probability limit. We present the selection of the precoding matrix, the mapping function and the error-correcting code yielding a WER that closely approaches this minimum outage probability. Using a geometric approach, the off-line system optimization effort for the BF channel is limited to at most B+1 times the effort for Gaussian channels, where B is the number of blocks in the BF channel.","1558-2248","","10.1109/TWC.2012.051712.111142","","https://ieeexplore.ieee.org/stamp/stamp.jsp?arnumber=6205592","Block fading channels;low-density parity-check coded modulations;EXIT charts","Fading;Modulation;Parity check codes;Vectors;Decoding;Encoding;Error analysis","","4","","48","IEEE","28 May 2012","July 2012","","IEEE","IEEE Journals"
"Design of Low Complexity Non-Binary LDPC Codes with an Approximated Performance-Complexity Tradeoff","Y. Yu; W. Chen","Department of Electronic Engineering, Shanghai Jiaotong University, Shanghai, China; Department of Electronic Engineering, Shanghai Jiaotong University, Shanghai, China",IEEE Communications Letters,"12 Apr 2012","2012","16","4","514","517","By presenting an approximated performance-complexity tradeoff (PCT) algorithm, a low-complexity non-binary low density parity check (LDPC) code over q-ary-input symmetric-output channel is designed in this manuscript which converges faster than the threshold-optimized non-binary LDPC codes in the low error rate regime. We examine our algorithm by both hard and soft decision decoders. Moreover, simulation shows that the approximated PCT algorithm has accelerated the convergence process by 30% regarding the number of the decoding iterations.","1558-2558","","10.1109/LCOMM.2012.021612.112467","","https://ieeexplore.ieee.org/stamp/stamp.jsp?arnumber=6155572","Nonbinary LDPC;EXIT chart;performance-complexity tradeoff;Gallager decoding algorithm b","Complexity theory;Decoding;Iterative decoding;Error probability;Algorithm design and analysis;Optimization","","7","","13","IEEE","20 Feb 2012","April 2012","","IEEE","IEEE Journals"
"Design of Convergence-Optimized Non-Binary LDPC Codes over Binary Erasure Channel","Y. Yu; W. Chen; L. Wei","Department of Electronic Engineering, Shanghai Jiaotong University, China; Department of Electronic Engineering, Shanghai Jiaotong University, China; Department of Electronic Engineering, Shanghai Jiaotong University, China",IEEE Wireless Communications Letters,"20 Aug 2012","2012","1","4","336","339","In this letter, we present a hybrid iterative decoder for non-binary low density parity check (LDPC) codes over binary erasure channel (BEC), based on which the recursion of the erasure probability is derived to design non-binary LDPC codes with convergence-optimized degree distributions. The resulting one-step decoding tree is cycle-free and achieves lower decoding complexity. Experimental studies show that the proposed convergence-optimization algorithm accelerates the convergence process by 33%.","2162-2345","","10.1109/WCL.2012.050112.120297","","https://ieeexplore.ieee.org/stamp/stamp.jsp?arnumber=6196162","Non-binary LDPC;EXIT chart;binary erasure channel;complexity optimization","Iterative decoding;Convergence;Optimization;Maximum likelihood decoding;Algorithm design and analysis","","7","","8","IEEE","7 May 2012","August 2012","","IEEE","IEEE Journals"
