"Distributed Video Coding With Feedback Channel Constraints","J. Slowack; J. Skorupa; N. Deligiannis; P. Lambert; A. Munteanu; R. Van de Walle","The Interdisciplinary Institute for Broadband Technology, Ledeberg-Ghent, Belgium; The Interdisciplinary Institute for Broadband Technology, Ledeberg-Ghent, Belgium; Department of Electronics and Informatics, Vrije Universiteit Brussel, Brussels, Belgium; The Interdisciplinary Institute for Broadband Technology, Ledeberg-Ghent, Belgium; Department of Electronics and Informatics, Vrije Universiteit Brussel, Brussels, Belgium; The Interdisciplinary Institute for Broadband Technology, Ledeberg-Ghent, Belgium",IEEE Transactions on Circuits and Systems for Video Technology,"28 Jun 2012","2012","22","7","1014","1026","Many of the distributed video coding (DVC) systems described in the literature make use of a feedback channel from the decoder to the encoder to determine the rate. However, the number of requests through the feedback channel is often high, and as a result the overall delay of the system could be unacceptable in practical applications. As a solution, feedback-free DVC systems have been proposed, but the problem with these solutions is that they incorporate a difficult trade-off between encoder complexity and compression performance. Recognizing that a limited form of feedback may be supported in many video-streaming scenarios, in this paper we propose a method for constraining the number of feedback requests to a fixed maximum number of $N$ requests for an entire Wyner-Ziv (WZ) frame. The proposed technique estimates the WZ rate at the decoder using information obtained from previously decoded WZ frames and defines the $N$ requests by minimizing the expected rate overhead. Tests on eight sequences show that the rate penalty is less than 5% when only five requests are allowed per WZ frame (for a group of pictures of size four). Furthermore, due to improvements from previous work, the system is able to perform better than or similar to DISCOVER even when up to two requests per WZ frame are allowed. The practical usefulness of the proposed approach is studied by estimating end-to-end delay and encoder buffer requirements, indicating that DVC with constrained feedback can be an important solution in the context of video-streaming scenarios.","1558-2205","","10.1109/TCSVT.2012.2189669","","https://ieeexplore.ieee.org/stamp/stamp.jsp?arnumber=6162975","Distributed video coding;feedback channel;rate estimation","Decoding;Estimation;Encoding;Indexes;Delay;Correlation;Codecs","","12","","29","IEEE","1 Mar 2012","July 2012","","IEEE","IEEE Journals"
"Soft-Input Inner Decoder for the Davey-MacKay Construction","X. Jiao; M. A. Armand","Department of Electrical and Computer Engineering, National University of Singapore, Singapore; Department of Electrical and Computer Engineering, National University of Singapore, Singapore",IEEE Communications Letters,"11 May 2012","2012","16","5","722","725","The Davey-MacKay (DM) construction is a promising concatenated coding scheme for the binary-input, binary-output, insertion-deletion-substitution (IDS) channel. Many practical channels however have continuous output. We therefore develop a soft-input inner decoder for this coding scheme under a cascaded channel model consisting of the IDS channel followed by a binary-input, continuous-output, additive white Gaussian noise (AWGN) channel. We show that at low signal-to-noise ratios (SNRs), applying the proposed inner decoder to the unquantized AWGN channel output, yields significant performance improvements over the original coding scheme when the channel output is 1-bit quantized, although the performance gains do decrease as SNR increases.","1558-2558","","10.1109/LCOMM.2012.032612.112621","","https://ieeexplore.ieee.org/stamp/stamp.jsp?arnumber=6177197","Davey-MacKay construction;insertion/deletion channel;AWGN channel;cascaded channel;soft-decision decoding;synchronization","Decoding;Signal to noise ratio;Synchronization;Channel models;Parity check codes;Encoding;Delta modulation","","11","","14","IEEE","3 Apr 2012","May 2012","","IEEE","IEEE Journals"
"Extended Detection for MIMO Systems with Partial Incremental Redundancy Based Hybrid ARQ","S. Park; Y. Whang; S. Choi","Department of Electrical and Electronic Engineering, Yonsei University, Seoul, South Korea; School of Electrical Engineering and Computer Science, Oregon State University, Corvallis, OR, USA; Department of Electrical and Electronic Engineering, Yonsei University, Seoul, South Korea",IEEE Transactions on Wireless Communications,"18 Oct 2012","2012","11","10","3714","3722","In this paper, an extended detection scheme is proposed for multiple-input multiple-output (MIMO) systems which employ partial incremental redundancy (IR) based hybrid automatic repeat request (HARQ). Based on the extended MIMO system model that interprets multiple retransmissions as a single transmission, the extended detection scheme estimates the entire transmitted symbols utilizing all information obtained up to the current retransmission. Compared with the conventional zero-forcing (ZF) detection scheme, the extended ZF detection scheme improves the post-processing signal-to-noise ratio (PSNR) of the newly transmitted symbols in every retransmission, as well as the repeatedly transmitted symbols. Simulation results verify that the extended detection scheme outperforms the conventional detection scheme. Simulation results also show that the extended minimum mean-square-error (MMSE) detection scheme can achieve a better error performance than the conventional maximum-likelihood (ML) detection scheme, and even the extended ZF detection scheme shows a comparable error performance to the conventional ML detection scheme.","1558-2248","","10.1109/TWC.2012.081612.112299","","https://ieeexplore.ieee.org/stamp/stamp.jsp?arnumber=6287524","Extended detection scheme;hybrid ARQ;MIMO;partial incremental redundancy;post-processing SNR;zero-forcing","MIMO;PSNR;Vectors;Diversity reception;Automatic repeat request;Redundancy;Modulation","","11","","18","IEEE","27 Aug 2012","October 2012","","IEEE","IEEE Journals"
"Designing a Good Low-Rate Sparse-Graph Code","I. Andriyanova; J. -P. Tillich","ETIS-UMR8051 group, ENSEA, CNRS, University of Cergy-Pontoise, Cergy, France; Equipe-Projet SECRET, INRIA-Rocequencourt, France",IEEE Transactions on Communications,"29 Nov 2012","2012","60","11","3181","3190","This paper deals with the design of low-rate sparse-graph codes, having a linear minimum distance d_{min} in the blocklength n. Its main contributions are: a) a necessary condition on a general family of sparse-graph codes with linear d_{min}; b) a justification of having degree-1 bits in the low-rate code structure; c) a new, efficient ensemble of low-rate sparse-graph codes with bits of degree 1, designed so that the necessary condition (a) is satisfied.","1558-0857","","10.1109/TCOMM.2012.082712.100205","","https://ieeexplore.ieee.org/stamp/stamp.jsp?arnumber=6291708","Sparse-graph codes;minimum distance;EXIT chart;TLDPC ensemble","Iterative decoding;Turbo codes;Bipartite graph;Convergence;Convolutional codes;Redundancy","","10","","31","IEEE","30 Aug 2012","November 2012","","IEEE","IEEE Journals"
"Design of an Efficient Maximum Likelihood Soft Decoder for Systematic Short Block Codes","P. Adde; D. Gomez Toro; C. Jego","CNRS Lab-STICC UMR 3192, Institut Telecom-Telecom Bretagne, Brest, France; CNRS Lab-STICC UMR 3192, Institut Telecom-Telecom Bretagne, Brest, France; IPB/Enseirb-Matmeca, CNRS IMS, UMR 5218, Université de Bordeaux 1, Bordeaux, France",IEEE Transactions on Signal Processing,"13 Jun 2012","2012","60","7","3914","3919","Maximum likelihood soft-decision decoding of linear block codes is addressed in this correspondence. A novel algorithm based on Chase-2 algorithm for the decoding of systematic binary block codes is detailed. A double re-encoding technique in place of the classical algebraic decoding for the computation of the candidate codeword list is the major innovation of the proposed algorithm. This approach has been successfully applied to systematic block codes that have a code rate equal to 1/2 and a parity check matrix composed of an invertible submatrix for the redundancy part. Simulation results show performance close to the optimum maximum likelihood decoding for an excellent tradeoff between BER performance and computational complexity. Then, the challenging issue of designing a decoder for a specific family of short binary block codes, called Cortex codes is also described. Three soft decoders for Cortex codes with lengths equal to 32, 64, and 128 and a code rate equal to 1/2 have been designed. Then, all the decoders were successively implemented onto an field-programmable gate array (FPGA) device. To our knowledge, they are the first efficient digital implementations of Cortex codes.","1941-0476","","10.1109/TSP.2012.2193575","","https://ieeexplore.ieee.org/stamp/stamp.jsp?arnumber=6179342","Computational complexity;decoder architecture;re- encoding;soft decoding;systematic short bloc codes","Systematics;Error correction codes;Bit error rate;Maximum likelihood decoding;Error correction;Block codes","","9","3","20","IEEE","5 Apr 2012","July 2012","","IEEE","IEEE Journals"
"High-Rate Maximum Runlength Constrained Coding Schemes Using Nibble Replacement","K. A. S. Immink","Nanyang Technological University, Singapore",IEEE Transactions on Information Theory,"11 Sep 2012","2012","58","10","6572","6580","In this paper, we will present coding techniques for the character-constrained channel, where information is conveyed using q-bit characters (nibbles), and where w prescribed characters are disallowed. Using codes for the character-constrained channel, we present simple and systematic constructions of high-rate binary maximum runlength constrained codes. The new constructions have the virtue that large lookup tables for encoding and decoding are not required. We will compare the error propagation performance of codes based on the new construction with that of prior art codes.","1557-9654","","10.1109/TIT.2012.2204034","","https://ieeexplore.ieee.org/stamp/stamp.jsp?arnumber=6214603","Constrained code;recording;runlength limited code","Encoding;Redundancy;Decoding;Art;Table lookup;Error correction codes;Complexity theory","","8","1","15","IEEE","8 Jun 2012","Oct. 2012","","IEEE","IEEE Journals"
"Finite-SNR Diversity-Multiplexing Trade-Off of Dual Hop Multiple-Relay Channels","Y. Liu; P. Dharmawansa; M. R. McKay; K. B. Letaief","Department of Electronic and Computer Engineering, Hong Kong University of Science and Technology, Clear Water Bay, Kowloon, Hong Kong; Department of Electronic and Computer Engineering, Honk Kong University of Science and Technology, Hong Kong, China; Department of Electronic and Computer Engineering, Hong Kong University of Science and Technology, Clear Water Bay, Kowloon, Hong Kong; Department of Electronic and Computer Engineering, Hong Kong University of Science and Technology, Clear Water Bay, Kowloon, Hong Kong",IEEE Transactions on Communications,"10 May 2012","2012","60","5","1451","1463","This paper investigates the finite signal-to-noise ratio (SNR) diversity-multiplexing trade-off (DMT) of point-to-point wireless channels assisted by multiple relays. Results are derived for both amplify-and-forward (AF) and decode-and-forward (DF) relaying protocols. For the AF protocol, we derive accurate approximations for the system outage probability when the relays are clustered between the source and destination. For the case where all the relays are clustered near the destination, an exact closed-form expression for the system outage probability is obtained. For the DF protocol, under general multiple relaying configurations, we derive an exact closed-form expression for the system outage probability. The outage results for AF and DF are used subsequently to yield expressions for the finite-SNR DMT. We also extract the conventional asymptotic DMTs as special cases of the finite-SNR results, and demonstrate that the asymptotic DMTs can significantly overestimate the level of diversity that is achievable for practical error rates and SNRs.","1558-0857","","10.1109/TCOMM.2012.041212.100768","","https://ieeexplore.ieee.org/stamp/stamp.jsp?arnumber=6188993","Amplify-and-forward;decode-and-forward;finite-SNR diversity-multiplexing trade-off;outage probability","Relays;Protocols;Signal to noise ratio;Multiplexing;Diversity methods;Approximation methods;Resource management","","8","","32","IEEE","26 Apr 2012","May 2012","","IEEE","IEEE Journals"
"Onboard Low-Complexity Compression of Solar Stereo Images","S. Wang; L. Cui; S. Cheng; L. Stankovic; V. Stankovic","School of Electrical and Computer Engineering, University of Oklahoma, Tulsa, Tulsa, OK, USA; School of Electrical and Computer Engineering, University of Oklahoma, Tulsa, Tulsa, OK, USA; School of Electrical and Computer Engineering, University of Oklahoma, Tulsa, Tulsa, OK, USA; Department of Electronic and Electrical Engineering, University of Strathclyde, Glasgow, UK; Department of Electronic and Electrical Engineering, University of Strathclyde, Glasgow, UK",IEEE Transactions on Image Processing,"11 May 2012","2012","21","6","3114","3118","We propose an adaptive distributed compression solution using particle filtering that tracks correlation, as well as performing disparity estimation, at the decoder side. The proposed algorithm is tested on the stereo solar images captured by the twin satellites system of NASA's Solar TErrestrial RElations Observatory (STEREO) project. Our experimental results show improved compression performance w.r.t. to a benchmark compression scheme, accurate correlation estimation by our proposed particle-based belief propagation algorithm, and significant peak signal-to-noise ratio improvement over traditional separate bit-plane decoding without dynamic correlation and disparity estimation.","1941-0042","","10.1109/TIP.2012.2187669","","https://ieeexplore.ieee.org/stamp/stamp.jsp?arnumber=6151826","Distributed source coding;image compression;multiview imaging;remote sensing","Correlation;Image coding;Decoding;Estimation;Joints;Transform coding;Educational institutions","","8","","19","IEEE","13 Feb 2012","June 2012","","IEEE","IEEE Journals"
"Analysis and Design of Tuned Turbo Codes","C. Koller; A. Graell i Amat; J. Kliewer; F. Vatta; K. S. Zigangirov; D. J. Costello","Department of Electrical Engineering, University of Notre Dame, Notre Dame, IN, USA; Department of Signals and Systems, Chalmers University of Technology, Gothenburg, Sweden; Klipsch School of Electrical and Computer Engineering, New Mexico State University, Las Cruces, NM, USA; DI3, Università di Trieste, Trieste, Italy; Department of Electrical and Information Technology, Lund University, Lund, Sweden; Department of Electrical Engineering, University of Notre Dame, Notre Dame, IN, USA",IEEE Transactions on Information Theory,"12 Jun 2012","2012","58","7","4796","4813","It has been widely observed that there exists a fundamental tradeoff between the minimum (Hamming) distance properties and the iterative decoding convergence behavior of turbo-like codes. While capacity-achieving code ensembles typically are asymptotically bad in the sense that their minimum distance does not grow linearly with block length, and they therefore exhibit an error floor at moderate-to-high signal-to-noise ratios, asymptotically good codes usually converge further away from channel capacity. In this paper, we introduce the concept of tuned turbo codes, a family of asymptotically good hybrid concatenated code ensembles, where asymptotic minimum distance growth rates, convergence thresholds, and code rates can be tradedoff using two tuning parameters: $\lambda $ and $\mu $. By decreasing  $\lambda $, the asymptotic minimum distance growth rate is reduced in exchange for improved iterative decoding convergence behavior, while increasing $\lambda $ raises the asymptotic minimum distance growth rate at the expense of worse convergence behavior, and thus, the code performance can be tuned to fit the desired application. By decreasing  $\mu $, a similar tuning behavior can be achieved for higher rate code ensembles.","1557-9654","","10.1109/TIT.2012.2195711","","https://ieeexplore.ieee.org/stamp/stamp.jsp?arnumber=6200859","Concatenated codes;distance growth rates;extrinsic information transfer (EXIT) charts;Hamming distance;iterative decoding;turbo codes","Iterative decoding;Turbo codes;Convergence;Tuning;Decoding;Hamming distance","","8","","32","IEEE","16 May 2012","July 2012","","IEEE","IEEE Journals"
"Nonlinear Trellis Codes for Binary-Input Binary-Output Multiple-Access Channels with Single-User Decoding","M. Griot; A. I. Vila Casado; W. -Y. Weng; H. Chan; J. Wang; R. D. Wesel","Qualcomm, Inc., San Diego, CA, USA; Mojix, Inc., Los Angeles, CA, USA; Ralink Technology, Taiwan; Pharmaco-Kinesis Corporation, Inglewood, CA, USA; Electrical Engineering Department, University of California, Los Angeles, CA, USA; Electrical Engineering Department, University of California, Los Angeles, CA, USA",IEEE Transactions on Communications,"9 Feb 2012","2012","60","2","364","374","This paper presents a practical technique that uses Ping's interleave(r)-division multiple access and single-user decoding to provide uncoordinated access for a family of binary-input binary-output multiple-access channels (MACs) including the OR-MAC where users' binary transmissions are combined with the logical OR operation. Information theoretic calculations provide the achievable sum-rates and optimal ones densities for these MACs. Because the required ones densities are significantly less than 50%, new nonlinear trellis code analysis and design techniques are introduced to provide the needed codes. Union bound techniques that predict the performance of these codes are also presented. Simulation results and a working FPGA implementation verify the performance and feasibility of the proposed nonlinear codes and overall multiple access scheme.","1558-0857","","10.1109/TCOMM.2012.010512.070116","","https://ieeexplore.ieee.org/stamp/stamp.jsp?arnumber=6127843","Multiuser channels;single-user-decoding;nonlinear trellis codes;binary asymmetric channel;Z channel;multiple access channel;binary multiplier channel","Decoding;Joints;Hamming weight;Convolutional codes;Limiting;Pairwise error probability;Interference","","8","","20","IEEE","10 Jan 2012","February 2012","","IEEE","IEEE Journals"
"A Novel Physical Layer Split FEC Scheme for Long Time Interleaving With Fast Zapping Support","D. Gomez-Barquero; P. F. Gomez; D. Gozalvez; B. Sayadi; L. Roullet","Instituto de Telecomunicaciones y Aplicaciones Multimedia (iTEAM), Universidad Politécnica de Valencia, Valencia, Spain; Instituto de Telecomunicaciones y Aplicaciones Multimedia (iTEAM), Universidad Politécnica de Valencia, Valencia, Spain; Instituto de Telecomunicaciones y Aplicaciones Multimedia (iTEAM), Universidad Politécnica de Valencia, Valencia, Spain; Instituto de Telecomunicaciones y Aplicaciones Multimedia (iTEAM), Universidad Politécnica de Valencia, Valencia, Spain; Instituto de Telecomunicaciones y Aplicaciones Multimedia (iTEAM), Universidad Politécnica de Valencia, Valencia, Spain",IEEE Transactions on Broadcasting,"18 May 2012","2012","58","2","269","276","This paper describes a novel forward error correction (FEC) and time interleaving scheme, known as BB-iFEC (Base Band - inter-burst FEC), aimed to provide long time interleaving with fast zapping support. BB-iFEC is a split FEC scheme with an outer FEC and an outer time interleaver concatenated to the inner FEC and inner time interleaver. It is based on the link layer FEC scheme of the hybrid satellite-terrestrial mobile broadcasting standard DVB-SH (Satellite to Handhelds), known as MPE-iFEC (Multi Protocol Encapsulation - inter-burst FEC), but moved down to the physical layer. This allows full transparency towards upper layers, as well as reduced signaling overhead and packet fragmentation. However, the major novelty is that it allows re-using the soft information at the output of the inner FEC decoder (i.e., the log-likelihood ratios, LLRs). Compared to hard decoding, this improves the performance at the expense of higher memory requirements at the receivers. Nevertheless, BB-iFEC allows to efficiently perform either soft or hard decoding, being thus a scalable solution. Another important advantage is that it can be introduced in future evolutions of existing systems, because it allows allows co-existence of terminals with and without long time interleaving support. The paper describes the main features of BB-iFEC and its implementation at the transmitter and receiver side. The paper also presents illustrative results for future evolutions of the digital terrestrial TV standard DVB-T2 (Second Generation Terrestrial), such as the next generation mobile broadcasting technology DVB-NGH (Next Generation Handheld).","1557-9611","","10.1109/TBC.2012.2185574","","https://ieeexplore.ieee.org/stamp/stamp.jsp?arnumber=6164281","DVB-NGH;fast zapping;FEC;mobile TV;time interleaving","Forward error correction;Decoding;Digital video broadcasting;Physical layer;Memory management;Encoding;Receivers","","7","","12","IEEE","5 Mar 2012","June 2012","","IEEE","IEEE Journals"
"Embracing Asynchronism: Achieving Cooperative Diversity using Zigzag Interference Cancellation","C. Hucher; P. Sadeghi","Research School of Engineering, Australian National University Austrialian Capital Territory, Canberra, Australia; Research School of Engineering, Australian National University Austrialian Capital Territory, Canberra, Australia",IEEE Transactions on Wireless Communications,"18 Sep 2012","2012","11","9","3240","3249","Synchronization between the received signals from several transmitters is a challenging problem for cooperative communications. In the literature it is often assumed that the signals are somehow perfectly synchronized, but the problem of communication with asynchronism is rarely addressed. Moreover, in the few works where the problem is addressed, the proposed techniques are designed for a maximum delay whose value determines the decoding complexity. Thus in practice, only small delays can be dealt with. In this paper, instead of trying to avoid asynchronism between the received signals from two different transmitters, we propose to exploit it to provide cooperative diversity by optimally combining the two signals resulting from forward and backward zigzag interference cancellation. In addition to being tolerant to any delay, our bit error rate derivations and simulations show that the proposed scheme provides similar performance as delay-tolerant space-time block codes, such as the delay-tolerant Alamouti code, with a much lower complexity compared to a maximum likelihood (ML) decoder.","1558-2248","","10.1109/TWC.2012.061912.111416","","https://ieeexplore.ieee.org/stamp/stamp.jsp?arnumber=6225390","Asynchronous communication;bit error rate;cooperative systems;detection algorithms;diversity methods","Delay;Decoding;Bit error rate;Interference cancellation;Relays;Complexity theory;Diversity reception","","7","","30","IEEE","25 Jun 2012","September 2012","","IEEE","IEEE Journals"
"Using Channel Output Feedback to Increase Throughput in Hybrid-ARQ","M. Agrawal; Z. Chance; D. J. Love; V. Balakrishnan","School of Electrical and Computer Engineering, Purdue University, West Lafayette, IN, USA; School of Electrical and Computer Engineering, Purdue University, West Lafayette, IN, USA; School of Electrical and Computer Engineering, Purdue University, West Lafayette, IN, USA; School of Electrical and Computer Engineering, Purdue University, West Lafayette, IN, USA",IEEE Transactions on Signal Processing,"20 Nov 2012","2012","60","12","6465","6480","Hybrid automatic repeat request (ARQ) protocols have become common in many packet transmission systems due to their incorporation in various standards. Hybrid-ARQ combines the normal ARQ method with forward error correction (FEC) codes to increase reliability and throughput. In this paper, we look at improving upon this performance using feedback information from the destination, in particular, using a powerful FEC code in conjunction with a proposed linear feedback code for the Rayleigh block fading channels. The new hybrid-ARQ scheme is initially developed for full received packet feedback in a point-to-point link. It is then extended to various multiple-antenna scenarios [e.g., multiple-input single-output (MISO), multiple-input multiple-output (MIMO), etc.] with varying amounts of packet feedback information. Simulations illustrate gains in throughput.","1941-0476","","10.1109/TSP.2012.2213079","","https://ieeexplore.ieee.org/stamp/stamp.jsp?arnumber=6268356","Additive Gaussian noise channels;channel output feedback;concatenated coding;hybrid-ARQ;multiple-input multiple-output (MIMO) fading channel","MIMO;Throughput;Automatic repeat request;Encoding;Fading channels;Decoding;Protocols","","7","1","45","IEEE","14 Aug 2012","Dec. 2012","","IEEE","IEEE Journals"
