"Transactions Papers - Constructions of Nonbinary Quasi-Cyclic LDPC Codes: A Finite Field Approach","L. Zeng; L. Lan; Y. Y. Tai; S. Song; S. Lin; K. Abdel-Ghaffar","Link A Media Devices Corporation, Santa Clara, CA, USA; KeyEye Communications, Sacramento, CA, USA; Ikanos Communications, Inc., Fremont, CA, USA; Marvell Semiconductor, Inc., Santa Clara, CA, USA; Department of Electrical and Computer Engineering, University of California, Davis, USA; Department of Electrical and Computer Engineering, University of California, Davis, USA",IEEE Transactions on Communications,"15 Apr 2008","2008","56","4","545","554","This paper is concerned with construction of efficiently encodable nonbinary quasi-cyclic LDPC codes based on finite fields. Four classes of nonbinary quasi-cyclic LDPC codes are constructed. Experimental results show that codes constructed perform well with iterative decoding using a fast Fourier transform based q-ary sum-product algorithm and they achieve significant coding gains over Reed-Solomon codes of the same lengths and rates decoded with either algebraic hard- decision Berlekamp-Massey algorithm or algebraic soft-decision Kotter-Vardy algorithm.","1558-0857","","10.1109/TCOMM.2008.060024","","https://ieeexplore.ieee.org/stamp/stamp.jsp?arnumber=4489627","","Parity check codes;Galois fields;Iterative decoding;Iterative algorithms;Fast Fourier transforms;Sum product algorithm;Reed-Solomon codes;Performance gain;Algorithm design and analysis;Belief propagation","","101","1","27","IEEE","15 Apr 2008","April 2008","","IEEE","IEEE Journals"
"A Coded Modulation Scheme for Deep-Space Optical Communications","Y. Tan; J. -z. Guo; Y. Ai; W. Liu; Y. -J. Fei","School of Electronic Information, Wuhan University of China, Wuhan, Hubei, China; School of Electronic Information, Wuhan University of China, Wuhan, Hubei, China; School of Electronic Information, Wuhan University of China, Wuhan, Hubei, China; School of Electronic Information, Wuhan University of China, Wuhan, Hubei, China; School of Electronic Information, Wuhan University of China, Wuhan, Hubei, China",IEEE Photonics Technology Letters,"8 Feb 2008","2008","20","5","372","374","A coded modulation scheme for deep-space optical communications is studied, which is a serial concatenation of an outer low-density parity-check (LDPC) code, an interleaver, a bit-accumulator, and pulse-position modulation (PPM). It is referred as LDPC-APPM. It is decoded with an iterative demodulator-decoder using standard turbo-decoding techniques. Simulation results show that the LDPC-APPM with an outer LDPC code of medium code length suffers a loss of about 0.7 dB at a bit-error rate of relative to the serially concatenated PPM (SCPPM) of similar parameters, which consists of the serial concatenation of an outer convolutional code, an interleaver, a bit-accumulator, and PPM; however, it has better code rate flexibility especially for high rates and simpler implementation structure than SCPPM. Further, it can achieve better performance than the LDPC-PPM of the same rate and length, which consists of the serial concatenation of an LDPC code and PPM.","1941-0174","","10.1109/LPT.2008.916903","","https://ieeexplore.ieee.org/stamp/stamp.jsp?arnumber=4448365","Decoding;deep-space communications;low-density parity-check (LDPC) codes;optical communication;pulse-position modulation (PPM)","Modulation coding;Optical fiber communication;Parity check codes;Iterative decoding;Pulse modulation;Optical pulses;Convolutional codes;Error correction codes;Demodulation;Bit error rate","","12","","9","IEEE","8 Feb 2008","March1, 2008","","IEEE","IEEE Journals"
"On Convergence Speed of Capacity-Achieving Sequences for Erasure Channel","M. Lu","Department of Mathematics, Pennsylvania State University, University Park, PA, USA",IEEE Transactions on Information Theory,"21 Mar 2008","2008","54","4","1793","1794","Oswald and Shokrollahi carried out a systematic study of capacity-achieving sequences of low-density parity-check (LDPC) codes for the binary erasure channel. Two quantities mu and Delta were suggested to measure the convergence speed of these sequences. They gave an upper bound of mu for a certain type of capacity-achieving sequences. In this correspondence, a lower bound of mu for this type of sequences is provided. It follows that, under a certain condition, the exact value of mu can be determined, which answers an open question posed by Oswald and Shokrollahi in their paper. If the condition is not satisfied the upper bound may not be tight. A counterexample is given.","1557-9654","","10.1109/TIT.2008.917662","","https://ieeexplore.ieee.org/stamp/stamp.jsp?arnumber=4475380","Binary erasure channel;capacity-achieving sequences;low-density parity-check (LDPC) codes","Convergence;Parity check codes;Upper bound;Iterative decoding;Iterative algorithms;Velocity measurement;Probability;Tornadoes;Distributed computing;Mathematics","","1","","5","IEEE","21 Mar 2008","April 2008","","IEEE","IEEE Journals"
"Quasi-cyclic generalized ldpc codes with low error floors","G. Liva; W. E. Ryan; M. Chiani","German Aerospace Centre, Institute of Communications and Navigation, Webling, Germany; Department of Electrical and Computer Engineering, University of Arizona Tucson, Tucson, AZ, USA; WiLAB/DEIS, University of Bologna, Cesena, Italy",IEEE Transactions on Communications,"21 Jan 2008","2008","56","1","49","57","In this paper, a novel methodology for designing structured generalized LDPC (G-LDPC) codes is presented. The proposed design results in quasi-cyclic G-LDPC codes for which efficient encoding is feasible through shift-register-based circuits. The structure imposed on the bipartite graphs, together with the choice of simple component codes, leads to a class of codes suitable for fast iterative decoding. A pragmatic approach to the construction of G-LDPC codes is proposed. The approach is based on the substitution of check nodes in the protograph of a low-density parity-check code with stronger nodes based, for instance, on Hamming codes. Such a design approach, which we call LDPC code doping, leads to low-rate quasi-cyclic G-LDPC codes with excellent performance in both the error floor and waterfall regions on the additive white Gaussian noise channel.","1558-0857","","10.1109/TCOMM.2008.050600","","https://ieeexplore.ieee.org/stamp/stamp.jsp?arnumber=4436088","","Parity check codes;Floors;Iterative decoding;Bipartite graph;Turbo codes;Design methodology;Circuits;Doping;Quasi-doping;Additive white noise","","116","2","39","IEEE","21 Jan 2008","January 2008","","IEEE","IEEE Journals"
"Application of Nonbinary LDPC Cycle Codes to MIMO Channels","R. Peng; R. -R. Chen","Department of Electrical and Computer Engineering, University of Utah, Salt Lake, UT, USA; Department of Electrical and Computer Engineering, University of Utah, Salt Lake, UT, USA",IEEE Transactions on Wireless Communications,"17 Jun 2008","2008","7","6","2020","2026","In this paper, we investigate the application of nonbinary low-density parity-check (LDPC) cycle codes over Galois field GF(q) to multiple-input multiple-output (MIMO) channels. Two types of LDPC coded systems that employ either joint or separate MIMO detection and channel decoding are considered, depending on the size of the Galois field and the modulation choice. We construct a special class of nonbinary LDPC cycle codes called the parallel sparse encodable (PSE) codes. The PSE code, consisting of a quasi-cyclic (QC) LDPC cycle code and a simple tree code, has the attractive feature that it is not only linearly encodable, but also allows parallel encoding which can reduce the encoding time significantly. We provide a systematic comparison between nonbinary coded systems and binary coded systems in both performance and complexity. Our results show that the proposed nonbinary system employing the PSE code outperforms not only the binary LDPC code specified in the 802.16e standard, but also the optimized binary LDPC code obtained using the EXIT chart methods. Through a detailed complexity analysis, we conclude that for the MIMO channel considered, the nonbinary coded systems achieve a superior performance at a receiver complexity that is comparable to that of the binary systems.","1558-2248","","10.1109/TWC.2008.070057","","https://ieeexplore.ieee.org/stamp/stamp.jsp?arnumber=4543051","","Parity check codes;MIMO;Galois fields;Decoding;Modulation coding;Fading;Binary codes;Code standards;Optimization methods;Performance analysis","","26","1","22","IEEE","17 Jun 2008","June 2008","","IEEE","IEEE Journals"
"Implementation aspects of LDPC convolutional codes","A. E. Pusane; A. J. Feltstrom; A. Sridharan; M. Lentmaier; K. S. Zigangirov; D. J. Costello","Department of Electrical Engineering, University of Notre Dame, Notre Dame, IN, USA; DS2 Design of Systems on Silicon, Valencia, Spain; Department of Electrical Engineering, University of Notre Dame, Notre Dame, IN, USA; Department of Electrical Engineering, University of Notre Dame, Notre Dame, IN, USA; Department of Electrical Engineering, University of Notre Dame, Notre Dame, IN, USA; Department of Electrical Engineering, University of Notre Dame, Notre Dame, IN, USA",IEEE Transactions on Communications,"18 Jul 2008","2008","56","7","1060","1069","Potentially large storage requirements and long initial decoding delays are two practical issues related to the decoding of low-density parity-check (LDPC) convolutional codes using a continuous pipeline decoder architecture. In this paper, we propose several reduced complexity decoding strategies to lessen the storage requirements and the initial decoding delay without significant loss in performance. We also provide bit error rate comparisons of LDPC block and LDPC convolutional codes under equal processor (hardware) complexity and equal decoding delay assumptions. A partial syndrome encoder realization for LDPC convolutional codes is also proposed and analyzed. We construct terminated LDPC convolutional codes that are suitable for block transmission over a wide range of frame lengths. Simulation results show that, for terminated LDPC convolutional codes of sufficiently large memory, performance can be improved by increasing the density of the syndrome former matrix.","1558-0857","","10.1109/TCOMM.2008.050519","","https://ieeexplore.ieee.org/stamp/stamp.jsp?arnumber=4568447","","Parity check codes;Convolutional codes;Iterative decoding;Delay;Pipelines;Bit error rate;Block codes;Iterative algorithms;Performance loss","","119","9","18","IEEE","18 Jul 2008","July 2008","","IEEE","IEEE Journals"
"Mitigation of linear and nonlinear impairments in high-speed optical networks by using LDPC-coded turbo equalization","I. B. Djordjevic; L. L. Minkov; H. G. Batshon","Department of Electrical and Computer Engineering, University of Arizona Tucson, Tucson, AZ, USA; Department of Electrical and Computer Engineering, University of Arizona Tucson, Tucson, AZ, USA; Department of Electrical and Computer Engineering, University of Arizona Tucson, Tucson, AZ, USA",IEEE Journal on Selected Areas in Communications,"5 Aug 2008","2008","26","6","73","83","We study a turbo equalization scheme based on low-density parity-check (LDPC) coded turbo equalization (TE). This scheme is suitable for simultaneous: (i) suppression of intra-channel nonlinearities, (ii) chromatic dispersion compensation, and (iii) polarization-mode dispersion (PMD) compensation. LDPC coding is based on large girth (g ges 8) block-circulant codes, and maximum a posteriori probability (MAP) equalizer is based on Bahl-Cocke-Jelinek-Raviv (BJCR) algorithm. The ultimate channel capacity limits, assuming an independent identically distributed (i.i.d.) source are reported as well. In the presence of intrachannel nonlinearities the LDPC-coded TE provides almost 12 dB improvement over BCJR equalizer at BER of 10-8. For an NRZ system operating at 10 Gb/s with residual dispersion of 11200 ps/nm and for differential group delay of 50 ps, the LDPC-coded TE is only 1 dB away from the i.i.d channel capacity. The efficiency of LDPC-coded TE in PMD compensation is demonstrated experimentally, with decoding performed off line.","1558-0008","","10.1109/JSACOCN.2008.032908","","https://ieeexplore.ieee.org/stamp/stamp.jsp?arnumber=4588335","","Optical fiber networks;Tellurium;Parity check codes;Equalizers;Channel capacity;Chromatic dispersion;Polarization mode dispersion;Bit error rate;Optical signal processing;Delay","","54","2","31","IEEE","5 Aug 2008","Aug. 2008","","IEEE","IEEE Journals"
"Performance and Decoding Complexity of Nonbinary LDPC Codes for Magnetic Recording","W. Chang; J. R. Cruz","School of Electrical and Computer Engineering, University of Oklahama, Norman, OK, USA; School of Electrical and Computer Engineering, University of Oklahama, Norman, OK, USA",IEEE Transactions on Magnetics,"18 Dec 2007","2008","44","1","211","216","We consider a group of high-performance q-ary low-density parity-check (LDPC) coded perpendicular magnetic recording channels (PMRCs) with optimized targets and codes over various field sizes. We show that the nonbinary LDPC-coded PMRCs provide 1-dB coding gain over a practical implementation of a good binary LDPC-coded PMRC at user density of 1.22, and evaluate the decoding complexities of these systems in terms of both the number of floating-point (FLP) operations and the computational time. Decoding complexity ratios of nonbinary LDPC-coded PMRCs to the binary LDPC-coded system are presented. After careful analysis, we conclude that the time complexity ratios are always smaller than the ratios obtained by the number of FLP operations, which do not exceed 7.42. Furthermore, experimental results show that the size of the Galois field does not affect the decoding complexity.","1941-0069","","10.1109/TMAG.2007.912832","","https://ieeexplore.ieee.org/stamp/stamp.jsp?arnumber=4407569","Decoding complexity;iterative decoding;low-density parity-check codes;partial response channels;perpendicular magnetic recording","Parity check codes;Magnetic recording;Iterative decoding;Perpendicular magnetic recording;Galois fields;Additive white noise;AWGN;Algorithm design and analysis;High performance computing;USA Councils","","13","1","23","IEEE","18 Dec 2007","Jan. 2008","","IEEE","IEEE Journals"
"A 1-Gb/s flexible LDPC decoder supporting multiple code rates and block lengths","J. -Y. Lee; H. -J. Ryu","Division of Electronics and Information Engineering, Chonbuk National University, Jeon-ju, Korea; Division of Electronics and Information Engineering, Chonbuk National University, Jeon-ju, Korea",IEEE Transactions on Consumer Electronics,"15 Jul 2008","2008","54","2","417","424","This paper propose a new flexible low-density parity-check (LDPC) decoding architecture that can be dynamically reconfigured according to a parity-check matrix which changes as code rate or block length varies. Since the LDPC codes are adopted in standards such as DVB-S2, IEEE 802.1 In and IEEE 802.16e and each standard allows various code rates and block lengths, an LDPC decoder architecture that could support multiple code rates and code block lengths is needed. The proposed architecture employs Benes network to implement configurable interconnection network. In the proposed architecture the number of levels and the delay of the interconnection network is reduced by using broadcasting technique which transmits reduced messages to save the complexity of the interconnection network. The number of processing units in the proposed partially parallel architecture is determined by investigating the relation between hardware complexity and throughput. By applying pipelining to the processing units, decoding throughput is increased. To verify the proposed architecture, a flexible LDPC decoder is implemented using a 0.18 mum CMOS process. The decoder occupies an area of 16.261 mm and runs correctly at the frequency of 212 MHz resulting in 1 Gbps decoding throughput.","1558-4127","","10.1109/TCE.2008.4560109","","https://ieeexplore.ieee.org/stamp/stamp.jsp?arnumber=4560109","","Parity check codes;Decoding;Multiprocessor interconnection networks;Throughput;Code standards;Digital video broadcasting;Parallel architectures;Hardware;Pipeline processing;CMOS process","","20","2","22","IEEE","15 Jul 2008","May 2008","","IEEE","IEEE Journals"
"Design Tradeoffs and Hardware Architecture for Real-Time Iterative MIMO Detection using Sphere Decoding and LDPC Coding","H. Kim; D. . -U. Lee; J. D. Villasenor","Electrical Engineering Department, University of California, Los Angeles, CA, USA; Electrical Engineering Department, University of California, Los Angeles, CA, USA; Electrical Engineering Department, University of California, Los Angeles, CA, USA",IEEE Journal on Selected Areas in Communications,"1 Aug 2008","2008","26","6","1003","1014","We explore the performance and hardware complexity tradeoffs associated with performing iterative multiple- input multiple-output (MIMO) detection using a sphere decoder and a low-density parity-check (LDPC) decoder. Iterations are performed both within the LDPC decoder as well as via an outer iteration loop through which refined soft information is fed back from the LDPC decoder to a MIMO detector. A hardware architecture and associated implementation results on Xilinx Virtex-5 field programmable gate array for a 4 x 4 QPSK MIMO system are presented. The system offers a performance improvement of approximately 1 dB over systems without the outer iteration loop, and provides an information bit throughput that ranges from 60 to 300 megabits per second when a length 1944 rate 1/2 LDPC code is used.","1558-0008","","10.1109/JSAC.2008.080816","","https://ieeexplore.ieee.org/stamp/stamp.jsp?arnumber=4586298","","Hardware;MIMO;Iterative decoding;Parity check codes;Maximum likelihood decoding;Detectors;Throughput;CMOS process;Field programmable gate arrays;Quadrature phase shift keying","","7","1","18","IEEE","1 Aug 2008","August 2008","","IEEE","IEEE Journals"
"Power Reduction Techniques for LDPC Decoders","A. Darabiha; A. Chan Carusone; F. R. Kschischang","Edward S. Rogers Sr. Department of Electrical and Computer Engineering, University of Toronto, Toronto, ONT, Canada; Edward S. Rogers Sr. Department of Electrical and Computer Engineering, University of Toronto, Toronto, ONT, Canada; Edward S. Rogers Sr. Department of Electrical and Computer Engineering, University of Toronto, Toronto, ONT, Canada",IEEE Journal of Solid-State Circuits,"25 Jul 2008","2008","43","8","1835","1845"," This paper investigates VLSI architectures for low-density parity-check (LDPC) decoders amenable to low- voltage and low-power operation. First, a highly-parallel decoder architecture with low routing overhead is described. Second, we propose an efficient method to detect early convergence of the iterative decoder and terminate the computations, thereby reducing dynamic power. We report on a bit-serial fully-parallel LDPC decoder fabricated in a 0.13-$\mu{\hbox{m}}$  CMOS process and show how the above techniques affect the power consumption. With early termination, the prototype is capable of decoding with 10.4 pJ/bit/iteration, while performing within 3 dB of the Shannon limit at a BER of 10$^{-5}$  and with 3.3 Gb/s total throughput. If operated from a 0.6 V supply, the energy consumption can be further reduced to 2.7 pJ/bit/iteration while maintaining a total throughput of 648 Mb/s, due to the highly-parallel architecture. To demonstrate the applicability of the proposed architecture for longer codes, we also report on a bit-serial fully-parallel decoder for the (2048, 1723) LDPC code in 10GBase-T standard synthesized with a 90-nm CMOS library. ","1558-173X","","10.1109/JSSC.2008.925402","","https://ieeexplore.ieee.org/stamp/stamp.jsp?arnumber=4578752","10 Gigabit Ethernet;channel coding;iterative message passing;low-density parity-check codes;very-large-scale integration","Parity check codes;Iterative decoding;Computer architecture;Energy consumption;Throughput;Very large scale integration;Routing;Convergence;Iterative methods;CMOS process","","104","22","26","IEEE","25 Jul 2008","Aug. 2008","","IEEE","IEEE Journals"
"Distributed source coding using short to moderate length rate-compatible LDPC codes: the entire Slepian-Wolf rate region","M. Sartipi; F. Fekri","School of Computer Science and Engineering, University of Tennessee, Chattanooga, Chattanooga, TN, USA; School of Electrical and Computer Engineering, Georgia Institute of Technology, Atlanta, GA, USA",IEEE Transactions on Communications,"14 Mar 2008","2008","56","3","400","411","In this paper, we propose a scheme for distributed source coding of correlated sources using a single systematic LDPC code. In particular, since we are interested in wireless sensor network applications, we consider LDPC codes with short to moderate lengths that achieve every arbitrary coding rate on the Slepian-Wolf rate region. We simplify the distributed source coding problem to the rate-compatible LDPC code design with an unequal error protection property. The decoders communicate to each other to exchange information bits prior to decoding. However, thereafter, each performs the decoding independently. Therefore, errors in one decoder do not affect the other one. The simulation results confirm that the gap from the theoretical limit remains almost the same for different rates on the Slepian-Wolf rate region. First, we consider two correlated sources. We show that our proposed scheme improves the performance of distributed source coding of two sources considerably. This benefit is more stressed for application with short to moderate length sequences. Then, we study distributed source coding of three sources. As a special case, we investigate three sources that are pairwise correlated with the same correlation probability. We show that the gap from the theoretical limit is smaller than that of previous work. We also investigate the distributed source coding of correlated sources when there is no prior knowledge of the correlation parameter at the time of code design. We note that although the proposed distributed source coding is well suited for sensor networks (where sequences with less than 10000 bits are used), the method can be generalized to other distributed source coding applications.","1558-0857","","10.1109/TCOMM.2008.060006","","https://ieeexplore.ieee.org/stamp/stamp.jsp?arnumber=4471935","","Source coding;Parity check codes;Wireless sensor networks;Decoding;Error correction codes;Scattering;Base stations;Channel coding;Communications Society;Computer science","","47","","26","IEEE","14 Mar 2008","March 2008","","IEEE","IEEE Journals"
"LDPC-coded cooperative relay systems: performance analysis and code design","C. Li; G. Yue; M. A. Khojastepour; X. Wang; M. Madihian","Marvell Semiconductor, Inc., Santa Clara, CA, USA; NEC Laboratories of America, Inc., Princeton, NJ, USA; NEC Laboratories of America, Inc., Princeton, NJ, USA; Department of Electrical Engineering, Columbia University, NY, USA; NEC Laboratories of America, Inc., Princeton, NJ, USA",IEEE Transactions on Communications,"14 Mar 2008","2008","56","3","485","496","We treat the problem of designing low-density parity-check (LDPC) codes to approach the capacity of relay channels. We consider an efficient analysis framework that decouples the factor graph (FG) of a B-block transmission into successive partial FGs, each of which denotes a two-block transmission. We develop design methods to find the optimum code ensemble for the partial FG. In particular, we formulate the relay operations and the destination operations as equivalent virtual MISO and MIMO systems, and employ a binary symmetric channel (BSC) model for the relay node output. For AWGN channels, we further develop a Gaussian approximation for the detector output at the destination node. Jointly treating the relay and the destination, we analyze the performance of the LDPC-coded relay system using the extrinsic mutual information transfer(EXIT) chart technique. Furthermore, differential evolution is employed to search for the optimum code ensemble. Our results show that the optimized codes always outperform the regular LDPC codes with a significant gain; in the AWGN case, when Protocol-II is employed and the relay is close to the source, the optimized code performs within 0.1dB to the capacity bound.","1558-0857","","10.1109/TCOMM.2008.060032","","https://ieeexplore.ieee.org/stamp/stamp.jsp?arnumber=4471943","","Relays;Performance analysis;Parity check codes;Channel capacity;Design methodology;MIMO;AWGN channels;Gaussian approximation;Detectors;Information analysis","","45","","22","IEEE","14 Mar 2008","March 2008","","IEEE","IEEE Journals"
