"Comparison of Orthogonal Frequency-Division Multiplexing and Pulse-Amplitude Modulation in Indoor Optical Wireless Links","D. J. F. Barros; S. K. Wilson; J. M. Kahn","Ginzton Laboratory, Department of Electrical Engineering, University of Stanford, Stanford, CA, USA; Department of Electrical Engineering, Santa Clara University, Santa Clara, CA, USA; Ginzton Laboratory, Department of Electrical Engineering, University of Stanford, Stanford, CA, USA",IEEE Transactions on Communications,"13 Feb 2012","2012","60","1","153","163","We evaluate the performance of three direct-detection orthogonal frequency-division multiplexing (OFDM) schemes in combating multipath distortion in indoor optical wireless links, comparing them to unipolar M-ary pulse-amplitude modulation (M-PAM) with minimum mean-square error decision-feedback equalization (MMSE-DFE). The three OFDM techniques are DC-clipped OFDM and asymmetrically clipped optical OFDM (ACO-OFDM) and PAM-modulated discrete multitone (PAM-DMT). We describe an iterative procedure to achieve optimal power allocation for DC-OFDM. For each modulation method, we quantify the received electrical SNR required at a given bit rate on a given channel, considering an ensemble of 170 indoor wireless channels. When using the same symbol rate for all modulation methods, M-PAM with MMSE-DFE has better performance than any OFDM format over a range of spectral efficiencies, with the advantage of (M-PAM) increasing at high spectral efficiency. ACO-OFDM and PAM-DMT have practically identical performance at any spectral efficiency. They are the best OFDM formats at low spectral efficiency, whereas DC-OFDM is best at high spectral efficiency. When ACO-OFDM or PAM-DMT are allowed to use twice the symbol rate of M-PAM, these OFDM formats have better performance than M-PAM. When channel state information is unavailable at the transmitter, however, M-PAM significantly outperforms all OFDM formats. When using the same symbol rate for all modulation methods, M-PAM requires approximately three times more computational complexity per processor than all OFDM formats and 63% faster analog-to-digital converters, assuming oversampling ratios of 1.23 and 2 for ACO-OFDM and M-PAM, respectively. When OFDM uses twice the symbol rate of M-PAM, OFDM requires 23% faster analog-to-digital converters than M-PAM but OFDM requires approximately 40% less computational complexity than M-PAM per processor.","1558-0857","","10.1109/TCOMM.2011.112311.100538","","https://ieeexplore.ieee.org/stamp/stamp.jsp?arnumber=6094127","Optical wireless;infrared wireless;visible light communications;communications system performance;multi-carrier optical systems;orthogonal frequency-division multiplexing;power allocation;intensity modulation with direct detection;PAM-DMT;ACO-OFDM;OOK;OFDM;MMSE equalizers","OFDM;Optical transmitters;Optical receivers;Wireless communication;Optical modulation;Noise","","134","1","23","IEEE","2 Dec 2011","January 2012","","IEEE","IEEE Journals"
"High-Speed Quantum Key Distribution System for 1-Mbps Real-Time Key Generation","A. Tanaka; M. Fujiwara; K. -i. Yoshino; S. Takahashi; Y. Nambu; A. Tomita; S. Miki; T. Yamashita; Z. Wang; M. Sasaki; A. Tajima","System Platforms Research Laboratories, NEC Corporation Limited, Kawasaki-shi, Japan; Quantum ICT Laboratory, National Institute of Information and Communications Technology, Tokyo, Japan; System Platforms Research Laboratories, NEC Corporation Limited, Kawasaki-shi, Japan; System Platforms Research Laboratories, NEC Corporation Limited, Kawasaki-shi, Japan; Green Innovations Research Laboratories, NEC Corporation Limited, Ibaraki, Japan; Graduate School of Information Science and Technology, Hokkaido University, Hokkaido, Japan; Nano ICT Laboratory, National Institute of Information and Communications Technology, Tokyo, Japan; Nano ICT Laboratory, National Institute of Information and Communications Technology, Tokyo, Japan; Nano ICT Laboratory, National Institute of Information and Communications Technology, Tokyo, Japan; Quantum ICT Laboratory, National Institute of Information and Communications Technology, Tokyo, Japan; System Platforms Research Laboratories, NEC Corporation Limited, Kawasaki-shi, Japan",IEEE Journal of Quantum Electronics,"20 Feb 2012","2012","48","4","542","550","A high-speed quantum key distribution (QKD) system has been developed with the goal of a 1-Mbps final secure key generation rate under 10-dB transmission loss, which corresponds to 50 km of standard single mode fiber. For the purpose of speeding-up all processes in QKD sequence, we apply a wavelength-division-multiplexing (WDM) technique using the colorless interferometric technique and a key distillation hardware (HW) engine. We establish a novel WDM scheme, sharing interferometers and their temperature regulators over multiple channels, which enables us to increase the number of channels with a small impact on system cost and size. To generate a secure key while satisfying both high speed and high security, we develop a key distillation HW engine which enables us to execute key distillation with 1-Mbit code length in real time. We have experimentally evaluated the performance of the developed system through installed fiber. By operating three wavelength channels, a new, world leading key generation rate of greater than 200 kbps over a 14.5-dB transmission loss has been achieved.","1558-1713","","10.1109/JQE.2012.2187327","","https://ieeexplore.ieee.org/stamp/stamp.jsp?arnumber=6150994","Field programmable gate arrays;quantum key distribution;wavelength division multiplexing","Photonics;Synchronization;Wavelength division multiplexing;Field programmable gate arrays;Optical attenuators;Channel coding","","96","3","38","IEEE","10 Feb 2012","April 2012","","IEEE","IEEE Journals"
"On the Joint V2I and V2V Scheduling for Cooperative VANETs With Network Coding","Q. Wang; P. Fan; K. B. Letaief","National Computer Network Emergency Response Technical Team/Coordination Center of China, Beijing, China; Department of Electronic Engineering, Tsinghua University, Beijing, China; Hong Kong University of Science and Technology, Kowloon, Hong Kong",IEEE Transactions on Vehicular Technology,"16 Jan 2012","2012","61","1","62","73","In the paper, we investigate the information spread problem in a joint vehicle-to-infrastructure (V2I) and vehicle-to-vehicle (V2V) communication system. A scene is considered where more information centers (or base stations) are allocated along the road so that the information centers are able to broadcast timely messages to vehicles within the range of the broadcast signal of each base station, which we shall refer to as broadcast zone . The seamless information spread is used to guarantee that messages are correctly received by each vehicle, regardless of whether it pulls into broadcast zones or not. We first derive the maximum throughput of the V2I downlink system for both additive white Gaussian noise (AWGN) channels and Rayleigh fading channels with Doppler effects. A measurement-based algorithm to estimate the throughput is also proposed. We then discuss the maximum achievable amount of information that can be relayed forward along a vehicular stream. A network coding technique will then be proposed to cancel the interference caused by relay signals to vehicles that are receiving messages from the corresponding information center. These theoretical results will give more insight into the vehicular communication system design.","1939-9359","","10.1109/TVT.2011.2167249","","https://ieeexplore.ieee.org/stamp/stamp.jsp?arnumber=6022812","Broadcast;intelligent transportation systems (ITSs);network coding;relay;vehicular ad hoc networks (VANETs);vehicle-to-infrastructure (V2I);vehicle-to-vehicle (V2V)","Vehicles;Throughput;Joints;Network coding;Fading;Interference;Downlink","","87","","24","IEEE","19 Sep 2011","Jan. 2012","","IEEE","IEEE Journals"
"Effects of Channel Estimation on Spatial Modulation","S. Sugiura; L. Hanzo","Toyota Central R&D Laboratories, Inc., Nagakute, Aichi, Japan; School of Electronics and Computer Science, University of Southampton, Southampton, U.K.",IEEE Signal Processing Letters,"9 Oct 2012","2012","19","12","805","808","In this letter, we investigate the effects of training-based channel estimation on the achievable performance of the recent spatial modulation (SM) based multiple-input multiple-output (MIMO) scheme. This is motivated by the fact that the SM transmitter is constituted by a single radio-frequency (RF) branch and multiple antenna elements (AEs), hence simultaneous pilot transmissions from the AEs are impossible, unlike in the classic multiple-RF MIMO transmitters. Our simulation results demonstrate that the SM scheme's BER curve exhibits a performance penalty, while relying on realistic imperfect channel-estimation. In order to combat these limitations, we propose two single-RF arrangements, namely a reduced-complexity joint channel estimation and data detection aided SM scheme as well as a non-coherently detected single-RF space-time shift keying scheme dispensing with channel estimation.","1558-2361","","10.1109/LSP.2012.2221707","","https://ieeexplore.ieee.org/stamp/stamp.jsp?arnumber=6319351","Channel estimation;iterative detection;non-coherent detection;single-RF MIMO;space-shift keying;space-time shift keying;spatial modulation;training signals","Channel estimation;Joints;MIMO;Bit error rate;Transmitters;Radio frequency;Signal to noise ratio","","80","","13","IEEE","2 Oct 2012","Dec. 2012","","IEEE","IEEE Journals"
"Rateless Coding for Gaussian Channels","U. Erez; M. D. Trott; G. W. Wornell","Department of Electrical Engineering-Systems, Tel Aviv University, Ramat-Aviv, Israel; Hewlett Packard Laboratories, Palo Alto, CA, USA; Department of Electrical Engineering and Computer Science, Massachusetts Institute of Technology, Cambridge, MA, USA",IEEE Transactions on Information Theory,"6 Feb 2012","2012","58","2","530","547","A rateless code-i.e., a rate-compatible family of codes-has the property that codewords of the higher rate codes are prefixes of those of the lower rate ones. A perfect family of such codes is one in which each of the codes in the family is capacity-achieving. We show by construction that perfect rateless codes with low-complexity decoding algorithms exist for additive white Gaussian noise channels. Our construction involves the use of layered encoding and successive decoding, together with repetition using time-varying layer weights. As an illustration of our framework, we design a practical three-rate code family. We further construct rich sets of near-perfect rateless codes within our architecture that require either significantly fewer layers or lower complexity than their perfect counterparts. Variations of the basic construction are also developed, including one for time-varying channels in which there is no a priori stochastic model.","1557-9654","","10.1109/TIT.2011.2173242","","https://ieeexplore.ieee.org/stamp/stamp.jsp?arnumber=6145513","Incremental redundancy;rate-compatible punctured codes;hybrid ARQ (H-ARQ);static broadcasting","Decoding;Redundancy;Encoding;Signal to noise ratio;Vectors;AWGN channels","","70","6","37","IEEE","6 Feb 2012","Feb. 2012","","IEEE","IEEE Journals"
"A Pragmatic Coded Modulation Scheme for High-Spectral-Efficiency Fiber-Optic Communications","B. P. Smith; F. R. Kschischang","Electrical and Computer Engineering Department, University of Toronto, Toronto, ONT, Canada; Electrical and Computer Engineering Department, University of Toronto, Toronto, ONT, Canada",Journal of Lightwave Technology,"26 Apr 2012","2012","30","13","2047","2053","A pragmatic coded modulation system is presented that incorporates signal shaping and exploits the excellent performance and efficient high-speed decoding architecture of staircase codes. Reliable communication within 0.62 bits/s/Hz of the estimated capacity (per polarization) of a system with L=2000 km is provided by the proposed system, with an error floor below 10-20. Also, it is shown that digital backpropagation increases the achievable spectral efficiencies-relative to linear equalization-by 0.55 to 0.75 bits/s/Hz per polarization.","1558-2213","","10.1109/JLT.2012.2185683","","https://ieeexplore.ieee.org/stamp/stamp.jsp?arnumber=6138266","Channel capacity;coded modulation;digital backpropagation;forward error correction;fiber-optic communications;staircase codes","Backpropagation;Modulation;Decoding;Receivers;Mathematical model;Nonlinear optics;Equations","","67","","18","IEEE","23 Jan 2012","July1, 2012","","IEEE","IEEE Journals"
"Scalable Coding of Encrypted Images","X. Zhang; G. Feng; Y. Ren; Z. Qian","School of Communication and Information Engineering, Shanghai University, Shanghai, China; School of Communication and Information Engineering, Shanghai University, Shanghai, China; School of Communication and Information Engineering, Shanghai University, Shanghai, China; School of Communication and Information Engineering, Shanghai University, Shanghai, China",IEEE Transactions on Image Processing,"11 May 2012","2012","21","6","3108","3114","This paper proposes a novel scheme of scalable coding for encrypted images. In the encryption phase, the original pixel values are masked by a modulo-256 addition with pseudorandom numbers that are derived from a secret key. After decomposing the encrypted data into a downsampled subimage and several data sets with a multiple-resolution construction, an encoder quantizes the subimage and the Hadamard coefficients of each data set to reduce the data amount. Then, the data of quantized subimage and coefficients are regarded as a set of bitstreams. At the receiver side, while a subimage is decrypted to provide the rough information of the original content, the quantized coefficients can be used to reconstruct the detailed content with an iteratively updating procedure. Because of the hierarchical coding mechanism, the principal original content with higher resolution can be reconstructed when more bitstreams are received.","1941-0042","","10.1109/TIP.2012.2187671","","https://ieeexplore.ieee.org/stamp/stamp.jsp?arnumber=6151830","Hadamard transform;image compression;image encryption;scalable coding","Image coding;Image reconstruction;Encryption;Image resolution;Decoding;Educational institutions","","67","","17","IEEE","13 Feb 2012","June 2012","","IEEE","IEEE Journals"
"An Iterative Algorithm for Trust Management and Adversary Detection for Delay-Tolerant Networks","E. Ayday; F. Fekri","Department of Electrical and Computer Engineering, Georgia Institute of Technology, Atlanta, GA; Department of Electrical and Computer Engineering, Georgia Institute of Technology, Atlanta, GA",IEEE Transactions on Mobile Computing,"23 Jul 2012","2012","11","9","1514","1531","Delay/Disruption Tolerant Networks (DTNs) have been identified as one of the key areas in the field of wireless communication, wherein sparseness and delay are particularly high. They are emerging as a promising technology in vehicular, planetary/interplanetary, military/tactical, disaster response, underwater and satellite networks. DTNs are characterized by large end-to-end communication latency and the lack of end-to-end path from a source to its destination. These characteristics pose several challenges to the security of DTNs. Especially, Byzantine attacks in which one or more legitimate nodes have been compromised and fully controlled by the adversary can give serious damages to the network in terms of latency and data availability. Using reputation-based trust management systems is shown to be an effective way to handle the adversarial behavior in Mobile Ad hoc Networks (MANETs). However, because of the unique characteristics of DTNs, those traditional techniques do not apply to DTNs. Our main objective in this paper is to develop a robust trust mechanism and an efficient and low cost malicious node detection technique for DTNs. Inspired by our recent results on reputation management for online systems and e-commerce, we develop an iterative malicious node detection mechanism for DTNs referred as ITRM. The proposed scheme is a graph-based iterative algorithm motivated by the prior success of message passing techniques for decoding low-density parity-check codes over bipartite graphs. Applying ITRM to DTNs for various mobility models, we observed that the proposed iterative reputation management scheme is far more effective than well-known reputation management techniques such as the Bayesian framework and EigenTrust. Further, we concluded that the proposed scheme provides high data availability and packet-delivery ratio with low latency in DTNs under various adversary attacks which attempt to both undermine the trust and detection scheme and the packet delivery protocol.","1558-0660","","10.1109/TMC.2011.160","","https://ieeexplore.ieee.org/stamp/stamp.jsp?arnumber=5975152","Security;trust and reputation management;iterative algorithms;malicious node detection;delay-tolerant networks.","Peer to peer computing;Mobile computing;Ad hoc networks;Iterative decoding;Security;Iterative methods;Network security;Fault tolerance","","65","","42","IEEE","4 Aug 2011","Sept. 2012","","IEEE","IEEE Journals"
"MIMO-Aided Near-Capacity Turbo Transceivers: Taxonomy and Performance versus Complexity","S. Sugiura; S. Chen; L. Hanzo","Toyota Central Research and Development Laboratories, Inc., Nagakute, Aichi, Japan; School of Electronics and Computer Science, University of Southampton, Southampton, UK; School of Electronics and Computer Science, University of Southampton, Southampton, UK",IEEE Communications Surveys & Tutorials,"3 May 2012","2012","14","2","421","442","In this treatise, we firstly review the associated Multiple-Input Multiple-Output (MIMO) system theory and review the family of hard-decision and soft-decision based detection algorithms in the context of Spatial Division Multiplexing (SDM) systems. Our discussions culminate in the introduction of a range of powerful novel MIMO detectors, such as for example Markov Chain assisted Minimum Bit-Error Rate (MC-MBER) detectors, which are capable of reliably operating in the challenging high-importance rank-deficient scenarios, where there are more transmitters than receivers and hence the resultant channel-matrix becomes non-invertible. As a result, conventional detectors would exhibit a high residual error floor. We then invoke the Soft-Input Soft-Output (SISO) MIMO detectors for creating turbo-detected two- or three-stage concatenated SDM schemes and investigate their attainable performance in the light of their computational complexity. Finally, we introduce the powerful design tools of EXtrinsic Information Transfer (EXIT)-charts and characterize the achievable performance of the diverse near-capacity SISO detectors with the aid of EXIT charts.","1553-877X","","10.1109/SURV.2011.032511.00136","","https://ieeexplore.ieee.org/stamp/stamp.jsp?arnumber=5742779","EXIT chart;iterative detection;MIMO;multiuser detection;turbo coding;wireless communication","Detectors;Markov processes;Computational complexity;Niobium;MIMO;Multiplexing","","57","","67","IEEE","5 Apr 2011","Second Quarter 2012","","IEEE","IEEE Journals"
"Linear Precoding for MIMO Broadcast Channels With Finite-Alphabet Constraints","Y. Wu; M. Wang; C. Xiao; Z. Ding; X. Gao","National Mobile Communications Research Laboratory, South East University, Nanjing, China; Department of Electrical and Computer Engineering, Missouri University of Science and Technology, Rolla, MO, USA; Department of Electrical and Computer Engineering, Missouri University of Science and Technology, Rolla, MO, USA; South East University, China; National Mobile Communications Research Laboratory, South East University, Nanjing, China",IEEE Transactions on Wireless Communications,"20 Aug 2012","2012","11","8","2906","2920","We investigate the design of linear transmit precoder for multiple-input multiple-output (MIMO) broadcast channels (BC) with finite alphabet input signals. We first derive an explicit expression for the achievable rate region of the MIMO BC with discrete constellation inputs, which is generally applicable to cases involving arbitrary user number and arbitrary antenna number. We further present a weighted sum rate upper bound of the MIMO BC with identical transmit precoding matrices. The resulting bound exhibits a serious performance loss because of the non-uniquely decodable transmit signals for MIMO BC with finite alphabet inputs in high signal-to-noise ratio (SNR) region. This performance loss motivates the use of a simple precoding to combat the non-unique decodability. Based on a constrained optimization problem formulation, we apply the Karush-Kuhn-Tucker analysis to derive necessary conditions for MIMO BC precoders to maximize the weighted sum-rate. We then propose an iterative gradient descent algorithm with backtracking line search to optimize the linear precoders for each user. Our { simulation} results under the practical transmit symbols of discrete constellations demonstrate significant gains by the proposed algorithm over other precoding schemes including the traditional iterative water-filling (WF) design for the Gaussian input signals. For the low-density parity-check coded systems, our precoder provides considerably coded BER improvement through iterative decoding and detection.","1558-2248","","10.1109/TWC.2012.060412.111806","","https://ieeexplore.ieee.org/stamp/stamp.jsp?arnumber=6213037","Broadcast channel;finite-alphabet signaling;MIMO;transmit precoding","MIMO;Signal to noise ratio;Modulation;Vectors;Optimization;Educational institutions;Interference","","56","","40","IEEE","6 Jun 2012","August 2012","","IEEE","IEEE Journals"
"Polar Codes for Cooperative Relaying","R. Blasco-Serrano; R. Thobaben; M. Andersson; V. Rathi; M. Skoglund","Communication Theory Laboratory, School of Electrical Engineering and ACCESS Linnaeus Centre, KTH Royal Institute of Technology, Stockholm, Sweden; Communication Theory Laboratory, School of Electrical Engineering and ACCESS Linnaeus Centre, KTH Royal Institute of Technology, Stockholm, Sweden; Communication Theory Laboratory, School of Electrical Engineering and ACCESS Linnaeus Centre, KTH Royal Institute of Technology, Stockholm, Sweden; Nvidia Corporation, Bristol, UK; Communication Theory Laboratory, School of Electrical Engineering and ACCESS Linnaeus Centre, KTH Royal Institute of Technology, Stockholm, Sweden",IEEE Transactions on Communications,"29 Nov 2012","2012","60","11","3263","3273","We consider the symmetric discrete memoryless relay channel with orthogonal receiver components and show that polar codes are suitable for decode-and-forward and compress-and-forward relaying. In the first case we prove that polar codes are capacity achieving for the physically degraded relay channel; for stochastically degraded relay channels our construction provides an achievable rate. In the second case we construct sequences of polar codes that achieve the compress-and-forward rate by nesting polar codes for source compression into polar codes for channel coding. In both cases our constructions inherit most of the properties of polar codes. In particular, the encoding and decoding algorithms and the bound on the block error probability O(2-Nβ) which holds for any 0<;β<;1/2.","1558-0857","","10.1109/TCOMM.2012.081412.110266","","https://ieeexplore.ieee.org/stamp/stamp.jsp?arnumber=6276210","Polar codes;relay channel;compress-and-forward;decode-and-forward;cooperative communication","Relays;Encoding;Vectors;Receivers;Decoding;Error probability;Strontium","","55","5","25","IEEE","21 Aug 2012","November 2012","","IEEE","IEEE Journals"
