"Document Title",Authors,"Author Affiliations","Publication Title",Date Added To Xplore,"Publication Year","Volume","Issue","Start Page","End Page","Abstract","ISSN",ISBNs,"DOI",Funding Information,PDF Link,"Author Keywords","IEEE Terms","Mesh_Terms",Article Citation Count,Patent Citation Count,"Reference Count","License",Online Date,Issue Date,"Meeting Date","Publisher",Document Identifier
"Counting Short Cycles of Quasi Cyclic Protograph LDPC Codes","M. Karimi; A. H. Banihashemi","Department of Systems and Computer Engineering, Carleton University, Ottawa, ONT, Canada; Department of Systems and Computer Engineering, Carleton University, Ottawa, ONT, Canada",IEEE Communications Letters,"9 Mar 2012","2012","16","3","400","403","An efficient method for counting short cycles in the Tanner graphs of quasi cyclic (QC) protograph low-density parity-check (LDPC) codes is presented. The method is based on the relationship between the number of short cycles in the graph and the eigenvalues of the directed edge matrix of the graph. We demonstrate that for a QC protograph LDPC code, the complexity of computing such eigenvalues can be reduced significantly by representing the directed edge matrix as a block circulant matrix. Numerical results are presented to show the lower complexity of the proposed method compared to the existing algorithms for counting short cycles. These results also reveal that QC LDPC codes on average have a superior short cycle and girth distribution compared to similar randomly constructed codes.","1558-2558","","10.1109/LCOMM.2012.020212.112311","","https://ieeexplore.ieee.org/stamp/stamp.jsp?arnumber=6150653","Low-density parity-check (LDPC) codes;quasi cyclic (QC) LDPC codes;protograph LDPC codes;girth;short cycles;short cycle distribution;girth distribution;counting short cycles","Parity check codes;Eigenvalues and eigenfunctions;Complexity theory;IEEE 802.11 Standards;Labeling;Symmetric matrices;Bipartite graph","","30","","20","IEEE","10 Feb 2012","March 2012","","IEEE","IEEE Journals"
"Turbo Equalization Effect for Nonbinary LDPC Code in BPM R/W Channel","Y. Nakamura; Y. Bandai; Y. Okamoto; H. Osawa; H. Aoi; H. Muraoka","Graduate School of Science and Engineering, Ehime University, Matsuyama, Japan; Graduate School of Science and Engineering, Ehime University, Matsuyama, Japan; Graduate School of Science and Engineering, Ehime University, Matsuyama, Japan; Graduate School of Science and Engineering, Ehime University, Matsuyama, Japan; The Research Institute of Electrical Communication, University of Tohoku, Sendai, Japan; The Research Institute of Electrical Communication, University of Tohoku, Sendai, Japan",IEEE Transactions on Magnetics,"18 Oct 2012","2012","48","11","4602","4605","It is expected for the nonbinary low-density parity-check (LDPC) coding and iterative decoding system to introduce the turbo equalization in order to enhance the error correction ability in the bit-patterned medium (BPM) R/W channel. In this paper, we investigate the effect of the turbo equalization on the bit-error rate (BER) performance of nonbinary LDPC coding and iterative decoding system over Galois filed GF(28) in BPM R/W channel with write-error at an areal recording density of 2 Tbit/inch2 considering the coding rate loss. The performance of turbo equalization using the nonbinary LDPC coding and iterative decoding system is evaluated by computer simulation, and it is compared to that without turbo equalization. The results show that the nonbinary LDPC and iterative decoding system with the turbo equalization has the larger write-margin compared to that without turbo equalization.","1941-0069","","10.1109/TMAG.2012.2194989","","https://ieeexplore.ieee.org/stamp/stamp.jsp?arnumber=6332861","Bit-patterned media (BPM);nonbinary low-density parity-check (LDPC) code;turbo equalization","Encoding;Decoding;Iterative decoding;Magnetic recording;Bit error rate;Magnetic heads","","6","","13","IEEE","18 Oct 2012","Nov. 2012","","IEEE","IEEE Journals"
"Nonbinary LDPC Code Decoder Architecture With Efficient Check Node Processing","K. He; J. Sha; Z. Wang","Institute of VLSI Design, School of Electronic Science and Engineering, Nanjing University, Nanjing, China; Institute of VLSI Design, School of Electronic Science and Engineering, Nanjing University, Nanjing, China; Broadcom Corporation, Irvine, CA, USA",IEEE Transactions on Circuits and Systems II: Express Briefs,"12 Jun 2012","2012","59","6","381","385","Nonbinary low-density parity-check (NB-LDPC) codes are an extension of binary LDPC codes with significantly better performance. Although various kinds of low-complexity iterative decoding algorithms have been proposed, the VLSI implementation of NB-LDPC decoders still remains a big challenge due to its high complexity and long latency. In this brief, a highly efficient check node processing scheme, which the processing delay greatly reduced, is proposed for Min-max decoding algorithm. Thereafter, an efficient check node unit (CNU) can be designed. Compared with previous works, the latency of the CNU could be reduced to less than 52%. In addition, a decoder for a (620, 310) NB-LDPC code is designed to demonstrate the efficiency of the presented techniques.","1558-3791","","10.1109/TCSII.2012.2195058","","https://ieeexplore.ieee.org/stamp/stamp.jsp?arnumber=6204079","Low-density parity-check (LDPC) codes;min–max decoding;nonbinary;VLSI design","Decoding;Computer architecture;Vectors;Iterative decoding;Complexity theory;Algorithm design and analysis","","9","","13","IEEE","23 May 2012","June 2012","","IEEE","IEEE Journals"
"Cyclic and Quasi-Cyclic LDPC Codes on Constrained Parity-Check Matrices and Their Trapping Sets","Q. Huang; Q. Diao; S. Lin; K. Abdel-Ghaffar","School of Electronic and Information Engineering, Beihang University, Beijing, China; Department of Electrical and Computer Engineering, University of California, Davis, CA, USA; Department of Electrical and Computer Engineering, University of California, Davis, CA, USA; Department of Electrical and Computer Engineering, University of California, Davis, CA, USA",IEEE Transactions on Information Theory,"18 Apr 2012","2012","58","5","2648","2671","This paper is concerned with construction and structural analysis of both cyclic and quasi-cyclic codes, particularly low-density parity-check (LDPC) codes. It consists of three parts. The first part shows that a cyclic code given by a parity-check matrix in circulant form can be decomposed into descendant cyclic and quasi-cyclic codes of various lengths and rates. Some fundamental structural properties of these descendant codes are developed, including the characterization of the roots of the generator polynomial of a cyclic descendant code. The second part of the paper shows that cyclic and quasi-cyclic descendant LDPC codes can be derived from cyclic finite-geometry LDPC codes using the results developed in the first part of the paper. This enlarges the repertoire of cyclic LDPC codes. The third part of the paper analyzes the trapping set structure of regular LDPC codes whose parity-check matrices satisfy a certain constraint on their rows and columns. Several classes of finite-geometry and finite-field cyclic and quasi-cyclic LDPC codes with large minimum distances are shown to have no harmful trapping sets of size smaller than their minimum distances. Consequently, their error-floor performances are dominated by their minimum distances.","1557-9654","","10.1109/TIT.2011.2179842","","https://ieeexplore.ieee.org/stamp/stamp.jsp?arnumber=6135499","Circulant decomposition;cyclic code;finite-geometry (FG) code;low-density parity-check (LDPC) code;orthogonal parity-check sums;quasi-cyclic (QC) code;row–column (RC)-constrained LDPC code;trapping set","Parity check codes;Arrays;Generators;Polynomials;Null space;Matrix decomposition;Decoding","","92","","84","IEEE","23 Jan 2012","May 2012","","IEEE","IEEE Journals"
"Interleaved Product LDPC Codes","M. Baldi; G. Cancellieri; F. Chiaraluce","Dipartimento di Ingegneria dellInformazione, Università Politecnica delle Marche, Ancona, Italy; Dipartimento di Ingegneria dellInformazione, Università Politecnica delle Marche, Ancona, Italy; Dipartimento di Ingegneria dellInformazione, Università Politecnica delle Marche, Ancona, Italy",IEEE Transactions on Communications,"12 Apr 2012","2012","60","4","895","901","Product LDPC codes take advantage of LDPC decoding algorithms and the high minimum distance of product codes. We propose to add suitable interleavers to improve the waterfall performance of LDPC decoding. Interleaving also reduces the number of low weight codewords, that gives a further advantage in the error floor region.","1558-0857","","10.1109/TCOMM.2012.030712.100173","","https://ieeexplore.ieee.org/stamp/stamp.jsp?arnumber=6168203","Product codes;LDPC codes;Interleavers","Product codes;Encoding;Algorithm design and analysis;Iterative decoding;Decoding;Arrays","","18","","20","IEEE","12 Mar 2012","April 2012","","IEEE","IEEE Journals"
"Construction of Binary LDPC Convolutional Codes Based on Finite Fields","L. Mu; X. Liu; C. Liang","Department of Electronic and Communications Engineering, Sun Yat-sen University, Guangzhou, China; Department of Electronic and Communications Engineering, Sun Yat-sen University, Guangzhou, China; Department of Electronic and Communications Engineering, Sun Yat-sen University, Guangzhou, China",IEEE Communications Letters,"11 Jun 2012","2012","16","6","897","900","Using a finite field approach, a novel algebraic construction of low-density parity-check (LDPC) convolutional codes with fast encoding property is proposed. According to the matrices of quasi-cyclic (QC) codes constructed based on the multiplicative groups of finite fields and the algebraic property that a binary circulant matrix is isomorphic to a finite ring, we first generate a polynomial-form parity-check matrix of an LDPC convolutional code under a given rate over a given finite field. Then some related modifications are made upon the original polynomial-form matrix to obtain the new one with fast encoding property. Simulation results show that the proposed LDPC convolutional codes have good performance with the iterative belief propagation decoding algorithm.","1558-2558","","10.1109/LCOMM.2012.040912.112352","","https://ieeexplore.ieee.org/stamp/stamp.jsp?arnumber=6185512","Finite fields;low-density parity-check (LDPC) convolutional codes;fast encoding;belief propagation","Parity check codes;Convolutional codes;Block codes;Polynomials;Simulation;Bit error rate","","6","","6","IEEE","17 Apr 2012","June 2012","","IEEE","IEEE Journals"
"EXIT-Aided Bit Mapping Design for LDPC Coded Modulation with APSK Constellations","T. Cheng; K. Peng; J. Song; K. Yan","Tsinghua National Laboratory for Information Science and Technology (TNList), Department of Electronic Engineering, Tsinghua University, Beijing, China; Tsinghua National Laboratory for Information Science and Technology (TNList), Department of Electronic Engineering, Tsinghua University, Beijing, China; Tsinghua National Laboratory for Information Science and Technology (TNList), Department of Electronic Engineering, Tsinghua University, Beijing, China; Tsinghua National Laboratory for Information Science and Technology (TNList), Department of Electronic Engineering, Tsinghua University, Beijing, China",IEEE Communications Letters,"11 Jun 2012","2012","16","6","777","780","In this paper, the bit mapping technique is applied to the low-density parity-check (LDPC) coded modulation system with Gray-APSK constellations for the first time. A multi-grid searching algorithm (MGSA) based on extrinsic information transfer (EXIT) chart analysis is first proposed to optimize the bit mapping distribution, after which a low-complexity bit mapper consisting of a structural bit interleaver and a demultiplexer (DEMUX) is devised. Compared to the LDPC coded QAM system specified in DVB-T2, the proposed APSK system with the optimized DEMUX can achieve up to 0.83dB gain under additive white Gaussian noise (AWGN) channel.","1558-2558","","10.1109/LCOMM.2012.041112.112436","","https://ieeexplore.ieee.org/stamp/stamp.jsp?arnumber=6188493","Bit mapping;LDPC;Gray-APSK;EXIT","Parity check codes;Bit error rate;Digital video broadcasting;Signal to noise ratio;Decoding;Quadrature amplitude modulation","","33","","12","IEEE","20 Apr 2012","June 2012","","IEEE","IEEE Journals"
"LDPC-Based Lossless Compression of Nonstationary Binary Sources Using Sliding-Window Belief Propagation","Y. Fang","College of Information Engineering, Northwest Agriculture and Forestry University, Yangling, Shaanxi, China",IEEE Transactions on Communications,"29 Nov 2012","2012","60","11","3161","3166","Low-density parity-check (LDPC) codes have been used to implement lossless distributed or conventional source coding. However, block-wise LDPC codes are difficult to adapt to varying source statistics as traditional symbol-wise entropy coding techniques. In this paper, we propose the sliding-window belief propagation (SWBP) algorithm which is able to simultaneously recover the source and refine the estimate of varying source statistics. The SWBP is easy to implement and performs well in simulations.","1558-0857","","10.1109/TCOMM.2012.080212.110108A","","https://ieeexplore.ieee.org/stamp/stamp.jsp?arnumber=6266765","Lossless source coding;LDPC;belief propagation;correlation estimation;Slepian-Wolf coding","Decoding;Standards;Belief propagation;Entropy;Complexity theory;Parity check codes;Probability","","17","","17","IEEE","13 Aug 2012","November 2012","","IEEE","IEEE Journals"
"Joint Shortening and Puncturing Optimization for Structured LDPC Codes","Y. Wei; Y. Yang; M. Jiang; W. Chen; L. Wei","Department of Electronic Engineering, Shanghai Jiaotong University, Shanghai, China; Department of Electronic Engineering, Shanghai Jiaotong University, Shanghai, China; National Mobile Communications Research Laboratory, South East University, Nanjing, China; Department of Electronic Engineering, Shanghai Jiaotong University, Shanghai, China; Department of Electronic Engineering, Shanghai Jiaotong University, Shanghai, China",IEEE Communications Letters,"12 Dec 2012","2012","16","12","2060","2063","The demand for flexible broadband wireless services makes the pruning technique, including both shortening and puncturing, an indispensable component of error correcting codes. The analysis of the pruning process for structured low-density parity-check (LDPC) codes can be considerably simplified with their equivalent representations through base-matrices or protographs. In this letter, we evaluate the thresholds of the pruned base-matrices by using protograph based on extrinsic information transfer (PEXIT). We also provide an efficient method to optimize the pruning patterns, which can significantly improve the thresholds of both the full-length patterns and the sub-patterns. Numerical results show that the structured LDPC codes pruned by the improved patterns outperform those with the existing patterns.","1558-2558","","10.1109/LCOMM.2012.101712.122145","","https://ieeexplore.ieee.org/stamp/stamp.jsp?arnumber=6336859","LDPC codes;shortening;puncturing;protograph;PEXIT","Parity check codes;IEEE 802.11n Standard;Optimized production technology;IEEE 802.16 Standards;Simulation","","11","1","21","IEEE","22 Oct 2012","December 2012","","IEEE","IEEE Journals"
"A PEG Construction of Finite-Length LDPC Codes with Low Error Floor","S. Khazraie; R. Asvadi; A. H. Banihashemi","Department of Electrical Engineering, Sharif University of Technology, Tehran, Iran; Department of Electrical and Computer Engineering, K. N. Toosi University of Technology, Tehran, Iran; Broadband Communications and Wireless Systems (BCWS) Center, Department of Systems and Computer Engineering, Carleton University, Ottawa, ONT, Canada",IEEE Communications Letters,"15 Aug 2012","2012","16","8","1288","1291","The progressive-edge-growth (PEG) algorithm of Hu et al. is modified to improve the error floor performance of the constructed low-density parity-check (LDPC) codes. To improve the error floor, the original PEG algorithm is equipped with an efficient algorithm to find the dominant elementary trapping sets (ETS's) that are added to the Tanner graph of the under-construction code by the addition of each variable node and its adjacent edges. The aim is to select the edges, among the candidates available at each step of the original PEG algorithm, that prevent the creation of dominant ETS's. The proposed method is applicable to both regular and irregular variable node degree distributions. Simulation results are presented to demonstrate the superior ETS distribution and error floor performance of the constructed codes compared to similar codes constructed by the original and other modifications of the PEG algorithm.","1558-2558","","10.1109/LCOMM.2012.060112.120844","","https://ieeexplore.ieee.org/stamp/stamp.jsp?arnumber=6211373","Low density parity-check (LDPC) codes;trapping sets;elementary trapping sets;error floor;progressive edge growth (PEG) algorithm;code construction","Parity check codes;Charge carrier processes;Bit error rate;Accuracy;Simulation;Algorithm design and analysis;Search problems","","35","","11","IEEE","4 Jun 2012","August 2012","","IEEE","IEEE Journals"
"Low-Latency Reweighted Belief Propagation Decoding for LDPC Codes","J. Liu; R. C. de Lamare","Department of Electronics, University of York, York, UK; Department of Electronics, University of York, York, UK",IEEE Communications Letters,"15 Oct 2012","2012","16","10","1660","1663","In this paper we propose a novel message passing algorithm which exploits the existence of short cycles to obtain performance gains by reweighting the factor graph. The proposed decoding algorithm is called variable factor appearance probability belief propagation (VFAP-BP) algorithm and is suitable for wireless communications applications with low-latency and short blocks. Simulation results show that the VFAP-BP algorithm outperforms the standard BP algorithm, and requires a significantly smaller number of iterations when decoding either general or commercial LDPC codes.","1558-2558","","10.1109/LCOMM.2012.080312.121307","","https://ieeexplore.ieee.org/stamp/stamp.jsp?arnumber=6261588","Belief propagation;reweighting the factor graph;message passing;low-latency;commercial LDPC codes","Standards;Iterative decoding;Decoding;Message passing;Convergence;Approximation algorithms","","30","","11","IEEE","6 Aug 2012","October 2012","","IEEE","IEEE Journals"
"Optimal Design of a Gallager B Noisy Decoder for Irregular LDPC Codes","S. M. S. T. Yazdi; C. -H. Huang; L. Dolecek","EE Department, University of California, Los Angeles, USA; EE Department, University of California, Los Angeles, USA; EE Department, University of California, Los Angeles, USA",IEEE Communications Letters,"12 Dec 2012","2012","16","12","2052","2055","In this letter, we study the performance of a noisy Gallager B decoder used to decode irregular low-density parity-check (LDPC) codes. We derive the final bit error rate (BER) as a function of both the transmission noise and processing errors. We allow different components of the decoder associated with certain computational units (i.e., bit and check nodes of varying degrees) to have different processing errors. We formulate an optimization problem to distribute available processing resources across different components of a noisy decoder to achieve minimal BER. Simulations demonstrate that the optimal resource allocation derived from our analysis outperforms uninformed (random) resource assignment.","1558-2558","","10.1109/LCOMM.2012.101712.121953","","https://ieeexplore.ieee.org/stamp/stamp.jsp?arnumber=6336856","LDPC decoder;Gallager B algorithm;noisy hardware;irregular codes;density evolution","Decoding;Program processors;Noise measurement;Parity check codes;Bit error rate;Hardware","","25","","10","IEEE","22 Oct 2012","December 2012","","IEEE","IEEE Journals"
"Efficient Stochastic Decoding of Non-Binary LDPC Codes with Degree-Two Variable Nodes","G. Sarkis; W. J. Gross","Department of Electrical and Computer Engineering, McGill University, Montreal, QUE, Canada; Department of Electrical and Computer Engineering, McGill University, Montreal, QUE, Canada",IEEE Communications Letters,"9 Mar 2012","2012","16","3","389","391","In this letter, we present an optimized version of the relaxed half-stochastic (RHS) algorithm targeted at non-binary LDPC codes with a variable node degree equal to two. The new algorithm has significantly fewer multiplications while maintaining an error-correction performance and a decoding iteration count identical to those of the original.","1558-2558","","10.1109/LCOMM.2011.122211.111737","","https://ieeexplore.ieee.org/stamp/stamp.jsp?arnumber=6120101","LDPC codes;non-binary;stochastic decoding","Decoding;Complexity theory;Equations;Iterative decoding;Vectors;Mathematical model","","17","","9","IEEE","30 Dec 2011","March 2012","","IEEE","IEEE Journals"
"Nonbinary multiple rate QC-LDPC codes with fixed information or block bit length","L. Liu; W. Zhou; S. Zhou","Wireless Information Network Laboratory, Department of Electrical Engineering and Information Science, University of Science and Technology of China, Hefei, China; Wireless Information Network Laboratory, Department of Electrical Engineering and Information Science, University of Science and Technology of China, Hefei, China; Department of Electrical and Computer Engineering, University of Connecticut, USA",Journal of Communications and Networks,"31 Aug 2012","2012","14","4","429","433","In this paper, we consider nonbinary quasi-cyclic low-density parity-check (QC-LDPC) codes and propose a method to design multiple rate codes with either fixed information bit length or block bit length, tailored to different scenarios in wireless applications. We show that the proposed codes achieve good performance over a broad range of code rates.","1976-5541","","10.1109/JCN.2012.6292249","","https://ieeexplore.ieee.org/stamp/stamp.jsp?arnumber=6292249","Low-density parity-check (LDPC) codes;multiple rates;nonbinary;quasi-cyclic (QC)","Parity check codes;Phase change materials;Decoding;Encoding;Educational institutions;Wireless communication;Electrical engineering","","8","","15","","31 Aug 2012","Aug. 2012","","KICS","KICS Journals"
"Serial Symbol-Reliability Based Algorithm for Decoding Non-Binary LDPC Codes","F. Garcia-Herrero; M. J. Canet; J. Valls; M. F. Flanagan","Instituto de Telecomunicaciones y Aplicaciones Multimedia, Universidad Politecnica de Valencia, Gandia, Spain; Instituto de Telecomunicaciones y Aplicaciones Multimedia, Universidad Politecnica de Valencia, Gandia, Spain; Instituto de Telecomunicaciones y Aplicaciones Multimedia, Universidad Politecnica de Valencia, Gandia, Spain; School of Electrical, Electronic and Communications Engineering, University College Dublin, Dublin, Ireland",IEEE Communications Letters,"11 Jun 2012","2012","16","6","909","912","A symbol-reliability based decoding algorithm with serial schedule for non-binary low-density parity-check (LDPC) codes is presented. Performance results, together with implementation complexity analysis, are provided for different sample codes. The proposed algorithm achieves a similar gain to the min- max algorithm for codes with column weight dv ≥ 6, with lower complexity than previous symbol-reliability based algorithms.","1558-2558","","10.1109/LCOMM.2012.040912.120423","","https://ieeexplore.ieee.org/stamp/stamp.jsp?arnumber=6185522","Nonbinary low-density parity-check (LDPC) code;symbol-reliability based algorithm;iterative serial decoding","Complexity theory;Vectors;Iterative decoding;Encoding;Algorithm design and analysis;Decoding","","8","","8","IEEE","17 Apr 2012","June 2012","","IEEE","IEEE Journals"
"Rate-Compatible LDPC Convolutional Codes Achieving the Capacity of the BEC","Z. Si; R. Thobaben; M. Skoglund","School of Electrical Engineering and the ACCESS Linnaeus Center, Royal Institute of Technology, Stockholm, Sweden; School of Electrical Engineering and the ACCESS Linnaeus Center, Royal Institute of Technology, Stockholm, Sweden; School of Electrical Engineering and the ACCESS Linnaeus Center, Royal Institute of Technology, Stockholm, Sweden",IEEE Transactions on Information Theory,"15 May 2012","2012","58","6","4021","4029","In this paper, we propose a new family of rate-compatible regular low-density parity-check (LDPC) convolutional codes. The construction is based on graph extension, i.e., the codes of lower rates are generated by successively extending the graph of the base code with the highest rate. Theoretically, the proposed rate-compatible family can cover all the rational rates from 0 to 1. In addition, the regularity of degree distributions simplifies the code optimization. We prove analytically that all the LDPC convolutional codes of different rates in the family are capable of achieving the capacity of the binary erasure channel (BEC). The analysis is extended to the general binary memoryless symmetric channel, for which a capacity-approaching performance can be achieved. Analytical thresholds and simulation results for finite check and variable node degrees are provided for both BECs and binary-input additive white Gaussian noise channels. The results confirm that the decoding thresholds of the rate-compatible codes approach the corresponding Shannon limits over both channels.","1557-9654","","10.1109/TIT.2012.2188990","","https://ieeexplore.ieee.org/stamp/stamp.jsp?arnumber=6157623","Graph extension;low-density parity-check (LDPC) codes;LDPC convolutional codes;rate-compatible codes;Shannon limit","Parity check codes;Convolutional codes;Optimization;Joining processes;Decoding;Xenon;Encoding","","33","","19","IEEE","24 Feb 2012","June 2012","","IEEE","IEEE Journals"
