"Universal Multiterminal Source Coding Algorithms With Asymptotically Zero Feedback: Fixed Database Case","E. -h. Yang; D. -K. He; T. Uyematsu; R. W. Yeung","Department of Electrical and Computer Engineering, University of Waterloo, Waterloo, ONT, Canada; Research In Motion/SlipStream, Waterloo, ONT, Canada; Department of Communications and Integrated Systems, Tokyo Institute of Technology, Tokyo, Japan; Department of Information Engineering, Chinese University of Hong Kong, New Territories, Hong Kong, China",IEEE Transactions on Information Theory,"25 Nov 2008","2008","54","12","5575","5590","Consider a source network in which a finite alphabet source X = {Xi}i=0 infin is to be encoded and transmitted, and another finite alphabet source Y = {Xi}i=0 infin correlated with X is available only to the decoder as side information. Traditionally, the channel between the encoder and decoder in the source network is assumed to be one-way. This, together with the fact that the encoder does not have access to Y, implies that the encoder has to know the achievable rates before encoding. In this paper, we consider universal source coding for a feedback source network in which the channel between the encoder and decoder is two-way and asymmetric. Assume that the encoder and decoder share a random database that is independent of both X and Y. A string matching-based (variable-rate) block coding algorithm with simple progressive encoding and joint typicality decoding is first proposed for the feedback source network. The simple progressive encoder does not need to know the achievable rates at the beginning of encoding. It is proven that for any (X, Y) in a large class of sources satisfying some mixing conditions, the average number of bits per letter transmitted from the encoder to the decoder (compression rate) goes to the conditional entropy H(X | Y) of X given Y asymptotically, and at the same time the average number of bits per letter transmitted from the decoder to the encoder (feedback rate) goes to 0 asymptotically. The algorithm and the corresponding analysis results are then extended to the case where both X and Y are to be encoded separately, but decoded jointly. Finally, a universal decoding algorithm is proposed to replace the joint typicality decoding, and the resulting universal compression algorithm consisting of the simple progressive encoder and the universal decoding algorithm is further shown to be asymptotically optimal for the class of all jointly memoryless source-side information pairs (X,Y).","1557-9654","","10.1109/TIT.2008.2006449","","https://ieeexplore.ieee.org/stamp/stamp.jsp?arnumber=4675724","Database;distributed source coding;entropy;feedback;$\phi$-mixing;string matching;universal data compression","Source coding;Feedback;Databases;Decoding;Entropy;Block codes;Algorithm design and analysis;Compression algorithms;Councils","","11","","28","IEEE","25 Nov 2008","Dec. 2008","","IEEE","IEEE Journals"
"Low complexity decoding for Raptor codes for hybrid-ARQ systems","J. Heo; S. W. Kim; J. T. Kim; J. Y. Kim","School of Electrical Engineering, Korea University, Seoul, Korea; Department of Electronics Engineering, Konkuk University, Seoul, Korea; Department of Electronics Engineering, Konkuk University, Seoul, Korea; Department of Radio Science and Engineering, Kwangwoon University, Seoul, Korea",IEEE Transactions on Consumer Electronics,"15 Jul 2008","2008","54","2","390","395","In this paper we present a low complexity decoding algorithm for Raptor codes which is used for incremental redundancy hybrid ARQ schemes. Encoding and decoding Raptor codes are the processes of making encoding symbols from the source symbols and the recovery of the source symbols from the received encoding symbols transmitted through an erasure channel, respectively. If the received encoding symbols are insufficient to recover the source symbols, additional encoding symbols are delivered and decoded with the previously received encoding symbols. We propose a low complexity decoding algorithm which efficiently combines the previously received encoding symbols and incremental encoding symbols. The proposed algorithm has excellent potential for realizing low power operation and higher throughput transmission due to its highly reduced computational complexity.","1558-4127","","10.1109/TCE.2008.4560104","","https://ieeexplore.ieee.org/stamp/stamp.jsp?arnumber=4560104","","Decoding;Encoding;Automatic repeat request;Parity check codes;Throughput;Computational complexity;Digital multimedia broadcasting;Multimedia communication;Channel capacity;IPTV","","11","","9","IEEE","15 Jul 2008","May 2008","","IEEE","IEEE Journals"
"Multilevel Optical Systems With MLSD Receivers Insensitive to GVD and PMD","G. Colavolpe; T. Foggi; E. Forestieri; G. Prati","Dipartimento di Ingegneria dell Informazione, University of Parma, Parma, Italy; CNIT Research Unit, Parma, Italy; Scuola Superiore Sant'' Anna, Pisa, Italy; Scuola Superiore Sant'' Anna, Pisa, Italy",Journal of Lightwave Technology,"13 Jun 2008","2008","26","10","1263","1273","This paper analyzes optical transmission systems based on high-order modulations such as phase-shift keying signals and quadrature amplitude modulations. When the channel is affected by group velocity dispersion (GVD), polarization mode dispersion (PMD), and phase uncertainties due to the laser phase noise, the optimal receiver processing based on maximum-likelihood sequence detection and its practical implementation through a Viterbi processor is described without a specific constraint on the receiver front end. The implementation issues are then faced, showing that at least a couple of widely known front ends, with proper modifications, can be used to extract the required sufficient statistics from the received signal. The aspects related to the receiver adaptivity, the complexity reduction of the Viterbi processor, and the possibility of employing polarization diversity at the transmitter end are also discussed. It is demonstrated that, as long as a sufficient number of Viterbi processor trellis states is employed, GVD and PMD entail no performance degradation with respect to the case of no channel distortions (the back-to-back case).","1558-2213","","10.1109/JLT.2008.917052","","https://ieeexplore.ieee.org/stamp/stamp.jsp?arnumber=4542901","Differential encoding;electrical equalization;group velocity dispersion (GVD);intersymbol interference (ISI);maximum-likelihood sequence detection (MLSD);optical transmission systems;phase-shift keying (PSK);polarization mode dispersion (PMD);quadrature amplitude modulation (QAM);Viterbi algorithm (VA)","Optical receivers;Optical transmitters;Viterbi algorithm;Optical distortion;Optical modulation;Quadrature amplitude modulation;Polarization mode dispersion;Signal analysis;Optical noise;Phase modulation","","11","1","39","IEEE","13 Jun 2008","May15, 2008","","IEEE","IEEE Journals"
"Scalable Joint Source and Channel Coding of Meshes","D. C. Cernea; A. Munteanu; A. Alecu; J. Cornelis; P. Schelkens","Department of Electronics and Informatics, Interdisciplinary Institute for Broadband Technology, Vrije Universiteit Brussel, Belgium; Department of Electronics and Informatics, Interdisciplinary Institute for Broadband Technology, Vrije Universiteit Brussel, Belgium; Department of Electronics and Informatics, Interdisciplinary Institute for Broadband Technology, Vrije Universiteit Brussel, Belgium; Belgium; Department of Electronics and Informatics, Interdisciplinary Institute for Broadband Technology, Vrije Universiteit Brussel, Belgium",IEEE Transactions on Multimedia,"21 Mar 2008","2008","10","3","503","513","This paper proposes a new approach for joint source and channel coding (JSCC) of meshes, simultaneously providing scalability and optimized resilience against transmission errors. An unequal error protection approach is followed, to cope with the different error-sensitivity levels characterizing the various resolution and quality layers produced by the input scalable source codec. The number of layers and the protection levels to be employed for each layer are determined by solving a joint source and channel coding problem. In this context, a novel fast algorithm for solving the optimization problem is conceived, enabling a real-time implementation of the JSCC rate-allocation. An instantiation of the proposed JSCC approach is demonstrated for MeshGrid, which is a scalable 3-D object representation method, part of MPEG-4 AFX. In this context, the L-inflnite distortion metric is employed, which is to our knowledge a unique feature in mesh coding. Numerical results show the superiority of the L-inflnite norm over the classical L-2 norm in a JSCC setting. One concludes that the proposed joint source and channel coding approach offers resilience against transmission errors, provides graceful degradation, enables a fast real-time implementation, and preserves all the scalability features and animation capabilities of the employed scalable mesh codec.","1941-0077","","10.1109/TMM.2008.917407","","https://ieeexplore.ieee.org/stamp/stamp.jsp?arnumber=4456690","Error resilient coding;joint source and channel coding of meshes;L-infinite coding;MeshGrid;three-dimensional (3-D) graphics;unequal error protection","Channel coding;Protection;MPEG 4 Standard;Computer graphics;Decoding;Scalability;Resilience;Error correction codes;Codecs;Degradation","","10","","29","IEEE","21 Mar 2008","April 2008","","IEEE","IEEE Journals"
"A High-Throughput Maximum a Posteriori Probability Detector","R. Ratnayake; A. Kavcic; G. -Y. Wei","School of Engineering and Applied Sciences, Harvard University, Cambridge, MA, USA; Department of Electrical Engineering, University of Hawai, Honolulu, HI, USA; School of Engineering and Applied Sciences, Harvard University, Cambridge, MA, USA",IEEE Journal of Solid-State Circuits,"25 Jul 2008","2008","43","8","1846","1858"," This paper presents a maximum a posteriori probability (MAP) detector, based on a forward-only algorithm that can achieve high throughputs. The MAP algorithm is optimal in terms of bit error rate (BER) performance and, with Turbo processing, can approach performance close to the channel capacity limit. The implementation benefits from optimizations performed at both algorithm and circuit level. The proposed detector utilizes a deep-pipelined architecture implemented in skew-tolerant domino and experimentally measured results verify the detector can achieve throughputs greater than 750 Mb/s while consuming 2.4 W. The 16-state EEPR4 channel detector is implemented in a 0.13$\ \mu{\hbox {m}}$  CMOS technology and has a core area of 7.1  ${\hbox {mm}}^{2}$. ","1558-173X","","10.1109/JSSC.2008.925404","","https://ieeexplore.ieee.org/stamp/stamp.jsp?arnumber=4578762","Architectures;BCJR algorithm;forward-only algorithm;iterative processing;maximum a posteriori probability algorithm;turbo;VLSI","Detectors;Signal processing algorithms;Iterative algorithms;Bit error rate;Throughput;Viterbi algorithm;Latches;Circuits;CMOS technology;Very large scale integration","","10","8","24","IEEE","25 Jul 2008","Aug. 2008","","IEEE","IEEE Journals"
"Cooperation over frequency-selective fading relay channels","J. Hu; T. M. Duman","Qualcomm, Inc., San Diego, CA, USA; Electrical Engineering Department, Arizona State University, Tempe, AZ, USA",IEEE Transactions on Wireless Communications,"22 Dec 2008","2008","7","12","5072","5081","We study information-rate calculations and coded cooperation strategies for relay channels with frequency-selective (FS) fading. We develop suitable channel trellises for the multiaccess and broadcast parts of the relay channel, and employ simulation-based techniques to calculate (approximate) ergodic information-rate bounds with FS Rayleigh fading. Our results show that frequency selectivity provides higher information rates than flat fading when the fading coefficients are known at the receiver, however, the improvement becomes marginal with increasing number of channel taps (when the overall signal to noise ratio is kept constant). Furthermore, we develop a distributed turbo-coding strategy and several decode-and-forward type detection/decoding schemes to ensure successful cooperative communication where the source and the relay may transmit simultaneously. We show that with suitable coding and iterative decoding, one can approach the approximate information-rate limits closely, and that detection schemes based on MMSE criterion provide a good performance/complexity trade-off.","1558-2248","","10.1109/T-WC.2008.071141","","https://ieeexplore.ieee.org/stamp/stamp.jsp?arnumber=4712725","Achievable information rates, cooperative communication,;frequency-selective fading, relay channels, turbo;codes.","Fading;Rayleigh channels;Frequency division multiaccess;Turbo codes;Iterative decoding;Protocols;Information rates;System performance;Digital relays;Parity check codes","","10","","39","IEEE","22 Dec 2008","December 2008","","IEEE","IEEE Journals"
"An EM approach to multiple-access interference mitigation in asynchronous slow FHSS systems","X. Tan; J. M. Shea","Department of Electrical and Computer Engineering, University of Florida, Gainesville, FL, USA; Department of Electrical and Computer Engineering, University of Florida, Gainesville, FL, USA",IEEE Transactions on Wireless Communications,"18 Jul 2008","2008","7","7","2661","2670","In this paper, we apply the EM algorithm for mitigation of multi-access interference (MAI) in asynchronous slow frequency-hop spread spectrum (FHSS) systems that employ binary frequency-shift keying (BFSK) modulation. MAI occurs if the hopping patterns of the users are not orthogonal. We show that when FSK signals arrive asynchronously, the time offset exposes portions of the desired and interfering signals in a way that can be exploited to improve the decoder performance. We develop an iterative detection, estimation, and decoding scheme to recover the desired signal in the presence of MAI. We compare the performance of this algorithm with that of a conventional noncoherent BFSK transceiver and show that the EM-based algorithm is particularly effective in the presence of strong interfering signals and allows more users in a FHSS system.","1558-2248","","10.1109/TWC.2008.070084","","https://ieeexplore.ieee.org/stamp/stamp.jsp?arnumber=4570232","","Multiple access interference;Frequency shift keying;Spread spectrum communication;Multiuser detection;Iterative algorithms;Signal processing algorithms;Frequency modulation;Iterative decoding;Jamming;Frequency conversion","","9","","21","IEEE","18 Jul 2008","July 2008","","IEEE","IEEE Journals"
"Stopping Set Analysis of Iterative Row-Column Decoding of Product Codes","E. Rosnes","Department of Informatics, University of Bergen, Bergen, Norway",IEEE Transactions on Information Theory,"21 Mar 2008","2008","54","4","1551","1560","In this paper, we introduce stopping sets for iterative row-column decoding of product codes using optimal constituent decoders. When transmitting over the binary erasure channel (BEC), iterative row-column decoding of product codes using optimal constituent decoders will either be successful, or stop in the unique maximum-size stopping set that is contained in the (initial) set of erased positions. Let Cp denote the product code of two binary linear codes Cc and Cr of minimum distances dc and dr and second generalized Hamming weights d2(Cc) and d2(Cr), respectively. We show that the size smin of the smallest noncode- word stopping set is at least mm(drd2(Cc),dcd2(Cr)) > drdc, where the inequality follows from the Griesmer bound. If there are no codewords in Cp with support set S, where S is a stopping set, then S is said to be a noncodeword stopping set. An immediate consequence is that the erasure probability after iterative row-column decoding using optimal constituent decoders of (finite-length) product codes on the BEC, approaches the erasure probability after maximum-likelihood decoding as the channel erasure probability decreases. We also give an explicit formula for the number of noncodeword stopping sets of size smin, which depends only on the first nonzero coefficient of the constituent (row and column) first and second support weight enumerators, for the case when d2(Cr) < 2dr and d2(Cc) < 2dc. Finally, as an example, we apply the derived results to the product of two (extended) Hamming codes and two Golay codes.","1557-9654","","10.1109/TIT.2008.917686","","https://ieeexplore.ieee.org/stamp/stamp.jsp?arnumber=4475386","Binary erasure channel;iterative decoding;product code;stopping set;support weight enumerator","Iterative decoding;Product codes;Maximum likelihood decoding;Parity check codes;Code standards;Iterative methods;Linear code;Hamming weight;Error analysis;CD-ROMs","","8","","17","IEEE","21 Mar 2008","April 2008","","IEEE","IEEE Journals"
"Finite-Length Extrinsic Information Transfer (EXIT) Analysis for Coded and Precoded ISI Channels","P. Tan; J. Li","Electrical and Computer Engineering Department, Lehigh University, Bethlehem, PA, USA; Electrical and Computer Engineering Department, Lehigh University, Bethlehem, PA, USA",IEEE Transactions on Magnetics,"18 Apr 2008","2008","44","5","648","655","In this paper, we consider the classic problem of accessing coded and precoded intersymbol interference (ISI) channels, and particularly partial response (PR) channels, which are widely used in modeling magnetic recording systems. Previous work has either treated the binary precoder as an exclusive function of the channel characteristics, disregarding possible impact from the channel code, or, in performing the iterative analysis of this concatenated system, assumed an unbounded length. Our approach here is to extend the conventional infinite-length extrinsic information transfer (EXIT) charts to ISI systems of limited lengths, and to explicitly account for the effect of the channel nonergodicity. We found that short-length channel codes may exhibit distinctively different EXIT behaviors in different rate regions, and it is important to couple the precoder and the channel code. We show that infinite- and finite-length EXIT behaviors do not always agree, and hence the results obtained from the infinite-length analysis may not hold for practical short-length systems.","1941-0069","","10.1109/TMAG.2008.917367","","https://ieeexplore.ieee.org/stamp/stamp.jsp?arnumber=4479880","Binary precoding;extrinsic information transfer (EXIT) charts;finite-length analysis;intersymbol interference (ISI);partial response (PR) channels;turbo equalization","Information analysis;Intersymbol interference;Iterative decoding;Magnetic recording;Magnetic analysis;Performance analysis;Concatenated codes;Error correction codes;Maximum likelihood decoding;Digital magnetic recording","","8","","20","IEEE","18 Apr 2008","May 2008","","IEEE","IEEE Journals"
"A general construction of constrained parity-check codes for optical recording","K. Cai; K. A. S. Immink","Data Storage Institute, Singapore; Turing Machines Inc., Netherlands",IEEE Transactions on Communications,"18 Jul 2008","2008","56","7","1070","1079","This paper proposes a general and systematic code design method to efficiently combine constrained codes with parity-check (PC) codes for optical recording. The proposed constrained PC code includes two component codes: the normal constrained (NC) code and the parity-related constrained (PRC) code. They are designed based on the same finite state machine (FSM). The rates of the designed codes are only a few tenths below the theoretical maximum. The PC constraint is defined by the generator matrix (or generator polynomial) of a linear binary PC code, which can detect any type of dominant error events or error event combinations of the system. Error propagation due to parity bits is avoided, since both component codes are protected by PCs. Two approaches are proposed to design the code in the non-return-to-zero-inverse (NRZI) format and the non-return-to-zero (NRZ) format, respectively. Designing the codes in NRZ format may reduce the number of parity bits required for error detection and simplify post-processing for error correction. Examples of several newly designed codes are illustrated. Simulation results with the Blu-Ray disc (BD) systems show that the new d = 1 constrained 4-bit PC code significantly outperforms the rate 2/3 code without parity, at both nominal density and high density.","1558-0857","","10.1109/TCOMM.2008.060502","","https://ieeexplore.ieee.org/stamp/stamp.jsp?arnumber=4568448","","Parity check codes;Optical recording;Optical signal processing;Error correction codes;Design methodology;Partial response channels;Automata;Event detection;Protection;Personal communication networks","","8","","22","IEEE","18 Jul 2008","July 2008","","IEEE","IEEE Journals"
"To code or not to code across time: space-time coding with feedback","C. Lin; V. Raghavan; V. V. Veeravalli","Coordinated Science Laboratory, Department of Electrical and Computer Engineering, University of Illinois, Urbana-Champaign, Urbana, IL, USA; Coordinated Science Laboratory, Department of Electrical and Computer Engineering, University of Illinois, Urbana-Champaign, Urbana, IL, USA; Coordinated Science Laboratory, Department of Electrical and Computer Engineering, University of Illinois, Urbana-Champaign, Urbana, IL, USA",IEEE Journal on Selected Areas in Communications,"10 Oct 2008","2008","26","8","1588","1598","Space-time codes leverage the availability of multiple antennas to enhance the reliability of communication over wireless channels. While space-time codes have initially been designed with a focus on open-loop systems, recent technological advances have enabled the possibility of low-rate feedback from the receiver to the transmitter. The focus of this paper is on the implications of this feedback in a single-user multi-antenna system with a general model for spatial correlation. We assume a limited feedback model, that is, a coherent receiver and statistical knowledge at both the ends, along with B bits of error-free quantized channel information at the transmitter. We study space-time coding with a family of linear dispersion (LD) codes that meet an additional orthogonality constraint so as to ensure low-complexity decoding. Our results show that, when the number of bits of feedback (B) is small, a space-time coding scheme that is equivalent to beamforming and does not code across time is optimal in a weak sense in that it maximizes the average received SNR. As B increases, this weak optimality transitions to optimality in a strong sense that is characterized by the maximization of average mutual information. Thus, from a system designer's perspective, our work suggests that beamforming may not only be attractive from a low-complexity viewpoint, but also from an information-theoretic viewpoint.","1558-0008","","10.1109/JSAC.2008.081024","","https://ieeexplore.ieee.org/stamp/stamp.jsp?arnumber=4641968","Adaptive coding;diversity methods;fading channels;feedback communications;MIMO systems;multiplexing;quantization","Feedback;Transmitters;Space time codes;Decoding;Array signal processing;Mutual information;MIMO;Diversity methods;Convolutional codes;Block codes","","7","3","39","IEEE","10 Oct 2008","October 2008","","IEEE","IEEE Journals"
"Optimal Transmission Strategy and Explicit Capacity Region for Broadcast Z Channels","B. Xie; M. Griot; A. I. V. Casado; R. D. Wesel","Electrical Engineering Department, University of California, Los Angeles, CA, USA; Electrical Engineering Department, University of California, Los Angeles, CA, USA; Electrical Engineering Department, University of California, Los Angeles, CA, USA; Electrical Engineering Department, University of California, Los Angeles, CA, USA",IEEE Transactions on Information Theory,"26 Aug 2008","2008","54","9","4296","4304","This paper provides an explicit expression for the capacity region of the two-user broadcast Z channel and proves that the optimal boundary can be achieved by independent encoding of each user. Specifically, the information messages corresponding to each user are encoded independently and the OR of these two encoded streams is transmitted. Nonlinear turbo codes that provide a controlled distribution of ones and zeros are used to demonstrate a low-complexity scheme that operates close to the optimal boundary.","1557-9654","","10.1109/TIT.2008.928298","","https://ieeexplore.ieee.org/stamp/stamp.jsp?arnumber=4609000","Broadcast channel;broadcast Z channel;capacity region;nonlinear turbo codes;turbo codes","Broadcasting;Decoding;Degradation;Turbo codes;Parity check codes;Gaussian channels;AWGN;Convolutional codes;Bicycles;Optimal control","","7","","15","IEEE","26 Aug 2008","Sept. 2008","","IEEE","IEEE Journals"
