ID,Type,Title,Status,Reason,Authors,Abstract,Categories,Published,DOI,PDF URL
ieee:11080308,journal,Joint Source–Channel Noise Adding With Adaptive Denoising for Diffusion-Based Semantic Communications,❌,"확산모델 시맨틱 통신 JSCC, ECC LDPC 기법 없음","C. Liang, D. Li","Semantic communication (SemCom) aims to convey the intended meaning of messages rather than merely transmitting bits, thereby offering greater efficiency and robustness, particularly in resource-constrained or noisy environments. In this letter, we propose a novel framework which is referred to as joint source–channel noise adding with adaptive denoising (JSCNA-AD) for SemCom based on a diffusion model (DM). Unlike conventional encoder–decoder designs, our approach intentionally incorporates the channel noise during transmission, effectively transforming the harmful channel noise into a constructive component of the diffusion-based semantic reconstruction process. Besides, we introduce an attention-based adaptive denoising mechanism, in which transmitted images are divided into multiple regions, and the number of denoising steps is dynamically allocated based on the semantic importance of each region. This design effectively balances the reception quality and the inference latency by prioritizing the critical semantic information. Extensive experiments demonstrate that our method significantly outperforms existing SemCom schemes under various noise conditions, underscoring the potential of diffusion-based models in next-generation communication systems.","Noise, Noise reduction, Semantics, Diffusion processes, Decoding, Training, Receivers, Noise measurement, Image reconstruction, Fading channels",2025,10.1109/JIOT.2025.3589398,https://ieeexplore.ieee.org/document/11080308
ieee:10799928,journal,Visible Light Communication Technology in Digital Operating Room: Experiment and Equipment Manufacturing,❌,수술실 가시광 통신(VLC) HW — LDPC ECC와 무관,"X. Wang, C. Zhang, J. Song","With the technology advances and implementation acceleration of medical digitization, more and more medical devices with radio frequency (RF) wireless communication capabilities are adopted in the hospitals for the conveniences and easily for the deployments. That causes the concerns on electromagnetic interference problem affecting medical safety seriously and should be considered carefully in reality. As an attractive technology, visible light communication (VLC) uses visible light offering illumination and communication at the same time. Compared with the traditional RF communication systems, VLC has significant advantages such as energy saving, easy deployment, no radio interference, electromagnetic compatibility and etc.. In this paper, the experiment utilizing VLC in the digital operating room to reduce electromagnetic interference is presented with implementation details on the test environment and both uplink and downlink hardware design and key parameters to support video/image transmission. The effectiveness of VLC system is verified to deploy in a real digital operating room and support in operation.","Visible light communication, OFDM, Light emitting diodes, Optical transmitters, Baseband, Symbols, Modulation, Servers, Forward error correction, Demodulation",2025,10.23919/comex.2024XBL0181,https://ieeexplore.ieee.org/document/10799928
ieee:11003119,journal,Exceeding Spectral Efficiency Gain of 2 With Co-Frequency Co-Time Full-Duplex in Finite Blocklength Regime,❌,전이중/반이중 유한블록길이 스펙트럼효율 이론분석; 디코더/HW/코드설계로 안 이어지는 순수 이론,"J. Ding, L. Wei, Y. Zhao, B. Jiao","This letter begins with a comparative analysis of the error performance between co-frequency co-time full-duplex (CCFD) and half-duplex (HD) systems in the finite blocklength regime for a given bandwidth. It is demonstrated that the CCFD system provides significant advantages, not only by increasing data rates through the doubled bandwidth for bidirectional transmissions, but also by allowing a larger number of transmitted data symbols, thereby enabling the longer blocklengths, which can reduce the error rate further. Subsequent analyses focus on the issue of spectral efficiency for a given error probability. Notably, gains exceeding 2 are observed when the self-interference (SI) is effectively canceled below a certain threshold. Finally, numerical evaluations substantiate the theoretical findings presented in this study.","Spectral efficiency, Error probability, Channel capacity, Full-duplex system, Bandwidth, Signal to noise ratio, Gain, Error analysis, Half-duplex system, Frequency conversion",2025,10.1109/LCOMM.2025.3569673,https://ieeexplore.ieee.org/document/11003119
ieee:10879301,journal,Coded Fluid Antenna Multiple Access Over Fast Fading Channels,❌,"Fluid antenna multiple access 무선 응용 특이; 채널코드는 부수 언급, NAND LDPC로 떼어낼 디코더/HW/구성 기법 없음","H. Hong, K. -K. Wong, K. -F. Tong, H. Shin, Y. Zhang","Enabled by the emerging fluid antenna system (FAS) technology, fast fluid antenna multiple access (FAMA) provides a massive connectivity scheme which is able to serve on the same physical channel hundreds of users, without the need of precoding nor interference cancellation at each user. This is, however, only possible if we know the antenna position (i.e., port) in which the ratio of the instantaneous signal energy to the sum-interference plus noise signal energy is maximized on a per-symbol basis. In this letter, we address how fast FAMA can be approached using practical channel codes. This technique is referred to as coded FAMA. An iterative decoding receiver with a novel soft-decision port detector and the correlated demapper is proposed. Also, the average mutual information (AMI) for the coded FAMA system is derived to indicate the system’s achievable transmission rate. Our results reveal that the spectral efficiency of the coded FAMA system can well approach the AMI with the proposed iterative decoding receiver. Moreover, it is illustrated that under rich scattering fast fading channels, the proposed coded FAMA system can support 120 users on the same channel to achieve a network spectral efficiency of 75 bps/Hz, without precoding.","Iterative decoding, Fluids, Symbols, Switches, Radio transmitters, Precoding, Internet of Things, Fading channels, Antenna arrays, Transmitting antennas",2025,10.1109/LWC.2025.3540668,https://ieeexplore.ieee.org/document/10879301
ieee:11016911,journal,"Task-Oriented Co-Design of Communication, Computing, and Control for Edge-Enabled Industrial Cyber-Physical Systems",❌,"태스크 지향 JSCC + 제어 공동설계, LDPC ECC 기법 없음","Y. Diao, Y. Zhang, D. D. Martini, P. G. Zhao, E. L. Li","This paper proposes a task-oriented co-design framework that integrates communication, computing, and control to address the key challenges of bandwidth limitations, noise interference, and latency in mission-critical industrial Cyber-Physical Systems (CPS). To improve communication efficiency and robustness, we design a task-oriented Joint Source-Channel Coding (JSCC) using Information Bottleneck (IB) to enhance data transmission efficiency by prioritizing task-specific information. To mitigate the perceived End-to-End (E2E) delays, we develop a Delay-Aware Trajectory-Guided Control Prediction (DTCP) strategy that integrates trajectory planning with control prediction, predicting commands based on E2E delay. Moreover, the DTCP is co-designed with task-oriented JSCC, focusing on transmitting task-specific information for timely and reliable autonomous driving. Experimental results in the CARLA simulator demonstrate that, under an E2E delay of 1 second (20 time slots), the proposed framework achieves a driving score of 48.12, which is 31.59 points higher than using Better Portable Graphics (BPG) while reducing bandwidth usage by 99.19%.","Delays, Symbols, Feature extraction, Autonomous vehicles, Ultra reliable low latency communication, Servers, Reliability, Random variables, Aerospace electronics, Trajectory",2025,10.1109/JSAC.2025.3574605,https://ieeexplore.ieee.org/document/11016911
ieee:10684454,journal,Optimized Unsourced Random Access Schemes With Sparse-Correction-Based Approximate Message Passing for Massive MIMO Systems,❌,"URA massive MIMO AMP 검출 — 무선 응용 특이적, LDPC 디코더 기법 없음","Y. Hu, M. Lou, D. Wang, X. Xia, J. Jin, Q. Wang, G. Liu, X. You, J. Wang","In a massive machine-type communication (mMTC) scenario, there are large number of devices that may establish links to receivers, which causes a great burden to the system for signaling overhead, thereby reducing the communication efficiency. One potential approach involves refraining from assigning signaling overhead to users, with active users opportunistically transmitting data messages within time slots. The receiver only needs to recover these independent data messages without identifying the source of these messages, named unsourced random access (URA). In this paper, suitable URA schemes are proposed for cellular massive multiple-input multiple-output (MIMO) and cell-free massive MIMO systems. In the cellular scenario, the system completes the transmission and estimation of the number of active users and the corresponding channel large-scale fading coefficients (LSFCs) in stage one. Utilizing the channel information obtained in stage one, the receiver in stage two applies the sparse-correction-based bilinear generalized approximate message passing (SCB-BiG-AMP) algorithm proposed in this paper to restore the original data sequences sent by active users. In a cell-free scenario, active users won't transmit LSFC information similar to that in stage one of cellular scenario for the properties of massive distributed antennas. Instead, the central limit theorem (CLT) is used to estimate the average channel LSFC of all active users, which is substituted into the SCB-BiG-AMP algorithm as the equivalent channel variance. Then, the original data sequences sent by active users can be restored. According to the simulation results, the proposed URA communication scheme can achieve good bit error performance. Moreover, as a result of the small uplink user-AP distance, the system performance in the cell-free scenario is much better than that in the cellular scenario.","Massive MIMO, Channel estimation, Codes, Receivers, Fading channels, Encoding, Estimation",2025,10.1109/TVT.2024.3464537,https://ieeexplore.ieee.org/document/10684454
ieee:10718362,journal,O2SC: Realizing Channel-Adaptive Semantic Communication With One-Shot Online-Learning,❌,"시맨틱 통신 원샷 온라인 학습/채널추정 — ECC 기법 없음, LDPC 무관","G. Zhang, K. Kang, Y. Cai, Q. Hu, Y. C. Eldar, A. L. Swindlehurst","Motivated by progress in data-driven supervised learning, semantic communication has witnessed remarkable advancements in improving the efficiency of data transmission under various channel conditions. These advancements typically require a substantial amount of training data for offline training, which is challenging in practical systems. Therefore, in this work, we propose O2SC, a one-shot online-learning framework for semantic communication to achieve adaptive transmission under different channel conditions. Since semantic communication relies on acquired channel state information (CSI), we jointly design the channel estimation and semantic communication processes. Specifically, we introduce a denoising module based on one-shot self-supervised learning, allowing semantic communication systems to adapt to new channel conditions without the need to collect extensive training data. The denoising module is utilized to eliminate noise in the received data samples, using only the data samples themselves. Following this, we further exploit meta-learning to allow the system to quickly adapt to diverse channel conditions, by finding an appropriate initialization for each data sample in a timely way. Simulation results demonstrate that the proposed method achieves performance close to that of supervised learning-based approaches while also providing improved generalizability across different channel conditions.","Noise reduction, Channel estimation, Training, Training data, Wireless communication, Signal to noise ratio, Matrix decomposition, Adaptation models, Supervised learning, Channel coding",2025,10.1109/TCOMM.2024.3480982,https://ieeexplore.ieee.org/document/10718362
ieee:11145102,journal,Fast Max-Log-MAP Detection of Irregular APSK Signals by Traversal Over Rings of Ordered PSK Constellation Points,❌,APSK 신호의 max-log-MAP 검출 복잡도 저감 - 변조 검출 기법이며 LDPC 디코더와 무관,"T. -H. Liu, D. -L. Yang, J. -H. Huang, Y. Ted Su","Amplitude phase shift keying (APSK) modulation signals are of low peak average power ratio and are generated to fight against the potentially non-linear high power amplifier in satellite communication. The benchmark maximum log-likelihood maximum a posteriori probability (max-log-MAP) detector requires to compute the distance squared between the received signal and each APSK constellation point for the extrinsic bit log-likelihood ratio (LLR) information. To overcome this major challenge of high detection complexity, we propose in this paper to partition and order all the APSK constellation points into rings of ordered phase shift keying (PSK) constellation points. We also propose to apply and tailor the iterative search strategies, originally used to detect multiple input multiple output (MIMO) quadrature amplitude modulation (QAM) signals, to search over the ordered irregular PSK constellation points. Compared with previously reported APSK detectors, our proposed detector achieves exactly the max-log-MAP detection, requires very low computational complexity, and is able to detect APSK signals modulated from the APSK constellation with arbitrary number of constellation points, arbitrary phase offsets, and arbitrary ring radii.","Phase shift keying, Modulation, Detectors, Symbols, Quadrature amplitude modulation, Parity check codes, Satellite communications, Computational complexity, Encoding, Vectors",2025,10.1109/TCOMM.2025.3604327,https://ieeexplore.ieee.org/document/11145102
ieee:10979950,journal,Semantic-Oriented Modulation for Wireless Communication,❌,"Semantic-oriented modulation over JSCC; modulation mapping, no LDPC ECC technique","Y. Wang, X. Zhang, Y. Sun, Q. Cui, X. Tao","In semantic communication (SemCom), the gain of deep learning (DL)-based joint source and channel coding (JSCC) has been proved to partly come from the analog transmission of semantic features extracted directly from the source signal. While the current mainstream digital communication system design results in the gains almost vanishing when bit-oriented modulation (e.g., QPSK) is employed. To tackle this problem, we propose a semantic-oriented modulation (SOM) method that enables direct mapping from an analog value of a semantic feature to a sequence of discrete values without bit conversion. SOM employs a hierarchical design to mitigate discretization loss and optimizes resource allocation by exploiting the varying significance of semantic features, reducing the data volume by 29.17%. We provide an analysis that reveals the impact of modulation orders and hierarchical layers, guiding the SOM’s design. Simulations in four tasks show that SOM outperforms JSCC with bit-oriented modulation, and the implementation of the software-defined radio (SDR) platform confirms its compatibility with existing systems and its potential for latency reduction.","Semantics, Modulation, Feature extraction, Symbols, Digital communication, Wireless communication, Training, Semantic communication, Quantization (signal), Data mining",2025,10.1109/JIOT.2025.3565017,https://ieeexplore.ieee.org/document/10979950
ieee:11197137,journal,Enhancing the EMI-Resilience of Communication Networks Through Warning Propagation: A Multilayer Approach,❌,"EMI 내성 다계층 경고전파 프레임워크 — LDPC 디코더/코드설계/HW 기여 없음, 떼어낼 ECC 기법 없음","M. Kameli, D. Pissoort, T. Claeys","This article presents a multilayer warning propagation framework to enhance electromagnetic interference resilience. This approach comprises multiple distinct error detection and correction techniques, each operating independently yet collaboratively. Unlike traditional concatenated coding approaches, the multilayer method is designed to integrate warnings generated by layers that address errors at different levels. A case study is conducted using simulations over a frequency range (0.1GHz–1 GHz) and varying signal-to-interference ratios. It is shown that while individual layers are found to exhibit vulnerabilities under specific electromagnetic interference conditions, the combination of these layers is observed to achieve near-zero undetected error rates, thereby enhancing system safety. In addition, the combination of layers is used to allow system designers to optimize falsely reported error rates, balancing safety and availability.","Nonhomogeneous media, Electromagnetic interference, Resilience, Safety, Electromagnetics, Integrated circuit modeling, Decision making, Communication networks, Receivers, Monitoring",2025,10.1109/TEMC.2025.3615289,https://ieeexplore.ieee.org/document/11197137
ieee:10995230,journal,Multimodal-Oriented Interactive Joint Source-Channel Coding for Lightweight Semantic Communication,❌,Multimodal JSCC lightweight semantic communication; no LDPC ECC technique to extract,"X. Niu, L. Tan, J. Wu, W. Yuan, T. Q. S. Quek","As a pivotal technology for sixth-generation (6G) mobile networks, semantic communication (SC) aims to enable low-energy, high-efficiency intelligent communication through joint source-channel coding (JSCC). However, current multimodal SC systems experience semantic divergence and conflicts due to imbalances in the representation capacity of individual encoders. Furthermore, high computational demands significantly elevate the deployment and operational costs of SC. In this letter, we propose a multimodal-oriented lightweight SC system based on an interactive JSCC scheme, promoting the evolution of 6G towards a multi-source collaboration paradigm. Additionally, a dynamic resource allocation method is introduced, which hierarchically adjusts computational costs to improve efficiency. Simulation results demonstrate that the proposed system reduces computational overhead by 60$\%$ compared to six benchmarks while maintaining high performance and robustness in multiple tasks.","Semantics, Computational modeling, Training, Silicon, Receivers, Encoding, Correlation, Visualization, Transmitters, Smart devices",2025,10.1109/TVT.2025.3568851,https://ieeexplore.ieee.org/document/10995230
ieee:11181088,journal,Reinforcement Learning-Based Underwater Video Transmission Against Jamming,❌,"수중 음향 비디오 전송 강화학습 적응변조코딩; 응용 특이적, 떼어낼 LDPC ECC 기법 없음","S. Li, T. Li, W. Su, H. Chen, L. Ye, H. Wang","Existing adaptive modulation and coding schemes suffer from performance degradation under time-varying underwater acoustic (UWA) channels and jamming attacks, resulting in increased video jitter and energy consumption, as well as reduced peak signal-to-noise ratio (PSNR). In this article, we first propose a reinforcement learning (RL)-based underwater video transmission scheme, which jointly optimizes the channel coding methods, subcarrier modulation order, quantization parameter, and transmit power against jamming. The direct sequence spread spectrum (DSSS) mechanism is used to reduce the jamming power in each subcarrier frequency band, which ensures that the transmitter obtains a reliable feedback message. In addition, a multi-frame statistics scheme is designed to support transmission policy selection, which mitigates the impact of channel instability by averaging the observed transmission performance and channel gain. To further enhance communication performance and robustness under large state–action spaces and dynamic channel conditions, we propose a deep RL (DRL)-based anti-jamming video transmission scheme to compress the excessive state–action space, mitigate quantization errors, and improve transmission stability. Two target networks are employed in DRL to ensure learning stability by mitigating fluctuations in  $Q$ -value and  $R$ -value updates caused by the time-varying channel. In addition, the performance bounds of transmission delay and energy consumption related to modulation order and channel coding rate are derived. Simulation and experimental results demonstrate that our schemes improve the video transmission performance by reducing transmission delay, energy consumption, and video jitter while increasing the PSNR and video quality compared with the benchmarks.","Videos, Jamming, Delays, OFDM, Energy consumption, Quality assessment, Jitter, Games, Encoding, Channel state information",2025,10.1109/JIOT.2025.3614646,https://ieeexplore.ieee.org/document/11181088
ieee:11072822,journal,Construction of Quantum Anamorphic Evolving Dynamic-Threshold Secret-Sharing Schemes,❌,"양자 비밀분산·암호 스킴, LDPC ECC 무관","S. S. Chaudhury, S. Ganguly","We propose the concept of Quantum Anamorphic Evolving Secret-Sharing(QAESS), combining two different cryptographic primitives in this paper. In QAESS, we have the anamorphic property, allowing alternate secrets to be embedded within the primary secret-sharing framework, accessible only under specific constraints, and the evolving property of secret-sharing (ESS) where the scheme can dynamically adapt by accommodating potentially an infinite number of new parties without reinitialization. To achieve this, the major hurdles we encounter are 1) the large dimensions of shares and the requirement of huge quantum memory, and 2) the system breakdown by inserting a spy. In our first construction, we present a QAESS scheme, and in the second construction, we use secret redistribution to mitigate the above challenges. Our constructions extensively use quantum trap codes, random permutations, and data structure techniques. We analyze the schemes’ efficiency, scalability, and robustness through theoretical proofs and complexity estimates. This integration of quantum anamorphism and evolving properties finds potential application in several Internet of Things (IoT) and other practical scenarios. We close the paper by discussing several advantages of our constructions and some interesting problems for further study.","Encryption, Internet of Things, Security, Encoding, Image reconstruction, Steganography, Quantum state, Adaptive systems, Vehicle dynamics, Protocols",2025,10.1109/TCOMM.2025.3587045,https://ieeexplore.ieee.org/document/11072822
ieee:10902515,journal,Adaptive FTN Signaling Over Rapidly-Fading Channels,❌,"FTN signaling/precoding 무선 응용 특이적, LDPC ECC로 떼어낼 기법 없음","M. Tong, X. Huang, J. Andrew Zhang, L. Hanzo","The research of faster-than-Nyquist (FTN) signaling has reached a state of maturity for considering practical multipath fading channels, rather than idealized additive white Gaussian noise channels only. To overcome fast-fading multipath propagations, conventional FTN systems tend to rely on channel coding techniques for cleaning up the residual errors, rather than harnessing Doppler effect mitigation. To circumvent this limitation, we propose an adaptive transmit precoding (ATPC) method associated with FTN signaling for applications in fast-fading multipath channels. Upon leveraging real-time channel state information fed back by the receiver, ATPC updates the modulation matrix to improve resilience against Doppler frequency shifts. To mitigate the inter-block interference and multipath effect, a cyclic prefix is inserted at the beginning of each transmission frame. In addition, we employ decision-directed successive interference cancellation for alleviating the inter-symbol interference stemming from FTN signaling and multipath effects. We also analyze the theoretical bit error rate (BER) performance and a pair of closed-form BER expressions are derived for extreme channel conditions, i.e., sufficiently large number of paths and sufficiently large Doppler frequency shift. Simulation results verify the effectiveness of the proposed ATPC method and demonstrate our performance improvements over conventional schemes.","OFDM, Doppler effect, Time-frequency analysis, Interference cancellation, Frequency modulation, Diversity reception, Complexity theory, Symbols, Multipath channels, Frequency diversity",2025,10.1109/TCOMM.2025.3545655,https://ieeexplore.ieee.org/document/10902515
