ID,Type,Title,Status,Reason,Authors,Abstract,Categories,Published,DOI,PDF URL
ieee:11401290,conference,An Efficient Degree Distribution of Short LT-like Codes for Update Distribution over IoT Networks,❌,"IoT용 LT-like fountain 코드 차수분포 설계, fountain 코드 제외","N. I. Abdulkhaleq, A. Saad Hussein, S. H. Ali","This paper compares three degree distributions-Robust Soliton Distribution (RSD), Memory-Based RSD (MBRSD), and novel Anti-Stuck Deterministic Degree Distribution (ASDD)for short-message transmission with low latency in Internet of Things (IoT) networks. The foremost contribution is the design of ASDD, which proactively grows and stabilizes the population of degree-1 symbols to prevent decoding stalls (""stuck"" states), thus keeping the belief-propagation process under erasure-prone situations. Performance was compared with MATLAB-based simulations of LT-like fountain codes in terms of decoding success rate, overhead efficiency, and erasure robustness. Performance shows ASDD beats RSD and MBRSD under all conditions: achieving a 15% improvement in decoding success rate at high erasure levels, reducing average overhead by 10–12%, and improving decoding reliability for short packets. Such improvements are especially useful for energy-compressing IoT nodes, where retaliation is expensive. Conclusions suggest that ASD provides an effective coding strategy to increase reliability and reduce the delay in short-notification-IoT communication. For future work, this will include the implementation of hardware and assess the real IoT network environment.","Codes, Redundancy, Symbols, Solitons, Robustness, Hardware, Decoding, Internet of Things, Low latency communication, Testing",2025,10.1109/ICECER65523.2025.11401290,https://ieeexplore.ieee.org/document/11401290
ieee:11146298,conference,Rethinking Reliability Using Network Coding: a Practical 5G Evaluation,❌,"5G RLNC 네트워크코딩 erasure 복구 - 재전송 대체 네트워크코딩, LDPC ECC 기법 없음","L. Landon, V. A. Vasudevan, J. Sung, M. Médard","This work presents the design and implementation of a real-time network coding system integrated into the IP layer of a 5G testbed, offering an alternative to conventional retransmission-based reliability mechanisms such as ARQ and HARQ. Using a netfilter-based packet interception framework, we inject forward erasure correction using Random Linear Network Coding (RLNC) into live traffic between a gNB and UE over a 3GPP RF link. We evaluate a block coding scheme, analyzing its impact on throughput, jitter, and resource usage. Results show that with appropriate code rate selection, RLNC can fully recover from packet losses using fewer transmissions than ARQ/HARQ and maintain a high throughput, particularly under moderate-to-high packet loss rates. These findings demonstrate that network coding can effectively replace retransmission-based reliability in future wireless systems, with the potential for more efficient resource utilization.","5G mobile communication, Computer network reliability, Packet loss, Network coding, Jitter, Throughput, Real-time systems, IP networks, Block codes, 3GPP",2025,10.1109/LCN65610.2025.11146298,https://ieeexplore.ieee.org/document/11146298
ieee:11213577,conference,Error Correction Enhancement in SCL Decoding of Polar Codes Using LSTM Network,❌,"Polar 부호 SCL 디코더 LSTM 개선 — LDPC가 아닌 polar 부호 대상, 이식 대상 LDPC 기법 아님(BP는 baseline 언급)","F. Alia, B. Akhbari, M. A. Attari","Polar codes have been selected as the channel coding scheme for the Enhanced Mobile Broadband (eMBB) control channel in 5G, which requires short length codes. One of the main challenges in utilizing polar codes is the design of low-complexity decoders with adequate error-correcting performance. The Successive Cancellation (SC) decoder was introduced as the first algorithm enabling polar codes to achieve the channel capacity for long codelengths. However, for shorter codelengths, this decoder does not provide satisfactory error-correction performance. To address this limitation, the Successive Cancellation List (SCL) decoder has been proposed, which performs decoding by maintaining a list of candidate paths and selecting the best one based on a path metric. In this paper, we propose improving the error-correction performance of the SCL decoder using concatenated Cyclic Redundancy Check (CRC) codes and Long Short-Term Memory (LSTM) network. Simulation results demonstrate that the proposed method outperforms the Belief Propagation (BP) decoder in terms of Bit Error Rate (BER) curves. Furthermore, the accuracy of the LSTM model in this study improves from 73 percent in previous research to 93.77 percent.","Accuracy, Monte Carlo methods, Simulation, Neural networks, Bit error rate, Decoding, Error correction, Polar codes, Long short term memory, Cyclic redundancy check codes",2025,10.1109/ICEE67339.2025.11213577,https://ieeexplore.ieee.org/document/11213577
ieee:11219454,conference,Self-Learning and Authentication Algorithm for Automotive Applications,❌,"MAC+Turbo 결합 자가학습 인증·정정 알고리즘 — Turbo 기반, LDPC 기법 아님, 보안 응용",N. Živić,"This paper presents a two-phase iterative algorithm for the correction (and possibly for authentication) of data related primarily to automotive applications. The algorithm combines Message Authentication Code (MAC), borrowed from cryptography and incorporated in the Soft Input Decryption (SID) procedure for data authentication, with a channel decoding technique based on a Turbo decoder, where certain data blocks, i.e. specific parts of an image (landmarks), are separately decoded in an iterative manner. The algorithm possesses a kind of self-learning property, since in each successful iteration of the landmark decoding, the knowledge about successful authentication of a landmark is passed to the next iteration in the form of “ $L$-values” which are set to the maximally permitted values, so that the decoding performance (for the whole image) is getting better and better in each subsequent iteration. The basic idea is to have cryptographic algorithms for data authentication which are tolerant to minor modifications, such as bit errors below a certain threshold. When these algorithms are combined with forward error correction codes and run in an iterative manner, and with carefully tuned values of some parameters, then both error correction and authentication (based on self-learning) can give better results. This paper describes an iterative (and selflearning) algorithm which can improve error correction and authentication of images protected by security mechanisms.","Automotive applications, Authentication, Forward error correction, Turbo codes, Iterative algorithms, Error correction codes, Decoding, Cryptography, Message authentication, Iterative decoding",2025,10.1109/IAVVC61942.2025.11219454,https://ieeexplore.ieee.org/document/11219454
ieee:10970889,conference,Improving Data Transmission Efficiency in UAV Networks Through Adaptive Coding,❌,"UAV 적응형 RCPC 코딩. LDPC 아니고 무선 응용 특이적, 떼어낼 ECC 기법 없음","M. M. Safadi, V. B. Amoursky","In recent years, unmanned aerial vehicles (UAV) have become widely used in civil and military applications such as surveillance, data collection, and cargo delivery. With the increasing use of this technology, there is a need for improved communication systems to ensure reliable and efficient data transmission. UAV networks face unique challenges due to dynamic motion, environmental interference, and energy and bandwidth limitations. The objective of this study is to propose an adaptive coding scheme using Rate-Compatible Punctured Coding (RCPC) technology, which assigns different coding rates to different data depending on their importance and channel conditions. The proposed scheme includes a mechanism to dynamically adjust the coding rates based on the change in link quality. This study demonstrates that adaptive coding can improve resource efficiency, reduce latency, and enhance communication reliability.","Surveillance, Interference, Autonomous aerial vehicles, Encoding, Reliability, Data communication, Time factors, Vehicle dynamics, Adaptive coding, Signal to noise ratio",2025,10.1109/REEPE63962.2025.10970889,https://ieeexplore.ieee.org/document/10970889
ieee:11250554,conference,Turbo Codes-based Physical Layer Security Method Against Passive Eavesdropping Attacks For MIMO Wireless Communication Systems,❌,Turbo 코드 기반 물리계층 보안(도청 방지) — LDPC ECC 기법 아님,"D. Van Linh, H. T. P. Thao, V. Van Yem","This paper proposes a Physical Layer Security (PLS) method based on the Turbo codes to mitigate the passive eavesdropping attacks on the Multiple-Input Multiple-Output (MIMO) wireless communication systems. The proposed method is implemented by using a secret key to manage the working principles of the Turbo codes. The performance of the proposed method is evaluated by comparing the bit error rate (BER) of the legitimate receiver (Bob) with the eavesdropper (Eve) in different MIMO configurations and channels. The obtained results indicate that the proposed method significantly reduces Eve’s decoding ability over the MIMO systems. Therefore, it is effective against passive eavesdropping attacks. Moreover, the proposed method gives a low computational complexity equivalent to normal Turbo codes.","Bit error rate, Information security, Receivers, Physical layer security, Turbo codes, MIMO, Decoding, Cryptography, Computational complexity, Eavesdropping",2025,10.1109/VCRIS68011.2025.11250554,https://ieeexplore.ieee.org/document/11250554
ieee:11084599,conference,Error Correction for DNA-Based Image Storage,❌,"DNA 저장 ECC(RS·convolutional·Raptor) JSCC, LDPC 아님","D. Lazzarotto, M. Testolina, T. Ebrahimi","DNA has been proposed as an alternative support for data storage due to its lower energy consumption and longer lifespan when compared to conventional techniques. DNA-based storage faces several challenges, particularly in managing errors that arise during synthesis and sequencing. The JPEG Committee has been working towards a DNA-based image coding standard and has proposed an initial prototype without including error-correction mechanisms. Inserted in the context of the JPEG DNA standardization, this paper presents two joint error-correcting pipelines for DNA-based image storage combining cyclic redundancy checks, Reed-Solomon codes, convolutional codes, and Raptor codes. The proposed pipelines are evaluated across various channel models and benchmarked against state-of-the-art, demonstrating enhanced coding performance, reduced complexity, and improved flexibility. The efficacy of the proposed systems has resulted in their inclusion in the JPEG DNA verification model. The results presented in this paper can serve as a reference to benchmark against future ideas on joint source-channel coding of images in DNA.","Reed-Solomon codes, Image coding, Pipelines, DNA, Transform coding, Rate-distortion, Benchmark testing, Image storage, Channel models, Standards",2025,10.1109/ICIP55913.2025.11084599,https://ieeexplore.ieee.org/document/11084599
ieee:11195597,conference,A Design of Convolutional Gaussain Random Codes,❌,"convolutional Gaussian random code 설계(polar+SVD precoding); AWGN 통신용, LDPC 아니며 NAND 이식 기법 없음",D. Lin,"This paper studies Gaussian random codes based on convolutional structures. Firstly, an error probability upper bound for finite-length Gaussian random codes is derived, expressed as a closed-form solution for the error exponent. It also proposes regular convolutional Gaussian random codes and analyzes the upper bound of error probability of their component codes. To improve the cutoff rate and reduce decoding complexity, polar codes are employed as component codes and SVD precoding is introduced to transform polar codes into approximate Gaussian random codes. Numerical verification shows that the proposed codes have the potential to meet high-performance requirements under achievable complexity conditions.","Convolutional codes, Upper bound, Closed-form solutions, Error probability, Precoding, Transforms, Complexity theory, Decoding, Polar codes, Gaussian channels",2025,10.1109/ISIT63088.2025.11195597,https://ieeexplore.ieee.org/document/11195597
ieee:11012346,conference,Parity based Error Correction Code for Embedded Memories,❌,"임베디드 메모리용 패리티 기반 ECC, LDPC 아님(버스트 오류 정정 패리티 코드)","K. Srinidhi, S. V. N. S. V. Chakka, M. Vinodhini","Modern technology is rapidly evolving; modern circuits are becoming more optimized and complex, enabling higher processing speeds and increased storage capacities. However, as electronic devices shrink in size, they become more susceptible to faults, particularly in radiation-intensive environments and extreme temperatures. One major concern in memory systems in modern technology is the data corruption caused by charged particles, which are leading to transient faults that affect system reliability. In this work, a novel Error Correction Code (ECC) method has been introduced, specifically the parity-based ECC, which has a high rate of detecting and correcting the burst errors. This design was implemented using Verilog and synthesized using the Cadence tool on a 45-nm technology node. The proposed ECC can correct up to 4-bit adjacent and non-adjacent errors for 16-bit data and 8-bit adjacent and non-adjacent errors for 32-bit data. The experimental results showed that the error correction code corrects 100% of quadruple adjacent error and 8-bit adjacent error bits. In addition, the area and power consumption as shown considerable reduction when compared to two other existing works.","Power demand, Scalability, Redundancy, Software, Error correction codes, Software reliability, Circuit faults, Integrated circuit modeling, Transient analysis, Integrated circuit reliability",2025,10.1109/DevIC63749.2025.11012346,https://ieeexplore.ieee.org/document/11012346
ieee:11111030,conference,Security Enhancement for High-Speed Optical Transmission Using Multilevel Coded Modulation and Information Scrambling,❌,"광통신 물리계층 보안(coded modulation + scrambling), NAND LDPC ECC로 떼어낼 디코더/코드설계 기법 없음","X. Yin, Y. Lei, Z. Guo, B. Chen",A multilevel coded modulation scheme in combination with information scrambling is proposed to enhance the physical layer security of high-speed optical transmission systems. Its effectiveness is demonstrated by comparing to conventional bit-interleaved coded modulation systems.,"Multiplexing, Optical switches, Digital signal processing, Physical layer security, Interleaved codes, Optical modulation, Security, Optical signal processing, High-speed optical techniques, Photonics",2025,10.23919/OECC/PSC62146.2025.11111030,https://ieeexplore.ieee.org/document/11111030
ieee:11171311,conference,A Comparative Analysis of Advanced Modulation and Coding Schemes for LEO Based Satellite Network,❌,LEO 위성 MCS 비교 분석; LDPC 디코더·구성 신규 기여 없음,D. R. Manjunath,"Satellite communication using LEO is gaining popular acceptance, owing to its capabilities of ubiquitous coverage, high speed and minimum latency. The aforementioned advantages offered by LEO links are best utilized when the adverse challenges such as Doppler shifts and varying channel conditions observed in LEO communication are effectively addressed. In order to ensure reliable connectivity amidst these challenges, it is pertinent to employ optimum Modulation and Coding Schemes (MCS). A comparative analysis of the various advanced MCS provides necessary insights into the trade-offs between MCS the implementation latency, spectral efficiency, BER, throughput and the effectiveness with which a reliable communication link can be established under dynamic LEO channel conditions.","Space vehicles, Satellites, Spectral efficiency, OFDM, Modulation, Low earth orbit satellites, Forward error correction, Throughput, Encoding, Reliability",2025,10.1109/SPACE65882.2025.11171311,https://ieeexplore.ieee.org/document/11171311
ieee:11085274,conference,Advances in Convolutional Codes and the Viterbi Algorithm for Error Correction in Digital Communication System,❌,"convolutional code+Viterbi 서베이, LDPC 무관","V. Arya, S. Gupta","The application of error correction codes (ECCs) is essential to achieve reliable data transfer over a noisy communications channel. Convolutional codes along with Viterbi decoding algorithm have played a significant role in the area of strong error correction in many communications systems. Herein, a detailed survey on the past, design, and applications of convolutional codes and Viterbi algorithm focusing on the current communication systems like 5G, IoT, and space networks. New-age technologies were especially highlighted because innovations resulted from integrating artificial intelligence and hardware acceleration. The article concludes with a number of observations on the main problems and avenues for future research into the application of these technologies in new-generation communication system. This research also examines the incorporation of novel technol ogies like machine learning and hardware acceleration with traditional error correction systems.","Convolutional codes, Viterbi algorithm, 5G mobile communication, Machine learning, Digital communication, Turbo codes, Error correction codes, Decoding, Reliability, Hardware acceleration",2025,10.1109/RFCoN62306.2025.11085274,https://ieeexplore.ieee.org/document/11085274
ieee:11154526,conference,Bounded-Metric List Decoding of Linearly Expurgated Tail-Biting Convolutional Codes,❌,"tail-biting 컨볼루션 부호 + ELF 리스트 디코딩; LDPC 부호/디코더 아님, 이식 가능한 LDPC 기법 없음","Z. Qu, W. Sui, G. Liva, D. Divsalar, R. Wesel","In the short blocklength regime, serial list decoding of tail-biting (TB) convolutional codes concatenated with an expurgating linear function (ELF) can approach the random coding union bound on frame error rate (FER) performance. Decoding complexity for a particular received word depends on how deep in the list the decoder must search to find a valid TB-ELF codeword. The average list size is close to one at low-FER operating points such as 10−6, and serial list decoding provides a favorable average complexity compared to other decoders with similar performance for these cases.However, the average list size can be on the order of a hundred or a thousand at higher, but still practically important, FER operating points such as 10−3. It is useful to study the tradeoff between how deep the decoder is willing to search and the proximity to the frame error rate (FER) achieved by an ML decoder. Often, this tradeoff is framed in terms of a maximum list depth. However, this paper frames the tradeoff in terms of a maximum allowable metric between the received word and the trellis paths on the list. We consider metrics of Euclidean distance and angle.This new approach draws on the wealth of existing literature on bounded-metric decoding to provide characterizations of how the choice of maximum allowable metric controls the tradeoffs between FER performance and both decoding complexity and undetected error rate. These characterizations lead to an example of an ELF-TB convolutional code that outperforms recent results for polar codes in terms of the lowest SNR that simultaneously achieves both a total error rate less than $\varepsilon _ \top ^{\ast} = {10^{ - 3}}$ and an undetected error rate below $\varepsilon _{\text{U}}^{\ast} = {10^{ - 5}}$.","Measurement, Convolutional codes, Satellites, Error analysis, Encoding, Decoding, Complexity theory, Polar codes, Standards, Signal to noise ratio",2025,10.1109/ISTC65386.2025.11154526,https://ieeexplore.ieee.org/document/11154526
ieee:11195274,conference,Randomness-Efficient Constructions of Capacity-Achieving List-Decodable Codes,❌,리스트 디코딩 가능 랜덤 선형부호의 randomness-efficient 구성(순수 조합/대수 이론); LDPC·NAND 이식 기법 없는 이론 bound,"J. Mosheiff, N. Resch, K. Shang, C. Yuan","In this work, we consider the task of generating listdecodable codes over small (say, binary) alphabets using as little randomness as possible. Specifically, we hope to generate codes achieving what we term the Elias bound, which means that they are ($\rho, L$) -list-decodable with rate $R \geq 1-h(\rho)-O(1 / L)$. A long line of work shows that uniformly random linear codes (RLCs) achieve the Elias bound: hence, we know $O\left(n^{2}\right)$ random bits suffice. Prior works (Guruswami and Mosheiff, FOCS 2022; Putterman and Pyne, ITCS 2024) demonstrate that just $O(L n)$ random bits suffice, via puncturing of low-bias codes. These recent constructions are essentially combinatorial, and rely (directly or indirectly) on graph expansion. We provide two new constructions, which are algebraic. Compared to prior works, our constructions are considerably simpler and more direct. Furthermore, our codes are designed in such a way that their duals are also quite easy to analyze. Our first construction which can be seen as a generalization of the celebrated Wozencraft ensemble - achieves the Elias bound and consumes $L n$ random bits. Additionally, its dual code achieves the Gilbert-Varshamov bound with high probability, and both the primal and dual admit quasilinear-time encoding algorithms. The second construction consumes $2 L n$ random bits and yields a code where both it and its dual achieve the Elias bound. In all of the above cases - including the prior works achieving randomness complexity $O(L n)$ - the codes are designed to “approximate” RLCs. More precisely, for a given locality parameter $L$ we construct codes achieving the same $L$-local properties as RLCs. This allows one to appeal to known list-decodability results for RLCs and thereby conclude that the code approximating an RLC also achieves the Elias bound (with high probability). As a final contribution, we indicate that such a proof strategy is inherently unable to generate list-decodable codes of rate $R$ over $\mathbb{F}_{q}$ with less than $L(1-R) n \log _{2}(q)$ bits of randomness.","Codes, Linear codes, Approximation algorithms, Encoding, Complexity theory",2025,10.1109/ISIT63088.2025.11195274,https://ieeexplore.ieee.org/document/11195274
ieee:11047096,conference,Experimental Demonstration of Alamouti coded 200-Gbps/λ Coherent PON Transmission Enabled by Polar Coded Truncated Probabilistic Shaped 64-QAM,❌,"코히어런트 PON 전송 데모, polar coded probabilistic shaping 기반 — LDPC ECC와 무관, 떼어낼 기법 없음","X. Jia, J. Li, N. Wang, D. Zhang, K. Zhang, X. Hu, X. Huang, M. Lv, D. Zhang",An Alamouti coded $200-\mathrm{Gbps} / \lambda$ coherent PON downstream is achieved with $32-\mathrm{dB}$ and $29-\mathrm{dB}$ power budget under optical-back-to-back and $20-\mathrm{km}$ cases respectively enabled by polar coded truncated probabilistic shaped 64-QAM scheme with $40-\mathrm{GHz}$ signal bandwidth.,"Optical fibers, Bandwidth, Probabilistic logic, Optical fiber communication, Passive optical networks, Complexity theory",2025,,https://ieeexplore.ieee.org/document/11047096
ieee:11478534,conference,Matmul-Based WAVA Implementation for Tailbiting Convolutional Codes,❌,"Tailbiting convolutional code(WAVA) 행렬곱 구현, LDPC 무관 컨볼루션 디코더",T. -Y. Wu,"This paper introduces a novel implementation of a tail-biting convolutional code (TBCC) decoder, which addresses the intrinsic decoding challenges associated with the wrap-around nature of TBCC. Traditional decoding methods, particularly sequential approaches like the Viterbi algorithm, struggle to efficiently handle TBCC due to their reliance on sequential processing. This limitation does not align well with the architecture of modern hardware, particularly parallel processing systems, which can exploit massive computational resources more effectively. To overcome these challenges, we transform the decoding process into multiple matrix multiplications by strategically splitting the code into subsequences. By leveraging this transformation, the decoder specifically the wrap-around Viterbi algorithm (WAVA) can fully utilize the power of neural processing units (NPUs) designed for high degrees of parallelism. NPUs at executing optimized linear algebra operations, making them ideally suited for the matrix multiplication approach adopted in this implementation. This method can significantly reduce latency, particularly for high-order TBCCs, which can achieve error performance close to the finite blocklength limit.","Application specific integrated circuits, Integrated circuits, Circuits, Central Processing Unit, Field programmable gate arrays, Communication systems, Radio access networks, Regional area networks, Ultra reliable low latency communication, Protocols",2025,10.1109/APWDSIT64675.2025.11478534,https://ieeexplore.ieee.org/document/11478534
