ID,Type,Title,Status,Reason,Authors,Abstract,Categories,Published,DOI,PDF URL
ieee:11365749,conference,A Comparative Study and Evaluation of 64-DP-QAM and 128-DP-QAM Modulated Signals in High-Capacity Long-Haul Optical Transmission,❌,"장거리 광통신 QAM 변조 비교, 떼어낼 LDPC 기법 없음","S. Rani, S. Singh, S. P. Singh","With growing interest in beyond-5G technologies, this study reviews and examines the details of modulation techniques that offer improved power and bandwidth efficiency for next-generation communication systems. A high-order modulation technique performs a very significant function in accommodating the growing traffic demands of modern transmission networks. High-capacity optical transmission has been extensively explored for long-distance communication links. Numerous approaches have been proposed to enhance system performance, among which the development of optimal modulation schemes has remained a core strategy. The efficiency of a communication system is determined by key parameters including bandwidth availability, power usage, and overall cost. The QAM with appropriate channel coding is a better choice for long range and high data rate communication. This work presents a performance analysis and comparison of 64-QAM and 128-QAM modulation formats employing dual polarization in long-haul optical communication systems. An investigation was conducted at a data rate of $70 \text{Gbps}, 84 \text{Gbps}$ and 120 Gbps over a fiber link spanning at 100 k and 150 km by employ the 64-DP-QAM and 1400 km distance achieved by 128-DP-QAM modulation. The samples per bit are used such as 8 and 32. The simulation allows for the observation of the constellation diagram, optical spectrum for representation of the optical signal.","Optical fiber amplifiers, Optical fiber polarization, Optical polarization, System performance, Optical attenuators, Optical fiber networks, Optical receivers, Optical transmitters, Optical amplifiers, Optical modulation",2025,10.1109/IEMECON69302.2025.11365749,https://ieeexplore.ieee.org/document/11365749
ieee:11345431,conference,Performance Analysis and Configuration of 5G NR for V2X Communications,❌,"5G NR V2X 성능 분석, 떼어낼 LDPC 기법 없음","N. C. Hu, L. Méndez-Monsanto, A. G. Armada","Remote driving relies heavily on high-reliability, low-latency, and high-throughput vehicular communication systems. Fifth-Generation (5G) stands out as the promising technology to meet these stringent requirements. This paper presents a comprehensive analysis of the performance of 5G radio access for remote driving scenarios. Specifically, it investigates the interplay between 5G numerologies, Modulation and Coding Scheme (MCS), vehicular velocities, and propagation channel models representative of urban and highway environments. For each configuration, the minimum Signal-to-Noise Ratio (SNR) required to achieve target Block Error Rate (BLER) of 10−1, 10−2 and 10−3 is determined. Additionally, we examine the asymmetric Uplink (UL) and Downlink (DL) throughput demands characteristic of remote driving use cases. The results provide insights into optimal parameter configurations for reliable 5G-based remote vehicle control under various mobility and channel conditions.","Road transportation, 5G mobile communication, Error analysis, Throughput, Reliability engineering, Performance analysis, Uplink, Low latency communication, Vehicle-to-everything, Signal to noise ratio",2025,10.1109/LATINCOM67778.2025.11345431,https://ieeexplore.ieee.org/document/11345431
ieee:10946061,conference,Physical Layer simulative comparison of DVB-S2X/RCS2 and 3GPP 5G NR-NTN technologies over Geostationary Satellite Scenario,❌,"DVB-S2X/5G NR-NTN 물리계층 성능 비교 — LDPC가 부수 언급, 떼어낼 ECC 기법 없음","B. Chamaillard, A. Traoré, N. Borios, S. Cioni","This simulation study aims to compare the physical layer performance of the 5th Generation (5G) New Radio Non-Terrestrial Networks (NR NTN) air interface with Digital Video Broadcasting (DVB) technologies, specifically analyzing the Second Generation Satellite Extensions (S2X) standard on the Downlink (DL) and DVB- Return Channel via Satellite 2nd generation (RCS2) standard on the Uplink (UL). The study assumes a reference geosynchronous satellite telecommunication system operating in the Ka-band frequencies. The comparison analysis of the physical layers demodulation performance on the Forward (FWD) link reveals an average spectral efficiency decrease from 15 to 26% for NR PDSCH (Physical Downlink Shared Channel) in comparison to DVB-S2X. The analysis of the Return (RTN) link indicates comparable performance between NR PUSCH (Physical Uplink Shared Channel) and DVB-RCS2, with a marginal advantage for either technology based on specific study cases. The conclusions drawn from the performance comparison emphasize the potential for optimizing NR waveform configuration to improve spectral efficiency and reduce implementation losses through enhanced channel estimation and phase tracking algorithms. Moreover, this study outcome advocates for the completion of the physical layer comparison with System Level simulations of both technologies. This would make it possible to consider additional implications such as nonlinear amplification effects, control plane overhead, and scheduling efficiency.","Spectral efficiency, Satellite broadcasting, Channel estimation, Signal processing algorithms, Physical layer, Uplink, Ka-band, Standards, Digital video broadcasting, Geostationary satellites",2025,10.1109/ASMS/SPSC64465.2025.10946061,https://ieeexplore.ieee.org/document/10946061
ieee:11197371,conference,Throughput and Capacity Analysis of LiFi-Over-Powerline,❌,"LiFi-over-powerline 채널 용량·throughput 측정 연구, FEC는 부수 언급, 이식 가능 LDPC 기법 없음","A. Pouralizadeh, K. L. Bober, V. Jungnickel, A. Tonello","A combination of optical wireless communication (also denoted as LiFi), and powerline communication offers a promising solution for wireless extension of data networks operating in unlicensed optical bands with no interference from radio. This paper reports on a measurement campaign conducted to characterize a LiFi-over-powerline link. The channel frequency response and the corresponding signal-to-noise ratio were measured up to 100 MHz under four various channel conditions, including liFi-only, powerline-only, cascaded PLCLiFi and cascaded power grid and LiFi links. In addition, the Shannon capacity and throughput, using both uniform and adaptive bit-loading, were evaluated to provide a complete linklevel performance assessment. For a power grid combined with 100 cm LiFi link, the results indicate a net data rate of $492 \text{Mbit} / \mathrm{s}$ after forward error correction decoding with a target bit error rate of $10^{-2}$, while the estimated capacity is $\mathbf{7 8 5 M b i t} /$ s.","Wireless communication, Optical fiber networks, Optical variables measurement, Light fidelity, Throughput, Adaptive optics, Power grids, Software, Telecommunications, Software measurement",2025,10.23919/SoftCOM66362.2025.11197371,https://ieeexplore.ieee.org/document/11197371
ieee:11317690,conference,Low-Complex LLR Computation for 5G-NR,❌,"5G-NR QAM LLR 계산 — 변조 복조 LLR이지 LDPC 디코더 ECC 아님, 채널 LLR과 무관","A. M. K, S. Soujanya, P. Singh","This paper presents a novel, low-complex algorithm for log-likelihood ratio (LLR) computation tailored for higher-order quadrature amplitude modulation (QAM) modulation schemes in fifth-generation new radio (5G-NR) systems. Unlike conventional approaches that require distinct, complex calculations for each modulation order, the proposed method uses a recursive framework that models LLR calculation as a scaled and shifted quadrature phase shift keying (QPSK) problem, enabling scalability and uniformity across modulation schemes. The proposed algorithm significantly reduces computational complexity and execution time by utilizing only linear operations and avoiding computationally intensive operations, making it highly suitable for hardware implementation. These reductions are achieved by the proposed scheme with almost no compromise in block error rate (BLER) performance, as demonstrated by simulation results. Its recursive and scalable design makes it a promising solution for efficient LLR computation in higher-order modulation schemes used in 5G-NR systems.","Degradation, Quadrature amplitude modulation, Error analysis, Scalability, Simulation, Physical layer, Hardware, Real-time systems, Computational complexity, Quadrature phase shift keying",2025,10.1109/FNWF66845.2025.11317690,https://ieeexplore.ieee.org/document/11317690
ieee:11437921,conference,The Dawn of 6G Standardization: Thinking on Physical Layer Design by Learning From 5G,❌,"6G 물리계층 설계 전망/서베이, 떼어낼 LDPC 디코더·코드설계 기법 없음","N. Li, F. Nan, H. Yin, J. Zhu","Till now, millions of 5 G base stations have been deployed all over the world. We've witnessed the achievements of 5G, while also gained a clear understanding of its challenges. In Aug. 2025, 3 GPP initiated the study on 6 G standardization, indicating the era of 6 G was coming. During this transitional window from 5 G to 6 G, a thorough assessment of 5 G 's strengths and shortcomings is essential to leverage these insights for the design of 6 G networks. This paper provides a comprehensive analysis of potential 6 G physical layer design based on lessons learned from 5 G together with the latest progress in 3GPP. Furthermore, some key research areas for 6G developments are identified from telecom operator's perspective.","6G mobile communication, Base stations, 5G mobile communication, Standardization, Physical layer, Telecommunications, 3GPP",2025,10.1109/ICCC68654.2025.11437921,https://ieeexplore.ieee.org/document/11437921
ieee:11174531,conference,A Reliable and Computationally Efficient Soft-Output Fixed-Complexity Sphere Decoder for Large-Scale MIMO Systems,❌,"대규모 MIMO 구체 디코더(LLR refinement); MIMO 검출이지 LDPC ECC 아님, 이식 기법 없음","Y. -M. Chen, S. -J. Jhang, Y. -L. Ueng","This paper explores a robust and computationally efficient soft-output fixed-complexity sphere decoder (FSD) designed for large-scale multiple-input multiple-output (MIMO) detection. A partial expansion strategy is designed for the first two layers of the proposed FSD, utilizing enumeration orders for both the real and imaginary components of the signal space. Additionally, a section-wise list candidate selection method, incorporating an innovative grouping strategy, is specifically designed for the leaf layer. These techniques complement each other to significantly reduce computational complexity and minimize processing delays. Furthermore, log-likelihood ratio (LLR) refinement is implemented to counteract overestimation caused by the bit-flipping algorithm, leading to notable improvements in error performance. Simulation results demonstrate that the proposed soft-output FSD achieves superior error performance compared to benchmark schemes and approaches the list sphere decoder, while maintaining significantly lower complexity.","Vehicular and wireless technologies, Simulation, Transmitting antennas, Detectors, Benchmark testing, Reliability engineering, MIMO, Decoding, Computational efficiency, Delays",2025,10.1109/VTC2025-Spring65109.2025.11174531,https://ieeexplore.ieee.org/document/11174531
ieee:11431665,conference,Secure Semantic Image Transmission over Wiretap Channels,❌,도청채널 시맨틱 이미지 전송/빔포밍 보안 — LDPC ECC 기법 없음,"X. Han, B. Feng, Y. Wu, X. -G. Xia, W. Zhang","Existing semantic communications have exhibited satisfactory performance in many tasks, but secure image transmission has not been adequately investigated. In this paper, we propose a novel secure semantic image transmission (SSIT) framework over multiple-input single-output (MISO) wiretap channels. To enhance image transmission security for a legitimate semantic user (SU) while interfering with the eavesdropper (Eve), a type of beneficial semantic noise map, which is determined by both source and SU channel states, is produced by a semantic noise-aided conditional variational autoencoder (SN-CVAE) in an unsupervised manner. Furthermore, to improve the secure image reconstruction quality, we propose an efficient transmit beamformer optimization algorithm and leverage the constrained stochastic successive convex approximation (CSSCA) to solve the optimization problem. Numerical results demonstrate that our method effectively protects image information from eavesdroppers while ensuring high-fidelity image reconstruction at the legitimate receiver.","Image communication, Wireless networks, Surveillance, Forensics, Oral communication, Semantic communication, MISO, Image reconstruction, Optimization, Eavesdropping",2025,10.1109/GLOBECOM59602.2025.11431665,https://ieeexplore.ieee.org/document/11431665
ieee:11324504,conference,Integrating Post-Quantum Cryptography with DNA-Based Data Storage for Secure and Robust Data Preservation,❌,"PQC+DNA 저장 보안 프레임워크, repetition coding 수준 outer code만; 이식할 LDPC ECC 기법 없음","J. M. Joseph, S. Cs, S. Vinod","Rapid advancements in quantum computing pose a significant threat to classical cryptographic systems such as RSA and ECC, creating an urgent need for post-quantum cryptography (PQC) to ensure long-term security. Deoxyribonucleic acid (DNA) has emerged as a promising medium for robust and covert data transmission due to its high information density, durability, and inherent concealment properties. This work introduces a hybrid security framework that combines PQC mechanisms with DNA-based encoding to enhance data confidentiality, integrity, and resilience against noise in biological communication channels. The ChaCha20Poly1305 algorithm provides authenticated encryption, while HKDF enables secure session key derivation across protocol layers. Kyber, a lattice-based key encapsulation mechanism (KEM), serves as the post-quantum key exchange component. Ciphertexts are transformed into DNA sequences through a balanced 2-bit mapping scheme, CRC16 verification, repetition coding, marker-based synchronization, and optional parity grouping. A biologically realistic noise model is constructed using substitutions, insertions, and deletions. Experimental results show that complete data recovery is achievable in substitution-dominant channels when employing a repetition factor of R equals 3, with an associated overhead of approximately 14.6 times. However, environments characterized by high rates of insertions and deletions remain challenging, highlighting the need for improved synchronization strategies and more robust outer-coding techniques. Overall, the proposed framework integrates standardized PQC algorithms with lightweight DNA-centric error-resilience methods, providing a modular foundation for secure, quantum-resistant, and privacy-preserving communication.","Encapsulation, Quantum computing, Noise, Redundancy, Encoding, Encryption, Decoding, Synchronization, Biological information theory, DNA sequencing",2025,10.1109/COMNETSAT68601.2025.11324504,https://ieeexplore.ieee.org/document/11324504
ieee:11140427,conference,Sionna Research Kit: A GPU-Accelerated Research Platform for AI-RAN,❌,"AI-RAN GPU 플랫폼/테스트베드 소개, LDPC ECC 기법 없음","S. Cammerer, G. Marcus, T. Zirr, F. A. Aoudia, L. Maggi, J. Hoydis, A. Keller","We introduce the NVIDIA Sionna Research Kit, a GPU-accelerated research platform for developing and testing AI/ML algorithms in 5G NR cellular networks. Powered by the NVIDIA Jetson AGX Orin, the platform leverages accelerated computing to deliver high throughput and real-time signal processing, while offering the flexibility of a software-defined stack. Built on OpenAirInterface (OAI) [1], it unlocks a broad range of research opportunities. These include developing 5G NR and ORAN compliant algorithms, collecting real-world data for AI/ML training, and rapidly deploying innovative solutions in a very affordable testbed. Additionally, AI/ML hardware acceleration promotes the exploration of use cases in edge computing and AI radio access networks (AI-RAN). To demonstrate the capabilities, we deploy a real-time neural receiver—trained with NVIDIA Sionna and using the NVIDIA TensorRT library for inference—in a 5G NR cellular network using commercial user equipment. The code examples will be made publicly available, enabling researchers to adopt and extend the platform for their own projects.","Cellular networks, Training, 5G mobile communication, Signal processing algorithms, Signal processing, Throughput, Real-time systems, Hardware acceleration, Testing, Radio access networks",2025,10.1109/ICMLCN64995.2025.11140427,https://ieeexplore.ieee.org/document/11140427
ieee:11068512,conference,Radio Transmitter Development to Support Multi-Gbps Satellite Downlinks in Ka-Band,❌,"Ka-band 위성 송신기 HW 개발, 고차 변조(8PSK/16APSK) — 채널코딩 부수 언급, 떼어낼 LDPC 기법 없음","M. M. Kobayashi, T. Voss, B. Douglas, Z. Towfic, C. Spurgers, M. Pugh, I. Kuperman, D. Bell","Advancements in spaceborne remote sensing technology have significantly increased the amount of data generated onboard spacecraft, necessitating a robust downlink system capable of much higher rates than previously required. For the NASA/ISRO Synthetic Aperture Radar (NISAR) mission the Jet Propulsion Laboratory (JPL) has developed a Ka-band Modulator (KaM) variant of the Universal Space Transponder (UST) product line to support 2000 Msps downlink from a single radio using Offset QPSK (OQPSK) modulation in the Earth Exploration Satellite Service (EESS) band from 25.5 to 27.0 GHz. The KaM has successfully completed its protoflight development campaign and flight models have been integrated onto the NISAR spacecraft, awaiting its launch. The KaM is a Software-Defined Radio (SDR) that offers the flexibility to change all aspects of the RF modulation to channel coding without altering the underlying hardware. This paper describes aspects of the design/implementation trade space to achieve higher data rates on the KaM while meeting transmission band spectral limitations. We explore the use of higher-order modulation schemes such as 8PSK and 16APSK, which can substantially increase data throughput within the available 1500 MHz bandwidth of the EESS band. Performance simulations and prototype radio-based characterization tests demonstrate that with firmware updates, the KaM can be upgraded to support data rates up to 3000 Msps using 8PSK modulation and 4000 Msps using 16APSK modulation. By employing a dual polarization downlink scheme using 16APSK, the updated radio could enable downlink rates of up to 8000 Msps for future missions with much greater downlink volume requirements. Link analyses are presented for Low Earth Orbit science satellites comparing the data rates against station coverage time to NASA's Near Space Network (NSN) and possible daily downlink volumes. A feasibility study is presented that evaluates high-rate lunar downlinks, pairing KaM technology with proposed Lunar Exploration Ground Sites (LEGS) considering current high-power amplifiers and antenna technology. Additionally, future Mars surface terminal links are analyzed to explore the viability of high-rate relay communications from the Martian surface to future Mars relay orbiters.","Space vehicles, Mars, Satellite broadcasting, Moon, Modulation, Downlink, Throughput, Transponders, Relays, Ka-band",2025,10.1109/AERO63441.2025.11068512,https://ieeexplore.ieee.org/document/11068512
ieee:10900633,conference,Hardware Implementation of Blind Decoding of Downlink Control Information for 5G,❌,"5G DCI 블라인드 디코딩 HW — 제어정보 탐색 구현이며 LDPC 디코더 아님, NAND로 이식할 ECC 기법 없음","Y. Anu rajarajeswari, N. Chandrachoodan, A. B. Vadapalli, J. Klutto Milleth","The user equipment (UE) based on the fifthgeneration new radio wireless communication technology standardized by 3GPP receives downlink control information (DCI) to obtain the time-frequency resources, modulation order, code rate, etc required for decoding the received data. The location of the resources containing the DCI will not be directly known to the UE instead it is received in certain possible locations informed through signaling. The UE must blindly decode multiple DCIs with different lengths from the different possible locations within a very stringent time limit of the order of 0.25 ms. This involves time consuming exhaustive search and imposes significant computation load to identify the locations for decoding multiple DCIs. In this paper, a flexible hardware implementation to perform the blind decoding (BD) within the time limit is proposed. It is found that the decoding is completed within 65% of the time available for BD by utilizing optimal resources. The proposed implementation is tested and validated for its functionality and performance using the in-house 5G testbed implemented using the Zynq Ultrascale + RFSoC ZCU111 board from Xilinx by integrating into an existing UE receive chain.","Wireless communication, Time-frequency analysis, 5G mobile communication, Computer architecture, Very large scale integration, Throughput, Downlink, Hardware, Decoding, Standards",2025,10.1109/VLSID64188.2025.00049,https://ieeexplore.ieee.org/document/10900633
ieee:11195542,conference,Achievability of Covert Quantum Communication,❌,"양자 은닉통신(qubit covert) achievability 이론; 양자 EC 원칙 제외, 고전 LDPC 유래 이식 기법 없음","E. J. D. Anderson, M. S. Bullock, F. Rozpędek, B. A. Bash","We explore covert communication of qubits over an arbitrary quantum channel. Covert communication conceals the transmissions in the channel noise, ensuring that an adversary is unable to detect their presence. We show the achievability of a square root law (SRL) for quantum covert communication similar to that for classical: $M(n) \sqrt{n}$ qubits can be transmitted covertly and reliably over $n$ uses of a general quantum channel. We lower bound $M (n)$ with and without assistance from a two-way covert classical channel. In the former case, we quantify the number of classical covert bits sufficient for our protocol.","Lower bound, Protocols, Qubit, Quantum channels, Noise, Reliability, Quantum communication, Information theory",2025,10.1109/ISIT63088.2025.11195542,https://ieeexplore.ieee.org/document/11195542
ieee:11138233,conference,Drones Jittering Enhanced Physical-Layer Key Generation,❌,"드론 물리계층 키생성(보안), LDPC ECC 기법 없음","T. Chen, D. Li, X. Fan, Y. Lou","Physical-layer key generation (PLKG) has gained critical importance for secure drone communications due to its lightweight implementation and adaptability to resource-constrained drones. However, the dominant line-of-sight path in drone channels limits wireless randomness, thereby degrading the key generation rate (KGR). To solve this problem, we propose a novel endogenous drone jittering enhanced PLKG scheme, which integrates the inherent drone jittering randomness to enhance KGR. By analyzing wireless signals and inertial measurement unit (IMU) data in the time-frequency domain, we find that the frequency of drone jittering falls within the 0-50 Hz range. Then, the discrete wavelet transform is used to extract jittering components. We quantize both the wireless signals and the extracted jittering components, then use XOR operation to combine their randomness. This forms a hybrid key generation scheme that enhances PLKG. We experimentally collect extensive wireless signal data and IMU data, and the experimental results show that, compared with the traditional PLKG scheme, the proposed scheme increases KGR by 18.6%. Furthermore, the National Institute of Standards and Technology randomness test confirms that the generated hybrid key meets sufficient randomness standards.","Wireless communication, Time-frequency analysis, Transforms, NIST, Media, Hybrid power systems, Communication system security, Synchronization, Standards, Drones",2025,10.1109/DMCIS65888.2025.11138233,https://ieeexplore.ieee.org/document/11138233
ieee:11240310,conference,Resolution Limits of Non-Adaptive 20 Questions Estimation for Tracking Multiple Moving Targets,❌,"20-questions estimation / target tracking with threshold decoding; pure estimation theory, not LDPC","C. Sun, L. Zhou, J. Wang, W. Yuan, C. Jiang, A. Hero","Motivated by the practical application of beam tracking of multiple devices in Multiple Input Multiple Output (MIMO) communication, we study the problem of non-adaptive twenty questions estimation for locating and tracking multiple moving targets under a query-dependent noisy channel. Specifically, we derive a second-order asymptotic bound on resolution for optimal query procedures and provide numerical examples to illustrate our results. In particular, we demonstrate that a single threshold decoding rule achieves the asymptotic bound. The single threshold decoding rule has reduced the computational complexity compared to the multiple threshold method proposed for locating multiple stationary targets (Zhou, Bai and Hero, TIT 2022). Finally, we illustrate our proposed algorithm for the application of beam tracking of multiple mobile transmitters in a 5G wireless network.","Target tracking, 5G mobile communication, Transmitters, Wireless networks, Noise, Estimation, MIMO, Decoding, Noise measurement, Computational complexity",2025,10.1109/ITW62417.2025.11240310,https://ieeexplore.ieee.org/document/11240310
