ID,Type,Title,Status,Reason,Authors,Abstract,Categories,Published,DOI,PDF URL
ieee:9647735,conference,Single Frequency Network Broadcasting with 5GNR Numerology,❌,5GNR SFN 방송 OFDM numerology/채널단축 수신기 연구; LDPC는 부수 언급 — 떼어낼 LDPC ECC 기법 없음,"Majid Mosavat, Guido Montorsi","This paper investigates the possibility of using 5G New Radio (5GNR) OFDM numerology in the deployment of efficient Single Frequency Networks (SFNs) for delivering TV services to user devices. The straightforward approach in the design of the physical layer for broadcasting application is based on the adoption of OFDM signalling with very long OFDM symbol and very low sub-carrier spacing (SCS). This design choice allows to dimension the Cyclic Prefix length to eliminate ISI and ICI induced by the large delay spread with a consequent overhead reduction. The 5GNR numerology is designed for unicast transmission and Cyclic Prefix lengths are not compatible with those required for large SFN networks. In this paper we consider a general receiver based on the channel shortening principle, but in the frequency domain. The receiver consists in a bank of per tone time/frequency 2D filters, possibly followed by Maximum-Likelihood (ML) trellis processing on the shortened channel. We provide promising information theoretic bound showing that the extension of 5GNR numerology to SFN is possible with very small performance loss. Even the simplest detector architecture that does not employ trellis processing provides throughput competitive with those that can be obtained with smaller SCS. We provide end to end simulation results with practical modulation and LDPC encoder confirming that the results predicted by the bounds can be closely matched in practice.",,17-19 Nov.,10.1109/LATINCOM53176.2021.9647735,https://ieeexplore.ieee.org/document/9647735
ieee:9651031,conference,GFDM-based underwater transmission scheme for image signals,❌,GFDM 수중 이미지 전송에 표준 LDPC 부수 적용 — 떼어낼 ECC 기법 없음,"Chin-Feng Lin, Cheng-Fong Wu, Ching-Lung Hsieh, Shun-Hsyung Chang","Generalized frequency division multiplexing (GFDM) transmission is an advanced communication scheme, and the main advantages of GFDM are its high spectral efficiency, high throughput, and low latency. In the paper, we design a GFDM based image transmission schemes with perfect and imperfect channel estimations for an underwater multipath fading channel model. Low-density parity-check (LDPC) channel coding is integrated into the proposed GFDM-based underwater image transmission schemes to enhance bit error rate (BER) performance. An adaptive 4 quadrature amplitude modulation (QAM) or 16-QAM, and a power assignment mechanism are integrated into the proposed scheme to achieve high transmission speed or low transmission power. The performance of the peak signal to noise ratios (PSNRs) of the original and received image signals was investigated for the proposed underwater image transmission scheme.",,16-19 Nov.,10.1109/ISPACS51563.2021.9651031,https://ieeexplore.ieee.org/document/9651031
ieee:9703612,conference,LDPC-based multi-relay lossy forwarding for correlated source transmission over orthogonal Rayleigh fading channels,❌,"다중 릴레이 lossy forwarding에 표준 LDPC+MP 적용 — 네트워크 Tanner-graph 매핑은 통신 응용 특이적, NAND 이식 가능 기법 없음","Amin Zribi, Shulin Song, Tad Matsumoto","In this paper, we design a communication and coding strategy for Lossy Forwarding (LF) systems with multiple relay nodes or helpers based on Low-Density Parity-check Codes (LDPC) with message passing decoding applied on a Tanner-graph that maps all the network. The system performance is investigated under the cases of a fixed number of helpers, and a random multiple shifted-Poisson distributed helpers for orthogonal Rayleigh fading channels. All the practical results will be also compared and validated with respect to theoretical outage probabilities.",,15-17 Nov.,10.1109/CAMA49227.2021.9703612,https://ieeexplore.ieee.org/document/9703612
ieee:9664082,conference,Design and performance analysis of Asynchronous Physical-layer Network Coding system,❌,"Physical-layer Network Coding 동기화/심볼정렬 기법, LDPC 무관·떼어낼 ECC 기법 없음","Qinghao Chen, Taibin Fang, Meng Tang, Jianhua Chen","For Physical-layer Network Coding (PNC), the problem of the symbol misalignment is a focus field. In this paper, we present an effective method to detect the number of symbol misalignment by utilizing Zadoff-Chu sequence (ZC sequence). Based on this method, we propose a joint communication system of Asynchronous Physical-layer Network Coding (APNC) and an Improved ZC sequence (IZC) based on BPSK modulation (IZC-APNC). In this system, we design a rule to the relay's symbol misalignment mapping, and correspondingly derive mathematical expressions of data processing. The simulation results show that our proposed system can effectively solve the problem of the symbol misalignment in APNC and improve the reliability of system transmission information.",,13-15 Nov.,10.1109/ICSAI53574.2021.9664082,https://ieeexplore.ieee.org/document/9664082
ieee:9618613,conference,Multi-Round Joint Belief Propagation Decoding with Perturbation for JSCC System Based on DP-LDPC Codes,❌,"DP-LDPC 기반 JSCC 소스-채널 결합 시스템, LDPC가 베이스라인, 떼어낼 순수 ECC 기법 없음","Weiwei Lin, Zhiping Xu, Shaohua Hong, Lin Wang","In this paper, a multi-round joint belief propagation (BP) decoding with perturbation algorithm is proposed for joint source-channel coding (JSCC) system based on double protograph low-density parity-check (DP-LDPC) codes to improve decoding performance. In the proposed algorithm, the joint BP decoding is concatenated with cyclic redundancy check (CRC). The reliability of each variable node (VN) is evaluated in the joint BP decoding algorithm, and the CRC is used to check the error which is undetected by the joint BP. When error is detected, re-decoding process with perturbation for the unreliable VN is aroused. The simulation results indicate that the proposed method has a better bit error rate (BER) performance in comparison with the traditional joint BP algorithm.",,11-13 Nov.,10.1109/CITS52676.2021.9618613,https://ieeexplore.ieee.org/document/9618613
ieee:9618067,conference,An Energy Efficient Hybrid FEC-ARQ Communication Scheme for Small Satellite Applications,✅,syndrome weight 진동 주기성 기반 신규 조기종료 정지기준(bit-flipping 디코더) — 이식 가능 디코더 기법(C),"Oliver Vassallo, Victor Buttigieg, Marc A. Azzopardi","With the extensive cost reductions associated with small satellites, low Earth orbit missions are increasingly becoming popular, mostly with universities and the New-Space industry. However, a persistent limitation associated with the smallest satellites is the significant reduction in energy resources that each satellite has at its disposal. This limitation poses a challenge when using advanced communication systems, particularly those employing advanced forward error correction such as low-density parity check (LDPC) codes. To conserve the high computational energy required to decode such codes, we propose a novel early termination stopping criterion for LDPC decoders that is based on detecting the periodicity of syndrome weight oscillations. The technique is independent of the operating signal-to-noise ratio and results in reductions better than 80%, in the computational energy expended on a well-known bit-flipping decoding algorithm. Real world results are presented using an ARM-based microcontroller.",,11-13 Nov.,10.1109/CITS52676.2021.9618067,https://ieeexplore.ieee.org/document/9618067
ieee:9739186,conference,Performance evaluation of offloading LDPC decoding to an FPGA in 5G baseband processing,✅,5G LDPC 디코딩 FPGA 오프로딩 아키텍처 성능평가; 이식 가능 HW 디코더 아키텍처 관점(D)으로 애매하지만 살림,"Florian Kaltenberger, Hongzhi Wang, Sakthivel Velumani","Offloading of computationally expensive physical layer processing such as the forward error correction, is one of the key enablers for a fully virtualized open radio access network (RAN). In this paper we show such an offloading architecture and will demonstrate it using the OpenAirInterface 5G New Radio open source software and the Xilinx T1 telco accelerator card. We will show the feasibility and the potential savings of such an architecture.",,10-12 Nov.,,https://ieeexplore.ieee.org/document/9739186
ieee:9739188,conference,Hardware Implementation of Cell-Free MIMO and Dynamic TDD using the OAI 5G NR Codebase,❌,"셀프리 MIMO/동적 TDD 5G NR HW 구현, LDPC·이식 가능 ECC 기법 없음","Himani Kamboj, Bhawesh Anand, Sanjhi Gupta, Ashish Meshram, Sudhakar Balijepalli, Chandra R. Murthy","The cell-edge user in a traditional cellular network experiences degraded quality of service compared to a user at the centre of the cell due to path loss and interference from neighboring base stations (BSs). Cell-free multiple input and multiple output (MIMO) is a promising technology that can improve the cell-edge performance as it offers macro-diversity and consequently improved coverage and throughput. Moreover, the network capacity in a cellular network is often underutilized due to a static time division duplex (TDD) configuration coupled with asymmetric traffic demands in neighboring cells. To handle heterogeneous traffic demands, dynamic TDD is considered to be a beneficial technology, wherein different cells can independently schedule slots in the uplink (UL)/downlink (DL) directions depending on their local traffic demands. However, dynamic TDD brings new challenges because of the introduction of cross-link interferences (CLI) between users and between BSs. Combining cell-free MIMO with dynamic TDD can effectively overcome the CLI, as there exists inbuilt co-operation between the access points (APs) in the cell-free MIMO architecture. This paper presents a hardware implementation of cell-free MIMO and dynamic TDD using the OPENAIRINTERFACE (OAI) 5G new radio (NR) software stack, with the aim to experimentally understand the role of cell-free MIMO and dynamic TDD in providing better connectivity at the cell-edge and improving network throughput.",,10-12 Nov.,,https://ieeexplore.ieee.org/document/9739188
ieee:9739167,conference,Constant-Weight Convolutional Codes for Index Modulation,❌,"인덱스변조용 정중량 컨볼루션 부호 + Viterbi 디코딩; 비-LDPC 부호, 이식 기법 없음","Daniel Nicolas Bailon, Juergen Freudenberger, Volker Kuehn","The encoding of antenna patterns with generalized spatial modulation as well as other index modulation techniques require w-out-of-n encoding where all binary vectors of length n have the same weight w. This constant-weight property cannot be obtained by conventional linear coding schemes. In this work, we propose a new class of constant-weight codes that result from the concatenation of convolutional codes with constant-weight block codes. These constant-weight convolutional codes are nonlinear binary trellis codes that can be decoded with the Viterbi algorithm. Some constructed constant-weight convolutional codes are optimum free distance codes. Simulation results demonstrate that the decoding performance with Viterbi decoding is close to the performance of the best-known linear codes. Similarly, simulation results for spatial modulation with a simple on-off keying show a significant coding gain with the proposed coded index modulation scheme.",,10-12 Nov.,,https://ieeexplore.ieee.org/document/9739167
ieee:9643510,conference,Algorithm and Hardware Co-design for Deep Learning-powered Channel Decoder: A Case Study,✅,"신경망 채널 디코더 알고리즘+systolic HW 공동설계, short LDPC FPGA 구현 — 이식 가능(C/D)","Boyang Zhang, Yang Sui, Lingyi Huang, Siyu Liao, Chunhua Deng, Bo Yuan","Channel decoder is a key component module in many communication systems. Recently, neural networks-based channel decoders have been actively investigated because of the great potential of their data-driven decoding procedure. However, as the intersection among machine learning, information theory and hardware design, the efficient algorithm and hardware codesign of deep learning-powered channel decoder has not been well studied. This paper is a first step towards exploring the efficient DNN-enabled channel decoders, from a joint perspective of algorithm and hardware. We first revisit our recently proposed doubly residual neural decoder. By introducing the advanced architectural topology on the decoder design, the overall error-correcting performance can be significantly improved. Based on this algorithm, we further develop the corresponding systolic array-based hardware architecture for the DRN decoder. The corresponding FPGA implementation for our DRN decoder on short LDPC code is also developed.",,1-4 Nov. 2,10.1109/ICCAD51958.2021.9643510,https://ieeexplore.ieee.org/document/9643510
