ID,Type,Title,Status,Reason,Algo,Authors,Abstract,Categories,Published,DOI,PDF URL
arxiv:2510.21600v1,preprint,Real-time decoding of the gross code memory with FPGAs,✅,양자 BB qLDPC 대상이나 reduced-precision FPGA BP 디코더(24ns) HW 기법이 분리 이식 가능 — Phase3 재검토,🔧 하드웨어 수정만,"Thilo Maurer, Markus Bühler, Michael Kröner, Frank Haverkamp, Tristan Müller, Drew Vandeth, Blake R. Johnson","We introduce a prototype FPGA decoder implementing the recently discovered Relay-BP algorithm and targeting memory experiments on the $[[144,12,12]]$ bivariate bicycle quantum low-density parity check code. The decoder is both fast and accurate, achieving a belief propagation iteration time of 24ns. It matches the logical error performance of a floating-point implementation despite using reduced precision arithmetic. This speed is sufficient for an average per cycle decoding time under $1\,\mathrm{μs}$ assuming circuit model error probabilities are less than $3 \times 10^{-3}$. This prototype decoder offers useful insights on the path toward decoding solutions for scalable fault-tolerant quantum computers.",quant-ph,2025-10-24,,https://arxiv.org/pdf/2510.21600v1
arxiv:2510.14843v1,preprint,Rate-Adaptive Spatially Coupled MacKay-Neal Codes with Thresholds Close to Capacity,✅,"바이너리 SC-LDPC(MacKay-Neal) 코드 설계, density evolution·BP threshold — 카테고리 E 이식 가능",✅ 알고리즘/코드 기여,"Ayman Zahr, Gianluigi Liva","We analyze by density evolution the asymptotic performance of rate-adaptive MacKay-Neal (MN) code ensembles, where the inner code is a protograph spatially coupled (SC) low-density parity-check code. By resorting to a suitably-defined parallel channel model, we compute belief propagation decoding thresholds, showing that SC MN code ensembles can perform within 0.15 dB from the binary-input additive white Gaussian noise capacity over the full [0,1] rate range.",cs.IT,2025-10-16,,https://arxiv.org/pdf/2510.14843v1
arxiv:2510.14060v2,preprint,Decoding Correlated Errors in Quantum LDPC Codes,✅,양자 BB 부호 대상이나 normalized min-sum + 하이브리드 serial-layered 스케줄·앙상블·FPGA HW 기법 이식 가능 — Phase3 재검토,✅ 알고리즘/코드 기여,"Arshpreet Singh Maan, Francisco-Garcia Herrero, Alexandru Paler, Valentin Savin","We introduce a decoding framework for correlated errors in quantum LDPC codes under circuit-level noise. The core of our approach is a graph augmentation and rewiring for interference (GARI) method, which modifies the correlated detector error model by eliminating 4-cycles involving Y-type errors, while preserving the equivalence of the decoding problem. We test our approach on the bivariate bicycle codes of distances 6, 10, and 12. A normalized min-sum decoder with a hybrid serial-layered schedule is applied on the transformed graph, achieving high accuracy with low latency. Performance is further enhanced through ensemble decoding, where 24 randomized normalized min-sum decoders run in parallel on the transformed graph, yielding the highest reported accuracy (on par with XYZ-Relay-BP) with unprecedented speed for the tested codes under uniform depolarizing circuit level noise. For the distance 12 (gross) code, our approach yields a logical error rate of $(6.70 \pm 1.93) \times 10^{-9}$ at a practical physical error rate of $10^{-3}$. Furthermore, preliminary FPGA implementation results show that such high accuracy can be achieved in real time, with a per-round average decoding latency of 273 ns and sub-microsecond latency in 99.99% of the decoding instances.",quant-ph,2025-10-15,10.1038/s41467-026-70556-3,https://arxiv.org/pdf/2510.14060v2
arxiv:2510.07179v2,preprint,Diffusion Codes: Self-Correction from Small(er)-Set Expansion with Tunable Non-locality,✅,"SWAP 네트워크 기반 새 고전 LDPC Tanner 그래프 구성(expander·locality tradeoff) — 양자 응용이나 바이너리 코드 설계(E) 이식 가능성, Phase 3 재검토",✅ 알고리즘/코드 기여,"Adithya Sriram, Vedika Khemani, Benedikt Placke","Optimal constructions of classical LDPC codes can be obtained by choosing the Tanner graph uniformly at random among biregular graphs. We introduce a class of codes that we call ``diffusion codes'', defined by placing each edge connecting bits and checks on some graph, and acting on that graph with a random SWAP network. By tuning the depth of the SWAP network, we can tune a tradeoff between the amount of randomness -- and hence the optimality of code parameters -- and locality with respect to the underlying graph. For diffusion codes defined on the cycle graph, if the SWAP network has depth $\sim Tn$ with $T> n^{2β}$ for arbitrary $β>0$, then we prove that almost surely the Tanner graph is a lossless ``smaller set'' vertex expander for small sets up size $δ\sim \sqrt T \sim n^β$, with bounded bit and check degree. At the same time, the geometric size of the largest stabilizer is bounded by $\sqrt T$ in graph distance. We argue, based on physical intuition, that this result should hold more generally on arbitrary graphs. By taking hypergraph products of these classical codes we obtain quantum LDPC codes defined on the torus with smaller-set boundary and co-boundary expansion and the same expansion/locality tradeoffs as for the classical codes. These codes are self-correcting and admit single-shot decoding, while having the geometric size of the stabilizer growing as an arbitrarily small power law. Our proof technique establishes mixing of a random SWAP network on small subsystems at times scaling with only the subsystem size, which may be of independent interest.","quant-ph, cond-mat.dis-nn, cond-mat.stat-mech, cs.IT, math.CO",2025-10-08,,https://arxiv.org/pdf/2510.07179v2
arxiv:2510.06257v1,preprint,Toward Uncertainty-Aware and Generalizable Neural Decoding for Quantum LDPC Codes,✅,"Bayesian GNN 신경망 디코더(QuBA, BP 대비 1~2자릿수 개선) — 양자 BB 코드 대상이나 신경망 디코더 아키텍처(C) 이식 가능성, Phase 3 재검토",✅ 알고리즘/코드 기여,"Xiangjun Mi, Frank Mueller","Quantum error correction (QEC) is essential for scalable quantum computing, yet decoding errors via conventional algorithms result in limited accuracy (i.e., suppression of logical errors) and high overheads, both of which can be alleviated by inference-based decoders. To date, such machine-learning (ML) decoders lack two key properties crucial for practical fault tolerance: reliable uncertainty quantification and robust generalization to previously unseen codes. To address this gap, we propose \textbf{QuBA}, a Bayesian graph neural decoder that integrates attention to both dot-product and multi-head, enabling expressive error-pattern recognition alongside calibrated uncertainty estimates. Building on QuBA, we further develop \textbf{SAGU }\textbf{(Sequential Aggregate Generalization under Uncertainty)}, a multi-code training framework with enhanced cross-domain robustness enabling decoding beyond the training set. Experiments on bivariate bicycle (BB) codes and their coprime variants demonstrate that (i) both QuBA and SAGU consistently outperform the classical baseline belief propagation (BP), achieving a reduction of on average \emph{one order of magnitude} in logical error rate (LER), and up to \emph{two orders of magnitude} under confident-decision bounds on the coprime BB code $[[154, 6, 16]]$; (ii) QuBA also surpasses state-of-the-art neural decoders, providing an advantage of roughly \emph{one order of magnitude} (e.g., for the larger BB code $[[756, 16, \leq34]]$) even when considering conservative (safe) decision bounds; (iii) SAGU achieves decoding performance comparable to or even outperforming QuBA's domain-specific training approach.","quant-ph, cs.IT, cs.LG",2025-10-05,,https://arxiv.org/pdf/2510.06257v1
arxiv:2510.01019v1,preprint,Layered Normalized Min-Sum Decoding with Bit Flipping for FDPC Codes,✅,"Layered NMS + syndrome-guided bit flipping 새 디코더(바이너리, LLR 활용) — min-sum 변형(C), NAND LDPC에 직접 이식 가능",✅ 알고리즘/코드 기여,"Niloufar Hosseinzadeh, Mohsen Moradi, Hessam Mahdavifar","Fair-density parity-check (FDPC) codes have been recently introduced demonstrating improved performance compared to low-density parity-check (LDPC) codes standardized in 5G systems particularly in high-rate regimes. In this paper, we introduce a layered normalized min-sum (LNMS) message-passing decoding algorithm for the FDPC codes. We also introduce a syndrome-guided bit flipping (SGBF) method to enhance the error-correction performance of our proposed decoder. The LNMS decoder leverages conflict graph coloring for efficient layered scheduling, enabling faster convergence by grouping non-conflicting check nodes and updating variable nodes immediately after each layer. In the event of decoding failure, the SGBF method is activated, utilizing a novel reliability metric that combines log-likelihood ratio (LLR) magnitudes and syndrome-derived error counts to identify the least reliable bits. A set of candidate sequences is then generated by performing single-bit flips at these positions, with each candidate re-decoded via LNMS. The optimal candidate is selected based on the minimum syndrome weight. Extensive simulation results demonstrate the superiority of the proposed decoder. Numerical simulations on FDPC$(256,192)$ code with a bit-flipping set size of $T = 128$ and a maximum of $5$ iterations demonstrate that the proposed decoder achieves approximately a $0.5\,\mathrm{dB}$ coding gain over standalone LNMS decoding at a frame error rate (FER) of $10^{-3}$, while providing coding gains of $0.75-1.5\,\mathrm{dB}$ over other state-of-the-art codes including polar codes and 5G-LDPC codes at the same length and rate and also under belief propagation decoding.",cs.IT,2025-10-01,,https://arxiv.org/pdf/2510.01019v1
