ID,Type,Title,Authors,Abstract,Categories,Published,DOI,PDF URL,Status
ieee:4350321,journal,Iterative Signal Processing for Coded LSTF Architectures,"Yuanliang Huang, Jiangzhou Wang, Kenichi Higuchi, Mamoru Sawahashi","For high speed orthogonal frequency division multiplexing (OFDM) plus multiple-input multiple-output (MIMO) multiplexing, a new coded layered space-time-frequency (LSTF) architecture with iterative signal processing at the receiver is proposed, where each independent codeword is threaded in the three-dimensional (3D) space-time-frequency transmission resource array. The iterative receiver structur...",,October 20,10.1109/TWC.2007.060088,https://ieeexplore.ieee.org/document/4350321,new
ieee:4346665,journal,A Versatile Variable Rate LDPC Codec Architecture,"Colm P. Fewer, Mark F. Flanagan, Anthony D. Fagan","This paper presents a system architecture for low-density parity-check (LDPC) codes that allows dynamic switching of LDPC codes within the encoder and decoder without hardware modification of these modules. Thus, rate compatibility is facilitated without the performance degradation inherent in a puncture-based system. This versatility also allows the LDPC system to be used in a variety of applicat...",,Oct. 2007,10.1109/TCSI.2007.904641,https://ieeexplore.ieee.org/document/4346665,new
ieee:4303212,journal,Improved Data Recovery from Patterned Media With Inherent Jitter Noise Using Low-Density Parity-Check Codes,"Ioannis T. Ntokas, Paul W. Nutter, Cen J. Tjhai, Mohammed Z. Ahmed","Patterned magnetic media promises areal densities in excess of 1 Tbit/in2 for data storage. However, current imperfect patterning techniques result in a variation in the dimensions and distribution of the fabricated islands. As a result, this variation introduces jitter in the replay waveform that makes data recovery difficult. In this paper, we investigate the use of low-density parity-check (LDP...",,Oct. 2007,10.1109/TMAG.2007.903349,https://ieeexplore.ieee.org/document/4303212,new
ieee:4305411,journal,Bilayer Low-Density Parity-Check Codes for Decode-and-Forward in Relay Channels,"Peyman Razaghi, Wei Yu",This paper describes an efficient implementation of binning for decode-and-forward (DF) in relay channels using low-density parity-check (LDPC) codes. Bilayer LDPC codes are devised to approach the theoretically promised rate of the DF relaying strategy by incorporating relay-generated parity bits in specially designed bilayer graphical code structures. While conventional LDPC codes are sensitivel...,,Oct. 2007,10.1109/TIT.2007.904983,https://ieeexplore.ieee.org/document/4305411,new
ieee:4317713,journal,"Design and Test of a 175-Mb/s, Rate-1/2 (128,3,6) Low-Density Parity-Check Convolutional Code Encoder and Decoder","R. Swamy, S. Bates, T.L. Brandon, B.F. Cockburn, D.G. Elliott, J.C. Koob, Zhengang Chen","Low-density parity-check block codes (LDPC-BCs) are quickly becoming the forward error correcting code of choice for emerging communication standards. However, low-density parity-check convolutional codes (LDPC-CCs), the convolutional counterpart of LDPC-BCs, seem to be better suited in applications with streaming data or variable sized packets. A rate-1/2, (128,3,6) LDPC-CC ASIC has been implemen...",,Oct. 2007,10.1109/JSSC.2007.905232,https://ieeexplore.ieee.org/document/4317713,new
ieee:4303151,journal,PRISM: A Video Coding Paradigm With Motion Estimation at the Decoder,"Rohit Puri, Abhik Majumdar, Kannan Ramchandran","We describe PRISM, a video coding paradigm based on the principles of lossy distributed compression (also called source coding with side information or Wyner-Ziv coding) from multiuser information theory. PRISM represents a major departure from conventional video coding architectures (e.g., the MPEGx, H.26x families) that are based on motion-compensated predictive coding, with the goal of addressi...",,Oct. 2007,10.1109/TIP.2007.904949,https://ieeexplore.ieee.org/document/4303151,new
ieee:4305396,journal,Cooperative Strategies and Achievable Rate for Tree Networks With Optimal Spatial Reuse,"Omer Gurewitz, Alexandre de Baynast, Edward W. Knightly","In this paper, a low-complexity cooperative protocol that significantly increases the average throughput of multihop upstream transmissions for wireless tree networks is developed and analyzed. A system in which transmissions are assigned to nodes in a collision free, spatial time division fashion is considered. The suggested protocol exploits the broadcast nature of wireless networks where the co...",,Oct. 2007,10.1109/TIT.2007.905000,https://ieeexplore.ieee.org/document/4305396,new
ieee:4352081,journal,Nonlinear Codes: The Product Construction,Ofer Amrani,"The standard product construction is discussed with respect to nonlinear codes. Thus, so-called nonlinear product codes are obtained that are better than linear product codes of similar length and code rate, and at the same time, amenable for encoding/decoding. On the other hand, it is shown that certain notorious nonlinear codes have an augmented product construction, namely, they can be construc...",,Oct. 2007,10.1109/TCOMM.2007.906365,https://ieeexplore.ieee.org/document/4352081,new
ieee:4384368,journal,Palomar Receive Terminal (PRT) for the Mars Laser Communication Demonstration (MLCD) Project,"Abhijit Biswas, Bruce Moision, William T. Roberts, William H. Farr, Andrew Gray, Kevin Quirk, Jon Hamkins, Michael K. Cheng, Jonathan Gin, Michael Nakashima, Gerardo G. Ortiz, Sabino Piazzolla, Carl Christian Liebe, David L. Losh","Significant technological advances were made toward utilizing the Hale telescope for receiving the faint laser communication signals transmitted from an optical transceiver on a spacecraft orbiting Mars. The so-called Palomar receive terminal design, which would have supported nominal downlink data rates of 1-30 Mbps, is described. Testing to validate technologies for near-Sun (3deg from edge of s...",,Oct. 2007,10.1109/JPROC.2007.905054,https://ieeexplore.ieee.org/document/4384368,new
ieee:4303215,journal,Quasi-Reduced-State Soft-Output Viterbi Detector for Magnetic Recording Read Channel,"Fei Sun, Tong Zhang","Reduced-state trellis detection with decision feedback is widely used to reduce the energy consumption of trellis detectors, particularly for soft-output trellis detectors that are energy-hungry by nature. However, the decision feedback tends to increase the circuit critical path and, more important, makes it difficult to apply some well-proven high-speed trellis detector design techniques such as...",,Oct. 2007,10.1109/TMAG.2007.904190,https://ieeexplore.ieee.org/document/4303215,new
ieee:4352099,journal,Joint Carrier Phase Estimation and Turbo Decoding Using Bit Carrier Phase APP Decoder,"Amir Saroka, Dan Raphaeli","In this paper, we present an algorithm for joint carrier phase estimation and turbo decoding for the case of rapidly varying carrier phase during the transmitted block. The proposed algorithm shows improved performance over previously proposed communication schemes, both coherent and noncoherent, for channels with additive white Gaussian noise and high carrier phase noise. The novel algorithm util...",,Oct. 2007,10.1109/TCOMM.2007.906402,https://ieeexplore.ieee.org/document/4352099,new
ieee:4305410,journal,The Design and Performance of Distributed LT Codes,"Srinath Puducheri, JÖrg Kliewer, Thomas E. Fuja","This paper describes techniques to decompose LT codes (a class of rateless erasure-correcting codes) into distributed LT (DLT) codes. DLT codes can be used to independently encode data from multiple sources in a network in such a way that, when the DLT-encoded packets are combined at a common relay, the resulting bit stream (called a modified LT (MLT) code) has a degree distribution approximating ...",,Oct. 2007,10.1109/TIT.2007.904982,https://ieeexplore.ieee.org/document/4305410,new
ieee:4428620,conference,Retransmission or Redundancy: Transmission Reliability in Wireless Sensor Networks,"Hao Wen, Chuang Lin, Fengyuan Ren, Yao Yue, Xiaomeng Huang","As an application-driven network, wireless sensor network generally requires high data reliability to maintain detection and response capabilities. Although two approaches, which are retransmission and redundancy, have been proposed to enhance data reliability, the theoretical work is required to evaluate their impact on transmission reliability and energy efficiency. In this paper, we offer a com...",,8-11 Oct. ,10.1109/MOBHOC.2007.4428620,https://ieeexplore.ieee.org/document/4428620,new
ieee:4390813,conference,Pseudo-ARQ for a Low Density Parity Check Code Decoder,"Damien Alleyne, Janak Sodha","A pseudo automatic repeat request scheme for a LDPC decoder is presented which dramatically improves the probability of an error in an information binary digit over the signal-to-noise ratio (SNR) range 0 dB to 2 dB, by sacrificing the information throughput, with the added advantage of not being adversely affected by a fluctuation in the channel SNR. A frame, which consists of the concatenation o...",,8-10 Oct. ,10.1109/WIMOB.2007.4390813,https://ieeexplore.ieee.org/document/4390813,new
ieee:4601900,conference,Implementing a 2-Gbs 1024-bit ½-rate low-density parity-check code decoder in three-dimensional integrated circuits,"Lili Zhou, Cherry Wakayama, Robin Panda, Nuttorn Jangkrajarng, Bo Hu, C.-J. Richard Shi","A 1024-bit, ½-rate fully parallel low-density parity-check (LDPC) code decoder has been designed and implemented using a three-dimensional (3D) 0.18??m fully depleted silicon-on-insulator (FDSOI) CMOS technology based on wafer bonding. The 3D-IC decoder was implemented with about 8M transistors, placed on three tiers, each with one active layer and three metal layers, using 6.9mm by 7.0mm of die a...",,7-10 Oct. ,10.1109/ICCD.2007.4601900,https://ieeexplore.ieee.org/document/4601900,new
ieee:4601964,conference,Maximizing the throughput-area efficiency of fully-parallel low-density parity-check decoding with C-slow retiming and asynchronous deep pipelining,"Ming Su, Lili Zhou, C.-J. Richard Shi","In this paper, we apply C-slow retiming and asynchronous deep pipelining to maximize the throughput-area efficiency of fully parallel low-density-parity-check (LDPC) decoding. Pipelined decoders are implemented in a 0.18 mum FDSOI CMOS process. Experimental results show that our pipelining technique is an efficient approach to maximizing LDPC decoding throughput while minimizing the area consumpti...",,7-10 Oct. ,10.1109/ICCD.2007.4601964,https://ieeexplore.ieee.org/document/4601964,new
ieee:4349918,conference,A Fast-Convergence Decoding Method and Memory-Efficient VLSI Decoder Architecture for Irregular LDPC Codes in the IEEE 802.16e Standards,"Yeong-Luh Ueng, Chung-Chao Cheng","In this paper, we propose a modified iterative decoding algorithm to decode a special class of quasi-cyclic low- density parity-check (QC-LDPC) codes such as QC-LDPC codes used in the IEEE 802.16e standards. The proposed decoding is implemented by serially decoding block codes with identical parity-check matrix H1 derived from the parity-check matrix H of the QC-LDPC codes. The dimensions of H1 ar...",,30 Sept.-3,10.1109/VETECF.2007.269,https://ieeexplore.ieee.org/document/4349918,new
ieee:4349877,conference,Design of Rate-Compatible Irregular LDPC Codes Based on Edge Growth and Parity Splitting,"Noah Jacobsen, Robert Soni","This paper considers the design of rate-compatible low-density parity-check (LDPC) codes with optimized degree distributions for their corresponding rates. The proposed design technique is based on extension, where a high-rate base code, or daughter code, is progressively extended to lower and lower rates such that each extension code is compatible with the previously obtained codes. Specifically,...",,30 Sept.-3,10.1109/VETECF.2007.228,https://ieeexplore.ieee.org/document/4349877,new
ieee:4349893,conference,Row-Splitting Design of Low-Density Parity-Check Codes for Gbps Transmission,"Jong-Ee Oh, Minho Cheong, Cheol-Hui Ryu, Seokhyun Yoon, Sok-Kyu Lee","In this paper, we propose a design methodology of low-density parity check (LDPC) code for very high speed transmission. To support various code rates with reasonable hardware and, possibly, the type-II hybrid automatic repeat request (HARQ), a row-splitting/combining method is employed in conjunction with shortening. In row-splitting approach, a parity check matrix of a high rate mother LDPC code...",,30 Sept.-3,10.1109/VETECF.2007.244,https://ieeexplore.ieee.org/document/4349893,new
ieee:4349925,conference,The Application of EESM and MI-Based Link Quality Models for Rate Compatible LDPC Codes,"Xiang Chen, Lei Wan, Zhenyuan Gao, Zesong Fei, Jingming Kuang","System evaluation of different resource allocation, power control and link adaptation (LA) solutions require the multi-cell system simulations, which provide important reference to the standardization and system design. Such a system-level simulator is expected to be reliable and quick enough, which requires a very accurate and simple link quality model. The exponential effective-SNR mapping (EESM...",,30 Sept.-3,10.1109/VETECF.2007.276,https://ieeexplore.ieee.org/document/4349925,new
ieee:4349876,conference,Tail-Biting LDPC Convolutional Codes Based on Protographs,"Marcos B. S. Tavares, Kamil Sh. Zigangirov, Gerhard P. Fettweis","In this paper, we introduce and investigate the tail- biting low-density parity-check convolutional codes (LDPCCCs) based on protographs. We show a construction algorithm for these codes, which is based on a modified version of the PEG algorithm [1] and on the unwrapping [2] technique. The basic ideas behind the decoder architecture for these codes are also discussed. Finally, the performances of ...",,30 Sept.-3,10.1109/VETECF.2007.227,https://ieeexplore.ieee.org/document/4349876,new
ieee:4349896,conference,Architecture and Design Methodology for Structured LDPC Decoder,"Jean-Baptiste Dore, Pierre Penard, Marie-Helene Hamon","In this paper we propose a decoding architecture for turbo-like decoding algorithm of a particular class of Low-Density Parity Check codes. We define a methodology to design codes. In a first step a hardware architecture and the decoding scheduling are first selected. Then rules for the design of these codes are derived, aiming at improving the convergence of the decoding algorithm, while fitting ...",,30 Sept.-3,10.1109/VETECF.2007.247,https://ieeexplore.ieee.org/document/4349896,new
ieee:4349897,conference,Size Compatible (SC)-Array LDPC Codes,"Daisuke Abematsu, Tomoaki Ohtsuki, Sigit P. W. Jarot, Tsuyoshi Kashima","Array low density parity check (LDPC) codes are high-rate codes that can achieve good error rate performance in additive white Gaussian noise (AWGN) channels. However, array LDPC codes do not support arbitrary code lengths, because the code length of an array LDPC code with good error rate performance is limited to a multiple of a prime number. This paper proposes Size Compatible (SC)-array LDPC c...",,30 Sept.-3,10.1109/VETECF.2007.248,https://ieeexplore.ieee.org/document/4349897,new
ieee:4349916,conference,Degree Distribution Based MIMO - LDPC Scheme,"Yiqing Cao, Xuehua Li, Zhensong Li, Dacheng Yang","In this paper, an LDPC based MIMO scheme is proposed in which matrix modulation scheme of MIMO and unequal protection ability of irregular LDPC codes are employed. The new scheme named degree distribution based-MIMO (DDB-MIMO for short) combines the two schemes, in which the important bits with large degrees are transmitted in transmission diversity (TD) symbols and bits with small degrees are map...",,30 Sept.-3,10.1109/VETECF.2007.267,https://ieeexplore.ieee.org/document/4349916,new
ieee:4349859,conference,LDPC-Coded HARQ Throughput Performance of MC-CDMA Using ICI Cancellation,"Kaoru Fukuda, Akinori Nakajima, Fumiyuki Adachi",Broadband packet data services are demanded in the next generation mobile communications systems. Multi-carrier CDMA (MC-CDMA) is considered to be a promising wireless technique. Hybrid ARQ (HARQ) is a powerful error control technique. It is known that the HARQ throughput performance of MC-CDMA degrades due to the residual inter-code interference (ICI) after frequency-domain equalization (FDE). Th...,,30 Sept.-3,10.1109/VETECF.2007.210,https://ieeexplore.ieee.org/document/4349859,new
ieee:4350012,conference,Soft Decoding Assisted Interference Cancellation in a Non-Binary LDPC Coded Fast Frequency Hopping Multiuser System Using Product Combining,"Sohail Ahmed, Lie-Liang Yang, Lajos Hanzo, Feng Guo","In this contribution, soft-input-soft-output (SISO) decoding aided successive interference cancellation (SIC) is considered in fast frequency hopping (FFH), M-ary frequency shift keying (MFSK) using product combining (PC), when operating in multiple access (MA) Nakagami-m channels. All users&#39; M-ary source symbols are encoded using non-binary LDPC codes and the encoded symbols are transmitted using...",,30 Sept.-3,10.1109/VETECF.2007.363,https://ieeexplore.ieee.org/document/4350012,new
ieee:4350075,conference,On the Secrecy Capabilities of ITU Channels,"Chunxuan Ye, Alex Reznik, Gregory Sternberg, Yogendra Shah",We consider the secrecy inherent in the reciprocal nature of multipath fading channels and present a technique to generate a shared perfectly secret key by two terminals observing a multipath fading channel. Using this technique we quantify the secrecy that can be generated from ITU cellular channels for the 2 GHz frequency range.,,30 Sept.-3,10.1109/VETECF.2007.426,https://ieeexplore.ieee.org/document/4350075,new
ieee:4349881,conference,Joint Optimization of Iterative Source and Channel Decoding Using Over-Complete Source-Mapping,"A. Q. Pham, Lie-Liang Yang, Lajos Hanzo","The intentionally imposed or inherent unintentional residual redundancy found in source encoded bitstreams can be exploited for supporting joint SoftBit-source decoding and channel decoding, which has the potential of improving both error correcting capability as well as the subjective audio or video quality of communication systems. As a potent error concealment technique, the softbit-based sourc...",,30 Sept.-3,10.1109/VETECF.2007.232,https://ieeexplore.ieee.org/document/4349881,new
ieee:4349907,conference,BERT Chart Analysis of Adaptive and Non-Adaptive Turbo Frequency Domain Equalization,"Maryam Sabbaghian, David Falconer","This paper analyzes the performance of turbo frequency domain equalization (TFDE) with 16-QAM by bit error rate transfer (BERT) chart. We derive the BERT chart for the two cases in which the equalizer adapts or does not adapt from iteration to iteration. In the first case, the equalizer parameters change during iterations based on the feedback information and in the latter case they do not change....",,30 Sept.-3,10.1109/VETECF.2007.258,https://ieeexplore.ieee.org/document/4349907,new
ieee:4455131,conference,EM Channel Estimation for Iterative DS-CDMA Receiver using LDPC Codes with M-ary Modulation,"Don Torrieri, Amitav Mukherjee, Hyuck M. Kwon","This paper proposes an iterative pilot-symbol-aided direct-sequence code-division multiple-access receiver. The receiver uses a regular low-density parity-check (LDPC) code, iterative demodulation and decoding, and iterative estimators for the fading amplitude and noise power spectral density (PSD). The expectation-maximization channel-estimation performance is analyzed for an additive white Gauss...",,29-31 Oct.,10.1109/MILCOM.2007.4455131,https://ieeexplore.ieee.org/document/4455131,new
ieee:4454752,conference,Short Protograph-Based LDPC Codes,"Dariush Divsalar, Sam Dolinar, Christopher Jones","In this paper we design protograph-based LDPC codes with short block sizes. Mainly we consider rate 1/2 codes with input block sizes 64, 128, and 256 bits. To simplify the encoder and decoder implementations for high data rate transmission, the structure of the codes is based on protographs and circulants. These codes are designed for short block sizes based on maximizing the minimum distance and ...",,29-31 Oct.,10.1109/MILCOM.2007.4454752,https://ieeexplore.ieee.org/document/4454752,new
ieee:4454753,conference,High Performance Nonbinary Quasi-Cyclic LDPC Codes on Euclidean Geometries,"Bo Zhou, Jingyu Kang, Ying Y. Tai, Qin Huang, Shu Lin","This paper presents algebraic methods for constructing efficiently encodable and high performance nonbinary quasi-cyclic LDPC codes based on hyperplanes of Euclidean geometries and masking. Codes constructed from these methods perform very well over the AWGN channel. With iterative decoding using a Fast Fourier Transform based sum-product algorithm, they achieve significantly large coding gains ov...",,29-31 Oct.,10.1109/MILCOM.2007.4454753,https://ieeexplore.ieee.org/document/4454753,new
ieee:4454772,conference,Attack Resilient Network Channel Code for the Wireless Multiple Access Relay Network,"Cheng-Chun Chang, Heung-No Lee","We consider a wireless multiple access network where the sender nodes are aided by a number of relay nodes. A two-phase transmission protocol is utilized. Low-density parity-check codes are used at sender nodes in the time-domain. A low-density generator-matrix code is formed across the spatial domain under the spirit of network coding. Looking at it from the perspective of the access node, the re...",,29-31 Oct.,10.1109/MILCOM.2007.4454772,https://ieeexplore.ieee.org/document/4454772,new
ieee:4454892,conference,Frequency-Hop Antijam Communications with Nonbinary Error-Control Coding,"Shu Lin, Michael R. Masse, Michael B. Pursley, Thomas C. Royster, Shumei Song","Reed-Solomon codes are nonbinary error-control codes that have been employed in military frequency-hop spread-spectrum systems to mitigate the effects of partial-band jamming and other frequency-selective disturbances. Hermitian codes, which are also nonbinary codes, have been suggested as alternatives because they have longer block lengths for the same alphabet size. More recently, construction m...",,29-31 Oct.,10.1109/MILCOM.2007.4454892,https://ieeexplore.ieee.org/document/4454892,new
ieee:4455166,conference,Performance of LDPC Coded MC-CDMA Downlink Sysetm with Constant Envelope Spread Sequences,"Jun Luo, Jean H. Andrian, Chi Zhou, James P. Stephens","This paper proposes a Low Density Parity Coding (LDPC) Coded Multicarrier Code Division Multiple Access (MC-CDMA) downlink system with constant envelope spread sequences. Unlike traditional downlink MC-CDMA systems, the Complex Quadratic Sequences (CQS), which has constant envelope in both time and frequency domains, is used as the spread sequences. The CQS helps the system decrease the Peak-to-Av...",,29-31 Oct.,10.1109/MILCOM.2007.4455166,https://ieeexplore.ieee.org/document/4455166,new
ieee:4438578,conference,A Reliable Scheme for Cluster Storage System,"Xu Li, Changsheng Xie, Qinqi Wei, Qiang Cao","An important issue in the design of large-scale cluster storage systems is their vulnerability to nodes crash and network failures. To explore the feasibility of implementing a reliable, high performance distributed cluster storage system, we adopt a reliable scheme that data are distributed across storage nodes using erasure coding with small low-density parity-check (LDPC) code. We implement our...",,29-31 Oct.,10.1109/SKG.2007.84,https://ieeexplore.ieee.org/document/4438578,new
ieee:4455301,conference,Dispersity Routing: Past and Present,N. F. Maxemchuk,"Dispersity Routing is a multi-path routing rule that the author proposed for the ARPA-net more than 35 years ago. Since that time, dispersity routing and other multi-path routing techniques, have been proposed for many networks, for different reasons. However, dispersity routing isn&#39;t used in any major networks. We will present some of the reasons why dispersity routing was considered and show how...",,29-31 Oct.,10.1109/MILCOM.2007.4455301,https://ieeexplore.ieee.org/document/4455301,new
ieee:4455046,conference,Recent Progress in Interleave-Division Multiple-Access (IDMA),"Li Ping, Peng Wang, Xiaodong Wang","In this paper, we outline several new developments related to interleave-division multiple-access (IDMA). Our discussion encompasses analysis and optimization techniques, superposition-coded modulation, frequency domain processing schemes and the applications of IDMA in multiple-input multiple-output, relay and ad hoc environments. We demonstrate the flexibility and robustness provided by IDMA. We...",,29-31 Oct.,10.1109/MILCOM.2007.4455046,https://ieeexplore.ieee.org/document/4455046,new
ieee:4455014,conference,End-to-End Channel Assurance for Communication over Open Voice Channels,"David J. Coumou, Gaurav Sharma",Voice channels are commonly utilized in a wide variety of communication and control scenarios that span the gamut of applications ranging from military and commercial aviation to emergency response applications. Often the existing equipment for these applications utilizes openly accessible voice communication systems that offer no assurance of data security or integrity. It is possible to secure t...,,29-31 Oct.,10.1109/MILCOM.2007.4455014,https://ieeexplore.ieee.org/document/4455014,new
ieee:4455187,conference,On the use of Small Satellites for Operational Responsive Space Missions,Jerry Brand,"As the warfighter moves through the 21st century, an Operational Responsive Space (ORS) segment can bring significant force advantages. These benefits support diverse missions providing the combat commander enhancements such as ISR data, data exfiltration, current weather and terrain mappings, container or ship tracking as well as others such as hyperspectral or multispectral imaging. While the OR...",,29-31 Oct.,10.1109/MILCOM.2007.4455187,https://ieeexplore.ieee.org/document/4455187,new
