ID,Type,Title,Authors,Abstract,Categories,Published,DOI,PDF URL,Status
ieee:10950452,journal,Reversible Data Hiding in Encrypted Images Based on Edge-Directed Prediction and Multi-MSB Self-Prediction,Yingqiang Qiu,"With the development of cloud computing, reversible data hiding in encrypted images (RDH-EI) technology has gained significant attention in ensuring data security and privacy protection. This paper proposes a high-capacity RDH-EI method that employs a dual prediction strategy, including edge-directed prediction and multiple most significant bits (multi-MSB) self-prediction. First, the image owner utilizes the edge-directed property of least-square optimization to enhance the accuracy of pixel prediction. Subsequently, each pixel undergoes self-prediction starting from the MSB and progressing towards an adaptive high-order bit-plane, plane by plane. A binary location map marks the prediction errors for each bit-plane. After being losslessly compressed using the Joint Bi-level Image Experts Group (JBIG) algorithm, the location maps are embedded into the encrypted image as auxiliary data, thereby creating ample room for embedding additional data. Next, the data hider retrieves the auxiliary data from the encrypted image and embeds the additional data into the reserved embedding room, resulting in a marked encrypted image. Finally, authorized recipients with different keys can either accurately extract data or precisely restore the image from the marked encrypted image without any errors. The experimental results show that the proposed method achieves average pure embedding rates of 4.240 bpp for BOSSBase dataset and 4.088 bpp for BOWS-2 dataset, respectively, outperforming many state-of-the-art RDH-EI methods.",,2025,10.1109/ACCESS.2025.3558369,https://ieeexplore.ieee.org/document/10950452,new
ieee:10795657,journal,Near-Optimal MIMO Detection Using Gradient-Based MCMC in Discrete Spaces,"Xingyu Zhou, Le Liang, Jing Zhang, Chao-Kai Wen, Shi Jin","The discrete nature of transmitted symbols poses challenges for achieving optimal detection in multiple-input multiple-output (MIMO) systems associated with a large number of antennas. Recently, the combination of two powerful machine learning methods, Markov chain Monte Carlo (MCMC) sampling and gradient descent, has emerged as a highly efficient solution to address this issue. However, existing gradient-based MCMC detectors are heuristically designed and thus are theoretically untenable. To bridge this gap, we introduce a novel sampling algorithm tailored for discrete spaces. This algorithm leverages gradients from the underlying continuous spaces for acceleration while maintaining the validity of probabilistic sampling. We prove the convergence of this method and also analyze its convergence rate using both MCMC theory and empirical diagnostics. On this basis, we develop a MIMO detector that precisely samples from the target discrete distribution and generates posterior Bayesian estimates using these samples, whose performance is thereby theoretically guaranteed. Furthermore, our proposed detector is highly parallelizable and scalable to large MIMO dimensions, positioning it as a compelling candidate for next-generation wireless networks. Simulation results show that our detector achieves near-optimal performance, significantly outperforms state-of-the-art baselines, and showcases resilience to various system setups.",,2025,10.1109/TSP.2024.3516502,https://ieeexplore.ieee.org/document/10795657,new
ieee:11201271,journal,Physical-Layer Secure Optical Transmission Based on Randomized Quantization Noise,"Hanwen Luo, Ziheng Zhang, Longquan Dai, Di Wu, Qi Yang, Lei Deng, Deming Liu, Xiaoxiao Dai, Mengfan Cheng","In this paper, we propose a novel physical layer security optical transmission scheme utilizing randomized quantization noise. The proposed approach encrypts low-order plaintext signals into ultra-high-order ciphertext using principles similar to quantum noise stream cipher (QNSC). While, the ultra-dense quadrature amplitude modulation (QAM) ciphertext waveforms are masked by intrinsic quantization noise. The combination of digital delta-sigma quantization and analog chaotic random scrambling not only produces randomized quantization noise, but also naturally supports one-time processing of masking ciphertext and generating keystream. Whereby, the in-band quantization noise (IBN) conceals nearby ciphertext levels bolstering security, and the out-of-band quantization noise (OOBN) is digitized to generate keystream using the Toeplitz hashing extractor. Experimental results show that 256-QAM plaintext signals were securely transmitted over standard single-mode fiber: 163-Gbps signals over 400 km, and 79.7-Gbps signals over 1800 km. To evaluate system performance, theoretical models for signal-to-noise ratio (SNR), bit error rate (BER), and number of masked signals (NMS) are derived as functions of the oversampling ratio (OSR). Our findings reveal a trade-off between transmission performance and security performance. Our results confirm that this scrambling effectively eliminates the correlation between the masking noise components. Toeplitz hashing extractor can effectively reduce the complexity of keystream generation and obtain a source-independent random keystream.",,2025,10.1109/TIFS.2025.3620673,https://ieeexplore.ieee.org/document/11201271,new
ieee:10870223,journal,Enhanced Visible Light Communication for Real-Time Audio With Interference-Resilient Protocols,"Kanchana Chathurangi Ahangama, Hemali Pasqual, Chinthaka Premachandra, H. Waruna Haripriya Premachandra","Despite its potential for high-speed data transmission, visible light communication (VLC) technology faces significant challenges in achieving reliable real-time audio streaming due to interference, signal degradation, and synchronization issues. These limitations hinder the widespread adoption of VLC technology, especially in high-quality audio transmission. This paper introduces a novel VLC transceiver design incorporating advanced interference-resilient protocols, dynamic frame structuring, and robust error correction algorithms to enhance audio streaming performance. The proposed system achieves a signal-to-noise ratio (SNR) of 45 dB, reduces the bit error rate (BER) by up to four orders of magnitude to  $1 \times 10^{-6}$ , and lowers the total latency by 50%. Furthermore, synchronization errors are reduced by 66.7%, while the mean opinion score (MOS) reaches 4.8, and the objective difference grade (ODG) improves to -0.5. The comparative analysis demonstrates significant advantages over Wi-Fi (802.11ac), VLC IM/DD, and state-of-the-art VLC systems. These findings establish the proposed system as a reliable solution for real-time, high-fidelity audio applications and a foundation for extending VLC technology to broader domains.",,2025,10.1109/ACCESS.2025.3538588,https://ieeexplore.ieee.org/document/10870223,new
ieee:10829389,journal,Piecewise Student's t-distribution Mixture Model-Based Estimation for NAND Flash Memory Channels,"Cheng Wang, Zhen Mei, Jun Li, Kui Cai, Lingjun Kong","Accurate modeling and estimation of the threshold voltages of the flash memory can facilitate the efficient design of channel codes and detectors. However, most flash memory channel models are based on Gaussian distributions, which fail to capture certain key properties of the threshold voltages, such as their heavy-tails. To enhance the model accuracy, we first propose a piecewise student's t-distribution mixture model (PSTMM), which features degrees of freedom to control the left and right tails of the voltage distributions. We further propose an PSTMM based expectation maximization (PSTMM-EM) algorithm to estimate model parameters for flash memories by alternately computing the expected values of the missing data and maximizing the likelihood function with respect to the model parameters. Simulation results demonstrate that our proposed algorithm exhibits superior stability and can effectively extend the flash memory lifespan by 1700 program/erase (PE) cycles compared with the existing parameter estimation algorithms.",,2025,10.1109/LSP.2024.3521326,https://ieeexplore.ieee.org/document/10829389,new
ieee:11269363,journal,Secure Coding Scheme for the Gaussian Broadcast Wiretap Channel With Common Message and Partial Feedback,"Hua He, Changsong Ma, Haoheng Yuan","In the literature, it has already been shown that a feedback control based coding scheme enhances the secrecy capacity of the Gaussian broadcast wiretap channel (GBC-WTC) with common message, and it performs better than the conventional random key based feedback scheme. However, note that the previously proposed scheme is based on the assumption that both the two receivers can send their received signals back to the transmitter via two feedback channels, which may not be available when a certain feedback channel fails to work. In this paper, we study the GBC-WTC with common message and partial feedback, where only one legitimate receiver can send his received signal back to the sender via a perfect feedback channel. A hybrid scheme, which combines the classical Schalkwijk-Kailath (SK) feedback control scheme, a dirty paper pre-coding scheme and the conventional random binning scheme is proposed for this model. Numerical results show that even in such a partial feedback case, our proposed scheme still works well and outperforms the existing secret-key based scheme in the literature.",,2025,10.1109/OJCOMS.2025.3637235,https://ieeexplore.ieee.org/document/11269363,new
ieee:10812736,journal,On the Optimum Detection of MIMO-SVD Signals With Strong Nonlinear Distortion Effects at the Transmitter,"João Gonçalves, M. Teresa Nogueira, Daniel Dinis, João Guerreiro, Rui Dinis","Multiple-Input Multiple-Output (MIMO) architectures are now widely adopted in wireless systems, providing substantial capacity benefits by harnessing spatial diversity and spatial multiplexing. Nonetheless, the large Peak-to-Average Power Ratio (PAPR) associated with common pre-processing techniques, like Singular Value Decomposition (SVD), increases the system’s susceptibility to nonlinear distortion. Conventional receiver designs that mitigate this distortion often neglect the fact that it has useful information on the transmitted data. Maximum Likelihood (ML) detection offers the capability to take advantage of the nonlinear distortion, but its inherent complexity is prohibitively high. This paper introduces a new MIMO receiver design aimed at exploiting the diversity introduced by the transmitter nonlinearities. It also provides an approximate bound on the achievable ML Bit Error Rate (BER) performance. Our results indicate that the proposed receiver can have a performance close to the ML receiver with just a few iterations.",,2025,10.1109/ACCESS.2024.3521513,https://ieeexplore.ieee.org/document/10812736,new
ieee:11206532,journal,A Message-Passing Perspective on Ptychographic Phase Retrieval,"Hajime Ueda, Shun Katakami, Masato Okada","We introduce a probabilistic approach to ptychographic reconstruction in computational imaging. Ptychography is an imaging method where the complex amplitude of an object is estimated from a sequence of diffraction measurements. We formulate this reconstruction as a Bayesian inverse problem and derive an inference algorithm, termed “Ptycho-EP,” based on belief propagation and Vector Approximate Message Passing from information theory. Prior knowledge about the unknown object can be integrated into the probabilistic model, and the Bayesian framework inherently enables the uncertainty quantification of the reconstruction. Numerical experiments demonstrate that, when the probe’s illumination function is known, our algorithm accurately retrieves the object image at a sampling ratio approaching the information theoretic limit. In scenarios where the illumination function is unknown, both the object and the probe can be jointly reconstructed via an Expectation-Maximization algorithm. We evaluate the performance of our algorithm against conventional methods, highlighting its superior convergence speed.",,2025,10.1109/TCI.2025.3622992,https://ieeexplore.ieee.org/document/11206532,new
ieee:11073184,journal,5G-NR Over Transparent Payload GEO Satellites: A Hands-On Approach Using OpenAirInterface5G-NTN,"Sumit Kumar, Jevgenij Krivochiza, Turker Yilmaz, Jorge Querol, Symeon Chatzinotas, Stefano Andrenacci, Joel Grotz","The inclusion of Non-Terrestrial Network (NTN) components has significantly enhanced the reach of 5G networks. OpenAirInterface5G (OAI) has developed an open-source, Software-Defined Radio (SDR)-based framework for 5G-NTN, using its Terrestrial Network (TN) protocol stack as the baseline. OAI’s 5G-NTN adaptations are still evolving, requiring in-lab validations and field trials to assess its effectiveness in addressing the unique challenges of NTN components and channel characteristics. Live satellite tests, unlike simulations, demand manual tuning of key parameters like carrier frequency offset, timing offsets, and gain calibration. In this work, we present a practical approach for deploying 5G over GEO satellites using the OAI 5G-NTN suite, addressing (a) satellite channel impairments and (b) limitations in OAI’s current 5G-NTN implementation. Our work provides step-by-step calibrations, ensuring both experiment reproducibility and the realization of a full 5G-NTN link. We further identify the performance bottlenecks and experiment with (a) Radio Link Control Acknowledgment Mode (RLC-AM) parameters and (b) Low-Density Parity Check (LDPC) iterations to improve end-to-end throughput. We validate our methods via live tests over a transparent payload GEO satellite. We believe that our work represents a critical step in bridging the gap between lab-based 5G-NTN emulation and live satellite testing, offering valuable insights to advance 5G-NTN research and development.",,2025,10.1109/OJCOMS.2025.3586871,https://ieeexplore.ieee.org/document/11073184,new
ieee:11075882,journal,Reed–Solomon-Based Private and Secure Distributed Matrix Multiplication From MDS-Coded Storage,"Tao Wang, Zhiping Shi, Juan Yang, Sha Liu","The private and secure distributed matrix multiplication (PSDMM) has broad applications in fields such as finance, e-health, and machine learning. The PSDMM problem introduces a public matrix library  $\mathcal {L}$  and aims to securely compute the product of a private matrix with a matrix confidentially selected from  $\mathcal {L}$ . In this setting, the user leverages the assistance of d server nodes to perform this computation while ensuring that no information about the private matrix or the index of the selected matrix is disclosed to colluding servers. In most prior works,  $\mathcal {L}$  is stored in a replicated form across the servers, resulting in significant storage inefficiency. This paper proposes the use of  $(d,K)$ -maximum distance separable (MDS) codes to encode the library and distribute it across the servers, thus enhancing storage efficiency. Building on this, the orthogonality property of Reed-Solomon (RS) codes and their dual codes is exploited to design PSDMM schemes that consistently achieve the optimal recovery threshold. Compared to existing MDS-coded storage PSDMM schemes, the proposed schemes offer lower decoding complexity, as the user only requires a single Lagrange interpolation during the decoding phase. Furthermore, to minimize download costs during decoding phase, subspace polynomial technique from repairing RS codes is introduced, resulting in a communication-efficient PSDMM (CE-PSDMM) scheme. Theoretical analysis shows that the CE-PSDMM scheme reduces the amount of data downloaded from each server compared to conventional PSDMM schemes.",,2025,10.1109/TIFS.2025.3587192,https://ieeexplore.ieee.org/document/11075882,new
ieee:10833617,journal,Specialized Scalar and SIMD Instructions for Error Correction Codes Decoding on RISC-V Processors,"Mael Tourres, Cyrille Chavet, Bertrand Le Gal, Philippe Coussy","The rapid deployment of Internet-of-Things (IoT) devices for a few years has been impressive, and the progressive deployment of 5G will accelerate things even further. Indeed, this standard opens the door to a new generation of standards aimed at a convergence of networks and communication protocols (WiFi, LTE, 4G etc.). This results in the need for flexible implementations of different families of codes, such as, LPDC, NB-LDPC, turbo codes and polar codes. In this context, the work presented in this article proposes the design of a flexible instruction set processor for an IoT context. The objective is to improve the performance level of low-complexity processor cores through instruction set extensions for Error Correction Code (ECC) decoding. The approach discussed is supported by experimental results obtained based on a RISC-V architecture to which specific instruction sets have been added. The results demonstrate a reduction in the required processing clock cycles up to 44.1% for polar codes, 39.2% for LDPC codes, 21.8% for NB-LDPC codes, and 24.3% for turbo codes (4G LTE) codes with a classical Single Instruction Single Data (SISD) approach. Moreover, Single Instruction Multiple Data (SIMD) parallelization strategy enables execution time savings that are far more impressive. The number of clock cycles required to decode a data bit is reduced by 65.6% to 76.9%, with a limited hardware over-cost from 0.6% to 34% (depending on the error correction code family and the targeted RISC-V core).",,2025,10.1109/ACCESS.2025.3527028,https://ieeexplore.ieee.org/document/10833617,new
ieee:11218052,journal,On the Atmospheric Turbulence-Based Cryptosystems With High Secret-Key Rate,Ivan B. Djordjevic,"In our recent paper, we proposed using the atmospheric turbulent channel as a source of randomness to simultaneously address various challenges in physical-layer security (PLS), quantum key distribution (QKD), and post-quantum cryptography (PQC). However, the long coherence time of atmospheric turbulence channels limits the achievable secret-key rates (SKRs). To address this issue, we initially leveraged the turbulence effects only during the system’s initialization phase. In this paper, we present a source-based secret key generation scheme that overcomes the limitations imposed by the long coherence time of the turbulent channel, without requiring initialization. The scheme utilizes both atmospheric turbulence and background radiation as sources of randomness. It offers security superior to PQC and is comparable to QKD, while enabling significantly higher SKRs, making it fully compatible with state-of-the-art optical communications.",,2025,10.1109/ACCESS.2025.3625777,https://ieeexplore.ieee.org/document/11218052,new
ieee:11222606,journal,PosGKG: Lightweight Position-Based Group Key Generation and Management in BC Systems,"Jiajun Li, Zheng Yan, Yishan Yang","Backscatter Communication (BC) is an innovative wireless communication technology that is characterized by energy harvesting capability, low cost, ultra-low power consumption, and ease of maintenance. Secure communications among a group of Backscatter Devices (BDs) are crucially important to facilitate its wide applications. However, current Group Key Generation (GKG) technologies in BC systems suffer from such problems as inadequate key consistency, low key generation efficiency, suboptimal key randomness, high key generation complexity, as well as lack of group key management to ensure backward and forward secrecy. In response, this paper proposes PosGKG, a position-based group key generation and management scheme with high key consistency, efficiency, and randomness, tailored for easy deployment in a BC system with low computation and communication complexity. PosGKG leverages position information to construct shared information between devices for GKG, thereby addressing over-reliance on channel reciprocity and enhancing group key consistency. In particular, PosGKG incorporates a dynamic update mechanism for private weight vectors of BDs that are used to obtain global positions for GKG, which guarantees that the generated group key retains a high degree of randomness, even in a static environment. PosGKG not only diminishes communication and computational complexities due to the adoption of randomly changed global positions as shared information for GKG but also exhibits enhanced security under various attacks, both passive and active ones. In addition, group key management is applied to guarantee the forward and backward secrecy of PosGKG, irrespective of the changes of the BC system. Theoretical analysis and comprehensive experiments with diverse configurations validate the performance of PosGKG in terms of communication and computational complexity, key generation efficiency, key consistency, robustness, security, and environmental feasibility, with demonstrated advantages over existing technologies.",,2025,10.1109/TIFS.2025.3626945,https://ieeexplore.ieee.org/document/11222606,new
ieee:11105420,journal,A Polar Coding Scheme With Selected Index Modulation,"Si-Yu Zhang, Jia-Qi Zhang, Xin-Wei Yue, Chao-Wei Wang","Short to medium length polar codes achieve inferior decoding performance than other advanced channel codes under successive cancellation (SC). Sophisticated polar decoding enhances the corresponding performance while degrading the coding rate and complexity. For better decoding performance and efficiency, this paper presents a polar coding scheme with selected index modulation (PC-SIM). At the transmitter, PC-SIM integrates the concept of index modulation (IM) into polar encoding, using the indices of inactive unfrozen positions (IUPs) to carry implicit information. To boost coding rate without sacrificing decoding performance, PC-SIM selects more reliable unfrozen positions for IM and adds inactive information bits (IIBs) to offset rate losses. Additionally, Walsh-Hadamard Transform (WHT) is incorporated to lower the high peak-to-average power ratio (PAPR) in multi-carrier systems and reduce interference. At the receiver, PC-SIM performs polar decoding followed by repetition decoding to obtain index bits and information bits. Simulation results indicate that in Orthogonal Frequency Division Multiplexing (OFDM) systems, compared to conventional polar codes and existing IM-aided polar coding schemes, the proposed PC-SIM scheme significantly improves error performance, coding rate, and PAPR reduction. The proposed PC-SIM achieves around 0.3 dB over the conventional CRC-aided polar codes and IM-aided polar codes with higher coding rate at the bit error ratio (BER) of $4\times 10^{-4}$.",,2025,10.1109/OJVT.2025.3593944,https://ieeexplore.ieee.org/document/11105420,new
ieee:11010111,journal,Generalized Implicit Transmission (GIT),"Dhanushki Hewawaduge, John P. Fonseka","Recently, two implicit transmission techniques, namely, implicit transmission with bit flipping (ITBF) and implicit transmission with collection decoding (ITCD) have been introduced to transmit an independent second coded sequence implicitly while transmitting a first coded sequence explicitly over the channel. In this study, a novel generalized implicit transmission (GIT) technique that can transmit any number of independent implicit sequences implicitly while transmitting a single explicit sequence over the channel is introduced. The GIT technique, its encoding and decoding are explained in detail. It is numerically demonstrated using the LDPC codes employed in the WiFi and 5G standards that GIT with multiple implicit sequences can increase the transmission rate significantly higher than those that can be achieved with a single implicit sequence reported in previous studies.",,2025,10.1109/OJCOMS.2025.3572500,https://ieeexplore.ieee.org/document/11010111,new
ieee:11222649,journal,Bits to Qubits: A Comparative Study of Memory Management in Classical and Quantum Systems,"Pradeep Lamichhane, Danda B. Rawat","In the near future, as quantum and classical systems coexist, managing hybrid systems will require efficient conversion between bits and qubits. Therefore, understanding memory management for both classical and quantum systems is essential. Along that line, this survey provides a comparative analysis of memory management in classical and quantum architectures. The traditional memory hierarchy and allocation strategies used in classical systems are examined along with caching and paging techniques which optimize performance and resource utilization. On the other hand, quantum memory management focuses on addressing unique challenges such as quantum decoherence and error correction using advanced techniques such as Shor’s code, Surface codes, and other specialized error correction codes. This study explores Quantum Random Access Memory (QRAM) and its role in enabling efficient data retrieval in quantum systems. Quantum read/write operations and their impact on coherence and fidelity are analyzed, highlighting advancements in qubit state measurement and error mitigation. While classical systems take benefits of deterministic and hierarchical memory structures, quantum systems must overcome environmental noise and decoherence to maintain data stability. Furthermore, scalability issues and emerging trends in quantum architecture are discussed, emphasizing how advancements in Quantum Error Correction (QEC) and hybrid systems can address current limitations in memory management.",,2025,10.1109/ACCESS.2025.3627127,https://ieeexplore.ieee.org/document/11222649,new
