ID,Type,Title,Authors,Abstract,Categories,Published,DOI,PDF URL,Status
ieee:11271423,journal,Nonlinear Massive MIMO–RSMA With Multilinear GSVD Precoding: Signal Characterization and Receiver Design,"Oussama Ben Haj Belkacem, Rui Dinis","In this work, we present a novel precoder design for multiuser massive multiple input multiple output (MU-mMIMO) systems impaired by nonlinear effects at the transmitter. By exploiting the rate splitting multiple access (RSMA) technique for user messages, we develop an analytical precoding framework based on the multilinear generalized singular value (ML-GSVD) decompositions for two or more matrices. This framework provides a robust statistical characterization of transmitted signals and enables accurate performance evaluation of precoding techniques in the presence of nonlinearities. Moreover, we introduce an iterative GSVD distortion cancellation (GSVD-DC) receiver for scenarios with strong nonlinear effects. Numerical results demonstrate that the proposed approach achieves substantial improvements in bit error rate (BER) compared to conventional precoders, for both linear and nonlinear cases, with moderate complexity increase, and without relying on successive interference cancellation (SIC). This makes the GSVD-DC receiver a promising solution for efficient and robust communications in nonlinear environments.",,2025,10.1109/ACCESS.2025.3638959,https://ieeexplore.ieee.org/document/11271423,new
ieee:11023562,journal,5G Indoor/Outdoor Field Trial of Deep Joint Source-Channel Coding Method,"Daisuke Hisano, Keigo Matsumoto, Yoshiaki Inoue, Yuko Hara, Kazuki Maruta, Yu Nakayama, Hiroshi Tatsukawa, Yuji Kawai, Yoshinori Shinohara, Hiroki Ikeda","This paper presents the first outdoor field trials of deep joint source-channel coding (DeepJSCC) for image transmission over a 5G system. DeepJSCC is a deep learning-based end-to-end method that unifies source and channel coding to enable robust and low-latency image transmission, particularly in low signal-to-noise power ratio (SNR) environments. Unlike conventional methods, DeepJSCC inherently avoids the cliff effect and maintains stable image quality under harsh channel conditions. To evaluate its feasibility of practical environments, we modified a commercial 5G base station (gNB) and user equipment (UE) to support DeepJSCC signal transmission and reception. Extensive experiments were conducted under indoor and outdoor settings, including line-of-sight (LoS) and non-line-of-sight (NLoS) conditions. A key contribution of this study is the empirical verification that even a DeepJSCC model trained solely on an additive white Gaussian noise (AWGN) channel can maintain stable reconstruction performance in real 5G environments, demonstrating its generalization capability. Compared to baseline systems using JPEG2000 and LDPC, DeepJSCC achieved higher PSNR stability and was able to restore image content even when conventional schemes completely failed. These findings suggest that DeepJSCC is a promising candidate for next-generation visual communication over 5G infrastructure.",,2025,10.1109/OJCOMS.2025.3576502,https://ieeexplore.ieee.org/document/11023562,new
ieee:11224747,journal,Enhancing QoS and RF-EMF Radiation Using RSMA and AI in 6G Networks: A Comprehensive Survey,"Adedotun T. Ajibare, Balyan Vipin, Oluwaseyi P. Babalola","The sixth generation (6G) wireless networks are envisioned to deliver unprecedented levels of connectivity, ultra-reliable low-latency communication (URLLC), and energy efficiency while addressing public concerns about radiofrequency electromagnetic field (RF-EMF) exposure. Rate-Splitting Multiple Access (RSMA) has emerged as a promising multiaccess technique that flexibly manages interference and supports a broad range of Quality of Service (QoS) requirements. In parallel, the integration of artificial intelligence (AI), including machine learning (ML) and reinforcement learning (RL), has become essential for dynamic resource optimisation, proactive decision making, and real-time adaptation in complex and dense wireless environments. This survey presents a comprehensive overview of RSMA’s operational principles, with a focus on its encoding/decoding architecture using low-density parity-check (LDPC) and polar coding and how it enhances spectral and energy efficiency compared to traditional multiple access schemes. It also presents the mathematical framework for both the RSMA scheme and the RF-EMF evaluation. The survey also explores AI-driven strategies for optimising RSMA, including power control, beamforming, and user scheduling, while minimising RF-EMF exposure. We examine the regulatory thresholds provided by IEEE, FCC, and ICNIRP, focusing on exposure-aware RSMA models that balance RF safety with performance demands in relation to system constraints. Furthermore, we discuss system-level trade-offs between QoS and RF-EMF exposure and system performance metrics such as bit error rate (BER), latency, spectral efficiency, and specific absorption rate (SAR) levels. This survey identifies open challenges, including real-time AI deployment, scalability, and security, and discusses future research directions, such as hybrid multiple access models, privacy-preserving ML, and AI-RSMA-6G integration. Finally, this survey serves both as a reference guide and a basis for future research on the safe, intelligent, and high-performing deployment of RSMA in 6G networks, which optimises both user experience and environment.",,2025,10.1109/ACCESS.2025.3628914,https://ieeexplore.ieee.org/document/11224747,new
ieee:10962181,journal,Corrections to “Performance of Spatially Coupled LDPC Codes Over the Underwater Wireless Optical Channel With Strong Turbulence and Pointing Errors”,"Sravan Kumar Padala, John D’Souza","Presents corrections to the paper, (Corrections to “Performance of Spatially Coupled LDPC Codes Over the Underwater Wireless Optical Channel With Strong Turbulence and Pointing Errors”).",,2025,10.1109/ACCESS.2025.3557463,https://ieeexplore.ieee.org/document/10962181,new
ieee:11258615,journal,Editorial Quantum Error Correction and Fault Tolerance,"Navin Kashyap, Narayanan Rengaswamy, Bane Vasic, Pavel Panteleev",,,2025,10.1109/JSAIT.2025.3620645,https://ieeexplore.ieee.org/document/11258615,new
ieee:10992724,conference,BER Comparison Between Time-Domain and Frequency-Domain Self-Interference Canceller in 5G-Based Full-Duplex Mobile Communications,"Takumi Yasaka, Kazuma Matsushima, Satoshi Suyama, Hiroyuki Otsuka","Full-duplex mobile communications are gaining attention as an access method between base station (BS) and user equipment (UE) that can improve frequency utilization efficiency. The important technology is to cancel or eliminate self-interference that occurs between the transmitter (TX) and its own receiver (RX) at both BS and UE. This paper presents a BER comparison between time-domain and frequency-domain self-interference canceller (SIC) operated at baseband. Specifically, we show the BER performance of OFDM-based QPSK and 16/64/256/1024-QAM signals as parameters of the coding rate when time-domain or frequency-domain SIC is applied. The results indicate that both SIC can drastically improve the BER for QPSK and QAM signals compared without SIC, and the frequency-domain SIC is more effective as the modulation order of QAM increases.",,15-17 Jan.,10.1109/ICOIN63865.2025.10992724,https://ieeexplore.ieee.org/document/10992724,new
ieee:11037425,journal,Bidirectional 100G/150G Amplified Transmission With a QD-SOA for Future Passive Optical Networks,"Ahmed Galib Reza, Lakshmi Narayanan Venkatasubramani, Vladimir S. Mikhrin, Alexey Gubenko, Liam P. Barry","This work investigates optically amplified bidirectional transmission with a quantum-dot semiconductor optical amplifier for next-generation 100G passive optical networks. We experimentally demonstrate 100/150 Gbit/s uplink/downlink bidirectional PAM-4 transmissions employing a quantum-dot semiconductor optical amplifier in the remote node of an optical access network. After 20 km optically amplified transmission, we attain the uplink/downlink power budgets of 32.3 dB/29 dB at the HD-LDPC bit error ratio decision threshold of  $10^{\mathrm {-2}}$  with an overhead of 15.5%, satisfying the power budget requirements of a legacy passive optical network with net (gross) achievable uplink/downlink data rates of 84.4/126.7 (100/150) Gbit/s, respectively.",,15 Sept.15,10.1109/LPT.2025.3580280,https://ieeexplore.ieee.org/document/11037425,new
ieee:11115102,journal,Terrain-Aware Image Transmission System for Lunar IoT Networks: A Multipriority Robust RaptorQ Coding Approach,"Yaonan Wu, Shushi Gu, Yuanjian Lin, Zhikai Zhang, Qinyu Zhang","Reliable image transmission is pivotal for lunar Internet of Things (IoT) networks, providing visual information for scientific exploration and real-time navigation. However, the moon’s harsh environment, i.e., lack of atmosphere, low surface conductivity, and rugged terrain, induces abnormal signal attenuation and packet losses, significantly degrading image transmission quality. This article presents the lunar adaptive image transmission system (LAITS), which integrates the terrain aware field strength prediction (TAFSP) framework with the hierarchical raptorQ redundancy optimization (HRRO) coding algorithm. The TAFSP framework provides field strength predictions for channel packet loss rate estimation, by leveraging high-resolution lunar elevation data to formulate a radio propagation loss model. The HRRO algorithm optimizes coding efficiency and enables low-overhead transmission, by dynamically adjusting RaptorQ’s data segmentation based on the predictions of channel packet loss rate and priorities of image data. Simulations demonstrate that while maintaining image transmission quality above the 25 dB peak signal-to-noise ratio (PSNR) threshold, LAITS achieves a coverage rate of 85% in flat terrain with a 4 km radius at 440, 915, and 2400 MHz, and achieves coverage rates of 85% at 440 MHz, 70% at 915 MHz, and 56% at 2400 MHz in rugged terrain with the same radius.",,"15 Oct.15,",10.1109/JIOT.2025.3596290,https://ieeexplore.ieee.org/document/11115102,new
ieee:11142740,journal,Joint Information Reconciliation-Privacy Amplification Scheme for CV-QKD,"Kun Zhang, Jia Hou, Yan Feng, Xue-Qin Jiang, Enjian Bai, Peng Huang, Guihua Zeng","In the conventional post-processing phase of Gaussian-modulated coherent state (GMCS) quantum key distribution (QKD) systems, the processes of information reconciliation (IR) and privacy amplification (PA) are typically carried out sequentially and separately. This approach incurs substantial computational complexity and may introduce potential security risks, such as key storage risks. In this paper, we propose a more efficient and secure post-processing scheme that integrates IR and PA into a single process by utilizing well-designed spinal codes. The proposed scheme significantly reduces computational complexity by employing the linear-complexity hash function instead of the superlinear complexity Toeplitz matrices used in conventional PA schemes, and effectively mitigates potential security risks associated with conducting IR and PA as separate processes. Experimental results show that the final secret key throughput of the proposed scheme is at least 250 times higher than that of the conventional PA scheme, with the improvement in throughput becoming even greater as the block lengths increase. More importantly, owing to the rateless property and the capacity-approaching performance of spinal codes, the GMCS QKD systems can achieve reconciliation efficiencies of higher than 97% across a broad range of signal-to-noise ratios from −22.5641 to 0.122 dB.",,"15 Oct.15,",10.1109/JLT.2025.3603253,https://ieeexplore.ieee.org/document/11142740,new
ieee:10878470,journal,Channel-Polarized Multilevel Coding for Low-Complexity Forward Error Correction,"Takeshi Kakizaki, Masanori Nakamura, Fukutaro Hamaoka, Yoshiaki Kisaka","Digital coherent optical fiber communication systems adopt forward error correction (FEC) and multilevel modulation in accordance with transmission distance, data rate, and power consumption requirements. Bit-interleaved coded modulation (BICM) is practical coded modulation because of the simplicity of applying a binary code to converted binary-input memoryless channels (B-MCs) under a random bit-interleaver. The power consumption of soft-decision (SD) FEC has recently become a challenge due to transceiver power constraints. The multilevel coding (MLC) scheme efficiently reduces the decoding complexity, while the code design and complexity reduction depend on the modulation order. In this paper, we propose new binary codes for channel-polarized multilevel coding (CP-MLC) that convert multiple B-MCs to unreliable and reliable bit-channels and apply only SD-FEC to unreliable bit-channel to reduce the decoding complexity without depending on the modulation order. Systematic CP-MLC can also be used in probabilistically-shaped signals by using it in the component code of a probabilistic amplitude shaping scheme.",,"15 May15, ",10.1109/JLT.2025.3540204,https://ieeexplore.ieee.org/document/10878470,new
ieee:10878115,journal,Joint Optimization of Digital Fronthaul Based on Delta-Sigma Modulation and Equal Length Level Conversion,"Zijun Yan, Yixiao Zhu, Gengming Lin, Qi Wu, Yikun Zhang, Qunbi Zhuge, Weisheng Hu","In conventional mobile fronthaul (MFH) links, the radio-over-fiber (RoF) interface and optical transmission are separately optimized. In this work, we propose an equal-length level conversion (ELLC) scheme to jointly optimize the delta-sigma modulation (DSM) quantization noise and optical transmission performance. The ELLC scheme converts the high-level quantizer output of the DSM into a low-level signal with equivalent entropy using entropy coding. Forward error correction (FEC) is incorporated to guarantee successful decoding without reducing the data rate. Under the peak-power constraint, both the signal-to-noise ratio (SNR) of the recovered wireless signal and the received optical power (ROP) sensitivity of the optical fronthaul transmission are improved with the proposed ELLC scheme. We experimentally demonstrate the conversion of a 6-level quantized DSM waveform into a 4-level signal (6-to-4 scheme), and the conversion of an 8-level quantized DSM signal into a 6-level signal (8-to-6 scheme) at an over-sampling rate (OSR) of 8 in an optical intensity modulation-direct detection (IM-DD) link. Compared to the 4-level quantized DSM, the 6-to-4 scheme provides an 11-dB SNR improvement for wireless signals and a 3-dB enhancement in ROP sensitivity after 10-km standard single-mode fiber (SSMF) transmission in the O-band. Similarly, the 8-to-6 scheme achieves a 4-dB SNR improvement and a 2.5-dB enhancement in ROP sensitivity compared to the 6-level quantized DSM. Moreover, we demonstrate high-pass (HP) DSM based on the proposed ELLC scheme, revealing its advantage with flexible passband selection. By converting higher-order PAM to lower-order PAM, the ELLC scheme achieves both the high recovered wireless signal SNR associated with high quantization levels and the enhanced noise resilience of lower modulation formats in optical channels. The proposed ELLC approach is anticipated to be a promising candidate for digital MFH in the 5G-Advanced era, especially for cost-sensitive and high-fidelity applications.",,"15 May15, ",10.1109/JLT.2025.3539745,https://ieeexplore.ieee.org/document/10878115,new
ieee:10742614,journal,Hardware Sharing Design Method of Rate Matching and Interleaving for Wireless Terminal in Industrial Internet of Things,"Wei Chen, Kejia Huo, Dake Liu","Reducing the power consumption of baseband chips in wireless terminals of the Industrial Internet of Things (IIoT) is a great challenge. Among them, the logic function of the rate matching and interleaving hardware module is very complex, which occupies a considerable portion of power consumption in the baseband chip, so it is of great significance to design a low-power rate matching and interleaving hardware. Due to differences in interleaving algorithms and throughput, the interleavers used in 4G long term evolution (LTE) and 5G NR/6G have not been merged into a single architecture. Switching between different standards provides new options for interleaver design, and by configuring the architecture of different interleavers, it is possible to use the same hardware for different standards to reduce hardware resources and power consumption. This article studies the block interleaving and rate matching of turbo codes, convolutional codes, polar codes, and low-density parity check (LDPC) codes used in 4G LTE and 5G NR/6G communication links. With regard to the different algorithms for these four types of encoding, shared design is carried out on the hardware structure. In this experiment, according to the proposed memory and interleaving sharing scheme for hardware design and hardware simulation, the area overhead of 0.1  $\mu $ m2 and power consumption of 4.31 mW are obtained by Synopsys synthesis at the SMIC 28-nm process and the frequency of 50 MHz. This achieves the maximum hardware reuse of four encoding schemes in the downlink communication link of 4G LTE and 5G NR/6G, and reduce power consumption.",,15 March15,10.1109/JIOT.2024.3491976,https://ieeexplore.ieee.org/document/10742614,new
ieee:10902381,journal,sDMCM—A Semantic Digital Modulation Constellation Mapping Scheme for Semantic Communication,"Lei Teng, Wannian An, Chen Dong, Xiaodong Xu","The current state of semantic communication research is primarily based on analog modulation, whereas digital communication is more prevalent in practical applications. However, traditional digital modulation constellation mapping designs are not suitable for semantic communication, as they are primarily focused on minimizing the bit error rate of the transmitted data rather than the change in the numerical value of the semantic information. To address this issue, a semantic digital modulation constellation mapping (sDMCM) scheme based on pulse amplitude modulation (PAM)/quadrature amplitude modulation (QAM) is proposed, that considers the internal correlation of the semantic information. In addition, this article proposes using the mean-squared error (MSE) of the semantic information between the transmitter and receiver as a performance metric for semantic communication. This article also provides the theoretical MSE performance of the proposed sDMCM through formula derivation. Finally, the simulation results match the theoretical results, demonstrating the rationality of the theoretical derivation. Comparing the proposed sDMCM scheme with traditional mapping schemes, such as Gray, Pseudo-Gray (Pe-Gray), and structural quadrant (SQ) constellations in an image semantic communication system under the additive white Gaussian noise (AWGN) channel, the restored image can tolerate an SNR drop of about 3 dB while maintaining the same multiscale structure similarity (MS-SSIM) performance. In addition, sDMCM is applied in an industrial Internet of Things semantic communication system to validate its role in IoT applications.",,"15 June15,",10.1109/JIOT.2025.3545667,https://ieeexplore.ieee.org/document/10902381,new
ieee:10973069,journal,Utilizing State Probabilities to Curb Consecutive Errors in Photonic THz Communications,"Liga Bai, Lu Zhang, Zhidong Lyu, Oskars Ozolins, Xiaodan Pang, Qun Zhang, Xianbin Yu","The rapid evolution of high-speed communication technologies has brought serious inter-symbol interference (ISI). To cope with this issue, channel equalization techniques, such as feedforward equalization (FFE) and decision feedback equalization (DFE), are typically used to compensate for channel response to facilitate signal recovery, and forward error correction (FEC) code, such as low-density parity check (LDPC) codes, is widely deployed to improve link budget margin. However, the mutual influence between the equalizer and the decoder has yet to be thoroughly explored. In this paper, the state error decoding (SED) algorithm is proposed to enhance the decoding performance by effectively reducing the error probabilities and surpassing the limitations of traditional signal recovery methods. Experimental results in a photonic terahertz wireless communication system achieve error propagation mitigation and additional 0.2 dB link budget improvement by utilizing the proposed SED method, which confirms the effectiveness of the algorithm in reducing error propagation and improving system performance, paving the way for the development of broadband communications.",,"15 July15,",10.1109/JLT.2025.3563391,https://ieeexplore.ieee.org/document/10973069,new
ieee:10980148,journal,Pre-Emphasis Assisted Mixed Modulation PD-NOMA-OFDM System for UOWC,"Gopal Krishna, Sumanta Gupta","This article reports the transmission of mixed modulation formats assisted signals, which use orthogonal frequency division multiplexing (OFDM) combined with power domain nonorthogonal multiple access (PD-NOMA) in a multi-user underwater optical wireless communication (UOWC) system. Experimental investigation of two and three-user PD-NOMA-OFDM-based signal transmission in UOWC systems is carried out using a blue light emitting diode (LED) as the transmitter. To overcome the modulation bandwidth limitation of LED, a technique called differential pre-emphasis (DPE) is introduced that optimally minimizes the rise and fall times of the optical OFDM-NOMA signal. Simulation and experimental results show that the bit error rate (BER) of each user is below the FEC threshold of 10−3 at the optimum DPE factor for both mixed-modulation and identical modulation formats in two- and three-user PD-NOMA schemes. For the two-user scenario with the same modulation (QPSK-QPSK) formats, the maximum per-user data rate achieved is 24.1 Mbps, while with mixed modulation (QPSK-16-QAM), the transmission rate is 24.1 Mbps for the far user (FU) and 48.2 Mbps for the near user (NU). For the three-user PD-NOMA scheme, the maximum per-user data rate is 24.1 Mbps with identical (QPSK) modulation format. With mixed modulation formats in three-user NOMA, the maximum achieved per-user data rates are 12.04 Mbps, 24.1 Mbps, and 48.2 Mbps with BPSK, QPSK, and 16-QAM modulation, respectively. Experimental studies in the turbulent water channel also establish the efficacy of the DPE-enabled mixed-modulation PD-NOMA-OFDM signal transmission in achieving BER below 10−3 in both two-user and three-user schemes.",,"15 July15,",10.1109/JLT.2025.3565771,https://ieeexplore.ieee.org/document/10980148,new
ieee:10685066,journal,MDVSC—Efficient Wireless Model Division Video Semantic Communication,"Zhicheng Bao, Haotai Liang, Chen Dong, Cong Li, Xiaodong Xu, Ping Zhang","This article introduces a novel method for transmitting video data over noisy wireless channels with high efficiency and controllability. The method derivates from model division multiple access (MDMA) to extract common semantic features from video frames. It also uses deep joint source-channel coding (JSCC) as the main framework to establish communication links and deal with channel noise. An entropy-based semantic importance coding scheme is developed to adjust the data amount accurately and explicitly. We name our method as model division video semantic communication (MDVSC). The main steps of our approach are as follows: first, video frames are transformed into a latent space to reduce computational complexity and redistribute data. Then, common features and individual features are extracted, and semantic importance coding is applied to further eliminate redundant semantic information under the communication bandwidth constraint. We evaluate our method on standard video test sequences and compare it with traditional wireless video coding methods. The results show that MDVSC generally surpasses the conventional methods in terms of quality metrics and has the capability to control code length precisely. Moreover, additional experiments and ablation studies are conducted to demonstrate its potential for various tasks.",,"15 Jan.15,",10.1109/JIOT.2024.3464614,https://ieeexplore.ieee.org/document/10685066,new
