ID,Type,Title,Authors,Abstract,Categories,Published,DOI,PDF URL,Status
ieee:11104821,journal,Asymptotically Good Generalized Quantum Tanner Codes,"Olai Å. Mostad, Eirik Rosnes, Hsuan-Yin Lin","In this work, we present a generalization of the recently proposed quantum Tanner codes by Leverrier and Zémor, which contains a construction of asymptotically good quantum low-density parity-check codes. Quantum Tanner codes have so far been constructed equivalently from groups, Cayley graphs, or square complexes constructed from groups. We show how to enlarge this to graphs with labeled local views and a family of square complexes, which is the largest possible in a certain sense. We show that the proposed generalization contains a family of asymptotically good quantum codes that are based on non-Cayley Schreier graphs, i.e., a new family of (generalized) quantum Tanner codes is provided. Moreover, we evaluate the performance of the generalized codes and compare with those based on Cayley graphs both in terms of minimum distance and logical error rate on the depolarizing channel, demonstrating that the proposed generalized codes based on Schreier graphs outperform those based on Cayley graphs.",,2025,10.1109/JSAIT.2025.3594310,https://ieeexplore.ieee.org/document/11104821,new
ieee:10887185,journal,Spectrum Shaping Error Correction Codes for High-Density Data Storage Systems,Chi Dinh Nguyen,"The study provides a novel and systematic method for designing high-efficiency spectral shaping error-correction codes (ECCs) for high-density data storage systems. The design includes the application of a high-efficiency spectral shaping k constrained code to the input user data, followed by an ECC for error correction, and the application of another spectral shaping code k constrained to the parity part of the ECC. The designed spectral shaping ECC can effectively mitigate the noise and interference affecting the data signal of high-density data storage systems and directly correct the system errors. The proposed code design method facilitates the application of spectrum shaping codes with long codeword lengths, which can achieve a high coding efficiency for the system. Furthermore, it also enables the soft-decision decoding (SDD) of ECCs, which has a much stronger error correction capability than the conventional hard-decision decoding (HDD). The proposed code design method is general and systematic; hence, it can be applied to any efficient spectral shaping codes as well as systematic ECCs.",,2025,10.1109/ACCESS.2025.3542290,https://ieeexplore.ieee.org/document/10887185,new
ieee:10879318,journal,Low-Complexity Architecture for High-Speed 50G-PON LDPC Decoder,"Kon-Woo Kwon, Kwangok Kim, Kyeonghwan Doo, Hwanseok Chung, Jeong Woo Lee","We propose a hardware architecture for 50G-PON LDPC decoder achieving high throughput and high error correcting capability while maintaining low level of resource utilization and implementation complexity. Our approach employs phased decoding as a key algorithm which effectively balances the competing goals of high throughput and low amount of resource utilization. We also propose a fixed-structured wiring network between variable nodes and check nodes, leveraging the quasi-cyclic property of parity-check matrix to significantly reduce implementation complexity. To further simplify the decoder structure and enhance the throughput, we propose a blockwise column cyclic shift in the parity-check matrix, along with rules for normalizing and quantizing messages generated in decoder. Our design also incorporates a pipelined structure of computation units. By integrating the proposed design schemes, we draw a sophisticated architecture for high-speed and low-complexity LDPC decoder that achieves the seamless decoding throughput of 49.7664 Gbps, even on a single FPGA board.",,2025,10.1109/ACCESS.2025.3540450,https://ieeexplore.ieee.org/document/10879318,new
ieee:11030804,journal,Cluster Decomposition for Improved Erasure Decoding of Quantum LDPC Codes,"Hanwen Yao, Mert Gökduman, Henry D. Pfister","We introduce a new erasure decoder that applies to arbitrary quantum LDPC codes. Dubbed the cluster decoder, it generalizes the decomposition idea of Vertical-Horizontal (VH) decoding introduced by Connolly et al. in 2022. Like the VH decoder, the idea is to first run the peeling decoder and then post-process the resulting stopping set. The cluster decoder breaks the stopping set into a tree of clusters, which can be solved sequentially via Gaussian Elimination. By allowing clusters of unconstrained size, this decoder achieves maximum-likelihood (ML) performance with reduced complexity compared with full Gaussian Elimination. When Gaussian Elimination is applied only to clusters whose sizes are less than a constant, the performance is degraded, but the complexity becomes linear in the block length. Our simulation results show that, for hypergraph product codes, the cluster decoder with constant cluster size achieves near-ML performance similar to VH decoding in the low-erasure-rate regime. For the general quantum LDPC codes we studied, the cluster decoder can be used to estimate the ML performance curve with reduced complexity over a wide range of erasure rates.",,2025,10.1109/JSAIT.2025.3578597,https://ieeexplore.ieee.org/document/11030804,new
ieee:11045392,journal,Performance Analysis of Superposition M-ary QAM Modulation in Coded Protograph LDPC MIMO Communication Systems With Low-Resolution ADCs,"Duc A. Hoang, Hieu T. Nguyen, Thang N. Le","Low-resolution analog-to-digital converters (ADCs) offer a compelling approach to reducing power consumption and hardware complexity in large-scale multiple-input multiple-output (LS-MIMO) systems for next-generation wireless networks. However, aggressive quantization significantly increases detection complexity—particularly for high-order modulation schemes—due to elevated noise and interference. In this paper, we propose a novel framework that jointly detects and decodes signals in LS-MIMO systems employing superposition modulation and low-resolution ADCs. Our approach leverages a message-passing (MP) algorithm that decomposes each high-order symbol into multiple BPSK layers, enabling more tractable soft-interference cancellation and extrinsic information updates. To theoretically assess system performance, we further develop a modified Protograph Extrinsic Information Transfer (PEXIT) algorithm, which integrates the effects of MIMO fading, ADC quantization noise, and protograph LDPC decoding into a single analytical tool. This modified PEXIT accurately predicts the iterative decoding thresholds under varying antenna dimensions, ADC resolutions, and superposition weighting schemes, thus facilitating a systematic code and modulation design process. Extensive numerical results corroborate the analysis, demonstrating that equal-weight superposition modulation provides consistent performance gains over conventional equal-distance constellations, especially in low-to-moderate quantization scenarios. These findings highlight the importance of power allocation strategies for superposition modulation in practical LS-MIMO receivers with coarse quantizers. Overall, this work offers a unified perspective on superposition modulation, low-resolution ADCs, and advanced LDPC decoding, opening new avenues for designing energy-efficient and spectrally efficient communication systems suitable for 5G-and-beyond networks.",,2025,10.1109/ACCESS.2025.3581775,https://ieeexplore.ieee.org/document/11045392,new
ieee:11271405,journal,Adaptive Reliability-Driven Conditional Innovation Decoding for LDPC Codes,"Hassan Touati, Rodrigo C. de Lamare","In this work, we present an adaptive reliability-driven conditional innovation (AR-CID) decoding algorithm for low-density parity check (LDPC) codes. The proposed AR-CID decoding algorithm consists of one stage of message quality checking and another stage of message passing refinement, which are incorporated into a residual belief propagation decoding strategy. An analysis of the AR-CID decoding algorithm is carried out along with a study of its computational complexity and latency characteristics. Simulation results for several examples of LDPC codes, including short and medium-length codes over an extended range of channel conditions, indicate that the proposed AR-CID decoding algorithm outperforms competing decoding techniques and has an extremely fast convergence, making it particularly suitable for low-delay applications.",,2025,10.1109/ACCESS.2025.3639020,https://ieeexplore.ieee.org/document/11271405,new
ieee:10935343,journal,Design of Enhanced Protograph Codes and Codebooks for IDD-SCMA Systems,"Jiaqin Chen, Huan Ma, Liang Lv, Wuyang Xue","This paper investigates the design of protograph low-density parity-check (PLDPC) codes and Gray-labeling codebooks (CBs) for the sparse code multiple access systems with iterative detection and decoding receiver (IDD-SCMA). Specifically, leveraging the protograph extrinsic information transfer (PEXIT) analysis, we first propose two types of PLDPC codes (i.e., an unpunctured Code-W and a punctured Code-V) which achieve the lowest decoding thresholds for the IDD-SCMA systems over AWGN and Rayleigh fading channels. To further enhance system performance, we focus on the critical role of Gray-labeling in the PLDPC-coded-IDD-SCMA systems, which are regarded as specific types of bit-interleaved coded modulation with iterative decoding (BICM-ID) systems. Subsequently, we devise a simple SCMA CB design scheme, referred to as the MPSK-based Gray-labeling CB design. This scheme is composed of the factor graph matrix design, the constellation set design, and Gray-labeling for the constellation set. Furthermore, with the aid of the PEXIT algorithm, the proposed CBs exhibit superior compatibility with the PLDPC-coded-IDD-SCMA systems. Analytical and simulation results demonstrate significant performance gains from the proposed PLDPC codes and CBs compared to existing counterparts. Consequently, the PLDPC-coded-IDD-SCMA systems with the proposed design emerge as a promising solution to satisfy the high-reliability requirements for SCMA applications.",,2025,10.1109/ACCESS.2025.3553397,https://ieeexplore.ieee.org/document/10935343,new
ieee:11087626,journal,Short-Block Polar-Coded Reverse and Direct Reconciliation in CV-QKD,"Dingzhao Wang, Xin Liu, Chao Xu, Soon Xin Ng, Lajos Hanzo","Continuous-variable quantum key distribution (CV-QKD) is a promising technique of supporting quantum-safe wireless networks in the emerging 6 G era, mapping quantum information onto the amplitude or phase of electromagnetic waves. However, conventional CV-QKD reconciliation methods often assume ideal classical side-information channels, which is an unrealistic scenario in practical deployments. To address this critical challenge, we propose a novel protection scheme integrating Polar and low-density parity-check (LDPC) codes. Specifically, Polar codes safeguard quantum transmissions due to their superior performance for short block lengths, while LDPC codes robustly protect the classical side information exchanged over auxiliary classical channels. We further enhance the CV-QKD performance by harnessing a soft-decision Polar decoding method combined with protocols specifically tailored for reverse reconciliation (RR) and direct reconciliation (DR). In the RR scheme, conceived decoding complexity is strategically distributed: Polar decoding is performed by Alice, and LDPC decoding by Bob, hence significantly reducing the computational demands compared to traditional schemes where both decoding processes are invoked at a single node. Simulation results validate the effectiveness of our approach, demonstrating that Polar codes consistently outperform LDPC codes in quantum transmission scenarios having short block lengths under 512 bits. These findings emphasize the strong potential of Polar coding-assisted CV-QKD in achieving secure and efficient quantum-safe control information transmissions, paving the way for practical implementation in next-generation wireless networks.",,2025,10.1109/OJVT.2025.3591417,https://ieeexplore.ieee.org/document/11087626,new
ieee:10909182,journal,On the Gap to Channel Capacity of Generalized Low-Density Parity-Check Codes,"Dongxu Chang, Qingqing Peng, Guanghui Wang, Guiying Yan, Dawei Yin","In this study, the gap to channel capacity of generalized low-density parity-check (GLDPC) codes under the a posteriori probability (APP) decoder on the binary input additive white Gaussian noise (BI-AWGN) channel is analyzed. Building on the density evolution for LDPC codes, we extend this to GLDPC codes by generalizing the properties of concentration, symmetry, and monotonicity to accommodate the characteristics of GLDPC codes. Specifically, we propose a methodology to simplify the computation of density evolution for GLDPC codes under APP decoding over BI-AWGN channels. Firstly, we identify a class of subcodes that can greatly simplify the performance analysis and practical decoding of GLDPC codes, which we refer to as message-invariant subcodes. Secondly, based on the characteristics of GLDPC codes, we develop a Gaussian mixture approximation algorithm to approximate the message distributions in density evolution. Compared to Gaussian approximation, the proposed Gaussian mixture approximation approach can greatly enhance accuracy while maintaining low computational complexity. Based on the above techniques, we demonstrate that with an appropriate proportion of generalized constraint (GC) nodes, despite the rate loss when single parity-check (SPC) nodes are replaced by GC nodes, GLDPC codes can reduce the original gap to capacity compared to their original LDPC counterparts. Our simulation experiments validate the performance analysis.",,2025,10.1109/OJCOMS.2025.3547391,https://ieeexplore.ieee.org/document/10909182,new
ieee:10982065,journal,Channel Coding QoS Analysis in 5G V2X Dynamic Propagation Models,"Dimitrios Chatzoulis, Costas Chaikalis, Apostolos Xenakis, Dimitrios Kosmanos, Kostas E. Anagnostou","Vehicle-to-everything (V2X) communications is a crucial area of wireless communications and is of primary interest for automakers, smart cities, municipal services, traffic planners, and law enforcement authorities. V2X systems are beneficial for increasing driving safety, driving time, the ability to avoid accidents, traffic congestion and energy saving. However, the V2X communication is not only characterized by high mobility and but also by rapid and unexpected changes in the communication environment, which drastically degrade the fading features and the quality of the communication channel. Maintaining tolerable quality of service (QoS) in a V2X communication environment is therefore essential. Thus, under the premise of ensuring channel quality, channel coding is employed as the predominant process enhancing reliability by introducing high data redundancy. In this study, we investigate the impact of 4th-Generation Long-Term Evolution (4G-LTE) turbo codes, 5th-Generation New Radio (5G-NR) polar codes, and 5G-NR low-density parity-check (LDPC) codes on the QoS of a V2X communication system. To this end, we propose space and time-varying V2X propagation models, based on real traffic data, that simulate V2X communication in real urban and highway environments and various traffic density conditions, based on the 3rd-Generation Partnership Project (3GPP) specifications. Through these simulations we investigate the frame error rate (FER) performance and QoS efficiency of the V2X dynamic propagation models which are achieved by the 4G-LTE and 5G-NR channel coding schemes. Our analysis introduces novel large-scale V2X fading models and ultimately proves that turbo-based coding schemes have superior performance for small-frame 5G V2X communication.",,2025,10.1109/ACCESS.2025.3566607,https://ieeexplore.ieee.org/document/10982065,new
ieee:11095675,journal,Gradient Flow Decoding,"Tadashi Wadayama, Lantian Wei","This paper presents the Gradient Flow (GF) decoding for LDPC codes. GF decoding, a continuous-time methodology based on gradient flow, employs a potential energy function associated with bipolar codewords of LDPC codes. The decoding process of the GF decoding is concisely defined by an ordinary differential equation and thus it is well suited to an analog circuit implementation. We experimentally demonstrate that the decoding performance of the GF decoding for AWGN channels is comparable to that of the multi-bit mode gradient descent bit flipping algorithm. We further introduce the negative log-likelihood function of the channel for generalizing the GF decoding. The proposed method is shown to be tensor-computable, which means that the gradient of the objective function can be evaluated with the combination of basic tensor computations. This characteristic is well-suited to emerging AI accelerators, potentially applicable in wireless signal processing. The paper assesses the decoding performance of the generalized GF decoding in LDPC-coded MIMO channels. For LDPC-coded MIMO channels, our method achieves approximately 1.6 dB performance gain over MMSE + BP. Furthermore, an exploration of score-based channel learning for capturing statistical properties is also provided.",,2025,10.1109/ACCESS.2025.3592296,https://ieeexplore.ieee.org/document/11095675,new
ieee:11154002,journal,Generative AI-Based Vector Quantized End-to-End Semantic Communication System for Wireless Image Transmission,"Maheshi Lokumarambage, Thushan Sivalingam, Feng Dong, Nandana Rajatheva, Anil Fernando","Semantic communication (SemCom) systems enhance transmission efficiency by conveying semantic information in lieu of raw data. However, challenges arise when designing these systems due to the need for robust semantic source coding for information representation extending beyond the training dataset, maintaining channel-agnostic performance, and ensuring robustness to channel and semantic noise. We propose a novel generative artificial intelligence (AI) based SemCom architecture conditioned on quantized latent. The system reduces the communication overhead of the wireless channel by transmitting the index of the quantized latent over the communication channel by mapping the quantized vector to the learned codebook vectors. The learned codebook is the shared knowledge base. The encoder is designed with a novel spatial attention mechanism based on image energy, focusing on object edges. The critic assesses the realism of generated data relative to the original distribution, with the Wasserstein distance. The model introduces novel contrastive objectives at multiple levels, including pixel, latent, perceptual, and task output, tailored for noisy wireless semantic communication. We validated the proposed model for transmission quality and robustness with low-density parity-check (LDPC), which outperforms the baselines of better portable graphics (BPG), specifically at low signal-to-noise ratio (SNR) levels ( $ {\lt }~ {5}$  dB). Additionally, it shows comparable results with joint source-channel coding (JSCC) with lower complexity and latency. The model is validated for human perception and machine perception-oriented task utility. The model effectively transmits high-resolution images without requiring additional error correction at the receiver. We propose a novel semantic-based matrix to evaluate the robustness to noise and task-specific semantic distortion.",,2025,10.1109/TMLCN.2025.3607891,https://ieeexplore.ieee.org/document/11154002,new
ieee:11008644,journal,Underwater Acoustic Communication Using Multi-Layer Vector Approximate Message Passing Evaluated on the Watermark Benchmark,"Julian Winkler, Sabah Badri-Hoeher",The multi-layer vector approximate message passing algorithm is applied to the problem of channel estimation in underwater acoustic communication addressing the estimation of time-varying channel characteristics. A pre-trained artificial neural network is used as prior for the channel estimation. The communication receiver is designed as a factor graph with a low-density parity check decoder as factor node. The performance of the proposed communication scheme is evaluated by comparing the bit error rates with classical communication schemes. The bit error rate is significantly decreased on strongly time-varying channels. Different datasets are compared for training the channel estimator.,,2025,10.1109/ACCESS.2025.3572283,https://ieeexplore.ieee.org/document/11008644,new
ieee:10845171,journal,Performance Enhancement of V2V Communication by QC-LDPC Code and NOMA-UM-MIMO Techniques,"Maryam Mohammed F. Abdullah, Osama Alluhaibi, Asim Egemen Yilmaz, Aykut Kalaycioglu","This study addresses the critical challenges in Vehicle-to-Vehicle (V2V) communications, particularly the issues of high mobility, dynamic channel conditions, and interference that adversely affect Bit Error Rate (BER) performance and overall system capacity. We propose an innovative integration of NOMA with a specific form of Quasi Cyclic-Low Density Parity Check (QC-LDPC) coding to enhance communication reliability and efficiency in vehicular environments, ensuring effective system operation even without clustering. Analytical and numerical simulations based on the NOMA-MIMO system are conducted to derive BER formulas for both near  $\text {(}{Bob}_{1})$  and far  $\text {(}{Bob}_{2})$  users. The effectiveness of Successive Interference Cancellation (SIC) techniques in mitigating interference in vehicular environments is also explored. Additionally, mathematical formulations for outage probability in NOMA-MIMO systems indicate that outage probability decreases with increased transmit power as users get closer to the base station. Our research demonstrates that QC-LDPC codes without  $Girth_{4}$  cycles significantly enhance error correction capabilities and achieve higher spectral efficiency over Rician fading channels. OFDMA-LDPC and SM-NOMA (Spatial Multiplexing-Non Orthogonal Multiple Access) based vehicular communication systems are also compared, emphasizing the impact of  $2\times 2$  and  $4\times 4$  MIMO configurations on BER and capacity. The results highlight NOMA’s superiority and the simplified structure of QC-LDPC, resulting in enhanced system performance in dynamic vehicular communication scenarios. Moreover, increasing the antennas at both ends leads to further performance improvements, with results achieved at a code rate 1/3 among the benchmarked schemes. The Sum-Product algorithm is often employed as a preferred decoding method in high-mobility scenarios due to its efficiency and simplicity, which enhance communication reliability and system capacity. This research also addresses the challenges associated with high vehicle velocities and the resulting Doppler shifts, which are significant in highway and urban scenarios. The mentioned effects were particularly pronounced at a frequency of 0.2 THz and a speed of 120 km/h, impacting signal quality and reliability.",,2025,10.1109/ACCESS.2025.3531511,https://ieeexplore.ieee.org/document/10845171,new
ieee:10777555,journal,Improved Free-of-CPP ADMM-Based Iterative Decoding Algorithm of Binary LDPC Codes,"Jing Bai, Zedong An, Yuhao Chi, Guanghui Song, Chau Yuen","Iterative decoding algorithms based on the alternating direction method of multipliers (ADMM) decoding of low density parity check (LDPC) codes has emerged as an alternating decoding method and bringed a boom of research on drawing upon mathematical optimization to LDPC decoding. Improving error-correcting performance is a key issue to enhance the superiority of ADMM decoding. In this letter, we investigate an efficient ADMM-based iterative decoder for binary LDPC codes. First, we build an mathematical programming equivalence of the maximum likelihood (ML) decoding problem by transforming parity-check constraints to multiple equivalent linear constraints and eliminating check-polytope projection (CPP). Then, an iterative algorithm based on ADMM technique is developed to solve this free-of-CPP (FCPP) equivalence and each ADMM update can be computed efficiently. Moreover, the proposed ADMM-FCPP decoding algorithm is analyzed to display a linear complexity to the length of the LDPC code at each iteration. Finally, simulation results demonstrate the superiority of the proposed decoder in error-correcting performance compared with the state-of-the-art ADMM-based decoders.",,2025,10.1109/LSP.2024.3511336,https://ieeexplore.ieee.org/document/10777555,new
