ID,Type,Title,Authors,Abstract,Categories,Published,DOI,PDF URL,Status
ieee:5755773,conference,Practical Successive Interference Cancellation in the Binary-Input Gaussian Multiple-Access Channel,"Xiaoyan Xu, Norbert Goertz","In the multiple access channel, successive interference cancellation (SIC) can be used to achieve the boundary points of the capacity region. In this paper, we investigate the practical potential of SIC by employing a set of practical moderate-blocksize Low-Density Parity-Check codes in the Multiple Access additive white Gaussian noise channel; in particular we consider binary modulation. The theo...",,14-16 Jan.,,https://ieeexplore.ieee.org/document/5755773,new
ieee:5755491,conference,Multiple-Bases Belief-Propagation with Leaking for Decoding of Moderate-Length Block Codes,"Thorsten Hehn, Johannes B. Huber, Pei He, Stefan Laendner","Short algebraic codes promise low-delay data transmission and good performance results when transmitted over the additive white Gaussian noise (AWGN) channel and decoded by maximum-likelihood (ML) soft-decision decoding. One reason for this is the large minimum distance of these codes. For belief-propagation (BP) decoding, short algebraic codes show suboptimal results due to their high-density par...",,14-16 Jan.,,https://ieeexplore.ieee.org/document/5755491,new
ieee:5755759,conference,Efficient Iterative Source-Channel Decoding Using Irregular Index Assignments,"Laurent Schmalen, Peter Vary, Thorsten Clevorn, Birgit Schotsch",We present a system for iterative source-channel decoding (ISCD) using irregular index assignments: The concept of irregular codes is applied to the index assignment of a scalar quantizer. The optimization performed in the EXIT chart enables near optimum transmission. The irregular index assignments are constructed by using high-rate block codes. This construction allows to use a very simple stopp...,,14-16 Jan.,,https://ieeexplore.ieee.org/document/5755759,new
ieee:5755778,conference,Efficient Implementation of Belief Propagation for Lossy Source Compression with LDGM Codes,"Peter Guenther, Dagmar Schoenfeld, Antje Winkler","In contrast to former investigations, this paper deals with belief propagation (BP) instead of survey propagation (SP) for binary quantization based on low-density generator matrix (LDGM) codes. We present necessary modifications of BP for binary quantization. Generally, our goal was a reduced complexity at constant rate-distortion performance. Therefore, additional approximations are considered. ...",,14-16 Jan.,,https://ieeexplore.ieee.org/document/5755778,new
ieee:5755799,conference,Statistics of a Blind Channel Estimator based on 'Logic Strings',"Wolfgang Rave, Andre Fonseca dos Santos, Gerhard Fettweis","We derive the mean squared error (variance) of a blind channel estimator that exploits constraints imposed on valid combinations of code bits (also called &#34;logic strings&#34;) and the respective receive symbols by the parity check equations of a channel code. The dependence of the estimation error on the length of the logic strings, their available number as well as on the channel impulse response is ...",,14-16 Jan.,,https://ieeexplore.ieee.org/document/5755799,new
ieee:5755961,conference,Joint Network/Channel Coding for Multi-User Hybrid-ARQ,Ragnar Thobaben,"We present a novel multi-user hybrid-ARQ scheme for a wireless multiple-unicast scenario where a base station supplies a group of users with individual messages. Considering that all users have access to noisy observations of all transmitted packets, network coding is applied to combine retransmissions to several users. Within this framework, we propose a novel joint network and channel code desig...",,14-16 Jan.,,https://ieeexplore.ieee.org/document/5755961,new
ieee:5755790,conference,On Code Design for Unequal Error Protection Multilevel Coding,"Neele von Deetzen, Werner Henkel","Unequal error protection is an important feature regarding transport of multimedia data. The paper presents a novel approach for realising unequal error protection properties with multilevel codes, following the capacity design rule but adjusting the scheme to provide more unequal error protection than a multilevel coding scheme inherently provides. The flexibility of this approach is investigated...",,14-16 Jan.,,https://ieeexplore.ieee.org/document/5755790,new
ieee:4446433,conference,Multi-Rate and QoS Differentiation in Optical Code Division Multiple Access Networks,"S. Sahuguede, M. Morelle, A. Julien-Vergonjanne, J.-P. Cances","To provide Quality of Service (QoS) and data rate differentiation, we investigate in this paper a 2 dimensional optical code division multiple access (OCDMA) technique. A 2D multi-weight coding scheme with parallel mapping technique is developed. The system enhancement is assessed thanks to the use of Forward Error Correction (FEC) based on Low Density Parity Check (LDPC) codes. In order to have a...",,10-12 Jan.,10.1109/ccnc08.2007.135,https://ieeexplore.ieee.org/document/4446433,new
