ID,Type,Title,Authors,Abstract,Categories,Published,DOI,PDF URL,Status
ieee:6120565,conference,Parallel Concatenation of LDPC Codes with Two Sets of Source Bits,"P.C. Catherine, K.M.S. Soyjaudah","Conventional attempts at using parallel concatenation for LDPC codes have not been widely successful. Interestingly, existing schemes do not rely on the concatenating architecture, but rather on the complementary profile of two carefully selected component codes. Each code individually drive the decoding process over the signal-to-noise ratio range over which it excels. In this work however, a con...",,18-20 Nov.,10.1109/ICETET.2011.46,https://ieeexplore.ieee.org/document/6120565,new
ieee:6120564,conference,Erasing Bit Nodes on the Bipartite Graph for Enhanced Performance of LDPC Codes,"P.C. Catherine, K.M.S. Soyjaudah","The proposed work is based on the fact that the complete set of bit nodes for an LDPC code may not always be required at the receiving side for successful decoding. A corresponding strategy is therefore built up. In contrast to common practice, the total number of iterations available is shared among different sets. The first set runs the decoding algorithm with all its bit nodes. Successive sets ...",,18-20 Nov.,10.1109/ICETET.2011.45,https://ieeexplore.ieee.org/document/6120564,new
ieee:6138645,conference,Efficient Reed-Solomon based LDPC decoders,"Chuan Zhang, Sang-Min Kim, Jin Sha","By exploring the specific characteristics of the matrices of Reed-Solomon (RS) based low-density parity-check (LDPC) codes, the authors manage to propose an efficient memory address generation (MAG) method for time-multiplexed (TM) RS-based LDPC code decoder architecture. This unique feature directly results in the MAG scheme which works perfectly with the TM decoders. Furthermore, along with the ...",,17-18 Nov.,10.1109/ISOCC.2011.6138645,https://ieeexplore.ieee.org/document/6138645,new
ieee:6138641,conference,A selective-input non-binary LDPC decoder architecture,"Yeong-Luh Ueng, Chung-Jay Yang, Shu-Wei Chen, Wei-Xuan Wu","This paper presents a layered selective-input Min-Max decoding algorithm and the associated architecture for non-binary LDPC codes. Compared to the selective-input non-binary decoders presented in the literature, our proposed selective-input implementation can be quite easily realized in order to achieve a higher parallelism and a higher throughput. Also, by using a compensation technique, the err...",,17-18 Nov.,10.1109/ISOCC.2011.6138641,https://ieeexplore.ieee.org/document/6138641,new
ieee:6138642,conference,Memory efficient decoder design of nonbinary LDPC codes,"Kai He, Jin Sha, Zhongfeng Wang","This paper presents a memory efficient decoding algorithm for the non-binary low-density parity-check (NB-LDPC) codes. Compared to other recently developed Min-Max decoding algorithm, the message memory as well as the average number of iterations has been reduced using the proposed decoding method. Meanwhile, the corresponding decoder architecture is also proposed.",,17-18 Nov.,10.1109/ISOCC.2011.6138642,https://ieeexplore.ieee.org/document/6138642,new
ieee:6138644,conference,A common flexible architecture for Turbo/LDPC codes,"Yuebin Huang, Chen Chen, Changsheng Zhou, Yun Chen, Xiaoyang Zeng","Turbo codes and LDPC codes are two of the most powerful error correction codes that can approach Shannon limit in many communication systems. But there are little architecture presented to support both LDPC and Turbo codes, especially by the means of ASIC. This paper have implemented a common architecture that can decode LDPC and Turbo codes, and it is capable of supporting the WiMAX, WiFi, 3GPP-L...",,17-18 Nov.,10.1109/ISOCC.2011.6138644,https://ieeexplore.ieee.org/document/6138644,new
ieee:6138643,conference,Flexible and efficient FEC decoders supporting multiple transmission standards,"Yun Chen, Changsheng Zhou, Yuebin Huang, Shuangqu Huang, Xiaoyang Zeng","An important trend of the modern mobile device is that a single user terminal that will be capable of receiving signals of multiple different transmission standards. Most of these transmission standards employ a forward error correction decoding, including Reed-Solomon, Viterbi, Turbo and low-density parity check and so on. In this overview paper we review several programmable and area-efficient d...",,17-18 Nov.,10.1109/ISOCC.2011.6138643,https://ieeexplore.ieee.org/document/6138643,new
ieee:6117701,conference,A novel low complexity soft-decision demapper for QPSK 8PSK demodulation of DVB-S2 systems,"Jianing Su, Zhenghao Lu, Xiaopeng Yu, Changhui Hu","This paper provides an efficient low complexity soft-decision demapper algorithm for computing the log-likelihood-ratios (LLRs) of the 8PSK demodulations in the DVB-S2 standard. The proposed method has linear complexity, avoids the multiple square operations in the classical method and reduces the number of compare-select operations by half compared to traditional LLR computation algorithms. The d...",,17-18 Nov.,10.1109/EDSSC.2011.6117701,https://ieeexplore.ieee.org/document/6117701,new
ieee:6123576,conference,A 115mW 1Gbps QC-LDPC decoder ASIC for WiMAX in 65nm CMOS,"Xiao Peng, Zhixiang Chen, Xiongxin Zhao, Dajiang Zhou, Satoshi Goto","Structured quasi-cyclic low-density parity-check (QC-LDPC) code is a part of many emerging wireless communication standards, such as WiMAX, WiFi and WPAN. This paper presents a high parallel decoder architecture for the QC-LDPC codes and the corresponding decoder ASIC for WiMAX system. Through utilizing the proposed fully parallel layered scheduling architecture, the decoder chip saves 22.2% memor...",,14-16 Nov.,10.1109/ASSCC.2011.6123576,https://ieeexplore.ieee.org/document/6123576,new
ieee:6123640,conference,A 1pJ/cycle Processing Engine in LDPC application with charge recovery logic,"Yimeng Zhang, Mengshu Huang, Nan Wang, Satoshi Goto, Tsutomu Yoshihara","This paper presents a Processing Engine (PE) which is used in Low Density Parity Codec (LDPC) application with a novel charge-recovery logic called pseudo-NMOS boost logic (pNBL), to achieve high-speed and low power dissipation. pNBL is a high-overdriven, low area consuming charge recovery logic, which belongs to boost logic family. Proposed Processing Engine is used in LDPC circuit to reduce powe...",,14-16 Nov.,10.1109/ASSCC.2011.6123640,https://ieeexplore.ieee.org/document/6123640,new
ieee:6210752,conference,Coded modulation of polarization- and space-multiplexed signals,"Henning Bülow, Ümit Abay, Andreas Schenk, Johannes B. Huber",In this Paper we investigate the optimization of constellations for polarization-division multiplexed transmission in standard single-mode fiber systems and for space-division multiplexing in a multi-mode fiber system.,,13-16 Nov.,10.1117/12.900442,https://ieeexplore.ieee.org/document/6210752,new
