ID,Type,Title,Authors,Abstract,Categories,Published,DOI,PDF URL,Status
ieee:6125307,conference,Trellis based Extended Min-Sum for decoding nonbinary LDPC codes,"Erbao Li, Kiran Gunnam, David Declercq","In this paper, we propose a new method to implement the Extended Min-Sum (EMS) algorithm based on trellis representation of inputting messages to the check node. The original EMS reduces the decoding complexity by choosing only nm most reliable values and by introducing the idea of configuration sets conf(nm, nc), where nc is the number of deviations from the most reliable output configuration. We...",,6-9 Nov. 2,10.1109/ISWCS.2011.6125307,https://ieeexplore.ieee.org/document/6125307,new
ieee:6125322,conference,Extended non-binary Low-Density Parity-Check codes over erasure channels,"Lam Pham Sy, Valentin Savin, David Declercq","Based on the extended binary image of non-binary LDPC codes, we propose a method for generating extra redundant bits, such as to decreases the coding rate of a mother code. The proposed method allows for using the same decoder, regardless of how many extra redundant bits have been produced, which considerably increases the flexibility of the system without significantly increasing its complexity. ...",,6-9 Nov. 2,10.1109/ISWCS.2011.6125322,https://ieeexplore.ieee.org/document/6125322,new
ieee:6190086,conference,Rate adaptive non-binary LDPC codes with low encoding complexity,Nicholas B. Chang,"For error-correction codes, the optimal coding rate can vary and depend on factors including channel, time-varying fading, environmental interference, power, bandwidth allocation, communication content, and application. Rate adaptive coding schemes are thus important for robust communications. This writeup proposes and studies a rate adaptive low density parity check (LDPC) coding scheme using non...",,6-9 Nov. 2,10.1109/ACSSC.2011.6190086,https://ieeexplore.ieee.org/document/6190086,new
ieee:6190138,conference,Improved iterative soft-reliability-based majority-logic decoding algorithm for non-binary low-density parity-check codes,"Chenrong Xiong, Zhiyuan Yan","Non-binary low-density parity-check (LDPC) codes have some advantages as opposed to their binary counterparts, but unfortunately their decoding complexity is a significant challenge. Hence, the iterative soft-reliability-based (ISRB) majority-logic decoding algorithm is attractive for non-binary LDPC codes, since it involves only finite field additions and multiplications as well as integer additi...",,6-9 Nov. 2,10.1109/ACSSC.2011.6190138,https://ieeexplore.ieee.org/document/6190138,new
ieee:6125404,conference,Improved cooperative spectrum sensing using belief propagation algorithm and energy detection,"Pranav Sakulkar, Adrish Banerjee","In this paper, we describe a new method for improving cooperative spectrum sensing in cognitive radio. We introduce a new block based on belief propagation algorithm in the conventional structure of cooperative spectrum sensing. The belief propagation block allows propagation of correct beliefs over a network of secondary users and thus in turn improves the primary user detection. We consider the ...",,6-9 Nov. 2,10.1109/ISWCS.2011.6125404,https://ieeexplore.ieee.org/document/6125404,new
ieee:6190388,conference,GPU accelerated scalable parallel decoding of LDPC codes,"Guohui Wang, Michael Wu, Yang Sun, Joseph R. Cavallaro","This paper proposes a flexible low-density parity-check (LDPC) decoder which leverages graphic processor units (GPU) to provide high decoding throughput. LDPC codes are widely adopted by the new emerging standards for wireless communication systems and storage applications due to their near-capacity error correcting performance. To achieve high decoding throughput on GPU, we leverage the paralleli...",,6-9 Nov. 2,10.1109/ACSSC.2011.6190388,https://ieeexplore.ieee.org/document/6190388,new
ieee:6125390,conference,LDPC codes based on Progressive Edge Growth techniques for block fading channels,"André G. D. Uchôa, Cornelius Healy, Rodrigo C. de Lamare, Richard D. Souza","We propose an algorithm to design Root-Check LDPC codes based on Progressive Edge Growth (PEG) techniques for block-fading channels. The proposed algorithm imposes some restrictions on the traditional PEG algorithm to ensure that the LDPC code generated is Root-Check with the largest possible girth. The performance is investigated by means of the outage probability. By doing so, the codes generate...",,6-9 Nov. 2,10.1109/ISWCS.2011.6125390,https://ieeexplore.ieee.org/document/6125390,new
ieee:6125400,conference,Rate-compatible LDPC codes using optimized dummy bit insertion,"Moritz Beermann, Tobias Breddermann, Peter Vary",Much attention has been paid to Low-Density Parity-Check (LDPC) codes since their rediscovery by MacKay. They belong to the most powerful channel coding techniques known today and have a broad range of applications. In wireless communication systems it is desirable to be able to adjust the code rate of the employed channel coding scheme (rate-matching) to allow for a flexible strength of error pro...,,6-9 Nov. 2,10.1109/ISWCS.2011.6125400,https://ieeexplore.ieee.org/document/6125400,new
ieee:6190087,conference,Achieving flexibility in LDPC code design by absorbing set elimination,"Jiajun Zhang, Jiadong Wang, Shayan Garani Srinivasa, Lara Dolecek","Low-density parity-check (LDPC) codes are attractive since their performance is known to approach the Shannon limits for suitably large block lengths. However, for moderate block lengths, error floors still jeopardize the performance even of well-designed LDPC codes. Previous work has shown that the error floor of a broad class of LDPC codes is due to certain graphical structures called absorbing ...",,6-9 Nov. 2,10.1109/ACSSC.2011.6190087,https://ieeexplore.ieee.org/document/6190087,new
ieee:6125306,conference,Finite-length rate-compatible LDPC codes based on extension techniques,"Jingjing Liu, Rodrigo C. de Lamare",We propose two innovative extension schemes for Rate-Compatible (RC) Low-Density Parity-Check (LDPC) codes with short/moderate block lengths. The proposed designs are based on the counting cycles algorithm and the Approximate Cycle Extrinsic Message Degree (EMD). Our layer-structured extension schemes enjoy a linear-time encodable ability and relatively low decoding complexity thanks to low degree...,,6-9 Nov. 2,10.1109/ISWCS.2011.6125306,https://ieeexplore.ieee.org/document/6125306,new
ieee:6125358,conference,Construction of SeIRA QC-LDPC codes with low error floor,"Wenyan Zhang, Minjian Zhao, Jie Zhong, Jie Wu, Xuanxuan Lv","We investigate the construction method of structured extended irregular repeated-accumulate quasi-cyclic low-density parity-check (SeIRA QC-LDPC) codes with short to moderate length. A new metric is proposed that jointly considers both circle length and circle connectivity, which aims to improve the error correcting performance in the error floor region. Meanwhile, iterative searching method is pr...",,6-9 Nov. 2,10.1109/ISWCS.2011.6125358,https://ieeexplore.ieee.org/document/6125358,new
ieee:6125345,conference,Distributed joint source-channel coding of correlated binary sources in wireless sensor networks,"Iqbal Shahid, Pradeepa Yahampath","In this paper, we present a distributed joint source-channel (DJSC) coding approach for a pair of correlated binary sources transmitted over independent binary symmetric channels. This problem is of interest in wireless sensor network applications, where encoders with low complexity and delay may be required. In the proposed method, a judiciously chosen fraction of information bits and a fraction ...",,6-9 Nov. 2,10.1109/ISWCS.2011.6125345,https://ieeexplore.ieee.org/document/6125345,new
ieee:6125401,conference,On the performance of non-binary LDPC with MIMO in practical systems,"Ottavio M. Picchi, Alain Mourad, Ismael Gutierrez, Marco Luise","This paper aims at assessing the performance of non-binary LDPC codes with MIMO techniques in practical systems (e.g. MIMO 2×2 systems). More specifically, we compare two approaches at the receiver side, a first linear approach (using linear equalizer) and a second less common approach making “soft” use of the maximum likelihood (ML) criterion. Moreover, this paper also tries to assess the suitabi...",,6-9 Nov. 2,10.1109/ISWCS.2011.6125401,https://ieeexplore.ieee.org/document/6125401,new
ieee:6115901,conference,Improved rate-adaptive codes for Distributed Video Coding,"Jeffrey J. Micallef, Reuben A. Farrugia, Carl J. Debono",Distributed Video Coding (DVC) is a coding paradigm which shifts the major computational intensive tasks from the encoder to the decoder. Temporal correlation is exploited at the decoder by predicting the Wyner-Ziv (WZ) frames from the adjacent key frames. Compression is then achieved by transmitting just the parity information required to correct the predicted frame and recover the original frame...,,6-9 Nov. 2,10.1109/VCIP.2011.6115901,https://ieeexplore.ieee.org/document/6115901,new
ieee:6115935,conference,An unequally protected Distributed Compressed Video Sensing algorithm,"Bin Li, Xuqi Zhu, Yu Liu, Lin Zhang","Distributed Compressed Video Sensing (DCVS) has developed as one of the efficient solutions that guarantee low complexity video compression. In this paper, a novel DCVS algorithm with unequal protection of the video signal&#39;s elements is proposed. The new algorithm utilizes not only the sparsity and probability distribution of the video signal but also its particular unequal significance feature. B...",,6-9 Nov. 2,10.1109/VCIP.2011.6115935,https://ieeexplore.ieee.org/document/6115935,new
ieee:6190136,conference,An efficient architecture for iterative soft reliability-based majority-logic non-binary LDPC decoding,"Xinmiao Zhang, Fang Cai","Non-binary low-density parity-check (NB-LDPC) codes have better error-correcting performance than their binary counterparts at the cost of higher decoding complexity when the code length is moderate. Compared to other NB-LDPC decoding algorithms, the iterative reliability-based majority-logic decoding can achieve better performance-complexity tradeoff. In this paper, an efficient partial-parallel ...",,6-9 Nov. 2,10.1109/ACSSC.2011.6190136,https://ieeexplore.ieee.org/document/6190136,new
ieee:6125305,conference,A flexible layered LDPC decoder,"I. Tsatsaragkos, V. Paliouras","We introduce a flexible layered decoder architecture for Quasi-Cyclic Low Density Parity Check (LDPC) codes. An iterative construction of the parity check matrix is exploited by the proposed decoder to achieve various degrees of parallelism, characterized by a high utilization of variable and check processing nodes, absence of memory conflicts, and a simple and scalable interconnection network. Fu...",,6-9 Nov. 2,10.1109/ISWCS.2011.6125305,https://ieeexplore.ieee.org/document/6125305,new
ieee:6190420,conference,A reduced routing network architecture for partial parallel LDPC decoders,"Houshmand Shirani-Mehr, Tinoosh Mohsenin, Bevan Baas","A novel partial parallel decoding scheme based on the matrix structure of LDPC codes proposed in IEEE 802.15.3c and IEEE 802.11ad standards is presented that significantly simplifies the routing network of the decoder, and the class of parity-check matrices for which the method can be used is defined. The proposed method results in an almost complete elimination of logic gates on the routing netwo...",,6-9 Nov. 2,10.1109/ACSSC.2011.6190420,https://ieeexplore.ieee.org/document/6190420,new
ieee:6190329,conference,Finding the most fault-tolerant flat XOR-based erasure codes for storage systems,Jay J. Wylie,"We describe the techniques we developed to efficiently find the most fault-tolerant flat XOR-based erasure codes for storage systems. These techniques substantially reduce the search space for finding fault-tolerant codes (e.g., by a factor of over 52 trillion in one case). This reduction in the search space has allowed us to find the most fault-tolerant codes for larger codes than was previously ...",,6-9 Nov. 2,10.1109/ACSSC.2011.6190329,https://ieeexplore.ieee.org/document/6190329,new
ieee:6125323,conference,On the iterative decoding of binary product codes over the binary erasure channel,"P. R. Freitas, V. C. da Rocha, J. S. Lemos-Neto",Iterative decoding in two dimensions over the binary erasure channel is investigated when identical linear binary cyclic codes are employed in each dimension. Decoding of the overall code is simplified by employing iterative decoding with cyclic permutations for the component code in each dimension. Decoding complexity versus performance can be traded as a function mainly of the number of minimum ...,,6-9 Nov. 2,10.1109/ISWCS.2011.6125323,https://ieeexplore.ieee.org/document/6125323,new
ieee:6125398,conference,An FPGA implementation architecture for decoding of polar codes,Alptekin Pamuk,Polar codes are a class of codes versatile enough to achieve the Shannon bound in a large array of source and channel coding problems. For that reason it is important to have efficient implementation architectures for polar codes in hardware. Motivated by this fact we propose a belief propagation (BP) decoder architecture for an increasingly popular hardware platform; Field Programmable Gate Array...,,6-9 Nov. 2,10.1109/ISWCS.2011.6125398,https://ieeexplore.ieee.org/document/6125398,new
ieee:6190112,conference,Outage capacity for MIMO-OFDM systems in block fading channels,"Marco Chiani, Andrea Conti, Matteo Mazzotti, Enrico Paolini, Alberto Zanella",We introduce the concept of outage capacity for multiple-input multiple-output (MIMO)-orthogonal frequency-division multiplexing (OFDM) systems in time and frequency block fading channels. We derive the outage capacity and its expression is shown to be related to the characteristic function of the capacity for the usual quasi-static MIMO fading channel case. We also compare the outage capacity wit...,,6-9 Nov. 2,10.1109/ACSSC.2011.6190112,https://ieeexplore.ieee.org/document/6190112,new
ieee:6116018,conference,Distributed video coding: A promising solution for distributed wireless video sensors or not?,"Chieh-Chuan Chiu, Shao-Yi Chien, Chia-han Lee, V. Srinivasa Somayazulu, Yen-Kuang Chen","Low-power and low-cost distributed wireless video sensors play important roles for applications in machine-to-machine (M2M) and wireless sensor networks. Distributed video coding (DVC), an emerging coding technology based on Wyner-Ziv theory, seems to be a possible solution for implementing low-power video sensors since most of the computational complexity is moved from the encoder to the decoder....",,6-9 Nov. 2,10.1109/VCIP.2011.6116018,https://ieeexplore.ieee.org/document/6116018,new
ieee:6190088,conference,Decoding by iterative detection (DECIDET): Soft-in/soft-out decoding of arbitrary linear block codes over arbitrary finite fields,"Todd K. Moon, Jacob H. Gunther","This paper presents a framework for an error correction decoding algorithm which can perform soft-input/soft-output decoding on arbitrary linear block codes over arbitrary finite fields. The algorithm produces estimates of individual symbols by detecting the symbol as a scalar multiple of a column of the generator matrix for the code, with other columns forming an interfering “noise” which is prob...",,6-9 Nov. 2,10.1109/ACSSC.2011.6190088,https://ieeexplore.ieee.org/document/6190088,new
ieee:6125326,conference,Sub-optimal importance sampling for fast simulation of linear block codes over BSC channels,"Gianmarco Romano, Antonio Drago, Domenico Ciuonzo",Estimation of very low word-error probability of hard-decoded linear block codes can be performed through Monte-Carlo simulation. The computational complexity of the standard method however increases as the probability of error to be estimated decreases. In this paper we propose a general algorithm for fast estimation of probability of error of linear block codes on BSC channels based on the impor...,,6-9 Nov. 2,10.1109/ISWCS.2011.6125326,https://ieeexplore.ieee.org/document/6125326,new
ieee:6125284,conference,Quantization based Estimate-and-Forward with unequal error protection for Turbo coded Physical layer network coding on the TWRC,"Dong Fang, Alister G. Burr","In this paper, we investigate a novel Estimate-and-Forward (EF) scheme based on quantization for Turbo coded Physical layer network coding (PLNC) on the two-way relay channel (TWRC). The network coded soft information is estimated as soft bits, which are then transmitted in quantized form. According to the different importance of different bits of the quantization index, unequal error protection (...",,6-9 Nov. 2,10.1109/ISWCS.2011.6125284,https://ieeexplore.ieee.org/document/6125284,new
ieee:6189996,conference,Compressive sensing based imaging via Belief Propagation,"Preethi Ramachandra, Mina Sartipi","Multiple description coding (MDC) using Compressive sensing (CS) mainly aims at restoring the image from a small subset of samples with reasonable accuracy using an iterative message passing decoding algorithm commonly known as Belief Propagation (BP). CS technique can accurately recover any compressible or sparse signal from a lesser number of non-adaptive, randomized linear projection samples th...",,6-9 Nov. 2,10.1109/ACSSC.2011.6189996,https://ieeexplore.ieee.org/document/6189996,new
ieee:6125442,conference,Maximum likelihood detection upper bound for detect-and-forward relaying over AWGN channels,"Khoa Quang Huynh, Tor Aulin","The maximum likelihood (ML) detection rule for the detect-and-forward relaying in Additive White Gaussian Noise (AWGN) channels which takes into account the detecting errors at the relay is formulated. In order to focus the study on relaying, channel coding is eliminated. Based on the derived ML detection rule, the upper bound on the probability of error at the destination&#39;s receiver is analyzed. ...",,6-9 Nov. 2,10.1109/ISWCS.2011.6125442,https://ieeexplore.ieee.org/document/6125442,new
ieee:6125395,conference,Outage performance for opportunistic decode-and-forward relaying coded cooperation networks over Nakagami-m fading,"Hoc Phan, Trung Q. Duong, Hans-Jürgen Zepernick","In this paper, we analyze the outage performance of an opportunistic decode-and-forward (DF) relaying coded cooperation network over independent, and identically distributed Nakagami-m fading channels. In this scheme, cooperative diversity gain is obtained by integrating opportunistic relaying (OR) selection with channel coding. We have derived an analytical expression for the outage probability (...",,6-9 Nov. 2,10.1109/ISWCS.2011.6125395,https://ieeexplore.ieee.org/document/6125395,new
ieee:6190223,conference,Channel tracking for D-BLAST for airborne platforms,"Kapil Borle, Biao Chen, M. J. Gans",Coherent symbol detection requires knowledge of channel state information. The traditional use of embedding pilot symbols with payload data may not be easy to justify if channel variation is fast and/or the data rate requirement is high. We consider the implementation of the D-BLAST algorithm for airborne platforms and develop channel tracking schemes that eliminate or reduce the use of pilot symb...,,6-9 Nov. 2,10.1109/ACSSC.2011.6190223,https://ieeexplore.ieee.org/document/6190223,new
ieee:6197837,conference,Construction of nonbinary LDPC codes: Prime difference approach,"Xin Zhao, Lijun Zhang, Leelung Cheng","This paper presents an algebraic method for constructing structural nonbinary LDPC codes based on the prime difference over finite field. The approach gives a class of quasi-cyclic (QC)-LDPC codes with girth at least 6. Especially, the approach can construct a class of short length code and the decoding complexity is low. Simulation results show that the constructed codes decoded with iterative de...",,27-30 Nov.,10.1049/cp.2011.0970,https://ieeexplore.ieee.org/document/6197837,new
ieee:6197838,conference,Construction of QC-LDPC codes based on PSO algorithm,"Yang Yang, Yang Xiao","The well known Tanner codes are not encodable, in this paper, we derived an encodable QC LDPC codes and use PSO algorithm to determine the parameters of the parity check matrices of the QC LDPC codes. The proposed PSO code construction considers the girth 4 and BER performance to be the constrained conditions in the fitness function of PSO algorithm. Simulation results show that the QC codes const...",,27-30 Nov.,10.1049/cp.2011.0971,https://ieeexplore.ieee.org/document/6197838,new
ieee:6197836,conference,"A class of (3, k) quasi-cyclic LDPC codes from difference sequences with girth 8","Bing Li, Lijun Zhang, Lee Lung Cheng","An approach for constructing a class of (3, k)-regular quasi-cyclic low-density parity-check (QC-LDPC) codes is proposed, which is based on combinatorial objects termed difference sequences. By an efficient algorithm for searching good difference sequences, codes in this class have girth at least eight. Simulation results show that the codes slightly outperform the counterpart PEG codes and have b...",,27-30 Nov.,10.1049/cp.2011.0969,https://ieeexplore.ieee.org/document/6197836,new
ieee:6197824,conference,"Wide-range, accurate frequency offset compensation algorithm based on LDPC for space coherent optical communication","Jingsong Xiang, Miaomiao Zhang, Xiaolei Zhang, Shengming Ma","In this paper, we introduce a wide-range, accurate LDPC coded-aided frequency offset compensation algorithm based on both EM algorithm and M&M algorithm in space coherent optical communication systems. The proposed approach can overcome the shortcoming of the existing frequency offset compensation algorithms which are employed in space coherent optical communication systems directly. It allows per...",,27-30 Nov.,10.1049/cp.2011.0957,https://ieeexplore.ieee.org/document/6197824,new
ieee:6143605,conference,Iterative reconstruction algorithms in compressed sensing,"Ludovic Danjean, Vida Ravanmehr, David Declercq, Bane Vasić","In this paper we give an overview of current results in iterative reconstruction of sparse signals using parity check matrices of low-density parity check (LDPC) codes as measurement matrices in compressed sensing. We provide a detailed explanation of two iterative reconstruction algorithms, Interval Passing (IP) algorithm and verification algorithm. We then compare their performance using parity ...",,22-24 Nov.,10.1109/TELFOR.2011.6143605,https://ieeexplore.ieee.org/document/6143605,new
ieee:6143617,conference,"Comparison of DVB-T/H and DVB-T2 in mobile, portable and fixed TV channels","Tomas Kratochvil, Ladislav Polak",The paper deals with the DVB-T/H (Digital Video Broadcasting - Terrestrial / Handheld) and DVB-T2 (Digital Video Broadcasting - 2nd Generation Terrestrial) standards and their performance in multipath and fading TV channel models. For the comparison the overview information about DVB-T/H and DVB-T2 were taken from the DVB Facts Sheets and added with according references. Then parameters and models...,,22-24 Nov.,10.1109/TELFOR.2011.6143617,https://ieeexplore.ieee.org/document/6143617,new
ieee:6101300,conference,Full diversity random LDPC codes,"Dieter Duyck, Joseph J. Boutros, Marc Moeneclaey","The block fading (BF) channel is a useful model for various communication systems in urban environments. Full-diversity error-correcting codes are required to approach the physical limits of the performance on BF channels. Low-density parity-check (LDPC) codes are good error-correcting codes, but full-diversity standard random LDPC codes for the BF channel are not known yet. We design full-diversi...",,22-23 Nov.,10.1109/SCVT.2011.6101300,https://ieeexplore.ieee.org/document/6101300,new
ieee:6129158,conference,Performance improvement of rateless code by non-uniform selection of messages in encoding,"Hyung Taek Lim, Eon Kyeong Joo",LT(Luby transform) encoding is widely used for rateless codes. But uniform choice of messages in the LT encoding process conflicts with the merit of BP(belief propagation) decoding. So more codeword symbols than expected are required for the reliable recovery of message symbols. Thus a new encoding scheme with non-uniform selection of messages that can decrease average overhead and computational c...,,21-24 Nov.,10.1109/TENCON.2011.6129158,https://ieeexplore.ieee.org/document/6129158,new
ieee:6129155,conference,Factor graph based CRSC turbo code and iterative receiver design,"Debasish Bera, S. S. Pathak, I. Chakrabarti",Iterative receiver is poised to become the most prevalent receiver technology in near future. The paper explains the designing methodology of iterative receiver from graph theoretic approach. Modeling of well known turbo convolution code in factor graph framework with Sum-Product-Algorithm (SPA) has been discussed here. The model shows simpler representation of complex encoder trellis. Exchange of...,,21-24 Nov.,10.1109/TENCON.2011.6129155,https://ieeexplore.ieee.org/document/6129155,new
ieee:6136889,conference,A flexible NoC-based LDPC code decoder implementation and bandwidth reduction methods,"Carlo Condo, Guido Masera","The need for efficient and flexible LDPC (Low Density parity Check) code decoders is rising due to the growing number and variety of standards that adopt this kind of error correcting codes in wireless applications. From the implementation point of view, the decoding of LDPC codes implies intensive computation and communication among hardware components. These processing capabilities are usually o...",,2-4 Nov. 2,10.1109/DASIP.2011.6136889,https://ieeexplore.ieee.org/document/6136889,new
