ID,Type,Title,Status,Reason,Authors,Abstract,Categories,Published,DOI,PDF URL
ieee:6697911,journal,Array Convolutional Low-Density Parity-Check Codes,✅,"array LDPC 블록부호에서 출발한 신규 RTI-LDPC convolutional 부호 설계(제약길이 단축·최소거리 증가) — 이식 가능 코드 설계(E, 바이너리)","Marco Baldi, Giovanni Cancellieri, Franco Chiaraluce","This paper presents a design technique for obtaining regular time-invariant low-density parity-check convolutional (RTI-LDPCC) codes with low complexity and good performance. We start from previous approaches which unwrap a low-density parity-check (LDPC) block code into an RTI-LDPCC code, and we obtain a new method to design RTI-LDPCC codes with better performance and shorter constraint length. Differently from previous techniques, we start the design from an array LDPC block code. We show that, for codes with high rate, a performance gain and a reduction in the constraint length are achieved with respect to previous proposals. Additionally, an increase in the minimum distance is observed.",,February 2,10.1109/LCOMM.2013.120713.132177,https://ieeexplore.ieee.org/document/6697911
ieee:6708135,journal,Joint Blind Frame Synchronization and Encoder Identification for Low-Density Parity-Check Codes,❌,"바이너리 LDPC 블라인드 프레임 동기화·인코더 식별 — 채널 ECC 디코더/HW/구성 기여 없음, 통신 응용 특이적","Tian Xia, Hsiao-Chun Wu","In this paper, the problem involving joint blind frame synchronization and encoder identification for binary low-density parity-check (LDPC) codes of binary phase-shift keyed (BPSK) signals is tackled. The unknown encoder and time-delay can be blindly estimated simultaneously using the average log-likelihood ratios (LLRs) of syndrome a posteriori probability (APP). A new two-stage search method with a search step of size q by exploiting the quasi-cyclic nature of the parity-check matrix is devised to reduce the complexity of the blind frame synchronization algorithm. Numerous Monte Carlo simulations are evaluated to demonstrate the effectiveness of the new joint blind frame-synchronization and encoder-identification scheme for multi-path situations.",,February 2,10.1109/LCOMM.2013.123113.132241,https://ieeexplore.ieee.org/document/6708135
ieee:6715252,journal,Construction of Irregular QC-LDPC Codes via Masking with ACE Optimization,✅,바이너리 QC-LDPC masking + ACE 최적화 구성으로 error-floor 개선 — 코드설계(E) 이식 가능,"Guojun Han, Yong Liang Guan, Lingjun Kong","Quasi-cyclic low-density parity-check (QC-LDPC) codes constructed by using algebraic approaches, such as finite geometry and finite field, generally have good structural properties and very low error-floors, and facilitate hardware implementation. Irregular QC-LDPC codes constructed from such QC-LDPC codes by using the masking technique, when decoded with the sum-product algorithm (SPA), have low decoding complexity, but often show early error-floors. In this paper, the relationship of cycle, girth and approximate cycle EMD (ACE) between the masking matrix and masked matrix is investigated, and the ACE algorithm is modified and used to construct the masking matrix for irregular QC-LDPC codes. Simulations demonstrate that the codes constructed by masking with ACE optimization exhibit much improved waterfall performance and lower error floors.",,February 2,10.1109/LCOMM.2014.010214.132463,https://ieeexplore.ieee.org/document/6715252
ieee:6715256,journal,High Throughput LDPC Decoder on GPU,✅,GPU 고처리량 LDPC 디코더 coalesced 메모리 접근 — 병렬화 HW 기법(D) 이식 가능,"Yong Lin, Wensheng Niu","The available Lower Density Parity Check (LDPC) decoders on Graphics Processing Unit (GPU) do not simultaneously read and write contiguous data blocks in memory because of the random nature of LDPC codes. One of these two operations has to be performed using noncontiguous accesses, resulting in long access time. To overcome this issue, we designed a multi-codeword parallel decoder with fully coalesced memory access. To test the performance of the method, we applied the method using an 8-bit compact data. The experimental results demonstrated that the method achieved more than 550Mbps throughput on Compute Unified Device Architecture (CUDA) enabled GPU.",,February 2,10.1109/LCOMM.2014.010214.132406,https://ieeexplore.ieee.org/document/6715256
ieee:6725573,journal,Efficient Progressive Edge-Growth Algorithm Based on Chinese Remainder Theorem,✅,"PEG-CRT 베이스매트릭스 확장 LDPC 구성, on-the-fly HW 저장 이점 — 코드설계(E) 이식 가능","Xueqin Jiang, Xiang-Gen Xia, Moon Ho Lee","Progressive edge-growth (PEG) algorithm construction builds a Tanner graph, or equivalently a parity-check matrix, for an LDPC code by establishing edges between the symbol nodes and the check nodes in an edge-by-edge manner and maximizing the girth in a greedy fashion. This approach is simple but the complexity of the PEG algorithm scale is O(nm), where n is the number of symbol nodes and m is the number of check nodes. We deal with this problem by construct a base matrix Hb of size mb × nb with the PEG algorithm and simultaneously expand this base matrix into a parity-check matrix H of size mx n via the the Chinese remainder theorem (CRT), where m ≫ mb and n ≥ nb. The size of the base matrix is expanded without decreasing the girth. For convenience, the PEG and CRT combined algorithm is referred to as the PEG-CRT algorithm in this paper. Since a smaller matrix is constructed with the PEG algorithm and the complexity of the CRT computation is negligible compared to the PEG algorithm, the complexity of the whole code construction process is reduced. Furthermore, the proposed algorithm has a potential advantage of saving storage space by storing a smaller matrix Hb and expanding it to H ""on-the-fly"" in hardware. The expanded matrix H preserves the important properties of base matrix such as large girth, flexible code rate and low density. The complexity analysis shows that the complexity of the PEG-CRT algorithm does not grow with the code length n. Simulation results show that compared with the PEG LDPC codes of length nb, the expanded PEG-CRT LDPC codes have better bit error rate (BER) performance with the iterative decoding. It is also shown that compared with PEG LDPC codes of length n, which constructed with higher complexities, the PEG-CRT codes have similar BER performance.",,February 2,10.1109/TCOMM.2014.011114.130285,https://ieeexplore.ieee.org/document/6725573
ieee:6712186,journal,Analysis and Enumeration of Absorbing Sets for Non-Binary Graph-Based Codes,❌,비이진(non-binary) graph 코드 absorbing set 설계 — 비이진 LDPC라 제외,"Behzad Amiri, Jorg Kliewer, Lara Dolecek","In this work, we first provide the definition of absorbing sets for linear channel codes over non-binary alphabets. In a graphical representation of a non-binary channel code, an absorbing set can be described by a collection of topological and edge labeling conditions. In the non-binary case, the equations relating neighboring variable and check nodes are over a non-binary field, and the edge weights are given by the non-zero elements of that non-binary field. As a consequence, it becomes more difficult for a given structure to satisfy the absorbing set constraints compared to the binary case. This observation in part explains the superior performance of non-binary codes over their binary counterparts. We show that the conditions in the non-binary absorbing set definition can be simplified in the case of non-binary elementary absorbing sets. Based on these simplified conditions, we provide design guidelines for finite-length non-binary codes free of small non-binary elementary absorbing sets. These guidelines demonstrate that even under the preserved topology, the performance of a non-binary graph-based code in the error floor region can be substantially improved by manipulating edge weights so as to avoid small absorbing sets. Our various simulation results suggest that the proposed non-binary absorbing set definition is useful for a range of code constructions and decoders. Finally, by using both insights from graph theory and combinatorial techniques, we establish the asymptotic distribution of non-binary elementary absorbing sets for regular code ensembles.",,February 2,10.1109/TCOMM.2013.122113.130465,https://ieeexplore.ieee.org/document/6712186
ieee:6514947,journal,Spectrum-Efficient Coded Modulation Design for Two-Way Relay Channels,❌,양방향 중계채널 코딩변조(LDPC 베이스라인); 통신 응용 특이적이며 NAND로 떼어낼 신규 LDPC 기법 없음,"Zhiyong Chen, Hui Liu","In this paper, we present and analyze spectrum and energy efficient coded modulation schemes for two-way relay channels. Depending on how the side information is utilized, two relay-to-destination decode-and-forward approaches are investigated. The first one, termed joint modulation relaying (JMR), jointly modulates two source messages by applying side information at the modulator and the demodulator. The second one, termed bit-cooperative coded modulation relaying (BCCMR), is a new joint coded modulation scheme for coded relay systems. In particular, a new constellation mapping for the JMR is proposed. The proposed constellation mapping is a many-to-one function and can be considered as a new form of network coding operation, in which the network coding is performed on the redundancy labeling of each constellation point. We establish the corresponding asymptotic optimal constellation labeling criterion by formulating the constellation constrained capacity with side information. For the BCCMR, a novel transceiver structure based on systematic low-density parity-check (LDPC) codes is developed. The joint coding-modulation design introduces the benefits of increased minimum Euclidean distance and the Hamming distance by jointly exploiting side information in the demapping and the decoding. The advantages of the LDPC-coded BCCMR and the JMR are analyzed using the density evolution method.",,February 2,10.1109/JSAC.2014.141206,https://ieeexplore.ieee.org/document/6514947
ieee:6712182,journal,Generalized and Extended Subspace Algorithms for Error Correction with Quantized DFT Codes,❌,"BCH-DFT 코드 subspace 에러 로컬라이제이션 — 비-LDPC 부호, 이식 가능한 LDPC BP 기법 없음","Mojtaba Vaezi, Fabrice Labeau","Discrete Fourier transform (DFT) codes have been used to provide robustness against errors and erasures in various applications. This paper focuses on improving error localization of the Bose-Chaudhuri-Hocquenghem (BCH) DFT codes. First, we analyze how the subspace-based error localization outperforms the coding-theoretic one. Then, we propose an extension of the subspace-based error localization, based on additional syndrome, that improves the existing one and is naturally suitable for rate-adaptive distributed source coding (DSC). Further, we propose a new generic subspace-based algorithm to decode BCH-DFT codes. The proposed approach generalizes the encoding and decoding of this important class of DFT codes. It introduces many different decoding matrices for a DFT code; this diversity is then used to diminish the effect of the quantization noise and thus to improve the decoding. Finally, the extended and generalized approaches are combined to maximize the decoding gain. Simulation results demonstrate the capability of the proposed algorithms to perform significantly better than the existing subspace-based error localization, in the presence of quantization noise.",,February 2,10.1109/TCOMM.2014.010414.130440,https://ieeexplore.ieee.org/document/6712182
ieee:6661340,journal,Convergence of Weighted Min-Sum Decoding Via Dynamic Programming on Trees,✅,"weighted min-sum/attenuated max-product 수렴성 분석, ML/LP 디코딩 보장 weight 조건 — min-sum 변형 디코더(C) 이식 가능","Yung-Yih Jian, Henry D. Pfister","Applying the max-product (and sum-product) algorithms to loopy graphs is now quite popular for best assignment problems. This is largely due to their low computational complexity and impressive performance in practice. Still, there is no general understanding of the conditions required for convergence or optimality of converged solutions or both. This paper presents an analysis of both attenuated max-product decoding and weighted min-sum decoding for low-density parity-check (LDPC) codes, which guarantees convergence to a fixed point when a weight factor, β, is sufficiently small. It also shows that, if the fixed point satisfies some consistency conditions, then it must be both a linear-programming (LP) and maximum-likelihood (ML) decoding solution. For (dv, dc)-regular LDPC codes, the weight factor must satisfy β(dv-1) <; 1 to guarantee convergence to a fixed point, whereas the results proposed by Frey and Koetter require instead that β(dv-1)(dc-1) ≤ 1. In addition, the range of the weight factor for a provable ML decoding solution is extended to 0 <; β(dv-1) 1. In addition, counterexamples that show a fixed point might not be the ML decoding solution if β(dv-1) > 1 are given. Finally, connections are explored with recent work on the threshold of LP decoding.",,Feb. 2014,10.1109/TIT.2013.2290303,https://ieeexplore.ieee.org/document/6661340
ieee:6671468,journal,Quantum LDPC Codes With Positive Rate and Minimum Distance Proportional to the Square Root of the Blocklength,❌,"양자 LDPC 코드 구성·최소거리 bound 이론, 고전 바이너리 LDPC로 이식할 디코더/HW/구성 기법 없음","Jean-Pierre Tillich, Gilles Zémor",The current best asymptotic lower bound on the minimum distance of quantum LDPC codes with a fixed non-zero rate is logarithmic in the blocklength. We propose a construction of quantum LDPC codes with fixed non-zero rate and prove that the minimum distance grows proportionally to the square root of the blocklength.,,Feb. 2014,10.1109/TIT.2013.2292061,https://ieeexplore.ieee.org/document/6671468
ieee:6739405,journal,Turbo equalization techniques toward robust PDM 16-QAM optical fiber transmission,❌,"광섬유 전송용 turbo equalization, 비-LDPC이며 떼어낼 바이너리 LDPC BP 기법 없음","Valeria Arlunno, Antonio Caballero, Robert Borkowski, Silvia Saldaña Cercós, Darko Zibar, Knud J. Larsen, Idelfonso Tafur Monroy","In this paper, we show numerically and experimentally that turbo equalization (TE) is an efficient technique to mitigate performance degradations stemming from optical fiber propagation effects in both optical fiber dispersion managed and unmanaged coherent detection links. The effectiveness of the proposed solution can be appreciated in both linear and nonlinear regimes for either scenario. We report on a system employing a polarization division multiplexing (PDM) 16-quadrature amplitude modulation (QAM) format for which we accomplish an increment in tolerance to link input power of up to 3 dB that represents a substantial improvement margin. The best bit error rate (BER) performances will therefore be guaranteed in a larger window, 6 dB, of link input power thanks to the implemented TE scheme. Moreover, our proposed approach is also proven to effectively mitigate interchannel impairments from surrounding amplitude shift-keying interfering channels in a dispersion managed link achieving also in this case an increment in power tolerance of 3 dB. Furthermore, in terms of BER performances, our proposed TE approach guarantees a gain of about a half order of magnitude at the best operational point. As TE can be included in the current coherent detection transceiver technologies and complement other equalization techniques, it has prospects for application in next-generation high-capacity and long-reach optical transmission links.",,Feb. 2014,10.1364/JOCN.6.000204,https://ieeexplore.ieee.org/document/6739405
ieee:6804249,conference,Low complexity encoding algorithm of RS-based QC-LDPC codes,✅,RS기반 QC-LDPC 저복잡도 인코딩(LFSR HW); 바이너리 LDPC 인코더 HW 이식 가능(D),"Mu Zhang, Li Tang, Qin Huang, Zulin Wang","This paper presents a novel encoding algorithm for QC-LDPC codes constructed from Reed-Solomon codes. The encoding is performed in the transform domain via Galois Fourier transformation. Message bits are encoded in sections corresponding to sub-matrices of the parity-check matrix in the transform domain. Because of the structure of the parity-check matrices of these LDPC codes, the encoding can be easily implemented with some linear-feedback shift registers, thus efficiently reduces the hardware cost.",,9-14 Feb. ,10.1109/ITA.2014.6804249,https://ieeexplore.ieee.org/document/6804249
ieee:6804221,conference,Decoding of quasi-cyclic LDPC codes with section-wise cyclic structure,✅,"QC-LDPC section-wise cyclic 구조 기반 저복잡도 디코딩+HW 절감, error-floor 개선(C/D/E)","Juane Li, Keke Liu, Shu Lin, Khaled Abdel-Ghaffar","Presented in this paper is a reduced-complexity iterative decoding scheme for quasi-cyclic (QC) LDPC codes. This decoding scheme is devised based on the section-wise cyclic structure of the parity-check matrix of a QC-LDPC code. Using this decoding scheme, the hardware implementation complexity of a QC-LDPC decoder can be significantly reduced without performance degradation. A high-rate QC-LDPC code that can achieve a very low error-rate without a visible error-floor is used to demonstrate the effectiveness of the proposed decoding scheme. Also presented in this paper are two other high-rate QC-LDPC codes and a method for constructing rate -1/2 QC-LDPC codes whose Tanner graphs have girth 8. All the codes constructed perform well with low error-floor using the proposed decoding scheme.",,9-14 Feb. ,10.1109/ITA.2014.6804221,https://ieeexplore.ieee.org/document/6804221
ieee:6804215,conference,Check-hybrid GLDPC codes without small trapping sets,✅,"GLDPC 트래핑셋 제거 위해 단일체크를 슈퍼체크로 변환하는 신규 코드설계(E), 바이너리","Vida Ravanmehr, David Declercq, Bane Vasic","In this paper, we propose a new approach to construct a class of check-hybrid generalized low-density parity-check (GLDPC) codes which are free of small trapping sets. The approach is based on converting some selected check nodes involving a trapping set to super checks corresponding to a shorter error-correcting component code. Specifically, we follow two main purposes to construct the check-hybrid codes: First, replacing single parity checks by super checks is done based on the knowledge of the trapping sets of the global LDPC code. We show that by converting some single checks to super checks in a trapping set, the decoder corrects the errors on a trapping set and hence eliminates the trapping set. Second, the rate-loss caused by replacing the super checks is reduced through finding the minimum number of such critical checks. We first present an algorithm to find possible critical checks in a trapping set. We then provide some upper bounds on the minimum number of such critical checks such that the decoder corrects all error patterns on certain trapping sets in the Tanner graph of the global LDPC code. We also provide a potential fixed set for a class of constructed check-hybrid codes.",,9-14 Feb. ,10.1109/ITA.2014.6804215,https://ieeexplore.ieee.org/document/6804215
ieee:6804247,conference,LDPC code designs based on √I matrices,✅,√I 행렬 기반 LDPC 구성 및 효율적 인코딩 구조 신규 코드설계(E),Shayan G. Srinivasa,LDPC codes can be constructed by tiling permutation matrices that belong to the square root of identity type and similar algebraic structures. We investigate into the properties of such codes. We also present code structures that are amenable for efficient encoding.,,9-14 Feb. ,10.1109/ITA.2014.6804247,https://ieeexplore.ieee.org/document/6804247
ieee:6804283,conference,Unconventional behavior of the noisy min-sum decoder over the binary symmetric channel,✅,"noisy min-sum 디코더 거동 분석, density evolution; min-sum 변형/디코더 분석 이식 가능(C)","Christiane L. Kameni Ngassa, Valentin Savin, David Declercq","This paper investigates the behavior of the noisy Min-Sum decoder over binary symmetric channels. A noisy decoder is a decoder running on a noisy device, which may introduce errors during the decoding process. We show that in some particular cases, the noise introduce by the device can help the Min-Sum decoder to escape from fixed points attractors, and may actually result in an increased correction capacity with respect to the noiseless decoder. We also reveal the existence of a specific threshold phenomenon, referred to as functional threshold. The behavior of the noisy decoder is demonstrated in the asymptotic limit of the code-length, by using “noisy” density evolution equations, and it is also verified in the finite-length case by Monte-Carlo simulation.",,9-14 Feb. ,10.1109/ITA.2014.6804283,https://ieeexplore.ieee.org/document/6804283
ieee:6804206,conference,A class of compression systems with model-free encoding,❌,model-free 압축(소스코딩) 아키텍처 — 채널 ECC 아님,"Ying-zong Huang, Gregory W. Wornell","Practical compression systems are constrained by their bit-stream standards, which define the source model together with the coding method used. We introduce a model-free coding architecture that separates the two aspects of compression and allows the design of potentially more powerful source models, as well as more flexible use of the compressed information stream. We show that this architecture is capable of producing competitive performance while supporting new use cases.",,9-14 Feb. ,10.1109/ITA.2014.6804206,https://ieeexplore.ieee.org/document/6804206
ieee:6757514,conference,27.6 An 821MHz 7.9Gb/s 7.3pJ/b/iteration charge-recovery LDPC decoder,✅,"576b LDPC 디코더 테스트칩(charge-recovery logic, 65nm) — 에너지효율 디코더 HW 아키텍처, NAND LDPC에 이식 가능(D)","Tai-Chuan Ou, Zhengya Zhang, Marios C. Papaefthymiou","This paper presents a 576b LDPC decoder test-chip designed using a charge-recovery logic family. The chip has been fabricated in a 65nm CMOS process and relies on 16 integrated inductors to achieve energy-efficient operation by recovering charge from gate fanouts. When self-oscillating at 821MHz, the chip recovers 51.4% of the energy supplied to it. In terms of device count, this chip is more than an order of magnitude larger than the largest previously-reported chips with charge-recovery logic [3-4]. When operating at 821MHz, it achieves a 7.9Gb/s throughput at 7.3pJ/b/iteration, improving on results in [1-2,5] by at least 1.7× in energy efficiency and 2.3× in area efficiency.",,9-13 Feb. ,10.1109/ISSCC.2014.6757514,https://ieeexplore.ieee.org/document/6757514
ieee:6757515,conference,27.7 A scalable 1.5-to-6Gb/s 6.2-to-38.1mW LDPC decoder for 60GHz wireless networks in 28nm UTBB FDSOI,✅,"802.11ad LDPC 디코더(28nm FDSOI) — approximate marginalization 등 신규 디코더 기법+HW 아키텍처, 이식 가능(C/D)","Matthew Weiner, Milovan Blagojevic, Sergey Skotnikov, Andreas Burg, Philippe Flatresse, Borivoje Nikolic","Low-density parity-check (LDPC) codes in modern wireless communications are rate- and throughput-scalable, and despite their complexity, decoding them requires low power consumption. The IEEE 802.11ad standard for Gb/s wireless LANs in the 60GHz band requires an implementation of an LDPC encoder/decoder with throughputs of 1.5, 3, and 6Gb/s, with code rates of 1/2, 5/8, 3/4 and 13/16 [1]. Previous implementations of decoders for these throughputs and levels of reconfiguration have power consumptions on the order of the rest of the baseband processing [2,3]. This paper presents a fully compatible IEEE 802.11ad LDPC decoder in 28nm ultra-thin body and BOX fully-depleted SOI (UTBB FDSOI) technology with a power consumption that is a small fraction of the total baseband power. To achieve this, the decoder introduces an approximate marginalization technique and a simplified reconfiguration method. Forward body biasing of FDSOI technology allows for minimum energy consumption across all decoding modes.",,9-13 Feb. ,10.1109/ISSCC.2014.6757515,https://ieeexplore.ieee.org/document/6757515
ieee:6757454,conference,19.1 A 128Gb MLC NAND-Flash device using 16nm planar cell,❌,16nm MLC NAND Flash 디바이스 — 셀 기술/스케일링이며 LDPC ECC 디코더/코드 설계 기여 없음,"Mark Helm, Jae-Kwan Park, Ali Ghalam, Jason Guo, Chang wan Ha, Cairong Hu, Heonwook Kim, Kalyan Kavalipurapu, Eric Lee, Ali Mohammadzadeh, Dan Nguyen, Vipul Patel, Ted Pekny, Bill Saiki, Daesik Song, Jeff Tsai, Vimon Viajedor, Luyen Vu, Tinwai Wong, Jung Hee Yun, Ramin Ghodsi, Andrea D'Alessandro, Domenico Di Cicco, Violante Moschiano","The aggressive scaling of NAND Flash memory technology — one that is even outpacing Moore's Law — has enabled very rapid cost-per-bit reduction, resulting in an explosion of systems utilizing this versatile memory technology. From removable media and personal music players to smart phones, tablets, and now personal computers and data center applications employing client and enterprise solid state drives (SSDs), NAND technology is making solid-state memory-based storage affordable.",,9-13 Feb. ,10.1109/ISSCC.2014.6757454,https://ieeexplore.ieee.org/document/6757454
