ID,Type,Title,Status,Reason,Authors,Abstract,Categories,Published,DOI,PDF URL
ieee:9972043,conference,Efficient ECC Architecture for Data Storage Memory Applications,⬜ 미선별,,"Nithesh gupta Chebrolu, Sumanth Sakkara, P. Cyril Prasanna Raj, U. Purushotham","In this wireless environment when a message is transmitted the information gets corrupted due to inter symbol interference and noise. The information also gets corrupted due to scaling of memory devices, hence the efficiency of the transmission decreases due to the corruption of the data. The error correction techniques process the received data which are temporarily stored in memory. Memories like SRAM and DRAM memory cells will store the data temporarily before processed by Error Correction Codes (ECCs). In this paper an efficient architecture for 2-D BCH ECC of size 15 x 15, with an error correction capability of 2 x 2, in the frequency domain are developed. The 2-D BCH encoder is designed and implemented using the conjugate class properties of finite fields to a reduction of number of gates. With the help of Inverse Discrete Finite Field Fourier Transform (IDFFFT) and Discrete Finite Field Fourier Transform (DFFFT) the data is converted from frequency domain to time domain and wise versa. The modified 2-D BCH decoder is designed with the help of Modified BM algorithm to reduce the resource utilization. The results of the encoder and decoder are illustrated in this paper. The proposed Modified Berlekamp's Massey (MBM) algorithm utilizes 77.3% lesser LUT's and 65.82% of dynamic power consumption lesser compared to Berlekamp's Massey (BM) algorithm. The proposed architecture is suitable for power and area efficient memory applications.",,24-25 Aug.,10.1109/ICOIACT55506.2022.9972043,https://ieeexplore.ieee.org/document/9972043
ieee:9904783,conference,Exploiting Binary Equilibrium for Efficient LDPC Decoding in 3D NAND Flash,⬜ 미선별,,"Hsiang-Sen Hsu, Li-Pin Chang","3D NAND flash is prone to bit errors due to severe charge leakage. Modern SSDs adopt LDPC for bit error management, but LDPC can incur a high read latency through iterative adjustment to the reference voltage. Bit scrambling helps reduce inter-cell interference, and with it, ones and zeros equally contribute to raw data. We observed that as bit errors develop, the 0-bit ratio in raw data deviates from 50%. Inspired by this property, we propose a method for fast adjustment to the reference voltage, involving a placement step and a fine-tuning step. Our method uses only a few hundreds of bytes of RAM but improves the average read latency upon existing methods by up to 24%.",,23-25 Aug.,10.1109/RTCSA55878.2022.00018,https://ieeexplore.ieee.org/document/9904783
ieee:10006524,conference,Intelligent and Reliable Coded Bit Stream Recovery over Correlated Fast Fading Channels,⬜ 미선별,,"Xiaoling Yang, Lin Zhang, Yuan Jiang","In this paper, we propose an intelligent coded-bits stream recovery scheme for improving reliability performance. In this design, a residual learning aided convolutional neural network (ResCNN) architecture with BCEwithLogits loss function is proposed to achieve the intelligent distortion compensation for the received data. In addition, at the online deployment stage, the ResCNN will calculate and output the float estimates of coded-bit streams, which act as the soft information to be regarded as the initial log likelihood ratio (LLR) for the subsequent decoding algorithm. Thus no channel state information (CSI) is required, then pilots used for the channel condition estimation can be removed to improve both the efficiency and the practicality. Subsequently, we analyze the computational complex and provide simulation results, which demonstrate that the proposed system can effectively improve the reliability performance of the receivers with no need of the CSI estimates to achieve higher practicality.",,23-24 Aug.,10.1109/ICICN56848.2022.10006524,https://ieeexplore.ieee.org/document/10006524
ieee:9909148,conference,Configurable Universal QC-LDPC Encoder Architecture Design,⬜ 미선별,,"Mingbo Hao, Guangzu Liu, Jun Zou, Tian Ban","Quasi-cyclic low-density parity-check (QC-LDPC) codes are widely used owning to its good performance and easy hardware implementation. However, most classical LDPC encoder designs do not support changing the LDPC code types or parameters according to different communication services and channel conditions. In this paper, we propose an encoder architecture with configurable code types, input information block lengths, coding rates and degrees of parallelism, which can realize “hot-switching” of configuration parameters. A new scheme that makes full use of the characteristics of the generation matrix is used in the core of parallel coding. The implementation on field programmable gate array (FPGA) shows that the throughput of the encoder can reach 1.6 Gbps under the condition of 7/8 coding rate (8176, 7154) and the degree of parallelism set to 8.",,21-23 Aug.,10.1109/ICEICT55736.2022.9909148,https://ieeexplore.ieee.org/document/9909148
ieee:9909157,conference,Spatially Coupled Generalized LDPC Codes Over Burst Erasure Channels,⬜ 미선별,,"Xing He, Yang Liu, Bin Wang, Yuzhi Zhang","In this paper, we present two types of spatially coupled generalized low density parity check (SC-GLDPC) codes to combat burst erasures. Compared with the spatially coupled low density parity check (SC-LDPC) codes, SC-GLDPC codes introduce the super check nodes instead of the standard single parity check constraints, which is beneficial to the burst erasure corrections. To evaluate the capability against burst erasures, density evolution algorithm for SC-GLDPC codes is proposed, which can be used to compute the maximum length of the consecutive burst erasures when transmitted over the burst erasure channels. Density evolution analysis results show that the burst erasure correction performances of these two types of SC-GLDPC codes are better than SC-LDPC codes while Type-2 SC-GLDPC codes perform better than Type-1 SC-GLDPC codes. To demonstrate the excellent asymptotic performances, we also simulate the finite-length performances of these two types of SC-GLPDC codes over burst erasure channels along with SC-LDPC codes for comparison. Simulation results show that the finite-length performances are consistent with the asymptotic performances obtained by density evolution.",,21-23 Aug.,10.1109/ICEICT55736.2022.9909157,https://ieeexplore.ieee.org/document/9909157
ieee:9919106,conference,Research of Error Control Coding and Decoding,⬜ 미선별,,"Liwei Huang, Yulin Chen, Hui Huang","Error control technology improves the reliability and validity of communication transmission. Linear block code, cyclic code, convolutional code, LDPC code and CRC are commonly used. In this paper, the principles of these codes are analysed, simulations of encoding and decoding are experimented. According to the simulation results, it is concluded that error control coding is helpful to reduce the error rate of the communication system.",,20-21 Aug.,10.1109/AEECA55500.2022.9919106,https://ieeexplore.ieee.org/document/9919106
ieee:9990252,conference,Optimized LDPC Code Concatenated with Trellis Shaping for PAPR Reduction in SISO-OFDM Systems,⬜ 미선별,,"Amna Arif, Abdul Wakeel, Alina Mirza, Mir Yasir Umair","Different techniques have been used for the peak-to-average power ratio (PAPR) reduction of orthogonal frequency division multiplexing (OFDM) systems. Among these, trellis shaping provides state of the art performance in terms of PAPR reduction as well as mean power reduction with moderate computational complexity. Therefore, this manuscript addresses the effect of using shaping codes with higher trellis depths for PAPR reduction of the OFDM systems. Using shaping codes of higher depths improve the PAPR reduction as well as bit error rate (BER) of the system. Moreover, we concatenate an optimized low-density parity-check (LDPC) code with Trellis shaping to further improve the performance of the OFDM system in terms of BER. For the LDPC code, the variable node degree distribution is optimized based on the error probabilities of the individual bits inside a quadrature amplitude modulation (QAM) constellation taking into consideration the error probabilities of the shaping codes used. Simulation results show that the proposed technique has better PAPR reduction as well as better BER as compared to the already existing systems using Trellis shaping with a shaping code of 4 states concatenated with an optimized LDPC code.",,16-20 Aug.,10.1109/IBCAST54850.2022.9990252,https://ieeexplore.ieee.org/document/9990252
ieee:9900999,conference,LDPC Channel Coding in Coplanar MIMO Ultraviolet Communication System,⬜ 미선별,,"Junyang Ji, Ping Su, Jianshe Ma, Bizhong Xia, Xingle Xue","The low-density parity-check code (LDPC) is used in this paper to implement a coplanar multiple-input multiple - output (MIMO) Ultraviolet (UV) communication system. This paper compares the performance of different receiver combining methods in the coplanar MIMO UV communication system and simulates the performance of the improved LDPC minimum sum decoding algorithms in the UV communication system. The results show that the offset minimum sum (OMS) and the normalized minimum sum (NMS) decoding algorithms outperform the minimum sum (MS) decoding algorithm in terms of bit error ratio (BER), and the receivers with the maximum ratio combination performs the best.",,12-15 Aug.,10.1109/ICOCN55511.2022.9900999,https://ieeexplore.ieee.org/document/9900999
ieee:9901270,conference,A PAPR Reduction scheme Based on Nonlinear Companding Transform and LDPC-coded for a Coherent Optical GFDM system,⬜ 미선별,,"Xiangyu Liu, Qi Zhang, Xiangjun Xin, Ran Gao, Yongjun Wang, Feng Tian, Qinghua Tian, Leijing Yang","A P APR reduction method based on nonlinear-companding-transform (NCT) and LDPC-coded is proposed to reduce high P APR of GFDM systems. This scheme utilizes the performance complementarity of NCT and LDPC-coded to effectively achieve superposition of advantages. An 80-Gbaud PDM-CO-GFDM system employing the proposed scheme is set up. When CCDF is 1e-2 and $\mu$ is 2, P APR is reduced by 5.16 dB compared with original GFDM scheme (GFDM-LDPC scheme). When BER is 1e-2, OSNR is reduced by 3.1 dB compared with original GFDM scheme, 3.9 dB compared with GFDM-NCT scheme, -0.5 dB compared with GFDM-LDPC scheme. Simulation results show that the proposed scheme has better performances in reducing the P APR and BER for GFDM.",,12-15 Aug.,10.1109/ICOCN55511.2022.9901270,https://ieeexplore.ieee.org/document/9901270
ieee:9901155,conference,Performance Analysis of LDPC Coding under Multiple Scattering in Ultraviolet Communication,⬜ 미선별,,"Axin Du, Jianguo Liu, Yuehui Wang, Jiwang Peng, Huishi Zhu, Yingkai Zhao, Ning Sun","Low-density parity-check (LDPC) codes are applied to multiple scattering communication channels based on Monte Carlo (MC) method. A simulated Ultraviolet (UV) communication system based on binary phase shift keying (BPSK) modulation is built. The effects of different decoding algorithms, number of iterations, and different receiver field-of-view (FOV) angles on the performance of the UV communication system are analyzed, respectively.",,12-15 Aug.,10.1109/ICOCN55511.2022.9901155,https://ieeexplore.ieee.org/document/9901155
ieee:9901006,conference,Probabilistically Shaped High-order QAM Coherent Optical Communication,⬜ 미선별,,"Fengchu Cao, Mingyi Gao, Weidong Shao, Xiaodi You, Gangxiang Shen","Probabilistically shaped (PS) high-order QAM coherent optical communication is attractive for large-capacity fiber transmission due to its high spectrum efficiency and sensitivity. In this work, we present its principle and key features in detail.",,12-15 Aug.,10.1109/ICOCN55511.2022.9901006,https://ieeexplore.ieee.org/document/9901006
ieee:9880620,conference,Partial Product-LDPC Codes Without Rate Loss,⬜ 미선별,,"Qianfan Wang, Suihua Cai, Fanhui Meng, Li Chen, Xiao Ma","In this paper, we present a new construction of product codes, where all rows of the information array are encoded using the low-density parity-check (LDPC) codes while only partial columns of the information array are encoded using the algebraic codes. Also distinguished from the conventional product codes, the actual code rates of the presented partial product codes are the same as those of the row component LDPC codes, without any rate loss. This is achieved by using the free-ride coding to transmit the additional column checks along with the LDPC codewords. For decoding, an iterative decoding algorithm, which is scheduled as free-ride decoding, row decoding and column decoding, is proposed. At the column decoding stage, the messages associated with those successfully decoded columns are hardened and exploited to improve the free-ride decoding and the row decoding. By assuming a binary symmetric channel model after row decoding, we present an approximated bound on the word error rate (WER) of the doubly-protected (by both the row code and the column code) information bits. To predict the performance of the proposed codes, a genie aided (GA) lower bound derived from the original LDPC coded system with partial known bits is presented. These bounds and the simulation results reveal that the presented product-LDPC codes can have a significant performance improvement over the row component LDPC codes (about one dB at the WER of 10–5). They also reveal that the presented product-LDPC codes can have a flexible trade off between the error-floor and the waterfall performances, by using different row codes and column codes.",,11-13 Aug.,10.1109/ICCC55456.2022.9880620,https://ieeexplore.ieee.org/document/9880620
ieee:9896662,conference,Design of 4-cycles Free Short-length LDPC Codes Based on the Kirkman Triple Systems,⬜ 미선별,,"Dongliang Guo, Yuejiao Feng, Congduan Li","Short-length codes may play a crucial role in delay-sensitive scenarios. Low-density parity-check (LDPC) codes, as a class of Shannon limit approaching codes, perform well with long code length. However, the design of short-length LDPC codes with good performance is still challenging. This paper investigates the construction of short-length LDPC codes based on the combinatorial design theory. Specifically, Kirkman triple systems (KTS), as a type of balanced incomplete block design (BIBD) techniques, are used to construct the parity-check matrices of LDPC codes, which are guaranteed to be 4-cycles free. Some other properties of such designed LDPC codes are also investigated. For instance, a lower bound on the girth, the code rate and minimum code distance. The simulation results show that the designed short-length LDPC codes based on KTS outperform that of randomly constructed ones.",,11-13 Aug.,10.1109/ICCCWorkshops55477.2022.9896662,https://ieeexplore.ieee.org/document/9896662
ieee:9880658,conference,Parallel Decoding of PIC-LDPC Codes Aided by Free-Ride Coding,⬜ 미선별,,"Fanhui Meng, Qianfan Wang, Suihua Cai, Xiao Ma","In this paper, we apply free-ride coding, a recently proposed technique, to the partial information coupling (PIC) low-density parity-check (LDPC) codes. Such an integration admits parallel decoding of PIC-LDPC codes, suggesting that high-speed decoders can be implemented. At the transmitter, the coupled information bits are periodically sampled and transmitted by the free-ride coding. At the receiver, these free-ride coded bits are first decoded and then used to decouple the whole PICLDPC coded chain into multiple shorter chains, each of which can be decoded separately and in parallel. This benefits from the fact that free-ride coded bits typically have higher reliability than others, as confirmed by the numerical results. Numerical results also show that the word error rate (WER) performance of the proposed codes is close to the genie-aided (GA) lower bound in the high SNR region.",,11-13 Aug.,10.1109/ICCC55456.2022.9880658,https://ieeexplore.ieee.org/document/9880658
ieee:9880684,conference,An Improved 5G NR LDPC Decoding Algorithm Based On Box-Plus Operation,⬜ 미선별,,"Liming Lu, Yi Li, Li Fang","Iterative box-plus operation is an equivalent function of BP algorithm used in fifth generation(5G) new radio Low-Density Parity-Check (LDPC) decoders, which has gathered significant interest in the past few years. However, it is very challenging to approximate iterative Box-Plus operation effectively since it contains continuous logarithmic and exponential operation. In this paper, the problem is solved gracefully by proposing a simple yet efficient approximate function. The corresponding optimal parameters are given by density evolution and Monte Carlo simulation, which could greatly reduce the unreliability of check-to-variable messages. The extensive experiments in error-correction performance have show the feasibility of the proposed method, compared to existing NMS and OMS algorithms, which makes it more attractive in practical 5G LDPC decoding applications.",,11-13 Aug.,10.1109/ICCC55456.2022.9880684,https://ieeexplore.ieee.org/document/9880684
ieee:9880641,conference,A Transmission Scheme based on QC-LDPC Codes with Matrix Q over AWGN Channel,⬜ 미선별,,"Jiayun Bao, Cuican Shen, Zhiping Shi, Li Deng","In this paper, a transmission scheme based on Quasi-Cyclic Low-Density Parity-Check (QC-LDPC) codes with an invertible quasi-cyclic Matrix Q is proposed over Additive White Gaussian Noise (AWGN) channel in order to obtain faster convergence of hard-decision decoding. Combined with the soft information from channel, another improved Reliability-based Q (RQ) decoding algorithm is proposed. The new design can also be applied to QC-LDPC codes in IEEE 802.16e Standards. The simulation results show that the proposed scheme with Q or RQ decoding algorithm has better error correction performance and lower average number of iterations than Bit-Flipping (BF) or weighted Bit-Flipping (WBF) decoding algorith",,11-13 Aug.,10.1109/ICCC55456.2022.9880641,https://ieeexplore.ieee.org/document/9880641
ieee:9896703,conference,Design of Non-punctured Protograph LDPC Codes for JSCC Systems over Partial Response Channels,⬜ 미선별,,"Ying Sun, Shiwei Zhu, Sanya Liu, Chen Chen","Traditional protograph low-density parity-check (PLDPC) codes with punctured nodes perform poorly over partial response (PR) channels. Therefore, several good PLDPC codes without punctured nodes have been designed so far over PR channels. However, these codes are based on the separate coding structure and neglect the residual redundancy left by source coding. So in this paper, based on the joint source-channel coding (JSCC) system, three new types of rate-1/2 non-punctured PLDPC codes are designed for PR channels. Higher rate channel codes are further designed by code lengthening from one of the proposed codes. The joint protograph extrinsic information transfer (JPEXIT) algorithm is also used to calculate the decoding threshold of the system. Both the JPEXIT analysis and the bit-error-rate (BER) simulation results show that in the JSCC system over PR channels, three new codes all possess performance improvement in the water-fall region compared to existing non-punctured PLDPC codes, especially one of them can also obtain a very low error floor. Also for the higher rate channel codes, no error floors are observed down to BER=10−6.",,11-13 Aug.,10.1109/ICCCWorkshops55477.2022.9896703,https://ieeexplore.ieee.org/document/9896703
ieee:9896664,conference,A Spatially Coupled PAC Coding Scheme and Its List Decoding,⬜ 미선별,,"Siyu Ying, Shan Jin, Zhaoyang Zhang","In order to promote the reliability and efficiency of transport block (TB)-based transmission, we propose a new class of spatially coupled Polarization-Adjusted Convolutional (PAC) coding scheme in this paper. In the proposed scheme, several consecutive code blocks (CBs) in each TB are coupled by the register states at the end of the encoding of each CB, and a depth-first successive-cancellation list (SCL)-based decoder is used for decoding. The proposed spatially coupled PAC codes introduce little coding complexity at the encoding side, and the coupling procedure is able to significantly mitigate the TB error rate (TBER), which are validated by extensive simulation results.",,11-13 Aug.,10.1109/ICCCWorkshops55477.2022.9896664,https://ieeexplore.ieee.org/document/9896664
ieee:9896677,conference,Deep Learning Based Constellation Rearrangement Design in Hybrid ARQ System,⬜ 미선별,,"Bo Cao, Ming Jiang, Chunming Zhao, Longhao Zou",This paper proposes a constellation rearrangement autoencoder (CoRe-AE) for hybrid automatic repeat request (HARQ) system through a learning-based neural network. Two identical autoencoder networks are used in the CoRe-AE scheme respectively corresponding to the first data transmission and the retransmission. It can both optimize the bit mapping and the geometric shaping of the constellation points during the two transmissions. It is shown that the bit error rate (BER) performances of our constellations learned by CoRe-AE are noticeably better than those of the regular square quadrature amplitude modulation (QAM) and some well-known geometric shaped constellations with conventional constellation rearrangement (CoRe) scheme in HARQ systems.,,11-13 Aug.,10.1109/ICCCWorkshops55477.2022.9896677,https://ieeexplore.ieee.org/document/9896677
ieee:9896692,conference,Bit-wise Detection for OTFS Modulation via Message Passing Algorithm,⬜ 미선별,,"Bowen Wang, Nanxi Li, Shan Yang, Zheng Jiang, Jianchi Zhu, Xiaoming She, Jianxiu Wang, Peng Chen","The orthogonal time frequency space (OTFS) modulation as a promising signal representation attracts growing attention for integrated sensing and communication. This paper devotes to signal detection for OTFS system. Notice the characteristics of high dimension and sparsity of OTFS channel, we propose a bit-wise message passing (MP) algorithm to support Soft-Input Soft-Output detection. We leverage the channel sparsity to simplify the factor graph, and approximate the discrete messages with continuous Gaussian distribution to facilitate message updating. Simulations in various cases validate the outperformance of the proposed algorithm contrast to existed symbol-wise MP and linear detectors.",,11-13 Aug.,10.1109/ICCCWorkshops55477.2022.9896692,https://ieeexplore.ieee.org/document/9896692
ieee:9880747,conference,A Low Complexity Iterative Receiving Method Based on Message Passing in π/4-DQPSK Modulated Frequency-Hopping Communications,⬜ 미선별,,"Liuqing Yang, Yuehong Gao, Zhiyuan Lin, Zuyao Ni, Shuying Zhang","A low complexity iterative receiving scheme is proposed for $\pi$ /4-DQPSK modulated frequency-hopping communication systems relying on message passing algorithm (MPA), where the receiving process is converted to the joint phase estimation and decoding process. Due to short duration of each hop pulse, coherent demodulation which costs much pilot overhead will reduce the system transmission efficiency. Besides, differential demodulation will lose bit error performance. In order to approximate the theoretically optimal performance with low pilot overhead and low complexity, this paper proposes a low complexity joint phase estimation and decoding iterative algorithm. We simplify the process of message passing and approximate the calculation of some probability messages, which omit lots of computation. Simulation results demonstrate that the proposed algorithm can reduce computational complexity by more than 60% compared with conventional MPA, and can also improve bit error performance by more than 1dB with only 4 pilot symbols per hop compared with differential demodulation.",,11-13 Aug.,10.1109/ICCC55456.2022.9880747,https://ieeexplore.ieee.org/document/9880747
ieee:9880838,conference,Min-Max Hamming Distance Considerations for Activation Pattern Design in Index Modulation,⬜ 미선별,,"Yinglin Chen, Tongyang Xu, Izzat Darwazeh","Index modulation (IM) has been widely studied showing promising performance over traditional communication systems. Index pattern plays an important role since its activation methodology determines bit error rate (BER), spectral efficiency (SE) and energy efficiency (EE). This work proposes efficient index activation patterns according to a min-max Hamming distance metric for both orthogonal frequency division multiplexing (OFDM) and non-orthogonal spectrally efficient FDM (SEFDM). Simulations of low-density parity-check (LDPC) coded IM systems in both additive white Gaussian noise (AWGN) and frequency selective channels are provided. Results reveal that the proposed index activation patterns in IM systems lead to improved BER and SE compared to that in traditional OFDM systems. Moreover, peak-to-average power ratio (PAPR) distribution results are presented to demonstrate the EE advantage of the proposed IM systems over OFDM systems.",,11-13 Aug.,10.1109/ICCC55456.2022.9880838,https://ieeexplore.ieee.org/document/9880838
