ID,Type,Title,Status,Reason,Authors,Abstract,Categories,Published,DOI,PDF URL
ieee:9840520,journal,Experimental real-time GbE MIMO FSO under fog conditions with software defined GNU Radio platform-based adaptive switching,⬜ 미선별,,"Zun Htay, Carlos Guerra-Yanez, Zabih Ghassemlooy, Stanislav Zvanovec, Mojtaba Mansour Abadi, Andrew Burton","In this paper, we demonstrate the first, to our knowledge, experimental implementation of a gigabit Ethernet multiple input single output free space optical (FSO) communications link using adaptive switching implemented in the software defined open-source software, GNU Radio, and analyze its performance. A fully functional FSO link with a feedback path is implemented using cost effective off-the-shelf components, i.e., media converters and small form-factor pluggable modules. We propose a switching mechanism at the transmitter to improve the link performance under different fog conditions and provide results for the proposed FSO system compared with a single FSO link. The real-time channel estimation is demonstrated and, based on the channel state information, adaptive switching is carried out in GNU Radio. We show that the proposed system under the heavy fog condition offers almost the same packet error rate under the clear channel but with a reduced data rate by about 100 Mbps (i.e., 600 Mbps).",,August 202,10.1364/JOCN.458562,https://ieeexplore.ieee.org/document/9840520
ieee:9658546,journal,Design of LUT-Based LDPC Decoders for Spin-Transfer Torque Magnetic Random Access Memory,⬜ 미선별,,"Chatuporn Duangthong, Watid Phakphisut, Pornchai Supnithi","Recently, low-density parity-check (LDPC) codes have been proposed to improve the reliability of spin-transfer torque magnetic random access memory (STT-MRAM). While several research works focus on the design of LDPC codes to combat the process variation and thermal fluctuation of the STT-MRAM, we aim to tackle the high decoding latency issues by the novel design of a lookup table (LUT)-based LDPC decoder for the forward and backward (FB) processes. In this work, the channel quantizer and LUT operations of the LDPC decoder are jointly designed by minimizing the error probability estimated from the density evolution (DE) algorithm. The simulation results show that the proposed design method for a code rate of 0.9 outperforms the previous methods in terms of bit error rate (BER) performance. Furthermore, the proposed design can support the channel model of the STT-MRAM without an independent and identically distributed (i.i.d.) channel adapter.",,Aug. 2022,10.1109/TMAG.2021.3137556,https://ieeexplore.ieee.org/document/9658546
ieee:9780420,journal,Construction of QC-LDPC Codes from Sidon Sequence Using Permutation and Segmentation,⬜ 미선별,,"Lintao Zhang, Juhua Wang","By utilizing a Sidon sequence, two new methods are proposed to construct quasi-cyclic (QC) low-density parity-check (LDPC) codes. The first method yields a QC-LDPC code without 4-cycles and the second method gives a QC-LDPC code without 4-cycles and 6-cycles. In the literature there are two methods which employ mathematical objects somewhat resembling a Sidon sequence to remove 4-cycles, and there are two explicit constructions which guarantee the absence of 4-cycles and 6-cycles. Compared with the former, our first method is much more flexible in selecting parameters while providing identical or better performance. Compared with the latter, our second method provides much better performance.",,Aug. 2022,10.1109/LCOMM.2022.3177511,https://ieeexplore.ieee.org/document/9780420
ieee:9800962,journal,Adaptive Belief Propagation Decoding of CRC Concatenated NR LDPC and Polar Codes,⬜ 미선별,,"Mingyang Zhu, Ming Jiang, Chunming Zhao","In this paper, we propose a modified adaptive belief propagation (ABP) algorithm, which is referred to as the random ABP (R-ABP) algorithm, for decoding short channel codes adopted in the fifth generation (5G) New Radio (NR) wireless systems. Based on the cyclic redundancy check (CRC) concatenation structure of 5G channel codes, we can take partial or even all CRC bits into iterative R-ABP decoding to improve the error correction performance, while the error detection capability can still be guaranteed by the remaining CRC bits and a proposed threshold-based acceptance criterion. We call this improved R-ABP decoding the threshold-and-CRC-aided R-ABP (TCA-R-ABP) decoding. The simulation results show that our proposed TCA-R-ABP algorithm outperforms the state-of-the-art decoding algorithms for many 5G low-density parity-check (LDPC) and polar codes. Moreover, the proposed TCA-R-ABP algorithm leads to a unified decoder for LDPC and polar codes, which has the potential to be a lower-complexity decoder over the combination of the belief propagation (BP) and CRC-aided successive cancellation list (CA-SCL) decoders.",,Aug. 2022,10.1109/TCOMM.2022.3184359,https://ieeexplore.ieee.org/document/9800962
ieee:9772648,journal,Automorphism Ensemble Decoding of Quasi-Cyclic LDPC Codes by Breaking Graph Symmetries,⬜ 미선별,,"Marvin Geiselhart, Moustafa Ebada, Ahmed Elkelesh, Jannis Clausius, Stephan ten Brink","We consider automorphism ensemble decoding (AED) of quasi-cyclic (QC) low-density parity-check (LDPC) codes. Belief propagation (BP) decoding on the conventional factor graph is equivariant to the quasi-cyclic automorphisms and therefore prevents gains by AED. However, by applying small modifications to the parity-check matrix at the receiver side, we can break the symmetry without changing the code at the transmitter. This way, we can leverage a gain in error-correcting performance using an ensemble of identical BP decoders, without increasing the worst-case decoding latency. The proposed method is demonstrated using LDPC codes from the CCSDS, 802.11n and 5G standards and produces gains of 0.2 to 0.3 dB over conventional BP decoding. Compared to the similarly performing saturated BP (SBP), the proposed algorithm reduces the average decoding latency by more than eight times.",,Aug. 2022,10.1109/LCOMM.2022.3174164,https://ieeexplore.ieee.org/document/9772648
ieee:9756519,journal,Multiple-Layer Integrated Interleaved Codes: A Class of Hierarchical Locally Recoverable Codes,⬜ 미선별,,Mario Blaum,"The traditional definition of Integrated Interleaved (II) codes generally assumes that the component nested codes are either Reed-Solomon (RS) or shortened Reed-Solomon codes. By taking general classes of codes, we present a recursive construction of Extended Integrated Interleaved (EII) codes into multiple layers, a problem that brought attention in literature for II codes. The multiple layer approach allows for a hierarchical scheme where each layer of the code provides for a different locality. In particular, we present the erasure-correcting capability of the new codes and we show that they are ideally suited as Locally Recoverable codes (LRC) due to their hierarchical locality and the small finite field required by the construction. Properties of the multiple layer EII codes, like their minimum distance and dimension, as well as their erasure decoding algorithms, parity-check matrices and performance analysis, are provided and illustrated with examples. Finally, we will observe that the parity-check matrices of high layer EII codes have low density.",,Aug. 2022,10.1109/TIT.2022.3166210,https://ieeexplore.ieee.org/document/9756519
ieee:9791398,journal,Nonlinear Transform Source-Channel Coding for Semantic Communications,⬜ 미선별,,"Jincheng Dai, Sixian Wang, Kailin Tan, Zhongwei Si, Xiaoqi Qin, Kai Niu, Ping Zhang","In this paper, we propose a class of high-efficiency deep joint source-channel coding methods that can closely adapt to the source distribution under the nonlinear transform, it can be collected under the name nonlinear transform source-channel coding (NTSCC). In the considered model, the transmitter first learns a nonlinear analysis transform to map the source data into latent space, then transmits the latent representation to the receiver via deep joint source-channel coding. Our model incorporates the nonlinear transform as a strong prior to effectively extract the source semantic features and provide side information for source-channel coding. Unlike existing conventional deep joint source-channel coding methods, the proposed NTSCC essentially learns both the source latent representation and an entropy model as the prior on the latent representation. Accordingly, novel adaptive rate transmission and hyperprior-aided codec refinement mechanisms are developed to upgrade deep joint source-channel coding. The whole system design is formulated as an optimization problem whose goal is to minimize the end-to-end transmission rate-distortion performance under established perceptual quality metrics. Across test image sources with various resolutions, we find that the proposed NTSCC transmission method generally outperforms both the analog transmission using the standard deep joint source-channel coding and the classical separation-based digital transmission. Notably, the proposed NTSCC method can potentially support future semantic communications due to its content-aware ability and perceptual optimization goal.",,Aug. 2022,10.1109/JSAC.2022.3180802,https://ieeexplore.ieee.org/document/9791398
ieee:9779155,journal,Simplified Ordered Statistic Decoding for Short-Length Linear Block Codes,⬜ 미선별,,"Changhyeon Kim, Dongyun Kam, Seokki Kim, Giyoon Park, Youngjoo Lee","The ordered statistic decoding (OSD) algorithm for short-length linear block codes provides an attractive ML-approaching performance, expected to be used for the ultra-reliable low latency communication (URLLC) at the next-generation wireless solutions. To find the corrected codeword among numerous candidates, however, the decoding process requires a considerable amount of computational costs, which need to be simplified to achieve low-latency processing. In this letter, we present several schemes that relax the overall complexity of the state-of-the-art segmentation discarding algorithm. Without degrading the error-correcting power, our method approximate the internal steps for computing the segment sizes and the stopping bounds at the run time, reducing the average processing costs by  $1.6\times 10 ^{4}$  times for achieving the low-BLER performance.",,Aug. 2022,10.1109/LCOMM.2022.3176646,https://ieeexplore.ieee.org/document/9779155
ieee:9795950,journal,Advanced Digital Signal Processing and Variable-Rate Coding for Unrepeatered Optical Transmission,⬜ 미선별,,"José Hélio C. Júnior, Tiago Sutili, Rafael C. Figueiredo, Darli A. A. Mello","In this paper, we evaluate the selective combination of algorithms for fiber nonlinearity compensation, transceiver impairments mitigation and variable-rate coding in unrepeatered optical transmission. A post-emphasis filter and a two-stage 4×4 multiple-input and multiple-output equalizer compensate the impact of bandwidth limitations and in-phase and quadrature skew. Nonlinear compensation is accomplished by a fast-converging adaptive digital back-propagation algorithm and maximum likelihood sequence estimation. Forward error correction is provided by a variable-rate spatially-coupled low-density parity-check code. The performance and complexity of the proposed digital subsystems are experimentally evaluated by the unrepeatered wavelength division multiplexing transmission of 17×200-Gb/s (DP-16QAM 32-GBd) channels over 350-km of large effective area and low-loss single-mode fibers. The experimental results for different combinations of algorithms elucidate the trade-off of complexity and performance in unrepeatered optical transmission.",,Aug. 2022,10.1109/JPHOT.2022.3182903,https://ieeexplore.ieee.org/document/9795950
ieee:9599361,journal,Performance and Capacity Analysis of MDCSK-BICM for Impulsive Noise in PLC,⬜ 미선별,,"Meiyuan Miao, Lin Wang, Guanrong Chen","To further mitigate the BER error floor of $M$-ary differential chaos shift keying (MDCSK) modulation for impulsive noise, a low-cost high-reliability coded modulation scheme without equalizations is desirable for impulsive noise. In this paper, a protograph-based low-density parity-check coded MDCSK-based bit-interleaved coded modulation (MDCSK-BICM) scheme is proposed for the scenario with impulsive noise obeying Bernoulli-Laplace distribution. Considering the Gaussian distribution of protograph extrinsic information transfer (PEXIT) and the benchmark of coding design, the U-shaped non-coherent capacity is derived with optimal code rate for square MDCSK, showing that the code rates are stable with $E_b/N_0$ increasing but still much lower than that of DS-16DQAM at code rate $>\!0.145$. The derived joint probability density function can be considered as approximately a Gaussian distribution, which is used to improve the impulsive noise fitted PEXIT. Finally, a new code under a novel principle is designed for better bit error rate performance based on the improved PEXIT analysis. Both PEXIT analysis and simulation results demonstrate that the proposed scheme achieves a better BER than that with a traditional scheme, and suggesting a research approach based on simple methods. This basic research work provides a guide to establish a framework and optimize the performance of transmission systems over practical power line communication.",,Aug. 2022,10.1109/TPWRD.2021.3124561,https://ieeexplore.ieee.org/document/9599361
ieee:9955194,conference,Blind Recognition of LDPC Codes by Average LLR in Multi-Channels Based on CNN,⬜ 미선별,,"Yongjie Zhao, Longqing Li, Junhao Ba, Changxin Zhang, Zongmin Liu, Han Long, Zhiping Huang","Coding and decoding play an essential role in communication systems and are the primary conditions to ensure the standard transmission of signals, which can increase stability and reliability after coding. Low Density Parity Check Code (LDPC) coding is a common form of coding, and its parallel iterative decoding algorithm based on a sparse matrix is less complex and more flexible than the Turbo algorithm. However, with the increasing number of protocols and channels, the traditional methods of LDPC codes recognition are not adaptable enough, a more flexible and applicable method is essential. In this paper, we propose a deep learning-based LDPC coding recognition method, which is more adaptable, has higher estimation accuracy than traditional algorithms and has a more straightforward data processing structure compared to 2-dimensional convolutional neural networks and fully connected networks. After training the data of the Additive White Gaussian Noise (AWGN) channel, Rayleigh channel and Rician channel, the network's performance is better in the test, and the estimation accuracy is better than the traditional algorithm.",,5-7 Aug. 2,10.1109/MLCCIM55934.2022.00075,https://ieeexplore.ieee.org/document/9955194
ieee:9914424,conference,A LDPC Decoding Algorithm based on Convolutional Neural Network,⬜ 미선별,,"Jiamei Gao, Bo Zhang, Bin Wang, Yang Liu","At present, low density parity check code (LDPC) has been widely used in channel coding and decoding because of its excellent performance, but with the increase of code length, the complexity of decoding algorithm has became higher and higher. In view of the limitations of decoding algorithm and the rapid development of artificial intelligence technology, it has great research prospects to solve the above problems through deep neural network. Therefore, this paper mainly focuses on the design and improvement of LDPC decoding process, and proposes an LDPC decoding model based on DenseNet neural network structure, which improves the LPDC decoding performance by optimizing DenseNet neural network structure. This method can recover information at the decoding end, avoiding the limitations of traditional short decoding loop and high complexity of decoding algorithm. The simulation results show that the LDPC decoding algorithm based on DenseNet neural network structure improves the decoding performance.",,4-5 Aug. 2,10.1109/DSA56465.2022.00165,https://ieeexplore.ieee.org/document/9914424
ieee:9918619,conference,Performance Evaluation of Burst Error Correction by LDPC Coding and Iterative Decoding System in Magnetic Tape Drive Using a BaFe Magnetic Tape,⬜ 미선별,,"Yasuaki Nakamura, Taisei Akamatsu, Madoka Nishikawa, Yoshishiro Okamoto","The tolerance for burst error of the interleaved low-density parity-check (LDPC) code is evaluated with the cross-interleaved Reed-Solomon code (CIRC) in the magnetic tape drive using a BaFe magnetic tape. We evaluate the interleaved LDPC coding and iterative decoding system with burst error detector (LDPC-BD) system by required signal-to-noise ratio (SNR) to achieve “No errors” for the burst-like deterioration such as media defects to the CIRC with erasure error correction (CIRC-EC) system by computer simulation. The results clarify that the LDPC-BD system tolerates the longer burst error than the CIRC-EC system. In addition, they also clarified that the LDPC-BD system achieves “No errors” with the 3.0-4.5 dB lower SNR than the CIRC-EC system.",,29-31 Aug.,10.1109/TMRC56419.2022.9918619,https://ieeexplore.ieee.org/document/9918619
ieee:9918551,conference,Convolutional Neural Network-based Media Noise Prediction and Equalization for TDMR Turbo-detection with Write/Read TMR,⬜ 미선별,,"Amirhossein Sayyafan, Ahmed Aboutaleb, Benjamin Belzer, Krishnamoorthy Sivakumar, Simon Greaves","This paper presents a turbo-detection system consisting of a convolutional neural network (CNN) based equalizer, a Bahl-Cocke-Jelinek-Raviv (BCJR) trellis detector, a CNN-based media noise predictor (MNP), and a low-density parity-check (LDPC) channel decoder for two-dimensional magnetic recording (TDMR). The BCJR detector, CNN MNP, and LDPC decoder iteratively exchange soft information to maximize the areal density (AD) subject to a bit error rate (BER) constraint. Simulation results employing a realistic grain switching probabilistic (GSP) media model show that the proposed system is quite robust to track-misregistration (TMR). Compared to a I-D pattern-dependent noise prediction (PDNP) baseline with soft intertrack interference (ITI) subtraction, the system achieves 0.34% AD gain with read-TMR alone and 0.69% with write- and read-TMR together.",,29-31 Aug.,10.1109/TMRC56419.2022.9918551,https://ieeexplore.ieee.org/document/9918551
ieee:10202276,conference,Performance Evaluation of Classic McEliece Post Quantum Cryptography,⬜ 미선별,,"Lingeshwaran B, Avtar Singh","Classic cryptography algorithms have become more fragile and vulnerable to modern attacks. The advancement of quantum computers and its attacks are now a big threat to the classic cryptography which uses hard mathematical calculation for security, that leads to the commence of the post quantum cryptography which are resistant to the quantum attacks. National Institute of Standardization and Technology is in process of standardizing the post quantum cryptography algorithm based on different factors like encapsulation, decapsulation time, keypair generation time, speed etc. In this paper we will discuss about the performance evaluation of post quantum cryptography algorithms especially the power consumption of Classic McEliece algorithm and its different variation which comes under code-based cryptography. The evaluated results are tabulated and categorized based on the different principles used and the factors leading to major power consumption is identified.",,29-30 Aug.,10.1109/ACM57404.2022.00022,https://ieeexplore.ieee.org/document/10202276
ieee:9909507,conference,Secure Image Communication using Systematic-LT Codes over AWGN Channel,⬜ 미선별,,"Guru Prasanth Sarvepalli, Sivaraman Rethinam, Bodempudi Naga Siva Prasad, Muralidhar Kulkarni","Luby Transform codes (LT) are rate less erasure codes potentially employed for data transmission over communication networks and data storage. Systematic LT codes (SLT) has advantage over LT code in unequal error protection of packet. SLT codes are designed using Robust soliton distribution (RSD), Sparse Degree Distribution (SDD) and Novel Degree Distribution (NDD). Further, SLT codes have been used as channel coding technique to transfer AES encrypted Image on BPSK over AWGN channel. BER in the range of 10−6 for SNR levels of 2dB have been achieved in SDD and NDD using soft decoding of 6 iterations for R−1 = 3.5. While analyzing the performance of SLT Codes, it has been observed that BER decreases drastically from 10−1 to 10−6 for SNR variation from 0.5dB to 2dB. Image quality analysis has been performed using Mean Squared Error (MSE), Peak Signal to Noise Ratio (PSNR), Number of Pixel Changing Rate (NPCR) and Unified Average Changing Intensity (UACI) for RSD, SDD & NDD between these power levels.",,26-28 Aug.,10.1109/ASIANCON55314.2022.9909507,https://ieeexplore.ieee.org/document/9909507
ieee:9906479,conference,Performance of PSA Kalman Filters for Phase Noise Compensation in High-Order QAM OFDM Systems,⬜ 미선별,,"Ryota Kuribayashi, Mamoru Sawahashi, Norifumi Kamiya","This paper presents an iterative phase noise compensation (PNC) method that utilizes pilot symbol assisted (PSA) PNC and subsequently an iterative Kalman filter in orthogonal frequency division multiplexing radio backhaul links. There are two options for the presented iterative PNC depending on the type of Kalman filter employed. One is an extended Kalman filter (EKF) and the other is an unscented Kalman filter (UKF). The latter is expected to perform better than the former since the PNC problem is nonlinear. We compare the bit error rate (BER) performance of iterative PNC employing the EKF and UKF. Computer simulation results show that no distinct difference in the BER is observed between the EKF PNC and UKF PNC associated with PSA PNC for 256QAM and 1024QAM schemes, where a low-density parity-check (LDPC) code with the coding rate of 8/9 is used for error correction. We also show that PSA-EKF and PSA-UKF PNC are effective in achieving a low BER such as 10−8 in a time-varying phase noise channel for LDPC-coded 256QAM and 1024QAM schemes.",,24-26 Aug.,10.1109/APWCS55727.2022.9906479,https://ieeexplore.ieee.org/document/9906479
ieee:9906481,conference,Bit Error Rate Performance of OFDM Using Hierarchical Modulation in 3GPP TDL Channel Model,⬜ 미선별,,"Daiki Mitamura, Mamoru Sawahashi, Yoshihisa Kishiyama","This paper presents the average bit error rate (BER) performance of orthogonal frequency division multiplexing using two-layer and three-layer hierarchical modulation (HM) schemes in a multipath Rayleigh fading channel based on a 3GPP tapped delay line channel model. In HM, the basic information bits should be demodulated and decoded using all the users within a cell satisfying the BER requirement. Hence, we investigate non-uniform quadrature amplitude modulation constellations so that the loss in the required average received signal-to-noise power ratio (SNR) satisfying the average BER of the basic information bits for HM is minimized compared to that using the original constellation with which only the basic information bits are transmitted. We also investigate the distance from a cell site in the coverage area for the information bits of each layer based on the path loss equations in the Urban Macro and Rural Macro scenarios in terms of the required average received SNR achieving the average BER of 10−3.",,24-26 Aug.,10.1109/APWCS55727.2022.9906481,https://ieeexplore.ieee.org/document/9906481
ieee:9906513,conference,Reliable Transceiver Design of LEO Satellite Communication Systems with Doppler Effect and Multipath and Amplification Nonlinear Distortions,⬜ 미선별,,"Sheng-Hsuan Hsu, Juinn-Horng Deng","With the advancement of wireless communication technology, satellite communications have the advantages of wide coverage and low latency. Low-earth-orbit (LEO) satellite communication systems have an important role in 6G technology development in the future. However, high-frequency and high-relative speed lead to Doppler effect, which will seriously affect the performance of the demodulator at the receiver. Meanwhile, for the high transmission power of the antenna, signal distortion caused by the non-linear effect of power amplifier (PA) needs to be considered. In this paper, we use Gaussian Minimum Shift Keying (GMSK) modulation technique as the main transceiver. It is found that under the non-ideal transmission, e.g., Doppler frequency offset and multipath channels effects, the continuous phase modulation (CPM) characteristics can effectively reduce multipath channel interference and nonlinear distortion. Also, the demodulation scheme using cross-coupled detector method can reduce the frequency offset effect. Moreover, the proposed modem scheme combined with the Quasi Cyclic LDPC (QC-LDPC) channel coding and the hybrid LDPC soft decoding method proposed herein, the error rate performance has better than using the min-sum algorithm decoding method alone.",,24-26 Aug.,10.1109/APWCS55727.2022.9906513,https://ieeexplore.ieee.org/document/9906513
