ID,Type,Title,Status,Reason,Algo,Authors,Abstract,Categories,Published,DOI,PDF URL
ieee:9940942,journal,Dynamic Error Recovery Flow Prediction Based on Reusable Machine Learning for Low Latency NAND Flash Memory Under Process Variation,✅,NAND 플래시 LDPC 다중 디코딩모드 동적 ERF를 ML(전이·메타학습)로 예측해 read latency 감소 — NAND/SSD 직접(A),✅ 알고리즘/코드 기여,"Minyoung Hwang, Jeongju Jee, Joonhyuk Kang, Hyuncheol Park, Seonmin Lee, Jinyoung Kim","NAND flash memory is becoming smaller and denser to have a larger storage capacity as technologies related to fine processes are developed. As a side effect of high-density integration, the memory can be vulnerable to circuit-level noise such as random telegraph noise, decreasing the reliability of the memory. Therefore, low-density parity-check code that provides multiple decoding modes is adopted in the NAND flash memory systems to have a strong error correcting capability. Conventional static error recovery flow (ERF) applies decoding modes sequentially, and read latency can increase when preceding decoding modes fail. In this paper, we consider a dynamic ERF using machine learning (ML) that predicts an optimal decoding mode guaranteeing successful decoding and minimum read latency and applies it directly to reduce read latency. Due to process variation incurred in the manufacturing of memory, memory characteristics are different by chips and it becomes difficult to apply a trained prediction model to different chips. Training the customized prediction model at each memory chip is impractical because the computational burden of training is heavy, and a large number of training data is required. Therefore, we consider ERF prediction based on reusable ML to deal with varying input and output relationships by chips due to process variation. Reusable ML methods reuse pre-trained model architecture or knowledge learned from source tasks to adapt the model to perform its task without any loss of performance in different chips. We adopt two reusable ML approaches for ERF prediction based on transfer learning and meta learning. Transfer learning method reuses the pre-trained model by reducing domain shift between a source chip and a target chip using a domain adaptation algorithm. On the other hand, meta learning method learns shared features from multiple source chips during the meta training procedure. Next, the meta-trained model reuses previously learned knowledge to fastly adapt to the different chips. Numerical results validate the advantages of the proposed methods with high prediction accuracy in multiple chips. In addition, the proposed ERF prediction based on transfer and meta learning can yield a noticeable reduction in average read latency as compared to conventional schemes.",,2022,10.1109/ACCESS.2022.3220337,https://ieeexplore.ieee.org/document/9940942
ieee:9834767,conference,Look-Ahead Bit-Flipping Decoding of MDPC Code,✅,Modified bit-flipping decoder for MDPC codes; new hard-decision BF algorithm transferable to NAND LDPC decoding (C).,✅ 알고리즘/코드 기여,H. Kaneko,"This paper presents a modified bit-flipping (BF) decoding algorithm for moderate-density parity-check codes using a property of the number of unsatisfied parity checks (NUPCs) in uncorrected error positions. The proposed BF algorithm selects candidate flipping positions using the current NUPC, and then selects one flipping position based on a sum of NUPCs in suspicious positions after tentative flipping of each candidate position. The block error rate (BLER) is evaluated by computer simulation, and the results show that the presented BF algorithm gives lower BLERs compared to existing decoding algorithms.","Resistance, Error analysis, Computer simulation, Estimation, Parity check codes, Decoding, Timing",2022,10.1109/ISIT50566.2022.9834767,https://ieeexplore.ieee.org/document/9834767
ieee:9834619,conference,Ternary Message Passing Decoding of RS-SPC Product Codes,✅,"터너리 메시지패싱 디코딩 알고리즘 + DE 분석 — 바이너리 이미지 RS-SPC 대상, 저복잡도 MP 디코더 기법 이식 가능(C), 애매하여 살림",✅ 알고리즘/코드 기여,"M. Zhu, M. Jiang, C. Zhao","This paper presents a ternary message passing (TMP) decoding algorithm for product codes constructed from binary image Reed-Solomon (RS) codes and single-parity-check (SPC) codes. All exchanged messages among component decoders in TMP decoding take value from a ternary alphabet {–1, 0, +1}, which gives a potential for designing fast decoders. In particular, intersymbol interference (ISI) channels are considered due to their applications in many high-speed systems. Moreover, we propose the density evolution (DE) analysis for RS-SPC product codes over AWGN and ISI channels. The DE analyses and simulation results show RS-SPC product codes under TMP decoding performs well in various channels.","AWGN channels, Reed-Solomon codes, Product codes, Message passing, Simulation, Intersymbol interference, Decoding",2022,10.1109/ISIT50566.2022.9834619,https://ieeexplore.ieee.org/document/9834619
ieee:9834448,conference,Fully Analog Noise-Resilient Dynamical Systems Storing Binary Sequence,✅,"패리티검사행렬 기반 아날로그 경사하강 디코딩 동역학 — 이식 가능한 새 디코더 아키텍처(C/D) 후보, 애매하여 살림",✅ 알고리즘/코드 기여,T. Wadayama,"This paper presents fully analog noise-resilient dynamical systems for storing a binary sequence. The proposed dynamical system is a gradient descent dynamical system based on a potential energy function defined based on a parity check matrix of a binary linear code. We assume that the dynamical system operates with stochastic disturbances such as thermal noises. We formulate the whole system, including stochastic disturbances, using stochastic differential equations (SDE). From a discretized stochastic difference equation, i.e., the Euler-Maruyama equation, we can study the covariance evolution of error vectors regarding the random walk of the system state around an equilibrium state. Some numerical evaluations for the (7,4) Hamming code and related codes indicate the robustness of the proposed dynamical system against the stochastic disturbances.","Potential energy, Difference equations, Differential equations, Linear codes, Thermal noise, Robustness, Parity check codes",2022,10.1109/ISIT50566.2022.9834448,https://ieeexplore.ieee.org/document/9834448
ieee:9965920,conference,Code-Aware Storage Channel Modeling via Machine Learning,✅,"A: NAND 플래시 채널 모델링(ML 생성모델)으로 부호 설계 보조 — NAND ECC 직접 관련, 코딩 설계 도구",✅ 알고리즘/코드 기여,"S. Zheng, P. H. Siegel","With the reduction in device size and the increase in cell bit-density, NAND flash memory suffers from larger inter-cell interference (ICI) and disturbance effects. Constrained coding can mitigate the ICI effects by avoiding problematic error-prone patterns, but designing powerful constrained codes requires a comprehensive understanding of the flash memory channel. Recently, we proposed a modeling approach using conditional generative networks to accurately capture the spatio-temporal characteristics of the read signals produced by arrays of flash memory cells under program/erase (P/E) cycling. In this paper, we introduce a novel machine learning framework for extending the generative modeling approach to the coded storage channel. To reduce the experimental overhead associated with collecting extensive measurements from constrained program/read data, we train the generative models via transferring knowledge from models pre-trained with pseudo-random data. This technique can accelerate the training process and improve model accuracy in reconstructing the read voltages induced by constrained input data throughout the flash memory lifetime. We analyze the quality of the model by comparing flash page bit error rates (BERs) derived from the generated and measured read voltage distributions. We envision that this machine learning framework will serve as a valuable tool in flash memory channel modeling to aid the design of stronger and more efficient coding schemes.","Training, Voltage measurement, Transfer learning, Measurement uncertainty, Bit error rate, Training data, Data models",2022,10.1109/ITW54588.2022.9965920,https://ieeexplore.ieee.org/document/9965920
ieee:9834902,conference,Graph-based codes for hierarchical recovery,✅,Tanner/graph-based codes with hierarchical locality and stopping-set analysis for erasure recovery — code-design technique (E) potentially portable to storage LDPC.,✅ 알고리즘/코드 기여,"A. Beemer, R. Kshirsagar, G. L. Matthews","In this paper, we consider approaches to designing Tanner codes to protect against symbol loss from multiple erasures. First, we note that Tanner codes inherit locality and availability from their inner codes, allowing one to design longer codes with specified locality and availability. Availability is desirable in that multiple disjoint repair groups increase the likelihood that symbols are available to repair erased ones. Even so, particular patterns of erasures well-distributed across the repair groups may prevent recovery. Hence, we consider an alternative using hierarchical locality which implements tiered recovery, where the tier utilized depends on the number of erasures. Finally, we define hierarchical stopping sets to characterize local message-passing decoder failure at the various repair levels.","Codes, Symbols, Maintenance engineering, Decoding",2022,10.1109/ISIT50566.2022.9834902,https://ieeexplore.ieee.org/document/9834902
ieee:10000968,conference,ECC-Aided RAID for Reliability Improvement of SSD,✅,"3-bit MLC NAND 대상 ECC-aided RAID, soft-decision 협력 ECC 디코딩으로 정정능력 향상 — NAND/SSD ECC 직접(A/B)",✅ 알고리즘/코드 기여,"K. Lee, G. Yu, Y. Hwang, B. Jun, H. Son, Y. H. Song","In the field of solid state drive (SSD), redundant array of inexpensive disk (RAID) is of great use due to its reliability and performance. In terms of reliability, RAID can be further enhanced with the help of error-correction code (ECC), which is another core technology for SSD applications. Recently, joint ECC-RAID schemes have been proposed for the reliability of SSD. Especially, due to high reliability with low computational complexity, joint ECC-RAID schemes based on RAID-5, denoted as ECC-RAID-5, are popularly adopted to devices as well as systems of data storage. In this paper, a new family of joint ECC-RAID schemes, called ECC-aided RAID (EA-RAID), are proposed to further improve the reliability of the joint ECC-RAID schemes in the data storage applications. In the EA-RAID, new types of data checking and regenerating algorithms based on soft-decision (SD) are introduced to enhance the error-correcting capability of the cooperative ECC decoding. The EA-RAID increases error-correction capability as at least 15% and 7% gain compared with the ECC-only schemes and the conventional ECC-RAID-5, respectively. The improvement is demonstrated by productized SSD based on virtuaI3-bit-over multi-level cell (MLC) NAND. It is expected that the proposed technologies can be introduced as a potential solution for next generation NAND.","Solid state drives, Memory, Encoding, Error correction codes, Decoding, Reliability, Global communication",2022,10.1109/GLOBECOM48099.2022.10000968,https://ieeexplore.ieee.org/document/10000968
ieee:9943021,conference,A new type of ultimate-Shannon-limit channel codes,✅,"protograph 기반 LDPC-Hadamard 코드, 새 코드 구성 — 바이너리 LDPC 코드설계 신기여(E), 이식 가능성 있음",✅ 알고리즘/코드 기여,F. C. M. LAU,"In most existing digital communication systems, the received signal strength is usually larger than the noise level. Alternatively, the bit-energy-to-noise-power-spectral-density (Eb/N0) is assumed to be greater than 0 dB. However, in some specific applications such as deepspace communications and quantum key distribution, the received signal power is smaller than the noise power. Under such circumstances, strong error correction codes are required to provide a reliable link between the transmitter and the receiver. In this talk, a new type of error-correction code called “protograph-based low-density parity-check Hadamard codes” is introduced. The codes are shown to provide excellent error performance not only when Eb/N0 is smaller than 0 dB, but also when Eb/N0 approaches the ultimate Shannon limit -1.59 dB.","Circuits and systems, Error correction codes, Digital communication, Wireless sensor networks, Wireless networks, Turbo codes, Technology transfer",2022,10.1109/ATC55345.2022.9943021,https://ieeexplore.ieee.org/document/9943021
ieee:9896912,journal,Neural Belief Propagation Auto-Encoder for Linear Block Code Design,✅,"Neural BP-like 디코더와 선형블록부호 공동학습 오토인코더, 이식 가능 신경망 디코더 (C)",✅ 알고리즘/코드 기여,"G. Larue, L. -A. Dufrene, Q. Lampin, H. Ghauch, G. R. -B. Othman","The growing number of Internet of Thing (IoT) and Ultra-Reliable Low Latency Communications (URLCC) use cases in next generation communication networks calls for the development of efficient Forward Error Correction (FEC) mechanisms. These use cases usually imply using short to mid-sized information blocks and requires low-complexity and/or fast decoding procedures. This paper investigates the joint learning of short to mid block-length coding schemes and associated Belief-Propagation (BP) like decoders using Machine Learning (ML) techniques. An interpretable auto-encoder (AE) architecture is proposed, ensuring scalability to block sizes currently challenging for ML-based linear block code design approaches. By optimizing a coding scheme w.r.t. the targeted decoder, the proposed system offers a good complexity/performance trade-off compared to various codes from literature with length up to 128 bits.","Decoding, Codes, Belief propagation, Forward error correction, Standards, Polar codes, Iterative decoding",2022,10.1109/TCOMM.2022.3208331,https://ieeexplore.ieee.org/document/9896912
ieee:9732212,journal,High-Throughput and Energy-Efficient VLSI Architecture for Ordered Reliability Bits GRAND,✅,ORBGRAND 고처리율 VLSI 아키텍처 — 임의 코드 적용 가능한 이식형 디코더 HW(C/D),✅ 알고리즘/코드 기여,"S. M. Abbas, T. Tonnellier, F. Ercan, M. Jalaleddine, W. J. Gross","Ultrareliable low-latency communication (URLLC), a major 5G new-radio (NR) use case, is the key enabler for applications with strict reliability and latency requirements. These applications necessitate the use of short-length and high-rate channel codes. Guessing random additive noise decoding (GRAND) is a recently proposed maximum likelihood (ML) decoding technique for these short-length and high-rate codes. Rather than decoding the received vector, GRAND tries to infer the noise that corrupted the transmitted codeword during transmission through the communication channel. As a result, GRAND can decode any code, structured or unstructured. GRAND has hard-input as well as soft-input variants. Among these variants, ordered reliability bits GRAND (ORBGRAND) is a soft-input variant that outperforms hard-input GRAND and is suitable for parallel hardware implementation. This work reports the first hardware architecture for ORBGRAND, which achieves an average throughput of up to 42.5 Gb/s for a code length of 128 at a target frame error rate (FER) of 10−7. Furthermore, the proposed hardware can be used to decode any code as long as the length and rate constraints are met. In comparison to the GRAND with ABandonment (GRANDAB), a hard-input variant of GRAND, the proposed architecture enhances decoding performance by at least 2 dB. When compared to the state-of-the-art fast dynamic successive cancellation flip decoder (Fast-DSCF) using a 5G polar code (PC) (128, 105), the proposed ORBGRAND VLSI implementation has  $49\times $  higher average throughput,  $32\times $  times more energy efficiency, and  $5\times $  more area efficiency while maintaining similar decoding performance.","Codes, Hardware, Very large scale integration, Maximum likelihood decoding, Throughput, Reliability, Polar codes",2022,10.1109/TVLSI.2022.3153605,https://ieeexplore.ieee.org/document/9732212
ieee:9789141,journal,Iterative Hard-Decision Decoding Algorithms for Binary Reed-Muller Codes,✅,"바이너리 RM 코드용 반복 비트플리핑(BF/NBF/MBF) 경판정 디코더 — bit-flipping 계열은 NAND LDPC 저복잡도 디코더로 이식 가능, 애매하므로 살림",✅ 알고리즘/코드 기여,"Y. -T. Ni, D. N. Nguyen, F. -K. Liao, T. -C. Kao, C. -Y. Chen","In this paper, novel hard-decision iterative decoding algorithms for binary Reed-Muller (RM) codes are presented. First, two algorithms are devised based on the majority-logic decoding algorithm with reliability measures of the received sequence. The bit-flipping (BF) and the normalized bit-flipping (NBF) decoding algorithms are hard-decision decoding algorithms. According to the updated hard reliability measures, the BF and NBF algorithms flip one bit of the received hard-decision sequence at a time in each iteration. The NBF decoding algorithm performs better than the BF decoding algorithm by normalizing the reliability measures of the information bits. Moreover, the BF and NBF algorithms are modified to flip multiple bits in one iteration to reduce the average number of iterations. The modified decoding algorithms are called the multiple-bits-flipping (MBF) algorithm and the normalized multiple-bits-flipping (NMBF) algorithm, respectively. The proposed algorithms have low computational complexities and can converge rapidly after a small number of iterations. The simulation results show that the proposed hard-decision decoding algorithms outperform the conventional decoding algorithm.","Iterative decoding, Maximum likelihood decoding, Codes, Reliability, Reed-Muller codes, Polar codes, Generators",2022,10.1109/ACCESS.2022.3180368,https://ieeexplore.ieee.org/document/9789141
ieee:9707626,journal,A Code Rate-Compatible High-Throughput Hardware Implementation Scheme for QKD Information Reconciliation,✅,"QC-LDPC+puncturing rate-compatible 화해 알고리즘과 NMSA HLS 구현(ZCU102, 136Mbps); QKD지만 고전 바이너리 LDPC 디코더/HW 기법 이식 가능(C/D)",✅ 알고리즘/코드 기여,"Ming Zhu, Ke Cui, Simeng Li, Lei Kong, Shibiao Tang, Jian Sun","For high-speed quantum key distribution (QKD) post processing, information reconciliation is the most computational step, which usually acts as the system speed bottleneck. Reconciliation efficiency and operation throughput are the two most important performance parameters, but they are often compromised to each other in actual realization due to the available hardware resources. Another characteristic of the information reconciliation is that its channel is time-varying, and in order to guarantee high efficiency, some rate-compatible error correction scheme should be adopted. To cope with the above problems, this paper proposes a rate-compatible high-efficiency reconciliation algorithm based on quasi-cyclic (QC) low-density parity-check (LDPC) codes and puncturing algorithms. On the other hand, in order to obtain high throughput while maintaining low implementation complexity, the normalized min-sum algorithm (NMSA) is realized and optimized by using the fast prototyping tool of high-level synthesis (HLS). The proposed information reconciliation module was implemented on the Xilinx Zynq Ultrascale+ ZCU102 development board. Experimental results show that the maximum throughput rate of the implemented reconciliation module in this paper can reach 136 Mbps, while the efficiency factor is kept lower than 1.32 across the error rate range of 1.7%∼10.6% under the remaining frame error rate level of 10−3. The comprehensive good performance obtained by our design can strongly support the development of modern high-speed QKD systems.",,"15 June15,",10.1109/JLT.2022.3149567,https://ieeexplore.ieee.org/document/9707626
ieee:9750799,conference,Speed up QC-LDPC decoder through memory subsystem optimization,✅,QC-LDPC 디코더 메모리 서브시스템 최적화·ASIP/SIMD 병렬화로 throughput 개선 — 이식 가능 HW 아키텍처(D),🔧 하드웨어 수정만,"Yajie Li, Dake Liu, Xinbing Zhou, Wei Chen","In this paper, we proposed a QC-LDPC decoder for 5G NR, WiMAX, and WLAN applications. The decoder can flexibly support arbitrary code length and rate under 5G NR standard. This design follows programmable ASIP (Application Specific Instruction-set Processor) design method and uses data parallel SIMD (Single Instruction Multiple Data) architecture. We doubled the logic computing speed to improve the throughout instead of using double speed memory architecture. Compared with the design mentioned in [1], the original design could achieve the highest QC-LDPC decoding throughput of 533Mbps (12 SISO in parallel) when the clock frequency is 200MHz (memory clock frequency is 400MHz). The existing design saved 47% of the decoding clock cycle without lossing decoding circuit quality. We achieved a maximum QC-LDPC decoding throughput of 1984 Mbps (with 48 SISO in parallel) when the system frequency is 400MHz (memory clock frequency is also 400MHz). Further, through circuit optimization, the upper limit of the system clock is promoted from 344MHz to 1.1GHz. The throughput can possibly be upto 5456Mbps. Finally, through the logic synthesis using 28nm SMIC CMOS cell library, the design is physically verified, and the logic gate count is reported 1716K. It is similar to that of the original design per SISO.",,14-16 Jan.,10.1109/IWECAI55315.2022.00027,https://ieeexplore.ieee.org/document/9750799
