ID,Type,Title,Status,Reason,Authors,Abstract,Categories,Published,DOI,PDF URL
ieee:8886344,journal,Strategies for economical next-generation 50G and 100G passive optical networks [Invited],⬜ 미선별,,"Doutje van Veen, Vincent Houtsma","This paper discusses whether scaling current time-division-multiplexed passive optical network technology based on intensity modulation with direct detection with on–off-keying to even higher bit rates can continue to meet future bandwidth demands in a cost-effective way or if other strategies like alternative modulation formats, transmission technologies, digital signal processing, and/or expansion of capacity via multiple wavelengths are required to enable economical next-generation 50G and 100G passive optical networks.",,January 20,10.1364/JOCN.12.000A95,https://ieeexplore.ieee.org/document/8886344
ieee:8897618,journal,Blind Recognition of LDPC Codes Over Candidate Set,⬜ 미선별,,"Zhaojun Wu, Limin Zhang, Zhaogen Zhong, Renxin Liu","Adaptive modulation and coding (AMC) techniques have attracted more attention recently because of flexible strategies and dynamic channel quality. Blind recognition of encoder is an important technology for AMC systems because it can improve communication efficiency very well. In this letter, we present a new algorithm to tackle blind low-density parity-check (LDPC) encoder identification over a given candidate set. Our proposed scheme establishes a cosine conformity (CC) of syndrome, which is a posterior probability that can measure the probability that all parity check relations of the codes are satisfied, and classifies the LDPC encoder leading to maximum average CC over the candidate set. Simulations show that the new method is effective for LDPC encoder identification; the theoretical correct ratio of recognition is consistent with the simulation results, and its performance is improved by nearly 1.5 dB when compared with the existing algorithm.",,Jan. 2020,10.1109/LCOMM.2019.2953229,https://ieeexplore.ieee.org/document/8897618
ieee:8897699,journal,On the Construction of Regular QC-LDPC Codes With Low Error Floor,⬜ 미선별,,"Abdullah Sarıduman, Ali E. Pusane, Z. Caner Taşkın","Quasi-cyclic low-density (QC-LDPC) codes benefit from efficient encoding hardware and display excellent error correcting performance. Therefore, they have been accepted into the 5G standards in addition to being potential candidates for next generation mobile systems. However, dominant trapping sets in the Tanner graphs cause some failures for the iterative decoding algorithm. In this letter, we propose a simulated annealing based method to find regular QC-LDPC codes without dominant trapping sets and have good error floor performance. Simulation results show that our proposed method generates QC-LDPC codes that have the best trapping sets distribution among recent works and better frame rate performance than others.",,Jan. 2020,10.1109/LCOMM.2019.2953058,https://ieeexplore.ieee.org/document/8897699
ieee:8894067,journal,Rate-Loss Mitigation of SC-LDPC Codes Without Performance Degradation,⬜ 미선별,,"Hee-Youl Kwak, Dae-Young Yun, Jong-Seon No","In research on spatially-coupled low-density parity-check (SC-LDPC) codes, rate-loss of SC-LDPC codes is one of the main issues to be addressed. One way to mitigate the rate-loss is to attach additional variable nodes with an irregular degree distribution, where the degree distribution is optimized with a constraint that the belief propagation (BP) threshold should not be degraded by attaching variable nodes. However, it is observed that the degree distribution obtained with the BP threshold constraint induces degradation of the finite-length performance. In order to address the problem, we propose new optimization methods to attach additional variable nodes while minimizing performance degradation. The proposed optimization methods are based on several design techniques including the scaling law, local threshold, expected graph evolution, differential evolution algorithms, the use of a protograph structure, and puncturing codewords. Using the optimized structure for additional variable nodes, the rate-loss of SC-LDPC codes can be reduced by more than 53% without sacrificing the finite-length performance. It is also shown that the rate-loss mitigation can be translated into a performance improvement if the proposed and the conventional SC-LDPC codes are compared at the same code rate.",,Jan. 2020,10.1109/TCOMM.2019.2952074,https://ieeexplore.ieee.org/document/8894067
ieee:8876876,journal,Construction of Multiple-Burst-Correction Codes in Transform Domain and Its Relation to LDPC Codes,⬜ 미선별,,"Liyuan Song, Qin Huang, Zulin Wang","This paper analyzes and explicitly constructs quasi-cyclic (QC) codes for correcting multiple bursts via matrix transformations. Our analysis demonstrates that the multiple-burst-correction capability of QC codes is determined by sub-matrices in the diagonal of their transformed parity-check matrices. By well designing these sub-matrices, the proposed QC codes are able to achieve optimal or asymptotically optimal multiple-burst-correction capability. Moreover, it proves that these codes can be QC low-density parity-check (QC-LDPC) codes, if the diagonal sub-matrices of their transformed parity-check matrices are Hadamard powers of base matrices. Analysis and simulation results show that our QC-LDPC codes perform well over not only random symbol error/erasure channels, but also burst channels.",,Jan. 2020,10.1109/TCOMM.2019.2948341,https://ieeexplore.ieee.org/document/8876876
ieee:8886511,journal,A Partially Coupled LDPC Coded Scheme for the Gaussian Wiretap Channel,⬜ 미선별,,Junyi Du,"In this letter, we propose an effective partially coupled low-density parity-check coded scheme to reduce the security gap for the Gaussian wiretap channel. In our scheme, codewords are partially coupled by exclusive OR adding the message bits from a codeword to the parity check bits from its consecutive codeword. An iterative decoding algorithm is also proposed to utilize the correlations between codewords. Based on this design, error propagation effect between codewords is achieved to worsen the performance at the eavesdropper, which receives messages via a poor conditioned channel. Numerical results demonstrate that the proposed scheme outperforms the punctured scheme in terms of the equivocation rate and the security gap.",,Jan. 2020,10.1109/LCOMM.2019.2950307,https://ieeexplore.ieee.org/document/8886511
ieee:8847386,journal,Spatial Modulation With Multi-Dimensional Constellations,⬜ 미선별,,"Dan Feng, Qingli He, Baoming Bai, Jianping Zheng, Mengmeng Liu","Quadrature spatial modulation (QSM) was proposed to strengthen conventional SM by creating a new spatial constellation dimension. Inspired by that, we present a spatial modulation scheme which expands spatial constellation to a new dimension and utilizes the spatial dimension to transmit multi-dimensional constellation signals. In the proposed scheme, Gallager mapping is used for spatial mapping to increase the transmission rate in spatial domain. The design method of multi-dimensional constellations is also described in this letter. We investigate both 5G LDPC codes and nonbinary LDPC codes with the designed multi-dimensional constellations. Simulation results show that the proposed scheme can achieve significant performance gains.",,Jan. 2020,10.1109/LWC.2019.2943341,https://ieeexplore.ieee.org/document/8847386
ieee:8643782,journal,Optimized Trellis-Based Min-Max Decoder for NB-LDPC Codes,⬜ 미선별,,"Jing Tian, Suwen Song, Jun Lin, Zhongfeng Wang","Non-binary low-density parity-check (NB-LDPC) codes outperform their binary counterparts in many cases. However, an NB-LDPC decoder usually requires excessive hardware resources and memory consumption. The trellis-based min-max decoding algorithm (TMMA), a well-known algorithm proposed in recent years, achieves good tradeoff between decoding performance and hardware complexity. Note that the check node processing unit (CNU) occupies the most hardware consumption. Based on the TMMA, many simplifications for the CNU have been developed with slight performance loss. The current TMMA with L truncations (L-TMMA) is promising for higher hardware efficiency than others. In this brief, based on the L-TMMA, we propose a new CNU design by incorporating algorithmic transformation and architectural optimization to further reduce the hardware complexity and thereby the critical path without any performance degradation. Synthesis results show that the proposed design achieves the lowest hardware consumption and the highest clock frequency with a small latency compared to the state-of-the-arts. Specifically, it saves more than 1/3 hardware resources compared with its original one.",,Jan. 2020,10.1109/TCSII.2019.2900088,https://ieeexplore.ieee.org/document/8643782
ieee:8883091,journal,Analysis and Optimization of Tail-Biting Spatially Coupled Protograph LDPC Codes for BICM-ID Systems,⬜ 미선별,,"Zhaojie Yang, Yi Fang, Guohua Zhang, Francis C. M. Lau, Shahid Mumtaz, Daniel B. da Costa","As a typical example of bandwidth-efficient techniques, bit-interleaved coded modulation with iterative decoding (BICM-ID) provides desirable spectral efficiencies in various wireless communication scenarios. In this paper, we carry out a comprehensive investigation on tail-biting (TB) spatially coupled protograph (SC-P) low-density parity-check (LDPC) codes in BICM-ID systems. Specifically, we first develop a two-step design method to formulate a novel type of constellation mappers, referred to as labeling-bit-partial-match (LBPM) constellation mappers, for SC-P-based BICM-ID systems. The LBPM constellation mappers can be seamlessly combined with high-order modulations, such as M-ary phase-shift keying (PSK) and M-ary quadrature amplitude modulation (QAM). Furthermore, we conceive a new bit-level interleaving scheme, referred to as variable node matched mapping (VNMM) scheme, which can substantially exploit the structure feature of SC-P codes and the unequal protection-degree property of labeling bits to trigger the wave-like convergence for TB-SC-P codes. In addition, we propose a hierarchical extrinsic information transfer (EXIT) algorithm to predict the convergence performance (i.e., decoding thresholds) of the proposed SC-P-based BICM-ID systems. Theoretical analyses and simulation results illustrate that the LBPM-mapped SC-P-based BICM-ID systems are remarkably superior to the state-of-the-art mapped counterparts. Moreover, the proposed SC-P-based BICM-ID systems can achieve even better error performance with the aid of the VNMM scheme. As a consequence, the proposed LBPM constellation mappers and VNMM scheme make the SC-P-based BICM-ID systems a favorable choice for the future-generation wireless communication systems.",,Jan. 2020,10.1109/TVT.2019.2949600,https://ieeexplore.ieee.org/document/8883091
ieee:8822501,journal,Quantum Codes From Classical Graphical Models,⬜ 미선별,,"Joschka Roffe, Stefan Zohren, Dominic Horsman, Nicholas Chancellor","We introduce a new graphical framework for designing quantum error correction codes based on classical principles. A key feature of this graphical language, over previous approaches, is that it is closely related to that of factor graphs or graphical models in classical information theory and machine learning. It enables us to formulate the description of the recently-introduced `coherent parity check' quantum error correction codes entirely within the language of classical information theory. This makes our construction accessible without requiring background in quantum error correction or even quantum mechanics in general. More importantly, this allows for a collaborative interplay where one can design new quantum error correction codes derived from classical codes.",,Jan. 2020,10.1109/TIT.2019.2938751,https://ieeexplore.ieee.org/document/8822501
ieee:8843939,journal,Locally Repairable Codes: Joint Sequential–Parallel Repair for Multiple Node Failures,⬜ 미선별,,"Ehsan Yavari, Morteza Esmaeili","Locally repairable codes (LRC) have been studied from two approaches to locally repair multiple failed nodes: 1) parallel approach, in which a coordinate i of an [n,k,d] linear code is said to have locality r and availability t if there exist t disjoint repair sets each of which contains at most r other coordinates that can recover the value of the i -th coordinate; 2) sequential approach, in which the erased symbols (failed nodes) are repaired, one by one, and any previously repaired node can be used to repair the remaining failed nodes. In this paper, we first consider LRC aiming at joint sequential-parallel repairing multiple failed nodes, and study the (n,k,r,t,u) -ELRCs (Exact locally repairable codes) which are [n,k] linear codes with the property that any set of failed nodes of size at most t can be simultaneously repaired in parallel mode, and each element of a set E of failed nodes of size at most u can be sequentially repaired by r (r<; k) other coordinates. We present a method by which with a given parity-check matrix of an (n,k,r,t,u) -ELRC with minimum Hamming distance d, a new ELRC with minimum Hamming distance 2d and availability t+1 is constructed that can repair each set of failed nodes E of size at most 2u+1 in sequential mode and this repair is done in at most u-t+2 steps. We construct a big family of LRCs by making use of orthogonal Latin rectangles and permutation cubes and some other combinatorial designs; the constructed codes contain the family of direct product codes; we also use m -dimensional permutation cubes to construct LRCs with short block length for each r.",,Jan. 2020,10.1109/TIT.2019.2940975,https://ieeexplore.ieee.org/document/8843939
ieee:8879556,journal,Raptor Codes With Descending Order Degrees for AWGN Channels,⬜ 미선별,,"Wei Yu, Krishna Narayanan, Jun Cheng, Jun Wu","We propose a novel construction of rateless codes for the additive white Gaussian noise (AWGN) channel with high order quadrature amplitude modulation (QAM). The proposed construction is structurally similar to a Raptor code consisting of an inner Luby transform (LT)-style code and an outer low density parity check (LDPC) code. The main novelty is that the output degree distribution for the LT part is time-varying and the degree of the parity bits decreases with time, parity bits with the same degree are clustered together rather than random, which is totally different from traditional fixed degree distributions. Simulation results with a joint iterative decoding algorithm demonstrate that both the goodput and the bit error rate (BER) performance of our proposed scheme are better than those of newly reported Raptor codes for the AWGN channel in most cases.",,Jan. 2020,10.1109/LCOMM.2019.2948906,https://ieeexplore.ieee.org/document/8879556
ieee:8895843,journal,FFT-Assisted Coded Modem for Intensity-Modulated Signals Under Peak and Average Power Constraints,⬜ 미선별,,"Ru-Han Chen, Jian Zhang, Yan-Yu Zhang","We consider an intensity-modulated (IM) communication system in the presence of Gaussian noise. To improve the reliability of such a system, a space-only constellation-optimal structure was proposed by Zhang under a peak and an average power constraint. However, how to utilize time resource to design signals has been an unsolved problem. In this paper, we design a complexity-efficient coded modem for IM signals under a peak- and an average-power constraint in finite-blocklength regimes. The proposed modem consists of a lattice-based multidimensional constellation bounded by the optimal shaping region, decomposable constellation mapping and demapping based on the fast Fourier transform (FFT), and a fast demodulator with near maximum-likelihood performance. To the authors' best knowledge, for the first time, the FFT and the inverse FFT (IFFT) algorithms are used for constellation mapping to reduce the involved complexity. Both theoretical analysis and Monte Carlo simulation results show that our proposed modem has significant signal-to-noise ratio gains and can support flexible-rate transmission compared to the one-dimensional optimal constellation with Gray labeling.",,Jan. 2020,10.1109/TCOMM.2019.2952586,https://ieeexplore.ieee.org/document/8895843
ieee:9016466,conference,Received-Power-Aware Frameless ALOHA for Grant-Free Non-Orthogonal Multiple Access,⬜ 미선별,,"Masaru Oinaga, Shun Ogata, Koji Ishibashi","In this paper, we propose a frameless ALOHA with an adjustable transmission probability of every user based on the received power at the base station (BS). Based on the numerical analysis, we show that the proposed received-power-aware design of the transmission probability effectively improves the packet resolution probability and the throughput performances.",,7-10 Jan. ,10.1109/ICOIN48656.2020.9016466,https://ieeexplore.ieee.org/document/9016466
ieee:9016621,conference,OFDM-based 25Gbps Wireless Backhaul System for 5G Convergence Service,⬜ 미선별,,"Young Jin Moon, Jun Woo Kim, Jang Won Moon, Young Su Lee, Seung Jae Bahng, Kyung Yeol Sohn, Hoon Lee","In order to provide backhaul link wirelessly for emerging convergence services, we develop an OFDM-based backhaul system operating in the E-band channel. Firstly, we make our own backhaul specification considering the E band channel in which the proposed backhaul system operates, where LDPC, 1024-QAM and 2-stream transmission using dual polarizations are adopted. Based on the specification, we simulate the PER performance on AWGN and modified 3GPP channel environment respectively and implement the backhaul system on FPGA (Xilinx Virtex UltraScale xcvu440). To compensate the RF impairments, several baseband signal processing techniques such as phase tracking, IQ balancing and XPIC are used. The backhaul system we develop can support up to 25Gbps throughput in a 2GHz channel bandwidth.",,7-10 Jan. ,10.1109/ICOIN48656.2020.9016621,https://ieeexplore.ieee.org/document/9016621
ieee:9031175,conference,Smart Jamming Attacks in 5G New Radio: A Review,⬜ 미선별,,"Youness Arjoune, Saleh Faruque","The fifth generation of wireless cellular networks (5G) is expected to be the infrastructure for emergency services, natural disasters rescue, public safety, and military communications. 5G, as any previous wireless cellular network, is vulnerable to jamming attacks, which create deliberate interference to hinder the communication of legitimate users. Therefore, jamming 5G networks can be a real threat to public safety. Thus, there is a strong need to investigate to what extent these networks are vulnerable to jamming attacks. For this investigation, we consider the 3GPP standard released in 2017, which is widely accepted as the primary reference for the deployment of these networks. First, we describe the key elements of 5G New Radio (NR) architecture, such as different channels and signals exchanged between the base station and user equipment. Second, we conduct an in-depth review of the jamming attack models and we assess the 5G NR vulnerabilities to these jamming attacks. Then, we present the state-of-the-art detection and mitigation techniques, and we discuss their suitability to defeat smart jammers in 5G wireless networks. Finally, we provide some recommendations and future research directions at the end of this paper.",,6-8 Jan. 2,10.1109/CCWC47524.2020.9031175,https://ieeexplore.ieee.org/document/9031175
ieee:9031117,conference,"Artificial Intelligence for 5G Wireless Systems: Opportunities, Challenges, and Future Research Direction",⬜ 미선별,,"Youness Arjoune, Saleh Faruque","The advent of the wireless communications systems augurs new cutting-edge technologies, including self-driving vehicles, unmanned aerial systems, autonomous robots, the Internet-of-Things, and virtual reality. These technologies require high data rates, ultra-low latency, and high reliability, all of which are promised by the fifth generation of wireless communication systems (5G). Many research groups state that 5G cannot meet its demands without artificial intelligence (A.I.) integration as 5G wireless networks are expected to generate unprecedented traffic giving wireless research designers access to big data that can help in predicting the demands and adjust cell designs to meet the users' requirements. Subsequently, many researchers applied A.I. in many aspects of 5G wireless communication design including radio resource allocation, network management, cyber-security. In this paper, we provide an in-depth review of A.I. for 5G wireless communication systems. in this respect, the aim of this paper is to survey A.I. in 5G wireless communication and networking by discussing many case studies, discuss the challenges, and shed new light on future research directions for leveraging A.I. in 5G wireless communications.",,6-8 Jan. 2,10.1109/CCWC47524.2020.9031117,https://ieeexplore.ieee.org/document/9031117
ieee:9105485,conference,A New Partially-Parallel VLSI-Architecture of Quasi-Cyclic LDPC Decoder for 5G New-Radio,⬜ 미선별,,"Anuj Verma, Rahul Shrestha","This paper presents partially-parallel low-density parity-check (LDPC) decoder architecture for binary-input additive-white Gaussian-noise (BIAWGN) channel in 5G new-radio cellular-communication technology based on layered min-sum decoding algorithm. This architecture exploits the iterative decomposition of check-node and variable-node combined-processing unit which leads to area optimization and lower hardware complexity. The proposed VLSI architecture of LDPC decoder processes quasi-cyclic LDPC encoded information which is received as log-likelihood ratios (LLRs) from soft demodulator at the receiver side. It achieves the adequate bit-error-rate (BER) of $10 -^{6}$ between 2 to 4 dB of bit-energy to noise-power-spectral-density $(\mathrm{E}_{b}/ \mathrm{N}_{0})$ with 10 decoding iterations for various code rates like 1/3, 2/5, 1/2, 2/3, 3/4, 5/6, and 8/9. The VLSI architecture of 5G new-radio LDPC decoder has been field-programmable logic-array (FPGA) prototyped and its implementation results are compared with state-of the-art designs where the proposed LDPC decoder shows lower hardware utilization up to 87%. To the best of our knowledge, this is the first VLSI-architecture of LDPC decoder reported for 5G new-radio compliant to the specifications of enhanced mobile broadband (eMBB).",,4-8 Jan. 2,10.1109/VLSID49098.2020.00018,https://ieeexplore.ieee.org/document/9105485
ieee:9043057,conference,A New LDPC Code Decoding Method: Expanding the Scope of Ising Machines,⬜ 미선별,,"Masashi Tawada, Shu Tanaka, Nozomu Togawa","Low-density parity-check (LDPC) codes have previously been considered as combinatorial optimization problems (COPs) in respect to its decoding. However, after defining it as such, none have gone so far as to convert the LDPC code into a quadratic unconstrained binary optimization (QUBO) problem. Thus, a new method is created: one that converts the LDPC code to a QUBO problem, inputs the QUBO problem into Ising machines (computers based on the Ising model that are designed to solve the QUBO problem), obtains the QUBO solution and converts it to a LDPC solution. By utilizing an actual Ising machine, LDPC solutions with code length of 256-bits have been obtained with an accuracy of 93.9% by average annealing time 214.0ms. The benefit of this newfound methodology goes beyond its theoretical imprint of obtaining LDPC solutions more accurately. It has only been a few years since the Ising machine has been developed. Therefore, in formulating this method, one expands the currently scope of studies involving Ising machines, helping current and future researchers unlock its full range of capabilities and possibilities.",,4-6 Jan. 2,10.1109/ICCE46568.2020.9043057,https://ieeexplore.ieee.org/document/9043057
ieee:9043176,conference,Performance Evaluation of Layered Division Multiplexing of Next Generation Digital Terrestrial Television Broadcasting Under ISDB-T,⬜ 미선별,,"Tomohiro Takaya, Akira Nakamura, Makoto Itami","The scheme that combines ISDB-T (Integrated Service Digital Broadcasting - Terrestrial) with LDM (Layered Division Multiplexing) has been proposed as the way to shift to the next-generation DTTB (Digital Terrestrial Television Broadcasting). However, when LDM is applied, the receiver is complicated and transmission characteristics deteriorate. In this paper, the performance is evaluated by computer simulations under AWGN (Additive White Gaussian Noise) environment under the cases that the receiver was simplified and the modulation of the upper layer was changed. As the results of computer simulations, the receiver can be simplified without deteriorating the performance. In addition, the required CNR (Carrier to Noise Ratio) of the lower layer can be improved by the proposed scheme.",,4-6 Jan. 2,10.1109/ICCE46568.2020.9043176,https://ieeexplore.ieee.org/document/9043176
