ID,Type,Title,Status,Reason,Authors,Abstract,Categories,Published,DOI,PDF URL
ieee:9083899,conference,Notice of Violation of IEEE Publication Principles: Channel Decoding Based on Complex-valued Convolutional Neural Networks,⬜ 미선별,,"L. Li, G. Yu, J. Xu, L. Li","Inspired by the recent outcomes in deep learning, we propose a novel decoding architecture which concatenates a complex-valued convolutional neural network (CCNN) with a belief propagation (BP) decoder for combating correlated noise in the channel. The CCNN can exploit the complex noise correlation and yield a more accurate estimation of the channel noise. Depressing the influence of channel noise via the proposed architecture, the BP decoder can obtain better decoding performances. Furthermore, extensive experiments are carried out to analyze and verify performances of the proposed framework.;Notice of Violation of IEEE Publication Principles<br>BR> “Channel Decoding Based on Complex-valued Convolutional Neural Networks” <br>by Lun Li, Guanghui Yu, Jin Xu, and Liguang Li <br> in the Proceedings of the 2nd 6G Wireless Summit (6G SUMMIT), March 2020 <br><br> After careful and considered review of the content and authorship of this paper by a duly constituted expert committee, this paper has been found to be in violation of IEEE’s Publication Principles. <br><br> This article contains significant portions of text from the article cited below that were paraphrased without attribution. <br><br> “Exploiting Noise Correlation for Channel Decoding with Convolutional Neural Networks” <br> by Fei Liang, Cong Shen, and Feng Wu <br> in the Proceedings of the IEEE International Conference on Communications (ICC), May 2018 <br><br>",,2020,10.1109/6GSUMMIT49458.2020.9083899,https://ieeexplore.ieee.org/document/9083899
ieee:9217354,conference,Throughput Maximization for Polar Coded IR-HARQ Using Deep Reinforcement Learning,⬜ 미선별,,"G. Qiu, M. -M. Zhao, M. Lei, M. -j. Zhao","The wireless channel conditions in the future mobile communication systems will become more and more complex as we are developing higher frequency bands, thus it is necessary to adjust the transmission parameters frequently. To ensure the reliability of data transmission, hybrid automatic repeat request (HARQ) techniques are widely used to improve the data throughput of wireless communication systems. This paper develops a polar coded incremental redundancy HARQ (IR-HARQ) scheme based on deep reinforcement learning (DRL) to combat the unexpected channel fluctuations in practice. Specifically, the IR bits are generated by performing quasi-uniform puncturing and polarizing matrix extension on polar codes, and the number of IR bits are optimized by utilizing the deep deterministic policy gradient (DDPG) algorithm in the considered IR-HARQ scheme. Simulation results show that compared with the conventional chase combing scheme and the fixed-length IR-HARQ scheme, the proposed IR scheme can significantly improve the system throughput.","Throughput, Decoding, Receivers, Machine learning, Reliability, Signal to noise ratio, Encoding",2020,10.1109/PIMRC48278.2020.9217354,https://ieeexplore.ieee.org/document/9217354
ieee:9209265,conference,Low Complexity PIC-MMSE Detector for LDS Systems over Frequency-Nonselective Channels,⬜ 미선별,,"M. Fantuz, M. Kulhandjian, C. D’Amours","We consider minimum mean square error (MMSE) and parallel interference cancellation (PIC) (MMSE-PIC) detection for low-density spreading (LDS) systems and compared its bit error rate (BER) performance to LDS systems using MPA-based detection the detection. In this paper, we extend the research of [1] to the frequency-nonselective Rayleigh fading channel, where we show that the BER performance of the MMSE-PIC receiver is only a small fraction of a dB behind that of the MPA-based detector. Therefore the MMSE-PIC receiver is a very good low-complexity alternative to MPA-based detection as it greatly reduces computation complexity without making a large sacrifice in BER performance.","Detectors, Fading channels, Complexity theory, Receivers, Multiuser detection, Multiaccess communication, NOMA",2020,10.1109/CAMAD50429.2020.9209265,https://ieeexplore.ieee.org/document/9209265
ieee:9261811,conference,A GUI based Self-learning Tool for Polar Codes using Successive Cancellation and List Decoders,⬜ 미선별,,"R. A. Ahsan, S. Khichar, W. Phakphisut, L. Wuttisittikulkij, A. Ngamjob, P. Sasithong, A. Bajpai, M. Saadi, A. Parnianifard, I. Ullah, M. P. Han, W. Phyo, P. Vanichchanunt","Recently, the importance of channel coding has become prominent for next-generation 5G wireless communication networks. Channel coding is becoming an active area of research and scholars are aiming to improve their knowledge about channel coding schemes which will be playing a crucial part in high-performance 5G networks. polar codes are the class of channel coding techniques that have been standardized in 5G. Moreover, it is a fact that activity tool-based learning raises the learning efficiency and generates intrinsic motivation for learning. Therefore, the main motivation for designing this paper is to develop a Graphical User Interface (GUI) based learning tool to help students easily learn channel coding techniques. In our teaching curriculum, we have used figure-based interactive representations to teach the basic concepts of polar codes efficiently. This learning tool provides users the option to learn about the encoding technique and two different decoding techniques named as Successive Cancellation (SC) and Successive Cancellation List (SCL) for different lengths of user-defined data bits. This complete model has been designed in Python.","Decoding, Polar codes, Graphical user interfaces, Tools, Signal to noise ratio, 5G mobile communication, Channel coding",2020,10.1109/ICAIT51105.2020.9261811,https://ieeexplore.ieee.org/document/9261811
ieee:9310014,conference,Neural Information Bottleneck Decoding,⬜ 미선별,,"M. Stark, J. Lewandowsky, G. Bauch","Receiver-sided channel decoding is a crucial, but computationally very demanding task. Recently, information-bottleneck-based decoding received considerable attention in the literature, as it achieves very good performance with coarse quantization and low complexity. Information bottleneck de-coders replace the conventional node operations in the channel decoders with relevant-information-preserving mappings. In the literature, these mappings are typically represented as lookup tables. Unfortunately, the lookup tables are fairly large and the logic circuits needed to implement the lookup tables occupy significant chip area. This paper proposes a novel approach to overcome these impairments, which is based on a trainable function, i.e., a neural network. We show that a trained neural network can represent the mappings more compactly than the frequently used lookup tables. Moreover, our results show that even multiple-input-multiple-output mappings can be learned to replace lookup tables with prohibitive complexity. We investigate a coarsely quantized low-density parity-check decoder that realizes the relevant-information-preserving mappings for all decoding iterations with a single neural network to illustrate the practical benefits of the proposed concept.","Decoding, Biological neural networks, Iterative decoding, Complexity theory, Training, Deep learning, Task analysis",2020,10.1109/ICSPCS50536.2020.9310014,https://ieeexplore.ieee.org/document/9310014
ieee:9174287,conference,Tangential-Sphere Bound Revisited,⬜ 미선별,,"J. Liu, C. Wang","With the recently proposed parameterized Gallager’s first bounding technique (GFBT), the tangential-sphere bound (TSB) of Poltyrev, which was considered as one of the tightest upper bounds, is revisited by defining nested Gallager regions. The nested Gallager regions are chosen to be a family of the boundary surface of the circular cone whose central line passes through the origin and the transmitted signal. The parameterized TSB proposed in this paper can be proved to be equivalent to the TSB proposed by Poltyrev. The equation for the optimal parameter can be obtained in an intuitive manner without resorting to the derivatives. The new derivation reveals that the optimal region of TSB is a cone rather than a double cone with a geometrical explanation, which is considered to be a double cone in the original literature.","AWGN channels, Upper bound, Pairwise error probability, Block codes, Information theory",2020,10.1109/ISIT44484.2020.9174287,https://ieeexplore.ieee.org/document/9174287
ieee:9083139,conference,Multilevel Coding with Flexible Probabilistic Shaping for Rate-Adaptive and Low-Power Optical Communications,⬜ 미선별,,"T. Yoshida, M. Karlsson, E. Agrell",A novel multilevel coded modulation scheme with probabilistic shaping is presented. It can reduce the power consumption up to 9 times compared with uniform signaling in the regime of typical hard-decision FEC thresholds.,"Optical fibers, Power demand, Modulation, Probabilistic logic, Throughput, Optical fiber communication, Encoding, Iterative decoding",2020,,https://ieeexplore.ieee.org/document/9083139
ieee:9539511,conference,Acquisition Technology for the Third Beidou Satellite Navigation Signal with Low Signal-to-Noise Ratio and High Dynamic,⬜ 미선별,,"Y. Qin, Y. Zhang, J. Guo, B. Guo","In order to solve the problem of acquisition of the third generation Beidou satellite navigation signal with low SNR and high dynamic, a BOC (1,1) signal acquisition technology based on the non-coherent accumulation of BPSK-like PMF-FFT is proposed. The influence of carrier Doppler frequency offset and code Doppler on PN code acquisition is considered simultaneously in this algorithm, according to searching range for Doppler frequency offset, first-order Doppler frequency offset changing rate and code Doppler, the parameters of acquisition algorithm are determined, and the quantitative analysis results of detection value are given. The detection probability formula of the acquisition algorithm is derived, and its correctness is proved, Compared with the minimum carrier to noise ratio of Beidou system, the algorithm in this paper has a margin of 9.7db in the worst case. Finally, the scheme of carrier Doppler rate of change and code Doppler compensation for extremely low SNR and high dynamic signals is given.","Codes, Satellites, Statistical analysis, Heuristic algorithms, Virtual reality, Satellite navigation systems, Doppler effect",2020,10.1109/ICVRIS51417.2020.00100,https://ieeexplore.ieee.org/document/9539511
ieee:9239538,conference,System-level Performance Comparison of IEEE 802.11p and 802.11bd Draft in Highway Scenarios,⬜ 미선별,,"R. Jacob, W. Anwar, N. Schwarzenberg, N. Franchi, G. Fettweis","Emerging applications such as cooperative automated driving in connection with technical advancements made in recent years require a new generation of V2X technologies. The upcoming IEEE 802.11bd standard, the successor of IEEE 802.11p, addresses increased throughput, range and reliability requirements by leveraging features such as high density midambles, dual carrier modulation and range extension. Within this work the authors present the first system-level evaluation of the upcoming standard. Therefore, a simulation framework to evaluate the transmission reliability in terms of packet reception ratio in highway scenarios with variable vehicle density is presented, based on which both technologies are compared. The results show significant improvements of the maximum transmission range, slight improvements in robustness against access layer packet loss and a strong performance degradation when using dual carrier modulation.","Road transportation, Modulation, Throughput, Robustness, Telecommunications, Standards, Vehicle-to-everything",2020,10.1109/ICT49546.2020.9239538,https://ieeexplore.ieee.org/document/9239538
ieee:9174259,conference,A Functional Construction of Codes for Multiple Access and Broadcast Channels,⬜ 미선별,,"S. Ganguly, L. Wang, Y. -H. Kim","Codes are developed for two-user multiple access and broadcast channels starting from Gelfand-Pinsker codes with known block lengths, rates, and error performances. Guarantees are provided on the block error rates of the MAC and BC codes in terms of the parameters of the constituent Gelfand- Pinsker codes. These guarantees hold as long as the constituent codes satisfy the assumed properties on rate, codeword weights, and performances, irrespective of the basic structure and other properties.","Codes, Error analysis",2020,10.1109/ISIT44484.2020.9174259,https://ieeexplore.ieee.org/document/9174259
ieee:9181187,conference,High-Efficient Reed-Solomon Decoder Based on Deep Learning,⬜ 미선별,,"X. An, Y. Liang, W. Zhang","Deep learning recently shows outstanding potential in channel decoding optimization, but its effect on the decoding of Reed-Solomon (RS) codes has yet to be explored. In this paper, we propose a RS decoder based on deep learning for the first time, and pave a new way to improve the existing RS decoding algorithms. We exploit a deep neural network (DNN) to estimate the error numbers of the received codewords, and according to the estimation results, a novel decoder is designed, which can adjust the most suitable decoding method to each received codeword automatically. Experiments show that for (7, 3), (15, 9) and (63, 55) RS codes, the average computational complexity of our decoder can be reduced by 68.96 %, 62.38 %, 50.61 % respectively compared with the HDD-LCC algorithm.","Maximum likelihood decoding, Machine learning, Estimation, Complexity theory, Training, Reliability",2020,10.1109/ISCAS45731.2020.9181187,https://ieeexplore.ieee.org/document/9181187
ieee:9265087,conference,Beyond 5G & Technologies: A Cross-Domain Vision,⬜ 미선별,,E. Mercier,"5G deployment is on-going and many challenges are arising. New Radio (NR) Frequency Range 2 (FR2) in the millimeter (mmW) frequency domain starts being considered. Wideband over extended spectrum is targeted, enlightening broadband capacity and even much higher throughput than current views. In addition, spatial coverage based on quite small short wavelength antenna-array beam-forming offers new use case scenarii. As a consequence, the induced bands to support are increasing as well as the complexity of Front-End Module (FEM). But for autonomy and economical attraction, massive deployment can only happen with energy efficiency improvement. This paper will propose optimization paths for mm W system architectures, and their actual implementation, PHY considerations, and associated technology advances, for an holistic approach of the entire communication chain, and will highlight some promising trends for the development of 5G and beyond transceivers.","Phase noise, Frequency conversion, Transceivers, Throughput, Robustness, Radio frequency, Frequency-domain analysis",2020,10.1109/VLSITechnology18217.2020.9265087,https://ieeexplore.ieee.org/document/9265087
ieee:9174343,conference,Improved efficiency for covering codes matching the sphere-covering bound,⬜ 미선별,,"A. Potukuchi, Y. Zhang","A covering code is a subset ${\mathcal{C}} \subseteq {\{ 0,1\} ^n}$ with the property that any z ∈{0,1}n is close to some $c \in {\mathcal{C}}$ in Hamming distance. For every ϵ,δ > 0, we show a construction of a family of codes with relative covering radius δ+ ϵ and rate 1−H(δ) with block length at most $\exp (O((1/ \in )\log (1/ \in )))$ for every ϵ >0. This improves upon a folklore construction which only guaranteed codes of block length exp(1/ ϵ 2). The main idea behind this proof is to find a distribution on codes with relatively small support such that most of these codes have good covering properties.","Error correction codes, Hamming distances",2020,10.1109/ISIT44484.2020.9174343,https://ieeexplore.ieee.org/document/9174343
ieee:9083366,conference,Transmission of 36-Gbaud PAM-8 Signal in IM/DD System using Pairwise-Distributed Probabilistic Amplitude Shaping,⬜ 미선별,,"D. Kim, Z. He, T. Bo, Y. Yu, H. Kim",We experimentally demonstrate the transmission of 36-Gbaud probabilistically-shaped PAM-8 signal over 10-km link. The performance measured after FEC decoding and inverse distribution matcher shows that the receiver sensitivity is improved by >1 dB compared to uniform-distributed signals.,"Optical fibers, Sensitivity, Modulation, Maxwell-Boltzmann distribution, Receivers, Probabilistic logic, Optical fiber communication, Decoding",2020,,https://ieeexplore.ieee.org/document/9083366
ieee:9333413,conference,World's First Field Trial of 100 Gbit/s Flexible PON (FLCS-PON),⬜ 미선별,,"R. Borkowski, M. Straub, Y. Ou, Y. Lefevre, Ž. Jelić, W. Lanneer, N. Kaneda, A. Mahadevan, V. Hückstädt, D. van Veen, V. Houtsma, W. Coomans, R. Bonk, J. Maes","We completed world's first field trial of FLCS-PON, which delivers bitrates up to 100 Gbit/s and allows for flexible line and code rate to match users' channel conditions and optimize throughput. Using FLCS-PON, we demonstrated a record-high 31.5dB loss budget for 100 Gbit/s preamplifier-direct-detection ONU.","Bit rate, Prototypes, Modulation, Throughput, Optical network units, Preamplifiers, Optical fiber communication",2020,10.1109/ECOC48923.2020.9333413,https://ieeexplore.ieee.org/document/9333413
ieee:9297194,conference,CP-Less MIMO Discrete Fourier Transform Spread OFDM,⬜ 미선별,,"M. Mainul Islam Mamun, D. Medhi, C. Beard","In this work, we present the first Cyclic prefix (CP)-less Multiple-Input Multiple-Output (MIMO) OFDM System. It is based on incorporating DFT spreading, signal discrimination with Walsh-Hadamard coding, and PAPR reduction with Tukey (tapered cosine) time-domain windowing techniques. This combination of mechanisms provides an effective combination of benefits related to Bit Error Rate (BER), Peak-to-Average Power Ratio (PAPR), Complementary Cumulative Distribution Function (CCDF) of PAPR, and Out-of-Band (OOB) spectral power. Our simulation study shows that the proposed scheme achieves Out-of-Band (OOB) spectral power attenuation of 142 dB with PAPR of 8.56 dB and BER of 10−4 under a scenario of Eb /N0 = 15 dB with a 16-QAM modulation.","Computers, Bit error rate, Discrete Fourier transforms, Modulation, Peak to average power ratio, MIMO, Encoding",2020,10.1109/ISNCC49221.2020.9297194,https://ieeexplore.ieee.org/document/9297194
ieee:9328963,conference,Supervised Learning for Enhanced Early HARQ Feedback Prediction in URLLC,⬜ 미선별,,"S. AlMarshed, D. Triantafyllopoulou, K. Moessner","The fifth-generation wireless communication networks (5G) facilitate a wide range of newly-emerging applications alongside existing cellular mobile broadband services. One of the key service classes of 5G is Ultra-Reliable and Low-Latency Communications (URLLC), which guarantees the rapid delivery of short packets (up to 1 ms) with a success probability rate of 99.999%. The challenging reliability and latency requirements of URLLC cannot be delivered by existing cellular networks, resulting in the need for significant air interface modifications. This study aims to satisfy the link latency requirements of URLLC applications, and specifically reduce the latency associated with the presence of the Hybrid Automatic Repeat reQuest (HARQ) feedback scheme. To this end, we investigate a supervised learning method to provide early HARQ (E-HARQ) feedback on the decodability status of the coded-received signal, ahead of the decoding processing. This strategy allows the transmitter to react faster and minimize the signal round-trip time (RTT). The simulation results demonstrate the capability of the proposed mechanism to speed up the feedback releasing and enhance the prediction accuracy by 12% with the introduction of a new feature derived by the channel state estimation.","Wireless communication, Training, 5G mobile communication, Transmitters, Simulation, Supervised learning, Ultra reliable low latency communication",2020,10.1109/Comnetsat50391.2020.9328963,https://ieeexplore.ieee.org/document/9328963
ieee:9045697,conference,Low Complexity Decoding of Downlink Chaos NOMA Scheme with Physical Layer Security,⬜ 미선별,,"Y. Masuda, E. Okamoto, T. Yamamoto","The non-orthogonal multiple access (NOMA) scheme has been considered as one of the methods for performing large capacity, high-speed communications in fifth-generation mobile communications system (5G). We propose a chaos NOMA scheme that realizes physical layer security and reliable communication. However, in conventional studies, the decoding of chaos NOMA uses joint maximum likelihood sequential estimation (MLSE), which simultaneously estimates the signals of all superposed users, and the decoding complexity increases exponentially with the number of superimposed users. Therefore, in this paper, we propose a low complexity decoding scheme for chaos NOMA using a combination of successive interference cancellation (SIC), which is a typical decoding method for NOMA, and partial MLSE. Through numerical simulations, we show that complexity is significantly reduced with the joint MLSE, and that the transmission performance is still better than that of the conventional NOMA scheme.","NOMA, Maximum likelihood estimation, Interference cancellation, Silicon carbide, Physical layer security, Numerical simulation, Complexity theory",2020,10.1109/CCNC46108.2020.9045697,https://ieeexplore.ieee.org/document/9045697
ieee:9379442,conference,M-QAM Demodulation based on Machine Learning,⬜ 미선별,,"R. N. Toledo, C. Akamine, F. Jerji, L. A. Silva",This paper presents a new Quadrature Amplitude Modulation (M-QAM) demodulation method using Machine Learning techniques. The new method significantly reduces the demodulation complexity for high-order constellations while maintains the demodulation accuracy. The experimental results demonstrate a performance gain of up to 1485% for 4096-QAM in comparison with the classical Log-Likelihood Ratio demodulator.,"Training, Quadrature amplitude modulation, Machine learning, Rayleigh channels, Telecommunications, Demodulation, Signal to noise ratio",2020,10.1109/BMSB49480.2020.9379442,https://ieeexplore.ieee.org/document/9379442
ieee:9322225,conference,Iterative Receiver with a Lattice-Reduction-Aided MIMO Detector for IEEE 802.11ax,⬜ 미선별,,"Y. -P. Wang, C. -C. Wen, C. -C. Kao, C. -J. Huang, D. -Z. Liu, C. -H. Yang","This paper presents the first 802.11ax compliant iterative detection and decoding (IDD) receiver that supports up to 4×4 1024-QAM MIMO detection in the open literature. Soft-input-soft-output (SISO) MIMO detection is implemented with a lattice reduction aided (LRA) K-best searcher and a max-log list demapper. A hardware-efficient IDD receiver is proposed to achieve the required packet-rate (PER) with a feasible latency. The extrinsic information transfer (EXIT) chart is utilized to reduce the number of iterations for IDD. Given the 802.11ax latency constraint, the performance, power, area (PPA) design space is explored to identify the optimal IDD receiver architecture. 50% of IDD inner iterations are reduced with only a 0.05dB loss in PER. The proposed IDD receiver achieves a 1dB improvement in PER with 3.6× smaller area and 3.0× lower power consumption when compared to the best non-IDD receiver.","Detectors, MIMO communication, Decoding, Iterative decoding, IEEE 802.11ax Standard, Lattices, Matrix decomposition",2020,10.1109/GLOBECOM42002.2020.9322225,https://ieeexplore.ieee.org/document/9322225
ieee:9172778,conference,Mitigating Fading in Cislunar Communications: Application to the Human Landing System,⬜ 미선별,,"M. S. Net, K. -M. Cheung","NASA's human exploration program is currently working towards landing astronauts on the surface of the Moon by 2024, close the lunar South Pole. To guarantee astronaut safety and maximize science data return, NASA is in the process of defining the communication architecture that will support all astronaut activities from launch to surface operations. Of particular interest to this paper are links from the lunar surface back to Earth without any intermediate relays. We show that the system geometry is such that antennas on the landing system will need to be pointed at low elevation angles, thus potentially causing multi-path fading effects not typically encountered in space communications. This paper is organized in three parts. First, we characterize the multi-path fading effects expected in links between the lunar South Pole and Earth and show that for moderate data rates (less than 1 Mbps) the links suffer from slow fading. We then show that for this operations regime the performance of forward error correction schemes is significantly worse for traditional Additive White Gaussian Noise channels. Finally, we investigate multi-copy mechanisms to mitigate the effects of fading, most notably repetition schemes and Automatic Repeat Request.","Fading channels, Earth, Geometry, South Pole, Moon, NASA, Forward error correction",2020,10.1109/AERO47225.2020.9172778,https://ieeexplore.ieee.org/document/9172778
