ID,Type,Title,Status,Reason,Authors,Abstract,Categories,Published,DOI,PDF URL
ieee:9171339,journal,A Novel ITI Suppression Technique for Coded Dual-Track Dual-Head Bit-Patterned Magnetic Recording Systems,⬜ 미선별,,"Santi Koonkarnkhai, Chanon Warisarn, Piya Kovintavewat","Generally, an intertrack interference (ITI) is a critical problem in bit-patterned magnetic recording (BPMR) systems that can attain an areal density (AD) up to 4 Tb/in2. Unavoidably, at high ADs, a very narrow track width must be employed, leading to severe ITI and unacceptable system performance. To tackle the ITI; therefore, this article introduces a novel ITI suppression technique for coded dual-track dual-head (DTDH) BPMR systems. At the first turbo iteration, the weighted readback signal of the adjacent track served as an estimated ITI signal is utilized for subtracting from the target readback signal to subside the ITI effect, before passing the refined readback signal to a turbo equalizer. Nonetheless, for the second turbo iteration onwards, the estimated ITI signal generated by the soft information obtained from a decoder at each turbo iteration will be then employed to subtract from the target readback signal during the turbo decoding process. Computer simulation results demonstrate that the proposed system can provide better performance than the DTDH system using a hard ITI suppression technique as well as the conventional system using one read head to decode one data track for all ADs, because the proposed technique can estimate the ITI signal well. Furthermore, when considering the recording system under the effects of media noise and track mis-registration, we also found that the proposed system is more robust than other systems.",,2020,10.1109/ACCESS.2020.3017708,https://ieeexplore.ieee.org/document/9171339
ieee:9205258,journal,Machine-Learning-Based Read Reference Voltage Estimation for NAND Flash Memory Systems Without Knowledge of Retention Time,⬜ 미선별,,"Hyemin Choe, Jeongju Jee, Seung-Chan Lim, Sung Min Joe, Il Han Park, Hyuncheol Park","To achieve a low error rate of NAND flash memory, reliable reference voltages should be updated based on the accurate knowledge of program/erase (P/E) cycles and retention time, because those severely distort the threshold voltage distribution of memory cell. Due to the sensitivity to the temperature, however, a flash memory controller is unable to acquire the exact knowledge of retention time, meaning that it is challenging to estimate accurate read reference voltages in practice. In this article, we propose a novel machine-learning-based read reference voltage estimation framework for the NAND flash memory systems without the knowledge of retention time. To establish an unknown input-output relation of the estimation model, we derive input features by sensing and decoding memory cells in the minimum read unit. In order to define the relation between unlabeled input features and a pre-assigned class label, namely label read reference voltages, we propose three mapping functions: 1) k -nearest neighbors-based, 2) nearest-centroid-based, and 3) polynomial regression-based read reference voltage estimators. For the proposed estimation schemes, we analyze that the storage overhead and computational complexity are increasing function of the exploited feature dimension. Accordingly, we propose a feature selection (or dimension reduction) algorithm to select the minimum dimension and corresponding features to reduce the overhead and complexity while maintaining high estimation accuracy. Based on extensive numerical analysis, we validate that the derived features successfully replace unknown knowledge of retention time, and the proposed feature selection algorithm precisely adjusts the trade-off between overhead/complexity and estimation accuracy. Furthermore, the simulation and analysis results show that the proposed framework not only outperforms the conventional estimation schemes but also achieves the near-optimal frame error rate while sustaining low latency performance.",,2020,10.1109/ACCESS.2020.3026232,https://ieeexplore.ieee.org/document/9205258
ieee:9256359,journal,Marker Codes Using the Decoding Based on Weighted Levenshtein Distance in the Presence of Insertions/Deletions,⬜ 미선별,,"Yuan Liu, Yiwei Lu, Yashuo He, Xiaonan Zhao, Cuiping Zhang","A random marker code is inserted into the information sequences periodically, and a novel symbol-level decoding algorithm considering the weighted Levenshtein distance (WLD) is designed for correcting insertions, deletions, as well as substitutions in the received sequences. In this method, branch quantities in the decoding trellis are calculated by measuring the WLD, which is done using the dynamic programming. A simulation study is performed to demonstrate the effectiveness of the presented scheme in the practical system, especially for channels with weak synchronization problems.",,2020,10.1109/ACCESS.2020.3037169,https://ieeexplore.ieee.org/document/9256359
ieee:9057585,journal,An Area-Efficient Hybrid Polar Decoder With Pipelined Architecture,⬜ 미선별,,"Yu Wang, Qinglin Wang, Yang Zhang, Shikai Qiu, Zuocheng Xing","As the first kind of capacity-achieving forward error correction (FEC) codes, polar codes have attracted much research interest recently. Compared with traditional FEC codes, polar codes show better error correction performance when successive cancellation list (SCL) decoding with cyclic redundancy check is adopted. However, its serial decoding nature and high complexity of list management lead to its low throughput. Though the adaptive SCL decoding and hybrid decoding can improve the throughput, it comes at cost of implementation area. In this paper, we propose a pipelined hybrid decoding procedure and the corresponding hardware architecture to improve the area efficiency. In our design, the idle decoding cores are employed for successive cancellation (SC) decoding when SCL decoding is not working. The SCL decoding will be activated when the SC decoding fails. Different decoding cores work according to their own operation sequences and share one common processing array to improve the utilization ratio of processing elements. Constant receiving interval is supported with the design of input buffer to store all received codewords. A software platform is established to optimize the design parameters for each module of decoder. Moreover, the corresponding architecture is implemented using 65nm technology. Experimental results show that the proposed decoder can achieve a similar error correction performance with the SCL decoding with list size 16. Compared to the state-of-the-art available hybrid decoder, our proposed pipelined hybrid decoder is $3.07\times $ more area efficient.",,2020,10.1109/ACCESS.2020.2985909,https://ieeexplore.ieee.org/document/9057585
ieee:8988272,journal,Separable Reversible Data Hiding in Encrypted Images With High Capacity Based on Median-Edge Detector Prediction,⬜ 미선별,,"Li Liu, Anhong Wang, Chin-Chen Chang","In recent years, reversible data hiding technology in encrypted images has become an important topic for researchers. In addition, separable reversible data hiding technology in encrypted images also has been developed extensively because of its better practicability. In this paper, a new scheme of separable reversible data hiding in encrypted image is proposed based on the median-edge detector prediction. First, the predicted value of each pixel is calculated by using the median-edge detector predictor, and the difference between the original pixel and the predicted pixel is recorded according to the threshold parameter, and a label map is generated. Second, the original image is encrypted. Third, the differences and the secret bits are embedded into the pixels according to certain rules. After being compressed by using Run Length Coding and Huffman Coding, the label map is spliced to the bottom of the encrypted image. Finally, the stego-image is generated. When the receiver possesses the stego-image, which are the encrypted image that contain the hidden data, the desired image can be extracted or decrypted in accordance with a different key. The experimental results showed that our proposed scheme achieved better hiding capacity than the other schemes.",,2020,10.1109/ACCESS.2020.2972736,https://ieeexplore.ieee.org/document/8988272
ieee:9075233,journal,A New Construction of Codebooks Meeting the Levenshtein Bound,⬜ 미선별,,"Li Han, Shimin Sun, Yang Yan, Qiuyan Wang","Codebooks with low coherence have extensive applications in many fileds such as code division multiple access (CDMA) communication systems, MIMO communications, compressed sensing and so on. In this paper, based on additive characters over finite fields, we propose a construction of optimal codebook with respect to the Levenshtein bound and verify that it is a new construction. By shortening the length of the optimal codebooks, we present a construction of codebooks asymptotically meeting the Levenshtein bound. To the best of our knowledge, the parameters of the asymptotically optimal codebooks are new.",,2020,10.1109/ACCESS.2020.2989360,https://ieeexplore.ieee.org/document/9075233
ieee:9106372,journal,Outage Analysis and Learning-Based Relay Selection for Opportunistic Lossy Forwarding Relaying Systems,⬜ 미선별,,"Haiyang Zhang, Zhiwei Zhang","In this paper, we study an opportunistic decode-and-forward (DF) system allowing intra-link errors, referred as opportunistic lossy-forwarding (OLF) system. Multiple relays are available but only one “best relay” is selected to forward the decoded information to the destination. The forwarded information may be erroneous. The relay selection strategy is built using source coding with a helper theorem. We evaluate the outage probability of OLF relaying system, and derive an approximated theoretical outage probability bound. For practical deployment, a statistical learning algorithm for selection relay is designed. The practical performance loss is negligible compared to the optimal selection case. The OLF system outperforms the existing opportunistic DF system in terms of outage performance. Both theoretical and numerical results show that full diversity can be achieved. Finally, we investigate the position of deploying relays by minimizing the outage probability from simulation results.",,2020,10.1109/ACCESS.2020.2999450,https://ieeexplore.ieee.org/document/9106372
ieee:9120055,journal,Performance Improvement for Wireless Sensors Networks by Adopting Hybrid Subcarrier Intensity Modulation Over Exponentiated Weibull Turbulence Channels,⬜ 미선별,,"Yi Wu, Yuan Hao, Hongzhan Liu, Lin Zhao, Ting Jiang, Dongmei Deng, Zhongchao Wei","We conduct a research on free space optical (FSO) communication system that is applied for transmission in wireless sensor networks (WSN), which is based on the hybrid pulse position modulation-binary phase shift keying-subcarrier intensity modulation (PPM-BPSK-SIM) undergoes novel Exponentiated Weibull fading channels. When battery-charged sensor transmission nodes with limited energy is transmitted, it is vital to study the performance of the transmission link. We have derived the exact joint probability function of the transmission link when the atmospheric turbulence and pointing errors are considering. On the basis of them, the unconditional average bit error rate (BER) for hybrid PPM-BPSK-SIM is derived, then the closed expression of the outage probability and the average channel capacity are also derived. Research results indicates that increasing the receiver aperture by aperture averaging effect can distinctly improve the performance of the link. Additionally, for any circumstances of atmospheric turbulence and pointing errors, by combining the utilization of hybrid PPM-BPSK-SIM modulation and symbol with average length greater than eight, the average BER performance can be conspicuously enhanced. The outage probability and average channel capacity of the FSO link are jointly affected by atmospheric turbulence and pointing error, and optimization strategies in different scenarios are given by our research.",,2020,10.1109/ACCESS.2020.3003329,https://ieeexplore.ieee.org/document/9120055
ieee:9112210,journal,Homomorphic Computation in Reed-Muller Codes,⬜ 미선별,,"Jinkyu Cho, Young-Sik Kim, Jong-Seon No","With the ongoing developments in artificial intelligence (AI), big data, and cloud services, fully homomorphic encryption (FHE) is being considered as a solution for preserving the privacy and security in machine learning systems. Currently, the existing FHE schemes are constructed using lattice-based cryptography. In state-of-the-art algorithms, a huge amount of computational resources are required for homomorphic multiplications and the corresponding bootstrapping that is necessary to refresh the ciphertext for a larger number of operations. Therefore, it is necessary to discover a new innovative approach for FHE that can reduce the computational complexity for practical applications. In this paper, we propose a code-based homomorphic operation scheme. Linear codes are closed under the addition, however, achieving multiplicative homomorphic operations with linear codes has been impossible until now. We strive to solve this problem by proposing a fully homomorphic code scheme that can support both addition and multiplication simultaneously using the Reed-Muller (RM) codes. This can be considered as a preceding step for constructing code-based FHE schemes. As the order of RM codes increases after multiplication, a bootstrapping technique is required to reduce the order of intermediate RM codes to accomplish a large number of operations. We propose a bootstrapping technique to preserve the order of RM codes after the addition or multiplication by proposing three consecutive transformations that create a one-to-one relationship between computations on messages and that on the corresponding codewords in RM codes.",,2020,10.1109/ACCESS.2020.3001120,https://ieeexplore.ieee.org/document/9112210
ieee:9169876,journal,HARQ Assisted Short-Packet Communications for Cooperative Networks Over Nakagami-m Fading Channels,⬜ 미선별,,"Yucui Yang, Yi Song, Fenglian Cao","Considering the coverage and short-packet communication requirements, this paper proposes a hybrid automatic repeat request (HARQ) assisted short-packet communications for cooperative Internet of Things (IoT) networks, where the signals are transmitted through short-packets. Since the short-packet communications will bring a higher packet error rate than long-packet communications, HARQ is adopted to improve transmission reliability by allowing retransmit the signals which cannot be detected correctly. For lighting the burden of the transmitter, the retransmitted signals are only sent from the relay. According to the detection capability of the user, selection combining (SC) scheme and maximum ratio combining (MRC) scheme are designed to detect the multiple transmitted signals. Besides, a set of closed-form expressions of the average packet error rate (APER) and effective throughput (ET) are derived over Nakagami-$m$ channels in the proposed SC and MRC schemes. For providing more insights into system performance, the asymptotic results are also provided. Simulation results demonstrate that HARQ will significantly improve reliability and transmission efficiency. Also, the MRC scheme outperforms the SC scheme in terms of APER and ET metrics, however, when the transmit power at the relay is high enough or the packet length is big enough, they achieve nearly the same performance.",,2020,10.1109/ACCESS.2020.3017148,https://ieeexplore.ieee.org/document/9169876
ieee:9186729,journal,Iterative and Adjustable Soft List Decoding for Polar Codes,⬜ 미선별,,"Bowen Feng, Jian Jiao, Shaohua Wu, Ye Wang, Qinyu Zhang","List decoding of polar codes is an outstanding decoding method, in which a fixed-size list is applied to retain the most probable paths. In general, it is preferable to use a large-size list in the decoding to achieve excellent error-control performance, but this can lead to high complexity. Moreover, the list decoding is still a one-time-pass algorithm with hard-decision outputs, which is not well suited for advanced concatenated coding systems. In this paper, a novel adjustable list decoding is proposed, in which the list size can be adjusted appropriately. Based on the reliability analyses of the decoding list, dynamic thresholds are designed to precisely guide the adjustments. The adjustable list decoding can also achieve excellent error-control performance, but the complexity is significantly reduced. Moreover, we propose an iterative adjustable list decoding scheme with soft-decision outputs for concatenated polar-coding systems, in which a log-likelihood-ratio update strategy is elaborately designed. It can achieve much better error-control performance compared with the existing iterative decoding schemes, such as the belief propagation (BP) decoding, and soft cancellation (SCAN) decoding. As the number of iterations increases, the decoding performance gradually improves, but the complexity increases little due to efficient complexity control designs.",,2020,10.1109/TSP.2020.3020226,https://ieeexplore.ieee.org/document/9186729
ieee:9097237,journal,Optimum Equivalent Loading in Multi-Dimensional Transmission,⬜ 미선별,,"John M. Cioffi, Peter S. Chow, Kenneth J. Kerpez","Loading methods for wireline and wireless transmission systems are explained and reviewed to allow examination of fundamental equivalences between approaches to optimum transmission with linear cross-dimensional interference. Shannon’s famous water-filling method is then re-interpreted by examining the difference between mutual information and the constellation size used on each tone. Results reinforce that highest performance in all methods retains use of Shannon’s water-filling. However, results also find that a constant-size constellation on all energized water-filling dimensions, when used with a good code and an appropriate joint maximum-likelihood decoder, is sufficient to approximate this highest performance. This means that tone-dependent constellation variation is not necessary, which increases receiver complexity but reduces the need for channel-state feedback. This then leads to some adaptive MCS (modulation and coding scheme) equivalent loading methods that can be applied generally to wireline and wireless transmission.",,2020,10.1109/OJCOMS.2020.2995663,https://ieeexplore.ieee.org/document/9097237
ieee:9257501,journal,Iterative Receiver Design for Probabilistic Constellation Shaping in ISI Channel,⬜ 미선별,,"Xiang Li, Jing Wu, Wei Heng, Yang Huang","This paper investigates the receiver design for probabilistic constellation shaping signaling over inter-symbol interference channel. The key component performing the constellation shaping is an adjustable distribution matcher, and the probabilistic shaping system is capable to adapt to variable data rates by adjusting the distribution match rate rather than the modulation or coding mode. In this paper, we resort to distinct techniques to derive two iterative receivers operating in time domain. Shaped-BCJR is a trellis-based solution where forward/backward algorithm together with turbo iteration is used to compute the posteriori probability in which the nonuniform a priori symbol probability initializes the calculation. Another receiver is based on linear filtering where expectation propagation provides a Gaussian approximation of the posteriori probability of each symbol. This receiver structure is represented by a factor graph and we detail the derivation of messages exchanging between adjacent nodes. The Bayesian equalization in each EP iteration brings unacceptable computational burden. An efficient block-wise matrix inversion strategy is proposed to tackle this problem, significantly reducing the computational complexity with little performance loss. Simulation results show that the proposed algorithms remarkably outperform LMMSE solutions and traditional EP based algorithms. Proposed matrix inversion strategy can also be used to improve the performance of other filter-type solutions.",,2020,10.1109/ACCESS.2020.3037807,https://ieeexplore.ieee.org/document/9257501
ieee:9247226,journal,Information-Optimum Approximate Message Passing for Quantized Massive MIMO Detection,⬜ 미선별,,"Liwen Wang, Takumi Takahashi, Shinsuke Ibi, Seiichi Sampei","We propose an information-optimum approximate message passing (AMP) for quantized massive multi-input multi-output (MIMO) signal detection. A well-known strategy for realizing low-complexity and high-accuracy massive multi-user detection (MUD) is AMP-based belief propagation (BP). However, when internal operations are conducted with double-precision arithmetic, large memory occupancy and severe processing delay are inevitable in the actual massive MIMO implementation. To address this issue, we replace all operations with a simple look-up table (LUT) search where all messages exchanged between each iteration process are unsigned integers. That is, the proposed signal detection is performed using only simple integer arithmetic. The LUT is designed offline using an information-bottleneck (IB) method, and the probability distribution of messages at each iteration step is required for determining the quantization threshold tracked by discrete density evolution (DDE). Computer simulations demonstrate the validity of the IB LUT-based AMP in terms of bit error rate (BER) performance and memory occupancy. The proposed method allows quantizing the AMP detector with fewer bits while maintaining similar performances, such as that of a typical AMP with double-precision.",,2020,10.1109/ACCESS.2020.3035726,https://ieeexplore.ieee.org/document/9247226
ieee:9110795,journal,Sub-Nyquist Spectrum Sensing of Sparse Wideband Signals Using Low-Density Measurement Matrices,⬜ 미선별,,"Yash Vasavada, Chandra Prakash","The problem of wideband spectrum sensing/sampling in the sub-Nyquist domain is solved in this paper using sparse (low-density) binary-valued measurement matrices. Key objectives are (i) to achieve an efficient compression ratio, and (ii) improve the signal reconstruction performance. We propose a novel RF front-end with parallel branches that we have called Low-Density Wideband Converter (LDWC). We show that the LDWC implements a binary Low-Density Parity Check (LDPC) matrix as the compressive sensing (CS) measurement matrix. We evaluate, using an Information-Theoretic approach, the asymptotic bound on the required number of LDWC parallel branches for sparsity detection. We develop two new belief propagation (BP) algorithms that operate on the Tanner graph of the CS measurements. We have derived the first algorithm by assuming independence among the variable nodes (VNs) of the Tanner graph. For the second method, we have accounted for the joint probability distribution of the VNs. Analytical and simulated performance results prove the concepts of the LDWC and the proposed BP algorithms and quantify the attainment of objectives (i) and (ii) stated above.",,2020,10.1109/TSP.2020.3000637,https://ieeexplore.ieee.org/document/9110795
ieee:9208768,journal,Information Transmission Schemes Based on Adaptive Coded Modulation for UAV Surveillance Systems With Satellite Relays,⬜ 미선별,,"Rui Xue, Mingfei Zhao, Huaiyu Tang","To expand their search range, unmanned aerial vehicles (UAVs) used for surveillance employ satellites as relays to forward monitoring data to the UAV's command and control centers. With updated sensors, the amount of UAV detection data increases sharply, and the demand for bandwidth and transmission rates increase continuously. In this paper, the Ka-band is introduced to the satellite system as a solution instead of the Ku, C and other bands. Highly robust constant coded modulations (CCMs), such as the binary low-density parity-check (LDPC) and the coded quadrature phase shift keying (QPSK) are adopted to handle poor channel conditions caused by rain attenuation, which lead to a waste of spectral efficiency, especially in poor weather conditions; Adaptive Coded Modulation (ACM) can relieve the problems detailed above. Aiming at the problem mentioned above, we have proposed two different transmission schemes for two typical scenarios, including high quality of service (QoS) and high throughput service. The first is the so called automatic repeat request (ARQ)+ACM (target bit error rate (BER) algorithm) for high QoS, which means ARQ and ACM are employed by UAV-satellite links and satellite-center links, respectively. The second, denoted as coded cooperation (CC)+ACM (the maximum throughput algorithm) for high throughput services, designates that CC is employed for UAV-satellite links and ACM is employed for satellite-center links. Simulation results show that the ARQ+ACM scheme achieves higher spectral efficiency than CCM in cases that keep the BER below 10-5, and the CC+ACM scheme attains 3 to 7.5 times the spectral efficiency of CCM.",,2020,10.1109/ACCESS.2020.3027737,https://ieeexplore.ieee.org/document/9208768
