ID,Type,Title,Status,Reason,Authors,Abstract,Categories,Published,DOI,PDF URL
ieee:9078867,journal,Compressed Sensing Using Binary Matrices of Nearly Optimal Dimensions,⬜ 미선별,,"M. Lotfi, M. Vidyasagar","In this paper, we study the problem of compressed sensing using binary measurement matrices and ℓ1-norm minimization (basis pursuit) as the recovery algorithm. We derive new upper and lower bounds on the number of measurements to achieve robust sparse recovery with binary matrices. We establish sufficient conditions for a column-regular binary matrix to satisfy the robust null space property (RNSP) and show that the associated sufficient conditions for robust sparse recovery obtained using the RNSP are better by a factor of (3√3)/2 ≈ 2.6 compared to the sufficient conditions obtained using the restricted isometry property (RIP). Next we derive universal lower bounds on the number of measurements that any binary matrix needs to have in order to satisfy the weaker sufficient condition based on the RNSP and show that bipartite graphs of girth six are optimal. Then we display two classes of binary matrices, namely parity check matrices of array codes and Euler squares, which have girth six and are nearly optimal in the sense of almost satisfying the lower bound. In principle, randomly generated Gaussian measurement matrices are “order-optimal.” So we compare the phase transition behavior of the basis pursuit formulation using binary array codes and Gaussian matrices and show that (i) there is essentially no difference between the phase transition boundaries in the two cases and (ii) the CPU time of basis pursuit with binary matrices is hundreds of times faster than with Gaussian matrices and the storage requirements are less. Therefore it is suggested that binary matrices are a viable alternative to Gaussian matrices for compressed sensing using basis pursuit.","Sparse matrices, Compressed sensing, Random variables, Null space, Manganese, Phase measurement, Bipartite graph",2020,10.1109/TSP.2020.2990154,https://ieeexplore.ieee.org/document/9078867
ieee:9151370,journal,Near-Instantaneously Adaptive Multi-Set Space-Time Shift Keying for UAV-Aided Video Surveillance,⬜ 미선별,,"Y. Zhang, C. Xu, I. A. Hemadeh, M. El-Hajjar, L. Hanzo","Unmanned Aerial Vehicles (UAV) are more suitable for surveillance systems than their traditional stationary counterparts. To meet the associated demanding video compression requirements, the H.265/High Efficiency Video Coding (HEVC) codec is invoked. Its scalable video coding extension is capable of supporting diverse video resolutions by encoding the video clips captured into multiple layers, namely the Base Layer (BL) and several Enhancement Layers (EL). In this treatise, we propose a multi-functional Multiple-Input Multiple-Output (MIMO) transceiver relying on Multi-Set Space-Time Shift Keying (MS-STSK) for UAV-aided near-instantaneously adaptive layered video streaming, which is capable of promptly varying the throughput as a function of both the estimated channel quality as well as of the UAV mobility, while maintaining near-flawless video quality. Additionally, we invoke EXtrinsic Information Transfer (EXIT) charts for characterizing our Unequal Error Protection (UEP) based video transceiver with the aid of near-capacity channel coding. Some of the perceptually less important ELs may have to be dropped during instances of low channel quality to retain the robustness of the transmitted video stream when a low-throughput MIMO configuration is activated. The simulation results show that our proposed UEP assisted adaptive system is capable of attaining the best Y-Peak SNR (PSNR) performance in comparison to both its non-adaptive and Equal Error Protection (EEP) counterparts.","Streaming media, MIMO communication, Unmanned aerial vehicles, Transceivers, Forward error correction, Error correction codes, Adaptive systems",2020,10.1109/TVT.2020.3012208,https://ieeexplore.ieee.org/document/9151370
ieee:8764507,journal,Efficient Mobile Video Streaming via Context-Aware RaptorQ-Based Unequal Error Protection,⬜ 미선별,,"H. Chen, X. Zhang, Y. Xu, Z. Ma, W. Zhang","Mobile video streaming systems typically apply the forward error correction (FEC) at the application layer to cope with packet-level transmission errors, which complements the bit-level correction mechanisms at the physical layer. However, most existing works fail to exploit the block-level dependencies in both intra and interframe coding modes of a single-layer compressed video, and thus are less efficient for the prevailing H.264/AVC and/or H.265/HEVC compatible single-layer video application. To this end, we propose a low-complexity FEC, i.e., context-aware RaptorQ (CA-RQ) with unequal error protection (UEP), to improve the error recovery performance of the singlelayer mobile video streaming, through incorporating the blocklevel dependencies in the compressed video data. We use a packet-level video transmission distortion model that considers the dependencies in both spatial and temporal domains, to quantify the importance of video packets within a group of pictures (GoP). The compressed video packets are categorized and grouped into several classes according to their importance to construct the CA-RQ code with the UEP property. We provide a theoretical analysis on redundancy allocation bounds to demonstrate the superior performance of proposed CA-RQ over the standard RaptorQ code. In the meantime, extensive simulations have shown that our scheme not only offers much better subjective visual quality with less than 50% additional redundant symbols as compared to the Macroblock-Based UEP (MB-UEP) scheme, but also outperforms the MB-UEP and classical equal error protection (EEP)-based schemes, by a 0.45%'5.71% and 0.94%'6.78% margin, respectively, in reconstructed quality evaluated using the structural similarity (SSIM) index, across a reasonable range of redundancy proportions.","Forward error correction, Redundancy, Error correction codes, Mobile video, Encoding",2020,10.1109/TMM.2019.2928497,https://ieeexplore.ieee.org/document/8764507
ieee:8955784,journal,Super-Sparse On-Off Division Multiple Access: Replacing Repetition With Idling,⬜ 미선별,,"G. Song, K. Cai, Y. Chi, J. Guo, J. Cheng","A very low-complexity on-off division multiple access (ODMA) scheme is proposed for K-user non-orthogonal multiple access (NOMA) systems. At the transmission side, each user employs the same length-m channel code whose coded bits, after modulation, are sent in a random time-hopping manner. Specifically, m coded bits are randomly scheduled and sent using n time slots with n≫m, i.e., only m slots are used for signal transmission and the other n- m slots are idle. The slot selection, referred to as an on-off pattern, is unique to each user, and it is the only means of user separation. Consequently, at each time slot only a very few users (i.e., 2 or 3) may simultaneously access the channel, leading to a super-sparse access system. Due to the sparse access property, a very low-complexity iterative multi-user decoding method can be implemented on an almost tree-like factor graph. Compared with existing iteratively decodable code division multiple access (CDMA) schemes, such as sparse-CDMA and interleave division multiple access (IDMA), ODMA does not rely on repetition (spreading) or user interleaving. In fact, we show that in using extrinsic information transfer (EXIT) analysis and simulation, idling is more effective than repetition in terms of enhancing the multi-user iterative decoding performance. By replacing repetition with idling, a remarkable multi-user decoding performance gain is achieved and, at the same time, the decoding complexity is significantly reduced.","Iterative decoding, NOMA, Multiaccess communication, Decoding, Complexity theory, Modulation, Indexes",2020,10.1109/TCOMM.2020.2965522,https://ieeexplore.ieee.org/document/8955784
ieee:9076031,journal,An Uplink SCMA Codebook Design Combining Probabilistic Shaping and Geometric Shaping,⬜ 미선별,,"C. Jiang, Y. Wang","Sparse Code Multiple Access (SCMA) is a promising non-orthogonal multiple access scheme owning to the shaping gain of its multi-dimensional codebook. Most of the existing designs of the codebook are based on geometric shaping (GS), while probabilistic shaping (PS) has important advantages in increasing channel capacity and reducing bit error rate. In this paper, an uplink SCMA codebook optimization algorithm which combines PS and GS is proposed. The algorithm adopts the bare bones particle swarm optimization algorithm based on maximizing the AMI. Based on the non-equiprobable codebook, a message passing algorithm with non-equalprobable distribution is introduced as the multiuser detection algorithm for SCMA scheme. We theoretically analyze the superiority of the codebooks combining PS and GS over others in terms of the average mutual information (AMI). Simulation results show that our proposed codebooks outperform the reference GS based codebooks under different overloading, different channels and different codebook sizes, and with the increase of overloading or codebook sizes, the gains are greater, which is up to 2.1dB gain in terms of block error rate performance. This observation also validates the theoretical analysis based on the AMI.","Uplink, Probabilistic logic, Optimization, NOMA, Multiuser detection, Quadrature amplitude modulation, Probability distribution",2020,10.1109/ACCESS.2020.2989448,https://ieeexplore.ieee.org/document/9076031
ieee:9145757,journal,A Novel Chip Pulse Employed by Ranging Code Based on Simultaneous Transmitting CPM Modulation and PN Ranging in Inter-Satellite Links of GNSS,⬜ 미선별,,"R. Xue, T. Wang, H. Tang","The construction of a navigation constellation with inter-satellite links (ISLs) has become one of the important development trends for new-generation global navigation satellite systems (GNSSs), and ISLs currently realize navigation and communication functions through separate low-rate omnidirectional telemetry, tracking, command and high-rate data service channels, respectively. If the above two functions are integrated into one channel, this will result in simplification of the onboard equipment, improvement of the electromagnetic compatibility, power consumption reduction and frequency resources savings, and we speculate that autonomous navigation will be achieved by ISLs with navigation and communication fusion. In this paper, a system capable of simultaneous high-data rate communication transmission and precision ranging is investigated, and a specific scheme is introduced by combining continuous phase modulation (CPM) and a pseudonoise (PN) ranging code denoted as CPM + PN. The chip pulse is one of the key factors to design the ranging code, which not only affects the ranging performance but also influences the properties of the CPM + PN scheme, such as its spectral characteristics, communication reliability, and acquisition time. To consider the above performance indexes, a new chip pulse based on a normally distributed wave is proposed. Theoretical analysis and simulation results show that compared to square-wave and half-sine wave cases, the normally distributed wave attains great advantages in the ranging accuracy and communication reliability, which become more notable with reasonable selection of the energy distribution index. Moreover, the proposed chip pulse achieves a similar acquisition time as the traditional wave. As a result, the normally distributed wave can be used as a better alternative to the ranging chip pulse for the CPM + PN waveform.","Distance measurement, Modulation, Reliability, Global navigation satellite system, Transmitters, Parity check codes",2020,10.1109/ACCESS.2020.3010835,https://ieeexplore.ieee.org/document/9145757
ieee:9206113,journal,Reduced-Complexity Low-Latency Logarithmic Successive Cancellation Stack Polar Decoding for 5G New Radio and Its Software Implementation,⬜ 미선별,,"L. Xiang, S. Zhong, R. G. Maunder, L. Hanzo","An efficient Fast logarithmic successive cancellation stack (Log-SCS) polar decoding algorithm is proposed along with its software implementation using single instruction multiple data (SIMD) style processing. Quantitatively, we reduce the decoding complexity by 50% on average, while simultaneously attaining a decoding latency that is only 21% of that of the state-of-the-art Fast successive cancellation list (SCL) polar decoder's software implementation. This is achieved without any loss of error correction performance by applying simplified path-metric (PM) computations for the rate-0, rate-1 and repetition sub-graphs of the proposed Fast Log-SCS decoder. Furthermore, a software implementation of the 32-bit fixed-point Fast Log-SCS polar decoder is conceived for x86 processors, which maintains the same block error ratio (BLER) as the floating-point Log-SCS polar decoder. Additionally, our software implementation is accelerated using SIMD instructions by relying on 512-bit Advanced Vector Extensions (AVX-512) and recursive template meta-programming for the first time, achieving a parallelism of 16, which makes it eminently suitable for the low-latency requirements of software-defined radio systems.","Decoding, Polar codes, Parallel processing, Complexity theory, Program processors",2020,10.1109/TVT.2020.3026915,https://ieeexplore.ieee.org/document/9206113
ieee:9146525,journal,Probabilistic Shaping in Time-Frequency-Packed Terabit Superchannel Transmission,⬜ 미선별,,"M. Jana, L. Lampe, J. Mitra, W. Jin, K. Law","To combine the individual benefits of probabilistic-shaping (PS) and time-frequency-packing (TFP), we consider for the first time PS-TFP wavelength-division multiplexing (WDM) superchannels. However, TFP introduces inter-symbol interference (ISI) and/or inter-carrier interference (ICI). Moreover, the presence of reconfigurable optical add-drop multiplexers in the fiber links may further degrade the system performance. In this letter, we efficiently handle such challenges to present PS-TFP superchannels enabling Terabit-per-second data rates. For this, we perform a joint ISI and ICI channel estimation in tandem with turbo equalization to mitigate the interference. We investigate optimizing the parameters in the shaping and packing dimensions to achieve a desired target spectral efficiency. We show through our numerical results that such an optimized PS-TFP transmission leads up to 1.2 dB performance improvement over an unshaped Nyquist WDM system under similar conditions.","Interference, Channel estimation, Gain, Wavelength division multiplexing, Parity check codes, Equalizers, Time-frequency analysis",2020,10.1109/LPT.2020.3011628,https://ieeexplore.ieee.org/document/9146525
ieee:9170632,journal,Non-Binary Constrained Codes for Two-Dimensional Magnetic Recording,⬜ 미선별,,"B. Dabak, A. Hareedy, R. Calderbank","The two-dimensional magnetic recording (TDMR) technology promises storage densities of 10 Tbits/in2. However, when tracks are squeezed together, a bit stored in the two-dimensional (TD) grid suffers inter-symbol interference (ISI) from adjacent bits in the same track and inter-track interference (ITI) from nearby bits in the adjacent tracks. A bit is highly likely to be read incorrectly if it is isolated in the middle of a  $3 \times 3$  square, surrounded by its complements, horizontally and vertically. We improve the reliability of TDMR systems by designing TD constrained codes that prevent these square isolation patterns. We exploit the way TD read heads operate to design our codes, and we focus on TD read heads that collect signals from three adjacent tracks. We represent the two-dimensional square isolation constraint as a one-dimensional constraint on an alphabet of eight non-binary symbols. We use this new representation to construct a non-binary lexicographically-ordered constrained code where one third of the input information bits are unconstrained. Our TD constraint codes are capacity-achieving, and the data protection is achieved with redundancy less than 3% and at modest complexity.","Magnetic recording, Magnetic heads, Interference, Complexity theory, Redundancy, Encoding, 6G mobile communication",2020,10.1109/TMAG.2020.3017511,https://ieeexplore.ieee.org/document/9170632
ieee:9112205,journal,Shared Hybrid ARQ With Incremental Redundancy (SHARQ IR) in Overloaded MIMO Systems to Support Energy-Efficient Transmissions,⬜ 미선별,,"M. Kashif, M. Iqbal, Z. Ullah, T. Dagiuklas, S. Sarwar, Z. Ul-Qayyum, M. Safyan","Multiple Input and Multiple Output is a technology through which data are transmitted over the channel through multiple antennas. However, during its deployment and implementation, some pragmatic issues arise such as interference, multipath fading and noise leading to potential packet losses and consume substantial energy. To address such issues, Hybrid ARQ transmissions provide effective means for error correction, especially in a noisy wireless channel. More often few bits in packets are found to be in error and it is unnecessary to use the entire MIMO channel for retransmission to correct these errors. Hence, this paper proposes a novel approach, i.e., Shared Hybrid ARQ (SHARQ IR) using the piggyback technique in an overloaded MIMO system where the transmitting antennas are more than the receiving antennas. Additionally, the concept of a simple retransmission method is used to transform an overloaded MIMO system into either the critically loaded or under loaded MIMO systems. Simulation results outperform the contemporary approaches through reduced BER and 20% throughput gain. Such improvements have the potential to support energy-efficient transmissions for encouraging green IoT applications.","MIMO communication, Kernel, Wireless communication, Throughput, Receivers, Internet of Things, Complexity theory",2020,10.1109/ACCESS.2020.3001146,https://ieeexplore.ieee.org/document/9112205
ieee:9152055,journal,IEEE 802.11be Wi-Fi 7: New Challenges and Opportunities,⬜ 미선별,,"C. Deng, X. Fang, X. Han, X. Wang, L. Yan, R. He, Y. Long, Y. Guo","With the emergence of 4k/8k video, the throughput requirement of video delivery will keep grow to tens of Gbps. Other new high-throughput and low-latency video applications including augmented reality (AR), virtual reality (VR), and online gaming, are also proliferating. Due to the related stringent requirements, supporting these applications over wireless local area network (WLAN) is far beyond the capabilities of the new WLAN standard - IEEE 802.11ax. To meet these emerging demands, the IEEE 802.11 will release a new amendment standard IEEE 802.11be - Extremely High Throughput (EHT), also known as Wireless-Fidelity (Wi-Fi) 7. This article provides the comprehensive survey on the key medium access control (MAC) layer techniques and physical layer (PHY) techniques being discussed in the EHT task group, including the channelization and tone plan, multiple resource units (multi-RU) support, 4096 quadrature amplitude modulation (4096-QAM), preamble designs, multiple link operations (e.g., multi-link aggregation and channel access), multiple input multiple output (MIMO) enhancement, multiple access point (multi-AP) coordination (e.g., multi-AP joint transmission), enhanced link adaptation and retransmission protocols (e.g., hybrid automatic repeat request (HARQ)). This survey covers both the critical technologies being discussed in EHT standard and the related latest progresses from worldwide research. Besides, the potential developments beyond EHT are discussed to provide some possible future research directions for WLAN.","Throughput, Wireless fidelity, Bandwidth, IEEE 802.11 Standard, Media Access Protocol, MIMO communication, Wireless communication",2020,10.1109/COMST.2020.3012715,https://ieeexplore.ieee.org/document/9152055
ieee:9094248,journal,SRAM Radiation Hardening Through Self-Refresh Operation and Error Correction,⬜ 미선별,,"M. S. M. Siddiqui, S. Ruchi, L. Van Le, T. Yoo, I. -J. Chang, T. T. -H. Kim","In Space applications, the scaling of transistors has made integrated circuits (ICs) more susceptible to soft errors, caused by radiation strikes. When a soft error causes a bit flip in a memory device, this event is referred to as a Single Event Upset (SEU). Since SEU errors degrade system performance and eventually lead to system failure, the design of radiation-resilient memory is substantial. This paper presents a radiation resilient SRAM with a self-refresh scheme for lowering the number of errors in each row below a threshold number. The proposed self-refresh operation reads out the stored data and performs single error correction using a simple algorithm during its hold/idle mode. A 4KB SRAM test chip in 65nm CMOS technology demonstrates a significant reduction in errors with the self-refresh operation. When the SRAM test chip was exposed to accelerated proton radiation with an energy level of 39.38 MeV, the self-refresh scheme reduces the number of uncorrectable errors by 25× and 8× lesser for the fluence of 9.82×1011 particles/cm2 and 49.1 × 1011 particles/cm2, respectively.","SRAM cells, Single event upsets, Error correction codes, Integrated circuits, Error correction, Materials reliability",2020,10.1109/TDMR.2020.2994769,https://ieeexplore.ieee.org/document/9094248
ieee:8861117,journal,On Single-Antenna Rayleigh Block-Fading Channels at Finite Blocklength,⬜ 미선별,,"A. Lancho, T. Koch, G. Durisi","This article concerns the maximum coding rate at which data can be transmitted over a noncoherent, single-antenna, Rayleigh block-fading channel using an error-correcting code of a given blocklength with a block-error probability not exceeding a given value. A high-SNR normal approximation of the maximum coding rate is presented that becomes accurate as the signal-to-noise ratio (SNR) and the number of coherence intervals L over which we code tend to infinity. Numerical analyses suggest that the approximation is accurate at SNR values above 15dB and when the number of coherence intervals is 10 or more.","Encoding, Signal to noise ratio, Coherence, Dispersion, Fading channels, Wireless communication, Receivers",2020,10.1109/TIT.2019.2945782,https://ieeexplore.ieee.org/document/8861117
ieee:9151948,journal,Notice of Violation of IEEE Publication Principles: Construction of GC-Balanced DNA With Deletion/Insertion/Mutation Error Correction for DNA Storage System,⬜ 미선별,,"T. Xue, F. C. M. Lau","Synthetic deoxyribonucleic acid (DNA) is a good medium for storing digital data for a long period due to its achievable high data storage density and outstanding longevity. However, synthesizing and sequencing DNA sequences in a DNA storage system are prone to a wide variety of errors, including insertion, deletion and mutation errors. At the same time, it is known that DNA sequences with 50% GC content are less susceptible to errors. This paper presents the construction of a GC-balanced DNA sequence with error correction capability. A systematic single insertion/deletion/substitution error correction code is first proposed and then used to design a GC-balanced scheme for synthesizing DNA sequences. With the proposed method, DNA sequences with exactly 50% GC content are constructed. Such DNA sequences not only have the maximum endurance to errors, but are able to correct both insertion/deletion and mutation of the nucleotide bases. The decoding procedures for the sequences are described and can readily be used in practice. Simulation results show that the proposed GC-balanced DNA sequences can correct base errors adequately.;Notice of Violation of IEEE Publication Principles <br><br>""Construction of GC-Balanced DNA With Deletion/Insertion/Mutation Error Correction for DNA Storage System,"" <br>by Tianbo Xue and Francis Lau <br>in IEEE Access, vol. 8, pp. 140972-140980, 2020 <br><br> After careful and considered review of the content and authorship of this paper by a duly constituted expert committee, this paper has been found to be in violation of IEEE’s Publication Principles. <br><br>This paper contains significant portions of text from the paper cited below that were reused without attribution. <br><br>“Linear-Time Encoders for Codes Correcting a Single Edit for DNA-Based Data Storages” <br>by Y. M. Chee, H. M. Kiah, and T. T. Nguyen, <br>in the Proceedings of the IEEE International Symposium on Information Theory (ISIT), Jul. 2019. <br><br> “Optimal Codes Correcting a Single Indel / Edit for DNA-Based Data Storage” <br> by K. Cai, Y. M. Chee, R. Gabrys, H. M. Kiah, and T. T. Nguyen <br> in arXiv, arXiv:1910.06501, Oct. 2019. <br><br>",,2020,10.1109/ACCESS.2020.3012688,https://ieeexplore.ieee.org/document/9151948
