ID,Type,Title,Authors,Abstract,Categories,Published,DOI,PDF URL,Status
ieee:5898071,conference,On the Capacity of the Underwater Acoustic Communication Channel under Realistic Assumptions,"Jean-Michel Passerieux, Francois-Xavier Socheleau, Christophe Laot","The capacity of the underwater acoustic communication (UAC) channel is addressed under a comprehensive set of assumptions: time-varying multi-paths channel, modeled as a doubly-spread frequency-selective Ricean channel with known statistical properties, actual realization of the channel unkown to the transmitter and receiver, constraints on transmit power (averaged and/or peak) and available frequency bandwidth. The exact channel capacity under such general assumptions is still unknown. Therefore, upper and lower bounds of this capacity are given, and then numerically assessed and discussed for a few typical shallow water UAC channels. It is shown that, as long as the theoretical channel capacity is considered, transmission with spectral efficiency higher than often now (e. g. 2 to 3 bits/sec/Hz) appears as a reasonable objective in typical UAC channels, providing SNR about 15 to 20 dB. In other respects, for a given available averaged transmit power, large peak-to-averaged-power-ratio (PAPR) is also shown to be highly desirable, since it significantly reduces the capacity loss due to the channel uncertainty.",,27-29 Apri,,https://ieeexplore.ieee.org/document/5898071,new
ieee:5873604,conference,Robust image transmission with OFDM over an AWGN channel,"Naglaa F. Soliman, Abd Alhamid A. Shaalan, Mohammed M. Fouad","In this paper a new scheme is proposed for progressive image transmission over coded Orthogonal Frequency Division Multiplexing (OFDM) system with Low Density Parity Check Coding (LDPC). Trigonometric transforms are used in this scheme for improving the performance of the OFDM systems and reducing the Peak-to-Average Power Ratio (PAPR) of OFDM signal. It improves the error resilience ability and transmission efficiency for progressive image transmission over Additive White Gaussian Noise (AWGN) channel. The Set Partitioning In Hierarchical Trees (SPIHT) algorithm is used for source coding of the images to be transmitted. In the proposed scheme the transmit data sequence of the OFDM signal after Inverse Fast Fourier Transform (IFFT) is grouped into in-phase and in-quadrature components, then each component is transformed using either the Discrete Cosine Transform (DCT) or the Discrete Sine Transform (DST). The simulation results show that adding the DST to the system improves the visual quality of reconstructed images and reduces the PAPR of OFDM signal more than the DCT.",,26-28 Apri,10.1109/NRSC.2011.5873604,https://ieeexplore.ieee.org/document/5873604,new
ieee:5783633,conference,A low-complexity LDPC decoder architecture for WiMAX applications,"Yu-Luen Wang, Yeong-Luh Ueng, Chian-Lien Peng, Chung-Jay Yang","In this paper, we present a low-complexity decoder architecture for WiMAX low-density parity-check (LDPC) codes based on a unified task processor. Memory access is accomplished through routing networks with fixed interconnections and memory address generators, which are quite simple due to the quasi-cyclic structure of the LDPC codes. In order to increase the decoding throughput, the check-node and variable-node operations are performed concurrently, and a modified layered decoding is employed. Based on this architecture, we implemented a full-mode WiMAX codec in a 90-nm process. This codec achieves an encoding (decoding) throughput of 960 Mb/s (240 Mb/s) and occupies an area of 0.679 mm2.",,25-28 Apri,10.1109/VDAT.2011.5783633,https://ieeexplore.ieee.org/document/5783633,new
ieee:5783634,conference,A macro-layer level fully parallel layered LDPC decoder SOC for IEEE 802.15.3c application,"Zhixiang Chen, Xiao Peng, Xiongxin Zhao, Qian Xie, Leona Okamura, Dajiang Zhou, Satoshi Goto","In this paper, we propose an ultra high-throughput LDPC decoder SOC to fulfill the requirement of IEEE 802.15.3c standard. By implementing a macro-layer fully parallel architecture, our proposed decoder takes only 4 clock cycles to finish one layered decoding iteration. Interconnection complexity problem introduced by high-parallel decoding is nicely solved by proposed reusable message permutation networks utilizing the features of code PCM. Critical path is shortened by applying frame-level pipeline decoding. A 65 nm CMOS chip is fabricated to verify the proposed architecture. Measured at 1.2 V, 400 MHz and 10 iterations the proposed decoder achieves a data throughput 6.72 Gb/s and consumes a power 537.6 mW with an energy efficiency 8.0 pJ/bit·iter.",,25-28 Apri,10.1109/VDAT.2011.5783634,https://ieeexplore.ieee.org/document/5783634,new
ieee:5893825,conference,Non-uniform signal constellation for iteratively decoded bit interleaved coded modulation (BICM-ID) with convolution and LDPC codes,"Tarek Arafa, Wolfgang Sauer-Greff, Ralph Urbansky","Bit interleaved coded modulation with iterative demapping and decoding (BICM-ID) is an effective technique to achieve high spectral efficiency with performance close to capacity limits. However, the use of non-uniform signal constellation following a Gaussian distribution instead of conventional equiprobable signaling provides a further improvement, i.e. shaping gain. In this paper, we investigate the effect of nonuniform constellation on the performance of BICM-ID systems with different forward error correction (FEC) coding schemes such as convolution code and low-density parity-check (LDPC) code as outer code. Simulation results show that the non-uniform constellations can offer a shaping gain up to 0.21 dB.",,25-27 Apri,10.1109/INNOVATIONS.2011.5893825,https://ieeexplore.ieee.org/document/5893825,new
ieee:5893817,conference,Successive iterative decoding of Reed Solomon codes using cryptographic hash codes as parity,"Obaid Ur Rehman, Natasa Zivic","Coding theory and Cryptography have common roots. Both the fields were introduced by Claude Shannon in his legendary work. The applications of both the fields are however quite different and therefore not significant research work has previously been done to investigate the connection between the both. In this work, those applications that require security in the form of cryptographic hash codes are considered and this cryptographic hash code is used as a means to improve the decoding results of concatenated Convolutional/Reed Solomon codes. Using the message digest, the results of concatenated decoding are enhanced and vice versa i.e. using the concatenated codes, the errors in the message digest are minimized. It is also demonstrated that a coding gain is achieved in both the cases.",,25-27 Apri,10.1109/INNOVATIONS.2011.5893817,https://ieeexplore.ieee.org/document/5893817,new
ieee:5929799,conference,Performance analysis of hybrid-ARQ systems with LDPC codes,"Onural Çimenler, Mehmet Şafak","The bit error probability, delay and throughput of a hybrid-ARQ system based on LDPC is studied. The system performance is presented as a function of the packet length, maximum number of retransmissions, the number of iterations and decoding and combining strategies. Simulation results show that the proposed algorithm leads to improved system performance in different operating conditions.",,20-22 Apri,10.1109/SIU.2011.5929799,https://ieeexplore.ieee.org/document/5929799,new
ieee:5931272,conference,Nonhomogeneous LDPC Codes and Their Application to Encrypted Communication,"Kuen-Tsair Lay, Chin-Ho Hou, Lun-Chung Peng","Given a parity check matrix (PCM) H, its associated low-density parity-check (LDPC) code is the solution space of the homogeneous system of linear equations Hx = 0. In this paper, we propose to adopt the solutions to Hx = b (a nonhomogeneous system of linear equations) as the code words, where b is a nonzero vector and is called the code's target syndrome. We use the term ""nonhomogeneous LDPC (abbreviated as NH-LDPC) codes"" to refer to the codes obtained this way. In particular, we propose a systematic NH-LDPC coding scheme. We show that the PCM needs to possess some properties for the systematic NH-LDPC encoding to work. The decoding of NH-LDPC codes is almost the same as the decoding of homogeneous (i.e. conventional) LDPC codes (i.e. by sum-product algorithm and iterative decoding), only with slight modification. As an example of practical application, we propose to use the NH-LDPC codes in encrypted data transmission, where the target syndrome b is used as the secret key (available only to legitimate users) for encryption and decryption. One problem is that, even without the knowledge of b, an illegitimate user can still demodulate a codeword's systematic part, albeit with a much higher error probability than legitimate ones. To counter this problem, a descrambler is incorporated at the receiver to magnify the effect of the errors from demodulation so that the illegitimate user can not obtain intelligible information content. Simulations show that the proposed joint coding-encryption scheme works well as long as the channel signal-to-noise ratio (SNR) is properly controlled to lie within a specific range.",,18-20 Apri,10.1109/CMC.2011.107,https://ieeexplore.ieee.org/document/5931272,new
ieee:5931249,conference,High Performance LDPC Decoder on CELL BE for WiMAX System,"Juntao Zhao, Ming Zhao, Haibin Yang, Jianwen Chen, Xiang Chen, Jing Wang","Low-density parity-check (LDPC) codes are widely used in many radio systems due to its superior performance and Software Defined Radio (SDR) is an emerging paradigm of the wireless communication system design due to its good flexibility and adaptability. However, LDPC decoding is computationally intensive and the implementation of it on software in a parallel way is quite challenging due to the characteristics of LDPC decoding and structures of software. In this paper, we presented an efficient software implementation of the LDPC decoder using the Parallel Code Block Decoding mode for the WiMAX SDR base band system on IBM CELL Broadband Engine (BE). With a single Synergistic Processor Element (SPE) running at 3.2GHz, the implemented LDPC decoder can achieve a throughput up to 1.71 Mbps. With eight SPEs working in parallel, the decoder can obtain the throughput more than 13Mbps, which can meet the WiMAX system requirement at 5MHz bandwidth mode.",,18-20 Apri,10.1109/CMC.2011.117,https://ieeexplore.ieee.org/document/5931249,new
ieee:5931243,conference,A High-Efficiency LDPC Encoder with Optimized Backtracking Algorithm,Zhibin Zeng,A new LDPC encoder is presented for CMMB in this paper. The encoder uses based on RU method embodies high-efficiency by using the optimized backtracking algorithm. Simulation shows that this method decreases the complexity of encoding and calculation significantly. Implementation of the LDPC encoder for CMMB achieves more efficient encoding rate.,,18-20 Apri,10.1109/CMC.2011.81,https://ieeexplore.ieee.org/document/5931243,new
ieee:5768233,conference,A time-saving algorithm for constructing QC-LDPC codes based on PEG algorithm,"Gong Ping, Huang Liqun","We propose a new algorithm based on PEG algorithm to construct high-girth quasi-cyclic low-density parity check (QC-LDPC) codes. Before our improved algorithm in introduction, we depict the general algorithm based on PEG algorithm to construct QC - LDPC code, if necessary to eliminate the short cycles, that would bring in cycles-search. When code length of basic matrix is not too long, the algorithm is feasible, but with the code length growth, cycles-search will bring large of calculation and time-consuming sharply. Therefore we put forward an improved method by using the specific relation of basic matrix rows to replace traditional cycles-search, effectively eliminates short cycles, and largely reduces the time complexity at the same time. Through the simulation analysis, the performance can also be comparable with random constructed LDPC codes.",,16-18 Apri,10.1109/CECNET.2011.5768233,https://ieeexplore.ieee.org/document/5768233,new
ieee:5768345,conference,The comparative analysis of LDPC and RS code,"Youan Xiao, Chunling Luo, Chao Yang","LDPC code and RS code are error-correcting codes which are researched much more at present, and in the two-dimensional bar code's applications the error correction code plays an important role. In order to accurately identify the two-dimensional bar code, error-correcting code's performance should be further enhanced. There is a simple introduction of the LDPC decoder based on BP algorithm and decoding algorithm for RS, and it gives MATLAB simulations in different iterations while in the same code length and code rate for LDPC code and RS code. Simulation results show that the greater the number of iterations the better the LDPC decoding performance, and the more errors can be rectified; based on the same code length and rate of the cases and less than 512 yards long, LDPC decoding performance is significantly higher than the RS code. It can be seen that LDPC code can do better than the RS codes on identifying two-dimensional bar code, and the information which we want can be reproduced clearly.",,16-18 Apri,10.1109/CECNET.2011.5768345,https://ieeexplore.ieee.org/document/5768345,new
ieee:5768183,conference,Diversity combining techniques for LDPC coded FFH/BFSK system over Rayleigh fading channel,"Jingke Dai, Daoxing Guo, Jingming Hu","Diversity combining is the pivotal technique in fast frequency hopping spread spectrum systems for combating partial-band interference and channel fading. A new suboptimal diversity combining technique, called Rayleigh Generalized Maximum-Likelihood Ratio Test (R_GMLRT), is proposed to mitigate the effect of jamming and fading. Based on the characteristic of signal distributing probability for the flat Rayleigh fading channel, the combining is carried out after obtaining the statistic maximum values of signal, interference and noise power. In this combining technique, the interference duty factor is needed, whereas a prior information of signal, interference or noise power is not required, and no channel or power resource is occupied, neither. The computer simulation results show, the anti-interference performance of R_GMLRT outperforms the traditional suboptimal combining techniques in existence. Especially, about 1dB gain is achieved when the interference exists on the whole spectrum band, which means it is quite fit for the flat Rayleigh fading channel with only background warm-noise.",,16-18 Apri,10.1109/CECNET.2011.5768183,https://ieeexplore.ieee.org/document/5768183,new
ieee:5782617,conference,FPGA implementation of two very low complexity LDPC decoders,"J. Castiñeira Moreira, M. Rabini, C. González, C. Gayoso, L. Arnone","Low-Density Parity-Check (LDPC) codes are very efficient error control codes that are being considered as part of many next generation communication systems. In this paper FPGA implementations of two low complexity decoders are presented. These two implementations operate over any kind of parity check matrix, (including those randomly generated, structurally generated, either systematic or non systematic) and can be parametrically performed for any code rate k/n. The proposed implementations are both of very low complexity, because they operate using only sums, subtracts and look-up tables. One of these decoders offers the advantage of not requiring the knowledge of the signal-to-noise ratio of the channel, as it usually happens to most of decoders for LDPC codes.",,13-15 Apri,10.1109/SPL.2011.5782617,https://ieeexplore.ieee.org/document/5782617,new
ieee:5764622,conference,Group coding of RF tags to verify the integrity of group of objects,"Yuki Sato, Jin Mitsugi, Osamu Nakamura, Jun Murai","RFID is an essential technology to uniquely identify physical objects. In many practical business processes using RFID, we check not only individual objects but also check if there is no missing objects and no extra objects in a group of objects. While individual objects identifications are done by using RFID, group verifications are usually done by looking up a shipping list or corresponding EDI data which require a network connection. In this paper, we propose “group coding of RF tags” by which we can verify the integrity of a group of objects just by writing additional data in RF tags' memory. The additional data is computed from unique IDs of objects that belong to the group. We propose fundamental and general group codings. With the fundamental group coding, we can check if the integrity of a group of objects is preserved or not. It is a parity check of hashes of unique IDs in a group. We also propose general group coding by extending the fundamental group coding. With the general group coding, we can estimate the number of missing objects if the integrity of a group is not verified. The strength of the missing number estimation can be controlled by the size of data written to RF tags. It can be considered as a Low Density Parity Check (LDPC) in physical objects. The theory of group coding is confirmed by a numerical simulation and an experiment. It is shown by the simulation and experiment that we can detect 10 missing RF tags out of 20 RF tags with 99.5% reliability by writing 96-bit data into each RF tags besides its 96-bit unique ID.",,12-14 Apri,10.1109/RFID.2011.5764622,https://ieeexplore.ieee.org/document/5764622,new
ieee:5767883,conference,"Mining large graphs: Algorithms, inference, and discoveries","U Kang, Duen Horng Chau, Christos Faloutsos","How do we find patterns and anomalies, on graphs with billions of nodes and edges, which do not fit in memory? How to use parallelism for such terabyte-scale graphs? In this work, we focus on inference, which often corresponds, intuitively, to “guilt by association” scenarios. For example, if a person is a drug-abuser, probably its friends are so, too; if a node in a social network is of male gender, his dates are probably females. We show how to do inference on such huge graphs through our proposed HADOOP Line graph Fixed Point (HA-LFP), an efficient parallel algorithm for sparse billion-scale graphs, using the HADOOP platform. Our contributions include (a) the design of HA-LFP, observing that it corresponds to a fixed point on a line graph induced from the original graph; (b) scalability analysis, showing that our algorithm scales up well with the number of edges, as well as with the number of machines; and (c) experimental results on two private, as well as two of the largest publicly available graphs - the Web Graphs from Yahoo! (6.6 billion edges and 0.24 Tera bytes), and the Twitter graph (3.7 billion edges and 0.13 Tera bytes). We evaluated our algorithm using M45, one of the top 50 fastest supercomputers in the world, and we report patterns and anomalies discovered by our algorithm, which would be invisible otherwise.",,11-16 Apri,10.1109/ICDE.2011.5767883,https://ieeexplore.ieee.org/document/5767883,new
ieee:5781901,conference,Mobility in Ku and Ka bands: the Eutelsat's point of view,"E. Feltrin, J. Freixe, E. Weller","Eutelsat plays a key role in the provision of mobile services over geosynchronous satellites. Starting with narrowband services for land transports, through broadband maritime service until the most recent IP and multimedia services on board high speed means of transport (trains and airplanes), Eutelsat is present in this market for several years, as services provider or just supplying capacity. This paper gives a technical overview, based on the Eutelsat's experience, of the evolution the mobility via satellite is having. The references are to the existing services in Ku and those planned to be deployed in Ka band.",,11-15 Apri,,https://ieeexplore.ieee.org/document/5781901,new
ieee:5928824,conference,On-Demand based wireless resources trading for Green Communications,"Wenchi Cheng, Xi Zhang, Hailin Zhang, Qiang Wang","The purpose of Green Communications is to reduce the energy consumption of the communication system as much as possible without compromising the quality of service (QoS) for users. An effective approach for Green Wireless Communications is On-Demand strategy, which scales power consumption with the volume and location of user demand. Applying the On-Demand Communications model, we propose a novel scheme-Wireless Resource Trading, which characterizes the trading relationship among different wireless resources for a given number of performance metrics. According to wireless resource trading relationship, different wireless resources can be consumed for the same set of performance metrics. Therefore, to minimize the energy consumption for given performance metrics, we can trade the other type of wireless resources for the energy resource under the demanded performance metrics. Based on the wireless resource trading relationship, we derive the optimal energy-bandwidth and energy-time wireless resource trading relationship for green wireless communications. We also develop an adaptive trading strategy by using different bandwidths or different delays for different transmission distances with available bandwidths and acceptable delay bounds in wireless networks. Our conducted simulations show that the energy consumption of wireless networks can be significantly reduced with our proposed wireless resources trading scheme.",,10-15 Apri,10.1109/INFCOMW.2011.5928824,https://ieeexplore.ieee.org/document/5928824,new
