ID,Type,Title,Authors,Abstract,Categories,Published,DOI,PDF URL,Status
ieee:6077622,journal,Design of good QC-LDPC codes without small girth in the p-plane,"Lingjun Kong, Yang Xiao","A construction method based on the p-plane to design high-girth quasi-cyclic low-density parity-check (QC-LDPC) codes is proposed. Firstly the good points in every line of the p-plane can be ascertained through filtering the bad points, because the designed parity-check matrixes using these points have the short cycles in Tanner graph of codes. Then one of the best points from the residual good points of every line in the p-plane will be found, respectively. The optimal point is also singled out according to the bit error rate (BER) performance of the QC-LDPC codes at last. Explicit necessary and sufficient conditions for the QC-LDPC codes to have no short cycles are presented which are in favor of removing the bad points in the p-plane. Since preventing the short cycles also prevents the small stopping sets, the proposed construction method also leads to QC-LDPC codes with a higher stopping distance.",,April 2011,10.3969/j.issn.1004-4132.2011.02.001,https://ieeexplore.ieee.org/document/6077622,new
ieee:5639060,journal,A High-Throughput LDPC Decoder Architecture With Rate Compatibility,"Kai Zhang, Xinming Huang, Zhongfeng Wang","This paper presents a high-throughput decoder architecture for rate-compatible (RC) low-density parity-check (LDPC) codes which supports arbitrary code rates between the rate of mother code and 1. Puncturing techniques are applied to produce different rates for quasi-cyclic (QC) LDPC codes with dual-diagonal parity structure. Simulation results show that our selected puncturing scheme only introduces the BER performance degradation of less than 0.2 dB, compared with the dedicated codes for different rates specified in the IEEE 802.16e (WiMax) standard. Subsequently, parallel layered decoding architecture (PLDA) is employed for high-throughput decoder design. While the original PLDA is lack of rate flexibility, the problem is solved gracefully by incorporating the puncturing scheme. As a case study, an RC-LDPC decoder based on the rate-1/2 WiMax LDPC code is implemented in the CMOS 65-nm process. The clock frequency is 1.1 GHz, and the synthesis core area is 1.96 mm$^{2}$. The decoder can achieve an input throughput of 1.28 Gb/s at ten iterations and supports any rate between 1/2 and 1.",,April 2011,10.1109/TCSI.2010.2089551,https://ieeexplore.ieee.org/document/5639060,new
ieee:5730557,journal,Lowering the Error Floor of LDPC Codes Using Cyclic Liftings,"Reza Asvadi, Amir H. Banihashemi, Mahmoud Ahmadian-Attari","Cyclic liftings are proposed to lower the error floor of low-density parity-check (LDPC) codes. The liftings are designed to eliminate dominant trapping sets of the base code by removing the short cycles which are part of the trapping sets. We derive a necessary and sufficient condition for the cyclic permutations assigned to the edges of a cycle ξ of length l(ξ) in the base graph such that the inverse image of ξ in the lifted graph consists of only cycles of length strictly larger than l(ξ). The proposed method is universal in the sense that it can be applied to any LDPC code over any channel and for any iterative decoding algorithm. It also preserves important properties of the base code such as degree distributions, and in some cases, the code rate. The constructed codes are quasi-cyclic and thus attractive from a practical point of view. The proposed method is applied to both structured and random codes over the binary symmetric channel (BSC). The error floor improves consistently by increasing the lifting degree, and the results show significant improvements in the error floor compared to the base code, a random code of the same degree distribution and block length, and a random lifting of the same degree. Similar improvements are also observed when the codes designed for the BSC are applied to the additive white Gaussian noise (AWGN) channel.",,April 2011,10.1109/TIT.2011.2110150,https://ieeexplore.ieee.org/document/5730557,new
ieee:5699415,journal,Noise Adaptive LDPC Decoding Using Particle Filtering,"Shuang Wang, Lijuan Cui, Samuel Cheng, Yan Zhai, Mark Yeary, Qiang Wu","Belief propagation (BP) is a powerful algorithm to decode low-density parity check (LDPC) codes over additive white Gaussian noise (AWGN) channels. However, the traditional BP algorithm cannot adapt efficiently to the statistical change of SNR in an AWGN channel. This paper proposes an adaptive scheme that incorporates a particle filtering (PF) algorithm into the BP based LDPC decoding process. The proposed scheme is capable to perform online estimation of time-varying SNR at the bit-level and enhance the BP decoding performance simultaneously.",,April 2011,10.1109/TCOMM.2011.011811.090309,https://ieeexplore.ieee.org/document/5699415,new
ieee:5715839,journal,Message-Wise Unequal Error Protection Based on Low-Density Parity-Check Codes,"Chen Gong, Guosen Yue, Xiaodong Wang","We propose a practical message-wise unequal error protection (UEP) scheme using low-density parity-check (LDPC) codes, where one or more special messages are more protected than other ordinary messages. In contrast to the information theoretic cavity coding scheme, which discards the codewords of ordinary messages near those of special messages, the proposed coding scheme performs codeword flipping to separate the codewords of special and ordinary messages without discarding any codewords. To better distinguish the original and flipped codewords, the LDPC codes with all-odd degree check nodes are employed. The decoder performs message type detection and codeword flipping detection based on the unsatisfied check nodes in iterative decoding. We provide performance analysis for both the message type detection and the codeword flipping detection. Moreover, we provide an asymptotic analysis on the detection error exponent to reveal the relationship between the proposed practical coding scheme and the information theoretically optimal cavity coding. Simulation results are provided to show that the proposed practical message-wise UEP schemes offer capacity-approaching protections to both types of messages as if only one type is transmitted.",,April 2011,10.1109/TCOMM.2011.020411.090611,https://ieeexplore.ieee.org/document/5715839,new
ieee:5730602,journal,Exchange of Limits: Why Iterative Decoding Works,"Satish Babu Korada, Rüdiger L. Urbanke","We consider communication over binary-input memoryless output-symmetric channels using low-density parity-check codes and message-passing decoding. The asymptotic (in the length) performance of such a combination for a fixed number of iterations is given by density evolution. Letting the number of iterations tend to infinity we get the density evolution (DE) threshold, the largest channel parameter so that the bit error probability tends to zero as a function of the iterations. In practice, we often work with short codes and perform a large number of iterations. It is, therefore, interesting to consider what happens if in the standard analysis we exchange the order in which the blocklength and the number of iterations diverge to infinity. In particular, we can ask whether both limits give the same threshold. Although empirical observations strongly suggest that the exchange of limits is valid for all channel parameters, we limit our discussion to channel parameters below the DE threshold. Specifically, we show that as long as the message reliabilities are bounded and other technical conditions are met, the bit error probability vanishes up to a nontrivial threshold regardless of how the limit is taken. This threshold is equal to the DE threshold when the minimum degree of the variable nodes is at least five and strictly less than the DE threshold for smaller degrees.",,April 2011,10.1109/TIT.2011.2111730,https://ieeexplore.ieee.org/document/5730602,new
ieee:5730554,journal,Some Results on MAP Decoding of Non-Binary LDPC Codes Over the BEC,"Vishwambhar Rathi, Iryna Andriyanova","In this paper, the transmission over the binary erasure channel (BEC) using non-binary LDPC (NBLDPC) codes is considered. The concept of peeling decoder and stopping sets is generalized to NBLDPC codes. Using these generalizations, a combinatorial characterization of decoding failures of NBLDPC codes is given, under assumption that the Belief Propagation (BP) decoder is used. Then, the residual ensemble of codes resulted by the BP decoder is defined and the design rate and the expectation of total number of codewords of the residual ensemble are computed. The decoding failure criterion combined with the density evolution analysis helps us to compute the asymptotic residual degree distribution for NBLDPC codes. Our approach to compute the residual degree distribution on the check node side is not efficient as it is based on enumeration of all the possible connections on the check node side which satisfy the decoding failure criterion. So, the computation of the asymptotic check node side residual degree distribution and further part of our analysis is performed for NBLDPC codes over GF2m with m = 2 . In order to show that asymptotically almost every code in such LDPC ensemble has a rate equal to the design rate, we generalize the argument of the Maxwell construction to NBLDPC codes, defined over GF22. It is also observed that, like in the binary setting, the Maxwell construction, relating the performance of MAP and BP decoding holds in this setting.",,April 2011,10.1109/TIT.2011.2110930,https://ieeexplore.ieee.org/document/5730554,new
ieee:5715835,journal,Toward a Practical Scheme for Binary Broadcast Channels with Varying Channel Quality Using Dirty Paper Coding,"Gyu Bum Kyung, Chih-Chun Wang","We consider practical schemes for binary dirty-paper channels and broadcast channels (BCs) with two receivers and varying channel quality. With the BC application in mind, this paper proposes a new design for binary dirty paper coding (DPC). By exploiting the concept of coset binning, the complexity of the system is greatly reduced when compared to the existing works. Some design challenges of the coset binning approach are identified and addressed. The proposed binary DPC system achieves similar performance to the state-of-the-art, superposition-coding-based system while demonstrating significant advantages in terms of complexity and flexibility of system design. For binary BCs, achieving the capacity generally requires the superposition of a normal channel code and a carefully designed channel code with non-uniform bit distribution. The non-uniform bit distribution is chosen according to the channel conditions. Therefore, to achieve the capacity for binary BCs with varying channel quality, it is necessary to use quantization codes of different rates, which significantly increases the implementation complexity. In this paper, we also propose a broadcast scheme that generalizes the concept of binary DPC, which we term soft DPC. By combining soft DPC with time sharing, we achieve a large percentage of the capacity for a wide range of channel quality with little complexity overhead. Our scheme uses only one fixed pair of codes for users 1 and 2, and a single quantization code, which possesses many practical advantages over traditional time sharing and superposition coding solutions and provides strictly better performance.",,April 2011,10.1109/TCOMM.2011.020411.090340,https://ieeexplore.ieee.org/document/5715835,new
ieee:5730584,journal,Graph-Based Decoding in the Presence of ISI,"Mohammad H. Taghavi, Paul H. Siegel","We propose a new graph representation for ISI channels that can be used for combined equalization and decoding by linear programming (LP) or iterative message-passing (IMP) decoding algorithms. We derive this graph representation by linearizing the ML detection metric, which transforms the equalization problem into a classical decoding problem. We observe that the performance of LP and IMP decoding on this model are very similar in the uncoded case, while IMP decoding significantly outperforms LP decoding when low-density parity-check (LDPC) codes are used. In particular, in the absence of coding, for certain classes of channels, both LP and IMP algorithms always find the exact ML solution using the proposed graph representation, without complexity that is exponential in the size of the channel memory. This applies even to certain two-dimensional ISI channels. However, for some other channel impulse responses, both decoders have nondiminishing probability of failure as SNR increases. We provide analytical explanations for many of these observations. In addition, we study the error events of LP decoding in the uncoded case, and derive a measure that can be used to classify ISI channels in terms of the performance of the proposed detection scheme.",,April 2011,10.1109/TIT.2011.2110070,https://ieeexplore.ieee.org/document/5730584,new
ieee:10189051,journal,A New Network Coding Design for Reliable Video Multicast,"Song Xiao, Hui Wang, Chengke Wu","One challenge of adapting network coding for video transmission over an erasure network is the insufficient rank in the Global coefficient matrix (GCM) at the decoder. To reduce the impact of above problem on video transmission, a special design for the global coding matrix of Random linear network coding (RLNC) is proposed to realize reliable video multicast. Rate allocation is also presented to minimize the quality degradation of the video. Simulation results show the method can provide higher reconstructed quality of video compared with traditional store and forward method and conventional RLNC design for video transmission. The method can be applied to video multicast over different type of network such as P2P networks.",,April 2011,,https://ieeexplore.ieee.org/document/10189051,new
ieee:5704848,journal,The Capacity of Gaussian Orthogonal Multiple-Access Relay Channel,Junyun Cui,"This paper is concerned with the capacity of Gaussian orthogonal multi-access relay channel (OMARC) where multiple sources communicate with one destination in the presence of one relay. The achievability proof and converse for the capacity of Gaussian OMARC are given by ε-entropy-typical sequences and cut-set upper bound, respectively. The capacity of Gaussian OMARC is shown to have a max-flow min-cut interpretation.",,April 2011,10.1109/LCOMM.2011.012511.102075,https://ieeexplore.ieee.org/document/5704848,new
ieee:5733406,journal,An Error Resilient Video Coding Scheme Using Embedded Wyner–Ziv Description With Decoder Side Non-Stationary Distortion Modeling,"Yongsheng Zhang, Hongkai Xiong, Zhihai He, Songyu Yu, Chang Wen Chen","In this paper, we propose a generic error resilient video coding (ERVC) scheme using embedded Wyner-Ziv (WZ) description. At the encoder side, a joint source-channel R-D optimized mode selection (JSC-RDO-MS) algorithm with WZ-coded anchor frames is statistically studied and developed. Given a stationary first-order Markov Gaussian source, the proposed mode optimization is justified by an analysis of the RD impact on the WZ bit-rate. JSC-RDO-MS involves in the estimation of expected rate and distortion of WZ coding with the unavailable side information, and the WZ bit-rate of each coding mode is determined based on the error correction capability of the specific WZ codec. At the decoder side, an online correlation noise model between the source and the side-information is proposed with a mixture of Laplacians whose parameters are attained to reflect the coherence of the motion field of successive frames and the energy of prediction residual. Each mixture component represents the statistical distribution of prediction residuals, and the mixing coefficients represent the amount of errors in motion compensation. The proposed scheme achieves the so-called classification gain by exploiting the spatially non-stationary characteristics of the motion field and texture. Extensive experimental results show that the proposed WZ-ERVC scheme achieves a better overall RD performance than existing ERVC schemes, and the proposed modeling algorithm also significantly outperforms the conventional Laplacian model by up to 2 dB.",,April 2011,10.1109/TCSVT.2011.2129050,https://ieeexplore.ieee.org/document/5733406,new
ieee:5945639,conference,Reduced complexity of decoding algorithm for irregular LDPC codes using Split Row method,"R. El Alami, C. B. Gueye, M. Mrabti, M. Boussetta, M. Zouak",A reduced complexity LDPC decoding method for regular LDPC code is extended to irregular LDPC codes; we present in this paper a full description of this method and its benefits for various row weight and length code word. The Split-Row method makes column processing parallelism easier to exploit and significantly simplifies row processors. Simulation results over an additive white Gaussian channel show that the error performance of high row-weight codes with Split-Row decoding is within 0.3–0.5 dB of the Min-Sum algorithm.,,7-9 April ,10.1109/ICMCS.2011.5945639,https://ieeexplore.ieee.org/document/5945639,new
ieee:5941439,conference,Dynamic LDPC codes for nanoscale memory with varying fault arrival rates,"Shalini Ghosh, Patrick D. Lincoln","Modern state-of-the-art nanodevices exhibit remarkable electronic properties, but the current assembly techniques yield very high defect and fault rates. Static errors can be addressed at fabrication time by testing and reconfiguration, but soft errors are problematic since their arrival rates are expected to vary over the lifetime of a part. Usual designs consider error correcting codes that tolerate the maximum failure rate expected over the entire lifetime. In this paper, we propose using a special variant of low-density parity codes (LDPCs) - Euclidean Geometry LDPC (EG-LDPC) codes - to enable dynamic changes in the level of fault tolerance. EG-LDPC codes have high error correcting ability (for large words they can approach the optimal Shannon limit) and they are sparse (circuit implementation requires small fan-in). In addition, a special property of EG-LDPC codes enables us to dynamically adjust the error correcting capacity for improved system performance (e.g., lower power consumption) during periods of expected low fault arrival rate. We present a system architecture for nanomemory based on nanoPLA building blocks using EG-LDPCs, where the encoder/decoder could also have faults, and analyze the fault detection and correction capabilities considering dynamic fault tolerance.",,6-8 April ,10.1109/DTIS.2011.5941439,https://ieeexplore.ieee.org/document/5941439,new
ieee:5770393,conference,Parallelizing a Coarse Grain Graph Search Problem Based upon LDPC Codes on a Supercomputer,"Vivek S. Nittoor, Reiji Suda","Codes on graphs have become the most important way to reach channel capacity. A new problem for High Performance Computing has been constructed with this work. The graph search problem as posed in this work is the coarsest version of the problem which corresponds to the exhaustive search case. The coarse grain graph search (CGGS) problem chooses an optimal parity-check matrix, based on minimum value of BER objective function. Based upon the specified range of parity-check matrices and range of signal to noise ratio (SNR), the CGGS generates the parity-check matrices using the Modified PEG algorithm, performs LDPC encoding, adds noise to the encoder output, performs LDPC decoding, computes Bi terror rate (BER), and thus the BER objective function. The CGGS problem in its current implementation runs in an MPI implementation on the T2K supercomputer at The University Of Tokyo. Two scheduling strategies have been proposed, Generalized Max-Min pairing (GMMP) and random pairing(RP) scheduling algorithms have been proposed, and good parallel performance of CGGS over an MPI implementation on T2K has been achieved.",,3-7 April ,10.1109/PARELEC.2011.13,https://ieeexplore.ieee.org/document/5770393,new
ieee:5764437,conference,An information rate analysis of power line communications impaired by colored noise,Riccardo Pighi,"In this paper, the impact of colored noise on the ultimate performance limits of broadband single carrier power line communication (PLC) systems is analyzed in terms of information rate (IR). As a case study, the IR analysis is applied to a high voltage (HV) PLC channel affected by corona noise as a particular type of colored noise: in order to complete the theoretical results, the bit error rate (BER) performance of a state-of-the-art PLC system with few low-density parity-check (LDPC)-coded schemes are also considered.",,3-6 April ,10.1109/ISPLC.2011.5764437,https://ieeexplore.ieee.org/document/5764437,new
ieee:5929261,conference,Application of LDPC codes on the MIMO channel model based on the geometrical one-ring scattering model,"Milena M. Stojnic, Predrag N. Ivanis",In this paper we evaluate performances of multiple-input multiple-output (MIMO) systems based on the geometrical one-ring scattering channel model. Systems with two antennas at the both the base station (BS) and the mobile station (MS) side are analyzed. We also consider application of LDPC codes on the described MIMO channel model. Simulation results for bit error rate (BER) are given for different values of parameter k (measure of isotropic scattering) and normalized antenna spacing at the BS with and without application of LDPC codes.,,27-29 Apri,10.1109/EUROCON.2011.5929261,https://ieeexplore.ieee.org/document/5929261,new
ieee:5929223,conference,Analysis of error correcting codes for the secure storage of biometric templates,"Sandro Noto, Paulo Lobato Correia, Luís Ducla Soares","Error Correcting Codes (ECCs) are widely used today in combination with cryptographic hash functions in the design of biometric systems with secure template storage. The selected ECC strongly influences the performance of the system in terms of False Rejection Rate (FRR) and False Acceptance Rate (FAR) and, therefore, the choice of the code must be done very carefully. This paper presents an analysis of the ECC properties which affect the security and recognition performance of biometric systems, taking as starting point the genuine and impostor normalized Hamming Distance (HD) distributions resulting from intra- and inter-class comparisons. To illustrate the ECC properties relevant for this discussion, the performance of a secure iris verification system is studied. The ECC codes selected for testing are Low-Density Parity Check (LDPC) and Reed Solomon (RS) codes, since these are two of the most commonly used ECCs for secure biometric template storage systems and they have very different properties, which allows testing under a wide range of conditions.",,27-29 Apri,10.1109/EUROCON.2011.5929223,https://ieeexplore.ieee.org/document/5929223,new
ieee:5898001,conference,Unavoidable Cycles in Polynomial-Based Time-Invariant LDPC Convolutional Codes,"Hua Zhou, Norbert Goertz","Low-Density Parity-Check convolutional codes (LDPCccs) are very interesting for practical error-correction coding in wireless transmission as they have excellent performance and at the same time they allow for variable block size with low complexity encoding and decoding. As for all LDPC codes that are decoded by the sub-optimal (but highly efficient) Sum Product Algorithm, the cycles in the code graph are very important for the practical performance of the coding scheme. Time-invariant LDPCccs can be defined by a polynomial syndrome former (transposed parity-check matrix in polynomial form), that can be derived from corresponding Quasi-Cyclic (QC) LDPC block codes. Given the polynomial syndrome former with certain structures, unavoidable cycles with lengths ranging from 6 to 12 will be shown to exist.We provide some rules for designing good codes with respect to the shortest cycle in the code-graph, the girth of the code, which is a crucial parameter for its decoding performance.",,27-29 Apri,,https://ieeexplore.ieee.org/document/5898001,new
ieee:5929203,conference,Rotation matrices for OFDM transmission,"José Seguro, Paulo Gomes, Nuno Souto, Américo Correia, Rui Dinis","We consider signal space diversity based on Complex Rotation Matrices (CRM) known to provide good performance gains over uncorrelated Rayleigh fading channels. OFDM/OFDMA signals based on LTE-A parameters are combined with CRM, spatial multiplexing (MIMO), Turbo or LDPC codes. It is shown that CRM outperform RRM (Real Rotation Matrix), as well as HM (Hadamard Matrices). The gains are especially high for the uncoded case, but we still have noticeable gains in the coded case, especially for high code rates.",,27-29 Apri,10.1109/EUROCON.2011.5929203,https://ieeexplore.ieee.org/document/5929203,new
ieee:5898059,conference,Towards full-diversity joint network-channel coding for large networks,"Dieter Duyck, - Daniele Capirone, Michael Heindlmaier, Marc Moeneclaey","Network coding and cooperative channel coding have both proved their importance for cooperative communications in wireless networks. It has been shown that it is beneficial to perform both techniques jointly. However, no diversity analysis for this framework has been made. Furthermore, the network codes in the state of the art have weak points from a coding point of view. This paper proposes a new general technique to construct network codes as an integral part of the channel code. The diversity order of this framework is analysed. Simulation of the word error rate performance of the new proposed joint network-channel code illustrates the benefit of joint network-channel coding.",,27-29 Apri,,https://ieeexplore.ieee.org/document/5898059,new
