ID,Type,Title,Authors,Abstract,Categories,Published,DOI,PDF URL,Status
ieee:8693053,conference,Improving Short-Length LDPC Codes with a CRC and Iterative Ordered Statistic Decoding : (Invited Paper),"Wei Zhou, Michael Lentmaier",The following topics are dealt with: learning (artificial intelligence); optimisation; channel coding; neural nets; probability; statistical analysis; pattern classification; stochastic processes; 5G mobile communication; gradient methods.,,20-22 Marc,10.1109/CISS.2019.8693053,https://ieeexplore.ieee.org/document/8693053,new
ieee:8693049,conference,Protograph-Based LDPC Code Design for Probabilistic Shaping with On-Off Keying,"Alexandru Dominic Git, Balázs Matuz, Fabian Steiner","This work investigates protograph-based low-density parity-check (LDPC) codes for the additive white Gaussian noise (AWGN) channel with on-off keying (OOK) modulation. A non-uniform distribution of the OOK modulation symbols is considered to improve the power efficiency especially for low signal-to-noise ratios (SNRs). To this end, a specific transmitter architecture based on time sharing is propo...",,20-22 Marc,10.1109/CISS.2019.8693049,https://ieeexplore.ieee.org/document/8693049,new
ieee:8693058,conference,Discretized Density Evolution for Rate Compatible Modulation : Invited Presentation,"Mariano Eduardo Burich, Richard Demo Souza, Javier Garcia-Frias","In this paper, we develop, for the first time in the literature, a Density Evolution analysis of Rate Compatible Modulation (RCM), which is challenging due to the way symbols in RCM are generated as weighted sums of the input bits. We consider uniform and non-uniform memoryless binary sources. By allowing the weights to be real numbers, rather than integers as in previous work, we propose, for the...",,20-22 Marc,10.1109/CISS.2019.8693058,https://ieeexplore.ieee.org/document/8693058,new
ieee:8692862,conference,Binary Message Passing Decoding of Product Codes Based on Generalized Minimum Distance Decoding : (Invited Paper),"Alireza Sheikh, Alexandre Graell i Amat, Gianluigi Liva","We propose a binary message passing decoding algorithm for product codes based on generalized minimum distance decoding (GMDD) of the component codes, where the last stage of the GMDD makes a decision based on the Hamming distance metric. The proposed algorithm closes half of the gap between conventional iterative bounded distance decoding (iBDD) and turbo product decoding based on the Chase-Pyndi...",,20-22 Marc,10.1109/CISS.2019.8692862,https://ieeexplore.ieee.org/document/8692862,new
ieee:8692899,conference,Spatially Coupled LDPC Codes and the Multiple Access Channel,"Sebastian Cammerer, Xiaojie Wang, Yingyan Ma, Stephan ten Brink","We consider spatially coupled low-density parity-check (SC-LDPC) codes within a non-orthogonal interleave division multiple access (IDMA) scheme to avoid cumbersome degree profile matching of the LDPC code components to the iterative multi-user detector (MUD). Besides excellent decoding thresholds, the approach benefits from the possibility of using rather simple and regular underlying block LDPC ...",,20-22 Marc,10.1109/CISS.2019.8692899,https://ieeexplore.ieee.org/document/8692899,new
ieee:8717757,conference,Performance of Self-Corrected Min-Sum Decoding Algorithm for Decoders with Quantized Input,"Aleksei Kharin, Igor Volkov, Aleksei Ovinnikov, Evgeny Likhobabin, Vladimir Vityazev","In this paper we explore the Min-Sum decoding algorithm for LDPC codes with self-correction (SC-MS) modification and how it affects the error correction performance for quantized input data. Three levels of quantization are observed: 3-, 2- and 1-bit.It was shown that the self-corrected modification significantly improves the performance of Min-Sum decoding algorithm with quantized input in compar...",,20-22 Marc,10.1109/INFOTEH.2019.8717757,https://ieeexplore.ieee.org/document/8717757,new
ieee:8692830,conference,A Noncoherent Space-Time Code from Quantum Error Correction,"S. Andrew Lanham, Travis C. Cuvelier, Corey Ostrove, Brian La Cour, Granville Ott, Robert Heath","In this work, we develop a space-time block code for noncoherent communication using techniques from the field of quantum error correction. We decompose the multiple-input multiple-output (MIMO) channel into operators from quantum mechanics, and design a non-coherent space time code using the quantum stabilizer formalism. We derive an optimal decoder, and analyze the former through a quantum mecha...",,20-22 Marc,10.1109/CISS.2019.8692830,https://ieeexplore.ieee.org/document/8692830,new
ieee:8675716,standard,IEEE Approved Draft Standard for Broadband over Power Line Networks: Medium Access Control and Physical Layer Specifications Amendment: Enhancement for Internet of Things applications,,Physical (PHY) and media access control (MAC) layers of a broadband powerline communication technology called flexible channel wavelet PHY/MAC (FCW) for Internet of Things applications (IoTPLC) based on wavelet orthogonal frequency division multiplexing (wavelet OFDM) are specified in this amendment. Modes for operations in different channels (frequency bands) with different values of carrier spac...,,20 March 2,,https://ieeexplore.ieee.org/document/8675716,new
ieee:8742225,conference,Scaling the Fast x86 DVB-S2 Decoder to 1 Gbps,Eugene Grayver,Software implementation of LDPC decoders has been an active area of development for the last 10 years. Researchers have focused on implementing the computationally expensive algorithm on both GPPs and GPUs. A major leap in performance was reported in the groundbreaking paper by Bertrand le Gal [2]. This paper builds on the work in [2] by considering the scaling of that implementation on modern man...,,2-9 March ,10.1109/AERO.2019.8742225,https://ieeexplore.ieee.org/document/8742225,new
ieee:8742112,conference,Acquisition and tracking for communications between Lunar South Pole and Earth,"Dariush Divsalar, Marc Sanchez Net, Kar-Ming Cheung","In this paper we design and analyze an end-to-end communication system between a lander/rover on the surface of the lunar South Pole and an Earth station. The acquisition and tracking system is discussed in detail. The communication system on the lander or rover could be used for the Earth-to-Moon communication. To communicate to and from the lander/rover on the lunar South Pole, low and/or medium...",,2-9 March ,10.1109/AERO.2019.8742112,https://ieeexplore.ieee.org/document/8742112,new
ieee:8741917,conference,Proximity Link Telecommunication and Tracking Scenarios for a Potential Mars Sample Return Campaign,"Charles D. Edwards, Allen H. Farrington, Roy E. Gladden, Charles H. Lee, Robert E. Lock, Brian K. Muirhead, Austin Nicholas, Ryan C. Woolley, Orson Sutherland","A Mars Sample Return (MSR) campaign would involve a series of three flight missions to acquire and cache Mars samples, retrieve those samples and launch them into Mars orbit, and then capture these samples and return them to Earth. Relay communications would be crucial for supporting this campaign, characterized by multiple critical events, complex surface operations, and an on-orbit Mars rendezvo...",,2-9 March ,10.1109/AERO.2019.8741917,https://ieeexplore.ieee.org/document/8741917,new
ieee:8713725,conference,Error Correction Codes in Wireless Sensor Networks: A Systematic Literature Review,"Meriem Bettayeb, Sara Ghunaim, Nour Mohamed, Qassim Nasir","Wireless Sensor Networks (WSN) require reliable data transmission with constrained energy consumption, power dissipation and high performance to maximize sensor lifetimes. A specific Error Correction Code (ECC) cannot be adopted by different applications of WSN as the ECC depends on application requirements and network constraints. Therefore, choosing the optimum ECC for a WSN application is done ...",,19-21 Marc,10.1109/ICCSPA.2019.8713725,https://ieeexplore.ieee.org/document/8713725,new
ieee:8713752,conference,Performance of 5GNR with Interference Alignment,"Khawla A. Alnajjar, Mohamed El-Tarhuni","Recently, a New Radio (NR) structure has been proposed for fifth generation (5G) mobile radio systems to support higher data rates and low latency scenarios. In this paper, we investigate the performance of 5G New Radio (5GNR) using precoding for Interference Alignment (IA). The system is based on an OFDM structure following the NR scheme with zero forcing receiver. It is shown that with proper se...",,19-21 Marc,10.1109/ICCSPA.2019.8713752,https://ieeexplore.ieee.org/document/8713752,new
ieee:8729542,conference,Iterative Carrier Phase Recovery for MPSK Systems Based on Simplified EM Algorithm,"Xin Man, Dun Mao, Xiaohong Lin, Fei Xia","This letter deals with the problem of carrier phase recovery for low-density parity-check (LDPC) coded MPSK systems at low signal-to-noise ratios (SNR). By utilizing Taylor series expansion and the constant-envelope characteristic of PSK signals, we greatly simplify the expectation maximization (EM) algorithm to recover the carrier phase. The proposed method works with simple operations of phase s...",,15-17 Marc,10.1109/ITNEC.2019.8729542,https://ieeexplore.ieee.org/document/8729542,new
ieee:8729533,conference,Short Polar-coded Non-coherent Receiver,"Huangxia Xu, Chaofan Chen, Yanming Xue","Emergency communications will be the key to deal with natural or man-made emergencies. Their prerequisites are the short frame burst under limited resources, as well as reliable bit error rate (BER) performance in low signal to noise ratio (SNR). With respect to short codes, polar codes normally outperform Low Density Parity Check (LDPC) codes and convolutional codes, which makes them more suitabl...",,15-17 Marc,10.1109/ITNEC.2019.8729533,https://ieeexplore.ieee.org/document/8729533,new
ieee:8729289,conference,Research on Polarization Code Encoding and Decoding Algorithm Based on HARQ Technology,"Tingting Yu, Wei Nie","As a 5G control channel coding scheme, the polarization code can reach the Shannon limit theoretically. However, under the condition of medium and short code, the communicationeffect of polarization code is not ideal. To solve this problem, a de-coding based on HARQ technology is proposed. The algorithm adds feedback retransmission based on CA-SCL decoding, and retransmits some information bits by...",,15-17 Marc,10.1109/ITNEC.2019.8729289,https://ieeexplore.ieee.org/document/8729289,new
ieee:8877013,conference,Error correction using LDPC code for performance improvement in clipped and biased OFDM with direct detection over optical fiber,"Usha Choudhary, Vijay Janyani","Paper presents a performance comparison for DC-biased OFDM and clipped OFDM for unipolar transmission over optical fiber communication systems with forward error check encoder, LDPC (32400, 64800). Asymmetrically clipped OFDM is being studied intensively for possible future technology in a short range optical channel with low power applications as well as adaptive data rate allocation in network b...",,13-15 Marc,10.1109/IEMECONX.2019.8877013,https://ieeexplore.ieee.org/document/8877013,new
ieee:8672649,standard,IEEE Draft Standard for Information Technology--Telecommunications and Information Exchange Between Systems Local and Metropolitan Area Networks--Specific Requirements Part 11: Wireless LAN Medium Access Control (MAC) and Physical Layer (PHY) Specifications--Amendment: Enhanced Throughput for Operation in License-Exempt Bands Above 45 GHz,,"In this amendment to IEEE Std 802.11-2020, standardized modifications to both the IEEE 802.11 physical layer (PHY) and the IEEE 802.11 medium access control (MAC) sublayer are defined to enable at least one mode of operation capable of supporting a maximum throughput of at least 20 gigabits per second (measured at the MAC data service access point), while maintaining or improving the power efficie...",,12 March 2,,https://ieeexplore.ieee.org/document/8672649,new
