ID,Type,Title,Authors,Abstract,Categories,Published,DOI,PDF URL,Status
ieee:4024833,conference,A Comparative Study on Low-Cost Multiuser Detectors,"Lihai Liu, Li Ping","In this paper, we compare different low-cost detection techniques for multiple access systems. The per-user complexities of these techniques are independent of the number of users. We demonstrate that the chip extrinsic information (CEI) method achieves the best performance, and the a posteriori probability information (APPI) and bit extrinsic information (BEI) methods provide different tradeoffs ...",,11-15 June,10.1109/ICC.2006.255449,https://ieeexplore.ieee.org/document/4024833,new
ieee:4024907,conference,Cross Layer Designs for OFDMA Wireless Systems with Heterogeneous Delay Requirements,"David Shui Wing Hui, Vincent Kin Nang Lau, Wong Hing Lam","This paper investigates a cross layer scheduling scheme for OFDMA wireless system with heterogeneous delay requirements. Unlike most existing cross layer designs which take a decoupling approach, our design considers both queueing theory and information theory in modeling the system dynamics. The cross layer design is formulated as an optimization of total system throughput, subject to individual ...",,11-15 June,10.1109/ICC.2006.255507,https://ieeexplore.ieee.org/document/4024907,new
ieee:4024911,conference,Approaching MIMO-OFDM Capacity with Per Antenna Power and Rate Feedback,"Rui Zhang, John M. Cioffi, Ying-chang Liang","For block fading channls, the delay-limited capacity measures the maximum constant-rate achievable over all fading blocks under the availability of complete channel knowledge at both the transmitter and the receiver. In this paper, we consider constant-rate transmissions over MIMO-OFDM block fading channels, under the condition that the channel is known at the receiver but unknown at the transmitt...",,11-15 June,10.1109/ICC.2006.255511,https://ieeexplore.ieee.org/document/4024911,new
ieee:4024294,conference,A permutation decomposition based algorithm for the design of prunable interleavers for parallel turbo decoder architectures,"Libero Dinoi, Alberto Tarable, Sergio Benedetto","In this paper we propose a technique to implement in a parallel fashion a turbo decoder based on an arbitrary permutation, and to expand its interleaver in order to produce a family of prunable S-random interleavers suitable for parallel implementations. We show that the spread properties of the obtained interleavers are almost optimal and we prove by simulation that they are very competitive in t...",,11-15 June,10.1109/ICC.2006.254902,https://ieeexplore.ieee.org/document/4024294,new
ieee:4025139,conference,On the Fundamental Tradeoff of Spatial Diversity and Spatial Multiplexing of MISO/SIMO Links with Imperfect CSIT,"Albert W. C. Lim, Vincent K. N. Lau","Multiple antennas can be used for increasing the packet reliability (spatial diversity) or the spectral efficiency (spatial multiplexing) in wireless communication systems operating under a slow fading environment. Zheng and Tse showed that both types of gains can be simultaneously obtained for a given multiple antenna channel, but there is a fundamental tradeoff between spatial diversity and spat...",,11-15 June,10.1109/ICC.2006.255737,https://ieeexplore.ieee.org/document/4025139,new
ieee:4024147,conference,Baseband Transmission on Power Line Channels with LDPC Coset Codes,"Raju Hormis, Inaki Berenguer, Xiaodong Wang","High rate transmission over power lines imposes stringent requirements in coding and equalization, the chief impairments being severe signal attenuation and impulsive noise. Yet, transmission requirements over this medium have reached several Mbit/sec to compete with other types of access. In this paper, we propose a novel PAM-based coded modulation scheme that is well suited to meeting such const...",,11-15 June,10.1109/ICC.2006.254757,https://ieeexplore.ieee.org/document/4024147,new
ieee:4024303,conference,Maximum Likelihood Decoding of Codes on the Z-channel,"Angela Barbero, Pal Ellingsen, Susanna Spinsante, Oyvind Ytrehus","The aim of this paper is to extend some basic concepts related to the Maximum Likelihood decoding of codes on the Z-channel, which is a particular, but very important, example of an asymmetric channel. We study distance properties of linear codes over the Z-channel, in order to define a suitable metric for the implementation of a Maximum Likelihood decoder on the channel. A combinatorial expressio...",,11-15 June,10.1109/ICC.2006.254911,https://ieeexplore.ieee.org/document/4024303,new
ieee:4024432,conference,Joint Application of CCSDS File Delivery Protocol and Erasure Coding Schemes over Space Communications,"Tomaso De Cola, Harald Ernst, Mario Marchese","The rising demand for multimedia services even in hazardous environments, such as space missions and military theatres, and the consequent need of proper internetworking technologies have revealed the inapplicability of TCP/IP architectures and highlighted the importance of the communication features provided by the protocol architectures proposed by the Consultative Committee for Space Data Syste...",,11-15 June,10.1109/ICC.2006.254999,https://ieeexplore.ieee.org/document/4024432,new
ieee:4024678,conference,Influence of Pit-Shape Variation on the Decoding Performance for Two-Dimensional Optical Storage (TwoDOS),"Naveen Singla, Joseph A. O'Sullivan","We study the influence of the variation in the shape of the pits for the two-dimensional optical storage (TwoDOS) paradigm vis-à-vis the readback signal and decoding performance. The algorithm used for decoding is a message-passing based joint equalization and decoding algorithm proposed by Singla and O&#39;Sullivan (Intl. Symp. Info. Theory, Sept. 2005). The performance dependence of the algorithm on...",,11-15 June,10.1109/ICC.2006.255296,https://ieeexplore.ieee.org/document/4024678,new
ieee:4024200,conference,A Scalable Probing-based Approach for Congestion Detection using Message Passing,"Rajesh Narasimha, Souvik Dihidar, Chuanyi Ji, Steven W. McLaughlin",In this paper we consider the theoretical and practical management resources needed to reliably localize congested nodes/links and propose a solution based on decoding linear error control codes. We define the scalability of measurement-based network monitoring and relate this to the problem decoding of linear error control codes on a binary symmetric channel. Our main goal is to minimize the numb...,,11-15 June,10.1109/ICC.2006.254779,https://ieeexplore.ieee.org/document/4024200,new
ieee:4024307,conference,Multilevel Coding for Spectrally Efficient Noncoherent Optical Transmission,"Ivan B. Djordjevic, Bane Vasic",Transmitter and receiver configurations suitable for M-ary DPSK/differential QAM noncoherent optical transmission are proposed. It is shown that multilevel coding based on lowdensity parity-check codes as component codes is an efficient approach to achieve high-spectrally efficient noncoherent optical transmission. The multilevel coding scheme with 2 bits/s/Hz spectral efficiency based on block-ci...,,11-15 June,10.1109/ICC.2006.254915,https://ieeexplore.ieee.org/document/4024307,new
