ID,Type,Title,Authors,Abstract,Categories,Published,DOI,PDF URL,Status
ieee:4068518,conference,Iterative Decoding for the Concatenation of LDPC Codes and BCH Codes Based on Chase Algorithm,"Zhiping Shi, Liang Zhou, Hong Wen, Shaoqian Li","In this paper, an iterative joint decoding algorithm for low density parity check codes with BCH codes based on Chase algorithm is proposed. After a certain number of iterations, the soft output values delivered by belief propagation algorithm of LDPC codes are used as reliability values to perform Chase decoding of BCH codes. And BCH decoder also will return soft information to LDPC decoder as in...",,21-23 June,10.1109/ITST.2006.288749,https://ieeexplore.ieee.org/document/4068518,new
ieee:4068656,conference,Type II Hybrid-ARQ Schemes of LDPC Codes Based on Information-Nulling Rate-Compatible Algorithm,"Fei Zesong, Zhu Miao, Kuang Jingming","In this paper, information nulling (IN) type II HARQ protocol with low-density parity-check (LDPC) codes is presented. Incremental redundancy is created from partial null versions of the original information data using the same encoder/decoder structure. In comparison to the conventional rate-compatible type II HARQ schemes, the decoder architecture always operates at the highest code rate, thus e...",,21-23 June,10.1109/ITST.2006.288968,https://ieeexplore.ieee.org/document/4068656,new
ieee:4068638,conference,Image Transmission with High-Rate LDPC Codes in Multicarrier Systems,"Huo Yongqing, Peng Qicong, Shao Huaizong","Low-density parity-check (LDPC) codes have near Shannon performance and easy to implement, multicarrier modulation can achieve high spectral efficiency and resist the inter-symbol interference (ISI). In this paper, we explored three high rate LDPC codes in image transmission with multicarrier modulation. The simulation results show that the combination of multicarrier modulation and high rate LDPC...",,21-23 June,10.1109/ITST.2006.288950,https://ieeexplore.ieee.org/document/4068638,new
ieee:4068648,conference,Rate-Compatible LDPC Codes for Cross-Layer Design Combining of AMC with HARQ,"Yuling Zhang, Dongfeng Yuan",This paper proposes a cross-layer design combining of adaptive modulation and coding (AMC) with hybrid automatic repeat request (HARQ) based on rate-compatible low-density parity-check codes (RC-LDPC). First we investigate the puncturing pattern of RC-LDPC codes and prove that our puncturing pattern is as good as random puncturing. Then we apply RC-LDPC codes to cross-layer design combing AMC with...,,21-23 June,10.1109/ITST.2006.288960,https://ieeexplore.ieee.org/document/4068648,new
ieee:4068833,conference,A novel simple stopping criterion for the PCGC decoder,"Xu Xiaojian, Li Jin, Hu Hanying","In this paper, in order to degrade the computation complexity and storage of the iterative decoder of parallel concatenated LDPC (low-density parity-check) codes, we propose a novel stopping criteria by using of the mean of the magnitude of the extrinsic information. We verify our algorithms with Monte Carlo simulation, and the results proved that the proposed rules outperforms the other existing ...",,21-23 June,10.1109/ITST.2006.288892,https://ieeexplore.ieee.org/document/4068833,new
ieee:4673709,conference,Constructions of Euclidean Geometry LDPC Codes and Performance Analysis in MIMO-OFDM System,"Fangni Chen, Lei Shen, Shiju Li","In this paper, we introduce the history and basic characteristic of low density parity check codes, then emphasize on the construction of Euclidean geometry LDPC code and take it as the channel code into IEEE802.16d MIMO-OFDM system simulation and compare it with RS-CC codes. Finally we makes a conclusion that Euclidean geometry LDPC codes are strong competitors to FEC codes for error control in c...",,20-24 June,10.1109/IMSCCS.2006.203,https://ieeexplore.ieee.org/document/4673709,new
ieee:1652139,conference,Fault Tolerance of Tornado Codes for Archival Storage,"M. Woitaszek, H.M. Tufo",This paper examines a class of low density parity check (LDPC) erasure codes called Tornado codes for applications in archival storage systems. The fault tolerance of Tornado code graphs is analyzed and it is shown that it is possible to identify and mitigate worst-case failure scenarios in small (96 node) graphs through use of simulations to find and eliminate critical node sets that can cause To...,,19-23 June,10.1109/HPDC.2006.1652139,https://ieeexplore.ieee.org/document/1652139,new
ieee:1696346,conference,Fast and Reduced-Complexity Decoding Rule for qary LDPC Codes by Using the Duality Properties,"A. Ghaith, J. Boutros, Yi Yuan-Wu",The paper studies symbol-by-symbol maximum a posteriori (MAP) decoding algorithms for non binary codes over an extension field GF(q). This decoding rule minimizes the probability of symbol error over a time-discrete memory less channel by employing the dual code. It is shown that these algorithms meet all requirements needed for iterative decoding as the output of the decoder can be split into thr...,,19-21 June,10.1109/WIMOB.2006.1696346,https://ieeexplore.ieee.org/document/1696346,new
ieee:4015748,conference,A Service Provider's Approach for Improving Performance of Aggregate Voice-over-IP Traffic,"Camelia Al-Najjar, A. L. Narasimha Reddy","The emerging popularity and interest in Voice-over-IP (VoIP) has been accompanied by customer concerns about voice quality over these networks. The lack of an appropriate real-time capable infrastructure in packet networks along with the threats of denial-of service (DoS) attacks can deteriorate the service that these voice calls receive. Traditionally, each voice call employs its own end-to-end f...",,19-21 June,10.1109/IWQOS.2006.250465,https://ieeexplore.ieee.org/document/4015748,new
ieee:1689967,conference,HDL Library of Processing Units for an Automatic LDPC Decoder Design,"G. Falcao, M. Gomes, J. Goncalves, P. Faia, V. Silva","In this paper we propose an efficient and generic HDL library of processing units which are the key elements of a modular low-density parity check (LDPC) decoder design approach. General purpose, low complexity and high throughput bit node and check functional models are developed. Both full serial and parallel architectures are considered. Also, it is described an automatic HDL code generator for...",,12-15 June,10.1109/RME.2006.1689967,https://ieeexplore.ieee.org/document/1689967,new
ieee:4024289,conference,On a Construction Method of Irregular LDPC Codes Without Small Stopping Sets,"G. Richter, A. Hof","In this paper, we present a construction method based on the progressive edge-growth (PEG) algorithm to design irregular low-density parity-check (LDPC) codes without small stopping sets. We show how to choose the connections in the PEG algorithm when having multiple choices to connect a variable node with a check node. Since preventing small stopping sets also prevents a low minimum distance, our...",,11-15 June,10.1109/ICC.2006.254897,https://ieeexplore.ieee.org/document/4024289,new
ieee:4024302,conference,Performance of Concatenated Code with LDPC Code and RSC Code,"Satoshi Gounai, Tomoaki Ohtsuki, Toshinobu Kaneko","In this paper, we propose a concatenated code by combining a Recursive Systematic Convolutional (RSC) code with a Low-Density Parity-Check (LDPC) code. The proposed concatenated code is encoded in parallel by an RSC encoder and an LDPC encoder without interleavers between them. When decoding the proposed concatenated code, the information bits are decoded by two decoding algorithms, and soft infor...",,11-15 June,10.1109/ICC.2006.254910,https://ieeexplore.ieee.org/document/4024302,new
ieee:4024287,conference,On Gaussian Approximation for Density Evolution of Low-Density Parity-Check Codes,Minyue Fu,"This paper is concerned with density evolution for iterative decoding of low-density parity-check (LDPC) codes. We first study the problem of density evolution computation for regular LDPC codes. For this, we propose a simple computational algorithm based on the ergodicity theory. This method is shown to match very well with explicit calculations of density functions. The second problem we study i...",,11-15 June,10.1109/ICC.2006.254895,https://ieeexplore.ieee.org/document/4024287,new
ieee:4024300,conference,Improved Low-Density Parity-Check Codes for Burst Erasure Channels,"Enrico Paolini, Marco Chiani","In this work we deal with Low-Density Parity-Check (LDPC) codes under iterative message passing decoding algorithm, over channels introducing bursts of erasures. The burst erasure channel model we consider in this paper can be seen as an erasure channel based on a hidden Markov chain (HMC-EC). In order to characterize the channel, in the first part of the paper the expression of mutual information...",,11-15 June,10.1109/ICC.2006.254908,https://ieeexplore.ieee.org/document/4024300,new
ieee:4024288,conference,The Minimal Product Parity Check Matrix and Its Application,Morteza Esmaeili,"In decoding a linear block code C by iterative decoding algorithms, these algorithms are essentially applied on a graphical representation of C such as Tanner graph and factor graph. Due to the impact of the structure of these graphs on the performance of code, we consider minimal parity check matrices(matrices with minimum number of nonzero entries) of product codes. An algorithm constructing suc...",,11-15 June,10.1109/ICC.2006.254896,https://ieeexplore.ieee.org/document/4024288,new
ieee:4024820,conference,Combinatorial Union-Bound Analysis on the Concatenation of LDPC/Turbo Codes and Space-Time Codes over Fast Fading MIMO Channels,"Jingqiao Zhang, Heung-no Lee","A performance evaluation framework based on the maximum-likelihood (ML) union bound is proposed for the concatenated coding scheme where the outer linear block code, low-density parity-check (LDPC) or Turbo code, drives a sequence of inner space-time codes. The outer code can be partitioned in a combinatorial manner such that all codewords in one subset/subcode are associated with an identical pai...",,11-15 June,10.1109/ICC.2006.255436,https://ieeexplore.ieee.org/document/4024820,new
ieee:4024284,conference,Error Floors of LDPC Codes on the Binary Symmetric Channel,"Shashi Kiran Chilappagari, Sundararajan Sankaranarayanan, Bane Vasic","In this paper, we propose a semi-analytical method to compute error floors of LDPC codes on the binary symmetric channel decoded iteratively using the Gallager B algorithm. The error events of the decoder are characterized using combinatorial objects called trapping sets, originally defined by Richardson. In general, trapping sets are characteristic of the graphical representation of a code. We st...",,11-15 June,10.1109/ICC.2006.254892,https://ieeexplore.ieee.org/document/4024284,new
ieee:4024291,conference,Design of Efficiently-Encodable Rate-Compatible Irregular LDPC Codes,"Jaehong Kim, Aditya Ramamoorthy, Steven W. McLaughlin","We present a new class of irregular low-density parity-check (LDPC) codes for finite block length (up to a few thousand symbols). The proposed codes are efficiently encodable and have a simple rate-compatible puncturing structure. For block lengths on the order of n=1000 bits, the codes show good puncturing performance over a wide range of rates. The codes outperform optimized irregular LDPC codes...",,11-15 June,10.1109/ICC.2006.254899,https://ieeexplore.ieee.org/document/4024291,new
ieee:4024296,conference,Construction of Irregular LDPC Convolutional Codes with Fast Encoding,"Ali Emre Pusane, Kamil Sh. Zigangirov, Daniel J. Costello","We propose a novel code design technique for irregular LDPC convolutional codes. The constructed codes can be encoded continuously in real time with the help of a shift-register based encoder. For moderate values of the syndrome former memory, simulation results show that the constructed codes outperform LDPC block codes with comparable hardware (processor) complexity.",,11-15 June,10.1109/ICC.2006.254904,https://ieeexplore.ieee.org/document/4024296,new
ieee:4024376,conference,Bilayer LDPC Codes for the Relay Channel,"Peyman Razaghi, Wei Yu",This paper describes a methodology for efficient implementation of binning and block-Markov coding for the relay channel using powerful features of low-density parity-check (LDPC) codes. We devise bilayer LDPC codes to approach the theoretically promised rate of the decode-and-forward relaying strategy by incorporating relay-generated random linear paritybits in a specially designed bilayer graphi...,,11-15 June,10.1109/ICC.2006.255035,https://ieeexplore.ieee.org/document/4024376,new
ieee:4024312,conference,Soft-Output Decoding in Multiple-Head MTR Encoded Magnetic Recording Systems,"Nikola Duric, Miroslav Despotovic",We present an approach for the soft-output decoding in multiple-head maximum-transition-run (MTR) encoded digital magnetic recording systems. The log-likelihood ratio (LLR) algebra implementation in Boolean logic mappings has been used to propagate the soft-output information through the MTR decoder. MTR code is employed as inner code in concatenation with low-density parity-check (LDPC) in two-tr...,,11-15 June,10.1109/ICC.2006.254920,https://ieeexplore.ieee.org/document/4024312,new
ieee:4025046,conference,Performance of Channel Information Estimation Method Utilizing Parity Check Bits for Turbo Coded Multi-route Multi-hop Networks,"Tadahiro Wada, Abbas Jamalipour, Hiraku Okada, Kouji Ohuchi, Masato Saito","Recently, sensor networks have been drawing many attentions. The networks can be applicable to many communication systems such as emergency communications, intelligent transportation systems, and so on. They could have a multi-route multi-hop structure by the signal relaying via multiple sensor nodes. Since the wireless links have very severe condition for the communications, a method which can ma...",,11-15 June,10.1109/ICC.2006.255645,https://ieeexplore.ieee.org/document/4025046,new
ieee:4024394,conference,A Structured LDPC Code Construction for Efficient Encoder Design,"Jean-baptiste Dore, Marie-helene Hamon, Pierre Penard","Low-Density Parity Check codes have been widely investigated over the past few years, and construction of Low-Density Parity Check code enabling efficient implementation design represents one of the main topics of interest. This article proposes a new code family, based on a structures code construction with an inherent parallelism. This construction divides the parity check matrix into layers whi...",,11-15 June,10.1109/ICC.2006.254961,https://ieeexplore.ieee.org/document/4024394,new
ieee:4024290,conference,eIRA Codes for Coded Modulation Systems,"Giuseppe Durisi, Libero Dinoi, Sergio Benedetto",In this paper we discuss the design of linear time encodable extended irregular repeat-accumulate (eIRA) codes for bit-interleaved coded modulation (BICM) systems. We interpret eIRA codes as a particular instance of the recently introduced multi-edge type (MET) low-density parity-check (LDPC) codes. This allows us to take into account during the design step both the systematic nature of these code...,,11-15 June,10.1109/ICC.2006.254898,https://ieeexplore.ieee.org/document/4024290,new
ieee:4024286,conference,Trapping Sets in Irregular LDPC Code Ensembles,"Olgica Milenkovic, Emina Soljanin, Philip Whiting","Trapping sets represent subgraphs in the Tanner graph of a code that, for certain classes of channels, exhibit a strong influence on the height and point of onset of the error-floor. We compute the asymptotic normalized distributions of trapping sets in random, irregular, binary low-density parity-check (LDPC) code ensembles. Our derivations rely on techniques from large deviation theory and stati...",,11-15 June,10.1109/ICC.2006.254894,https://ieeexplore.ieee.org/document/4024286,new
ieee:4024698,conference,Wireless Image Transmission Using Rate-Compatible LDPC Codes,"Xiang Pan, Amir H. Banihashemi, Aysegul Cuhadar","In this paper, we propose a combined source/channel coding scheme for transmission of images over fading channels. The proposed scheme employs rate-compatible low-density parity-check (RC-LDPC) codes along with embedded image coders such as JPEG2000 (JP2K) and set partitioning in hierarchical trees (SPIHT). The assignment of channel coding rates to source packets is performed by a fast trellis-bas...",,11-15 June,10.1109/ICC.2006.255225,https://ieeexplore.ieee.org/document/4024698,new
ieee:4024293,conference,A Linear-Programming Approach to The Design of LDPC Codes for Non-Uniform Channels,Masoud Ardakani,"We propose a linear-programming approach to the design of low-density parity-check codes for non-uniform channels, i.e., when different bits of the codeword experience different channel parameters. Non-uniform channels are encountered in many communication systems, e.g., in a network that different packets are sent through parallel routes; in orthogonal frequency division multiplexing, where the c...",,11-15 June,10.1109/ICC.2006.254901,https://ieeexplore.ieee.org/document/4024293,new
ieee:4024370,conference,Low-Complexity Cooperative Coding for Sensor Networks using Rateless and LDGM Codes,"Andrew W. Eckford, Josephine P. K. Chu, Raviraj S. Adve","Given limitations with current technology, nodes in a sensor network have stringent energy and complexity constraints. This paper presents a scheme for cooperative error-control coding, using rateless and low-density generator-matrix codes, for sensor networks. Assuming knowledge of the source-relay channel quality, we show that the proposed scheme achieves good performance and a good energy trade...",,11-15 June,10.1109/ICC.2006.255029,https://ieeexplore.ieee.org/document/4024370,new
ieee:4025150,conference,Random Coding Union Bounds and Error Exponents for Concatenated MIMO Systems,"Jingqiao Zhang, Heung-no Lee","An assumption of random block codes is made for the closed-form derivation of union upper bounds. The random code works as the outer code for concatenation with the inner space-time modulation over the multi-input multi-output (MIMO) fading channels. From the union bound expression, we further obtain the closed-form expressions of error exponent and cut-off rate for MIMO channels. The error expone...",,11-15 June,10.1109/ICC.2006.255748,https://ieeexplore.ieee.org/document/4025150,new
ieee:4024285,conference,An IS Simulation Technique for Very Low BER Performance Evaluation of LDPC Codes,"Enver Cavus, Charles L. Haymes, Babak Daneshrad","We introduce an Importance Sampling (IS) method that successfully simulates the performance of Low density Parity Check (LDPC) Codes in an AWGN channel at very low bit error rates (BERs). By effectively finding and biasing bit node combinations that are the dominant sources of error events, called trapping sets, the developed technique provokes more frequent decoder failures. Consequently, fewer s...",,11-15 June,10.1109/ICC.2006.254893,https://ieeexplore.ieee.org/document/4024285,new
ieee:4024925,conference,Comparison between Convolutional and LDPC Code-based Turbo Frequency Domain Equalization,"Maryam Sabbaghian, David Falconer","This paper1 presents a Turbo Equalization system using soft interference cancellation in the frequency domain, in which the filter is updated during the iterations with respect to the soft information it receives from the decoder. Simulation results confirm that this method outperforms the suggested one in [4,ll] while it does not add much complexity to the system. We also investigate the effect o...",,11-15 June,10.1109/ICC.2006.255525,https://ieeexplore.ieee.org/document/4024925,new
ieee:4024339,conference,Approaching Capacity on Noncoherent Block Fading Channels with Successive Decoding,"Teng Li, Xiaowei Jin, Oliver M. Collins, Thomas E. Fuja","A receiver structure that uses decision feedback and successive decoding is proposed for a noncoherent channel with independent block fading. The transceiver employs a block interleaver to decompose the channel into a set of independent fading sub-channels. LDPC codes are used on each sub-channel, and the decoded data are fed back to help in channel estimation. Simulation results indicate that the...",,11-15 June,10.1109/ICC.2006.254947,https://ieeexplore.ieee.org/document/4024339,new
ieee:4024301,conference,Low Rate Concatenated Zigzag-Hadamard Codes,"Guosen Yue, W. K. Leung, Li Ping, Xiaodong Wang",We introduce a new class of low-rate error correction codes called concatenated zigzag Hadamard (ZH) codes which are specified by a highly structured zigzag graph with each segment being a Hadamard codeword. The ZH codes enjoy extremely simple encoding and very-low-complexity soft-input soft-output (SISO) decoding. We present an asymptotic performance analysis of the proposed codes using the extri...,,11-15 June,10.1109/ICC.2006.254909,https://ieeexplore.ieee.org/document/4024301,new
ieee:4024292,conference,On Raptor Codes,"Hossein Pishro-Nik, Faramarz Fekri","We introduce a construction of raptor codes to be used over symmetric channels. An important property of the proposed scheme is that unlike the previous construction of raptor codes, it allows to design codes that are approaching the capacity of the underlying channel in a rate-compatible way. We also show that for finite-length codes, the proposed construction outperforms the previous constructio...",,11-15 June,10.1109/ICC.2006.254900,https://ieeexplore.ieee.org/document/4024292,new
ieee:4024098,conference,CRC-Assisted Error Correction in a Convolutionally Coded System,"Renqiu Wang, Wanlun Zhao, Georgios B. Giannakis","In communication systems employing a serially concatenated cyclic redundancy check (CRC) code along with a convolutional code (CC), erroneous packets after CC decoding are usually discarded. The list Viterbi algorithm (LVA) and the iterative Viterbi algorithm (IVA) are two existing approaches capable of recovering erroneously decoded packets. We first propose an iterative log-MAP (ILM) algorithm i...",,11-15 June,10.1109/ICC.2006.254708,https://ieeexplore.ieee.org/document/4024098,new
ieee:4024848,conference,Design of Near-Optimal Coding Schemes for Adaptive Modulation with Practical Constraints,"Hari Sankar, Krishna R. Narayanan","We consider a system with parallel flat-fading subchannels for transmission of data, similar to a multicarrier system, where the sub-channel states are known perfectly to both the transmitter and the receiver. The results presented so far in literature for this system have only considered maximizing the sum-rate with Gaussian constellations which is not realizable in practice. In this paper, we co...",,11-15 June,10.1109/ICC.2006.255464,https://ieeexplore.ieee.org/document/4024848,new
ieee:4024299,conference,A new family of codes with high iterative decoding performances,"Iryna Andriyanova, Jean-pierre Tillich, Jean-claude Carlach",We investigate a new class of codes which is in a sense a hybrid between LDPC codes and turbo-codes. Some members of this new class have been shown to be asymptotically good and we conjecture that such a behavior holds for all classes of codes presented here. They all display excellent iterative decoding performances with no error floor at block error rates up to 10-6 for lengths of several thousa...,,11-15 June,10.1109/ICC.2006.254907,https://ieeexplore.ieee.org/document/4024299,new
ieee:4024375,conference,Iterative Network and Channel Decoding for the Two-Way Relay Channel,"Christoph Hausl, Joachim Hagenauer","We introduce an extension of the relay channel that we call two-way relay channel. The two-way relay channel consists of two users which want to communicate to each other with the help of one relay. We consider the time-division two-way relay channel without power control, where the broadcast channels are orthogonalized in time and where the two users and the relay use the same transmission power....",,11-15 June,10.1109/ICC.2006.255034,https://ieeexplore.ieee.org/document/4024375,new
ieee:4024642,conference,"Block (0, k) Codes Designed by Coded Bit Stuffing","A. V. Kuznetsov, E. M. Kurtas","Timing recovery in communication and storage systems requires the use of Run Length Limited (RLL) or (d,k) codes. A class of such codes is constructed by a method called coded bit stuffing. The proposed encoder does not change the main part of input data bits, and just places these bits into the code word &#34;as is&#34;. The remaining small part of data bits is encoded into a set of short nonzero words c...",,11-15 June,10.1109/ICC.2006.255260,https://ieeexplore.ieee.org/document/4024642,new
ieee:4024844,conference,A trellis-coded chaotic modulation scheme,"Eiji Okamoto, Yasunori Iwanami","Recently, a chaotic modulation has been proposed and attracts many researchers&#39; attention because of some properties such as noise-like signal, nonlinearity, and pseudo-periodicity. The chaotic modulation is usually treated as a secure transmission scheme rather than an efficient scheme in terms of channel noise. In this paper, to achieve a secure and high-performance transmission, we propose a tr...",,11-15 June,10.1109/ICC.2006.255460,https://ieeexplore.ieee.org/document/4024844,new
ieee:4024298,conference,Procedures for Efficient Iterative Decoding of Orthogonal Convolutional Codes,"Yu-cheng He, David Haccoun, Christian Cardinal",A procedure for the forward-only iterative belief propagation decoding of orthogonal convolutional codes is presented. It can be dramatically simplified to perform the iterative threshold decoding of convolutional self-doubly-orthogonal codes without interleaving. These procedures can help implement iterative decoders efficiently using a serial concatenation of one-step BP decoders or one-step thr...,,11-15 June,10.1109/ICC.2006.254906,https://ieeexplore.ieee.org/document/4024298,new
