ID,Type,Title,Authors,Abstract,Categories,Published,DOI,PDF URL,Status
ieee:1638625,journal,Lifting methods for quasi-cyclic LDPC codes,"Seho Myung, Kyeongcheol Yang, Youngkyun Kim","In this paper, we present two simple methods to construct a quasi-cyclic LDPC (QC-LDPC) code of larger length by lifting a given QC-LDPC code. We show that its girth is always larger than or equal to that of the given QC-LDPC code. Applying the methods recursively, it is possible to construct a sequence of QC-LDPC codes generated from a single exponent matrix by proper floor or modulo operations. ...",,June 2006,10.1109/LCOMM.2006.1638625,https://ieeexplore.ieee.org/document/1638625,new
ieee:1638622,journal,Surrogate-channel design of universal LDPC codes,"F. Peng, W.E. Ryan, R.D. Wesel","A universal code is a code that may be used across a number of different channel types or conditions with little degradation relative to a good single-channel code. The explicit design of universal codes, which simultaneously seeks to solve a multitude of optimization problems, is a daunting task. This letter shows that a single channel may be used as a surrogate for an entire set of channels to p...",,June 2006,10.1109/LCOMM.2006.1638622,https://ieeexplore.ieee.org/document/1638622,new
ieee:1643529,journal,On unequal error protection LDPC codes based on plotkin-type constructions,"V. Kumar, O. Milenkovic","We introduce a new family of unequal error protection (UEP) codes, based on low-density parity-check (LDPC) component codes and Plotkin-type constructions. The codes are decoded iteratively in multiple stages, and the order of decoding determines the level of error protection. The level of UEP among the code bits is also influenced by the choice of the LDPC component codes and by some new reliabil...",,June 2006,10.1109/TCOMM.2006.876842,https://ieeexplore.ieee.org/document/1643529,new
ieee:1638623,journal,Adaptive offset min-sum algorithm for low-density parity check codes,"Ming Jiang, Chunming Zhao, Li Zhang, Enyang Xu","An improvement is presented to the offset min-sum decoding algorithm for low-density parity check codes. The proposed algorithm introduces a more efficient adjustment for check-node update computation in view of different minimum values. According to the optimal correction factor of normalized min-sum algorithm, we can determine the adaptive offset item. The improved algorithm achieves a noticeabl...",,June 2006,10.1109/LCOMM.2006.1638623,https://ieeexplore.ieee.org/document/1638623,new
ieee:1637708,journal,Noise-predictive BCJR equalization for suppression of intrachannel nonlinearities,"I.B. Djordjevic, B. Vasic",An iterative equalization scheme for suppressing intrachannel nonlinearities in high-speed optical transmission systems operating at 40 Gb/s is presented. The proposed method employs a noise-predictive filter to mitigate the colored noise due to amplified spontaneous emission noise and optical filtering. The maximum a posteriori probability symbol detection implemented as the Bahl-Cocke-Jelinek-Ra...,,June 2006,10.1109/LPT.2006.876757,https://ieeexplore.ieee.org/document/1637708,new
ieee:1638653,journal,"Approaching the capacity of the MIMO Rayleigh flat-fading channel with QAM constellations, independent across antennas and dimensions","J. Bellorado, S. Ghassemzadeh, A. Kavcic","In this study we consider the challenge of reliable communication over a wireless Rayleigh flat-fading channel using multiple transmit and receive antennas. Since modern digital communication systems employ signal sets of finite cardinality, we examine the use of the quadrature amplitude modulation (QAM) constellation to approach the capacity of this channel. By restricting the channel input to th...",,June 2006,10.1109/TWC.2006.1638653,https://ieeexplore.ieee.org/document/1638653,new
ieee:1638543,journal,Raptor codes,A. Shokrollahi,"LT-codes are a new class of codes introduced by Luby for the purpose of scalable and fault-tolerant distribution of data over computer networks. In this paper, we introduce Raptor codes, an extension of LT-codes with linear time encoding and decoding. We will exhibit a class of universal Raptor codes: for a given integer k and any real epsiv>0, Raptor codes in this class produce a potentially infi...",,June 2006,10.1109/TIT.2006.874390,https://ieeexplore.ieee.org/document/1638543,new
ieee:1638564,journal,Decentralized erasure codes for distributed networked storage,"A.G. Dimakis, V. Prabhakaran, K. Ramchandran","In this correspondence, we consider the problem of constructing an erasure code for storage over a network when the data sources are distributed. Specifically, we assume that there are n storage nodes with limited memory and k<n sources generating the data. We want a data collector, who can appear anywhere in the network, to query any k storage nodes and be able to retrieve the data. We introduce ...",,June 2006,10.1109/TIT.2006.874535,https://ieeexplore.ieee.org/document/1638564,new
ieee:1628955,journal,A hardware Gaussian noise generator using the Box-Muller method and its error analysis,"D.-U. Lee, J.D. Villasenor, W. Luk, P.H.W. Leong","We present a hardware Gaussian noise generator based on the Box-Muller method that provides highly accurate noise samples. The noise generator can be used as a key component in a hardware-based simulation system, such as for exploring channel code behavior at very low bit error rates, as low as 10-12 to 10-13. The main novelties of this work are accurate analytical error analysis and bit-width opt...",,June 2006,10.1109/TC.2006.81,https://ieeexplore.ieee.org/document/1628955,new
ieee:1638561,journal,Separating distributed source coding from network coding,"A. Ramamoorthy, K. Jain, P.A. Chou, M. Effros",This correspondence considers the problem of distributed source coding of multiple sources over a network with multiple receivers. Each receiver seeks to reconstruct all of the original sources. The work by Ho et al. 2004 demonstrates that random network coding can solve this problem at the potentially high cost of jointly decoding the source and the network code. Motivated by complexity considera...,,June 2006,10.1109/TIT.2006.874534,https://ieeexplore.ieee.org/document/1638561,new
ieee:1638642,journal,A novel broadcast scheduling strategy using factor graphs and the sum-product algorithm,"Jung-Chieh Chen, Yeong-Cheng Wang, Jiunn-Tsair Chen","This paper presents a novel self-organizing distributed algorithm for finding a broadcasting schedule in a packet radio network via only local collaborative interactions among neighboring network stations. Inspired by the huge success of the low density parity check (LDPC) codes in the field of error control coding, we transform the broadcast scheduling problem (BSP) into an LDPC-like problem thro...",,June 2006,10.1109/TWC.2006.1638642,https://ieeexplore.ieee.org/document/1638642,new
ieee:4052232,conference,Wyner-Ziv Video Coding using LDPC Codes,"Limin Liu, Edward J. Delp","Wyner-Ziv video coding aims to design encoders based on the Slepian-Wolf and Wyner-Ziv distributed source coding theorems. In this coding scenario, source statistics are exploited at the decoder so that it is feasible to design simplified encoders. The shift of the computational complexity from the encoder to the decoder is suitable for emerging mobile multimedia applications. Many channel coding ...",,7-9 June 2,10.1109/NORSIG.2006.275237,https://ieeexplore.ieee.org/document/4052232,new
ieee:1644559,conference,Low-Density Parity-Check Codes for Discretized Min-Sum Decoding,"B. Smith, F.R. Kschischang, Wei Yu",The performance of low-density parity-check (LDPC) codes transmitted over a memoryless binary-input continuous output additive white Gaussian noise (AWGN) channel and decoded with quantized min-sum decoding is strongly influenced by the decoder&#39;s quantization scheme. This paper presents an efficient algorithm that determines the best uniform scalar quantizer for a particular code. To maximize perf...,,30 May-1 J,10.1109/BSC.2006.1644559,https://ieeexplore.ieee.org/document/1644559,new
ieee:1644556,conference,Hard-Decision Performance of LDPC Codes on Binary Symmetric Channels with Small Crossover Probabilities,"Hua Xiao, A.H. Banihashemi","Upper and lower bounds are derived on the frame error rate (FER) of low-density parity-check (LDPC) codes decoded by hard-decision iterative algorithms over binary symmetric channels (BSC). The bounds, which are tight for sufficiently small crossover probabilities of the channel, provide a good estimate of FER in this region. The derivation of the bounds is based on the enumeration of low-weight e...",,30 May-1 J,10.1109/BSC.2006.1644556,https://ieeexplore.ieee.org/document/1644556,new
ieee:1644557,conference,Performance Bounds for Multilevel LDPC Coded Modulation,"H.G. Vu, H.H. Nguyen, D.E. Dodds","This paper investigates multilevel coded modulation with multistage decoding, where finite-length low-density parity check (LDPC) codes are used as component codes. The systems under consideration are different from the conventional multilevel coded modulation by the fact that more than one coded bit of a component code are mapped to the labeling bits of the signal constellation. The union bound o...",,30 May-1 J,10.1109/BSC.2006.1644557,https://ieeexplore.ieee.org/document/1644557,new
ieee:1644569,conference,Incremental Redundancy via Check Splitting,"M. Good, F.R. Kschischang","A new method of creating rateless codes for noisy channels is presented. Unlike puncturing, where every punctured variable disables several checks, or extending, which creates many cycles in the code graph or creates parity checks with insufficient weight, the proposed method uses check splitting to lower the rate of the code. Check splitting operates by replacing a row r of maximum weight in the ...",,30 May-1 J,10.1109/BSC.2006.1644569,https://ieeexplore.ieee.org/document/1644569,new
ieee:1644558,conference,Capacity-Approaching LDPC Codes with Low Error Floors for High-Speed Digital Communications,"Zhiyong He, S. Roy, P. Fortier",This paper discusses the design of capacity-approaching irregular low density parity check (LDPC) codes constructed from circulant permutation matrices with low error floors. The experimental results indicate that the performance in the waterfall region of the error curve can be improved by increasing the maximum column degree or by decreasing the fraction of columns with maximum degree in the par...,,30 May-1 J,10.1109/BSC.2006.1644558,https://ieeexplore.ieee.org/document/1644558,new
ieee:1644593,conference,Distributed Source Coding Using Symbol-Based Turbo Codes,"M. Zamani, F. Lahouti","A simple but powerful scheme for distributed source coding based on the concept of binning and symbol-based turbo codes is proposed. The previous works on the compression with side information (SI) using turbo codes and the binning technique are focused on binary turbo codes. The source is considered to be binary or is converted to a binary stream. This conversion, however, reduces the redundancy ...",,30 May-1 J,10.1109/BSC.2006.1644593,https://ieeexplore.ieee.org/document/1644593,new
ieee:1644614,conference,Improving the Performance of 4-State Turbo Codes with the Correction Impulse Method and Data Puncturing,"K. Gracie, S. Crozier","Turbo codes offer excellent error-rate performance and have been included in a wide variety of systems and standards. However, these gains are limited as the signal-to-noise ratio (SNR) increases by &#34;flares&#34; in their error-rate curves. These flares may disqualify turbo codes from applications that require very low error rates. Recently, an effective method for reducing these error flares that is a...",,30 May-1 J,10.1109/BSC.2006.1644614,https://ieeexplore.ieee.org/document/1644614,new
ieee:1644615,conference,Performance of a 4-State Turbo Code with Data Puncturing and a BCH Outer Code,"R. Kerr, K. Gracie, S. Crozier","The performance of a concatenated turbo code with an outer BCH code is examined. The turbo code was based on simple 4-state constituent codes with a constrained high spread random (HSR) inter-leaver. Data puncturing, as opposed to puncturing only the parity bits, was used with the Turbo code to improve the convergence performance in the waterfall region. It is shown that this simple approach achie...",,30 May-1 J,10.1109/BSC.2006.1644615,https://ieeexplore.ieee.org/document/1644615,new
ieee:1644568,conference,Adaptive Demodulation Performance over a Rayleigh Fading Channel,"J.D. Brown, K.N. Plataniotis, S. Pasupathy",Adaptive demodulation (ADM) is a newly proposed rate adaptive system which operates without requiring channel state information at the transmitter (unlike adaptive modulation). We consider the performance of ADM (using 16-QAM and using 16-PSK) over a Rayleigh fading channel. A methodology is presented for the receiver to effectively choose its operating region based on the observed SNR at the rece...,,30 May-1 J,10.1109/BSC.2006.1644568,https://ieeexplore.ieee.org/document/1644568,new
ieee:1644613,conference,On the Robustness of Iterative Decoders,"P. Zarrinkhat, M. Ardakani","Robustness of iterative decoders, i.e., their ability to successfully decode the received signal in spite of unknown changes in the channel parameter, is investigated. More specifically, using low-density parity-check codes and iterative message-passing decoders for error correction, we consider reliable communication over a binary-input power-limited Gaussian channel whose noise power is not perf...",,30 May-1 J,10.1109/BSC.2006.1644613,https://ieeexplore.ieee.org/document/1644613,new
ieee:4123942,conference,Cryptography and Coding,,,,28-30 June,,https://ieeexplore.ieee.org/document/4123942,new
ieee:4123899,conference,A Low Memory FPGA Based LDPC Decoder Architecture for Quasi-Cyclic LDPC codes,"Paul Saunders, Antony D. Fagan","We propose a novel low memory fully programmable FPGA decoder architecture to decode quasi-cyclic LDPC codes. By performing optimizations at the code construction, algorithmic and architecture levels we are able to achieve significant memory storage advantages over current FPGA decoder implementations. Our decoder employs the modified turbo decoding algorithm, to achieve a memory utilisation of 71...",,28-30 June,,https://ieeexplore.ieee.org/document/4123899,new
ieee:4123943,conference,Construction of Girth 8 LDPC Codes based on Finite Lattice Geometries,"John Craddock, Mark Flanagan, Anthony Fagan","This paper presents a novel method for constructing Low Density Parity Check (LDPC) codes with a girth of up to 8. These codes are based on the structural properties of finite lattice geometries. Results are presented which show that these codes perform well over awgn channels with iterative decoding. These codes also have several implementation advantages, which are presented.",,28-30 June,,https://ieeexplore.ieee.org/document/4123943,new
ieee:4123891,conference,Iris Matching Using Error-Correcting Codes,"Eabhnat Ni Fhloinn, Michael Purser","Reed-Solomon codes are introduced as an improved means of matching iris images. A distinct advantage of this approach is that the biometric template is not stored explicitly; it is sufficient to save the hashed reading, together with the check digits, increasing the overall security.",,28-30 June,,https://ieeexplore.ieee.org/document/4123891,new
ieee:1691156,conference,Non-Binary Low Density Parity Check Codes for Satellite Communications,"G. Bosco, R. Garello, F. Mininni, M. Baldi, F. Chiaraluce","In this paper, we study a new class of Low Density Parity Check codes, designed for satellite communications, and achieving both high spectral efficiency and large coding gain. Given a constant-envelope 8-PSK constellation, a generic linear binary code does not lead to a geometrically uniform Euclidean-space code. Low Density Parity Check codes over Z_8, the group of integers modulo 8, are conside...",,26-29 June,10.1109/ISCC.2006.108,https://ieeexplore.ieee.org/document/1691156,new
ieee:1691072,conference,Performance Improvement of DVB-H System with LDPC Code in MPE-FEC Frame,"Hyung Taek Lim, Sang Hoon Lee, Jong Soo Lim, Ju Yeun Kim, Eon Kyeong Joo",RS (Reed - Solomon) code is used in DVB-H (digital video broadcasting - handheld) system as an addtional error correcting code to improve the performance during mobile reception. LDPC (low density parity check) code which is rediscovered recently shows the astonishing performance. Therefore LDPC code can be used to replace RS code in order to improve the performance further since both of them are ...,,26-29 June,10.1109/ISCC.2006.127,https://ieeexplore.ieee.org/document/1691072,new
ieee:4063999,conference,On the Performance of Incremental Redundancy Hybrid ARQ Schemes with Rate Compatible LDPC Codes,"Hong Wen, Liang Zhou, Chusheng Fu","Rate compatible LDPC codes with only one parity check matrix can be applicable to rate matching. An incremental redundancy hybrid ARQ scheme based on rate compatible LDPC codes is introduced. We studied the throughput of the new HARQ scheme. Furthermore, the throughput of the new HARQ scheme is simulated. It shows that for arbitrary block fading channel, comprising AWGN channel, the performance of...",,25-28 June,10.1109/ICCCAS.2006.284758,https://ieeexplore.ieee.org/document/4063999,new
ieee:4063830,conference,The Application of High-Rate LDPC Codes in Image Transmission over Wireless Channel,"Huo Yongqing, Peng Qicong, Shao Huaizong","It has been proved that low-density parity-check (LDPC) codes is good codes and have good distance. They have near Shannon limit performance when decoded using an iterative probabilistic algorithm. Moreover, high-rate LDPC codes have high data rate and high spectral efficiency. So, in this paper, we explored three high-rate LDPC codes in image transmission over Rayleigh fading channel, the simulat...",,25-28 June,10.1109/ICCCAS.2006.284586,https://ieeexplore.ieee.org/document/4063830,new
ieee:4063992,conference,Threshold Determination of LDPC Codes for Turbo Equalization Based on EXIT Chart,"Xu Hua, Xu Cheng-qi, Kang Su-cheng","Optimization of LDPC codes based on (EXIT) chart for MIMO channel was recently proposed by Brink. We extended Brink&#39;s idea to the performance analysis and threshold determination of LDPC codes for MMSE turbo equalization. The receiver was partitioned into two blocks. A new scheme to obtain EXIT curve of block I was given. Furthermore a new algorithm was proposed based on the EXIT curve fitting, wh...",,25-28 June,10.1109/ICCCAS.2006.284751,https://ieeexplore.ieee.org/document/4063992,new
ieee:4063991,conference,A Class of Improved Low-Density Parity-Check Codes Constructed Based on Gallager's Form,"Guangen Wu, Pinyi Ren","Focused on the problem that short cycles degrade the iterative decoding performance of finite length LDPC, a class of improved low density parity check (LDPC) codes constructed based on Gallager&#39;s form is designed. On the basis of keeping down the basic form of Gallager&#39;s construction, a quasi-cyclic form is used, then the new codes are free of cycles of length 4 and have good minimum distance. Si...",,25-28 June,10.1109/ICCCAS.2006.284750,https://ieeexplore.ieee.org/document/4063991,new
ieee:4064000,conference,Enhanced Low-Density Parity-Check Codes Based on Sum-check Blocks,"Jingli Lin, Longjiang Jing, Weile Zhu, Chen Yang","Based on some characteristics of decoding and error-floors of low-density parity-check (LDPC) codes, an approach of adding sum-check blocks to original LDPC blocks over GF(2) is proposed. The performance of this approach is analyzed and the circuits are also presented. Also, the simulation results show that the performance of the constructed LDPC codes can be improved significantly with low cost, ...",,25-28 June,10.1109/ICCCAS.2006.284759,https://ieeexplore.ieee.org/document/4064000,new
ieee:4064124,conference,Algebraic Constructions of Nonbinary Quasi-Cyclic LDPC Codes,"Shu Lin, Shumei Song, Ying Y. Tai, Lan Lan, Lingqi Zeng","In the late 1950&#39;s and early 1960&#39;s, finite fields were successfully used to construct linear block codes, especially cyclic codes, with large minimum distances for correcting random errors with algebraic decoding, such as Bose-Chaudhuri-Hocqenghem (BCH) and Reed-Solomon (RS) codes. Recently it has been shown that finite fields can also be used successfully to construct binary quasi-cyclic (QC)-LD...",,25-28 June,10.1109/ICCCAS.2006.284883,https://ieeexplore.ieee.org/document/4064124,new
ieee:4063835,conference,A LDPC-Based Joint Source Channel Decoding Using HMM for Image Transmission System,"Jie Gao, Rongke Liu, Xinmei Sun, Xiaolin Zhang",A modified joint source channel decoding (JSCD) algorithm based on low-density parity-check (LDPC) coding and hidden Markov estimation is proposed to employ the self-checking mechanism of LDPC codes in adjusting the error probability p of the hidden Markov model (HMM) and the JSCD scheme utilizes the source residual redundancy while no priori information of the source parameters is available. We a...,,25-28 June,10.1109/ICCCAS.2006.284591,https://ieeexplore.ieee.org/document/4063835,new
ieee:4064033,conference,A Type-II Hybrid ARQ Scheme Based on Rate-compatible LDPC Code,"Fei Zesong, Zhu Miao, Kuang Jingming",Rate-compatible code is a typical way to achieve high forward error correction (ARQ/FEC) systems in packet data transmission. This paper focuses on the construction of efficient rate-compatible low density parity check (RC-LDPC) codes in a flexible way. A special technique to get rate compatible LDPC codes called extending without code-rate threshold is presented in comparison to the results in Zh...,,25-28 June,10.1109/ICCCAS.2006.284792,https://ieeexplore.ieee.org/document/4064033,new
ieee:4064429,conference,Efficient Decoder Implementation for QC-LDPC Codes,"Jin Sha, Minglun Gao, Zhongjin Zhang, Li li, Zhongfeng Wang","Channel coding is an important building block in communication systems. Low-density parity-check codes is one kind of prominent error correcting codes being considered in next generation industry standards. This paper presents a memory efficient, very high speed decoder architecture suited for quasi-cyclic low-density parity-check codes using modified Min-Sum decoding algorithm. In general, about ...",,25-28 June,10.1109/ICCCAS.2006.285182,https://ieeexplore.ieee.org/document/4064429,new
ieee:4064029,conference,Performance of LDPC Coded AOFDM Under Frequency-Selective Fading Channel,"Zhou Mingyu, Li Lihua, Wen Na, Zhang Ping","In this paper, LDPC code is combined with adaptive OFDM. Code rate of LDPC is fixed and modulation mode of sub-carriers can vary according to CQI. Throughput analysis of the scheme under frequency-selective fading channel and theory of sub-band based LDPC coded AOFDM is given. Computer simulation under 12-tap TU fading channel was carried out. Results show that the LDPC coded AOFDM scheme exhibits...",,25-28 June,10.1109/ICCCAS.2006.284788,https://ieeexplore.ieee.org/document/4064029,new
ieee:4064072,conference,A Novel Turbo Equalization for MIMO Frequency Selective Fading Channels,"Zhanli Liu, Jing Wang, Chunming Zhao, Jiaheng Wang, Ming jiang","In this paper, we present a novel CRC-aided turbo equalization approach that exploits the cyclic redundancy check (CRC) to reduce computational complexity. The essential idea is that, during the iterative process, once a data block in the data frame is detected totally correct by CRC, we can set all the log likelihood ratio (LLR) of the bits in this block a fixed high value for the next iteration,...",,25-28 June,10.1109/ICCCAS.2006.284831,https://ieeexplore.ieee.org/document/4064072,new
ieee:4063994,conference,A New Design Method of Multi-Rate Quasi-Cyclic LDPC Codes,"Zhichu Lin, Zhixing Yang, Changyong Pan","A new method called fractional row combination is proposed to design a group of multi-rate quasi-cyclic LDPC codes in this paper. Unlike the original row combination method, it guarantees all the codes under different rates have concentrated check-node degree distributions, hence better performance under iterative decoding. Moreover, a combinatorial method based on BIBD is applied to our design. T...",,25-28 June,10.1109/ICCCAS.2006.284753,https://ieeexplore.ieee.org/document/4063994,new
ieee:4063993,conference,An Improved Construction of LDPC Codes Based on Data Punctured Hybrid ARQ,"Ming Jiang, Chunming Zhao, Zhanli Liu, Li Zhang","A data puncturing type-II hybrid automatic retransmission request protocol, using LDPC codes which have the constructions with low encoding complexity and moderate matrix dimensions, is a good tradeoff between the system throughput and the hardware overhead. Based on the characteristics of this protocol that only the parity bits are sent in each retransmission and the puncturing is operated on the...",,25-28 June,10.1109/ICCCAS.2006.284752,https://ieeexplore.ieee.org/document/4063993,new
ieee:1633511,conference,HoVer Erasure Codes For Disk Arrays,J.L. Hafner,"We present a new family of XOR-based erasure codes primarily targeted for use in disk arrays. These codes have a unique data/parity layout, with both horizontal and vertical parity arrangements giving rise to the name HoVer codes. We give constructions that tolerate up to four disk failures. Though the codes are only approximately maximum distance separable (MDS), they have performance advantages ...",,25-28 June,10.1109/DSN.2006.40,https://ieeexplore.ieee.org/document/1633511,new
