ID,Type,Title,Status,Reason,Authors,Abstract,Categories,Published,DOI,PDF URL
ieee:5747327,conference,Frame synchronization without attached sync markers,미선별,,Jon Hamkins,"We describe a method to synchronize codeword frames without making use of attached synchronization markers (ASMs). Instead, the synchronizer identifies the code structure present in the received symbols, by operating the decoder for a handful of iterations at each possible symbol offset and forming an appropriate metric. This method is computationally more complex and doesn't perform as well as frame synchronizers that utilize an ASM; nevertheless, the new synchronizer acquires frame synchronization in about two seconds when using a 600 kbps software decoder, and would take about 15 milliseconds on prototype hardware. It also eliminates the need for the ASMs, which is an attractive feature for short uplink codes whose coding gain would be diminished by the overheard of ASM bits. The lack of ASMs also would simplify clock distribution for the AR4JA low-density parity-check (LDPC) codes and adds a small amount to the coding gain as well (up to 0.2 dB).",,5-12 March,10.1109/AERO.2011.5747327,https://ieeexplore.ieee.org/document/5747327
ieee:5759850,conference,A sorting-based architecture of finding the first two minimum values for LDPC decoding,미선별,,"Qian Xie, Zhixiang Chen, Xiao Peng, Satoshi Goto","This paper presents an efficient architecture of finding the first two minimum values for row operation in LDPC decoding. Given a set of numbers X, efficient algorithm and its corresponding hardware implementation for finding the first minimum value, min_1st, second minimum value, min_2nd and the position of min_1st are greatly needed in LDPC decoder design. The design is based on sorting-based approach proposed in. Compared to the conventional architecture, our architecture performs better in both speed and area. An extension method is also presented to apply the proposed architecture when the number of inputs is an any positive integer.",,4-6 March ,10.1109/CSPA.2011.5759850,https://ieeexplore.ieee.org/document/5759850
ieee:5759853,conference,Design of turbo codes without 4-cycles in Tanner graph representation for message passing algorithm,미선별,,"Ying Cui, Xiao Peng, Satoshi Goto","Turbo code and Low Density Parity Check (LDPC) code are both recommended as FEC code in many communication standards owing to their impressive error correcting performance. Aiming at the common architecture which can decode both of the two codes, this paper describes the method of decoding turbo codes with message passing algorithm which is conventionally used for LDPC codes. In this method, turbo codes are viewed as block codes and the sparse parity check matrices are constructed through Smith Decomposition or GBT (Generator matrix based transformation). In order to guarantee decoding performance, we propose the criterion of turbo codes with no 4-cycles, which is mathematically proved and demonstrated by the simulation results.",,4-6 March ,10.1109/CSPA.2011.5759853,https://ieeexplore.ieee.org/document/5759853
ieee:5749523,conference,Sparse Graph Codes for the Two-Way Relay Network with Correlated Sources,미선별,,"Gottfried Lechner, Roy Timo, Lawrence Ong","We consider the two-way relay network where two nodes communicate via a relay. We assume that the data at the nodes are correlated (e.g., measurements in a sensor network) and that there is no direct communication between the nodes. The nodes communicate via the relay using a two-phase protocol consisting of an uplink part over an orthogonal multiple access channel and a downlink part over a broadcast channel. The individual codes as well as the overall system can be represented by a joint factor graph consisting of a source code at each node, a channel code for the each uplink and a channel code for the downlink. The optimality of separation of source and channel coding implies that it is optimal to individually design these codes. We focus on low-density parity-check codes where code design corresponds to the optimisation of their degree distributions.",,29-31 Marc,10.1109/DCC.2011.70,https://ieeexplore.ieee.org/document/5749523
ieee:5749479,conference,Formulating Binary Compressive Sensing Decoding with Asymmetrical Property,미선별,,"Xiao Lin Liu, Chong Luo, Feng Wu","This paper mathematically analyzes the verification based message passing decoder for the binary compressive sensing (CS) compression problem, toward the goal of judging whether the decoding will be successful prior to the decoding process and of providing design guidelines of sensing matrices for better coding performance. For a biased binary source with unequal percentage of bit ""0"" and ""1"", we observe that the recovery probabilities for bit ""0"" and ""1"" are different during each round of evolution in the decoding process. We refer to this property as asymmetrical recovery. To authors' best knowledge, this paper is the first one to formulate CS decoding by taking the asymmetrical recovery into account. With the new formulation, the recursion of unrecoverable probability of source bits can be characterized more precisely than previous formulations. Furthermore, as an important property of CS decoding, we also characterize the variation on asymmetrical recovery in different rounds of evolution. The simulation results show that the new formulation has a close match with the actual decoding. Finally, we derive design guidelines for random sensing matrices from the source coding perspective.",,29-31 Marc,10.1109/DCC.2011.28,https://ieeexplore.ieee.org/document/5749479
ieee:5779435,conference,Gigabit rate achieving low-power LDPC codes: Design and architecture,미선별,,"Shadi Abu-Surra, Eran Pisek, Thomas Henige","The quality of any communication system is greatly determined by the performance excellence of the selected channel coding scheme. In this work, we propose algorithms for designing LDPC channel coding schemes. The proposed designs are suitable for achieving Gigabit communications with relatively low-power consumption. We design LDPC code family with fixed block length and no puncturing. Also, starting with an LDPC code base-family, we construct LDPC code families with longer block length but decodable using the same hardware as the base-family. We propose a unified decoder architecture, which can decode all LDPC codes in the designed base-family as well as all LDPC codes in the derived code families with longer block length.",,28-31 Marc,10.1109/WCNC.2011.5779435,https://ieeexplore.ieee.org/document/5779435
ieee:5779408,conference,Serially concatenated LT code with DQPSK modulation,미선별,,"Iqbal Hussain, Ming Xiao, Lars K. Rasmussen","We consider serial concatenation of a Luby Transform (LT) code with a differential quadrature phase-shift-keying (DQPSK) modulator for transmission over an additive white Gaussian noise (AWGN) Channel. Assuming a target average rate for the operation of the rateless LT DQPSK scheme, the degree distribution of the LT code is optimized in terms of convergence threshold using extrinsic information transfer (EXIT) charts. From the EXIT chart analysis, we show that the proposed LT DQPSK scheme has a similar convergence performance, but lower complexity, as compared to a Raptor code with differential modulation, and a LDPC code optimized for DQPSK. The EXIT chart analysis framework is also applied to evaluate the throughput performance for the three schemes in terms of the average code rate as a function of the signal-to-noise ratio. The comparison demonstrates that the proposed structure is well-suited for adaptive-rate transmission over a wide range of rates.",,28-31 Marc,10.1109/WCNC.2011.5779408,https://ieeexplore.ieee.org/document/5779408
ieee:5750893,conference,A High-efficiency LDPC Encoder for CMMB with Dynamic Programming,미선별,,Zhibin Zeng,"In this paper, a high-efficiency LDPC encoder for CMMB based on LU decomposition with dynamic programming is proposed. Results from simulation and implementation shows that this method can decrease complexity of encoding and improve encoding rate effectively.",,28-29 Marc,10.1109/ICICTA.2011.368,https://ieeexplore.ieee.org/document/5750893
ieee:5750987,conference,Studies on Space-Time Block Codes with LDPC,미선별,,"Li Bai Ping, Wang Ting, Li Juming","Firstly, this paper gives a simple introduction of the encoding/decoding theory of LDPC and Space-time coding. And it carries out a detailed research and analysis on LDPC coding system and the space-time block coding system. Then, LDPC and space-time coding are combined. The performance of LDPC-STBC under AWGN channel is given through computer simulation. The simulation results show that this method can improve the coding performance. In addition, it indicates a detail comparison of the different types of LDPC code weight and STBC receiving ways.",,28-29 Marc,10.1109/ICICTA.2011.462,https://ieeexplore.ieee.org/document/5750987
ieee:5766201,conference,Design of bilayer lengthened LDPC codes for Rayleigh fading relay channels,미선별,,"Osso Vahabzadeh, Masoud Salehi","Recently, two classes of high rate bilayer low-density parity-check (LDPC) codes have been proposed for Gaussian relay channels using bilayer density evolution technique. These two classes include bilayer lengthened LDPC codes and bilayer expurgated LDPC codes that have been used in a decode-and-forward relaying strategy. In this paper, we first study the decode-and-forward achievable rates for a Rayleigh fading relay channel. Then, we design bilayer lengthened LDPC codes for this channel model in different SNR regimes, namely, when the link between the source and the relay is much stronger than the link between the source and the destination and when the SNRs of these links are comparable.",,23-25 Marc,10.1109/CISS.2011.5766201,https://ieeexplore.ieee.org/document/5766201
ieee:5766114,conference,A Markov chain model for Edge Memories in stochastic decoding of LDPC codes,미선별,,"Kuo-Lun Huang, Vincent Gaudet, Masoud Salehi","Stochastic decoding is a recently proposed method for decoding Low-Density Parity-Check (LDPC) codes. Stochastic decoding is, however, sensitive to the switching activity of stochastic bits, which can result in a latching problem. Using Edge Memories (EMs) has been proposed as a method to counter the latching problem in stochastic decoding. In this paper, we introduce a Markov chain model for EMs and study state transitions over decoding cycles. The proposed method can be used to determine the convergence and the required number of decoding cycles in stochastic decoding. Moreover, it can help to study the behavior of decoding process and to estimate the decoding time.",,23-25 Marc,10.1109/CISS.2011.5766114,https://ieeexplore.ieee.org/document/5766114
ieee:5766255,conference,Concatenation of LDPC codes with Golden space-time block codes over the block fading MIMO channels: System design and performance analysis,미선별,,"Jin-Taek Seong, Heung-No Lee","The use of low-density parity-check (LDPC) codes over the multi-input multi-output (MIMO) channels has shown the performance to be achieved to the capacity limit. For the 2 × 2 MIMO system, the Golden codes were recently developed as the optimal space-time codes with a full rate and a full diversity gain. In this paper, we give the detailed system design for the concatenated coding scheme, which consists of the LDPC codes as the outer code and the Golden space-time block codes (STBC) as the inner code. The outer binary block codeword transforms itself onto the sequence of the internal space-time (IST) symbols according to a fixed constellation map. The soft-input soft-output (SISO) message passing decoder of the LDPC codes can be combined with a SISO constellation de-mapper as the Golden STBC decoder. They exchange the extrinsic messages in turbo-iterations. We evaluate the error performance for different block lengths of the proposed system. For the Golden codes concatenated with the LDPC codes, the maximum-likelihood union bound analysis is used for performance benchmarking.",,23-25 Marc,10.1109/CISS.2011.5766255,https://ieeexplore.ieee.org/document/5766255
ieee:5766103,conference,Secret key generation through OFDM multipath channel,미선별,,"Yanpei Liu, Stark C. Draper, Akbar M. Sayeed",We analyze the fundamental limits of key generation and describe an implementation based on error correcting codes. We show that key extraction based on channel coefficients significantly outperforms key extraction based on received signal strength indicators (RSSI). The development in this paper is based on an IEEE 802.11a orthogonal frequency-division multiplexing (OFDM) model and We demonstrate that it is feasible to use the sampled channel coefficients in OFDM as the key source. The key extraction problem is cast as a Slepian-Wolf coding and decoding problem. We construct regular and irregular forms of binary and non-binary low-density parity check (LDPC) codes to prototype our key extraction.,,23-25 Marc,10.1109/CISS.2011.5766103,https://ieeexplore.ieee.org/document/5766103
ieee:5766212,conference,Random complex field code design for security over wiretap channels,미선별,,"Jiaxi Xiao, Xiaoli Ma, Steven W. McLaughlin","Wiretap channel has caught a lot of attention recently in secured communications. A commonly adopted wiretap model is that the main channel is noiseless and the eavesdroppers channel is binary erasure channel (BEC). LDPC codes have been applied to achieve strong secrecy. However, it lacks design flexibility balancing on security and reliability, and cannot illustrate the fundamental tradeoffs among erasure rate, secrecy rate, and the security performance. In this paper, we propose a random complex field code (RCFC) design for such wiretap channels. The design of RCFCs is systematic and flexible for any secrecy rate. By using the proposed code design, the desired receiver can decode the confidential information without any error (in the absence of noise). Simultaneously, when the secrecy rate is below or equal to the secrecy capacity, we prove that the mutual information between the confidential message and the decoded message given by the eavesdropper converges to zero with the codeword length goes to infinity. Additionally, our RCFC design is the first one which provides a platform to tradeoff secrecy rate with the security performance.",,23-25 Marc,10.1109/CISS.2011.5766212,https://ieeexplore.ieee.org/document/5766212
ieee:5766236,conference,Unequal error protection for noncoherent random linear network coding,미선별,,"Zhiyuan Yan, Bruce W. Suter","Since random linear network coding (RLNC) is susceptible to various errors, error control for RLNC is important and has attracted a lot of attention recently. Previous error control schemes for RLNC provide uniform error protection to all the packets in a session. However, in practice packets often have different significance and hence require different levels of protection. Furthermore, uniform error protection may be unnecessary or infeasible in some scenarios. In this paper, we investigate unequal error protection for RLNC. In particular, based on a novel signal space decomposition, we propose a new error control scheme that provides different levels of protection to two classes of packets transmitted to the same set of destination nodes.",,23-25 Marc,10.1109/CISS.2011.5766236,https://ieeexplore.ieee.org/document/5766236
ieee:5936539,conference,Reliable distribution of electronic media in vehicular networks based on fountain codes,미선별,,"Robert Budde, Stefan Nowak, Ruediger Kays","Distribution of electronic media to cars plays a key role when it comes to the deployment of car-to-infrastructure communications. Like in other point-to-multipoint systems, the application of fountain codes is highly promising. In this paper, we investigate the applicability of fountain codes in an infrastructure-based automotive communication system and introduce an expedient method to design such a system. By means of system simulations we compare its performance with respect to a data carousel.",,23-24 Marc,,https://ieeexplore.ieee.org/document/5936539
ieee:5763465,conference,The Design of Network Low Density Parity Check Codes for Wireless Multiple-Access Relay Networks,미선별,,"Ying Li, Lili Wang, Yue Sun","Based on the relaying scheme which permits the relay node to jointly encode the data information from two source nodes, a new network low density parity check (NLDPC) code is designed for the Rayleigh fading channel. Since the log-likelihood ratio (LLR) of the signal received from the fading channel is not a Gaussian random variable, the Gaussian Approximation algorithm cannot be employed directly in the density evolution. In this paper, a new hybrid bilayer Gaussian Approximation algorithm is derived to predict the performance of NLDPC codes over Rayleigh fading channels, based on which an optimization algorithm is developed to search for the degree distribution of the NLDPC code. Simulations show that, in a network with two sources, one relay and one destination, the system with the designed NLDPC code holds a performance gap of less than 0.6dB from the threshold.",,22-25 Marc,10.1109/AINA.2011.90,https://ieeexplore.ieee.org/document/5763465
ieee:5763585,conference,On the Rateless Character of Irregular RA Codes,미선별,,"Rong Sun, Jingwei Liu, Pingli Zhang, Baoming Bai",This paper introduces the construction of systematic irregular RA codes. The encoding line is used to describe the graph structure of IRA codes. Two interleaving strategies for IRA codes are analyzed and it is shown that the two interleaving strategies are equal. The rateless character of IRA codes is also shown. The performances of IRA codes with different rate in binary erasure channel are simulated. Simulation results show that the IRA codes is capacity achieving. The error floor performance of IRA codes is analyzed and the modified encoding method is presented to lower the error floor.,,22-25 Marc,10.1109/WAINA.2011.49,https://ieeexplore.ieee.org/document/5763585
ieee:5763463,conference,Semi-random Kite Codes over Fading Channels,미선별,,"Bo Bai, Baoming Bai, Xiao Ma","This paper introduces a new class of rate less forward error correction codes named semi-random Kite (SR-Kite) codes, which can be described by a sparse semi-random parity-check matrix in systematic form. SR-Kite codes have not only rate less property, but also low error floors. We present a simulation-based greedy optimization algorithm to design the degree distribution of SR-Kite codes for independent Rayleigh fading channels. The performances of SR-Kite codes under maximum likelihood decoding are analyzed for both AWGN and independent Rayleigh fading channels via union bound. Both the analysis and simulation results show that the proposed codes perform well over AWGN and fading channels within a wide range of signal-to-noise-ratios.",,22-25 Marc,10.1109/AINA.2011.16,https://ieeexplore.ieee.org/document/5763463
ieee:5958912,conference,New QC-LDPC codes implementation on FPGA platform in Rayleigh fading environment,미선별,,"Farid Ghani, Abid Yahya, Abdul Kader","This paper presents performance of Quasi-Cyclic low-density parity-check (QC-LDPC) codes on a flat Rayleigh fading channels by employing DPSK modulation scheme. The BER curves show that large girth and diversity level robust the system performance. Moreover, Prototype architecture of the LDPC codes has been implemented by writing Hardware Description Language (VHDL) code and targeted to a Xilinx Spartan-3E XC3S500E FPGA chip. Simulation results show that the proposed QC-LDPC codes achieve a 0.1dB coding gain over randomly constructed codes and perform 1.3 dB from the Shannon-limit at a BER of 10−6 with a code rate of 0.89 for block length of 1332.",,20-23 Marc,10.1109/ISCI.2011.5958912,https://ieeexplore.ieee.org/document/5958912
ieee:5763047,conference,A flexible high throughput multi-ASIP architecture for LDPC and turbo decoding,미선별,,"Purushotham Murugappa, Rachid Al-Khayat, Amer Baghdadi, Michel Jezequel","In order to address the large variety of channel coding options specified in existing and future digital communication standards, there is an increasing need for flexible solutions. This paper presents a multi-core architecture which supports convolutional codes, binary/duo-binary turbo codes, and LDPC codes. The proposed architecture is based on Application Specific Instruction-set Processors (ASIP) and avoids the use of dedicated interleave/deinterleave address lookup memories. Each ASIP consists of two datapaths one optimized for turbo and the other for LDPC mode, while efficiently sharing memories and communication resources. The logic synthesis results yields an overall area of 2.6mm2 using 90nm technology. Payload throughputs of up to 312Mbps in LDPC mode and of 173Mbps in Turbo mode are possible at 520MHz, fairing better than existing solutions.",,14-18 Marc,10.1109/DATE.2011.5763047,https://ieeexplore.ieee.org/document/5763047
ieee:5770792,conference,BCH code based multiple bit error correction in finite field multiplier circuits,미선별,,"Mahesh Poolakkaparambil, Jimson Mathew, Abusaleh M. Jabir, Dhiraj K. Pradhan, Saraju P. Mohanty","This paper presents a design methodology for multiple bit error detection and correction in Galois field arithmetic circuits such as the bit parallel polynomial basis (PB) multipliers over GF(2m). These multipliers are crucial in most of the cryptographic hardware designs and hence it is essential to ensure that they are not vulnerable to security threats. Security threats arising from injected soft (transient) faults into a cryptographic circuit can expose the secret information, e.g. the secret key, to an attacker. To prevent such soft or transient fault related attacks, we consider fault tolerance as a method of mitigation. Most of the current fault tolerant schemes are only multiple bit error detectable but not multiple bit error correctable. Keeping this in view, we present a multiple bit error correction scheme based on the BCH codes, with an efficient bit-parallel Chien search module. This paper details the design procedure as well as the hardware implementation specs. Comparison with existing methods demonstrate improved area, and reduced delay performances.",,14-16 Marc,10.1109/ISQED.2011.5770792,https://ieeexplore.ieee.org/document/5770792
ieee:5764032,conference,Analysis the performance of a LDPC coded FSO system with Q-ary pulse-position modulation,미선별,,"Bobby Barua, Dalia Barua","Free-space optical communication is an attractive and cost-effective solution for high-rate image, voice, and data transmission. However, optical wave propagation through the air experiences fluctuation in amplitude and phase due to atmospheric turbulence. In this paper, an analytical approach is presented to evaluate the bit error rate performance of a free space optical link using LDPC coded Q-ary optical PPM through atmospheric turbulence channel. Performance results are evaluated for multiple-laser and multiple photo-detector combination without and with LDPC code to combat the effect of atmospheric turbulence. The performance results are evaluated in terms of bit error rate (BER) and coding gain. It is found that LDPC coded system provides significant coding gain of 10 to 20 dB over uncoded system can be evaluated at BER 10-12 for multiple source and photo-detector combinations. It also provides better performance under strong turbulence rather than weak turbulence conditions.",,11-13 Marc,10.1109/ICCRD.2011.5764032,https://ieeexplore.ieee.org/document/5764032
ieee:5764130,conference,Performance of LDPCC-MC-CDMA in wideband shortwave channel,미선별,,"Qi Jun-wei, Xue Rui, Zhang Ya-qian","For the poor error-correcting performance of traditional channel codes in shortwave channel, Low Density Parity Check Codes (LDPCC) with a optimal check-up matrix and a suitable decoding algorithm is introduced. Combined with Multi-Carrier-Code Division Multiple Access (MC-CDMA) technology which can inhibit multipath interference remarkably, the LDPC+OFDM+DSSS scheme is proposed. Then the effect of MC modulation and LDPC codes on the performance of the system is studied, which can provide the reference basis for practical application. Simulation results in wideband shortwave channel show that LDPC codes can improve the bit error rate (BER) performance compared with the traditional channel coding. Meanwhile, the system can also inhibit the channel interference and symbol interference effectively and the performance of the system is greatly improved.",,11-13 Marc,10.1109/ICCRD.2011.5764130,https://ieeexplore.ieee.org/document/5764130
