ID,Type,Title,Authors,Abstract,Categories,Published,DOI,PDF URL,Status
ieee:5605917,journal,On the UEP Capabilities of Several LDPC Construction Algorithms,"Neele von Deetzen, Sara Sandberg",This paper analyzes construction algorithms for low-density parity-check (LDPC) codes with respect to their unequal error protection (UEP) capabilities. We show that the choice of code construction algorithm highly affects the performance and UEP properties of LDPC codes with identical degree distributions. Our results provide an explanation to disagreements in earlier research.,,November 2,10.1109/TCOMM.2010.101210.080614,https://ieeexplore.ieee.org/document/5605917,new
ieee:5601969,journal,A Low Complexity Decoding Algorithm for Majority-Logic Decodable Nonbinary LDPC Codes,"Dayuan Zhao, Xiao Ma, Chao Chen, Baoming Bai","In this letter, we propose a low complexity decoding algorithm for majority-logic decodable nonbinary low-density parity-check (LDPC) codes. The proposed algorithm is initialized with the quantized squared Euclidean distances between the constellation points and the received signals. Like most of the existing reliability-based decoding algorithms, the proposed algorithm requires only integer opera...",,November 2,10.1109/LCOMM.2010.100810.101403,https://ieeexplore.ieee.org/document/5601969,new
ieee:5599947,journal,A Unified Early Stopping Criterion for Binary and Nonbinary LDPC Codes Based on Check-Sum Variation Patterns,"Guojun Han, Xingcheng Liu","In order to detect uncorrectable error frames and early terminate their iterative belief-propagation (BP) decoding for binary or nonbinary LDPC codes, a unified early stopping criterion using check-sum variation patterns is proposed. In addition to low computational overhead and easy choice of threshold parameters, it can be adapted to different channels. Simulation results show that the proposed ...",,November 2,10.1109/LCOMM.2010.100410.100998,https://ieeexplore.ieee.org/document/5599947,new
ieee:5585626,journal,Joint Source-Channel Estimation Using Accumulated LDPC Syndrome,Yong Fang,"Source correlation estimation is an important issue remained in Slepian-Wolf Coding (SWC), while a counterpart issue in noisy transmission is channel noise estimation. This letter considers the transmission of SWC bitstream over a noisy channel. We show that it is possible to estimate both source correlation and channel noise using an accumulated Low-Density Parity-Check (LDPC) syndrome.",,November 2,10.1109/LCOMM.2010.091710.101062,https://ieeexplore.ieee.org/document/5585626,new
ieee:5590324,journal,"Quasi-Cyclic LDPC Codes: An Algebraic Construction, Rank Analysis, and Codes on Latin Squares","Li Zhang, Qin Huang, Shu Lin, Khaled Abdel-Ghaffar, Ian F. Blake","Quasi-cyclic LDPC codes are the most promising class of structured LDPC codes due to their ease of implementation and excellent performance over noisy channels when decoded with message-passing algorithms as extensive simulation studies have shown. In this paper, an approach for constructing quasi-cyclic LDPC codes based on Latin squares over finite fields is presented. By analyzing the parity-che...",,November 2,10.1109/TCOMM.2010.091710.090721,https://ieeexplore.ieee.org/document/5590324,new
ieee:5582319,journal,Two Low-Complexity Reliability-Based Message-Passing Algorithms for Decoding Non-Binary LDPC Codes,"Chao-Yu Chen, Qin Huang, Chi-chao Chao, Shu Lin",This paper presents two low-complexity reliability-based message-passing algorithms for decoding LDPC codes over non-binary finite fields. These two decoding algorithms require only finite field and integer operations and they provide effective trade-off between error performance and decoding complexity compared to the non-binary sum product algorithm. They are particularly effective for decoding ...,,November 2,10.1109/TCOMM.2010.091310.090327,https://ieeexplore.ieee.org/document/5582319,new
ieee:5595115,journal,Adaptive Discrete-Rate MIMO Communications with Rate-Compatible LDPC Codes,"Matthew D. Dorrance, Ian D. Marsland","By using rate-compatible (RC) low density parity-check (LDPC) codes with adaptive modulation, we propose an adaptive, discrete-rate multiple-input multiple-output (MIMO) communications system. Given the high spectral efficiency of MIMO and the flexibility of an incremental redundancy (IR) protocol, combined with adaptive coding and modulation (ACM), the designed communications system is capable of...",,November 2,10.1109/TCOMM.2010.092810.090549,https://ieeexplore.ieee.org/document/5595115,new
ieee:5681114,journal,Advanced signal processing technique for storage systems,"Jun Lee, Kees A. Schouhamer Immink","A post-Viterbi processor has found wide acceptance in recording systems since it can correct dominant error events at the channel detector output using only a few parity bits, and thereby significantly reduce the correction capacity loss of the error correction code. This paper presents two novel techniques for minimizing the mis-correction of a post-Viterbi processor based on an error detection c...",,November 2,10.1109/TCE.2010.5681114,https://ieeexplore.ieee.org/document/5681114,new
ieee:5590328,journal,Cooperative Concatenated Coding in Multi-Hop Multiple Access Relay Networks,Sang Wu Kim,"We propose a cooperative concatenated coding scheme in multi-hop multiple access relay networks, where the parity bits generated in the previous hops are concatenated with those in the next hop such that the error recovery capability improves as the information travels through the network. It is based on the idea of cross-hop cooperation where the cooperation occurs across multiple hops, as oppose...",,November 2,10.1109/TCOMM.2010.091710.080208,https://ieeexplore.ieee.org/document/5590328,new
ieee:5610712,journal,A Min-Sum Iterative Decoder Based on Pulsewidth Message Encoding,"Kevin Cushon, Camille Leroux, Saied Hemati, Shie Mannor, Warren J. Gross","In this brief, we introduce a new iterative decoder implementation called pulsewidth-modulated min-sum (PWM-MS), in which messages are exchanged in a pulsewidth-encoded format. The advantages of this method are low switching activity, very low complexity check nodes, low routing congestion, and excellent energy efficiency. We implement a fully parallel PWM offset MS decoder for a (660, 484) regula...",,Nov. 2010,10.1109/TCSII.2010.2082970,https://ieeexplore.ieee.org/document/5610712,new
ieee:5563107,magazine,Joint Source and Channel Coding,"Maria Fresia, Fernando Peréz-Cruz, H. Vincent Poor, Sergio Verdú","The objectives of this article are two-fold: First, to present the problem of joint source and channel (JSC) coding from a graphical model perspective and second, to propose a structure that uses a new graphical model for jointly encoding and decoding a redundant source. In the first part of the article, relevant contributions to JSC coding, ranging from the Slepian-Wolf problem to joint decoding ...",,Nov. 2010,10.1109/MSP.2010.938080,https://ieeexplore.ieee.org/document/5563107,new
ieee:5607213,journal,"A 26.9 K 314.5 Mb/s Soft (32400,32208) BCH Decoder Chip for DVB-S2 System","Yi-Min Lin, Chih-Lung Chen, Hsie-Chia Chang, Chen-Yi Lee","This paper provides a soft Bose-Chaudhuri-Hochquenghem (BCH) decoder chip with soft information from the LDPC decoder for the DVB-S2 system. In contrast with the hard BCH decoder, the proposed soft BCH decoder that deals with least reliable bits can provide much lower complexity with similar error-correcting performance. Moreover, the error locator evaluator is proposed to evaluate error locations...",,Nov. 2010,10.1109/JSSC.2010.2065630,https://ieeexplore.ieee.org/document/5607213,new
ieee:5582270,journal,Transform-Domain Adaptive Correlation Estimation (TRACE) for Wyner–Ziv Video Coding,"Xiaopeng Fan, Oscar C. Au, Ngai Man Cheung",Wyner-Ziv video coding (WZVC) is a newly emerged video coding scheme which compresses the input video frames with the side information (SI) frames only available at the decoder. WZVC exploits the statistics between the source frame and the SI frame at the decoder by utilizing their correlation information. This correlation information is important but also difficult to estimate due to the absence ...,,Nov. 2010,10.1109/TCSVT.2010.2077472,https://ieeexplore.ieee.org/document/5582270,new
ieee:5547000,journal,Relaxation Dynamics in Stochastic Iterative Decoders,"Saeed Sharifi Tehrani, Chris Winstead, Warren J. Gross, Shie Mannor, Sheryl L. Howard, Vincent C. Gaudet",Stochastic decoding is a recently proposed approach for graph-based iterative error control decoding. We present and investigate three hysteresis methods for stochastic decoding on graphs with cycles and show their close relationship with the successive relaxation method. Implementation results demonstrate the tradeoff in bit error rate performance with circuit complexity.,,Nov. 2010,10.1109/TSP.2010.2066269,https://ieeexplore.ieee.org/document/5547000,new
ieee:5605383,journal,Error Correcting Coding for a Nonsymmetric Ternary Channel,"Nicolas Bitouzé, Alexandre Graell i Amat, Eirik Rosnes","Ternary channels can be used to model the behavior of some memory devices, where information is stored in three different levels. In this paper, error correcting coding for a ternary channel where some of the error transitions are not allowed, is considered. The resulting channel is nonsymmetric, therefore, classical linear codes are not optimal for this channel. We define the maximum-likelihood (...",,Nov. 2010,10.1109/TIT.2010.2069211,https://ieeexplore.ieee.org/document/5605383,new
ieee:5605381,journal,Grassmannian Packings From Operator Reed–Muller Codes,"Alexei Ashikhmin, A. Robert Calderbank","This paper introduces multidimensional generalizations of binary Reed–Muller codes where the codewords are projection operators, and the corresponding subspaces are widely separated with respect to the chordal distance on Grassmannian space. Parameters of these Grassmannian packings are derived and a low complexity decoding algorithm is developed by modifying standard decoding algorithms for binar...",,Nov. 2010,10.1109/TIT.2010.2070192,https://ieeexplore.ieee.org/document/5605381,new
ieee:5716617,conference,A 5.7Gbps row-based layered scheduling LDPC decoder for IEEE 802.15.3c applications,"Shiang-Yu Hung, Shao-Wei Yen, Chih-Lung Chen, Hsie-Chia Chang, Shyh-Jye Jou, Chen-Yi Lee","A LDPC decoder chip supporting four code rates of IEEE 802.15.3c applications is presented. The row-based layered scheduling with normalized min-sum algorithm is proposed to reduce the iteration number while maintaining similar performance. In addition, the reconfigurable 8/16/32-input sorter is designed to deal with four LDPC codes. In order to alleviate routing complexity, both of the reallocati...",,8-10 Nov. ,10.1109/ASSCC.2010.5716617,https://ieeexplore.ieee.org/document/5716617,new
ieee:5716619,conference,A 5.35 mm2 10GBASE-T Ethernet LDPC decoder chip in 90 nm CMOS,"Alessandro Cevrero, Yusuf Leblebici, Paolo Ienne, Andreas Burg",A partially parallel low density parity check (LDPC) decoder compliant with the IEEE 802.3an standard for 100BASE-T Ethernet is presented. The design is optimized for minimum silicon area and is based on the layered offset-min-sum algorithm which speeds up the convergence of the message passing decoding algorithm. To avoid routing congestion the decoder architecture employs a novel communication s...,,8-10 Nov. ,10.1109/ASSCC.2010.5716619,https://ieeexplore.ieee.org/document/5716619,new
ieee:5716618,conference,A 15.8 pJ/bit/iter quasi-cyclic LDPC decoder for IEEE 802.11n in 90 nm CMOS,"C. Roth, P. Meinerzhagen, C. Studer, A. Burg",We present a low-power quasi-cyclic (QC) low density parity check (LDPC) decoder that meets the throughput requirements of the highest-rate (600 Mbps) modes of the IEEE 802.11n WLAN standard. The design is based on the layered offset-min-sum algorithm and is runtime-programmable to process different code matrices (including all rates and block lengths specified by IEEE 802.11n). The register-trans...,,8-10 Nov. ,10.1109/ASSCC.2010.5716618,https://ieeexplore.ieee.org/document/5716618,new
ieee:5661521,conference,The Implementation of Block Low-Density Parity-Check Code Codec on FPGA,"Wen Xue, Jianxin Wang, Guangzu Liu, Riqin Chen",In this paper we introduce the implementation of a block-LDPC codec on FPGA with simulation. The result shows that this codec is suitable for block LDPC with less resource consumption.,,7-9 Nov. 2,10.1109/ICEEE.2010.5661521,https://ieeexplore.ieee.org/document/5661521,new
ieee:5698804,conference,Three-dimensional nonbinary-LDPC-coded modulation schemes for high speed optical fiber transmission,"Murat Arabaci, Hussam G. Bathson, Ivan B. Djordjevic, Ted Schmidt, Ross Saunders, Roberto Marcoccia","We propose coded-modulation schemes employing three-dimensional constellations and component nonbinary LDPC codes to enable high-speed optical communications. Compared to polarization-division-multiplexed QPSK, the proposed scheme improves coding gain by ~2dB even at the BER of 10-6.",,7-11 Nov. ,10.1109/PHOTONICS.2010.5698804,https://ieeexplore.ieee.org/document/5698804,new
ieee:5698928,conference,Subcarrier-multiplexed four-dimensional LDPC coded modulation for high speed optical transmission systems,"Hussam G. Batshon, Ivan B. Djordjevic, Ted Schmidt","In this paper, we propose a subcarrier-multiplexed four-dimensional LDPC-coded modulation scheme suitable to achieve 400 Gb/s single-channel transmission rate over optical channels. The proposed scheme outperforms the corresponding polarization multiplexing schemes by up to 4.4 dB in OSNR at BER 10-6.",,7-11 Nov. ,10.1109/PHOTONICS.2010.5698928,https://ieeexplore.ieee.org/document/5698928,new
ieee:5698981,conference,Orbital angular momentum (OAM) based LDPC-coded free-space optical communication,Ivan B. Djordjevic,An orbital angular momentum (OAM) based LDPC-coded modulation scheme suitable for use in FSO communication is proposed. We demonstrate that proposed scheme can operate under strong atmospheric turbulence regime and enable 100Gb/s optical transmission while employing 10Gb/s components.,,7-11 Nov. ,10.1109/PHOTONICS.2010.5698981,https://ieeexplore.ieee.org/document/5698981,new
ieee:5757907,conference,Equivocation of eve using two edge type LDPC codes for the binary erasure wiretap channel,"Mattias Andersson, Vishwambhar Rathi, Ragnar Thobaben, Joerg Kliewer, Mikael Skoglund","We consider transmission over a binary erasure wiretap channel using the code construction method introduced by Rathi et al. based on two edge type Low-Density Parity-Check (LDPC) codes and the coset encoding scheme. By generalizing the method of computing conditional entropy for standard LDPC ensembles introduced by Méasson, Montanari, and Urbanke to two edge type LDPC ensembles, we show how the ...",,7-10 Nov. ,10.1109/ACSSC.2010.5757907,https://ieeexplore.ieee.org/document/5757907,new
ieee:5757578,conference,Rate-compatible LDPC code decoder using check-node merging,"Anton Blad, Oscar Gustafsson, Meng Zheng, Zesong Fei","The use of rate-compatible error correcting codes offers several advantages as compared to the use of fixed-rate codes: a smooth adaptation to the channel conditions, the possibility of incremental Hybrid ARQ schemes, as well as sharing of the encoder and decoder implementations between the codes of different rates. In this paper, the implementation of a decoder for rate-compatible quasi-cyclic LD...",,7-10 Nov. ,10.1109/ACSSC.2010.5757578,https://ieeexplore.ieee.org/document/5757578,new
ieee:5702882,conference,Sparse-graph codes for information reconciliation in QKD applications,"Fabio Mesiti, Maria Delgado, Marina Mondin, Fred Daneshgaran","This paper deals with the use of sparse-graph codes (and in particular, Low density Parity Check - LDPC - codes) for information reconciliation and pre-data sifting in Quantum Key Distribution (QKD). We model the overall channel used in QKD as the parallel of the quantum channel, where the actual quantum key is transmitted, and a public Additive White Gaussian Noise (AWGN) channel, where the parit...",,7-10 Nov. ,10.1109/ISABEL.2010.5702882,https://ieeexplore.ieee.org/document/5702882,new
ieee:5757594,conference,Compressive sensing based multiview image coding with belief propagation,"Parmida Beigi, Xiaoyu Xiu, Jie Liang","Multiview image acquisition systems usually involve many closely-located cameras. In some scenarios, it might be possible to significantly reduce the sample rates of some cameras and still reconstruct the corresponding images with good quality, by taking advantage of the side information from neighboring views. In this paper, we investigate the application of the belief propagation-based compressi...",,7-10 Nov. ,10.1109/ACSSC.2010.5757594,https://ieeexplore.ieee.org/document/5757594,new
ieee:5757839,conference,Polar codes for compress-and-forward in binary relay channels,"Ricardo Blasco-Serrano, Ragnar Thobaben, Vishwambhar Rathi, Mikael Skoglund","We construct polar codes for binary relay channels with orthogonal receiver components. We show that polar codes achieve the cut-set bound when the channels are symmetric and the relay-destination link supports compress-and-forward relaying based on Slepian-Wolf coding. More generally, we show that a particular version of the compress-and-forward rate is achievable using polar codes for Wyner-Ziv ...",,7-10 Nov. ,10.1109/ACSSC.2010.5757839,https://ieeexplore.ieee.org/document/5757839,new
ieee:5680317,conference,A design of rate-adaptive LDPC codes for distributed source coding using PEG algorithm,"Min Jang, Jin Whan Kang, Sang-Hyo Kim","We propose a method for constructing rate-adaptive low-density parity check (LDPC) codes with large girth by syndrome merging with progressive-edge-growth (PEG) algorithm. Proposed scheme has a different structure from LDPC accumulate (LDPCA) codes. As a result, the new construction method turns the girth up for each specific code, and eliminates error floor.",,31 Oct.-3 ,10.1109/MILCOM.2010.5680317,https://ieeexplore.ieee.org/document/5680317,new
ieee:5679760,conference,"A novel structure of high rate (3,L) regular QC-LDPC codes for magnetic recording channels","Mongkol Kupimai, Virasit Imtawil, Anupap Meesomboon, Puripong Suthisopapan","The novel structure of high rate (3,L) regular QC-LDPC codes based on circulant permutation matrices are presented in this paper. The parity-check matrix of the proposed code consists of permutation matrices, their transpose matrices and identity matrices. With this new method, the proposed code is free from girth 4, girth 6, and sometimes girth 8. The construction of parity-check matrix of the pr...",,31 Oct.-3 ,10.1109/APCC.2010.5679760,https://ieeexplore.ieee.org/document/5679760,new
ieee:5680460,conference,Analysis of error-prone patterns for LDPC codes under belief propagation decoding,"Huanlin Li, Yanyan Cao, Jeffrey C. Dill","Lowering the error floor of LDPC codes is extremely attractive to some systems, such as deep space communication systems and storage systems, which desire very low error rates. The error floor phenomenon of LDPC codes, which is associated with their message passing decoding algorithms, is mainly caused by some unfavorable combinatorial characteristics (or error-prone patterns) of LDPC codes. In th...",,31 Oct.-3 ,10.1109/MILCOM.2010.5680460,https://ieeexplore.ieee.org/document/5680460,new
ieee:5680340,conference,On iterative decoding of two-level superposition codes for cooperative broadcasting based on QPSK and 4-PAM constellations,Robert Morelos-Zaragoza,This paper considers iterative decoding of two-level superposition codes used in cooperative broadcasting over wireless networks. The coding scheme consists of two low-density parity-check (LDPC) codes combined using Plotkin&#39;s |u|u + v|-construction and provides two levels of error protection. Coding for cooperative broadcasting differs from conventional single-source broadcast coding. Instead of ...,,31 Oct.-3 ,10.1109/MILCOM.2010.5680340,https://ieeexplore.ieee.org/document/5680340,new
ieee:5680462,conference,Decoding of a quasi-cyclic LDPC code on a stream processor,"Jawone A. Kennedy, Daniel L. Noneaker","The TDMP layered belief-propagation algorithm is investigated for decoding a quasi-cyclic low-density parity-check code on a stream processor using fixed-point arithmetic. The effect of the processor&#39;s fixed-point resolution on the decoder performance is determined, and a simple technique is described for minimizing the performance penalty incurred when using the (highest throughput) lowest-resolu...",,31 Oct.-3 ,10.1109/MILCOM.2010.5680462,https://ieeexplore.ieee.org/document/5680462,new
ieee:5680414,conference,Increased dynamic range multi-rate waveform for mobile satellite communications: Adaptive Coding Spreading and Modulation (ACSM),"John O'Neill, Arthur Loh, Nirmal Velayudhan, Shay Har-Noy","For time-division multiplexed satellite communications links, a multi-rate waveform can enable substantial capacity gains over waveforms employing static coding and modulation. Using a multi-rate waveform such as DVB-S2 with adaptive coding and modulation (ACM), a user&#39;s data is transported with the most efficient modulation and forward error correction coding point that specific user can reliably...",,31 Oct.-3 ,10.1109/MILCOM.2010.5680414,https://ieeexplore.ieee.org/document/5680414,new
ieee:5720462,conference,A flexible ASIP decoder for combined binary and non-binary LDPC codes,"F. Naessens, A. Bourdoux, A. Dejonghe","This paper describes the implementation of a flexible combined binary and non-binary LDPC decoder. The ASIP architecture can be configured allowing re-use between both modes. Key in the architecture is parallelization, which is exploited in the SIMD engine. Binary LDPC codes intrinsically enables parallelization through layered decoding while in the non-binary case different trade-offs can be made...",,24-25 Nov.,10.1109/SCVT.2010.5720462,https://ieeexplore.ieee.org/document/5720462,new
ieee:5682908,conference,Reduced-complexity decoding of low-density parity check codes based on adaptive convergence,"Jia-Ning Su, Zhenghao Lu, Xiaopeng Yu, Yang Liu","Low-density parity-check (LDPC) codes have recently been considered as a viable candidate for forward error correction in system level hardware-redundant, fault-tolerant logics. An important factor that influences the choosing of a specific FEC technique in a nano-scale system implementation is its real-time performance, namely its computational complexity. In this paper, we propose a set of rules...",,22-23 Nov.,10.1109/SOCDC.2010.5682908,https://ieeexplore.ieee.org/document/5682908,new
ieee:5645968,conference,Hamming product code with iterative process for NAND flash memory controller,"Juhee Kim, Yong Jee","This paper presents a (32640, 30720, 224) iterative Hamming product code for forward error correction (FEC) in multi-level cell (MLC) NAND flash memory systems. The proposed code consists of folded product codes with processing (2040, 1920, 14) Hamming product codes, reiteratively, which are designed to be able to correct multiple burst or random errors. Experimental results show that coding gain ...",,2-4 Nov. 2,10.1109/ICCTD.2010.5645968,https://ieeexplore.ieee.org/document/5645968,new
ieee:5662204,conference,On the universality of LDPC code ensembles under belief propagation and ML decoding,"Boaz Shuval, Igal Sason","A universal design of low-density parity-check (LDPC) code ensembles which enables to operate reliably over various channels is of great interest. This paper considers the universality of LDPC code ensembles over sets of memoryless binary-input output-symmetric (MBIOS) channels, addressing their universality under belief-propagation (BP) and maximum-likelihood (ML) decoding. Based on the density e...",,17-20 Nov.,10.1109/EEEI.2010.5662204,https://ieeexplore.ieee.org/document/5662204,new
ieee:5661933,conference,Approximate iterative LP decoding of LDPC codes over GF(q) in linear complexity,"Dina Goldin, David Burshtein","The problem of low-complexity approximated linear programming (LP) decoding of LDPC codes over GF(q) is considered. An iterative algorithm with linear complexity was proposed by Burshtein for the binary case. However, this algorithm cannot be trivially generalized for the non-binary case, since the derivation uses the even parity property of the check nodes, which does not hold for codes over GF(q...",,17-20 Nov.,10.1109/EEEI.2010.5661933,https://ieeexplore.ieee.org/document/5661933,new
ieee:5661970,conference,Iterative multiuser detection for coded impulse radio systems,"Yehuda Shen Bahar, Ofer Amrani","Impulse-Radio (IR) is a wideband modulation technique that can support multiple users by employing random Time-Hopping (TH) combined with repeated transmissions. The latter is aimed at alleviating the impact of collisions. This work introduces a graphical model for describing the multiuser system which, in turn, facilitates the inclusion of general coding schemes. Based on factor graph representat...",,17-20 Nov.,10.1109/EEEI.2010.5661970,https://ieeexplore.ieee.org/document/5661970,new
ieee:5662100,conference,Finite blocklength coding for channels with side information at the receiver,"Amir Ingber, Meir Feder","The communication model of a memoryless channel that depends on a random state that is known at the receiver only is studied. The channel can be thought of as a set of underlying channels with a fixed state, where at each channel use one of these channels is chosen at random, and this selection is known to the receiver only. The capacity of a such channel is known, and is given by the expectation ...",,17-20 Nov.,10.1109/EEEI.2010.5662100,https://ieeexplore.ieee.org/document/5662100,new
