ID,Type,Title,Status,Reason,Authors,Abstract,Categories,Published,DOI,PDF URL
ieee:6638554,conference,Securewaveforms for SISO channels,❌,무선 보안 파형 설계(SINR/AN); ECC·LDPC 무관,"Ming Li, Sandipan Kundu, Dimitris A. Pados, Stella N. Batalama","We develop a novel waveform design approach to minimize the likelihood that a message transmitted wirelessly between trusted single-antenna nodes is intercepted by an eavesdropper. In particular, first, with knowledge of the eavesdropper's channel state information (CSI) we find the optimal waveform and transmit energy that minimize the signal-to-interference-plus-noise ratio (SINR) at the output of the eavesdropper's maximum-SINR linear filter, while at the same time provide the intended receiver with a required pre-specified SINR at the output of its own max-SINR filter. Next, if prior knowledge of the eavesdropper's CSI is unavailable, we design a waveform that maximizes the amount of energy available for generating disturbance to eavesdroppers, termed artificial noise (AN), while the SINR of the intended receiver is maintained at the pre-specified level. Simulation studies demonstrate our analytical developments and illustrate the benefits of the designed waveforms on securing single-input single-output (SISO) transmissions.",,26-31 May ,10.1109/ICASSP.2013.6638554,https://ieeexplore.ieee.org/document/6638554
ieee:6638520,conference,"Hybrid variational Bayesian channel estimation, demodulation and decoding for OFDM under sparse multipath channels",❌,"OFDM 변분베이즈 채널추정+Turbo 코딩 수신기; LDPC 무관, 떼어낼 바이너리 LDPC 디코더 기법 없음","Chulong Chen, Michael D. Zoltowski","In this paper, a novel hybrid OFDM receiver based on sparse variational Bayesian (VB) learning and soft-input soft-output decoding is proposed. By noticing that a key part of the inference problem approximated by VB (message-passing) methods may be inferred exactly, an genetic interfacing structure is proposed allowing the use of virtually all existing soft-input soft-output decoding schemes. Therefore the tasks of joint channel state estimation, demodulation and decoding are iteratively solved under the proposed hybrid variational Bayesian framework. The bit-interleaved coded modulation with Turbo coding is used to demonstrate the potential performance of the proposed structure. Very promising results in performance are observed in computer simulated experiments.",,26-31 May ,10.1109/ICASSP.2013.6638520,https://ieeexplore.ieee.org/document/6638520
ieee:6582088,conference,Memory scaling: A systems architecture perspective,❌,"메모리/DRAM 스케일링 시스템 아키텍처 서베이, NAND 언급은 부수적이며 떼어낼 LDPC 디코더/코드 기법 없음",Onur Mutlu,"The memory system is a fundamental performance and energy bottleneck in almost all computing systems. Recent system design, application, and technology trends that require more capacity, bandwidth, efficiency, and predictability out of the memory system make it an even more important system bottleneck. At the same time, DRAM technology is experiencing difficult technology scaling challenges that make the maintenance and enhancement of its capacity, energy-efficiency, and reliability significantly more costly with conventional techniques. In this paper, after describing the demands and challenges faced by the memory system, we examine some promising research and design directions to overcome challenges posed by memory scaling. Specifically, we survey three key solution directions: 1) enabling new DRAM architectures, functions, interfaces, and better integration of the DRAM and the rest of the system, 2) designing a memory system that employs emerging memory technologies and takes advantage of multiple different technologies, 3) providing predictable performance and QoS to applications sharing the memory system. We also briefly describe our ongoing related work in combating scaling challenges of NAND flash memory.",,26-29 May ,10.1109/IMW.2013.6582088,https://ieeexplore.ieee.org/document/6582088
ieee:6615299,conference,Computational complexities and relative performance of LDPC codes and turbo codes,❌,"LDPC vs Turbo 복잡도/성능 비교 — 표준 부호 비교 분석, 신규 디코더/구성/HW 기여 없음","Jiancun Zuo, Qiudong Sun, Fangming Zhao","This paper addresses the computational requirements and relative performance of low-density parity-check (LDPC) codes and Turbo codes. Detailed complexity analysis and exact formulas giving the required number of calculations are first presented for LDPC codes and Turbo codes, and then Monte Carlo simulations are performed to compare their relative performance at comparable computation cost. The numeral results show that even at moderate block length the optimized irregular LDPC codes can also beat Turbo codes with only 19% computational cost.",,23-25 May ,10.1109/ICSESS.2013.6615299,https://ieeexplore.ieee.org/document/6615299
ieee:6615401,conference,The information reconciliation protocol basing on error codes,❌,"QKD 정보조정(reconciliation)용 LDPC 개선—채널 ECC 아님, 떼어낼 디코더 양자화/HW 기법 명시 없음","Sun Niuniu, Zhang Shuilian, Xin Gang, Cai Wenbing","Information reconciliation (IR) is an important step in quantum key distribution (QKD). The error correcting codes are widely used in IR, which can also be seen as error correction. But it proved that this approach contains deleting the leaked information in practical applications. Error coding is not always a guarantee of the reconciliation. It only require of the data's consistency and security. In this paper, Author proposed an improvement scheme of LDPC code on the property of reconciliation and performed some number simulations to evaluate that method. It's shown that this method would achieve a higher efficiency than the original algorithm. Therefore, this algorithm has special important meaning to the key generation.",,23-25 May ,10.1109/ICSESS.2013.6615401,https://ieeexplore.ieee.org/document/6615401
ieee:6663513,conference,Data transfer paradigms for future networks: Fountain coding or congestion control?,❌,"fountain/erasure 코딩 vs 혼잡제어, 떼어낼 채널 LDPC ECC 기법 없음","Sándor Molnár, Zoltán Móczár, András Temesváry, Balázs Sonkoly, Szilárd Solymos, Tamás Csicsics","The research history of congestion control protocols has unveiled that it is difficult to find an optimal solution, which meets all the challenges of the evolving Internet. As an alternative paradigm recent studies suggest replacing congestion control with erasure coding techniques. In this paper we present a performance study of this approach comparing it with TCP based solutions. In order to investigate the new paradigm in details and also in practice, we have developed and implemented a novel transport protocol (Digital Fountain based Communication Protocol, DFCP) where an efficient digital fountain based erasure coding scheme plays the role of correcting packet loss. We present some analytical and simulation results together with our first performance comparisons in a testbed environment.",,22-24 May ,,https://ieeexplore.ieee.org/document/6663513
ieee:6565715,conference,Prototype of 3-Gb/s 60-GHz millimeter-wave-based wireless file-transfer system,❌,"60GHz 무선 파일전송 시스템 프로토타입, ECC/LDPC 디코더 기여 없음","Yasuo Asakura, Keitarou Kondou, Masashi Shinagawa, Shinya Tamonoki, Makoto Noda","We report the development of the prototype of a high-speed wireless file-transfer system using a 60-GHz band. The prototype achieved an effective user-data rate over 3 Gb/s using a quadrature-phase-shift keying modulation, including overheads of a physical layer and a retransmission control between two memory devices, by using a new 40-nm CMOS baseband LSI and automatic direct memory-access contro...",,20-24 May ,,https://ieeexplore.ieee.org/document/6565715
ieee:6572189,conference,A decoding algorithm with reduced complexity for non-binary LDPC codes over large fields,❌,비이진 NB-LDPC 대형 필드 디코딩 복잡도 저감. 비이진 LDPC 제외.,"Jun Lin, Zhiyuan Yan","Non-binary low-density parity-check (NB-LDPC) codes outperform their binary counterparts in some cases, but their high decoding complexity is a significant hurdle to their applications. In this paper, we propose a decoding algorithm with reduced computational complexities and smaller memory requirements for NB-LDPC codes over large fields. First, a simplified algorithm is proposed to reduce the computational complexity of variable node processing. To reduce memory requirements, existing NB-LDPC decoders often truncate the message vectors to a limited number nm of values. However, the memory requirements of these decoders remain high when the field size is large, since nm needs to be large enough to alleviate error performance degradation. In this paper, an improved trellised based check node processing algorithm is proposed to significantly reduce the memory requirement. The number of elements in a variable-to-check message is reduced to nv (nv <; nm). The sorted log likelihood ratio (LLR) vector of a check-to-variable message is approximated using a piece-wise linear function. Thus, only few LLRs are stored and other LLRs are computed on-the-fly when needed. For each a priori message, most LLRs are approximated with a linear function. Our numerical results demonstrate that the proposed decoding algorithm outperforms existing algorithms. Two LLR generation units (LGUs) are proposed to compute LLR vectors for check-to-variable messages, and the two LGUs require only a fraction of the area needed to store nm LLRs.",,19-23 May ,10.1109/ISCAS.2013.6572189,https://ieeexplore.ieee.org/document/6572189
ieee:6572101,conference,Memory efficient EMS decoding for non-binary LDPC codes,❌,비이진 NB-LDPC EMS 디코딩 메모리 효율화. 비이진 LDPC 제외.,"Leixin Zhou, Jin Sha, Yun Chen, Zhongfeng Wang","Non-binary low-density parity-check (NB-LDPC) codes are an extension of binary LDPC codes with significantly better performance when the code length is moderate. Previously, forward-backward schemes are used to implement check node processing, which need large amount of memory. In this paper, a novel approach-TCL-EMS is proposed for NB-LDPC decoding. Compared to original EMS decoding algorithm, the memory efficiency is improved and the average number of iterations is reduced significantly. Also, the overall decoder architecture is proposed.",,19-23 May ,10.1109/ISCAS.2013.6572101,https://ieeexplore.ieee.org/document/6572101
ieee:6572104,conference,Low-complexity layered iterative hard-reliability-based majority-logic decoder for non-binary quasi-cyclic LDPC codes,❌,비이진 QC-LDPC IHRB-MLGD 디코더. 비이진 LDPC 제외.,"Chenrong Xiong, Zhiyuan Yan","Non-binary low-density parity-check (NB-LDPC) codes have some advantages as opposed to their binary counterparts, but unfortunately their decoding complexity is a significant challenge. Hence, iterative hard-reliability-based majority-logic decoding (IHRB-MLGD) algorithms are attractive for NB-LDPC codes due to their low complexities. In this paper, we propose a layered improved iterative hard-reliability-based majority-logic decoding algorithm and design a partly parallel architecture for the proposed algorithm. Our improved algorithm achieves better error performance and faster convergence than existing IHRB-MLGD algorithms, while maintaining low complexities. The proposed partly parallel architecture achieves a throughput of 779 Mbps with SMIC 0.13um CMOS technology.",,19-23 May ,10.1109/ISCAS.2013.6572104,https://ieeexplore.ieee.org/document/6572104
ieee:6676436,conference,Improving the performance of new service overlaid ASK-DPSK WDM-PON with nonbinary LDPC coding,❌,비이진(NB-LDPC) 코딩 스킴 — 바이너리 한정 기준 위배,"Haiping Wang, Yang Lu, Biao Chen, Xuezhi Hong","We propose a novel nonbinary low-density parity-check (NB-LDPC) coding scheme for new service overlaid wavelength-division-multiplexed passive optical network (WDM-PON). In conventional binary coding scheme, each channel is encoded/decoded independently; while in our nonbinary coding scheme, old service channel and new service channel are encoded/decoded together. Compared with independent binary coding scheme, NB-LDPC coding scheme provides better bit-error-rate performance as shown by our simulation.",,16-18 May ,10.1109/WOCC.2013.6676436,https://ieeexplore.ieee.org/document/6676436
ieee:6676435,conference,Low-density parity-check code-based WDM-OFDM-PON,❌,"WDM-OFDM-PON 광통신 응용, LDPC 부수 사용·떼어낼 신규 ECC 기법 없음","Qinglong Luo, Min Feng, Chenglin Bai, Hao He, Weisheng Hu","In this letter, a WDM-OFDM-PON architecture using LDPC code is brought up to increase transmission range and system performance. In optical line terminal (OLT), LDPC-coded OFDM signal at 10-Gb/s is transmitted as downstream. At each optical network unit (ONU), the optical OFDM signal is demodulated with direct detection, and on-off keying date at 2.5-Gb/s is returned as upstream. Simulation results show that the transmission distance could exceed 20-km with negligible penalty.",,16-18 May ,10.1109/WOCC.2013.6676435,https://ieeexplore.ieee.org/document/6676435
ieee:6599815,conference,Recognition of channel encoder parameters from intercepted bitstream,❌,가로채기 비트스트림에서 채널부호 파라미터 인식(블라인드 식별) - ECC 디코더/구성/HW 기법 아님,"Yasser Karimian, Mahmoud Ahmadian Attari","We study recovering the channel encoder parameters for an unknown code from intercepted bitstream received from Binary Symmetric Channel in this paper. An iterative column elimination algorithm is introduced which attempts to eliminate parity bits in codewords of noisy data. This algorithm is very practical due to low complexity and use of XOR operator. Since, the computational complexity is low, searching for the length of code and synchronization is possible. Furthermore, the Hamming weight of the parity check words are only used in threshold computation and unlike other algorithms, they have negligible effect in the proposed algorithm. Eventually, experimental results are presented and estimations for the maximum noise level allowed for recovering the words of the parity check matrix are investigated.",,14-16 May ,10.1109/IranianCEE.2013.6599815,https://ieeexplore.ieee.org/document/6599815
ieee:6635852,conference,LDPC coded OFDM systems over broadband indoor power line channels: A performance analysis,❌,"PLC OFDM에 표준 LDPC 적용 성능분석 - 신규 디코더/구성/HW 기여 없음, 표준 부호 단순 사용","Yasin Kabalci, Ibrahim Develi, Ersan Kabalci","Power line communication (PLC) is an emerging technology that aims to provide communication over power lines. In this paper, bit error rate (BER) performances of low-density parity-check (LDPC) coded orthogonal frequency-division multiplexing (OFDM) systems have been investigated in broadband (BB) PLC channels. The performance analyses have been performed for three different indoor channel conditions that were generated by using new and more practical PLC channel model proposal. From the simulation results, it was demonstrated that the LDPC coding scheme offers considerable coding gain with reasonable encoding complexity in the whole channel conditions, when compared to uncoded OFDM systems.",,13-17 May ,10.1109/PowerEng.2013.6635852,https://ieeexplore.ieee.org/document/6635852
