ID,Type,Title,Authors,Abstract,Categories,Published,DOI,PDF URL,Status
ieee:4557334,conference,EXIT Chart Analysis of Binary Message-Passing Decoders,"Gottfried Lechner, Troels Pedersen, Gerhard Kramer","Binary message-passing decoders for LDPC codes are analyzed using EXIT charts. For the analysis, the variable node decoder performs all computations in the L-value domain. For the special case of a hard decision channel, this leads to the well-know Gallager B algorithm, while the analysis can be extended to channels with larger output alphabets. By increasing the output alphabet from hard decision...",,24-29 June,10.1109/ISIT.2007.4557334,https://ieeexplore.ieee.org/document/4557334,new
ieee:4557178,conference,Equalization on Graphs: Linear Programming and Message Passing,"Mohammad H. Taghavi, Paul H. Siegel","We propose an approximation of maximum-likelihood detection in ISI channels based on linear programming or message passing. We convert the detection problem into a binary decoding problem, which can be easily combined with LDPC decoding. We show that, for a certain class of channels and in the absence of coding, the proposed technique provides the exact ML solution without an exponential complexit...",,24-29 June,10.1109/ISIT.2007.4557178,https://ieeexplore.ieee.org/document/4557178,new
ieee:4557461,conference,Towards Understanding Weighted Bit-Flipping Decoding,"Xiaofu Wu, Cong Ling, Ming Jiang, Enyang Xu, Chunming Zhao, Xiaohu You","A natural relationship between weighted bit-flipping (WBF) decoding and message-passing decoding is explored. This understanding can help us develop a dual WBF decoding algorithm from one type of message-passing decoding algorithm and vice versa. For min-sum decoding, one can find that its dual WBF algorithm is the algorithm proposed by Jiang et al. For belief-propagation (BP) decoding, we propose...",,24-29 June,10.1109/ISIT.2007.4557461,https://ieeexplore.ieee.org/document/4557461,new
ieee:4557340,conference,Ordering Finite-State Markov Channels by Mutual Information,Andrew W. Eckford,"In previous work, an ordering result was given for the symbolwise probability of error using general Markov channels, under iterative decoding of LDPC codes. In this paper, the ordering result is extended to mutual information, under the assumption of an iid input distribution. For certain channels, in which the capacity-achieving input distribution is iid, this allows ordering of the channels by ...",,24-29 June,10.1109/ISIT.2007.4557340,https://ieeexplore.ieee.org/document/4557340,new
ieee:4557371,conference,Construction of a Lossy Source Code Using LDPC Matrices,"Shigeki Miyake, Jun Muramatsu","Research into applying LDPC code theory, which is used for channel coding, to source coding has received a lot of attention in several research fields such as Distributed Source Coding. In this paper a source coding problem with a fidelity criterion is considered. Matsunaga et al. [6] constructed a lossy code under the conditions of a binary alphabet, a uniform distribution, and a Hamming measure ...",,24-29 June,10.1109/ISIT.2007.4557371,https://ieeexplore.ieee.org/document/4557371,new
ieee:4557316,conference,A Combinatorial Family of Near Regular LDPC Codes,"K. Murali Krishnan, Rajdeep Singh, L. Sunil Chandran, Priti Shankar",An elementary combinatorial Tanner graph construction for a family of near-regular low density parity check (LDPC) codes achieving high girth is presented. These codes are near regular in the sense that the degree of a left/right vertex is allowed to differ by at most one from the average. The construction yields in quadratic time complexity an asymptotic code family with provable lower bounds on ...,,24-29 June,10.1109/ISIT.2007.4557316,https://ieeexplore.ieee.org/document/4557316,new
ieee:4557575,conference,A Note on Error Correction Schemes using LDPC codes with a High-Capacity Feedback Channel,"Naoto Kobayashi, Toshiyasu Matsushima, Shigeich Hirasawa","In this paper, transmission schemes with noiseless and high capacity feedback channel is considered. We propose two types of transmission schemes using LDPC codes and clarify the density evolution analysis method for these proposed schemes. We investigate the performance of the proposed schemes by the density evolution analysis and computer simulations. The result shows some interesting characteri...",,24-29 June,10.1109/ISIT.2007.4557575,https://ieeexplore.ieee.org/document/4557575,new
ieee:4557108,conference,Network Coding over a Noisy Relay : a Belief Propagation Approach,"Sichao Yang, Ralf Koetter","In recent years, network coding has been investigated as a method to obtain improvements in wireless networks. A typical assumption of previous work is that relay nodes performing network coding can decode the messages from sources perfectly. On a simple relay network, we design a scheme to obtain network coding gain even when the relay node cannot perfectly decode its received messages. In our sc...",,24-29 June,10.1109/ISIT.2007.4557108,https://ieeexplore.ieee.org/document/4557108,new
ieee:4557262,conference,Analysis and design of raptor codes for joint decoding using Information Content evolution,"Auguste Venkiah, Charly Poulliat, David Declercq","This paper is eligible for the student paper award. In this paper, we present an analytical analysis of the convergence of raptor codes under joint decoding over the binary input additive white noise channel (BIAWGNC), and derive an optimization method. We use information content evolution under Gaussian approximation, and focus on a new decoding scheme that proves to be more efficient: the joint ...",,24-29 June,10.1109/ISIT.2007.4557262,https://ieeexplore.ieee.org/document/4557262,new
ieee:4557496,conference,An Analysis of the Sum-Product Decoding of Analog Compound Codes,"Fangning Hu, Werner Henkel","We investigate the sum-product decoding on graphs of analog compound codes and show that the iterative decoding can be completely analyzed by tracing the mean vector at each iteration. A novel geometric analysis is proposed to visualize the iterative decoding process in the Euclidean space. Based on this geometric analysis, we propose to decompose the analog compound codes into several orthogonal ...",,24-29 June,10.1109/ISIT.2007.4557496,https://ieeexplore.ieee.org/document/4557496,new
ieee:4557511,conference,Module Codes in Group Rings,"Paul Hurley, Ted Hurley","A new construction method for codes using encodings from group rings is presented. They consist primarily of two types, zero-divisor and unit-derived codes. Previous codes from group rings focused on ideals; e.g. cyclic codes are ideals in the group ring over a cyclic group. The fresh focus is on the encodings themselves, which only under very limited conditions result in ideals. Using an isomorph...",,24-29 June,10.1109/ISIT.2007.4557511,https://ieeexplore.ieee.org/document/4557511,new
ieee:4557103,conference,Algebraic Superposition of LDGM Codes for Cooperative Diversity,"Lei Xiao, Thomas E. Fuja, Jorg Kliewer, Daniel J. Costello","This paper presents a technique for achieving cooperative spatial diversity using serially concatenated low density generator matrix (LDGM) codes. Specifically, we consider a scenario in which a pair of transceivers employ algebraic superposition of error control codes to effect spatial diversity at their common destination. The construction of LDGM codes from a sparse generator matrix makes them ...",,24-29 June,10.1109/ISIT.2007.4557103,https://ieeexplore.ieee.org/document/4557103,new
ieee:4557364,conference,Optimal Routing for the Gaussian Multiple-Relay Channel with Decode-and-Forward,"Lawrence Ong, Mehul Motani","In this paper, we study a routing problem on the Gaussian multiple relay channel, in which nodes employ a decode-and-forward coding strategy. We are interested in routes for the information flow through the relays that achieve the highest DF rate. We first construct an algorithm that provably finds optimal DF routes. As the algorithm runs in factorial time in the worst case, we propose a polynomia...",,24-29 June,10.1109/ISIT.2007.4557364,https://ieeexplore.ieee.org/document/4557364,new
ieee:4557246,conference,Constraint Relaxation and Annealed Belief Propagation for Binary Networks,"Yen-Chih Chen, Yu T. Su","In this paper, we propose two novel generalized belief propagation (BP) algorithms to improve the convergence behavior of the conventional BP algorithm. By incorporating a dynamic temperature into the free energy formulation, message passing is performed on a dynamic surface of energy cost. The proposed cooling process helps BP converge to a stable fixed point with a lower energy value that leads ...",,24-29 June,10.1109/ISIT.2007.4557246,https://ieeexplore.ieee.org/document/4557246,new
ieee:4557089,conference,"On the Dynamics of Analog Min-Sum Iterative Decoders, an Analytical Approach","Saied Hemati, Abbas Yongacoglu","In this paper, we show that an ideal analog min-sum decoder, in the log-likelihood ratio domain, can be considered as a piecewise linear system. Many theoretical aspects of these decoders, thus, can be studied analytically. It is also shown that the dynamic equations can become singular and degrade the decoding performance. When the decoder is nonsingular, the corresponding dynamic equations can b...",,24-29 June,10.1109/ISIT.2007.4557089,https://ieeexplore.ieee.org/document/4557089,new
ieee:4557497,conference,Encoding for the Blackwell Channel with Reinforced Belief Propagation,"Alfredo Braunstein, Farbod Kayhan, Guido Montorsi, Riccardo Zecchina","A key idea in coding for the broadcast channel (BC) is binning, in which the transmitter encode information by selecting a codeword from an appropriate bin (the messages are thus the bin indexes). This selection is normally done by solving an appropriate (possibly difficult) combinatorial problem. Recently it has been shown that binning for the Blackwell channel -a particular BC- can be done by it...",,24-29 June,10.1109/ISIT.2007.4557497,https://ieeexplore.ieee.org/document/4557497,new
ieee:4557110,conference,On Linear and Cyclic Codes for Correcting Deletions,"Khaled A. S. Abdel-Ghaffar, Hendrik C. Ferreira, Ling Cheng","The use of linear and cyclic codes for correcting synchronization errors is investigated. These codes are typically required to have the capability to correct substitution errors, which are the most common type of errors in most communication and storage systems. However, synchronization errors, associated with the deletion and insertion of symbols, can also occur and may cause severe performance ...",,24-29 June,10.1109/ISIT.2007.4557110,https://ieeexplore.ieee.org/document/4557110,new
ieee:4557436,conference,"Compound conditional source coding, Slepian-Wolf list decoding, and applications to media coding","Stark C. Draper, Emin Martinian","We introduce a novel source coding problem, compound conditional source coding. We describe how a number of media coding problems can be cast into this framework. We develop the achievable rate region for this problem and error exponent results. We show that the reliability function of compound conditional source coding is as least as large as the list-decoding error exponent of Slepian-Wolf codin...",,24-29 June,10.1109/ISIT.2007.4557436,https://ieeexplore.ieee.org/document/4557436,new
ieee:4557388,conference,On the ARMA Approximation for Frequency-Flat Rayleigh Fading Channels,"Alan Barbieri, Amina Piemontese, Giulio Colavolpe","We consider a terrestrial wireless channel, whose statistical model under flat-fading conditions is due to Clarke. A lot of papers in the literature deal with receivers for this scenario, aiming at estimating and tracking the time-varying channel, possibly with the aid of known (pilot) symbols. A common approach to derive receivers of reasonable complexity is to resort to a Kalman filter which is ...",,24-29 June,10.1109/ISIT.2007.4557388,https://ieeexplore.ieee.org/document/4557388,new
ieee:4557204,conference,Optimum Linear LLR Calculation for Iterative Decoding on Fading Channels,"Raman Yazdani, Masoud Ardakani","On a fading channel with no channel state information at the receiver, calculating true log-likelihood ratios (LLR) is complicated. Existing work assume that the power of the additive noise is known and use the expected value of the fading gain in a linear function of the channel output to find approximate LLRs. In this work, we first assume that the power of the additive noise is known and we fin...",,24-29 June,10.1109/ISIT.2007.4557204,https://ieeexplore.ieee.org/document/4557204,new
ieee:4557203,conference,EXIT-Chart Based Labeling Design for Bit-interleaved Coded Modulation with Iterative Decoding,"Tsang-Wei Yu, Chu-Yan Wang, Chung-Hsuan Wang, Wern-Ho Sheen","In this paper, labeling is jointly designed with the outer code by the EXIT chart based analysis to improve the performance of bit-interleaved coded modulation with iterative decoding. A systematic design methodology is proposed for regular modulation schemes which can easily obtain a set of labelings with various slopes. Given an outer code, the optimal labeling which has the steepest slope but s...",,24-29 June,10.1109/ISIT.2007.4557203,https://ieeexplore.ieee.org/document/4557203,new
ieee:4557389,conference,"A family of non-binary TLDPC codes: density evolution, convergence and thresholds","Iryna Andriyanova, Jean-Pierre Tillich","We generalize the results about how to compute iterative decoding thresholds over the binary erasure channel of non-binary LDPC code ensembles of [16] to non-binary TLDPC codes [2], [3]. We show in this case how density evolution can be performed in order to calculate iterative decoding thresholds and find several families with a very simple regular structure and thresholds close to the Shannon li...",,24-29 June,10.1109/ISIT.2007.4557389,https://ieeexplore.ieee.org/document/4557389,new
ieee:4557357,conference,Exact solution for the conditional entropy of Poissonian LDPC codes over the Binary Erasure Channel,"Satish Babu Korada, Shrinivas Kudekar, Nicolas Macris","We consider communication over a binary erasure channel with low density parity check codes and optimal maximum a posteriori decoding. It is known that the problem of computing the average conditional entropy, over such code ensembles, in the asymptotic limit of large block length is closely related to computing the free energy of a mean field spin glass in the thermodynamic limit. Tentative, but ...",,24-29 June,10.1109/ISIT.2007.4557357,https://ieeexplore.ieee.org/document/4557357,new
ieee:4557123,conference,Codes for Multi-Level Flash Memories: Correcting Asymmetric Limited-Magnitude Errors,"Yuval Cassuto, Moshe Schwartz, Vasken Bohossian, Jehoshua Bruck",Several physical effects that limit the reliability and performance of Multilevel Flash memories induce errors that have low magnitude and are dominantly asymmetric. This paper studies block codes for asymmetric limited-magnitude errors over q-ary channels. We propose code constructions for such channels when the number of errors is bounded by t. The construction uses known codes for symmetric err...,,24-29 June,10.1109/ISIT.2007.4557123,https://ieeexplore.ieee.org/document/4557123,new
ieee:4557335,conference,EXIT Functions of Hadamard Components in Repeat-Zigzag-Hadamard (RZH) Codes,"Kai Li, Xiaodong Wang, Alexei Ashikhmin",We investigate the extrinsic information transfer (EXIT) functions of Hadamard codes in the context of repeat- zigzag Hadamard (RZH) codes with parallel decoding. The derived EXIT functions can serve as an effective tool for designing low-rate IRZH codes with parallel decoding in BIAWGN channels.,,24-29 June,10.1109/ISIT.2007.4557335,https://ieeexplore.ieee.org/document/4557335,new
ieee:4557111,conference,EXIT and Density Evolution Analysis for Homogeneous Expectation Propagation,John MacLaren Walsh,We extend Gaussian approximation density evolution (DE) techniques from the soft iterative decoding of turbo and low density parity check (LDPC) codes to the performance and convergence analysis of belief propagation (BP) and expectation propagation (EP) in randomly connected very large sparse homogeneous factor graphs. A strict form of the Gaussian approximation allows the use of extrinsic inform...,,24-29 June,10.1109/ISIT.2007.4557111,https://ieeexplore.ieee.org/document/4557111,new
ieee:4557159,conference,Generating functional analysis of CDMA soft-decision multiuser detector,"K. Mimura, M. Okada","We investigate detection dynamics of a soft parallel interference canceller (soft-PIC), which includes a hard PIC as a special case, for CDMA multiuser detection, applied to a randomly spread, fully synchronous base-band uncoded CDMA channel model with additive white Gaussian noise (AWGN) under perfect power control in the large-system limit. We analyze the detection dynamics of the soft-PIC and t...",,24-29 June,10.1109/ISIT.2007.4557159,https://ieeexplore.ieee.org/document/4557159,new
ieee:4557385,conference,Multilevel Coding for Fading Channels,"Mei Chen, Oliver M. Collins","This paper proposes a multilevel coding system with linear mapping for fading channels. The receiver performs multi-stage decoding. Each stage employs the decision-aided successive estimation and decoding method that decouples the channel estimation and decoding without loss of information. As a result, existing codes designed for memoryless channels can be applied directly. The overall system can...",,24-29 June,10.1109/ISIT.2007.4557385,https://ieeexplore.ieee.org/document/4557385,new
ieee:4288785,conference,ACE Spectrum of LDPC Codes and Generalized ACE Design,"D. Vukobratovic, A. Djurendic, V. Senk","The construction of good, finite-length, LDPC codes is currently an attractive research area. Reducing attention to the binary erasure channel (BEC), this problem translates into the problem of finding elements of selected (irregular) LDPC code ensemble with the size of the minimal stopping set being maximized. Faced with the lack of analytical solution to this problem, simple but powerful heurist...",,24-28 June,10.1109/ICC.2007.114,https://ieeexplore.ieee.org/document/4288785,new
ieee:4288783,conference,A Modified Bit-Flipping Decoding Algorithm for Low-Density Parity-Check Codes,"T. M. N. Ngatched, F. Takawira, M. Bossert","In this paper, a modified bit-flipping decoding algorithm for low-density parity-check (LDPC) codes is proposed. Both improvement in performance and reduction in decoding delay are observed by flipping multiple bits in each iteration. Our studies show that the proposed algorithm achieves an appealing tradeoff between performance and complexity for many constructions of LDPC codes.",,24-28 June,10.1109/ICC.2007.112,https://ieeexplore.ieee.org/document/4288783,new
ieee:4288832,conference,Quasi-Cyclic Low-Density Parity-Check Codes in the McEliece Cryptosystem,"M. Baldi, F. Chiaraluce, R. Garello, F. Mininni","In this paper, a new variant of the McEliece cryptosystem, based on quasi-cyclic low-density parity-check (QC-LDPC) codes, is studied. In principle, such codes can substitute Goppa codes, originally used by McEliece; their adoption, however, is subject to cryptanalytic evaluation to ensure sufficient system robustness. The authors conclude that some families of QC-LDPC codes, based on circulant pe...",,24-28 June,10.1109/ICC.2007.161,https://ieeexplore.ieee.org/document/4288832,new
ieee:4288827,conference,Lowering Error Floor of LDPC Codes Using a Joint Row-Column Decoding Algorithm,"Z. He, S. Roy, P. Fortier","Low-density parity-check codes using the belief-propagation decoding algorithm tend to exhibit a high error floor in the bit error rate curves, when some problematic graphical structures, such as the so-called trapping sets, exist in the corresponding Tanner graph. This paper presents a joint row-column decoding algorithm to lower the error floor, in which the column processing is combined with th...",,24-28 June,10.1109/ICC.2007.156,https://ieeexplore.ieee.org/document/4288827,new
ieee:4288787,conference,An Efficient Analysis of Finite-Length LDPC Codes,"R. Yazdani, M. Ardakani","An efficient method for finite-length low-density parity-check (LDPC) code analysis is proposed. This method is based on studying the channel variations when observed during a finite-length codeword. To this end, channel parameters are interpreted as random variables and their distributions are found. Assuming that a decoding failure is the result of an observed channel worse than the code&#39;s decod...",,24-28 June,10.1109/ICC.2007.116,https://ieeexplore.ieee.org/document/4288787,new
ieee:4288831,conference,Systematic Modification of Parity-Check Matrices for Efficient Encoding of LDPC Codes,"M. Shaqfeh, N. Goertz","An algorithm for efficient encoding of LDPC codes is presented that does not impose any restrictions on the construction of the parity-check matrices. The algorithm modifies the parity check matrix, without changing the subspace spanned by its rows, by removing linear dependent rows and adding a small number of new rows such that the graph-based message-passing encoder will not get stuck in a stop...",,24-28 June,10.1109/ICC.2007.160,https://ieeexplore.ieee.org/document/4288831,new
ieee:4289703,conference,Quantization Effects in Low-Density Parity-Check Decoders,"Z. Zhang, L. Dolecek, M. Wainwright, V. Anantharam, B. Nikolic","A. class of combinatorial structures, called absorbing sets, strongly influences the performance of low-density parity- check (LDPC) decoders. In particular, the quantization scheme strongly affects which absorbing sets dominate in the error-floor region. Absorbing sets may be characterized as weak or strong. They are a characteristic of the parity check matrix of a code. Conventional quantization...",,24-28 June,10.1109/ICC.2007.1032,https://ieeexplore.ieee.org/document/4289703,new
ieee:4288788,conference,On the Enhancement of LDPC Codes in the IEEE 802.16 Physical Layer,"K. ElMahgoub, M. Nafie","In this paper we study low density party check (LDPC) codes used in the IEEE 802.16 physical layer standard. We introduce two novel techniques to enhance the performance of such codes. In the first technique, we use the binary parity check matrix proposed in the IEEE 802.16 standard, and propose a novel parity check matrix for LDPC codes over GF(4) with the non-zero entries chosen to maximize the ...",,24-28 June,10.1109/ICC.2007.117,https://ieeexplore.ieee.org/document/4288788,new
ieee:4289359,conference,Equivalent-Capacity-Based Design of Space-Time Block-Coded Sphere-Packing-Aided Multilevel Coding,"R. Y. S. Tee, O. Alamri, S. X. Ng, L. Hanzo",A multilevel coding (MLC) scheme invoking sphere packing (SP) modulation combined with space time block coding (STBC) is designed. The coding rates of each of the MLC component codes are determined using the so-called equivalent capacity based constituent-code rate-calculation procedure invoking a 4-dimensional (4D) sphere packing bit-to-symbol mapping scheme. Four different-rate Low-Density Parit...,,24-28 June,10.1109/ICC.2007.688,https://ieeexplore.ieee.org/document/4289359,new
ieee:4288829,conference,Informed Dynamic Scheduling for Belief-Propagation Decoding of LDPC Codes,"A. I. V. Casado, M. Griot, R. D. Wesel","Low-density parity-check (LDPC) codes are usually decoded by running an iterative belief-propagation, or message-passing, algorithm over the factor graph of the code. The traditional message-passing schedule consists of updating all the variable nodes in the graph, using the same pre-update information, followed by updating all the check nodes of the graph, again, using the same pre-update informa...",,24-28 June,10.1109/ICC.2007.158,https://ieeexplore.ieee.org/document/4288829,new
ieee:4289421,conference,VLSI Architectures for Layered Decoding for Irregular LDPC Codes of WiMax,"K. K. Gunnam, G. S. Choi, M. B. Yeary, M. Atiquzzaman","We present a new multi-rate architecture for decoding irregular LDPC codes in IEEE 802.16e WiMax standard. The proposed architecture utilizes the value-reuse property of offset min-sum, block-serial scheduling of computations and turbo decoding message passing algorithm. The decoder has the following advantages: 55% savings in memory, reduction of routers by 50%, and increase of throughput by 2tim...",,24-28 June,10.1109/ICC.2007.750,https://ieeexplore.ieee.org/document/4289421,new
ieee:4288828,conference,Design of Unequal Error Protection LDPC Codes for Higher Order Constellations,"N. von Deetzen, S. Sandberg","We present an optimization method for unequal error protection (UEP)-LDPC codes with higher order constellations. By modifying the density evolution algorithm under the Gaussian approximation, we propose a flexible code design algorithm for a variable number of protection classes and arbitrary modulation schemes with Gray mapping. Our results show that appropriate code design for higher order cons...",,24-28 June,10.1109/ICC.2007.157,https://ieeexplore.ieee.org/document/4288828,new
ieee:4288784,conference,A Class of LDPC Erasure Distributions with Closed-Form Threshold Expression,"E. Paolini, M. Chiani","In this paper, a family of low-density parity-check (LDPC) degree distributions, whose decoding threshold on the binary erasure channel (BEC) admits a simple closed form, is presented. These degree distributions are a subset of the check regular distributions (i.e. all the check nodes have the same degree), and are referred to as p-positive distributions. It is given proof that the threshold for a...",,24-28 June,10.1109/ICC.2007.113,https://ieeexplore.ieee.org/document/4288784,new
