ID,Type,Title,Authors,Abstract,Categories,Published,DOI,PDF URL,Status
ieee:4557440,conference,Generalized Stability Condition for Generalized and Doubly-Generalized LDPC Codes,"Enrico Paolini, Marc Fossorier, Marco Chiani","In this paper, the stability condition for low-density parity-check (LDPC) codes on the binary erasure channel (BEC) is extended to generalized LDPC (GLDPC) codes and doubly-generalized LDPC (D-GLDPC) codes. It is proved that, in both cases, the stability condition only involves the component codes with minimum distance 2. The stability condition for GLDPC codes is always expressed as an upper bou...",,24-29 June,10.1109/ISIT.2007.4557440,https://ieeexplore.ieee.org/document/4557440,new
ieee:4557538,conference,On the Mapping of Low-Density Parity-Check Codes for Bit-Interleaved Coded Modulation,"Gerd Richter, Axel Hof, Martin Bossert","Low-density parity-check (LDPC) codes are very powerful error correction codes for bit-interleaved coded modulation (BICM) schemes. In BICM schemes the bits of one symbol have unequal error protection. In this paper, we show how to improve the performance of given LDPC codes by mapping the variable nodes of certain degree in a special way to the different bit levels. Since the equivalent binary-in...",,24-29 June,10.1109/ISIT.2007.4557538,https://ieeexplore.ieee.org/document/4557538,new
ieee:4557664,conference,An Algorithm to Find All Small-Size Stopping Sets of Low-Density Parity-Check Matrices,"Eirik Rosnes, Oyvind Ytrehus","In this work, we introduce an efficient algorithm to find all stopping sets of size less than some threshold of a fixed low-density parity-check (LDPC) matrix. The solution is inspired by the algorithm proposed by Rosnes and Ytrehus in 2005 to find an exhaustive list of all small-size turbo stopping sets in a turbo code. The efficiency of the proposed algorithm is demonstrated by several numerical...",,24-29 June,10.1109/ISIT.2007.4557664,https://ieeexplore.ieee.org/document/4557664,new
ieee:4557297,conference,Turbo Decoding of Product Codes based on the Modified Adaptive Belief Propagation Algorithm,"Christophe Jego, Warren J. Gross","This paper introduces the Modified Adaptive Belief Propagation (m-ABP) algorithm, an innovative method for the turbo decoding of product codes based on BCH component codes. The Adaptive Belief Propagation algorithm of Jiang and Narayanan is simplified by moving the matrix adaptation step outside of the iteration loop, significantly reducing the complexity. Performance in terms of the bit- error-ra...",,24-29 June,10.1109/ISIT.2007.4557297,https://ieeexplore.ieee.org/document/4557297,new
ieee:4557405,conference,Rateless Slepian-Wolf Coding Based on Rate Adaptive Low-Density-Parity-Check Codes,"Jing Jiang, Dake He, Ashish Jagmohan",A rateless Slepian-Wolf coding (SWC) scheme based on rate adaptive low-density-parity-check (LDPC) codes is presented. We first motivate the application of punctured LDPC codes in SWC. A general rate adaptive LDPC framework is then described. The main idea is to adjust the puncturing ratio in the specified variable nodes for rate adaptivity while keeping the bipartite graph structure intact. As a ...,,24-29 June,10.1109/ISIT.2007.4557405,https://ieeexplore.ieee.org/document/4557405,new
ieee:4557138,conference,Error Rate Estimation of Finite-Length Low-Density Parity-Check Codes on Binary Symmetric Channels Using Cycle Enumeration,"Hua Xiao, Amir H. Banihashemi","The performance of low-density parity-check (LDPC) codes decoded by hard-decision iterative decoding algorithms can be accurately estimated if the weight J and the number |Ej| of the smallest error patterns that cannot be corrected by the decoder are known. To obtain J and |Ej|, one would need to perform the direct enumeration of error patterns with weight i les J. The complexity of enumeration in...",,24-29 June,10.1109/ISIT.2007.4557138,https://ieeexplore.ieee.org/document/4557138,new
ieee:4557666,conference,Stopping-Set Enumerator Approximations for Finite-Length Protograph LDPC Codes,"Kaiann Fu, Achilleas Anastasopoulos","Asymptotic analysis of low-density parity-check (LDPC) code weight and stopping-set enumerators, for codewords and stopping sets which grow linearly with codelength, has aided in designing codes with linear minimum distance and low error floors. However, the analysis cannot capture the behavior of codewords and stopping sets that grow sublinearly with codelength. Thus, it is unclear how well the a...",,24-29 June,10.1109/ISIT.2007.4557666,https://ieeexplore.ieee.org/document/4557666,new
ieee:4557555,conference,Cycle Analysis and Construction of Protographs for QC LDPC Codes With Girth Larger Than 12,"Sunghwan Kim, Jong-Seon No, Habong Chung, Dong-Joon Shin","A quasi-cyclic (QC) low-density parity-check (LDPC) code can be viewed as the protograph code with circulant permutation matrices. In this paper, we find all the subgraph patterns of protographs of QC LDPC codes having inevitable cycles of length 2i, i = 6,7,8,9,10, i.e., the cycles existing regardless of the shift values of circulants. It is also derived that if the girth of the protograph is 2g,...",,24-29 June,10.1109/ISIT.2007.4557555,https://ieeexplore.ieee.org/document/4557555,new
ieee:4557557,conference,Designing LDPC Codes without small trapping sets by using Tanner Graph Covers,"Milos Ivkovic, Shashi Kiran Chilappagari, Bane Vasic","We present a method for lowering the error floor of low-density parity check (LDPC) codes. It is based on Tanner graph covers that do not have trapping sets from the original code. The advantages of the method are that it is universal, as it can be applied to any LDPC code/channel model/decoding algorithm and it improves performance at the expense of increasing the code length, without losing the ...",,24-29 June,10.1109/ISIT.2007.4557557,https://ieeexplore.ieee.org/document/4557557,new
ieee:4557171,conference,Edge-based Scheduled BP in LDPC Codes,"Oren Golov, Ofer Amrani","This paper studies the potential performance gain, referred to as scheduling gain, when decoding LDPC codes using scheduled belief-propagation. Introducing genie-aided scheduling, it is shown that the scheduling-gain can be quite impressive for moderate and short-length codes. Adaptive schedule based on edge ordering is presented. This approach compares favorably with serial scheduling schemes bas...",,24-29 June,10.1109/ISIT.2007.4557171,https://ieeexplore.ieee.org/document/4557171,new
ieee:4557125,conference,Staircase and other structured linear-time encodable LDPC codes: analysis and design,"Federica Garin, Giacomo Como, Fabio Fagnani","We consider a family of codes which can be seen both as a special kind of serial turbo codes and as LDPC codes having a parity check matrix which is partly random and partly structured. These codes are linear-time encodable, thanks to the turbo structure, and can be decoded as LDPC codes. We provide an ensemble analysis for the waterfall region, on the line of classical results for serial turbo co...",,24-29 June,10.1109/ISIT.2007.4557125,https://ieeexplore.ieee.org/document/4557125,new
ieee:4557573,conference,Constellation Shaping using LDPC Codes,"Sunil Kaimalettu, Andrew Thangaraj, Matthieu Bloch, Steven W. McLaughlin","It is well-known that a Gaussian source distribution is required for maximum information transfer across a Gaussian channel. In a coded modulation system an equiprobable symbol constellation loses at most 1.53 dB when compared to a Gaussian source. To bridge this shaping gap, a code can be used to make the source distribution more Gaussian over an expanded constellation that results in lower avera...",,24-29 June,10.1109/ISIT.2007.4557573,https://ieeexplore.ieee.org/document/4557573,new
ieee:4557230,conference,Iterative LDPC decoding using neighborhood reliabilities,Valentin Savin,"In this paper we study the impact of the processing order of nodes of a bipartite graph, on the performance of an iterative message-passing decoding. To this end, we introduce the concept of neighborhood reliabilities of graph&#39;s nodes. Nodes reliabilities are calculated at each iteration and then are used to obtain a processing order within a serial or serial/parallel scheduling. The basic idea is...",,24-29 June,10.1109/ISIT.2007.4557230,https://ieeexplore.ieee.org/document/4557230,new
ieee:4557085,conference,On the error correction of regular LDPC codes using the flipping algorithm,David Burshtein,"We apply the iterative bit flipping algorithm to the standard regular low-density parity-check (LDPC) code ensemble. In the past it was shown, for a typical code in the ensemble with left degree at least five and block length sufficiently large, that this algorithm can correct all error patterns with some linear (in the block length) number of errors. We extend this result to the case where the le...",,24-29 June,10.1109/ISIT.2007.4557085,https://ieeexplore.ieee.org/document/4557085,new
ieee:4557391,conference,Constructing LDPC Codes by 2-Lifts,"Xudong Ma, En-hui Yang","With the motivation of constructing Low-Density Parity-Check (LDPC) codes with low error floors, we propose a new code construction scheme based on random 2-lifts. An analysis on stopping set distributions of the proposed code ensembles is presented. The analysis shows that low-weight stopping sets in the resulting codes are typically the results of stopping sets with weak graph expansion properti...",,24-29 June,10.1109/ISIT.2007.4557391,https://ieeexplore.ieee.org/document/4557391,new
ieee:4557569,conference,Tail-Biting LDPC Convolutional Codes,"Marcos B.S. Tavares, Kamil Sh. Zigangirov, Gerhard P. Fettweis","In this paper, the tail-biting version of the low-density parity-check convolutional codes (LDPCCCs) is introduced and investigated. The definition of the tail-biting LDPCCCs (TB-LDPCCCs) is given through their parity-check matrices and the basic ideas behind the architectures of the encoders and decoders for these codes are also presented. In addition, the asymptotical lower bound for the minimum...",,24-29 June,10.1109/ISIT.2007.4557569,https://ieeexplore.ieee.org/document/4557569,new
ieee:4557231,conference,Analytical Performance of One-Step Majority Logic Decoding of Regular LDPC Codes,"Rathnakumar Radhakrishnan, Sundararajan Sankaranarayanan, Bane Vasic","In this paper, we present a combinatorial algorithm to calculate the exact bit error rate performance of regular low-density parity check codes under one-step majority logic decoding. Majority logic decoders have regained importance in nano-scale memories due to their resilience to both memory and logic gate failures. This result is an extension of the work of Rudolph on error correction capabilit...",,24-29 June,10.1109/ISIT.2007.4557231,https://ieeexplore.ieee.org/document/4557231,new
ieee:4557390,conference,On Deriving Good LDPC Convolutional Codes from QC LDPC Block Codes,"Ali Emre Pusane, Roxana Smarandache, Pascal O. Vontobel, Daniel J. Costello","In this paper we study the iterative decoding behavior of time-invariant and time-varying LDPC convolutional codes derived by unwrapping QC LDPC block codes. In particular, for a time-varying LDPC convolutional code, we show that the minimum pseudo-weight of the convolutional code is at least as large as the minimum pseudo-weight of the underlying QC code. We also prove that the unwrapped convolut...",,24-29 June,10.1109/ISIT.2007.4557390,https://ieeexplore.ieee.org/document/4557390,new
ieee:4557160,conference,General entanglement-assisted quantum error-correcting codes,"Todd A. Brun, Igor Devetak, Min-Hsiu Hsieh","Entanglement-assisted quantum error-correcting codes (EAQECCs) make use of pre-existing entanglement between the sender and receiver to boost the rate of transmission. It is possible to construct an EAQECC from any classical linear code, unlike standard QECCs which can only be constructed from dual-containing codes. Operator quantum error-correcting codes (OQECCs) allow certain errors to be correc...",,24-29 June,10.1109/ISIT.2007.4557160,https://ieeexplore.ieee.org/document/4557160,new
ieee:4557169,conference,Asymptotically Good Woven Codes with Fixed Constituent Convolutional Codes,"Irina E. Bocharova, Boris D. Kudryashov, Rolf Johannesson, Victor V. Zyablov",A construction of woven graph codes based on constituent convolutional codes is studied. It is shown that within the random ensemble of such codes there exist asymptotically good codes with short fixed constituent codes. An example of a rate R = 1/3 woven graph code with free distance equal to 32 based on rate Rc = 2/3 constituent convolutional codes with overall constraint length 5 is given.,,24-29 June,10.1109/ISIT.2007.4557169,https://ieeexplore.ieee.org/document/4557169,new
ieee:4557323,conference,Quantum Quasi-Cyclic LDPC Codes,"Manabu Hagiwara, Hideki Imai","In this paper, a construction of a pair of quasi-cyclic LDPC codes to construct a quantum error-correcting code is proposed. Our construction method is based on algebraic combinatorics and have lots of variations for length, code rate.",,24-29 June,10.1109/ISIT.2007.4557323,https://ieeexplore.ieee.org/document/4557323,new
ieee:4557324,conference,A class of quantum LDPC codes: construction and performances under iterative decoding,"Thomas Camara, Harold Ollivier, Jean-Pierre Tillich",A generic method for constructing quantum LDPC codes is presented. We first explain how to overcome the difficulty of finding a set of low weight generators for the stabilizer group of the code. Our approach is based on a graph representation of the generators of the stabilizer group and on a simple local rule to ensure commutativity. We provide several specific examples of quantum LDPC codes obta...,,24-29 June,10.1109/ISIT.2007.4557324,https://ieeexplore.ieee.org/document/4557324,new
ieee:4557609,conference,Cryptanalysis of a new instance of McEliece cryptosystem based on QC-LDPC Codes,"Marco Baldi, Franco Chiaraluce","We adopt a class of quasi-cyclic low-density parity-check codes that allow to overcome the main limitations of the original McEliece cryptosystem based on Goppa codes, that are large key size and low transmission rate. The codes are designed by using a new algorithm based on &#34;random difference families&#34; that permits to construct very large sets of equivalent codes. An extensive cryptanalysis is de...",,24-29 June,10.1109/ISIT.2007.4557609,https://ieeexplore.ieee.org/document/4557609,new
ieee:4557531,conference,On Construction of Two Classes of Efficient Quantum Error-Correction Codes,"Peiyu Tan, Jing Li","Stabilizer codes are an important branch of quantum codes, but the existing stabilizer codes constructed from the classical binary codes almost exclusively belong to the special subclass of CSS codes. This paper develops simple and systematic constructions for two rich classes of non-CSS quantum stabilizer codes: quantum low density parity check (LDPC) codes based on classical quasi-cyclic LDPC co...",,24-29 June,10.1109/ISIT.2007.4557531,https://ieeexplore.ieee.org/document/4557531,new
ieee:4557567,conference,From Block to Convolutional Codes using Block Distances,"Vladimir Sidorenko, Carlos Medina, Martin Bossert","It is well known that convolutional codes can be considered as block codes over a field of rational functions. Being a block code, every convolutional code has &#34;block&#34; distance df. The free distance df of a convolutional code is lower bounded by d,B, df ges dB. With this approach, every method of designing or combining block codes immediately gives a method to design or to combine convolutional co...",,24-29 June,10.1109/ISIT.2007.4557567,https://ieeexplore.ieee.org/document/4557567,new
ieee:4557392,conference,On Codes Constructed by Generalized Kronecker Product,"Wen-Yao Chen, Chung-Chin Lu","In this paper, we apply generalized Kronecker product recursively to construct low-density parity-check (LDPC) codes with arbitrarily large girth. The parity check matrices of these codes are block matrices consisting of circulant permutation matrices, thus may benefit from efficient encoding. It turns out that the LU(m, q) codes proposed in the literature is a special case of this construction fo...",,24-29 June,10.1109/ISIT.2007.4557392,https://ieeexplore.ieee.org/document/4557392,new
ieee:4557244,conference,Multiple-Bases Belief-Propagation for Decoding of Short Block Codes,"Thorsten Hehn, Johannes B. Huber, Stefan Laendner, Olgica Milenkovic","A novel soft-decoding method for algebraic block codes is presented. The algorithm is designed for soft-decision decoding and is based on belief-propagation (BP) decoding using multiple bases of the dual code. Compared to other approaches for high-performance BP decoding, this method is conceptually simple and does not change at each stage of the decoding process. With its multiple BP decoders the...",,24-29 June,10.1109/ISIT.2007.4557244,https://ieeexplore.ieee.org/document/4557244,new
ieee:4557205,conference,Generalized Iterative Decoding for Linear Block Codes on the Binary Erasure Channel,"Khaled A.S. Abdel-Ghaffar, Jos H. Weber","The generalized iterative decoding concept offers attractive performance versus complexity trade-off opportunities in the spectrum between traditional iterative decoding and optimal decoding for linear block codes over the binary erasure channel. In each iteration, a system of equations is solved. The maximum number of equations to be solved in one iteration is called the order of the decoder. In ...",,24-29 June,10.1109/ISIT.2007.4557205,https://ieeexplore.ieee.org/document/4557205,new
ieee:4557166,conference,Improving the Performance of Protograph LDPC Codes by Using Different Transmission Energies,"Gerd Richter, Martin Bossert","Irregular low-density parity-check (LDPC) codes constructed from small protographs are one of the most powerful LDPC codes. In this paper, we show that the performance of LDPC codes based on small protographs can be further improved by using different transmission energies for every variable node of the protograph. Thus, a protograph is now described by a set of variable nodes, a set of check node...",,24-29 June,10.1109/ISIT.2007.4557166,https://ieeexplore.ieee.org/document/4557166,new
ieee:4557442,conference,Pseudo-codeword Landscape,"Michael Chertkov, Mikhail Stepanov","We discuss the performance of low-density-parity-check (LDPC) codes decoded by means of linear programming (LP) at moderate and large signal-to-noise-ratios (SNR). Utilizing a combination of the previously introduced pseudo-codeword-search method and a new &#34;dendro&#34; trick, which allows us to reduce the complexity of the LP decoding, we analyze the dependence of the frame-error-rate (FER) on the SNR...",,24-29 June,10.1109/ISIT.2007.4557442,https://ieeexplore.ieee.org/document/4557442,new
ieee:4557603,conference,Distributed Parameter Estimation with Side Information: A Factor Graph Approach,"Amin Zia, James P. Reilly, Shahram Shirani","In this paper, a low complexity algorithm for distributed maximum likelihood estimation of a binary symmetric source (BSS) using side-information is proposed. The estimation is formulated as an incomplete-data problem and is solved by the expectation-maximization (EM) algorithm. A low-complexity implementation of the algorithm using coset codes and LDPC-based syndrome decoding with message passing...",,24-29 June,10.1109/ISIT.2007.4557603,https://ieeexplore.ieee.org/document/4557603,new
ieee:4557574,conference,Explicit Construction of Type-II QC LDPC Codes with Girth at least 6,Kristine Lally,"Type-II quasi-cyclic (QC) LDPC codes are constructed from combinations of weight-0, weight-1 and weight-2 circulant matrices. The structure of cycles of length 2n are investigated, and necessary and sufficient conditions for a type-II QC LDPC parity check matrix H to have girth at least 2(n + 1) are given. An explicit construction of type-II codes which guarantees girth at least 6 is presented. A ...",,24-29 June,10.1109/ISIT.2007.4557574,https://ieeexplore.ieee.org/document/4557574,new
ieee:4557459,conference,ML decoding via mixed-integer adaptive linear programming,"Stark C. Draper, Jonathan S. Yedidia, Yige Wang","Linear programming (LP) decoding was introduced by Feldman et al. (IEEE Trans. Inform. Theory Mar. 2005) as a novel way to decode binary low-density parity-check codes. Taghavi and Siegel (Proc. ISIT 2006) describe a computationally simplified decoding approach they term &#34;adaptive&#34; LP decoding. Adaptive LP decoding starts with a sub-set of the LP constraints, and iteratively adds violated constrai...",,24-29 June,10.1109/ISIT.2007.4557459,https://ieeexplore.ieee.org/document/4557459,new
ieee:4557568,conference,Sequential Decoding with a Look-Ahead Path Metric,"Marcin Sikora, Daniel J. Costello","Convolutional codes are an efficient means of achieving reliable communication with low latency and complexity constraints. Since optimal Viterbi decoding of long (say, above 8) constraint length codes can be prohibitively complex, sequential decoders, such as the Zigangirov-Jelinek (ZJ) stack algorithm or the Fano algorithm can be applied. However, the performance of sequential algorithms is limi...",,24-29 June,10.1109/ISIT.2007.4557568,https://ieeexplore.ieee.org/document/4557568,new
ieee:4557272,conference,On the Maximally Recoverable Property for Multi-Protection Group Codes,"Minghua Chen, Cheng Huang, Jin Li","In this paper, we study the maximally recoverable (MR) property for multi-protection group (MPG) codes. MPG codes with MR property achieve the best erasure recoverability given configurations, where a configuration represents the structural relationship between data and parity symbols. We present construction and decoding algorithms for MPG codes with MR property. We show that both recoverability ...",,24-29 June,10.1109/ISIT.2007.4557272,https://ieeexplore.ieee.org/document/4557272,new
ieee:4557261,conference,Analysis of PCO Raptor codes and Turbo-Fountain Codes on Noiseless Channels,"Alberto Tarable, Sergio Benedetto","This paper deals with precode-only (PCO) Raptor codes and turbo fountain codes used on a noiseless channel, as it is the case for the BEC or the AWGN channel with high SNR. The performance measure for such family of codes is the efficiency, i.e., the amount of redundancy needed to decode the information bits. Following a previous paper, we give an exact expression for the average efficiency of max...",,24-29 June,10.1109/ISIT.2007.4557261,https://ieeexplore.ieee.org/document/4557261,new
ieee:4557143,conference,Moment Balancing Templates: Universal Constructions to Add Insertion/Deletion Correction Capability to Arbitrary Error Correcting or Constrained Codes,"Hendrik C. Ferreira, Khaled A. S. Abdel-Ghaffar, Ling Cheng, Theo G. Swart","We investigate extending a chosen block or convolutional code which has additive error correction capability, as predetermined by the usual communication systems or coding considerations. Our extension involves constructing a template to add additional redundant bits in positions, selected to balance the moment of the code word. Using some number theoretic constructions in the literature, insertio...",,24-29 June,10.1109/ISIT.2007.4557143,https://ieeexplore.ieee.org/document/4557143,new
ieee:4557156,conference,Doped Accumulate LT Codes,"Xiaojun Yuan, Li Ping","We introduce a family of rateless codes, namely the doped accumulate LT (DALT) codes, that are capacity-approaching on a binary erasure channel (BEC) with bounded encoding and decoding complexity. DALT codes can be either systematic or non-systematic. Non-systematic DALT codes are very similar to raptor codes, except that joint optimization on the full coding graph can be applied to DALT codes, an...",,24-29 June,10.1109/ISIT.2007.4557156,https://ieeexplore.ieee.org/document/4557156,new
ieee:4557564,conference,Superposition Coding for Power-and Bandwidth Efficient Communication over the Gaussian Channel,Harm S. Cronie,"A method for power- and bandwidth efficient communication over the Gaussian channel is presented. The method is based on the superposition of binary random variables. As an example we design a signal constellation for a spectral efficiency of 10 bit/s/Hz. The constellation has a constrained capacity limit only 0.18 dB from the Gaussian capacity limit. Moreover, we show that combined with multi-lev...",,24-29 June,10.1109/ISIT.2007.4557564,https://ieeexplore.ieee.org/document/4557564,new
ieee:4557663,conference,Average Stopping Set Weight Distribution of Redundant Random Matrix Ensembles,Tadashi Wadayama,"In this paper, redundant random matrix ensembles (abbreviated as redundant random ensembles) are defined and their stopping set (SS) weight distributions are analyzed. A redundant random ensemble consists of a set of binary matrices with linearly dependent rows. These linearly dependent rows (redundant rows) significantly reduce the number of stopping sets of small size. Upper and lower bounds on ...",,24-29 June,10.1109/ISIT.2007.4557663,https://ieeexplore.ieee.org/document/4557663,new
ieee:4557243,conference,Pattern Recognition System Design with Linear Encoding for Discrete Patterns,"Po-Hsiang Lai, Joseph A. O'Sullivan",Pattern recognition systems based on compressed patterns and compressed sensor measurements can be designed using low-density matrices. We examine truncation encoding where a subset of the patterns and measurements are stored perfrectly while the rest is discarded. We also examine the use of LDPC parity check matrices for compressing measurements and patterns. We show how more general ensembles of...,,24-29 June,10.1109/ISIT.2007.4557243,https://ieeexplore.ieee.org/document/4557243,new
