ID,Type,Title,Authors,Abstract,Categories,Published,DOI,PDF URL,Status
ieee:4237370,journal,Implementation of a Flexible LDPC Decoder,"Guido Masera, Federico Quaglio, Fabrizio Vacca","Low-density parity-check codes (LDPC) are among the most powerful error correcting tools today available. For this reason they became very popular in several applications such as the digital satellite broadcasting system (DVB-S2), wireless local area network (IEEE 802.11n) and metropolitan area network (802.16e). Whereas several code-specific decoders have been proposed in the literature, the impl...",,June 2007,10.1109/TCSII.2007.894409,https://ieeexplore.ieee.org/document/4237370,new
ieee:4282133,journal,Recent Advances in Turbo Code Design and Theory,"Branka Vucetic, Yonghui Li, Lance C. Perez, Fan Jiang",The discovery of turbo codes and the subsequent rediscovery of low-density parity-check (LDPC) codes represent major milestones in the field of channel coding. Recent advances in the design and theory of turbo codes and their relationship to LDPC codes are discussed. Several new interleaver designs for turbo codes are presented which illustrate the important role that the interleaver plays in thes...,,June 2007,10.1109/JPROC.2007.897975,https://ieeexplore.ieee.org/document/4282133,new
ieee:4215147,journal,Accumulate–Repeat–Accumulate Codes: Capacity-Achieving Ensembles of Systematic Codes for the Erasure Channel With Bounded Complexity,"Henry D. Pfister, Igal Sason","This paper introduces ensembles of systematic accumulaterepeataccumulate (ARA) codes which asymptotically achieve capacity on the binary erasure channel (BEC) with bounded complexity, per information bit, of encoding and decoding. It also introduces symmetry properties which play a central role in the construction of new capacity-achieving ensembles for the BEC. The results here improve on the tra...",,June 2007,10.1109/TIT.2007.896873,https://ieeexplore.ieee.org/document/4215147,new
ieee:4237479,journal,Design of Rate-Compatible Irregular Repeat Accumulate Codes,"Guosen Yue, Xiaodong Wang, Mohammad Madihian","We consider the design of efficient rate-compatible (RC) irregular repeat accumulate (IRA) codes over a wide code rate range. The goal is to provide a family of RC codes to achieve high throughput in hybrid automatic repeat request (ARQ) scheme for high-speed data packet wireless systems. As a subclass of low-density parity-check codes, IRA codes have an extremely simple encoder and a low-complexi...",,June 2007,10.1109/TCOMM.2007.898834,https://ieeexplore.ieee.org/document/4237479,new
ieee:4215135,journal,A Partial Ordering of General Finite-State Markov Channels Under LDPC Decoding,"Andrew W. Eckford, Frank R. Kschischang, Subbarayan Pasupathy","A partial ordering on general finite-state Markov channels is given, which orders the channels in terms of probability of symbol error under iterative estimation decoding of a low-density parity-check (LDPC) code. This result is intended to mitigate the complexity of characterizing the performance of general finite-state Markov channels, which is difficult due to the large parameter space of this ...",,June 2007,10.1109/TIT.2007.896877,https://ieeexplore.ieee.org/document/4215135,new
ieee:4202981,journal,Iterative Decoding Using Attenuated Extrinsic Information from Sum-Product Decoder for PMR Channel With Patterned Medium,"Yasuaki Nakamura, Mitsuhiro Nishimura, Yoshihiro Okamoto, Hisashi Osawa, Hajime Aoi, Hiroaki Muraoka, Yoshihisa Nakamura","An LDPC coding and iterative decoding system is studied in perpendicular magnetic recording (PMR) with a bit-patterned medium. We propose an iterative decoding scheme using attenuated extrinsic information from a sum-product decoder, and the bit error rate (BER) performance of the LDPC coding and iterative decoding system is evaluated by R/W computer simulations. It has been clarified that at an a...",,June 2007,10.1109/TMAG.2007.893421,https://ieeexplore.ieee.org/document/4202981,new
ieee:4215144,journal,Computing the Stopping Distance of a Tanner Graph Is NP-Hard,"Karunakaran Murali Krishnan, Priti Shankar",Two decision problems related to the computation f stopping sets in Tanner graphs are shown to be NP-complete. It follows as a consequence that there exists no polynomial time algorithm for computing the stopping distance of a Tanner graph unless P = NP.,,June 2007,10.1109/TIT.2007.896864,https://ieeexplore.ieee.org/document/4215144,new
ieee:4282117,journal,Channel coding: The road to channel capacity,"Daniel J. Costello, G. David Forney","Starting from Shannon&#39;s celebrated 1948 channel coding theorem, we trace the evolution of channel coding from Hamming codes to capacity-approaching codes. We focus on the contributions that have led to the most significant improvements in performance versus complexity for practical applications, particularly on the additive white Gaussian noise channel. We discuss algebraic block codes, and why th...",,June 2007,10.1109/JPROC.2007.895188,https://ieeexplore.ieee.org/document/4282117,new
ieee:4282124,journal,Turbo and Turbo-Like Codes: Principles and Applications in Telecommunications,"Ken Gracie, Marie-HÉlÈne Hamon","For decades, the de facto standard for forward error correction was a convolutional code decoded with the Viterbi algorithm, often concatenated with another code (e.g., a Reed-Solomon code). But since the introduction of turbo codes in 1993, much more powerful codes referred to collectively as turbo and turbo-like codes have eclipsed classical methods. These powerful error-correcting techniques ac...",,June 2007,10.1109/JPROC.2007.895197,https://ieeexplore.ieee.org/document/4282124,new
ieee:4202832,journal,Novel RLL-ECC Concatenation Scheme for High-Density Magnetic Recording,"Jin Lu, Keith G. Boyer","We propose a new run-length-limited (RLL)/error correction coding (ECC) concatenation scheme based on uniform interleaving. The new scheme reverses the positions of the ECC encoder and the RLL encoder in the classical RLL-ECC structure. Further, a uniform interleaver on the sender side and a uniform deinterleaver on the receiver side are added to the new scheme. We prove that uniform interleaving ...",,June 2007,10.1109/TMAG.2007.894008,https://ieeexplore.ieee.org/document/4202832,new
ieee:4203089,journal,Self-Compensation Technique for Simplified Belief-Propagation Algorithm,"Yen-Chin Liao, Chien-Ching Lin, Hsie-Chia Chang, Chih-Wei Liu","The min-sum algorithm is the most common method to simplify the belief-propagation algorithm for decoding low-density parity-check (LDPC) codes. However, there exists a performance gap between the min-sum and belief-propagation algorithms due to nonlinear approximation. In this paper, a self-compensation technique using dynamic normalization is thus proposed to improve the approximation accuracy. ...",,June 2007,10.1109/TSP.2007.893976,https://ieeexplore.ieee.org/document/4203089,new
ieee:4237471,journal,Iterative Decoding of Multiple-Step Majority Logic Decodable Codes,"Ravi Palanki, Marc P. C. Fossorier, Jonathan S. Yedidia",We investigate the performance of iterative decoding algorithms for multistep majority logic decodable (MSMLD) codes of intermediate length. We introduce a new bit-flipping algorithm that is able to decode these codes nearly as well as a maximum-likelihood decoder on the binary-symmetric channel. We show that MSMLD codes decoded using bit-flipping algorithms can outperform comparable Bose-Chaudhur...,,June 2007,10.1109/TCOMM.2007.898699,https://ieeexplore.ieee.org/document/4237471,new
ieee:4203072,journal,Lossless Source Coding Using Nested Error Correcting Codes,"Javad Haghighat, Walaa Hamouda, Mohammad Reza Soleymani","We propose a tree-structured variable-length random binning scheme for lossless source coding. The existing source coding schemes based on turbo codes, low-density parity check codes, and repeat accumulate codes can be regarded as practical implementations of this random binning scheme. For sufficiently large data blocks, we show that the proposed scheme asymptotically achieves the entropy limit. ...",,June 2007,10.1109/TSP.2007.893934,https://ieeexplore.ieee.org/document/4203072,new
ieee:4282128,journal,The Factor Graph Approach to Model-Based Signal Processing,"Hans-Andrea Loeliger, Justin Dauwels, Junli Hu, Sascha Korl, Li Ping, Frank R. Kschischang","The message-passing approach to model-based signal processing is developed with a focus on Gaussian message passing in linear state-space models, which includes recursive least squares, linear minimum-mean-squared-error estimation, and Kalman filtering algorithms. Tabulated message computation rules for the building blocks of linear models allow us to compose a variety of such algorithms without a...",,June 2007,10.1109/JPROC.2007.896497,https://ieeexplore.ieee.org/document/4282128,new
ieee:4282130,journal,Optimality and Duality of the Turbo Decoder,"Phillip A. Regalia, John MacLaren Walsh","The near-optimal performance of the turbo decoder has been a source of intrigue among communications engineers and information theorists, given its ad hoc origins that were seemingly disconnected from optimization theory. Naturally one would inquire whether the favorable performance might be explained by characterizing the turbo decoder via some optimization criterion or performance index. Recentl...",,June 2007,10.1109/JPROC.2007.896495,https://ieeexplore.ieee.org/document/4282130,new
ieee:4202781,journal,Performance Evaluation of Partial Response Targets for Perpendicular Recording Using Field Programmable Gate Arrays,"Seungjune Jeon, Xinde Hu, Lingyan Sun, B. V. K. Vijaya Kumar",We present the results of performance evaluation of partial response (PR) targets for perpendicular recording by simulation using a field programmable gate array (FPGA). Previous research proposed several PR targets for perpendicular recording channels. We evaluated the bit error rate (BER) performance of those PR targets. Different PR targets led to not only different BERs for given signal-to-noi...,,June 2007,10.1109/TMAG.2007.893424,https://ieeexplore.ieee.org/document/4202781,new
ieee:4279212,magazine,The OFDM-IDMA approach to wireless communication systems,"Li Ping, Qinghua Guo, Jun Tong","This article outlines the basic principles of OFDM-IDMA. Comparisons with other alternative technologies such as OFDM-CDMA and OFDMA are provided. Some attractive features of OFMD-IDMA are explained, including low-cost iterative multi-user detection, flexible rate adaptation, frequency diversity, and significant advantages regarding spectral and power efficiency.",,June 2007,10.1109/MWC.2007.386608,https://ieeexplore.ieee.org/document/4279212,new
ieee:4237154,journal,Opportunistic Spectral Usage: Bounds and a Multi-Band CSMA/CA Protocol,"Ashutosh Sabharwal, Ahmad Khoshnevis, Edward Knightly","In this paper, we study the gains from opportunistic spectrum usage when neither sender or receiver are aware of the current channel conditions in different frequency bands. Hence to select the best band for sending data, nodes first need to measure the channel in different bands which takes time away from sending actual data. We analyze the gains from opportunistic band selection by deriving an o...",,June 2007,10.1109/TNET.2007.893230,https://ieeexplore.ieee.org/document/4237154,new
ieee:4251165,journal,Constellation Shaping for Bandwidth-Efficient Turbo-Coded Modulation With Iterative Receiver,"Stephane Y. Le Goff, Boon Kien Khoo, Charalampos C. Tsimenidis, Bayan S. Sharif","This paper introduces a new technique for combining constellation shaping and bit-interleaved turbo-coded modulation (BITCM) over additive white Gaussian noise channel. The proposed scheme consists of serial concatenation of a binary turbo code, short-length binary shaping code, and mapping function using Gray labeling. The corresponding receiver is made up of four blocks (demapper, shaping decode...",,June 2007,10.1109/TWC.2007.05780,https://ieeexplore.ieee.org/document/4251165,new
ieee:4200759,journal,Iterative Decoding of Serially Concatenated Arithmetic and Channel Codes With JPEG 2000 Applications,"Marco Grangetto, Bartolo Scanavino, Gabriella Olmo, Sergio Benedetto","In this paper, an innovative joint-source channel coding scheme is presented. The proposed approach enables iterative soft decoding of arithmetic codes by means of a soft-in soft-out decoder based on suboptimal search and pruning of a binary tree. An error-resilient arithmetic coder with a forbidden symbol is used in order to improve the performance of the joint source/channel scheme. The performa...",,June 2007,10.1109/TIP.2007.896612,https://ieeexplore.ieee.org/document/4200759,new
ieee:4282126,journal,Code-Aided Turbo Synchronization,"CÉdric Herzet, Nele Noels, Vincenzo Lottici, Henk Wymeersch, Marco Luise, Marc Moeneclaey, Luc Vandendorpe",The introduction of turbo and low-density parity-check (LDPC) codes with iterative decoding that almost attain Shannon capacity challenges the synchronization subsystems of a data modem. Fast and accurate signal synchronization has to be performed at a much lower value of signal-to-noise ratio (SNR) than in previous less efficiently coded systems. The solution to this issue is developing specific ...,,June 2007,10.1109/JPROC.2007.896518,https://ieeexplore.ieee.org/document/4282126,new
ieee:4202995,journal,A Reduced-Complexity Iterative Receiver Based on Simulated Annealing for Coded Partial-Response Channels,"Zhiliang Qin, Kui Cai, Xiaoxin Zou","In this paper, we propose a low-complexity soft-output channel detector for turbo equalization over coded partial-response channels based on the simulated annealing (SA) algorithm. It is shown that the proposed detector can significantly reduce the computational complexity with only slight performance degradation compared to the BCJR algorithm",,June 2007,10.1109/TMAG.2007.893414,https://ieeexplore.ieee.org/document/4202995,new
ieee:4282114,journal,Iterative Detection for Channels With Memory,"Achilleas Anastasopoulos, Keith M. Chugg, Giulio Colavolpe, Gianluigi Ferrari, Riccardo Raheli","In this paper, we present an overview on the design of algorithms for iterative detection over channels with memory. The starting point for all the algorithms is the implementation of soft-input soft-ouput maximum a posteriori (MAP) symbol detection strategies for transmissions over channels encompassing unknown parameters, either stochastic or deterministic. The proposed solutions represent effec...",,June 2007,10.1109/JPROC.2007.896511,https://ieeexplore.ieee.org/document/4282114,new
ieee:4251138,journal,Belief Propagation over SISO/MIMO Frequency Selective Fading Channels,"Mustafa N. Kaynak, Tolga M. Duman, Erozan M. Kurtas","In this letter, we propose an iterative belief propagation (BP) channel detector (equalizer) over single-input single- output (SISO) and multiple-input multiple-output (MIMO) frequency selective fading channels as an alternative to the typically used maximum a-posteriori (MAP) or maximum likelihood (ML) detectors. The proposed detector has a parallel structure, resulting in fast hardware implement...",,June 2007,10.1109/TWC.2007.05779,https://ieeexplore.ieee.org/document/4251138,new
ieee:4282127,journal,Joint Source–Channel Turbo Techniques for Discrete-Valued Sources: From Theory to Practice,"Xavier Jaspar, Christine Guillemot, Luc Vandendorpe","The principles which have been prevailing so far for designing communication systems rely on Shannon&#39;s source and channel coding separation theorem. This theorem states that source and channel optimum performance bounds can be approached as close as desired by designing independently the source and channel coding strategies. However, this theorem holds only under asymptotic conditions, where both ...",,June 2007,10.1109/JPROC.2007.896491,https://ieeexplore.ieee.org/document/4282127,new
ieee:4215151,journal,Permutation Polynomial Interleavers: An Algebraic-Geometric Perspective,Oscar Y. Takeshita,"An interleaver is a critical component for the channel coding performance of turbo codes. Algebraic constructions are important because they admit analytical designs and simple, practical hardware implementation. The spread factor of an interleaver is a common measure for turbo coding applications. Maximum-spread interleavers are interleavers whose spread factors achieve the upper bound. An infini...",,June 2007,10.1109/TIT.2007.896870,https://ieeexplore.ieee.org/document/4215151,new
ieee:4259757,conference,LDPC Codes of Arbitrary Girth,"Tsvetan Asamov, Nuh Aydin","For regular, degree two LDPC (low density parity-check) codes, there is a strong relationship between high girth and performance. This article presents a greedy algorithm, called successive level growth (SLG), for the construction of LDPC codes with arbitrarily specified girth. The simulation results show that our codes exhibit significant coding gains over randomly constructed LDPC codes and in s...",,6-8 June 2,10.1109/CWIT.2007.375703,https://ieeexplore.ieee.org/document/4259757,new
ieee:4259766,conference,Distributed Source Coding using non-binary LDPC codes for sensor network applications,"Madhurima Potluri, Suma Chilumuru, Sumakanth Kambhampati, Kamesh R. Namuduri","Recent revolution in sensor networks has resulted in the development of many enabling techniques, one of which being distributed source coding (DSC). DSC allows a low-complexity encoder, shifting the high complexity to the decoder, making this scheme appropriate for sensor networks. In this paper, we have extended the non-binary low-density parity-check (LDPC) codes, developed for channel coding, ...",,6-8 June 2,10.1109/CWIT.2007.375712,https://ieeexplore.ieee.org/document/4259766,new
ieee:4259765,conference,Bit-Interleaved Coded Modulation for the Relay Channel Using Bilayer LDPC Codes,"Peyman Razaghi, Marko Aleksic, Wei Yu",This paper describes a coding scheme for approaching the maximum theoretical decode-and-forward rate for the relay channel in the high signal-to-noise ratio (SNR) regime. The proposed scheme is based on a concatenation of bit-interleaved coded modulation (BICM) and a specially designed bilayer low-density parity-check (BLDPC) code that works simultaneously at two different SNRs. It is shown that t...,,6-8 June 2,10.1109/CWIT.2007.375711,https://ieeexplore.ieee.org/document/4259765,new
ieee:4259758,conference,Estimation of Bit and Frame Error Rates of Low-Density Parity-Check Codes on Binary Symmetric Channels,"Hua Xiao, Amir H. Banihashemi","A method for estimating the performance of low-density parity-check (LDPC) codes decoded by hard-decision iterative decoding algorithms on binary symmetric channels (BSC) is proposed. Based on the enumeration of the smallest weight error patterns that cannot be all corrected by the decoder, this method estimates both the frame error rate (FER) and the bit error rate (BER) of a given LDPC code with...",,6-8 June 2,10.1109/CWIT.2007.375704,https://ieeexplore.ieee.org/document/4259758,new
ieee:4259753,conference,A Variable Rate Slepian-Wolf Code Construction Using Concatenated Convolutional Codes,"Mahdi Zamani, Farshad Lahouti","A variable rate Slepian-Wolf (SW) code is constructed which is vital for wireless sensor network applications. A practical scheme to construct SW codes is to use the syndrome of a channel code as a compressed representation of a codeword in presence of a side information (Pradhan and Ramchandran, 2003). The proposed solution is based on an efficient and practical algorithm to compute the syndrome ...",,6-8 June 2,10.1109/CWIT.2007.375699,https://ieeexplore.ieee.org/document/4259753,new
ieee:4259740,conference,Cycle and Distance Properties of Structured LDPC Codes Based on Circulant Permutation Matrices,"Jean-Baptiste Dore, Marie-Helene Hamon, Pierre Penard","This paper investigates cycle and distance properties of structured Low Density Parity Check (LDPC) codes based on circulant permutation matrices. A very simple algorithm to detect and construct codes with good cycle properties is proposed. A geometrical approach to design codes with good girth properties is then presented and illustrated, through the definition of rules for the design of parity c...",,6-8 June 2,10.1109/CWIT.2007.375686,https://ieeexplore.ieee.org/document/4259740,new
ieee:4259756,conference,EXIT Charts of LDPC Codes over BIAWGN Channels with Imperfect Channel Estimation,"Hamid Saeedi, Amir H. Banihashemi","To efficiently design LDPC code ensembles that perform well in the presence of channel estimation error (also referred to as &#34;SNR mismatch&#34;), it is necessary to generate extrinsic information transfer (EXIT) charts. We have previously observed that the variable node (check node) EXIT curve in the presence of mismatch lies below (above) the original variable node curve in the absence of mismatch in...",,6-8 June 2,10.1109/CWIT.2007.375702,https://ieeexplore.ieee.org/document/4259756,new
ieee:4259754,conference,Slepian-Wolf Coding for General Sources and Its Duality with Channel Coding,"Jun Chen, Da-ke He, En-hui Yang","We study the problem of Slepian-Wolf coding for general sources (not necessarily stationary) with finite alphabet. A linear codebook-level duality between Slepian-Wolf coding for general sources and channel coding for a class of cyclic-symmetric channels is established under optimal decoding, through which the general formula for the Slepian-Wolf limit can be reinterpreted using Verdu and Han&#39;s ch...",,6-8 June 2,10.1109/CWIT.2007.375700,https://ieeexplore.ieee.org/document/4259754,new
ieee:4272972,conference,Determining Fault Tolerance of XOR-Based Erasure Codes Efficiently,"Jay J. Wylie, Ram Swaminathan",We propose a new fault tolerance metric for XOR-based erasure codes: the minimal erasures list (MEL). A minimal erasure is a set of erasures that leads to irrecoverable data loss and in which every erasure is necessary and sufficient for this to be so. The MEL is the enumeration of all minimal erasures. An XOR-based erasure code has an irregular structure that may permit it to tolerate faults at a...,,25-28 June,10.1109/DSN.2007.32,https://ieeexplore.ieee.org/document/4272972,new
ieee:4557314,conference,On the minimum weight of simple full-length array LDPC codes,"Kenji Sugiyama, Yuichi Kaji","Simple and full-length array LDPC codes (SFA-LDPC codes) is a class of LDPC codes which are algebraically constructed from a family of array codes. The minimum weight of SFA-LDPC codes has been investigated in literatures, but exact minimum weight of the code is not known except for some small parameters. In this paper it is shown that the class of SFA-LDPC codes which are denoted by CA (p, 4) in ...",,24-29 June,10.1109/ISIT.2007.4557314,https://ieeexplore.ieee.org/document/4557314,new
ieee:4557556,conference,Analysis of Non-binary Hybrid LDPC Codes,"Lucile Sassatelli, David Declercq","This paper is eligible for the student paper award. In this paper, we analyse asymptotically a new class of LDPC codes called non-binary hybrid LDPC codes, which has been recently introduced in L. Sassatelli and D. Declerq [2006]. We use density evolution techniques to derive a stability condition for hybrid LDPC codes, and prove their threshold behavior. We study this stability condition to concl...",,24-29 June,10.1109/ISIT.2007.4557556,https://ieeexplore.ieee.org/document/4557556,new
ieee:4557315,conference,Tight Bounds of Minimum Distance Distributions of Irregular LDPC Code Ensembles,"Shinya Miyamoto, Kenta Kasai, Tomoharu Shibuya, Kohichi Sakaniwa","Upper bounds of minimum distance distributions of Gallger codes and irregular LDPC codes were derived by Callage and Di, respectively. Di&#39;s bounds are tight for irregular LDPC codes which have variable nodes of degree two, however, it is not tight for irregular LDPC codes which do not. In this paper, we derive tight lower and upper bounds of minimum distance distributions of irregular LDPC code en...",,24-29 June,10.1109/ISIT.2007.4557315,https://ieeexplore.ieee.org/document/4557315,new
ieee:4557106,conference,On the Minimum Distance of Generalized LDPC Codes,"Ayoub Otmani, Jean-Pierre Tillich, Iryna Andriyanova",We study necessary conditions which have to be satisfied in order to have LDPC codes with linear minimum distance. We give two conditions of this kind in this paper. These conditions are not met for several interesting code families: this shows that they are not asymptotically good. The second one concerns LDPC codes that have a Tanner graph in which there are cycles linking variable nodes of degr...,,24-29 June,10.1109/ISIT.2007.4557106,https://ieeexplore.ieee.org/document/4557106,new
ieee:4557229,conference,Fast Decoding of Rate-Compatible Punctured LDPC Codes,"Jini Kwon, Demijan Klinc, Jeongseok Ha, Steven W. McLaughlin","While rate-compatible punctured low-density parity-check (RCP-LDPC) codes offer high flexibility in terms of code rate at a relatively low cost in implementation complexity, they are reported to require more decoding iterations than unpunctured LDPC codes. In this paper1 we consider layered belief propagation decoding and propose efficient check node layering that significantly accelerates the dec...",,24-29 June,10.1109/ISIT.2007.4557229,https://ieeexplore.ieee.org/document/4557229,new
